video_id,title,publishedAt,channelId,channelTitle,categoryId,trending_date,tags,view_count,likes,dislikes,comment_count,thumbnail_link,comments_disabled,ratings_disabled,description
"nUEqPtVGIpE","Lil Baby - Woah (Official Music Video)","2019-12-06T17:00:13.000Z","UCM1gEqLPsgej7ZKzu9w8v7A","LilBabyVEVO","10","19.11.12","Lil|Baby|Woah|Quality|Control/Motown|Records|Hip|Hop|lil baby|lil baby woah|woah|woah lil baby|lil baby official|lil baby music video|woah music video|lil baby woah music video|woah lil baby music video|official video lil baby|lil baby lyrics|lil baby woah lyrics|lil baby woah dance|woah dance","5762282","199528","4148","8394","https://i.ytimg.com/vi/nUEqPtVGIpE/default.jpg","False","False","Stream/Download Woah: https://qualitycontrol.lnk.to/WoahYDFollow Lil Baby Everywhere:https://www.instagram.com/lilbaby_1/https://twitter.com/lilbaby4PFhttps://www.facebook.com/4pflilbabywww.qualitycontrolmusic.com#Woah #LilBabyMusic video by Lil Baby performing Woah. © 2019 Quality Control Music, LLC, under exclusive license to UMG Recordings, Inc.http://vevo.ly/fbu2nv"
"ZhrOjQaZNco","A Pack of Wolves Came After Glenn Villeneuve | Joe Rogan","2019-12-07T20:30:00.000Z","UCnxGkOGNMqQEUMvroOWps6Q","JRE Clips","22","19.11.12","Joe Rogan|JRE|Joe Rogan Experience|JRE Clips|PowerfulJRE|Joe Rogan Fan Page|Joe Rogan Podcast|podcast|MMA|Joe Rogan MMA Show|UFC|comedy|comedian|stand up|funny|clip|favorite|best of","692037","11318","475","2494","https://i.ytimg.com/vi/ZhrOjQaZNco/default.jpg","False","False","Taken from JRE #1395 w/Glenn Villeneuve:https://youtu.be/PNocQzhPyac"
"of2tHZrca7M","THE BABY IS COMING TODAY!!???","2019-12-07T22:45:09.000Z","UC-rN2gfG9OhqitnrRPnPmHg","THIS IS L&S","22","19.11.12","the baby is coming today|official birth video|labor and delivery|her water broke|this is l&s|l&s|the ace family|we're pregnant|we're having a baby|pregnancy announcement|couples|boyfriend|girlfriend|family|vlog|lifestyle|love|happiness|hollywood|los angeles|california","1095660","52408","911","2723","https://i.ytimg.com/vi/of2tHZrca7M/default.jpg","False","False","Get a Current Black Premium Card: https://www.current.com/THISISLandSGET YOUR CHRISTMAS  MERCH NOW!🎄 https://landonandshyla.com💥CHECK US OUT ON SOCIAL MEDIA💥*LANDON*INSTA: https://www.instagram.com/landonmcbroom_SNAP: Landon_mcbroomTWITTER: Landonmcbroom_*SHYLA*INSTA: https://www.instagram.com/shylaSNAP: Simply_shylaTWITTER: Shyla*JOSEPH* (VIDEOGRAPHERS)INSTA: https://www.instagram.com/joecasimiro_"
"Y3aIdtEICVA","OUR CHRISTMAS HOUSE DECOR","2019-12-08T00:35:05.000Z","UCDSJCBYqL7VQrlXfhr1RtwA","Les Do Makeup","26","19.11.12","[none]","471587","27854","307","2200","https://i.ytimg.com/vi/Y3aIdtEICVA/default.jpg","False","False","Hi babygirls!  Thank you so much for watching and for supporting! I LOVE YOU!! ❤️❤️I’ve partnered with Drop and giving away $5-$25 gift cards to 100 of you guys at random! Contest ends January 30 , 2020 so enter before then!How to enter:Download Drop using  this link  https://b.ewd.io/lesdomakeup and link a debit or credit card when you sign up!OR Download Drop from App store/Google Play  and use my invite code “LesDoMakeup” and link a debit or credit card ——————————————————————SHOP MY MERCH HERE / hoodies restock 12/9/2019 @ 10 am MT  - https://shoplesdomakeup.comSHOP MY BUNDLE HERE🌸🌸  - https://liveglam.com/product/les-do-makeup-bundle-of-joy-collection/————————————————————————————FOLLOW ME! ❤️Instagram- https://www.instagram.com/leeexlieeeTwitter- https://twitter.com/LEXXXLIEEEFacebook- https://www.facebook.com/Lesdomakeup1/Snapchat @lexxxlieee PO BOX 972657El Paso, TX 79997 Business inquires only: quezada_1383@yahoo.com"
"iQNjTtruvGY","2019 SEC Championship Highlights: #2 LSU dominates #4 Georgia | CBS Sports","2019-12-08T01:22:10.000Z","UCja8sZ2T4ylIqjggA1Zuukg","CBS Sports","17","19.11.12","CBS|CBS Sports|sports|sp:ty=high|sp:dt=2019-12-07T21:00:00Z|sp:st=football|sp:li=cfb|sp:ti:home=LSU|sp:ti:away=UGa|LSU|sec|uga|uga vs lsu|georgia vs lsu|sec championship|2019 sec championship|lsu sec champions|joe burrow|joe burrow sec championship","308056","1682","165","910","https://i.ytimg.com/vi/iQNjTtruvGY/default.jpg","False","False","No. 2 LSU had a lot on its mind Saturday night inside Mercedes-Benz Stadium. In addition to ensuring it won the SEC Championship Game to capture its first league crown since 2011, finish the 2019 season undefeated and clinch a spot in the College Football Playoff, the Tigers wanted to make a statement to those that demoted it from the No. 1 ranking it held for a large part of the season. Statement made.SUBSCRIBE TO OUR CHANNEL:https://www.youtube.com/user/CBSSports FOLLOW US ON:Facebook - https://www.facebook.com/CBSSports/Instagram - https://www.instagram.com/cbssports/Twitter - https://twitter.com/CBSSports#SECchampionship #UGA #LSU #Georgia #LSUTigers #JoeBurrow #SEC #football #Collegefootball #NCAA #NCAAFB"
"9fStxEEBcOM","GUESS WHO *YOUTUBER EDITION* w/ CLICK","2019-12-07T21:30:01.000Z","UCELEYV16ItX8pNkg8EuVY7g","Click","24","19.11.12","click|click house|click crew|click plays|muselk|loserfruit|crayator|bazzagazza|lachlan|lazarbeam|lannan|vlogs|fortnite|challenge|lufu|bazz|cray|prank|reactions|travel|game show|gaming|sketch|comedy|funny|guess who|youtubers|jake paul|logan paul|pewdiepie|ksi|mrbeast|giant|youtuber guess who|guess the youtuber","957379","46342","789","2794","https://i.ytimg.com/vi/9fStxEEBcOM/default.jpg","False","False","We play guess who but with your favourite (and not so favourite) youtubers! Click Social Links:YouTube | http://bit.ly/CLICK-SUBSCRIBEDouble Click YouTube | http://bit.ly/DOUBLECLICKTik Tok | http://vm.tiktok.com/m68E3N/Twitter | https://twitter.com/TheClickCrewInstagram | https://instagram.com/clickOur Partners:Produced and edited by the Click Management Team | http://clickmgmt.com.au/team4G data powered by Boost Mobile Australia | https://boost.com.au/Audio Equipment by Rode Microphones | http://www.rode.com/Click Roster:Muselk | https://www.youtube.com/user/MrMuselkLoserfruit | https://www.youtube.com/user/TheLoserfruitCrayator | https://www.youtube.com/user/CrayatorBazzaGazza | https://www.youtube.com/c/BazzaGazzaLazarBeam | https://www.youtube.com/LazarBeamTannar | https://www.youtube.com/c/tannareacottWe have opened a PO Box! You can send your letters or packages to all of us here at Click for a chance to be featured in a future video:PO Box 183Pyrmont 2009Australia"
"GAx_fwI9Az0","Harry Styles - Adore You (Live on The Graham Norton Show)","2019-12-07T23:30:00.000Z","UCbOCbp5gXL8jigIBZLqMPrw","HarryStylesVEVO","10","19.11.12","Harry Styles Adore You|Harry Styles Adore You Live|Adore You Live|Adore You Performance|Harry Styles Adore You Performance|Graham Norton|The Graham Norton Show|Harry Styles Graham Norton Show|Harry Styles Adore You Graham Norton Show|One Direction|Harries|Fine LIne|Harry Styles Fine Line|Rosalia|Eroda|Live On The Graham Norton Show|Harry Styles Live On The Graham Norton Show|Harry|Styles|Adore|You|Live|The|Graham","1373044","163017","352","4430","https://i.ytimg.com/vi/GAx_fwI9Az0/default.jpg","False","False","Pre-order Harry Styles’ new album ‘Fine Line’ now: https://HStyles.lnk.to/FineLinePSPAAY Listen to “Adore You” now: https://HStyles.lnk.to/AdoreYouAYListen to “Watermelon Sugar” now: https://HStyles.lnk.to/WatermelonSugarAYListen to “Lights Up” now: https://HStyles.lnk.to/LightsUpAYHARRY STYLES. LOVE ON TOUR. 2020.https://hstyles.co.uk/tourFollow Harry Styles:Facebook: https://HarryStyles.lnk.to/followFIInstagram: https://HarryStyles.lnk.to/followIITwitter: https://HarryStyles.lnk.to/followTIWebsite: https://HarryStyles.lnk.to/followWISpotify: https://HarryStyles.lnk.to/followSIYouTube: https://HarryStyles.lnk.to/subscribeYDLyrics:Walk in your rainbow paradiseStrawberry lipstick state of mindI get so lost inside your eyesWould you believe it?You don’t have to say you love meYou don’t have to say nothingYou don’t have to say you’re mineHoneyI’d walk through fire for youJust let me adore youOh honeyI’d walk through fire for youJust let me adore youLike it’s the only thing I’ll ever doLike it’s the only thing I’ll ever doYour wonder under summer skiesBrown skin and lemon over iceWould you believe it?You don't have to say you love meI just wanna tell you somethingLately you’ve been on my mindHoneyI’d walk through fire for youJust let me adore youOh honeyI’d walk through fire for youJust let me adore youLike it’s the only thing I’ll ever doLike it’s the only thing I’ll ever doIt’s the only thing I’ll ever doI’d walk through fire for youJust let me adore youOh honeyI’d walk through fire for youJust let me adore youLike it’s the only thing I’ll ever doI’d walk through fire for youJust let me adore youOh honeyOh honeyI’d walk through fire for youJust let me adore youLike it’s the only thing I’ll ever do#HarryStyles #AdoreYou #FineLine"
"L7MkXc4hX-8","Buying my New Dream Supercar in Hawaii!","2019-12-07T19:00:02.000Z","UC21Kozr_K0yDM-VjoihG9Aw","TheStradman","2","19.11.12","TheStradman|Stradman|Supercars|Super Cars|Hypercars|Exotic Cars|Buying a Supercar|Supercar Shopping|How to buy a Supercar|Stradman Car Collection|Stradman Lamborghini|Stradman Supra|Stradman Aventador|Stradman Jeep|Lamborghini|Aventador|Toyota Supra|Ford GT|How to make Money|Making Money|Rich|Wealthy|Finances|Financial Advice|Graham Stephen|Dailydrivenexotics|Cheap Lamborghini|Supra Widebody|Car Collection","1182760","57515","1734","9867","https://i.ytimg.com/vi/L7MkXc4hX-8/default.jpg","False","False","If you're looking for the perfect used car, AutoTempest is the first place you need to start!https://www.autotempest.com/Follow me on Instagram @thestradman for my Hawaiian adventures!https://www.instagram.com/thestradman/?hl=en"
"V-p2wEu_hNg","Lazio 3-1 Juventus | Lazio Shock Juve with 3-Goal Comeback after CR7 Opener! | Serie A","2019-12-07T22:39:43.000Z","UCBJeMCIeLQos7wacox4hmLQ","Serie A","17","19.11.12","Juventus|Lazio 3-1 Juventus|lazio juventus 3 1|juventus vs lazio highlights|lazio vs juventus live|lazio vs juventus|Felipe Caicedo|Napoli|Ronaldo|Cristiano Ronaldo|goals|Milinkovic-Savic|CR7|Luiz Felipe|Serie A|AC Milan|milinkovic-savic sergej|Inter Milan|Dybala|Higuain|highlights|Insigne|Roma|full highlights|watch|stream|calcio|Italia|lukaku|de ligt|balotelli|sp:ty=high|sp:dt=2019-12-07T18:45:00Z|sp:st=soccer|sp:li=seri|sp:ti:home=LAZ|sp:ti:away=JUV|sp:vl=en","4997562","53562","2843","4613","https://i.ytimg.com/vi/V-p2wEu_hNg/default.jpg","False","False","Lazio fight back to beat 10-man Juventus with goals from Luiz Felipe, Milinkovic-Savic and Felipe Caicedo after Cristiano Ronaldo's opener | Serie AThis is the official channel for the Serie A, providing all the latest highlights, interviews, news and features to keep you up to date with all things Italian football.Subscribe to the channel here! https://bit.ly/2OM2Eax Find out more about the Serie A at: http://www.legaseriea.it/en/ Questo è il canale ufficiale della Serie A, dove potrai avere accesso ai momenti salienti, alle interviste, alle notizie e alle funzionalità del momento per rimanere aggiornato sulle ultime novità del campionato.Iscriviti qui al canale! https://bit.ly/2OM2EaxPer maggiori infomazioni sulla Serie A: http://www.legaseriea.it/it"
"2lAe1cqCOXo","YouTube Rewind 2019: For the Record | #YouTubeRewind","2019-12-05T18:00:14.000Z","UCBR8-60-B28hp2BmDPdntcQ","YouTube","24","19.11.12","Rewind|Rewind 2019|youtube rewind 2019|#YouTubeRewind|MrBeast|PewDiePie|James Charles|Shane Dawson|CaseyNeistat|RiceGum|Simone Giertz|JennaMarbles|Lilly Singh|emma chamberlain|The Try Guys|Fortnite|Minecraft|Roblox|Marshmello|Garena Free Fire|GTA V|Lachlan|Anaysa|jeffreestar|Noah Schnapp|Jennelle Eliana|T-Series|Azzyland|LazarBeam|Dude Perfect|David Dobrik|KSI|NikkieTutorials|Kurzgesagt|Jelly|Ariana Grande|Billie Eilish|BLACKPINK|Year in Review","57543049","2853005","7014771","921718","https://i.ytimg.com/vi/2lAe1cqCOXo/default.jpg","False","False","In 2018, we made something you didn’t like. For Rewind 2019, let’s see what you DID like.Celebrating the creators, music and moments that mattered most to you in 2019. To learn how the top lists in Rewind were generated: https://rewind.youtube/aboutTop lists featured the following channels:@1MILLION Dance Studio @A4 @Anaysa @Andymation @Ariana Grande @Awez Darbar @AzzyLand @Billie Eilish @Black Gryph0n @BLACKPINK @ChapkisDanceUSA @Daddy Yankee @David Dobrik @Dude Perfect @Felipe Neto @Fischer's-フィッシャーズ- @Galen Hooks @ibighit @James Charles @jeffreestar @Jelly @Kylie Jenner @LazarBeam @Lil Dicky @Lil Nas X @LOUD @LOUD Babi @LOUD Coringa @Magnet World @MrBeast @Nilson Izaias Papinho Oficial @Noah Schnapp@백종원의 요리비책 Paik's Cuisine @Pencilmation @PewDiePie @SethEverman @shane @Shawn Mendes @Team Naach @whinderssonnunes @워크맨-Workman @하루한끼 one meal a day To see the full list of featured channels in Rewind 2019, visit: https://rewind.youtube/about"
"u5mFtwfgidk","We Tried To Re-Create This Giant 30-Pound Burger • Eating Your Feed • Tasty","2019-12-07T16:00:11.000Z","UCJFp8uSYCjXOMnkUyb3CQ3Q","Tasty","26","19.11.12","buzzfeed|tasty|buzzfeed tasty|eating your feed|buzzfeed andrew|anderw|buzzfeed niki|niki|andrew ilnyckyi|how to make|food challenge|we tried to recreate|We Tried To Re-Create This Giant 30-Pound Burger|giant food|giant burger|we tried to make a giant burger|eating your feed giant burger|PL-EYF|PL-EYF-S3|viral food videos|viral food video|niki ang|buzzfeed rie|rie mcclenny|Giant 30-Pound Burger|food|cooking|taste test|andrew ilnyckyj","1039224","31381","737","1299","https://i.ytimg.com/vi/u5mFtwfgidk/default.jpg","False","False","“Rie’s crying because she can’t believe how good it is!”Shop the NEW Tasty Merch: https://bzfd.it/shoptastyyoutubeSubscribe to Tasty: https://bzfd.it/2ri82Z1About Tasty:The official YouTube channel of all things Tasty, the world's largest food network. From recipes, world-class talent, and top-of-the-line cookware, we help connect food lovers in every way they interact with food.Connect with Tasty:Shop the NEW Tasty Merch: https://bzfd.it/shoptastyyoutubeSubscribe to Tasty Newsletters: https://bzfd.it/2SC4h0SLike us on Facebook: http://www.facebook.com/buzzfeedtastyFollow us on Instagram: https://www.instagram.com/buzzfeedtasty/Follow us on Twitter: https://www.twitter.com/tastyCheck out our website: https://www.tasty.co/Shop the Tasty Kitchenware line: https://t.co/0dPSuobra7Credits: https://www.buzzfeed.com/bfmp/videos/92792MUSICNight Visitors_MainLicensed via Warner Chappell Production Music Inc.Astruds SistersLicensed via Warner Chappell Production Music Inc.Rollin' Easy_fullmixLicensed via Warner Chappell Production Music Inc.Dance Of The Drunken Fairy_undrscrLicensed via Warner Chappell Production Music Inc.Caprice No. 16 in G Minor_MainLicensed via Warner Chappell Production Music Inc.Setting SunLicensed via Warner Chappell Production Music Inc.EnchiladasLicensed via Warner Chappell Production Music Inc.https://www.youtube.com/c/buzzfeedtasty"
"xUEMRL2IJRo","Teens & College Kids React To YouTube Rewind 2019","2019-12-07T02:48:28.000Z","UC0v-tlzsn0QZwJnkiaUSJVQ","FBE","24","19.11.12","wrap up|react to youtube rewind|youtube rewind|Teens & College Kids React To YouTube Rewind 2019|college kids react|teens react|react|reaction|fbe|youtubers react|roblox|fortnite|pencilmation|mr beast|james charles|minecraft|black pink|ariana grande|BTS|Billie Elish|2019|shane dawson|pewdiepie|youtube|youtube rewind 2019|youtube rewind 2018|all youtube rewinds|#youtuberewind|rewind 2019|youtuberewind|youtube rewind reaction|youtube rewind 2019 reaction","1733733","57335","6194","7083","https://i.ytimg.com/vi/xUEMRL2IJRo/default.jpg","False","False","What did you think of the latest YouTube Rewind 2019 compared to others? Check out all FBE past YouTube Rewind Reactions https://www.youtube.com/watch?v=VB_jBAsWR6g&list=PLwnD0jwK0yyk87MF5PcdIotYENBqM5MrYJoin our SuperFam and support FBE: https://www.youtube.com/user/React/joinSUBSCRIBE & HIT THE 🔔. New Videos 2pm PT on FBE: http://fbereact.com/SubscribeFBEJoin us LIVE on FBE2 every Tuesday and Friday at 3pm PST.Sign Up for Our Newsletter: http://fbereact.com/infoTeens & College Kids react to YouTube Rewind 2019. Watch to see their reactions! #YouTubeRewind #YouTubeRewind2019Teens and College Kids react to YouTube Rewind 2019. YouTube changed the format of rewind and instead highlighted the most liked creator videos, music videos, dance videos, video games, beauty gurus, and the most viewed creators. Did seeing Camila Cabello, Mr Beast, PewDiePie, Minecraft, or James Charles make you click or do you think it deserves the dislikes?  Content Featured:YouTube Rewind 2019: For the Recordhttps://www.youtube.com/watch?v=2lAe1cqCOXoFBE’s goal is to credit the original links to the content featured in its shows. If you see incorrect or missing attribution please reach out to credits@fbeteam.comReactors Featured:Annahttps://www.instagram.com/annalisefujii/Carloshttps://www.instagram.com/cj_money130/Diontehttps://www.instagram.com/dapper_macon2.0/Elisehttps://www.instagram.com/elise.kom/Jaxonhttps://www.instagram.com/jaxonhh/Jaykahttps://www.instagram.com/jayka.noelle/Mikaelahttps://www.youtube.com/mikaelapascalSheilahttps://www.youtube.com/sheilacurielTroyhttps://www.instagram.com/troyglass/Yeshuahttps://www.instagram.com/yeshuakaliqMERCH 👕 https://www.shopfbe.comFollow FBE:FBE WEBSITE: https://fbeteam.com/FBE: http://www.youtube.com/FBEREACT: http://www.youtube.com/REACTFBE2: https://www.youtube.com/FBE2FBELive: https://www.youtube.com/fbeliveFACEBOOK: http://www.facebook.com/FBEFACEBOOK: http://www.facebook.com/FBEShowsTWITTER: http://www.twitter.com/fbeINSTAGRAM: http://www.instagram.com/f/fbeSNAPCHAT: https://fbereact.com/snapchatDISCORD: https://fbereact.com/FBEdiscordTWITCH: https://www.twitch.tv/fbeliveAMAZON: https://www.amazon.com/v/FBEXUMO: https://fbereact.com/xumoSEND US STUFF:FBEP.O. BOX 4324Valley Village, CA 91617-4324Produced by Sierra Middlebrooks & Lauren HutchinsonExecutive Producers - Benny Fine & Rafi FineVice President of Production - Kate GradyHead of Digital Studio - Harris ShermanAssociate Producer - Jesse TugasLine Producer - Hillary FreedmanProduction Manager - Seung-Wan ChoiCasting & Talent Relations - Steven CauseyProduction Coordinator - Laura EspinozaAsst. Production Coordinator - Laura LareauCoordinator Assistant - Ashley PazPost Production Manager - Jake MetivaPost Production Supervisor- Nick Weiss-RichmondEditor - Karen Rivas & Andrea WinslowAssistant Editor - Lucas Griffith & Amanda SantanaDirector of Photography - Sam KimJr. Studio Technician - Jayden RomeroProduction Tech - Micah Kearny, Edgar Plascencia, Ryan Johnson, Lake Peterson, Francois El-Bitar, Asuka LinGraphics Lead - Lindsey KindtGraphics - Kat Nieto & James JenningsSet design - Melissa JudsonMusic - Cyrus Ghahremaniwrap up, react to youtube rewind, youtube rewind, 2019, youtube, youtube rewind 2019, youtube rewind 2018, all youtube rewinds, #youtuberewind, rewind 2019, youtube rewind, youtube rewind reaction, youtube rewind 2019 reaction© FBE, IncTeens & College Kids React To YouTube Rewind 2019"
"4nSdIlG9qTg","Welcome to Little Homeschool | Steven Universe Future | Cartoon Network","2019-12-07T18:30:34.000Z","UCMsgXPD3wzzt8RxHJmXH7hQ","Cartoon Network","24","19.11.12","steven universe|cartoon network|steven universe cartoon network|steven universe cartoon|steven universe amethyst|amethyst steven universe|steven universe pearl|pearl steven universe|steven universe garnett|garnett steven universe|Cartoon Network (TV Network)|Cartoon Network Steven Universe|Steven Universe Cartoon Network","560018","20673","464","2390","https://i.ytimg.com/vi/4nSdIlG9qTg/default.jpg","False","False","Catch up on all Steven Universe 👉http://cartn.co/YTStevenSteven and the Crystal Gems have formed a school...but there’s one Gem who refuses to attend. Who could she be?Episode: Little HomeschoolSUBSCRIBE: http://cartn.co/subscribeWATCH MORE: http://cartn.co/moresuAbout Steven Universe:Introducing the Crystal Gems! Garnet, Amethyst, Pearl… and Steven. Steven might not know how to use the magical powers that come out of his bellybutton, but that doesn’t stop him from joining the Gems on their magical adventures! Connect with Steven Universe online:Steven Universe Website: http://cartn.co/suwebsiteLike Steven Universe on FACEBOOK: http://cartn.co/sufacebookAbout Cartoon Network:Welcome to Cartoon Network's YouTube Channel, your destination for episode clips, behind the scenes footage, how to draw tutorials, toy videos, and more!  Cartoon Network is home to your favorite shows and characters including Teen Titans Go!, Ben 10, Steven Universe, The Amazing World of Gumball, OK K.O.!, and much more! Want full episodes? Go to the CN APP where you can find new unlocked episodes updated every week!Connect with Cartoon Network Online:Visit Cartoon Network WEBSITE: http://cartn.co/cnwebsiteFollow Cartoon network on INSTAGRAM:  http://cartn.co/instagramLike Cartoon Network on FACEBOOK: http://cartn.co/facebookFollow Cartoon Network on TWITTER: http://cartn.co/twitterhttp://www.youtube.com/user/CartoonNetwork"
"3ap6PTQUMf4","Game Theory's UNCENSORED Interview with YouTube CEO Susan Wojcicki","2019-12-07T19:06:08.000Z","UCo_IB5145EVNcf8hw1Kku7w","The Game Theorists","20","19.11.12","game theory|game theorists|the game theorists|matpat|susan wojcicki|youtube ceo|youtube ceo interview|youtube ceo channel|susan wojcicki interview|matpat interview|interview|youtube 2019|youtube 2020|youtube update problem","1263248","79054","1401","12131","https://i.ytimg.com/vi/3ap6PTQUMf4/default.jpg","False","False","SUBSCRIBE to never miss a Theory! ► http://bit.ly/1qV8fd6I was given the chance to interview YouTube Ceo Susan Wojcicki earlier this year. I was allowed to ask her ANY QUESTION I wanted and believe me I pulled no punches. I asked Susan all the things I've waited years to ask and today I wanted to share it with you. I am an advocate for Creators and our community, we deserve the answers to all the things going on the platform we all call home. Theorists, let's get into it!Get Your NEW Holiday Theory Wear NOW! ► http://creatorink.co/theory-wearSUBSCRIBE for Every Theory! ►► http://bit.ly/1qV8fd6  Hang out with us on GTLive! ► http://bit.ly/1LkSBnz#GameTheory #SusanWojcicki #YouTubeCEO #Interview #Matpat #TheGameTheoristsCheck out our Meta Theories!The REAL Reason YouTube is Broken ► https://bit.ly/2rnI5ehYouTube is Ruining Gaming! ► https://bit.ly/2sND4MpWill Your Favorite Channel Survive 2020? ► https://bit.ly/34XjQlTWhat They WON'T TELL YOU About Your Favorite Channels ► https://bit.ly/38dUDpd"
