video_id,title,publishedAt,channelId,channelTitle,categoryId,trending_date,tags,view_count,likes,dislikes,comment_count,thumbnail_link,comments_disabled,ratings_disabled,description
"YU58UOXGrqU","The Weirdest GOOGLE Searches","2019-12-10T20:15:48.000Z","UCw1SQ6QRRtfAhrN_cjkrOgA","LazarBeam","20","19.11.12","GOOGLE|reaction|challenge|funny|comedy|lazarbeam|lazar|gaming|gameplay","2188980","143135","2692","19314","https://i.ytimg.com/vi/YU58UOXGrqU/default.jpg","False","False","DONT GOOGLE ANYTHING YOU SEE IN THIS VIDEO YOUNG ONES👕LAZAR Merch - https://shoplazar.com/🐤TWITTER - https://goo.gl/Amqx54📷INSTAGRAM - https://goo.gl/gGzFf1"
"pN_saYHO-vI","6 People Killed In Jersey City Shootout","2019-12-10T22:26:33.000Z","UCNZyLULUQBp5e9Q1cKtvk6Q","CBS New York","25","19.11.12","CBS2 News At 5|Alice Gainer|New Jersey|Local TV|Maurice DuBois|Kristine Johnson","412685","3015","581","2519","https://i.ytimg.com/vi/pN_saYHO-vI/default.jpg","False","False","CBS2's Alice Gainer has the latest on the deadly shootout in New Jersey that left one police officer, three civilians, and two suspects dead."
"HJ1ZavgU69U","Nick Cannon Drops 2 Eminem Diss Tracks, Eminem Responds","2019-12-10T18:33:48.000Z","UChi08h4577eFsNXGd3sxYhw","Breakfast Club Power 105.1 FM","24","19.11.12","the breakfast club|breakfast club|power1051|celebrity news|radio|video|interview|angela yee|charlamagne tha god|dj envy|eminem nick cannon diss|eminem nick cannon|eminem nick cannon beef|rumor report eminem|rumor report nick cannon|nick cannon beef with eminem|eminem beef with nick cannon","678257","8032","7019","7264","https://i.ytimg.com/vi/HJ1ZavgU69U/default.jpg","False","False","Eminem vs Nick Cannon (00:41)Subscribe NOW to The Breakfast Club: http://ihe.art/xZ4vAcAGet MORE of The Breakfast Club:► WATCH MORE: https://www.youtube.com/user/breakfastclubpowerfm► LISTEN LIVE: https://TheBreakfastClub.iheart.com/► CATCH UP on What You Missed: http://ihe.art/Dx2xSGN► FOLLOW The Breakfast Club on Instagram: https://www.instagram.com/BreakfastClubAM/► FOLLOW The Breakfast Club Twitter: https://twitter.com/BreakfastClubAM► LIKE The Breakfast Club on Facebook: https://www.facebook.com/BreakfastClubAM/Get more Power 105: ► Listen LIVE: http://power1051fm.com/► Facebook: https://www.facebook.com/Power1051NY/► Twitter: https://twitter.com/power1051/► Instagram: https://www.instagram.com/power1051/The Breakfast Club features celebrity interviews, Charlamagne tha God’s Donkey of the Day, Angela Yee’s Rumor Reports, DJ Envy’s mixes and so much more! Every guest visiting the world’s most dangerous morning show is grilled with their signature blend of honesty and humor. The results are the best interviews to be found on radio.#BreakfastClub#RumorReport#NickCannon#Eminem"
"ahZFCF--uRY","GHOSTBUSTERS: AFTERLIFE - Official Trailer (HD)","2019-12-09T14:00:00.000Z","UCz97F7dMxBNOfGYu3rx8aCw","Sony Pictures Entertainment","24","19.11.12","Sony|Sony Pictures Entertainment|Ghostbusters: Afterlife|Ghostbusters 2020|Ghostbusters: Afterlife Trailer|Official Trailer|Ghostbusters Official Trailer|Jason Reitman|Dan Aykroyd|Harold Ramis|Carrie Coon|Finn Wolfhard|Mckenna Grace|Paul Rudd|Ghostbusters 2020 Trailer|Ghostbusters: Afterlife Sony|Ghostbusters Afterlife 2020|HD Trailer|Trailer|Trailer 2020","10256255","295570","20403","30122","https://i.ytimg.com/vi/ahZFCF--uRY/default.jpg","False","False","Everything happens for a reason. Watch the new trailer for #Ghostbusters: Afterlife in theaters next summer.Visit Site:https://www.ghostbusters.com/?hs308=youtubeorgFollow Us On Social:https://www.facebook.com/Ghostbustershttps://www.twitter.com/Ghostbustershttps://www.instagram.com/GhostbustersSubscribe to Sony Pictures for exclusive content: http://bit.ly/SonyPicsSubscribeFrom director Jason Reitman and producer Ivan Reitman, comes the next chapter in the original Ghostbusters universe. In Ghostbusters: Afterlife, when a single mom and her two kids arrive in a small town, they begin to discover their connection to the original ghostbusters and the secret legacy their grandfather left behind. The film is written by Jason Reitman & Gil Kenan.Directed by: Jason Reitman Written by: Gil Kenan & Jason Reitman Based on the 1984 film “Ghostbusters”  An Ivan Reitman film written by Dan Aykroyd and Harold Ramis Produced by: Ivan Reitman Executive Producers:Dan AykroydGil KenanJason BlumenfeldMichael Beugg Cast:Carrie CoonFinn WolfhardMckenna Graceand Paul Rudd#OfficialTrailer #Sony #Ghostbusters #GhostbustersAfterlife #CarrieCoon FinnWolfhard #MckennaGrace #PaulRudd #Trailer"
"6CfldD53MSg","PUMA x Lauren London Forever Stronger","2019-12-10T17:59:48.000Z","UCDh2ahygvbt19U_CKDgPfzQ","LaurenLondon","24","19.11.12","Lauren London|Lauren|London|Lauren London Forever Stronger|Forever Stronger|Puma|PUMA|Lauren London Stronger Forever Puma|Los Angeles|Lauren London Puma|Marathon|The Marathon Continues|Nipsey|Nipsey Hussle","830550","17515","180","1415","https://i.ytimg.com/vi/6CfldD53MSg/default.jpg","False","False","“Lauren London is proud to join forces with PUMA to support her on this next chapter of her journey. This piece was a creative vision Lauren wanted to bring to life to signify the continuation of her marathon alongside PUMA. Forever Stronger.”Created by Lauren LondonDirected by Danny WilliamsPoem written by Samantha SmithScore by Rance 1500 Or NothinEdited by Matt TolkinFilm Production by AJR FilmsFollow Lauren on Twitter: @LaurenLondonFollow Lauren on Instagram: @LaurenLondonSpecial Thanks To @PUMA2019"
"jwHfMld-2BU","Trying Celebrity Makeup Hacks!","2019-12-10T20:01:51.000Z","UCucot-Zp428OwkyRm2I7v2Q","James Charles","24","19.11.12","james|james charles|makeup artist|mua|covergirl|coverboy|cute|easy makeup|how-to|reviews|tutorials|funny videos|beauty tips|hacks|beauty|vogue beauty secrets|vogue|beauty secrets|celebrities|celebrity|makeup hacks|hack|makeup tips|kendall jenner|kylie jenner|kourtney kardashian|taylor hill|jhene aiko|ashley graham|Emily Ratajkowski","1274673","69890","3101","4492","https://i.ytimg.com/vi/jwHfMld-2BU/default.jpg","False","False","HI SISTERS! In today's video, I try out some Celebrity Makeup Hacks by following the Vogue Beauty Secrets videos! Kendall & Kylie Jenner, Kourtney Kardashian, Jhene Aiko, Taylor Hill, Ashley Graham, Emily Ratajkowski & more all have some awesome tricks that I decided to test... See how my makeup turns out!!ALL CREDITS GO TO VOGUE BEAUTY SECRETS SERIES:https://www.youtube.com/playlist?list=PLztAHXmlMZFS9ZN7GTlZ2UOB2JmxICdt8🎥 PREVIOUS VIDEO » https://youtu.be/F7s1wUfhiLc👕 SISTER'S APPAREL » http://sisters-apparel.com🛎 Subscribe to my channel to join the sisterhood & hit the notification bell so you never miss an upload! » http://bit.ly/JamesCharles for new videos!__❤️ LET'S BE BFFSINSTAGRAM » http://instagram.com/jamescharlesTWITTER » http://twitter.com/jamescharlesTWITCH » http://twitch.tv/jamescharlesSNAPCHAT » jamescharless__💸 COUPON CODES 💸MORPHE BRUSHES » http://morphebrushes.comUse code JAMES for 10% off all products online AND in store!LILLY LASHES » https://lillylashes.com/Use code JAMES for 15% off all lashesLAURAS BOUTIQUE » http://lauras-boutique.comUse code JAMES for 10% off all itemsSKINDINAVIA » http://skindinavia.comUse code JAMES for 25% off all products __♡ MY AMAZING TEAMLouis Gargiulahttp://instagram.com/louisgargiulaRyan Allenhttps://www.youtube.com/user/HelloXRyanMichael Rusakovhttp://instagram.com/michael.ny"
"BDjNG2LQRfM","Savannah and 6 Year Old Everleigh Surprise Daddy With Pregnancy Announcement!!!","2019-12-09T22:24:43.000Z","UC4-CH0epzZpD_ARhxCx6LaQ","The LaBrant Fam","22","19.11.12","cole and sav|the labrant fam|labrant fam|the labrant family|the labrant fam youtube|youtube the labrant fam|youtube sav and cole|cole sav and everleigh|everleigh|cole labrant|sav and cole labrant|savannah soutas|vlogs|family friendly|family vlogs|pregnant|surprise|reveal|announcement|pregnancy test","4626107","192953","3387","0","https://i.ytimg.com/vi/BDjNG2LQRfM/default.jpg","True","False","Watch Everleigh And Savannah find out here (:https://www.youtube.com/watch?v=yxZ4iBn8NtYGet our book here: https://thomasnelson.com/p/coleandsav/SUBSCRIBE to The LaBrant Fam!: http://bit.ly/SubToLaBrantFamSUBSCRIBE to Everleigh Opens Toys!: http://bit.ly/SubToEverleighWATCH MORE:SURPRISING THE FAMILY: https://youtube.com/playlist?list=PLMfMYAG7EYW1cCqfK86gEzUwpqQoKQEZ4&playnext=2CHALLENGES: https://youtube.com/playlist?list=PLMfMYAG7EYW3n503yjFz6f24m4MkXRjGd&playnext=2MORE CARL!: https://youtube.com/playlist?list=PLMfMYAG7EYW3JvyEhqXVrufBhrFvyMLyb&playnext=2DANCE WITH US: https://youtube.com/playlist?list=PLMfMYAG7EYW1jI9XUwT9kiRpfab_wHoLF&playnext=2FOLLOW US ON...INSTAGRAMSavannah: https://instagram.com/sav.labrantCole: https://instagram.com/thesupercoleEverleigh: https://instagram.com/everleighroseTWITTERSavannah: https://twitter.com/savannahsoutasCole: https://twitter.com/thesupercoleMUSIC CREDITSTrack: 2SCOOPS - Donuts [NCS Release]Music provided by NoCopyrightSounds.Watch: https://youtu.be/lc4Tt-CU-i0Free Download / Stream: http://ncs.io/DonutsYOTrack: Acejax feat. Danilyon - By My Side [NCS Release]Music provided by NoCopyrightSounds.Watch: https://youtu.be/SE_8DxZLmLkFree Download / Stream: http://ncs.io/ByMySideYO"
"wzZPNpL0FqQ","Jimmy Kimmel Pranks Staff with His Wax Figure","2019-12-10T08:30:04.000Z","UCa6vGFO9ty8v5KZJXQxdhaw","Jimmy Kimmel Live","24","19.11.12","jimmy|kimmel|live|late|night|talk|show|funny|comedic|comedy|clip|comedian|Jimmy’s Wax Figure|Wax Statue|Wax Figure|Cousin Micki|Surprise|Wax Museum|Reaction|Madame Tussauds Hollywood|Wax Jimmy","1424591","53780","1373","2403","https://i.ytimg.com/vi/wzZPNpL0FqQ/default.jpg","False","False","Starting tomorrow a wax figure of Jimmy will be on display at Madame Tussauds Hollywood. At the museum, they have what they call the 'Jimmy Kimmel Live Experience,' so we decided to have that here too. We brought 'Wax Jimmy' into our office and put it in strange places to surprise staffers with special emphasis on Jimmy's cousin Micki.Make Your Own Baby Yoda! https://youtu.be/6Xsqw9ZhM9QSUBSCRIBE to get the latest #KIMMEL: http://bit.ly/JKLSubscribe Watch Mean Tweets: http://bit.ly/KimmelMT10 Connect with Jimmy Kimmel Live Online: Visit the Jimmy Kimmel Live WEBSITE: http://bit.ly/JKLWebsiteLike Jimmy Kimmel on FACEBOOK: http://bit.ly/KimmelFBLike Jimmy Kimmel Live on FACEBOOK: http://bit.ly/JKLFacebookFollow @JimmyKimmel on TWITTER: http://bit.ly/KimmelTWFollow Jimmy Kimmel Live on TWITTER: http://bit.ly/JKLTwitterFollow Jimmy Kimmel Live on INSTAGRAM: http://bit.ly/JKLInstagram About Jimmy Kimmel Live: Jimmy Kimmel serves as host and executive producer of Emmy-winning Jimmy Kimmel Live, ABC's late-night talk show.Jimmy Kimmel Live is well known for its huge viral video successes with 5.6 billion views on YouTube alone.Some of Kimmel's most popular comedy bits include - Mean Tweets, Lie Witness News, Jimmy's Twerk Fail Prank, Unnecessary Censorship, YouTube Challenge, The Baby Bachelor, Movie: The Movie, Handsome Men's Club, Jimmy Kimmel Lie Detective and music videos like I (Wanna) Channing All Over Your Tatum and a Blurred Lines parody with Robin Thicke, Pharrell, Jimmy and his security guard Guillermo.Now in its seventeenth season, Kimmel's guests have included: Johnny Depp, Meryl Streep, Tom Cruise, Halle Berry, Harrison Ford, Jennifer Aniston, Will Ferrell, Katy Perry, Tom Hanks, Scarlett Johansson, Channing Tatum, George Clooney, Larry David, Charlize Theron, Mark Wahlberg, Kobe Bryant, Steve Carell, Hugh Jackman, Kristen Wiig, Jeff Bridges, Jennifer Garner, Ryan Gosling, Bryan Cranston, Jamie Foxx, Amy Poehler, Ben Affleck, Robert Downey Jr., Jake Gyllenhaal, Oprah, and unfortunately Matt Damon.Jimmy Kimmel Pranks Staff with His Wax Figurehttps://youtu.be/wzZPNpL0FqQ"
"LxDm9T1TKvU","Resident Evil 3 - State of Play Announcement Trailer | PS4","2019-12-10T14:32:39.000Z","UC-2Y8dQb0S6DtpxNgAKoJKA","PlayStation","20","19.11.12","resident evil|re|resident evil 3|re3|biohazard|bio|raccoon city|jill valentine|valentine|jill|stars|nemesis|tyrant|mr x|remake|remaster|bioweapon|bow|resistance|project resistance|outbreak|survivor|survivors|mastermind|birkin|annette|william|fabron|daniel|umbrella|corporation|experiment|state of play|episode 4|sop","1781879","132631","1824","10675","https://i.ytimg.com/vi/LxDm9T1TKvU/default.jpg","False","False","Resident Evil 3 returns to PlayStation 4 on April 3rd, 2020. Experience Jill Valentine’s encounter with the unrelenting Nemesis in this survival-horror classic remade from the ground up.It also includes Resident Evil Resistance, a new 1 vs 4 asymmetrical online multiplayer game set in the Resident Evil universe. Cooperate as one of four Survivors or as a twisted Mastermind attempting to stop them at every turn.Rated Mature: Blood and Gore, Intense Violence, Suggestive Themes"
"H1sG-C8ajbo","Billie Eilish Surprises Alicia Keys w/ a Home Video 'Fallin' Cover","2019-12-10T09:35:00.000Z","UCJ0uqCI0Vqr2Rrt1HseGirg","The Late Late Show with James Corden","24","19.11.12","The Late Late Show|Late Late Show|James Corden|Corden|late night|late night show|comedy|comedian|celebrity|celeb|celebrities|CBS|joke|jokes|funny|funny videos|funny video|humor|hollywood|famous|alicia keys|fallin|billie eilish|billie eilish fallin|fallin cover","2569848","69118","988","2001","https://i.ytimg.com/vi/H1sG-C8ajbo/default.jpg","False","False","After Late Late Show guest host Alicia Keys compliments Billie Elish on her teenage success, and brings up the Ocean Eyes cover Alicia posted on her Instagram, Billie surprises Alicia with a 5-year-old video of her covering Fallin' at a talent show. After, Alicia promises to take care of Billie at her first GRAMMYs ceremony coming up in January.More Late Late Show:Subscribe: http://bit.ly/CordenYouTubeWatch Full Episodes: http://bit.ly/1ENyPw4Facebook: http://on.fb.me/19PIHLCTwitter: http://bit.ly/1Iv0q6kInstagram: http://bit.ly/latelategramWatch The Late Late Show with James Corden weeknights at 12:35 AM ET/11:35 PM CT. Only on CBS.Get new episodes of shows you love across devices the next day, stream live TV, and watch full seasons of CBS fan favorites anytime, anywhere with CBS All Access. Try it free! http://bit.ly/1OQA29B---Each week night, THE LATE LATE SHOW with JAMES CORDEN throws the ultimate late night after party with a mix of celebrity guests, edgy musical acts, games and sketches. Corden differentiates his show by offering viewers a peek behind-the-scenes into the green room, bringing all of his guests out at once and lending his musical and acting talents to various sketches. Additionally, bandleader Reggie Watts and the house band provide original, improvised music throughout the show. Since Corden took the reigns as host in March 2015, he has quickly become known for generating buzzworthy viral videos, such as Carpool Karaoke."
"iNRM7LJZzKw","Entire House Makeover for Christmas!","2019-12-09T22:21:32.000Z","UC0CG8Kj2DqFc9bJld0hJKBA","Ryland Adams","24","19.11.12","[none]","2156291","140680","2505","11007","https://i.ytimg.com/vi/iNRM7LJZzKw/default.jpg","False","False","Subscribe to Morgan https://www.youtube.com/channel/UCSfL...Subscribe to Shane https://www.youtube.com/user/shane/vi...I finally have merch!! https://www.amazon.com/rylandadamsWATCH MY LAST VIDEO: I Wore Woman’s Section Clothing for a Week! https://youtu.be/B5oaHhxX6iQADD ME ON:INSTAGRAM: https://www.instagram.com/rylandadams...TWITTER: https://twitter.com/ryland_adams?lang=enSNAPCHAT: @rylandadams"
"UtoLFJeYWq0","My Pregnancy Scare","2019-12-10T20:00:04.000Z","UCWENB1OaGA9402PKzEVl0ow","storybooth","1","19.11.12","storybooth|story booth|storybooth animated|storytime|story time|animation|high school|scared|nervous|mom|boyfriend|best friend|anime|video games|baby|pregnancy|pregnancy test|my pregnancy scare|pregnancy scare|stressful|storybook|school|mother|pregnant|doctor|symptoms|pregnancy symptoms","569184","29583","487","2120","https://i.ytimg.com/vi/UtoLFJeYWq0/default.jpg","False","False","By Aliyah  |  Subscribe: http://bit.ly/sub2storybooth | Comment, like, share this story.  Stand up against people who judge others and use your voice - WEAR IT OUT LOUD! merch back in stock! SHOP http://storybooth.com/store  LIMITED QUANTITIES! When Aliyah was 15 years old, she moved in with her mother after her father passed away. It was so difficult for her to deal with her loss, and to make things even more stressful, Aliyah had to go to a brand new school after her move. On her first day, she was so scared to start her new high school and meet new people. She was really shy. But one day, she met a boy named Aaron. Aaron knew Aliyah's mom through his job, so they immediately had a connection. They became really good friends, and they eventually started dating. They got really close, and Aliyah ended up falling deeply in love with him. He was her first boyfriend and real relationship. One day, when Aaron and Aliyah were home alone, after watching anime, playing video games and hanging out, they decided to take their relationship to the next level. They went to her room, and one thing led to another.  A few weeks later, Aliyah was with her best friend when she started to feel a pain in her stomach. When she went to the bathroom, she realized that she was experiencing a pregnancy symptom. She immediately got really nervous, so she called Aaron and he brought her a pregnancy test. Aliyah took the test a few times, and she became even more nervous and confused when the results were both positive and negative. She didn't know if she was pregnant. Aliyah went to the doctor with her mom to get an official test. After waiting nervously, Aliyah finally got the results - she was not pregnant. Even though she had mixed emotions at first, Aliyah decided that everything ultimately worked out for the best. She did not feel ready to have a baby and become a mother at the time. When she looks back, she probably says to herself, My pregnancy scare was a moment I'll never forget. Record your story @ https://storybooth.com or our iPhone app for a chance to get animated.______What's your true story?  storybooth wants to hear it! LINKS:Website: http://www.storybooth.comInstagram: @thestorybooth https://www.instagram.com/thestoryboothTumblr: https://storybooth.tumblr.com/If you liked this storybooth storytime (story time storybook) animation watch our themed parity playlist collections full of true stories:Being Yourself: https://goo.gl/89enENLove and Heartbreak: https://goo.gl/mfaoKwEmbarrassing and Funny: https://goo.gl/5GjxrWBullies and Mean People: https://goo.gl/THS3LBOvercoming Challenges:  https://goo.gl/pbxRa9#storybooth #noscripts #novoiceactors"
"o0SWE_jio-Q","Traveling Cross Country Living In Our Tiny Home Van","2019-12-09T20:16:20.000Z","UCITqR49EAUY8i1vZtXTwe-A","Dolan Twins","23","19.11.12","Dolan|Twins|dolan twins van|van series|dolan twins van series|dolan van series ep. 3|episode 3|van 3|dolan twins road trip|ethan|grayson|tiny home|tiny home on wheels|country|america|usa|van life|living in a van|live in van|traveling van|traveling cross country|cross country","2263096","181623","2164","13862","https://i.ytimg.com/vi/o0SWE_jio-Q/default.jpg","False","False","In this video we traveled across the United States while living in the tiny home van that we built together. We were faced with extreme weather conditions and many other obstacles. Things... went downSUBSCRIBE -  https://www.youtube.com/user/TheDolan...Last Episode - https://www.youtube.com/watch?v=zGwrBIscb24&t=5sMerch - https://dolantwins.comEthan’s StuffINSTAGRAM - https://instagram.com/ethandolan/TWITTER - https://twitter.com/EthanDolanSNAPCHAT - EthanDolanGrayson’s ThingsINSTAGRAM - https://instagram.com/graysondolan/TWITTER - https://twitter.com/GraysonDolanSNAPCHAT - GraysonDolan"
"3WEhsS9ybwk","The Vector W8 Is the Craziest Supercar Ever Made","2019-12-10T16:57:42.000Z","UCsqjHFMB_JYTaEnf_vmTNqg","Doug DeMuro","2","19.11.12","vector w8|vector|vector w8 review|vector review|supercar|vector m12|doug demuro|demuro|doug de muro","914242","32812","1309","7695","https://i.ytimg.com/vi/3WEhsS9ybwk/default.jpg","False","False","GO READ MY COLUMN!http://autotradr.co/OversteerThe Vector W8 is the craziest supercar in history. Today I'm reviewing the Vector W8 to show you why it's so insane, and I'm going to show you all the quirks and features of the crazy Vector W8.WEBSITE & MERCH!http://www.dougdemuro.comFOLLOW ME!Twitter - http://www.twitter.com/dougdemuroInstagram - http://www.instagram.com/dougdemuroFacebook - http://www.facebook.com/ddemuroDOUGSCORE CHART: https://www.dougdemuro.com/dougscore"
"TqjwSNRDrO8","Mac Pro and Pro Display XDR 8K Unboxing!","2019-12-10T17:00:42.000Z","UCey_c7U86mJGz1VJWH5CYPA","iJustine","22","19.11.12","ijustine","496859","25253","1438","3151","https://i.ytimg.com/vi/TqjwSNRDrO8/default.jpg","False","False","Unboxing the new Mac Pro and Pro Display XDR! We shot and I edited this all in 8K on the new Mac that you just watched me unbox. Follow up video coming soon after I actually get to use it!► SUBSCRIBE FOR MORE VIDEOS: http://www.youtube.com/subscription_center?add_user=ijustine🎶 MUSIC I USE - https://goo.gl/Pe7GTL RED CAMERA OPS:Nathan: http://instagram.com/nathanhaugaardTyler: http://instagram.com/dvstylrCory: http://instagram.com/corybasil Thanks to http://www.alternativerentals.com for renting me some REDS on very short notice :) ► Check out http://vloguniversity.com for more info about my conference next year!BE MY FRIEND:http://instagram.com/ijustinehttp://facebook.com/ijustinehttp://twitter.com/ijustineSnapchat: iJustine► WHAT I USE TO MAKE VIDEOS: https://www.youtube.com/watch?v=YRCngWau2GE📷 GEAR:Sony a7 III: http://geni.us/UHuO6ASony a7S II: http://geni.us/B1tYeKZFE 24-70mm F2.8 GM Lens: http://geni.us/MhAPNERx100 V: http://geni.us/ZVGoJGoPro Hero 7: http://geni.us/uxuU1Insta 360 One X: http://geni.us/8tEtxKRx0: http://geni.us/BoXwFGrMemory Card: http://geni.us/zuulPoABECOME A CHANNEL MEMBER: https://www.youtube.com/channel/UCey_c7U86mJGz1VJWH5CYPA/join"
"HKQ9eTuCXrk","The Patriots are cheaters and liars! – Max Kellerman | First Take","2019-12-10T17:00:25.000Z","UCiWLfSweyRNmLpgEHekhoAg","ESPN","17","19.11.12","new england patriots|cincinnati bengals|bengals|patriots|tom brady|nfl|national football league|patriots nfl|espn nfl|stephen a smith|tom brady nfl|new england patriots nfl|first take|stephen a. smith|espn first take|espn|first take stephen a smith|first take today|first take nfl|nfl first take|first take espn|first take espn today|nfl on espn|first take football|football|espn first take stephen a smith|espn first take today|stephen a first take|#nfl","453125","6623","745","3088","https://i.ytimg.com/vi/HKQ9eTuCXrk/default.jpg","False","False","Stephen A. Smith, Max Kellerman and Dan Orlovsky react to the New England Patriots admitting that their production crew was videotaping the Cincinnati Bengals' sideline.✔ Subscribe to ESPN+ https://plus.espn.com/✔ Get the ESPN App: http://www.espn.com/espn/apps/espn✔ Subscribe to ESPN on YouTube: http://es.pn/SUBSCRIBEtoYOUTUBE✔ Subscribe to ESPN FC on YouTube: http://bit.ly/SUBSCRIBEtoESPNFC✔ Subscribe to NBA on ESPN on YouTube: http://bit.ly/SUBSCRIBEtoNBAonESPN✔ Watch ESPN on YouTube TV: http://es.pn/YouTubeTVExclusive interviews with Rachel Nichols https://urlzs.com/jNUReStephen A. Smith on ESPN https://urlzs.com/W19TzESPN on Social Media:► Follow on Twitter: http://www.twitter.com/espn► Like on Facebook: http://www.facebook.com/espn► Follow on Instagram: www.instagram.com/f/espnVisit ESPN on YouTube to get up-to-the-minute sports news coverage, scores, highlights and commentary for NFL, NHL, MLB, NBA, College Football, NCAA Basketball, soccer and more. More on ESPN.com: https://www.espn.com"
"vOhLRx2pf9U","Higher | Mecha Kingdoms Skins Teaser - League of Legends","2019-12-10T18:00:09.000Z","UC2t5bjwHdUX4vM2g8TRDq5g","League of Legends","20","19.11.12","Riot Games|Riot|League of Legends|League|LoL|MOBA|Mecha kingdoms|jax|skin|skins teaser|event|lunar revel|mecha|avalon|robot|lol skins|league skins|animated trailer|skins trailer","1048995","34345","507","2084","https://i.ytimg.com/vi/vOhLRx2pf9U/default.jpg","False","False","We must rise above the past if we wish to have a future.Mecha Kingdoms launches with five new pilots on January 15, 2020, at 11:00 a.m. PT."
"RMxXp6MTN5M","Lizzo Twerks In Her THONG at NBA Game","2019-12-09T21:31:28.000Z","UCdtXPiqI2cLorKaPrfpKc4g","Entertainment Tonight","24","19.11.12","Lizzo|Entertainment Tonight|etonline|et online|celebrity|Hollywood|news|trending|et|et tonight|2019|lizzo juice|Lizzo dancing|lizzo dancing at lakers game|Lizzo lakers game|lizzo twerking at staples center|Lizzo twerks|Lizzo twerking|lizzo staples center","611187","3337","4521","2539","https://i.ytimg.com/vi/RMxXp6MTN5M/default.jpg","False","False","Lizzo seemed to having the time of her life at Sunday night’s Laker game.Lizzo at jingle ball courtesy:  iHeartMediaFootage Courtesy of NBA.comExclusives from #ETonline :https://www.youtube.com/playlist?list=PLQwITQ__CeH2Y_7g2xeiNDa0vQsROQQgv"
