video_id,title,publishedAt,channelId,channelTitle,categoryId,trending_date,tags,view_count,likes,dislikes,comment_count,thumbnail_link,comments_disabled,ratings_disabled,description
"JFNM1aN7y3I","REACTING to PRETENTIOUS INGREDIENTS Recipe Relay Video","2020-01-26T16:15:00.000Z","UCfyehHM_eo4g5JUyWmms2LA","SORTEDfood","26","20.01.02","REACTING to PRETENTIOUS INGREDIENTS Recipe Relay Video|Reacting to Pass It On|Sortedfood Reaction|Sorted|sortedfood|sortedfood ben ebbrell|sortedfood James Currie|Pretentious ingredients|pretentious ingredients sorted|pass it on sortedfood|cooking challenge|sortedfood pass it on|food challenge|recipe relay|pass or fail","243130","12371","159","634","https://i.ytimg.com/vi/JFNM1aN7y3I/default.jpg","False","False","Here’s another reaction video for the Pass It On recipe relay video using pretentious ingredients! The Sorted guys get to see how each of the others behaved while cooking in the kitchen...Didn’t catch the first video? Be sure to watch that first right here: https://youtu.be/AqbHNtmb0NgLove these reaction videos? Give it a like, comment below and we’ll do more!WANT TO SUPPORT SORTED?? Here's how to get involved...Join our food journey each week by SUBSCRIBING to the channel. Press the bell button to get notifications every time we post: https://goo.gl/pqaw14Become a member of the Sorted club and access the AMAZING podcast and apps that have been designed for you to live your best life through food: https://goo.gl/otD6NFGrab the Packs Starter Kit for everything you need to create your own SMART kitchen and nail midweek meals: https://sorted.club/buy-the-packs-starter-kit/Grab a copy of one of our UNIQUE cookbooks for major cooking inspo: https://sorted.club/books/"
"7QUbshDzo7Q","China Virus: Wuhan Medical Workers Battle Coronavirus on Lunar New Year Day","2020-01-26T09:41:19.000Z","UChirEOpgFCupRAk5etXqPaA","QuickTake by Bloomberg","25","20.01.02","china coronavirus|china flu|china population|pandemic|china virus|virus|wuhan|wuhan china|coronavirus symptoms|china lockdown|china quarantine|wuhan virus|virus in china|china news|中國肺炎|中國 疫情|肺炎|武汉 病毒|病毒|钟南山|武汉|湖北 省 委 书记|sari|武汉 肺炎|武漢|肺炎 病徵|sars|novel coronavirus|chinese virus|new coronavirus|cdc coronavirus|corona virus|新型 冠状 病毒|新型 肺炎|中国|新型 コロナ ウイルス と は|冠狀 病毒 肺炎|china|coronavirus news|コロナ ウイルス","304149","1428","213","1155","https://i.ytimg.com/vi/7QUbshDzo7Q/default.jpg","False","False","For the medical workers in China's city of Wuhan, the center of the novel coronavirus (2019-nCoV) outbreak, this year's Lunar New Year holidays have been very different as they strive to fight the virus and save the lives of those infected.The Spring festival is usually synonymous to family reunions and celebrations in China. However, as the city, located in central China's Hubei Province, is now hosting the vast majority of the confirmed cases of novel coronavirus pneumonia, medical staff across hospitals in Wuhan have faced up to their responsibilities regardless of the risks and sacrifices.On the early morning of Saturday, the first day of the Chinese Lunar New Year, the country's grandest traditional festival that was supposed to be filled with fun activities and events, doctors and nurses from the Jinyintan Hospital did not even have time to take a rest.Ding Na is a nurse working in the ICU of the hospital, one that has been at the frontier of the battle for nearly a month since it took in the first infected patient on Dec 29 last year.Her husband is a physician who works on a different floor in the same building. However, over the past 28 days, they did not quite have any chance to meet each other nor much time to rest at home.This has lead to the husband's locker becoming a mail box for the couple to keep in touch and care for each other.I come here every day to bring him tidy clothes here and take away the dirty ones home, as she told the China Central Television (CCTV) reporter.Knowing well about the threat they faced in the fight against the virus better than anyone, the medical workers have still chosen to stick to their duties and try their best to free the patients away from the pain.I hope with our efforts, we are able to control the epidemic at an earlier date so that none of our families, colleagues, friends and fellow citizens suffer anymore, said Guo Wei, deputy head of infection division from Tongji Hospital affiliated to Tongji Medical College of Huazhong University of Science and Technology.Subscribe to our YouTube channel: https://bit.ly/2TwO8GmQUICKTAKE ON SOCIAL:Follow QuickTake on Twitter: twitter.com/quicktakeLike QuickTake on Facebook: facebook.com/quicktakeFollow QuickTake on Instagram: instagram.com/quicktakeSubscribe to our newsletter: https://bit.ly/2FJ0oQZEmail us at quicktakenews@gmail.comQuickTake by Bloomberg is a global news network delivering up-to-the-minute analysis on the biggest news, trends and ideas for a new generation of leaders."
"K_oXgALpVeY","Can You Find Him in This Video? • Hidden in Plain Sight #11","2020-01-25T13:00:03.000Z","UCDRbNGFusqlXX4a5vwi9ouQ","Vat19","24","20.01.02","vat19|vat 19|vat-19|hidden in plain sight","3594141","78822","5283","5734","https://i.ytimg.com/vi/K_oXgALpVeY/default.jpg","False","False","Can Danny hide until the end of the day before his boss finds him?Buy here: https://www.vat19.com/item/crunchy-snow-stress-ball?adid=youtubeMore Hidden in Plain Sight: https://www.youtube.com/watch?v=BtR4mH3ZvcM&list=PLSqiExuEA-RF4HU9PWHtpiQo94XkXV2nXSubscribe to Vat19: http://www.youtube.com/subscription_center?add_user=vat19comVisit the Vat19 Headquarters: https://www.vat19.com/tour****************** Follow Vat19:Facebook: https://facebook.com/vat19Instagram: https://instagram.com/vat19/Shop hundreds more curiously awesome products:https://www.vat19.com/?adid=youtubeWatch More Vat19:The White Elephant Gift Show: https://www.youtube.com/watch?v=rppcXroNgKI&list=PLSqiExuEA-RFpqW0Y3vn0pn8wDW_3LXAOLatest Uploads: https://www.youtube.com/user/vat19com/videos?shelf_id=1&view=0&sort=ddPopular Videos: https://www.youtube.com/user/vat19com/videos?shelf_id=7&view=0&sort=pFun Stuff to Eat: https://www.youtube.com/watch?v=7RXmNRr8x7I&list=PLSqiExuEA-REt5gzR0A9ernZNHlZ2glIlAbout Vat19:Vat19 is dedicated to curiously awesome gifts, candy, toys, gummy, putty, puzzles, games, and more! In addition to making funny commercials you'll actually want to watch, we produce amazing challenge videos, document our outrageous contraptions, and invite you to a front row seat for our silly stunts. Sometimes we blow things up, fill up a bathtub or pool with crazy stuff, dare each other to eat super spicy foods, and answer “burning questions” from our viewers."
"fPTmr_O6prE","How I Fell In Love With My Coworker","2020-01-25T16:00:06.000Z","UCpko_-a4wgz2u_DgDgd9fqA","BuzzFeedVideo","22","20.01.02","buzzfeed|buzzfeed video|buzzfeedvideo|relationships|dating|storytime|relationship storytime|boyfriend|girlfriend|first kiss|first kiss storytime|dating storyting|buzzfeed merle|buzzfeed aria|merle o'neal|aria inthavong|merlia|merle and aria|aria and merle|How I Fell In Love With My Coworker|love story|aria and merle love story|story time","3008206","156394","2489","11166","https://i.ytimg.com/vi/fPTmr_O6prE/default.jpg","False","False","After months of tension, it's official! BuzzFeed producers Aria (https://instagram.com/ariainthavong/) and Merle (https://instagram.com/merleeshay/) tell the story of how they became a couple, with help from all the friends and coworkers who were forced to watch it unfold...SPECIAL THANKS• Tatsu Ramen (Merle & Aria's favorite ramen spot!)https://www.tatsuramen.com/https://www.instagram.com/tatsuramen/https://twitter.com/tatsuramenhttps://www.facebook.com/tatsuramen/• Sunrise Balloonshttps://www.sunriseballoons.com/https://www.facebook.com/sunriseballoon/Buy tickets above for your own beautiful hot air balloon experience!• Jack Dytrych Photographyhttps://www.jacktdphoto.com/https://www.instagram.com/jacktdphoto/-----The relationship between Aria and Merle has been completely consensual between two colleagues who are at an equal level in their work and careers.However, workplace and sexual harassment are also very real and unacceptable. If you find yourself in a workplace situation that feels in any way uncomfortable or inappropriate, please reach out to resources such as:https://www.nsvrc.org/https://www.rainn.org/https://leanin.org/Credits: https://www.buzzfeed.com/bfmp/videos/98417Check out more awesome videos at BuzzFeedVideo!https://bit.ly/YTbuzzfeedvideoGET MORE BUZZFEED:https://www.buzzfeed.comhttps://www.buzzfeed.com/videoshttps://www.youtube.com/buzzfeedvideohttps://www.youtube.com/asishttps://www.youtube.com/buzzfeedmultiplayerhttps://www.youtube.com/buzzfeedviolethttps://www.youtube.com/perolikehttps://www.youtube.com/ladylikeSUBSCRIBE TO BUZZFEED NEWSLETTERS:https://www.buzzfeed.com/newslettersBuzzFeedVideoBuzzFeed’s flagship channel. Sometimes funny, sometimes serious, always shareable. New videos posted daily!To see behind-the-scenes & more, follow us on Instagram @buzzfeedvideo http://bit.ly/2JRRkKULove BuzzFeed? Get the merch! BUY NOW: https://goo.gl/gQKF8mMUSICLicensed via Audio NetworkBizarre AffairLicensed via Warner Chappell Production Music Inc.Happy Anniversary_fullmixLicensed via Warner Chappell Production Music Inc.Easy Going Intrigue_FullLicensed via Warner Chappell Production Music Inc.Neutral Report_FullLicensed via Warner Chappell Production Music Inc.Facts and Figures_FullLicensed via Warner Chappell Production Music Inc.EXTERNAL CREDITSJack Dytrych Photographyhttps://www.instagram.com/jacktdphoto/+Josefin Meyerhttps://www.instagram.com/josefinmeyer/+Matt Realhttps://www.instagram.com/matty_rere/+Sunrise Balloonshttps://www.sunriseballoons.com/+Tatsu Ramenhttps://www.tatsuramen.com/+Jack Dytrychhttps://www.instagram.com/jdytrych22/+Fernando Padrónhttps://www.instagram.com/ferpaaa/"
"jZYpZTfWLmA","How Big Does a Freeze Dried 1 lb. Gummy Bear Get?","2020-01-25T20:00:04.000Z","UC1zZE_kJ8rQHgLTVfobLi_g","The King of Random","27","20.01.02","thekingofrandom|tkor|grant thompson|nate|calli|random happens|freeze drying|freeze dried food|freeze dryer machine|long term food storage|how does a freeze dryer work|random experiment|gummy fruit|how to make space ice cream|best food to freeze dry|backpacking prep|my experience|problems|customer service|harvest right freeze dryer review|gummy bear|gummy worm|freeze drying experiments|what food should i put in a freeze dryer","720856","15481","807","2317","https://i.ytimg.com/vi/jZYpZTfWLmA/default.jpg","False","False","Install Raid for Free ✅ IOS: https://clcr.me/jcqOcL ✅ ANDROID: https://clcr.me/f8Jlof  ✅ PC: https://clcr.me/z4iUHg and get a special starter pack 💥 Available only for the next 30 days.Today we're testing our biggest freeze dried candy yet- a one pound gummy bear. How big will it get once we run it though the freeze dryer? Check out the TKOR Shop: http://bit.ly/2UCNpEbSee What Else We're Up To:TKOR Discord: http://bit.ly/2LTTRoyTKOR Reddit: http://bit.ly/2XOFn0mTKOR Instagram: http://bit.ly/2Ihef1jNate's Instagram: http://bit.ly/2CZx05FCalli's Instagram: http://bit.ly/2YWWryaTKOR Facebook: http://bit.ly/2Kl2zgrTKOR Pinterest: http://bit.ly/2InY0iTSend Us Some Mail:TKOR1881 W Traverse ParkwaySte. E #221Lehi, UT 84043Business Inquiries: For sponsorship requests or business opportunities please contact us directly: http://bit.ly/2VwFw3xMusic by: Calisto Young - Bashy GyalSven Karlsson - Save Me From Myself (Instrumental Version)Andreas Ericson - Carbon (Indie Pop Version)L.M. Styles - Getting Thru (Instrumental Version)Royalty Free Music from Epidemic Sound: http://bit.ly/2YZS8SHWARNING:This video is only for entertainment purposes. If you rely on the information portrayed in this video, you assume the responsibility for the results. Have fun, but always think ahead, and remember that every project you try is at YOUR OWN RISK.✌️👑  RANDOM NATION: TRANSLATE this video and you'll GET CREDIT! Click Here: http://bit.ly/3aFfy5U  Want credit TRANSLATING other videos? Click Here to see where else you can contribute: http://bit.ly/2UFOm1OThis video is dedicated to our friend and founder Grant Thompson- the one and only King of Random. Click here to see our tribute to him: http://bit.ly/2MwG5bNFTC Disclosure: This video is sponsored by Raid: Shadow Legends.THANK YOU!! ✌️👑"
"rNyJbdv2KF4","First flight of Boeing's 777X foldable-wing aircraft (full recap)","2020-01-25T23:08:58.000Z","UCOmcA3f_RrH6b9NmcNa4tdg","CNET","28","20.01.02","CNET|Technology|News|Tech|science|aviation|boeing|boeing 777x|boeing triple 7x|777x|triple 7x|boeing 777x first flight|777x first flight|take off|landing|folding wingtips|foldable wings|foldable wing aircraft|foldable wing airplane|commercial airplane|boeing news|top news|aviation news|engineering|full recap|recap|highlights|aerospace|777|first flight|flight|aviation videos|boeing 777|jet|777x engine|folding wingtip|boeing 777x takeoff|runway","1190285","5950","603","1430","https://i.ytimg.com/vi/rNyJbdv2KF4/default.jpg","False","False","Boeing successfully flew and landed its new 777X aircraft, the first commercial airplane with folding wingtips.  Watch a full recap of the day's events.Subscribe to CNET: https://www.youtube.com/user/CNETTVCNET playlists: https://www.youtube.com/user/CNETTV/playlistsDownload the new CNET app: https://cnet.app.link/GWuXq8ExzGLike us on Facebook: https://www.facebook.com/cnetFollow us on Twitter: https://www.twitter.com/cnetFollow us on Instagram: http://bit.ly/2icCYYm"
"_uSJDq7VPrw","Free Range vs Strict Parents: Is Spanking Your Kids Ever Okay?","2020-01-25T15:00:06.000Z","UCJjSDX-jUChzOEyok9XYRJQ","Jubilee","24","20.01.02","jubilee|jubilee media|jubilee project|live deeper|blind devotion|love language|middle ground|spectrum|free range parents|free range kids|lenore skenazy|hal chaffee|strict parents|helicopter parents|tiger parents|parenting advice|parenting tips|how to raise my child","1739549","57813","896","23687","https://i.ytimg.com/vi/_uSJDq7VPrw/default.jpg","False","False","Follow us on INSTAGRAM: 👉https://www.instagram.com/jubileemedia/ 👈SUBSCRIBE for more! http://bit.ly/SUBSCRIBEjubilee Be in a Jubilee video: http://bit.ly/JubileeCastingAre you a loyal Jubilee fan? Join our Facebook group: https://www.facebook.com/groups/407942859721012/| ABOUT |We believe in the power of empathy for human good. Ultimately, we aim to inspire people to EMBRACE EMPATHY.| SOCIAL |Jubilee Facebook: https://www.facebook.com/jubileemediaJubilee Instagram: https://www.instagram.com/jubileemedia/Jubilee Twitter: https://www.twitter.com/jubileemediaJubilee Website: https://www.jubileemedia.comFEATURING:Hal - https://youtube.com/halchaffeeJenny - https://instagram.com/realfoodbytwomomsJody - https://instagram.com/themaddenhouseLenore - https://letgrow.org/Nguyen - https://instagram.com/starrykitchen For brands interested in partnering with Jubilee, email us:hello@jubileemedia.comHelp us caption & translate this video!https://amara.org/v/CZmi1/"
"7xtX1KNSlrY","YouTube Diamond Play Button Review!","2020-01-25T22:53:48.000Z","UCBJycsmduvYEL83R_U4JriQ","Marques Brownlee","28","20.01.02","YouTube play button|diamond play button|10 million subscribers|youtube award|youtube button|MKBHD|what's inside","2513841","131908","2043","6710","https://i.ytimg.com/vi/7xtX1KNSlrY/default.jpg","False","False","The Diamond Play Button for 10 million subscribers!10,000,000: https://youtu.be/NvQmi_ciL1kWhatsInside video: https://youtu.be/hI5jggQTAsMMKBHD Merch: http://shop.MKBHD.comVideo Gear I use: http://kit.co/MKBHD/video-gear#recom...Tech I'm using right now: https://www.amazon.com/shop/MKBHDIntro Track: Jordyn Edmonds http://smarturl.it/jordynedmonds Playlist of MKBHD Intro music: https://goo.gl/B3AWV5~http://twitter.com/MKBHDhttp://instagram.com/MKBHDhttp://facebook.com/MKBHD"
"Ibax7n-IsCQ","Painting Things for 24 Hours","2020-01-24T21:00:03.000Z","UCYAB7hh1ohA8-iX54EpMdeA","Moriah Elizabeth","24","20.01.02","mariah elizabeth|painting seashells|painting on things|tiktok painting compilation|painting a hydro flask|squishy makeover|painting a mug|customizing a iphone","5900418","146214","4975","25148","https://i.ytimg.com/vi/Ibax7n-IsCQ/default.jpg","False","False","Hey Guys! Today I am doing a 24 hour challenge AGAIN. BUT, this time, I wanted to make it a little more interesting. I am not too big on challenges on my channel, just because I can't compete with the extreme challenges that so many other youtubers are willing to do LOL. I just like painting on things 😂 PLUS, I feel like a lot of challenges these days have gotten really pointless. But, this one is good haha. I decided to try  to paint and decorate different things for 24 hours. I have a lot of art supplies laying around my art room, just begging to be painted. But I don't often have the time to paint that much at a time. So this was a great opportunity to put a bunch of it to good use finally.I am going to be painting on a seashell, painting a pencil pouch, painting a rock, painting a squishy (mini squishy makeover lol), making a custom mug, decorating a giant clothes pin and a surprise weird item LOL. This video almost turned out like a tiktok painting compilation haha. Warning: Lots of rainbow, fruit and desserts coming your way 😂 I PICKLE YOU MERCH: https://moriah-elizabeth.teespring.com/listing/i-pickle-you?product=2I HEART PICKLE MERCH: https://moriah-elizabeth.teespring.com/listing/i-love-pickle-dark?product=2*IF You want the pickle Valentines Day Merch to arrive on or before Valentine’s Day, be sure to order by January 27th with regular shipping, or February 2nd with RUSH shipping (rush shipping is an additional cost).*PICKLE PLUSH PRE-ORDER: https://creators.teespring.com/moriah-elizabeth-pickle-plushie/?utm_source=website_homepage&utm_medium=platform&utm_campaign=pickle_plush&utm_content=%2Fmoriah-elizabeth-pickle-plushie%2FALSO. Just in case anyone missed the original announcement, please go back to this video (https://www.youtube.com/watch?v=y3nwki4bsMI&t=503s) to get the full scoop on the pre-order, OR review the pre-order FAQs. The first batch of plushies (the ones that were already in progress when the pre-order started) have sold out completely, so anyone who orders a plush from here on out will receive their Pickle around June.MATERIALS AND SUPPLIES USED (contains affiliate links):Giant clothespin: https://amzn.to/2NSQ9vyPaint Palette: https://amzn.to/38Bj9jvAcrylic Paint: https://amzn.to/2REtaFCLeather Paint: https://amzn.to/2GlHCNzGlass Paint: https://amzn.to/30TJgQePosca Paint Pens: https://amzn.to/2RnAEhn___________WELCOME TO MY CHANNEL__________Hey! my name is Moriah (pronounced muh-rye-yuh 😂 ) and this is my channel....obviously. I'm 25 and like doing anything creative...and being snarky.....just a lil. I make a lot of decorating and painting videos here. I'm obsessed with editing and adding lil bits to my videos, so if that's not your thing....oof you may hate this haha. I paint on squishies, thrift store finds, and other random things I pick up. I also love to draw, but don't expect anything too skilled, I'm not the best at that haha. You will also find occasional crafting/testing crafting kits on my channel which are always a hot mess. And even some baking (REALLY bad at that, but it's fun to try LOL). CURRENT SERIES:Squishy Makeovers: Fixing and decorating used squishies sent from my viewersThrift Store Makeovers: Fixing and decorating stuff I find at thrift stores/yard salesBake With ME: Recreating squishies I've decorated in real lifeCreate This Book: Drawing in the prompt book that I wrote (available to purchase and follow along)Squishy Unboxing: Opening used squishy packages sent from viewersCraft Kit Testing: pretty self explanatory. testing craft kits.___UPLOAD SCHEDULE___Every Friday at 4:00pm ET: Alternating Squishy Makeovers, Thrift Makeovers, Craft Kit Reviews, Create This Book, Mail Openings and Miscellaneous crafts and DIYs____PURCHASE ME PRODUCTS____CREATE THIS BOOK:https://amzn.to/2vUerfICREATE THIS BOOK 2:https://amzn.to/2Nx2G9fME MERCHhttps://me-merch.myshopify.comMORE MERCH:https://moriah-elizabeth.teespring.com/____ME SOCIALS____INSTAGRAM: https://www.instagram.com/moriahelizabethofficial/VISIT ME WEBSITE:https://www.moriahelizabeth.com/____CONTACT ME____EMAIL PICTURES OF YOUR ART (Create This Book or Fan art only please):Artwork@Moriah.videoFOR BUSINESS INQUIRIES/OPPORTUNITIES ONLY:Business@Moriah.video_____MAIL ME_____For sending squishies, Letters, or general fan mail, please contact: FANMAIL@MORIAH.VIDEO to request my P.O. box address (mail accepted from those ages 13+ ONLY)ATTENTION: Unfortunately I can only respond to a small amount of people each week. This is to make sure that I get a reasonable amount of mail and can feature the maximum amount on camera. I apologize in advance if you do not hear back from me, I may not have even seen the message. This email gets SUPER clogged with thousands of messages. Currently have 15,000+ unread messages just in this folder. SORRY PEEPS!*"
"TTtI-zH4bLw","Valencia 2-0 Barcelona - GOALS & HIGHLIGHTS - 1-25-2020","2020-01-25T17:26:08.000Z","UC0YatYmg5JRYzXJPxIdRd8g","beIN SPORTS USA","17","20.01.02","beIN SPORTS|beIN SPORTS USA|Futbol|Football|barcelona vs valencia|valencia vs barcelona|barcelona vs valencia live|barcelona vs valencia full match|fc barcelona vs valencia highlights|today match highlights barcelona vs valencia|valencia vs barcelona full match|bein sports live|bein sports news","265157","2110","186","887","https://i.ytimg.com/vi/TTtI-zH4bLw/default.jpg","False","False","Un penal fallado, un gol y un autogol fueron los elementos para dar al FC Barcelona su primera derrota en #LaLiga, y la primera de la era Setién.A missed PK, a goal and an own goal were the elements which gave FC Barcelona their first defeat of the season and Setien's first loss as Barca's Manager.Connect with beIN SPORTS Online:Watch us on TV: http://bit.ly/2d7bf5YWatch us Online: http://bit.ly/1WNtvkcVisit our WEBSITE: http://beINSPORTS.comLike us on FACEBOOK: http://facebook.com/beINSPORTSUSAFollow us on TWITTER: http://twitter.com/beINSPORTSUSAFollow us on INSTAGRAM: http://instagram.com/beINSPORTSUSA"
"GZsA1TfeUO0","Resumen y Goles | Cruz Azul vs Santos Laguna | Jornada 3 - CL 2020 | Liga BBVA MX","2020-01-26T00:59:58.000Z","UCq8BPLXtFeiSFOvmJrknWGg","LIGA BBVA MX","17","20.01.02","soccer|fútbol|sports|deportes|Clausura 2020 - Liga MX|Liga MX|Jornada 3|Cruz Azul|Santos Laguna|LIGA|BBVA|MX|LIGA BBVA MX|cruz azul 3-0 santos|cruz azul vs santos 3-0|cruz azul vs santos 2020|Cruz Azul Santos|Cruz Azul Santos 2020|Cruz Azul vs Santos|Cruz Azul contra Santos|Accion Cruz Azul Santos|Cruz Azul vs Santos en vivo|Jornada 3 Liga MX|Liga Mx 2020|Resumen|Highlights|liga mexicana|futbol mexicano|cl20|football|Accion jornada 3","625611","2516","284","312","https://i.ytimg.com/vi/GZsA1TfeUO0/default.jpg","False","False","Cruz Azul 3-0 SantosSábado 25 de enero, 202017:00 hrs.Estadio: AztecaAsistencia: 13586Cruz Azul dio una gran exhibición de futbol. Se impusieron con marcador de 3-0 a Santos en el Estadio Azteca, esto en el marco de la Jornada 3 de la LIGA BBVA MX Clausura 2020. Con esto, La Máquina alcanzó sus primeros 3 puntos del certamen; los Guerreros, en la tabla general, se quedaron con los 3 puntos que ganaron en la fecha anterior.Goles:Minuto 2. Gran combinación entre Jonathan Rodríguez y Roberto Alvarado, el jugador uruguayo fue quien terminó disparando desde la entrada del área para vencer a Jonathan Orozco. “Cabecita” no celebró como una forma de respeto a su ex equipo.Minuto 50. Elías Hernández encontró un rebote en las afueras del área y ejecutó un disparo implacable para dejar “congelado” al guardameta de los Guerreros. Golazo. Fue el 2-0.Minuto 79. Gol de Luis Romo, refuerzo de La Máquina, a pase de Elías Hernández. El mediocampista se sumó al frente y disparó, se apoyó en un desvío, para marcar el 3-0.Figura del partido:Elías Hernández fue brillante en la cancha del Estadio Azteca, hizo un golazo y dio una asistencia. Durante todo el partido dio muestras de su gran clase. Juegazo del volante mexicano."
