video_id,title,publishedAt,channelId,channelTitle,categoryId,trending_date,tags,view_count,likes,dislikes,comment_count,thumbnail_link,comments_disabled,ratings_disabled,description
"UyKgYMQ-AlQ","Katy Perry - Never Worn White (Official)","2020-03-05T05:00:10.000Z","UC-8Q-hLdECwQmaWNwXitYDw","KatyPerryVEVO","10","20.05.03","katy perry|katy|perry|never worn white|nww|new katy|new katy perry|katy perry new song|katy perry 2020|katy 2020|kp5|never worn white katy|never worn white katy perry|pop|new|new song|teenage dream","5798728","496028","11888","30876","https://i.ytimg.com/vi/UyKgYMQ-AlQ/default.jpg","False","False","Listen to Never Worn White: http://katy.to/NeverWornWhiteDirector: J.A.C.KProducer: Maggie McLeanCommissioner: Targa SahyounKaty Perry Complete Collection on Spotify: http://katy.to/SpotifyCompleteYDKaty Perry Essentials on Apple Music: http://katy.to/AMEssentialsYDWatch your favorite Katy videos on YouTube: http://katy.to/MusicVideosYDFollow Katy Perry:Website: http://katy.to/WebsiteYDInstagram: http://katy.to/InstagramYDTwitter: http://katy.to/TwitterYDFacebook: http://katy.to/FacebookYDWeibo: http://katy.to/WeiboYDVK: http://katy.to/VKPageYDMusic video by Katy Perry performing Never Worn White. © 2020 Capitol Records, LLC"
"r6iCu2r5jSM","Stunna 4 Vegas - DO DAT (feat. Dababy & Lil Baby) [Official Music Video]","2020-03-04T17:00:09.000Z","UC0VDoibglvjR23EaNH5ut7Q","Stunna 4 Vegas","10","20.05.03","[none]","1134724","61222","3745","3868","https://i.ytimg.com/vi/r6iCu2r5jSM/default.jpg","False","False","Stunna 4 Vegas - DO DAT (feat. Dababy & Lil Baby)Rich Youngin'  Out Now: https://smarturl.it/RICHYOUNGINSpotify: https://smarturl.it/RICHYOUNGIN/SpotifyApple Music: https://smarturl.it/RICHYOUNGIN/AppleMusicConnecthttps://www.facebook.com/officialstunna4vegas/https://twitter.com/Stunna4Vegas_https://www.instagram.com/stunna4vegas/#Stunna4Vegas #Dababy #LilBaby #DODAT"
"FYpl_5cWWfU","State Of Emergency In Los Angeles County Over Coronavirus Outbreak | NBC Nightly News","2020-03-05T01:39:39.000Z","UCeY0bbntWzzVIaj2z3QigXg","NBC News","25","20.05.03","Nightly News|U.S. News|Coronavirus|NBC Nightly News with Lester Holt|nbc news|nbc|news|breaking news|us news|world news|politics|current events|top stories|pop culture|lester holt|State Of Emergency|Los Angeles|symptoms|sickness|virus protection|outbreak|coronavirus outbreak|COVID-19|coronavirus pandemic|coronavirus prevention|covid-19 news|covid-19 updates|covid-19 outbreak|coronavirus update|coronavirus us|coronavirus news|coronavirus latest news","584999","5470","558","3643","https://i.ytimg.com/vi/FYpl_5cWWfU/default.jpg","False","False","Six new COVID-19 cases have been confirmed in Los Angeles, including a federal contract employee brought in to help screen international travelers for the virus. Officials in the region of nearly 10 million people have now advised citizens to avoid handshakes and hugs and to stay six feet away from strangers at large events.» Subscribe to NBC News: http://nbcnews.to/SubscribeToNBC» Watch more NBC video: http://bit.ly/MoreNBCNewsNBC News Digital is a collection of innovative and powerful news brands that deliver compelling, diverse and engaging news stories. NBC News Digital features NBCNews.com, MSNBC.com, TODAY.com, Nightly News, Meet the Press, Dateline, and the existing apps and digital extensions of these respective properties.  We deliver the best in breaking news, live video coverage, original journalism and segments from your favorite NBC News Shows.Connect with NBC News Online!NBC News App: https://smart.link/5d0cd9df61b80Breaking News Alerts: https://link.nbcnews.com/join/5cj/breaking-news-signup?cid=sm_npd_nn_yt_bn-clip_190621Visit NBCNews.Com: http://nbcnews.to/ReadNBCFind NBC News on Facebook: http://nbcnews.to/LikeNBCFollow NBC News on Twitter: http://nbcnews.to/FollowNBCFollow NBC News on Instagram: http://nbcnews.to/InstaNBCState Of Emergency In Los Angeles County Over Coronavirus Outbreak | NBC Nightly News"
"sbVPcPL30xc","Dixie Chicks - Gaslighter (Official Video)","2020-03-04T17:00:16.000Z","UCu2L8AfbVwqHhT3ME89hq_Q","dixiechicksVEVO","10","20.05.03","dixie chicks|the dixie chicks|dcx2020|dixie chicks 2020|gaslighter|gaslighting|dixie chicks gaslighter|the dixie chicks gaslighter|official video|video|gaslighter video|gaslighter official video|the dixie chicks gaslighter video|the dixie chicks gaslighter official video|natalie maines|martie maguire|Emily Robison|George bush|country music|female country|country|female country artist|female country music stars|not|ready","1327603","26058","2576","2761","https://i.ytimg.com/vi/sbVPcPL30xc/default.jpg","False","False","Pre-save the Dixie Chicks’ new album ‘Gaslighter’ now: https://DixieChicks.lnk.to/GaslighterPSPAID Creative Director/Director - Seanne FarmerCo-Director - Derek MiltonDirector of Photography - Ian CoadEditor - Mark SpencerChoreography - JaQuel KnightProducer - Tara DuncanExecutive Producer - Mindi Pelletier Listen to “Gaslighter” here: https://DixieChicks.lnk.to/GaslighterSingleIDAmazon Music: https://DixieChicks.lnk.to/GaslighterSingleID/amazonmusicApple Music: https://DixieChicks.lnk.to/GaslighterSingleID/applemusiciTunes: https://DixieChicks.lnk.to/GaslighterSingleID/itunesSoundcloud: https://DixieChicks.lnk.to/GaslighterSingleID/soundcloudSpotify: https://DixieChicks.lnk.to/GaslighterSingleID/spotifyYouTube Music: https://DixieChicks.lnk.to/GaslighterSingleID/youtubemusic Follow the Dixie ChicksWebsite: http://www.dixiechicks.com/Facebook: https://www.facebook.com/dixiechicksTwitter: https://twitter.com/dixiechicksInstagram: https://instagram.com/dixie_chicks/ Lyrics: GaslighterDenierDoing anything to get your ass fartherGaslighterBig timerRepeating all of the mistakes of your father We moved to California and we followed your dreamsI believed in the promises you made to meSwore that night til death do us partBut you lie lie lie lie liedHollywood welcomed you with open doorsNo matter what they gave you you still wanted moreActing all above it when our friends divorcedWhat a lie lie lie lie lie You’re such aGaslighterDenierDoing anything to get your ass fartherGaslighterBig timerRepeating all of the mistakes of your fatherGaslighterYou broke meYou’re sorry but where’s my apologyGaslighterYou liar You thought I wouldn’t see it if you put it in my faceGive you all my money you’ll gladly walk awayYou think it’s justifiable I think it’s pretty cruelAnd you know you lie best when you lie to youCause boy you know exactly what you did on my boatAnd boy that’s exactly why you ain’t comin’ homeSave your tired stories for your new someone elseCause they’re lie lie lie lie liesLook out you little GaslighterDenierDoing anything to get your ass fartherGaslighterBig timerRepeating all of the mistakes of your fatherGaslighterYou broke meYou’re sorry but where’s my apologyGaslighterYou liar You just had to start a fireHad to start a fireCouldn’t take yourself on a road a little higherHad to burn it up had to tear it downTried to say I’m crazyBabe you know I’m not crazy that’s youGaslightingYou’re a lie lie lie liarOh honey that’s youGaslightingYou made your bed and then your bed caught fire GaslighterI’m your mirrorStanding right hereUntil you can see howYou broke meYeah I’m brokenYou’re still sorryAnd there’s still no apology GaslighterDenierDoin anything to get your ass fartherGaslighterBig timerRepeating all of the mistakes of your fatherGaslighterYou broke meYou’re sorry but where’s my apologyGaslighterYou liar #DixieChicks #Gaslighter #DCX2020"
"oq9AgxHvGjw","The Weeknd - After Hours (Short Film)","2020-03-04T16:00:11.000Z","UCF_fDSgPpBQuh1MsUTgIARQ","TheWeekndVEVO","10","20.05.03","The|Weeknd|After|Hours|Republic|Records","2145166","163290","3697","10205","https://i.ytimg.com/vi/oq9AgxHvGjw/default.jpg","False","False","*****EPILEPSY WARNING ******** *****EPILEPSY WARNING ******** *****EPILEPSY WARNING ******** Official short film for The Weeknd’s ‘After Hours’ album – pre-order everywhere now: http://theweeknd.co/afterhoursYD►Subscribe to The Weeknd on YouTube: http://theweeknd.co/subscribeYD ►Get tickets: https://www.theweeknd.com/tour►Get exclusive merch: https://shop.theweeknd.com/►Follow The Weeknd:https://twitter.com/theweeknd https://www.facebook.com/theweeknd https://www.instagram.com/theweeknd https://www.theweeknd.com Director: Anton TammiIntroducing: Zaina MiucciaProduction Company: Somesuch Executive Producer: Saskia Whinney, Tim NashProducer: Sarah ParkDirector of Photography: Oliver Millar2nd Unit DP: Devin Daddy KarringtenSteadicam Op: Nick MuellerGaffer: Mickey PetersenKey Grip: Marlow NunezProduction Designer: Miranda Lorenz1st AD: Kenneth TaylorProduction Supervisor: Greg EpsteinProduction Coordinator: Danielle MandelDirector’s Assistant: Dylan DugasEditor: Janne VartiaAssistant Editor: Tim MontanaPost Production Supervisor: Alec Ernest Post Production Coordinator: Jeff WattersonColorist: Nicke Jacobsson Sound Designer: Akseli Soini @ El Camino HelsinkiAddt’l Sound Design: Anton Ahlberg @ Red Pipe Studios3D & Animation: Oscar BöckermanTitle Design: Aleksi TammiVFX: Flawless, MathematicSpecial thanks: Andreas Arvidsson & Ida Gündoğdu#TheWeeknd #AfterHoursMusic video by The Weeknd performing After Hours. © 2020 The Weeknd XO, Inc., manufactured and marketed by Republic Records, a division of UMG Recordings, Inc."
"K7ZI-EFJ-Uo","Lil Skies - Havin My Way (feat. Lil Durk) [Official Music Video]","2020-03-04T18:00:02.000Z","UCLEyFXOmaIgG6h4_6wqLx7Q","Lil Skies","10","20.05.03","Lil Skies|Atlantic Records|Lil Skies IG Live|Lil Skies Instagram|Lil Skies Leak|Lil Skies Havin My Way|Havin My Way|Lil SKies Lil Durk Havin My Way|Lil Skies Lil Durk|Lil Durk|lil skies new music|lil skies new song|lil skies lil durk new song|durkio|little skies|lil skys|lil skies having my way|having my way|lil skies lil durk having my ways|lil durk having my ways|green light|india|Prada you|homebody|bora bora|riots|weirdo|magic|red roses|sand","526991","76787","602","6894","https://i.ytimg.com/vi/K7ZI-EFJ-Uo/default.jpg","False","False","Lil Skies - Havin My Way (feat. Lil Durk) Stream/Download: https://lilskies.lnk.to/HavinMyWayID Subscribe for more official content from Lil Skies: https://1633.lnk.to/LilSkiesSubscribeFollow Lil Skieshttps://www.lilskiesofficial.comhttps://www.instagram.com/lilskies/https://twitter.com/lilskieshttps://soundcloud.com/lil-skieshttps://www.facebook.com/lilskiesofficialThe official YouTube channel of Atlantic Records artist Lil Skies. Subscribe for the latest music videos, performances, and more.Waynesboro, PA does not come to mind when you think of contributions to hip-hop, but Kimetrius “Lil Skies” Foose hopes to be that boundless rose to spring forth from the concrete.#LilSkies #LilDurk #HavinMyWay"
"2OvyA2__Eas","NCT 127 엔시티 127 '영웅 (英雄; Kick It)' MV","2020-03-04T15:00:13.000Z","UCEf_Bc-KVd7onSeifS3py9g","SMTOWN","10","20.05.03","nct127|영웅|kick it|neo zone|nct 영웅|bruce lee|nct 127 영웅|네오존|엔시티 127|smtown|nct","7915597","983372","22456","142469","https://i.ytimg.com/vi/2OvyA2__Eas/default.jpg","False","False","NCT 127's 2nd full album NCT #127 Neo Zone will be released on March 6th, 6PM (KST).✔Pre-order ➫ http://nct127.lnk.to/neozoneYT💚Subscribe to NCT 127 YouTube Channel!https://www.youtube.com/nct127?sub_confirmation=1NCT 127 Officialhttp://nct127.smtown.comhttp://www.youtube.com/nct127http://www.youtube.com/nctdailyhttp://www.facebook.com/NCT127.smtownhttp://www.instagram.com/nct127http://twitter.com/NCTsmtown_127#NCT127 #영웅 #KickIt #NeoZone #英雄NCT 127 엔시티 127 '영웅 (英雄; Kick It)' MV ℗ SM Entertainment"
"02xf1i0qPr8","BEHIND THE SCENES OF THE ACE FAMILY NEW MUSIC VIDEO!!! ( ONLY ONE )","2020-03-05T02:59:53.000Z","UCWwWOFsW68TqXE-HZLC3WIA","The ACE Family","22","20.05.03","the ace family behind the scenes of the ace family new music video|ace family behind the scenes of the ace family new music video|behind the scenes of the ace family new music video|behind the scenes music video|music video behind the scenes|behind the scenes ace family music video|the ace family|ace family|ace family music video|ace family music|music video","1080575","80447","1134","5525","https://i.ytimg.com/vi/02xf1i0qPr8/default.jpg","False","False","Behind the scenes of The ACE Family new music video!!! (Only One) Pre-save Only One now:  https://resources.lnk.to/OnlyOneIDDOWNLOAD ACE PLAY HERE: https://play.google.com/store/apps/details?id=com.jumpbuttonstudio.aceplayJOIN THE ACE FAMILY & SUBSCRIBE: http://bit.ly/THEACEFAMILYThe Ace Family store: http://shopacefamily.com LAST VIDEO: https://www.youtube.com/watch?v=l3_sEhYBErw&t=3s*TURN ON OUR POST NOTIFICATIONS FOR SHOUTOUTS IN OUR VIDEOS****BUSINESS INQUIRIES : INFO.THEACEFAMILY@GMAIL.COMMAKE SURE YOU LIKE, COMMENT, SHARE & SUBSCRIBE TO OUR YOUTUBE CHANNEL AND FOLLOW US ON OUR FAMILY ADVENTURES!WATCH MORE VIDEOS!!! VLOGS: https://youtube.com/playlist?list=PLq...PRANKS: https://youtube.com/playlist?list=PLq...CHALLENGES: https://youtube.com/playlist?list=PLq...POPULAR VIDEOS: https://youtube.com/playlist?list=PLq...LATEST VIDEOS: https://youtube.com/playlist?list=PLq... STALK US :)Catherine's Instagram: https://www.instagram.com/catherinepaiz/Catherine's Twitter: http://twitter.com/catherinepaizCatherine's SnapChat: Catherinepaiz"
"0PGlcDT_CRc","How coaches wanna act when their star player is failing","2020-03-04T23:26:27.000Z","UC4G10tk3AHFuyMIuD3rHOBA","RDCworld1","23","20.05.03","[none]","673827","93467","247","3641","https://i.ytimg.com/vi/0PGlcDT_CRc/default.jpg","False","False","3rd installment of the coaches series! Lol the coach deals with the star player not being able to play because of grades. Do you think this is how coaches wanna act? Like,comment, and Tag 3 friendsSocial Media all sites!: @supremedreams_1@RDCworld1 @ive_ben_jammin@Clean Uniform @23_is_leland@l0veandpeac3@dylanpatel4@playthatjohn"
"0rXUeoeIpQU","John Oliver Fought the Urge to Panic About Coronavirus Appearing in New York City","2020-03-04T11:00:00.000Z","UCVTyTA7-g9nopHeHbeuvpRA","Late Night with Seth Meyers","23","20.05.03","Late Night|Seth Meyers|John Oliver|Fought|Urge|Panic|About|Coronavirus|Appearing|New York City|NBC|NBC TV|television|funny|talk show|comedy|humor|stand-up|parody|snl seth meyers|host|promo|seth|meyers|weekend update|news satire|satire|John Oliver on Meyers|John Oliver interview|Last Week Tonight|Last Week Tonight with John Oliver|The Daily Show with Jon Stewart|news|current news|politics|Community|The Lion King|health|pandemic|epidemic","990427","15849","675","1233","https://i.ytimg.com/vi/0rXUeoeIpQU/default.jpg","False","False","John Oliver talks about coronavirus and his stint on an obscure British TV show.Subscribe to Late Night: http://bit.ly/LateNightSeth Watch Late Night with Seth Meyers Weeknights 12:35/11:35c on NBC. Get more Late Night with Seth Meyers: http://www.nbc.com/late-night-with-seth-meyers/ LATE NIGHT ON SOCIALFollow Late Night on Twitter: https://twitter.com/LateNightSethLike Late Night on Facebook: https://www.facebook.com/LateNightSethFollow Late Night Instagram: http://instagram.com/LateNightSethLate Night on Tumblr: http://latenightseth.tumblr.com/ Late Night with Seth Meyers on YouTube features A-list celebrity guests, memorable comedy, and topical monologue jokes. GET MORE NBCLike NBC: http://Facebook.com/NBCFollow NBC: http://Twitter.com/NBCNBC Tumblr: http://NBCtv.tumblr.com/YouTube: http://www.youtube.com/nbcNBC Instagram: http://instagram.com/nbctv John Oliver Fought the Urge to Panic About Coronavirus Appearing in New York City- Late Night with Seth Meyershttps://youtu.be/0rXUeoeIpQULate Night with Seth Meyershttp://www.youtube.com/user/latenightseth"
"6vmQXoTB0QE","Short film for Eternal Atake BabyPluto 🌟🛸","2020-03-04T00:57:52.000Z","UCqwxMqUcL-XC3D9-fTP93Mg","LIL UZI VERT","10","20.05.03","Lil|Uzi|Vert|lil uzi vert|lil uzi vert eternal atake|eternal atake|eternal awake|lil uzi eternal atake","2204873","215440","3353","23074","https://i.ytimg.com/vi/6vmQXoTB0QE/default.jpg","False","False","Short film for Eternal Atake BabyPluto 🌟🛸Gibson HazardConnect with Lil Uzi Vert:https://twitter.com/LILUZIVERThttps://www.instagram.com/liluzivert/https://www.facebook.com/LilUziVert/https://www.youtube.com/user/LILUZIVERThttp://liluziofficial.com/#LilUziVert #EternalAtake"
"RNjx45jC2eA","Justin Bieber Scares David Beckham","2020-03-04T14:00:04.000Z","UCp0hYYBW6IMayGgR-WeoCvQ","TheEllenShow","24","20.05.03","ellen|ellen degeneres|the ellen degeneres show|ellentube|season 17|episode 97|justin bieber|justin bieber ellen|justin bieber quavo|justin bieber performance|justin bieber ellen performance|justin bieber intentions|justin bieber changes|quavo|migos|umg|exclusive|ellentube exclusive|justin bieber interview|justin bieber quavo intentions|justin bieber scare|ellen scare|justin bieber ellen scare|david beckham|ellen david beckham|david beckham soccer|soccer","8536534","223193","5562","6405","https://i.ytimg.com/vi/RNjx45jC2eA/default.jpg","False","False","David Beckham explained to Ellen how his kids were the reason he ended up at Justin Bieber’s house on Halloween, and the pop star just happened to be waiting in the box to scare his friend! Plus, the soccer icon talked about how he can’t say no to his 8-year-old daughter Harper, and what he thinks about his wife Victoria calling him out on his lack of dance skills.#DavidBeckham#JustinBieber#Scare"
"fj3nstTudDo","#FreeTheDELETE Ep10 THE PREPARATION","2020-03-04T17:00:12.000Z","UCfldkV2SsADCyp3SlI1Q6Ug","MATTHARDYBRAND","22","20.05.03","FreeTheDELETE|Free The DELETE|Matt Hardy|BROKEN Matt|WOKEN Matt|Big Money Matt|V1|First Version|ICONIC Matt Hardy|Hardy Boyz|House Hardy|Queen Rebecca|King Maxel|Lord Wolfgang|Senor Benjamin|Maxel Hardy|Wolfie Hardy|Reby Sky|Reby Hardy|Jeff Hardy|Brother Nero|Vanguard 1|Skarsgard|Hardy Compound|Space and Time|Hardy Boys|Hardy Brothers|DELETE|OBSOLETE|WWE|WWF|AEW|TNA|IMPACT|ECW|ROH|NJPW|OMEGA|WOKEN DELETION|limbo","445605","23015","399","4011","https://i.ytimg.com/vi/fj3nstTudDo/default.jpg","False","False","In FREE THE DELETE Episode 10, Matt begins THE PREPARATION for his precarious plan to RESURRECT both ZENITH and his #BROKENBrilliance. All of the perilous pieces of Matt's prophetic puzzle come to fruition. Filmed and Edited by Reby HardyWritten and Created by Matt HardyProduced by Matt and Reby Hardy#MattHardy #HardyBoyz #BROKENMatt #HouseHardyhttp://www.YouTube.com/MATTHARDYBRANDhttp://www.twitter.com/MATTHARDYBRANDhttp://www.instagram.com/MATTHARDYBRAND"
"m3UlSk40Tkg","I BROKE THE FASTEST 40 YARD DASH RECORD AT MY OWN NFL COMBINE!","2020-03-05T00:02:03.000Z","UC4mLlRa_dezwvytudo9s1sw","Deestroying","24","20.05.03","db wr 1 on 1|deestroying|football|nfl|wide receiver|best catches|destroying|1 on 1|exposed|highschool football|7 on 7|one handed catch|nfl highlights|football highlights|highlight tape|deestroying highlights|donald de la haye highlights|antonio brown|dockery|xfl highlights|friday night lights|last chance high|donald de la haye|kicker|football vines|ab|logan paul diss track|nfl cobine|fastest 40 yard dash|40 yard dash|nfl combine 2020|nfl draft","399020","18250","490","1650","https://i.ytimg.com/vi/m3UlSk40Tkg/default.jpg","False","False","During my own NFL combine I ran the fastest 40 yard dash I've EVER ran!NEW MERCH WEBSITE : https://www.staytentoes.comFollow Us :Me : https://www.instagram/com/deestroying/Kiana : https://www.instagram.com/kianawudte/Trevor : https://www.instagram.com/trevorlosada/Coach Ryans : https://www.instagram.com/godfatherofspeed/SUB TO MY OTHER CHANNEL : https://www.youtube.com/channel/UCBNQjAJURDiuWHnJvd4f9DAFOLLOW MY SOCIAL MEDIA:Twitter : https://www.twitter.com/deestroyingIG : https://www.instagram.com/deestroying"
"rMBb93RmPXM","I Made FlightReact's Ankle Bleed... 1v1 Basketball!","2020-03-04T20:30:19.000Z","UCxEUEkp5y728nY57wg8z3dw","Tristan Jass","24","20.05.03","t jass vs flight|tristan jass vs flight|flight vs t jass|flight vs tristan jass|t jass 1v1|tristan jass|tristan jass 1v1|1v1 basketball|t jass makes flights ankle bleed|trash talker gets exposed|trash talker basketball|nba basketball|flight reacts|flight reacts 1v1|notyouraverageflight|cash nasty|cash nasty flight reacts|nerd plays basketball|basketball in the hood|flight reacts exposed|nerd plays basketball at venice beach|i made flights ankle bleed","368159","22855","276","1934","https://i.ytimg.com/vi/rMBb93RmPXM/default.jpg","False","False","I finally played Flight Reacts 1v1... His ankle started bleeding...▼Connect With Tristan Jass▼https://twitter.com/tristanjass/https://www.youtube.com/tristanjasshttps://www.instagram.com/tristanj22/https://www.facebook.com/pg/tristanjass22/about/▼Follow T Jass Brand▼https://www.instagram.com/tjassbrand/https://twitter.com/tjassbrandFollow FlightReactshttps://instagram.com/flight23white_https://twitter.com/Flight23Whitehttps://www.youtube.com/channel/UC_k0qgMNIW2VmTQKjFsbXDw"
"0lapF4DQPKQ","BTS (방탄소년단) 'Black Swan' Official MV","2020-03-04T15:00:02.000Z","UC3IZKseVpdzPSBaWxBxundA","Big Hit Labels","10","20.05.03","BIGHIT|빅히트|방탄소년단|BTS|BANGTAN|방탄","19555584","4153628","30415","379067","https://i.ytimg.com/vi/0lapF4DQPKQ/default.jpg","False","False","BTS (방탄소년단) 'Black Swan' Official MVCredits:Director : YongSeok Choi (Lumpens)Co-Director : Guzza (Lumpens)Assistant Director : Jihye Yoon (Lumpens)Executive Producer / Producer : Tiffany SuhDirector of Photography : Hyunwoo Nam (GDW)Focus Puller : Sangwoo YoonB Cam : Eumko2nd AC : Eunki KimCamera Crew : Robin Kim, Isue shin, Alec Echaverria, Matt MaioJIB Operator : YoungJoong Kim, Hyun In KimCo-production company : FREENJOYExecutive Producer : Nathan ScherrerProduction Supervisor : Sina Pars, Joe KeenanProduction Coordinator : Matt KovacsClient Liaison : Ran Ro1st AD : Joe Suarez2nd AD Liaison : Joseph KimLocation Manager : Laura DominguezGaffer : Kyle BrysonKey Grip : Wadsworth PetersColor : Company 3Colorist : Charles BunnagSenior Producer : Gabriel WakemanAssociate Producer : Bianca YiVisual Creative : Nu Kim, Sabinne Cheon, Lee Sun Kyoung, Kim Ga EunPerformance Directing : Son Sung Deuk, Lee Ga Hun, Lee Byung EunArtist Management : Kim Shin Gyu, Kim Su Bin, Park Jun Tae, An Da Sol, Ahn Jong Hun, Lee Jung MinBig Hit Entertainment. Rights are reserved selectively in the video. Unauthorized reproduction is a violation of applicable laws. Manufactured by Big Hit Entertainment, Seoul, Korea.Connect with BTS: https://ibighit.com/bts http://twitter.com/BTS_bighithttp://twitter.com/BTS_twt http://www.facebook.com/bangtan.official https://www.youtube.com/user/BANGTANTV http://instagram.com/BTS.bighitofficial https://channels.vlive.tv/FE619 https://www.tiktok.com/@bts_official_bighit  https://app.weverse.io/gpt4o https://www.weibo.com/BTSbighithttps://www.weibo.com/BTSmembers http://i.youku.com/btsofficial http://btsblog.ibighit.com   #BTS #방탄소년단 #BlackSwan #MAP_OF_THE_SOUL_7 #MV"
"y8c_mAxW7QI","A One-Year Update From Alex | JEOPARDY!","2020-03-04T15:59:58.000Z","UCnxxhf9PSA3VJ4Q80pWJoow","Jeopardy!","24","20.05.03","Alex Trebek (TV Personality)|double jeopardy!|exclusive jeopardy|Jeopardy questions|think music|Jeopardy! best moments|tv program|Merv Griffin|Official Jeopardy!|let's play|Game Show (TV Genre)|reality games|play jeopardy|Jeopardy! (TV Program)|jeopardy!","507759","25878","120","1719","https://i.ytimg.com/vi/y8c_mAxW7QI/default.jpg","False","False","A one-year update from Alex.Subscribe to Jeopardy!'s official YouTube channel for more: http://bit.ly/JSubscribe_YT JEOPARDY! ON SOCIAL:Like JEOPARDY! on Facebook: http://bit.ly/2AuJ6kX Follow JEOPARDY! on Twitter: http://bit.ly/2kjdBq8 Follow JEOPARDY! on Instagram: http://bit.ly/2AKTpnq #Jeopardy! #AlexTrebek MORE JEOPARDY!:Find Your Station: http://bit.ly/2BIOtxc Play J!6: http://bit.ly/2AtJVdTPlay JEOPARDY! World Tour on Google Play: https://t.co/J2P6b0JLdT Play JEOPARDY! World Tour on iTunes: http://apple.co/2ASWeU1More from JEOPARDY!: https://www.jeopardy.com/JEOPARDY! provides a test of knowledge across a variety of interesting subjects such as literature, history, science, the arts, and pop culture.For the latest news and editorial features from JEOPARDY! go to https://www.jeopardy.com/jbuzz/ ABOUT JEOPARDY!JEOPARDY!, America’s Favorite Quiz Show®, and its host, Alex Trebek, began their 34th season in syndication on September 11, 2017. With 23 million viewers each week, JEOPARDY! is the top-rated quiz show on television, and has won many awards and distinctions over the course of its 30+ years on the air, including the 2017 Emmy for Outstanding Game Show. The show holds a Guinness World Records® record for the most Emmy® Awards won by a TV game show (34 Emmys). In 2014, JEOPARDY! won the inaugural Writers Guild of America award for Outstanding Writing for a Quiz and Audience Participation Show; it is also the recipient of a 2011 Peabody Award. JEOPARDY! is produced by Sony Pictures Television, a Sony Pictures Entertainment Company; it is distributed domestically by CBS Television Distribution and internationally by CBS Television International, both units of CBS Corp."
