video_id,title,publishedAt,channelId,channelTitle,categoryId,trending_date,tags,view_count,likes,dislikes,comment_count,thumbnail_link,comments_disabled,ratings_disabled,description
"cAVgKdbDlRY","Leaving the Spotlight - Justin Bieber: Seasons","2020-01-27T17:00:11.000Z","UCIwFjwMjI0y7PDBVEO9-bkQ","Justin Bieber","24","20.01.02","Justin Bieber|Justin Biber: Seasons|Music|Yummy|Musician|Artist|Singer|Documentary|Docu-series","24196891","702935","33230","27337","https://i.ytimg.com/vi/cAVgKdbDlRY/default.jpg","False","False","A look back at Justin’s life after cancelling the last leg of his Purpose Tour. You choose how you want to watch - get early access to new episodes and watch the series ad-free with YouTube Premium or watch two new episodes each week with ads for free on YouTube. Learn more at https://support.google.com/youtube/answer/6358146. Check out YouTube Premium at: https://www.youtube.com/premium/originals See if Premium is available in your country at: https://support.google.com/youtube/answer/6307365"
"eYSmNP3woow","Husband Of Woman Killed Along With Kobe Bryant Speaks Out | TODAY","2020-01-27T14:55:39.000Z","UChDKyKQ59fYz3JO2fl0Z6sg","TODAY","25","20.01.02","Sports|News|Editor's picks|Big News|Kobe Bryant|The TODAY Show|TODAY Show|TODAY|TODAY Show Interview|TODAY show news|the latest on today|helicopter crash|Gianna|Christina Mauser|basketball coach|Crash Victim|Crash Victim Speaks|kobe's Basketball Academy|Hoda|tragic helicopter crash|kobe bryant death|kobe bryant news|kobe bryant helicopter crash|kobe bryant crash|kobe helicopter crash|kobe death|Christina Chopper Crash|Chopper Crash|Matt Mauser","3781542","53514","1626","8312","https://i.ytimg.com/vi/eYSmNP3woow/default.jpg","False","False","The tragic helicopter crash that killed Kobe Bryant and his 13-year-old daughter Gianna also killed seven others, including Christina Mauser, who was a basketball coach at the school Bryant’s daughters attended. Joining TODAY by phone, her husband Matt Mauser says “she was extraordinary … he picked her because she was amazing.”» Subscribe to TODAY: http://on.today.com/SubscribeToTODAY» Watch the latest from TODAY: http://bit.ly/LatestTODAYAbout: TODAY brings you the latest headlines and expert tips on money, health and parenting. We wake up every morning to give you and your family all you need to start your day. If it matters to you, it matters to us. We are in the people business. Subscribe to our channel for exclusive TODAY archival footage & our original web series.  Connect with TODAY Online!Visit TODAY's Website: http://on.today.com/ReadTODAYFind TODAY on Facebook: http://on.today.com/LikeTODAYFollow TODAY on Twitter: http://on.today.com/FollowTODAYFollow TODAY on Instagram: http://on.today.com/InstaTODAYFollow TODAY on Pinterest: http://on.today.com/PinTODAY#KobeBryant #ChristinaMauser #TodayShowHusband Of Woman Killed Along With Kobe Bryant Speaks Out | TODAY"
"Pza4XfYsWQI","De'arra Said YES To The Dress!!! | PART 1","2020-01-28T00:20:47.000Z","UCYL9lSER7W0kMXbGCprMS0A","Vlogs By DK4L","22","20.01.02","extravaganza|extravaganza part 1|part 1 of|part 1 video|dk4l engagement|dk4lengagement|De'arra and ken|De'arra engagement|dearra engagement|engagement video|engaged|dk4l|dk4l vlogs|dk4l vlog|dk4l challenges|dk4l challenge|de'arra|ken","737739","52104","385","2347","https://i.ytimg.com/vi/Pza4XfYsWQI/default.jpg","False","False","Part 1 of our Engagement Extravaganza!!!!*FOLLOW US AROUND THE WORLD* (travel vlogs) ⇣ https://bit.ly/2sd3yDKSUBSCRIBE TO OUR MAIN CHANNEL FOR CHALLENGES, PRANKS, STORY TIMES & MORE ⇢ http://bit.ly/2a01NmhSTALK US :)De’arra Instagram: https://www.instagram.com/dearra/Ken's Instagram: https://Instagram.com/kenw/Facebook: https://www.facebook.com/dearra.ken/De’arra Twitter:https://twitter.com/dearraKen’s Twitter: https://twitter.com/dk4lSnapchat: dk_4l Age: De’arra: 23Ken: 25#DK4L"
"bbQ8I-ztij8","Lil Tecca - Shots (Official Music Video)","2020-01-27T21:53:30.000Z","UCOlxqtcKc-HBEQJgDsylyhA","Lil Tecca","10","20.01.02","Lil Tecca|Shots|We Love You Tecca|Tecca|Hip Hop|Rap|Music|Ransom","3358176","232216","2854","11684","https://i.ytimg.com/vi/bbQ8I-ztij8/default.jpg","False","False","Prod. Taz Taylor & Nick MiraDirected by: Omar Jones (@freeomarjones)Produced by: ATLAS ProductionsConnect with Lil Tecca:http://www.liltecca.comhttps://www.instagram.com/lilteccahttps://www.twitter.com/lilteccahttps://www.facebook.com/lilteccahttps://www.soundcloud.com/lilteccahttps://open.spotify.com/artist/4Ga1P7PMIsmqEZqhYZQgDo?si=Yeu4x1HITES_zKueo3-o4Ahttps://music.apple.com/us/artist/lil-tecca/1366503504#LilTecca #Shots #WeLoveYouTecca"
"mjrQR1X_52k","Ariana Grande: Imagine, 7 Rings & thank u, next | 2020 GRAMMYs Performance","2020-01-28T03:56:45.000Z","UCq4isO8ZYOZfmvGJ-_1UdIA","Recording Academy / GRAMMYs","10","20.01.02","grammy awards|grammys|grammy|album of the year|record of the year|song of the year|grammys red carpet|grammy red carpet|2020 grammys|62nd grammys|unexpect everything|ariana grande grammys|ariana grande 2020 grammys|ariana grande grammy performance|ariana grande thank you next grammys|ariana grande 7 rings|ariana grande imagine grammys","970447","17045","1139","1059","https://i.ytimg.com/vi/mjrQR1X_52k/default.jpg","False","False","Watch Ariana Grande’s performance of Imagine, 7 Rings and thank u, next on the 62nd  GRAMMY Awards.Full performance: https://bit.ly/313XYnBAbout the Recording Academy / GRAMMYs: Recording Academy is the world's leading society of musical professionals, and is dedicated to celebrating, honoring, and sustaining music's past, present and future. Connect with the Recording Academy / GRAMMYs: WEBSITE: http://www.grammy.comFACEBOOK: http://grm.my/2gcTcMk TWITTER: http://grm.my/2gDUHUD  INSTAGRAM: http://grm.my/2gZGIvJ Subscribe NOW to the Recording Academy / GRAMMYs on YouTube: http://grm.my/1dTBF8H#GRAMMYs #GRAMMYAwards #UnexpectEverything #GRAMMYs2020 #ArianaGrande #Imagine #7rings #thankyounext"
"6ekKPXlFJjY","Conan Remembers Kobe Bryant - CONAN on TBS","2020-01-28T03:11:15.000Z","UCi7GJNg51C3jgmYTUwqoUXA","Team Coco","23","20.01.02","Conan O'Brien|Conan|Conan (TV Series)|TBS (TV Channel)|Team Coco","2625177","77245","1021","3425","https://i.ytimg.com/vi/6ekKPXlFJjY/default.jpg","False","False","Conan says a few words about Kobe Bryant; an incredibly gifted athlete and a great talk show guest.More CONAN @ http://teamcoco.com/videoTeam Coco is the official YouTube channel of late night host Conan O'Brien, CONAN on TBS & TeamCoco.com. Subscribe now to be updated on the latest videos: http://bit.ly/W5wt5DFor Full Episodes of CONAN on TBS, visit http://teamcoco.com/videoGet Social With Team Coco:On Facebook: ‪https://www.facebook.com/TeamCoco‬On Google+: https://plus.google.com/+TeamCoco/On Twitter: http://twitter.com/TeamCocoOn Tumblr: http://teamcoco.tumblr.comOn YouTube: http://youtube.com/teamcocoFollow Conan O'Brien on Twitter: http://twitter.com/ConanOBrien"
"f2LhYccWWQI","Meek Mill - Letter to Nipsey (feat. Roddy Ricch) [Official Audio]","2020-01-27T05:00:05.000Z","UC9HlWVtENbiMQzVRmnbJxtw","Meek Mill","10","20.01.02","meek mill|meek|mill|hip hop|rap|atlantic|atlantic records|wins & losses|dreams worth more than money|stay woke|dangerous|champions|championship|championship rings|Intro|trauma|uptwon vibes|on me|cardi b|whats free|Respect the game|going bad|drake|almost slipped|tic tac toe|24/7|pay you back|21 savage|100 summers|wit the shits|stuck in my ways|cold hearted ii|meek mill letter to nipsey roddy ricch|letter to nipsey|nipsey hussle","2998014","143299","1559","5610","https://i.ytimg.com/vi/f2LhYccWWQI/default.jpg","False","False","Meek Mill -  Letter to Nipsey (feat. Roddy Ricch)All proceeds from sales and streams of Letter to Nipsey will benefit Nipsey's family.Stream/Download: https://MeekMill.lnk.to/LetterToNipseyIDSubscribe for more official content from Meek Mill:https://MeekMill.lnk.to/subscribeFollow Meek Millhttp://meekMill.comhttp://twitter.com/MeekMillhttp://facebook.com/MeekMillhttp://instagram.com/MeekMillhttps://soundcloud.com/meek-mill-dcThe official YouTube channel of Atlantic Records artist Meek Mill. Subscribe for the latest music videos, performances, and more.#LetterToNipsey #TheMarathonContinues"
"acQE-RUe-vQ","Most ODDLY SATISFYING Video to watch before sleep","2020-01-27T21:28:07.000Z","UCpB959t8iPrxQWj7G6n0ctQ","SSSniperWolf","24","20.01.02","sssniperwolf|sniper wolf|reacting|reaction|funny|satisfying|satisfying video|satisfying slime|oddly satisfying video|oddly satisfying|oddly|asmr|relax|satisfying videos","4182462","151388","6892","7185","https://i.ytimg.com/vi/acQE-RUe-vQ/default.jpg","False","False","Most ODDLY SATISFYING Video to watch before sleep! What was the most satisfying thing in this video that made you relax? Leave a Like if you enjoyed! Watch the last one https://youtu.be/Oe-se_N04Rg Subscribe to join the Wolf Pack and enable notifications! http://bit.ly/SubSSSniperWolfInstagram: http://instagram.com/sssniperwolfTwitter: http://www.twitter.com/sssniperwolfFacebook: https://www.facebook.com/sssniperwolfOfficial Merch: https://ogwolfpack.com/"
"YE4JaQ_EVi4","NBA Legend Kobe Bryant Dies at 41","2020-01-27T23:00:07.000Z","UCv7YFWATebnJ1ty4cwMKgsQ","The Wendy Williams Show","24","20.01.02","wendy williams|the wendy williams show|#youtubeblack|entertainment|celebrity news|talk show","1563594","21776","1508","3541","https://i.ytimg.com/vi/YE4JaQ_EVi4/default.jpg","False","False","Kobe Bryant and his 13-year-old daughter Gianna were killed in a helicopter crash early Sunday morning in California.They were on their way to Gianna’s basketball game. Nine people were on board and there were no survivors.Kobe leaves behind his wife Vanessa, and his 3 daughters.Then, an MSNBC anchor apologized after appearing to us the N-word while covering Kobe Bryant’s death.Plus, Kobe was honored throughout the Grammys. Host, Alicia Keys brought out Boyz II Men to sing “It’s So Hard to Say Goodbye.”The big winner of the night was Billie Eilish. She won five Grammys, including the big 4, Album, Record, Song of the Year and Best New Artist._#WendyWilliamsFollow Wendy See it first. See it now. Only at https://www.WendyShow.comhttps://www.Facebook.com/WendyShowhttps://www.Instagram.com/WendyShowhttps://www.Twitter.com/WendyWilliams"
"fss9Az1u3bA","Randy Orton unleashes a ruthless steel chair assault on Edge: Raw, Jan. 27, 2020","2020-01-28T05:18:54.000Z","UCJ5v_MCY6GNUBTO8-D3XoAg","WWE","17","20.01.02","wwe|world wrestling entertainment|wrestling|wrestler|wrestle|superstars|कुश्ती|पहलवान|डब्लू डब्लू ई|मैच|सुपरस्टार|व्यावसायिक कुश्ती|مصارعه|Raw|Edge|Randy Orton|wwe royal rumble 2020 live|wwe edge returns|wrestling highlights|edge returns|edge returns to raw|wwe raw|randy orton attacks edge|wwe monday night raw|wwe raw highlights today|wwe raw highlights|wwe raw highlights 2020|randy orton rko|wwe randy orton attacks edge|conchairto wwe|edge conchairto","2756152","59918","2894","7306","https://i.ytimg.com/vi/fss9Az1u3bA/default.jpg","False","False","One night after Edge’s dramatic in-ring comeback during the 2020 Men’s Royal Rumble Match, The Viper ruthlessly attacks The Rated-R Superstar with a steel chair.#RAW #EdgeReturnsGET YOUR 1st MONTH of WWE NETWORK for FREE: http://wwe.yt/wwenetwork---------------------------------------------------------------------Follow WWE on YouTube for more exciting action!---------------------------------------------------------------------Subscribe to WWE on YouTube: http://wwe.yt/Check out WWE.com for news and updates: http://goo.gl/akf0J4Watch WWE on Sony in India: http://www.wwe.com/SonySportsNetworkFind the latest Superstar gear at WWEShop: http://shop.wwe.com---------------------------------------------Check out our other channels!---------------------------------------------The Bella Twins: https://www.youtube.com/thebellatwinsUpUpDownDown: https://www.youtube.com/upupdowndownWWEMusic: https://www.youtube.com/wwemusicTotal Divas: https://www.youtube.com/wwetotaldivas------------------------------------WWE on Social Media------------------------------------Twitter: https://twitter.com/wweFacebook: https://www.facebook.com/wweInstagram: https://www.instagram.com/wwe/Reddit: https://www.reddit.com/user/RealWWEGiphy: https://giphy.com/wwe------------------------------------WWE Podcasts------------------------------------After the Bell with Corey Graves: http://bit.ly/afterthebellpodcastThe New Day: Feel the Power: https://link.chtbl.com/7Fp6uOqk"
"UDngGivE99c","Stars Give Love to Kobe Bryant, 'It's Just Tragic' | TMZ","2020-01-27T15:04:06.000Z","UCK7IIV6Q2junGSdYK3BmZMg","TMZ","24","20.01.02","TMZ|Hollywood|Celebrity|Entertainment|Entertainment News|TMZ Sports|TMZ Live|TMZ TV|kobe|kobe bryant|kobe death|kobe bryant death|kobe helicopter|kobe daughter|mama|kobe tmz|kobe video|kobe update|kobe news|lakers|kobe highlights|tmz|jay-z|cardi b|the game|lebron|lebron james|shaq","1272537","18813","2018","3055","https://i.ytimg.com/vi/UDngGivE99c/default.jpg","False","False","The biggest stars in the world -- from all walks of life -- are mourning the death of Kobe Bryant ... from Mark Wahlberg to Jay-Z, The Game, Lil' Kim and more.Of course, everyone happened to be in L.A. for the Grammys ... but Kobe was clearly on everyone's mind.Some of the stars remembered Kobe as a hero. Others focused on the tragedy that caused his death.SUBSCRIBE: http://po.st/TMZSubscribeAbout TMZ:TMZ has consistently been credited for breaking the biggest stories dominating the entertainment news landscape and changed the way the public gets their news. Regularly referenced by the media, TMZ is one of the most cited entertainment news sources in the world. Subscribe to TMZ on YouTube for breaking celebrity news/ gossip and insight from the newsroom staff (TMZ Chatter & TMZ News), the best clips from TMZ on TV, Raw & Uncut TMZ paparazzi video (from TMZ.com) and the latest video from TMZ Sports and TMZ Live! Keeping Up with Our YouTube Exclusive Content:TMZ Chatter: TMZ newsroom staff insight and commentary from stories/ photos/ videos on TMZ.com TMZ News: The latest news you need to know from TMZ.comRaq Rants: Raquel Harper talks to a celebrity guest with ties to the hip hop and R&B communities.Behind The Bar Podcast: TMZ's lawyers Jason Beckerman and Derek Kaufman loiter at the intersection of law and entertainment, where they look closely at the personalities, events and trends driving the world of celebrity — and how the law affects it all.We love Hollywood, we just have a funny way of showing it.Need More TMZ?TMZ Website: http://po.st/TMZWebsiteLIKE TMZ on Facebook! http://po.st/TMZLikeFOLLOW TMZ on Twitter! http://po.st/TMZFollowFOLLOW TMZ on Instagram! http://po.st/TMZInstaTMZ on TV & TMZ Sports on FS1 Tune In Info: http://po.st/TMZOnAirTMZ is on iOS! http://po.st/TMZiOSTMZ is on Android! http://po.st/TMZonAndroidGot a Tip?Contact TMZ: http://po.st/TMZTipCheck out TMZ Live, TMZ Sports and toofab!TMZ Live: http://po.st/TMZLiveWebsiteSubscribe! TMZ Live: http://po.st/TMZLiveSubscribeTMZ Sports: http://po.st/TMZSportsWebsiteSubscribe! TMZ Sports: http://po.st/TMZSportsSubscribeToofab: http://po.st/toofabWebsiteSubscribe! toofab: http://po.st/toofabSubscribehttps://www.youtube.com/c/TMZ"
"-c2afF2euq4","SIDEMEN REVERSE HIDE & SEEK ON A PRIVATE ISLAND","2020-01-28T19:00:00.000Z","UCh5mLn90vUaB1PbRRx_AiaA","MoreSidemen","22","20.01.02","[none]","1836808","97090","950","2795","https://i.ytimg.com/vi/-c2afF2euq4/default.jpg","False","False","• Sidemen: http://www.youtube.com/Sidemen• Sidemen Clothing: http://www.sidemenclothing.com• Sidemen Twitter: https://twitter.com/Sidemen----------------------------------------------------------------------Sidemen:• Miniminter: http://www.youtube.com/Miniminter• Zerkaa: http://www.youtube.com/Zerkaa• Behzinga: http://www.youtube.com/Behzinga• Vikkstar123: http://www.youtube.com/Vikkstar123• TBJZL: http://www.youtube.com/TBJZL• Wroetoshaw: http://www.youtube.com/Wroetoshaw• KSI: http://www.youtube.com/KSIedited by https://twitter.com/TegsRFoutro song https://www.youtube.com/watch?v=3O7FQdHrHLM"
"OTTWedyp37o","Kobe Bryant's BEST 100 Plays & Moments Of His NBA Career","2020-01-27T23:23:33.000Z","UCqQo7ewe87aYAe7ub5UqXMw","House of Highlights","17","20.01.02","kobe bryant|kobe bryant highlights|kobe bryant top 100 plays|kobe bryant best 100 plays|kobe bryant best plays|los angeles lakers|nba|basketball|kobe bryant tribute|kobe|bryant|kobe best plays|best kobe moments","1821708","54568","482","3686","https://i.ytimg.com/vi/OTTWedyp37o/default.jpg","False","False","RIP to the legend, Kobe Bryant.Check out a tribute video to Kobe Bryant's best & top 100 plays, highlights & moments of his NBA career for the Los Angeles Lakers."
"IgReQBE0kaM","Memes That My Older Relatives Post On Facebook","2020-01-27T18:00:03.000Z","UCSUf5_EPEfl4zlBKZHkZdmw","Danny Gonzalez","23","20.01.02","danny gonzalez|funny|commentary|comedy|react|reaction|reacting|awful|humor|memes|old|people|boomer|facebook","1797894","134090","1387","10027","https://i.ytimg.com/vi/IgReQBE0kaM/default.jpg","False","False","Go to https://expressvpn.com/dannygonzalez and find out how you can get 3 months free.share if you doSupport MeMERCH ► http://dannygonzalez.storeFollow MeINSTAGRAM ► https://www.instagram.com/dannygonzalez/TWITTER ► https://twitter.com/dannygonzalezSECOND CHANNEL ► https://www.youtube.com/c/2Danny2FuriousSPOTIFY ► https://open.spotify.com/artist/6pDkmNhHCLh7YEb3sXceOs?si=8ZpMgF41SoufOS1UZ4vbkgWHY DO I CALL MY FANS GREG?Greg is the strongest family on the internet, we're the fastest growing channel on Youtube, and we make fire content. So, instead of making up some pun using my name and calling my fans that, I decided to use a different name entirely. A name so strong, haters tremble when it is spoken. WE ARE GREG. AND WE ARE TAKING OVER THE INTERNET. And all you have to do to join is hit subscribe and turn on notifications. #dannygonzalez"
"D4HPie3aNKA","Colin Cowherd is moved to tears reflecting on Kobe's legacy & impact | THE HERD | LIVE FROM MIAMI","2020-01-27T18:49:21.000Z","UCFDidMd82mpDkKijLUqHp7A","The Herd with Colin Cowherd","17","20.01.02","fox|fox sports|fs1|fox sports 1|colin cowherd|cowherd|colin|the herd|sports|news|joy|taylor|joy taylor|nba|basketball|kobe bryant|kobe|los angeles lakers|lakers|gianna bryant|kobe death|kobe bryant death|Kobe Bryant helicopter crash|Kobe daughter|Gianna death|Gianna Bryant death|Bryant death|Bryant helicopter crash|Kobe helicopter crash|Kobe Bryant crash|Bryant crash|Kobe crash|Bryant|Gianna Bryant crash","1479494","24223","601","1921","https://i.ytimg.com/vi/D4HPie3aNKA/default.jpg","False","False","Colin Cowherd discusses Kobe Bryant after his and his daughter's tragic deaths. Hear what Colin thought Kobe meant to the game, what his legacy will be and what his loss means to the game of basketball.#TheHerd #NBA #KobeBryant SUBSCRIBE to get all the latest content from The Herd: http://foxs.pt/SubscribeTHEHERD  ►Watch the latest content from The Herd: http://foxs.pt/LatestOnTheHerd ►Watch our favorite content on “Best of The Herd”: http://foxs.pt/BestOnTheHerd ▶First Things First's YouTube channel: http://foxs.pt/SubscribeFIRSTTHINGSFIRST►UNDISPUTED’s YouTube channel: http://foxs.pt/SubscribeUNDISPUTED ►Speak for Yourself’s YouTube channel: http://foxs.pt/SubscribeSPEAKFORYOURSELF ▶Fair Game with Kristine Leahy’s YouTube channel: http://foxs.pt/SubscribeFAIRGAMESee more from THE HERD: http://foxs.pt/THEHERDFoxSports Like THE HERD on Facebook: http://foxs.pt/THEHERDFacebook Follow THE HERD on Twitter: http://foxs.pt/THEHERDTwitter Follow THE HERD on Instagram: http://foxs.pt/THEHERDInstagram Follow Colin Cowherd on Twitter: http://foxs.pt/ColinCowherdTwitter  About The Herd with Colin Cowherd:The Herd with Colin Cowherd is a three-hour sports television and radio show on FS1 and iHeartRadio. Every day, Colin will give you his authentic, unfiltered opinion on the day’s biggest sports topics.Colin Cowherd is moved to tears reflecting on Kobe's legacy & impact | THE HERD | LIVE FROM MIAMIhttps://youtu.be/D4HPie3aNKAThe Herd with Colin Cowherdhttps://www.youtube.com/c/colincowherd"
"bTCQhMMfse0","Junk Food","2020-01-26T17:29:05.000Z","UCo8bcnLyZH8tBIH9V1mLgqQ","TheOdd1sOut","23","20.01.02","Junk Food|cereal|honey nut cheerios|soda|carrots|M&Ms|London|health|diet|animation|cartoon|funny|theodd1sout|theoddisout|theoddonesout","14105551","732042","9585","81717","https://i.ytimg.com/vi/bTCQhMMfse0/default.jpg","False","False","Are you an MMMM Candy bar, because you're so sweet 💖💖💖 Pre-Order my book ➤ https://theodd1sout.com/pages/the-first-sequel Second Channel ➤ https://www.youtube.com/channel/UC0GLNhtTu7yI8rl6ZZGeezw Additional artists: GetMadz ➤ https://www.youtube.com/user/TheMadz2012 Rushlight Invader ➤ https://www.youtube.com/user/RushLightInvader Annie Loomis ➤ https://twitter.com/annieloomisart AntiDarkHeart ➤ https://twitter.com/AntiDarkHeart PantslessPajamas ➤ https://www.youtube.com/channel/UCR0O-1cvuPNxDosvSDLpWHg Hexrin ➤ https://twitter.com/hexriin Kat ➤ https://twitter.com/NineDoodles funymony ➤ https://www.youtube.com/user/funymony Second channel ➤ https://www.youtube.com/channel/UC0GLNhtTu7yI8rl6ZZGeezw Twitter ➤ https://twitter.com/Theodd1sout Instagram ➤ https://www.instagram.com/theodd1sout/ Website/Merch ➤ https://theodd1sout.com/ SomethingElseYt ➤ https://www.youtube.com/user/trolldawgz GetMadz ➤ https://www.youtube.com/user/TheMadz2012"
"8Nz1m4U3UmY","Sober Convos: Prisoners & Trolleys","2020-01-28T02:19:29.000Z","UCn1XB-jvmd9fXMzhiA6IR0w","Domics","23","20.01.02","domics|animation|prisoners|hypothetical|trolleys|moral|funny|podcast|audible|life|death","1091043","76273","784","4221","https://i.ytimg.com/vi/8Nz1m4U3UmY/default.jpg","False","False","Start listening with a 30-day Audible trial. Choose 1 audiobook and 2 Audible Originals absolutely free. Visit http://www.audible.com/domics or text domics to 500 500.  Kressh: https://www.instagram.com/_kressh/Jomm: https://twitter.com/FlashJomm | https://www.instagram.com/jommish/ Additional Animators: Aaron Estrada: https://www.instagram.com/aeron_estrada Ehlboy: https://www.youtube.com/ehlboyJommChristopher Carlone YT: https://www.youtube.com/carlonec Website: http://www.christophercarlone.com/ Check out GG! Gaming Cafe https://www.gggaming.ca/ ~Follow me!~ TWITTER: https://twitter.com/OmNomDomz FACEBOOK: http://www.facebook.com/domics.me INSTAGRAM: https://www.instagram.com/omnomdomz/"
"1ZFGq_ghfoU","Remembering Kobe Bryant | The View","2020-01-27T16:20:26.000Z","UCeH6qE4V7n5tVwP7NkdrtJg","The View","24","20.01.02","The View|Whoopi Goldberg|Joy Behar|Meghan McCain|Sunny Hostin|Kobe Bryant|NBA|Los Angeles Lakers|Legend","822156","10839","323","1248","https://i.ytimg.com/vi/1ZFGq_ghfoU/default.jpg","False","False","REMEMBERING KOBE BRYANT: The co-hosts look back on the life of the NBA legend who tragically lost his life in a helicopter accident Sunday along with his 13-year-old daughter and seven others. abcn.ws/36vCfpUSubscribe to our YouTube channel: http://bit.ly/2Ybi4tM MORE FROM 'THE VIEW':Full episodes: http://abcn.ws/2tl10qhTwitter: http://twitter.com/theviewFacebook: http://facebook.com/TheViewInstagram: http://instagram.com/theviewabc"
