video_id,title,publishedAt,channelId,channelTitle,categoryId,trending_date,tags,view_count,likes,dislikes,comment_count,thumbnail_link,comments_disabled,ratings_disabled,description
"Qasm0iuoy7k","McConnell, Schumer address Soleimani airstrike, impeachment on Senate floor","2020-01-03T18:03:06.000Z","UCXIJgqnII2ZOINSWNOGFThA","Fox News","25","20.04.01","[none]","1078296","14179","4504","6450","https://i.ytimg.com/vi/Qasm0iuoy7k/default.jpg","False","False","Senate to reconvene as impeachment impasse continues. #FoxNews FOX News operates the FOX News Channel (FNC), FOX Business Network (FBN), FOX News Radio, FOX News Headlines 24/7, FOXNews.com and the direct-to-consumer streaming service, FOX Nation. FOX News also produces FOX News Sunday on FOX Broadcasting Company and FOX News Edge. A top five-cable network, FNC has been the most watched news channel in the country for 17 consecutive years. According to a 2018 Research Intelligencer study by Brand Keys, FOX News ranks as the second most trusted television brand in the country. Additionally, a Suffolk University/USA Today survey states Fox News is the most trusted source for television news or commentary in the country, while a 2017 Gallup/Knight Foundation survey found that among Americans who could name an objective news source, FOX News is the top-cited outlet. FNC is available in nearly 90 million homes and dominates the cable news landscape while routinely notching the top ten programs in the genre. Subscribe to Fox News!  https://bit.ly/2vBUvASWatch more Fox News Video: http://video.foxnews.comWatch Fox News Channel Live: http://www.foxnewsgo.com/Watch full episodes of your favorite showsThe Five: http://video.foxnews.com/playlist/longform-the-five/Special Report with Bret Baier: http://video.foxnews.com/playlist/longform-special-report/The Story with Martha Maccallum: http://video.foxnews.com/playlist/longform-the-story-with-martha-maccallum/Tucker Carlson Tonight: http://video.foxnews.com/playlist/longform-tucker-carlson-tonight/Hannity:  http://video.foxnews.com/playlist/longform-hannity/The Ingraham Angle: http://video.foxnews.com/playlist/longform-the-ingraham-angle/Fox News @ Night: http://video.foxnews.com/playlist/longform-fox-news-night/ Follow Fox News on Facebook: https://www.facebook.com/FoxNews/Follow Fox News on Twitter: https://twitter.com/FoxNews/Follow Fox News on Instagram: https://www.instagram.com/foxnews/om/"
"fY-LA3YaZ_M","2019 Was The Craziest Year Ever","2020-01-03T21:10:01.000Z","UCX6OQ3DkcsbYNE6H8uQQuVA","MrBeast","24","20.04.01","[none]","6303826","537836","4099","31302","https://i.ytimg.com/vi/fY-LA3YaZ_M/default.jpg","False","False","Thank you for the best year of my life, 2020 lets change the worldNew Merch - https://shopmrbeast.com/SUBSCRIBE OR I TAKE YOUR DOG----------------------------------------------------------------follow all of these or i will kick you• Facebook - https://www.facebook.com/MrBeast6000/• Twitter - https://twitter.com/MrBeastYT•  Instagram - https://www.instagram.com/mrbeast--------------------------------------------------------------------"
"g693Rt_Y0Po","Moneybagg Yo - U Played feat. Lil Baby (Official Audio)","2020-01-03T05:00:09.000Z","UC7r-J2sPQVv9i3iNcte1u-A","MoneybaggYoVEVO","10","20.04.01","moneybagg|moneybaggyo|moneybaggyouplayed|uplayed|u played music|u played music video|u played|u played moneybagg|u played moneybagg yo|lil baby|lilbaby|Yo Gotti|Gotti|Rex|Bagg|Demario|Demario White|hip hop|hip-hop|Rap|R&B|RnB|Soul|music|music video","1037383","44830","1827","1562","https://i.ytimg.com/vi/g693Rt_Y0Po/default.jpg","False","False","Moneybagg Yo feat. Lil Baby U Played out now: http://smartURL.it/UPlayedFollow Moneybagg Yo:http://www.instagram.com/moneybaggyohttp://www.twitter.com/moneybaggyohttp://www.facebook.com/moneybaggyo#MoneybaggYo #LilBaby #UPlayedMusic video by Moneybagg Yo performing U Played (Audio). © 2019 N-Less Entertainment/Interscope Recordshttp://vevo.ly/EJdNXi"
"ey-At5iXjEE","Dramatic escalation with airstrike in Iraq l ABC News","2020-01-03T15:25:48.000Z","UCBi2mrWuNuyYy4gbM6fU18Q","ABC News","25","20.04.01","breaking news|Qassem Soleimani|Iran|Iraq|drone strike|international News|Baghdad Airport|Iran News|War|oil prices|iran embassy attack|trump|iran general killed|us airstrike iran|Quds Force|Iran retaliation|Hassan Rouhani|Iran Supreme leader|Ayatollah Ahmad Khatami|Hezbollah|Isreael|Middle East|Middle East News","899433","7813","1850","7292","https://i.ytimg.com/vi/ey-At5iXjEE/default.jpg","False","False","A U.S. airstrike killed Qassem Soleimani, the commander of Iran’s Quds Force and a top Iranian general, which has sparked fears of escalation.READ MORE: https://abcn.ws/2QLp1PI#ABCNews #BreakingNews #Soleimani #Iran #Hezbollah #MiddleEast"
"Z_XbtYfrNYI","Mitch Hedberg: I Wish They Made Fajita Cologne - Late Night With Conan O'Brien","2020-01-03T15:00:05.000Z","UCi7GJNg51C3jgmYTUwqoUXA","Team Coco","23","20.04.01","Late Night With|Conan|O'Brien|NBC|HD|HQ|Comedy|Podcast|Best Of|Official|Conan Classic|Mitch Hedberg|Strategic Grill Locations|Mitch All Together|Do You Believe in Gosh?|Lords of Dogtown|Almost Famous|Crank Yankers","532302","16368","407","1280","https://i.ytimg.com/vi/Z_XbtYfrNYI/default.jpg","False","False","(Original airdate: 10/12/04) Mitch Hedberg jokes about “The Real World,” dreams, and dwelling cheeses. Experience the Best Of Stand-Up From Conan on our podcast hosted by CONAN writer Laurie Kilmartin. Only on Stitcher Premium: http://www.stitcherpremium.com/conan"
"VR3d-uh7HSw","When The Boss Battle Has Really Good Music","2020-01-03T17:25:26.000Z","UCV6g95OBbVtFmN9uiJzkFqQ","CircleToonsHD","1","20.04.01","When The Boss Battle Has Really Good Music|Boss battle music|when the boss battle has a good theme song|theme song|rpg music|gaming music|video game music|when the boss has good music|when the|circletoonshd|circle|toons|hd|ms paint animtion|animation|cartoon|video games|gaming|boss battle|OST|video game ost|boss battle ost|gaming ost|parody|satire","871609","72314","867","4429","https://i.ytimg.com/vi/VR3d-uh7HSw/default.jpg","False","False","Yo! I know I'm fighting for my life here, but I'm not gonna lie, this music kinda SLAPS.Subscribble for more viddles ► https://www.youtube.com/circletoonshdMerch! ► https://shop.makeship.com/collections/circletoonshdTwitter! ► https://www.twitter.com/CircletoonshdPatreon! ► https://www.patreon.com/CircleFacebook! ► https://www.facebook.com/JustMeBeingACircleTwitch! ► https://www.twitch.tv/thealmightycircleInstagram! ► https://www.instagram.com/thealmightycircle"
"IDEBiCBlz7U","2020 Kill Count / Dead Meat Schedule","2020-01-03T14:00:03.000Z","UC2IYWWifoIht9T47z1Z5lJw","Dead Meat","1","20.04.01","horror|dead meat|movies|scary|films|kills|kill count|body count|james a. janisse|jaj|pine commander boogie","553249","63865","1011","10408","https://i.ytimg.com/vi/IDEBiCBlz7U/default.jpg","False","False","***NOTE ABOUT THE DEAD MEAT PODCAST: It will continue to have weekly releases on Tuesdays during this time, since it's done entirely by Chelsea (the only time I have to spend towards a podcast is the one hour it takes to record an episode each week)***PATREON ► https://patreon.com/deadmeatjamesMERCH (shirts & pins) ► http://www.DeadMeatStore.com/TWITCH (livestreaming) ► https://www.twitch.tv/deadmeatjames/Mail stuff to Dead Meat! 13535 Ventura Blvd STE C PMB 423 Sherman Oaks, CA, 91423Dead Meat Podcast ► http://deadmeatpod.libsyn.com/websiteDnDnD (D&D podcast I'm in) ► https://itunes.apple.com/us/podcast/dndnd/id1397527832Also at ► https://dndndpod.simplecast.fm/Dead Meat on Social Media:Twitter ► https://twitter.com/deadmeatjamesInstagram ► http://instagram.com/deadmeatjamesFacebook ► https://www.facebook.com/deadmeatjamesReddit ► https://reddit.com/r/deadmeatjames/Discord ► https://discord.gg/GHazvA5Steam Official Group ► http://steamcommunity.com/groups/DeadMeatOfficialJames A. Janisse on Social Media:Twitter ► https://twitter.com/jamesajanisseInstagram ► http://instagram.com/jamesajanissePractical Folks (James's other channel):https://www.youtube.com/practicalfolksMUSIC!!~~Logo/The Numbers~~U Make Me Feel by MK2https://www.youtube.com/watch?v=qSET1PSw8Ic"
"lfXAdSyV1qw","THE PRINCE FAMILY SWIMMING POOL CHALLENGE (TWTPF)","2020-01-02T18:00:43.000Z","UC5LGPvoUOfwcLi4Ck8LiR4A","THE PRINCE FAMILY","22","20.04.01","The Prince Family|The Prince Family Vlogs|The Prince Family Pranks|The Prince Family Challenges|Prince Family|Damien & Biannca|trapped with the prince family|twtpf|the prince family reality show|swimming|swim|swimming pools|fish|fishing|capture the fish|goldfish|pool challenges￼|underwater|underwater challenge|the ace family|mrbeast|faze rug|the labrant family|the prince family swimming pool challenge|swimming pool|pool challenge|swimming challenge","1824214","64062","2567","5945","https://i.ytimg.com/vi/lfXAdSyV1qw/default.jpg","False","False","Trapped With The Prince Family Season 1 Episode 6The Last Couple Standing Wins Cash Prize & A Trip To Hawaii! Make Sure You Watch All The Trapped With The Prince Family Episodes (TWTPF) 🤪🍿Episode 1 - https://www.youtube.com/watch?v=BLbPPhCVdUo&t=35sEpisode 2 - https://www.youtube.com/watch?v=jxfVQ6-VEGs&t=218sEpisode 3 - https://www.youtube.com/watch?v=X5tfgWaxpH4&t=1293sEpisode 4 - https://www.youtube.com/watch?v=IxkWeGVheoIEpisode 5 - https://www.youtube.com/watch?v=ByC418QPJLMEpisode 6 - https://www.youtube.com/watch?v=lfXAdSyV1qwFollow The Prince Family On Facebook: https://www.facebook.com/TheOfficialPrinceFamilyThe Prince Family Merch: https://www.officialprincefamily.comSubscribe To DJ's Clubhouse: https://www.youtube.com/channel/UCqONv8hrKKTd0ELJcxOVNJQFollow Damien:Instagram: https://instagram.com/DamienPrinceJrTwitter: https://twitter.com/DamienPrinceJrSnapChat: https://snapchat.com/add/DamienPrinceJrFacebook: https://facebook.com/DamienPrinceJrFollow Biannca: YouTube Channel: https://goo.gl/iCz7K8Instagram: https://instagram.com/x_bianncarainesTwitter: https://twitter.com/bianncarrainesSnapChat: https://snapchat.com/add/BianncaRainesFollow Nova's Instagram: https://www.instagram.com/novagraceprinceFollow Kyrie & DJ:Instagram: https://instagram.com/djandkyrieprinceTwitter: https://twitter.com/daimon_kyrieBUSINESS INQUIRIES: ThePrinceFamilyInquiries@gmail.com#ThePrinceFamily#TrappedWithThePrinceFamily#TWTPF"
"EaMed9sUPVo","Justin Bieber - Yummy (Lyric Video)","2020-01-03T05:00:02.000Z","UCIwFjwMjI0y7PDBVEO9-bkQ","Justin Bieber","24","20.04.01","justin bieber|yummy|lyric video|Justin|Bieber|justin bieber yummy|yummy justin bieber|bieber 2020|justin bieber songs|justin bieber new song|justin beiber|justin beiber yummy|yummy justin beiber|justin bieber 2020|jb|bieber is back|justin bieber new album|bieber new song|yummy new song|bieber new album|justin bieber tour|#bieber2020|bieber2020|justin biber|2020|biber 2020|yummy lyric video|yummy dance video|yummy official video|yummy music video","8024696","763134","78508","75010","https://i.ytimg.com/vi/EaMed9sUPVo/default.jpg","False","False","Yummy out now: https://justinbieber.lnk.to/YummyOfficial music video out 1/4 at noon EST. Set a reminder & join the premiere here: https://JustinBieber.lnk.to/YummyVideoAnimated by: Arben VllasaliuEdited by: Nathan Flanagan-Frankl"
"2wAekP9Z1Zs","DYED MY HAIR BLONDE AND SURPRISED BRAMTY!!! *CRAZY REACTION*","2020-01-03T03:14:31.000Z","UCOIGee5h5-_8cfY4wFwPX_w","The Bramfam","22","20.04.01","the bramfam|bramfam|bramty|bramfam vlogs|bramty juliette|dyed my hair|dying my hair|dyed my hair blonde|blonde hair|hair transformation|new hair|surprising my wife|surprising my girlfriend|surprising my gf|surprise","533057","43924","1078","0","https://i.ytimg.com/vi/2wAekP9Z1Zs/default.jpg","True","False","DYED MY HAIR BLONDE AND SURPRISED BRAMTY!!! *CRAZY REACTION*👕 BRAMFAM MERCH ► http://bramfam.merchnow.com🎶 ITS A BRAM NEW DAY RINGTONE ► https://apple.co/2FOkCcc➡️ 🔔 SUBSCRIBE TO BRAMTY'S CHANNEL ► https://bit.ly/2FYjK55➡️ 🔔 SUBSCRIBE TO PENELOPE'S CHANNEL ► http://bit.ly/2gtkZ0p► FOLLOW US ON SOCIAL MEDIA:👉🏼 Bramty's Instagram ► https://instagram.com/bramty👉🏼 Luis's Instagram ►  https://www.instagram.com/luisnestor👉🏼 Penelope's Instagram ►  https://instagram.com/penelope👉🏼 Balcom and Levy's Instagram ► https://www.instagram.com/balcomandlevy👉🏼 Bramty's Twitter ►  https://twitter.com/bramtyjuliette👉🏼 Bramty's TikTok ►👉🏼 Luis's TikTok ►❗️WATCH MORE OF OUR VIDEOS HERE ❗️🔔 LATEST UPLOADS: https://www.youtube.com/playlist?list...🔔 POPULAR VIDEOS: https://www.youtube.com/playlist?list...📬 MAILING 📬Bramty Juliette or Luis NestorP.O Box 173387Tampa, FL 33672► For business inquiries, please contact:Bramtyjuliette@gmail.com"
"35XGfnmTm8E","Why Drugs Are So Expensive | VICE on HBO","2020-01-03T14:00:01.000Z","UCZaT_X_mc0BI-djXOlfhqWQ","VICE News","25","20.04.01","VICE on HBO|vice video|VICE News|VICE News Tonight|vice news 2019|drugs expensive|DIY bio hackers|prescription drugs|news|cost of living|DIY pharmacy|chemicals|drug costs in america|prescription drog costs|us healthcare|healthcare costs in america|healthcare costs|hamilton morris|hamilton morris vice|trending|cost drugs|martin shkreli|turing pharmaceuticals|drug pricing","410597","8422","275","2116","https://i.ytimg.com/vi/35XGfnmTm8E/default.jpg","False","False","Americans today spend more on pharmaceuticals per capita than anyone else in the world, and more than one in five say they have trouble affording their prescription drugs. But they might not know about the alternative pathways to medicine. VICE's Hamilton Morris explores the world of clandestine chemists, DIY bio hackers, and grey markets to see if a more democratized medicinal future is indeed possible.Subscribe to VICE News here: http://bit.ly/Subscribe-to-VICE-NewsCheck out VICE News for more: http://vicenews.comFollow VICE News here:Facebook: https://www.facebook.com/vicenewsTwitter: https://twitter.com/vicenewsTumblr: http://vicenews.tumblr.com/Instagram: http://instagram.com/vicenewsMore videos from the VICE network: https://www.fb.com/vicevideo#VICEonHBO"
"SS_TaaJGiSA","Deep Cleaning a Girl’s DIRTY SUV | Nasty Carpet Cleaning and Satisfying Car Detailing!","2020-01-03T14:00:11.000Z","UCAQHQEO4QpI5dXtr3vLoFCg","The Detail Geek","2","20.04.01","dirty car detailing|filthy car detailing|complete dirty detail|car cleaning|car detailing|interior car cleaning|interior car detailing|car interior cleaning|auto detailing|the detail geek|detail geek|interior cleaning|detailing truck|dirty truck detail|dirty truck cleaning|filthy work truck|asmr|girls dirty truck|girls dirty suv|chevy trailblazer|carpet cleaning|nasty carpet cleaning|satisfying car detailing|exterior car detailing","676202","23725","337","2530","https://i.ytimg.com/vi/SS_TaaJGiSA/default.jpg","False","False","Deep Cleaning a Girl’s DIRTY SUV | Nasty Carpet Cleaning and Satisfying Car Detailing! This Chevy Trailblazer was covered in dirt, had super nasty carpets and was the worst smelling vehicle I’ve ever detailed! It needed a full interior car detailing and exterior car detailing, so in this video I show you my satisfying process to deep clean and completely transform this Trailblazer!#cardetailing #satisfying #truckwashQ&A vid - https://youtu.be/Xn-CKiTSKls✅ MERCH - https://teespring.com/stores/the-detail-geek ✅IG: thedetailgeek1Products used:🇺🇸 ViewersBissell SpotClean Professional - https://amzn.to/326m1CtMcCulloch MC1375 Steam System - https://amzn.to/2JdeLgKDrill Brush Set - https://amzn.to/2RYgDN5Lilly Brush - https://amzn.to/2Q8Hk4EDetail Brushes:Boar’s Hair - https://amzn.to/346ushS Ultra Soft - https://amzn.to/2Ddzn4VMicrofiber Towels - https://amzn.to/2MZ6f8XMicrofiber Drying Towel - https://amzn.to/2LQT7kiGlass Waffle Weave Towel - https://amzn.to/2KZrJAQBlack Nitrile Gloves - https://amzn.to/2NO8PzdMicrofiber Wash Mitt - https://amzn.to/2Xr0AfZ6” Dual Action Polisher - https://amzn.to/2WNHCfe5 inch backing plate - https://amzn.to/2KuqR6TMeguiar’s Microfiber Cutting Disc - https://amzn.to/2Kz01efLake Country 5.5” Pads - https://amzn.to/31KUaI3FLEX Swirl Finder Light - https://amzn.to/2Uf4G6VCarpet Brush - https://amzn.to/31FeydnDetailing Clay - https://amzn.to/31DHHpvFoam Cannon - https://amzn.to/2RnZgoEGrit Guards - https://amzn.to/2ISwkBoWheel Brushes:     Tire Brush - https://amzn.to/2RuKb4U     Wheel Well Brush - https://amzn.to/2KYFMWq     Wheel Brush - https://amzn.to/31KUruz     EZ Detail Brush - https://amzn.to/31LGqfVLeather Brush - https://amzn.to/2IU8LtlDust Mask - https://amzn.to/38DJ5vV303 Aerospace Protectant - https://amzn.to/33TbVpwBug Remover - https://amzn.to/2ZC2zLkMeguiar’s All Purpose Cleaner - https://amzn.to/2ZCSJJsMeguiar’s Iron Decon - https://amzn.to/31c7DqUCarpet Solution - https://amzn.to/2silU9VFolex Spot Remover - https://amzn.to/2MOJodQ Glass Cleaner - https://amzn.to/2Xo7UZOWheel & Tire Cleaner - https://amzn.to/2KslKUNLeather Cleaner - https://amzn.to/2ZzvtzZLeather Conditioner - https://amzn.to/2ZyIzcJOptimum Tire Shine - https://amzn.to/2N0dZrnMeguiar’s Quick Detail Spray - https://amzn.to/2WVAIEVMeguiar’s AIO Wax - https://amzn.to/2RHbJUQCarPro CQuartz UK 3.0 Edition - https://amzn.to/2Xr1LMrCarPro Reload - https://amzn.to/2XqjmEcCar Wash Soap - https://amzn.to/2Xtn9kSCarPro PERL - https://amzn.to/2JSpXQ7🇨🇦 ViewersBissell SpotClean Professional - https://amzn.to/2XstEEIMcCulloch MC1375 Steam System - https://amzn.to/2KZW2axDrill Brush Set - https://amzn.to/2LCZVSyLilly Brush - https://amzn.to/2ZW4LlXDetail Brushes:Boar’s Hair - https://amzn.to/2OBoC1A Ultra Soft - https://amzn.to/2Xyh1ozMicrofiber Towels - https://amzn.to/2XoN1O3Microfiber Wash Mitt - https://amzn.to/2Itfydf6” Dual Action Polisher - https://amzn.to/2Rqvqjf5 inch Backing Plate - https://amzn.to/31HI7LtMeguiar’s Microfiber Cutting Disc - https://amzn.to/2MZ3UuHLake Country 5.5” pads - https://amzn.to/2IUMmLbWheel Brushes:     Tire Brush - https://amzn.to/2RsOtK6     Wheel Well Brush - https://amzn.to/2Fm08p5     EZ Detail Brush - https://amzn.to/2Xneik8Carpet Brush - https://amzn.to/2XncjfGLeather Brush - https://amzn.to/2JfGVGzDetailing Clay - https://amzn.to/2XqZr8bFoam Cannon - https://amzn.to/2IsvqMWBlack Nitrile Gloves - https://amzn.to/2xHjlNIGrit Guards - https://amzn.to/31LEDrdDust Mask - https://amzn.to/36zlXgb303 Aerospace Protectant - https://amzn.to/2KrZ8UuCarpet Solution - https://amzn.to/399IMZHFolex Spot Remover - https://amzn.to/2SN4MUs Wheel & Tire Cleaner - https://amzn.to/2XtrVOuGlass Cleaner - https://amzn.to/2Xm3ClHOptimum Tire Shine - https://amzn.to/2RnCsWhMeguiar’s Detail Spray - https://amzn.to/2Ksqw4MMeguiar’s AIO - https://amzn.to/2NlnyRRMeguiar’s Mirror Glaze Sealant - https://amzn.to/30j31zbCarPro CQuartz UK 3.0 Edition - https://amzn.to/31LBIPACarPro Reload - https://amzn.to/2WRsVHWCar Wash Soap - https://amzn.to/2XuJiQ3CarPro PERL - https://amzn.to/2SG6qp9🇬🇧 ViewersBissell SpotClean Professional - https://amzn.to/30wYI30McCulloch MC1375 Steamer - https://amzn.to/2XHzZY7Lilly Brush - https://amzn.to/31vsN3SMicrofiber Wash Mitt - https://amzn.to/2XElR1SMeguiar’s Glass Cleaner - https://amzn.to/2XJyIQmGriots Garage 6” Dual Action Polisher - https://amzn.to/2XHCSZ1Wheel Brushes: Tire Brush - https://amzn.to/30zcouH Wheel Brush - https://amzn.to/2SaegqA EZ Detail Brush - https://amzn.to/32mn01rDetail Brushes:Boars Hair - https://amzn.to/2QBI9Br Ultra Soft - https://amzn.to/2OrHdwODrill Brush Set - https://amzn.to/32xn92qLeather Brush - https://amzn.to/2S8y9OKFoam Cannon - https://amzn.to/30u9s29303 Aerospace Protectant - https://amzn.to/30uESFOAs an Amazon Associate I earn from qualifying purchases (paid link)"
"K_IHoG1XfoI","Film Theory: Should Disney Buy Spiderman for $10 Billion? (Disney vs Sony)","2020-01-02T22:05:13.000Z","UC3sznuotAs2ohg_U__Jzj_Q","The Film Theorists","1","20.04.01","spiderman|spider-man|spider man|disney|marvel|mcy|sony|spiderman far from home|spiderman endgame|far from home|endgame|infinity war|spiderman far from home post credit scene|spider-man far from home full movie|credit scene far from home|disney spiderman|sony spiderman|spiderman spiderverse|spiderverse|spider verse|film theorists|film theory|matpat|avengers","2146263","100548","2647","10870","https://i.ytimg.com/vi/K_IHoG1XfoI/default.jpg","False","False","Never miss a Film Theory! ► http://bit.ly/1dI8VBH The tug of war between Disney and Sony over Spider-Man is one for the ages. Since joining forces to bring the webbed wonder into the MCU, if felt inevitable that Disney would swoop in and take Sony's prized hero. Yet, Sont still remains owner of our friendly, neighborhood Spidey. See, Disney is not willing to pay the amount Sony is asking. Should Disney bend to Sony's offer or are they missing a steal and, perhaps, their once chance? Let's find out!Subscribe to see every Film Theory! ► http://bit.ly/1dI8VBH #Spiderman #Marvel #Disney #Sony #Avengers #FarFromHome #FilmTheory #MatpatNeed Royalty Free Music for your Content? Try Epidemic Sound.Get Your 30 Day Free Trial Now ► http://share.epidemicsound.com/TheFilmTheoristsCredits:Writer: Matthew Patrick and Luke Barat  Editors: Dan Cybert Seibert, Koen Verhagen, and Marc SchneiderAssistant Editor: AlyssaBeCrazySound Editor: Yosi Berman"
"XHn5H9YdFWw","Our New DREAM House Tour!","2020-01-01T17:00:14.000Z","UCkvK_5omS-42Ovgah8KRKtg","jeffreestar","26","20.04.01","jeffree star|jeffree star house tour|jeffree star approved|jeffree star house|jeffree star closet tour|shane dawson|ryland adams|nathan schwandt|jeffree star x shane dawson colletion|jeffree star moving|jeffree star cosmetics|jeffree star house decorating|the dolan twins|the ace family|cleaning our messy house|decluttering jeffree house|garret watts|saying goodbye to our pink house","15030300","876610","25879","87610","https://i.ytimg.com/vi/XHn5H9YdFWw/default.jpg","False","False","HEY EVERYONE… HAPPY NEW YEAR ANDDDDDD Welcome BACK to my channel! Today we're giving you all the official Jeffree Star Family dream home castle tour! We invited Shane Dawson and Ryland over to see our new house for the first time and they come along for the FULL tour! So excited for what 2020 brings us.WANT MORE?? 💄 WATCH US SAY GOODBYE TO OUR PINK HOUSE! ► https://bit.ly/2MNcgTN⭐ SHOP the Magic Star™ Concealer & Setting Powders: https://bit.ly/2GvMZdU🍓 SHOP THE JEFFREE STAR x MORPHE PART 2 COLLECTION: https://www.morphe.com/pages/jeffree-starYou can now use code JSTAR at checkout on Morphe.com for 10% OFF ANY Morphe product!*SHOP: http://www.jeffreestarcosmetics.com+ FOLLOW MY BRAND ON Instagram: http://instagram.com/jeffreestarcosmetics+FOLLOW ME ON IG: http://instagram.com/jeffreestar+ SNAPCHAT: jeffreedahmer+ TWITTER: @jeffreestarWATCH MORE VIDEOS...................❤️🔮 WATCH SURPRISING MY BOYFRIEND W HIS DREAM CAR  ► https://bit.ly/2ObF2At🎀 WATCH MY PINK VAULT CLOSET TOUR ▷ https://www.youtube.com/watch?v=CwMBrNEpYfs😱 TRYING DOLLAR GENERAL MAKEUP FOR THE FIRST TIME ▷ https://bit.ly/2kptBHy"
"v3n8txX3144","Google and Amazon are now in the oil business","2020-01-03T14:33:45.000Z","UCLXo7UDZvByw2ixzpQCufnA","Vox","25","20.04.01","Vox.com|vox|explain|explainer|climate change|big oil|fracking|google|amazon|microsoft|artificial intelligence|machine learning|adam cole|global warming|big tech","1228251","55481","1880","3593","https://i.ytimg.com/vi/v3n8txX3144/default.jpg","False","False","Google, Microsoft, and Amazon are teaming up with Big Oil to squeeze more oil and gas out of the ground using machine learning technology.Subscribe to our channel! http://goo.gl/0bsAjOSources:Brian Merchant (Gizmodo) https://gizmodo.com/how-google-microsoft-and-big-tech-are-automating-the-1832790799Christopher M. Matthews (Wall Street Journal) https://www.wsj.com/articles/silicon-valley-courts-a-wary-oil-patch-1532424600Matt Novak (Gizmodo) https://paleofuture.gizmodo.com/article-from-1975-the-world-will-be-out-of-oil-by-2015-1732903871Kasia TokarskaDaniel CivitareseGhassan AlRegib - https://ghassanalregib.info/Google, Microsoft, and Amazon have been very vocal about their efforts to reduce the world's dependence on fossil fuels. But as The Wall Street Journal and Gizmodo have reported, these same companies are currently teaming up with fossil fuel industry to help them squeeze as much oil and gas out of the ground as possible. Oil has always been hard to find and hard to extract, and so the industry has teetered precariously on the edge of profitability several times over the course of its history. Over and over again, experts have predicted that we'll soon run out of accessible, affordable oil - but so far, they've been wrong. Just when things look bleakest for black gold, new technology swoops in to keep the industry afloat.Vox.com is a news website that helps you cut through the noise and understand what's really driving the events in the headlines. Check out http://www.vox.com.Watch our full video catalog: http://goo.gl/IZONyEFollow Vox on Facebook: http://goo.gl/U2g06oOr Twitter: http://goo.gl/XFrZ5H"
