video_id,title,publishedAt,channelId,channelTitle,categoryId,trending_date,tags,view_count,likes,dislikes,comment_count,thumbnail_link,comments_disabled,ratings_disabled,description
"1ub84oRlz4s","The most horrifying night we've ever experienced.","2020-03-08T20:14:02.000Z","UCg3gzldyhCHJjY7AWWTNPPA","Sam and Colby","24","20.09.03","sam golbach|colby brock|exploring|sam and colby haunted hotel|sam and colby biltmore hotel|haunted biltmore hotel|sam and colby seance|sam and colby overnight|overnight at haunted hotel|sam and colby haunted video|sam golbach 3 am|scary experience|colby brock haunted|xplr|sam and colby scary|haunted hotel|florida haunted|top 10 haunted|jake webber|ouija board|sam and colby ouija board|corey scherer ouija|corey scherer|shadow man|haunted florida","938692","105108","6053","19913","https://i.ytimg.com/vi/1ub84oRlz4s/default.jpg","False","False","Tour TICKETS: http://allinonetour.comSam and Colby stayed overnight at the haunted biltmore hotel and now have to get to the bottom of Corey Scherer's shadow man spirit by talking to mediums and playing with the ouija board. The group experiences crazy paranormal evidence.New XPLR SPIRIT BOARD: http://samandcolby.com/Text us! (913)285-8687SUB TO OUR FRIENDS:Jake: https://www.youtube.com/user/Jakewebber9Corey: https://www.youtube.com/user/ItsCoreySchererNEW XPLR APP! Download for free: https://apps.apple.com/us/app/xplr/id1474820819Android: https://play.google.com/store/apps/details?id=co.tapcart.app.id_lMlmFXdnGD&hl=en_USChannel Membership: https://www.youtube.com/channel/UCg3gzldyhCHJjY7AWWTNPPA/joinEdited by: @hhilliersmith Make sure to Subscribe! https://www.youtube.com/channel/UCg3gzldyhCHJjY7AWWTNPPA?sub_confirmation=1Check out our personal channels!COLBY: https://www.youtube.com/c/ColbyBrockSAM: https://www.youtube.com/c/SamGolbachOur other social media!Instagram: @SamandColbyTwitter: @SamandColbySnapchat: @samgolbach & @colbybrock"
"yXWw0_UfSFg","Anything You Can Fit In The Circle I’ll Pay For","2020-03-07T21:00:00.000Z","UCX6OQ3DkcsbYNE6H8uQQuVA","MrBeast","24","20.09.03","[none]","15779857","1115356","11772","45804","https://i.ytimg.com/vi/yXWw0_UfSFg/default.jpg","False","False","Watch until the end to see how much i spentNew Merch - https://shopmrbeast.com/SUBSCRIBE OR I TAKE YOUR DOG----------------------------------------------------------------follow all of these or i will kick you• Facebook - https://www.facebook.com/MrBeast6000/• Twitter - https://twitter.com/MrBeastYT•  Instagram - https://www.instagram.com/mrbeast--------------------------------------------------------------------"
"C2TQetYUJ8E","UFC 248: Zhang Weili vs Joanna Jedrzejczyk Recap","2020-03-08T17:31:32.000Z","UC7tdFNggH_jwjJTDWqYelmA","MMAWeekly.com","17","20.09.03","MMA|mixed martial arts|MMAWeekly.com|MMAWeeklyVideos|UFC|Ultimate Fighting Championship|UFC 248|Zhang Weili vs Joanna Jedrzejczyk|Weili vs Jedrzejczyk|Zhang Weili|Joanna Jedrzejczyk|recap|review|highlights|breakdown","1138821","8179","2157","1429","https://i.ytimg.com/vi/C2TQetYUJ8E/default.jpg","False","False","See the highlights from UFC 248: Zhang Weili vs Joanna Jedrzejczyk recap after Weili defended her championship belt against the former strawweight  champion, Jedrzejczyk, in the one of the best mma fights of the year. #UFC | #zhangweili | #joannajedrzejczyk | #ufc248recap | #ufc248music provided by https://www.bensound.com/Website: http://www.MMAWeekly.com/Subscribe on Youtube: https://www.youtube.com/subscription_center?add_user=MMAWeeklyVideosFacebook: https://www.facebook.com/MMAWeeklycom-176775391774/Twitter: https://twitter.com/MMAWeeklycom/Instagram: https://www.instagram.com/mmaweekly/"
"GUNx3gJyZGw","LAKERS at CLIPPERS | FULL GAME HIGHLIGHTS | March 8, 2020","2020-03-08T22:21:03.000Z","UCWJ2lWNubArHWmf3FIHbfcQ","NBA","17","20.09.03","NBA|G League|Basketball|game-0021900948|sp:ty=high|sp:dt=2020-03-08T19:30:00Z|sp:st=basketball|sp:li=nba|sp:ti:home=LAC|sp:ti:away=LAL|Pass|Assist|Dunk|Jump Shot|Steal|Lakers|Clippers|Los Angeles|L.A.|Full Game Recap|Full Game Highlights","2443601","21998","1016","6091","https://i.ytimg.com/vi/GUNx3gJyZGw/default.jpg","False","False","LAKERS at CLIPPERS | FULL GAME HIGHLIGHTS | March 8, 2020The Los Angeles Lakers defeated the L.A. Clippers, 112-103. LeBron James (28 PTS, 7 REB, 9 AST) and Anthony Davis (30 PTS, 8 REB) combined for 58 PTS to pace the Lakers, while Paul George tallied 31 PTS and 6 REB for the Clippers.Catch Monday's action on NBA TV: Milwaukee Bucks at Denver Nuggets, 9:00 pm/etSubscribe to the NBA: https://on.nba.com/2JX5gSN Full Game Highlights Playlist: https://on.nba.com/2rjGMgeFor news, stories, highlights and more, go to our official website at https://nba_webonly.app.link/nbasiteGet NBA LEAGUE PASS: https://nba.app.link/nbaleaguepass5"
"ybji16u608U","Marvel Studios' Black Widow | Final Trailer","2020-03-09T12:46:55.000Z","UCvC4D8onUfXzvjTOM-dBfEA","Marvel Entertainment","24","20.09.03","marvel|comics|black widow|scarlett johansson|black widow trailer|natasha romanoff|trailer|david harbour|florence pugh|2020|movie|mcu|avengers|black widow 2020|superhero|black widow movie|red guardian|rachel weisz|superheroes|official|final trailer|taskmaster","1454011","167174","1578","9449","https://i.ytimg.com/vi/ybji16u608U/default.jpg","False","False","At some point we all have to choose between what the world wants you to be and who you are.” Watch the new trailer for Marvel Studios’ #BlackWidow. In theaters May 1.► Learn more: https://www.marvel.com/movies/black-widow► Subscribe to Marvel: http://bit.ly/WeO3YJFollow Marvel on Twitter: ‪https://twitter.com/marvelLike Marvel on Facebook: ‪https://www.facebook.com/marvelFor even more news, stay tuned to:Tumblr: ‪http://marvelentertainment.tumblr.com/Instagram: https://www.instagram.com/marvelPinterest: ‪http://pinterest.com/marvelofficialReddit: http://reddit.com/u/marvel-official"
"GLsXcv5zouQ","Growing Fears Over Response To Coronavirus As Number Of Confirmed Cases Soar | NBC Nightly News","2020-03-09T00:20:35.000Z","UCeY0bbntWzzVIaj2z3QigXg","NBC News","25","20.09.03","nbc news|news channel|news station|newspaper|breaking news|us news|world news|politics|nightly news|current events|top stories|pop culture|business|health","1038153","8623","1301","6860","https://i.ytimg.com/vi/GLsXcv5zouQ/default.jpg","False","False","Dr. Anthony Fauci said he was concerned about community spread and that the administration needs to take whatever action is appropriate to contain the outbreak. President Trump has stayed optimistic about the outbreak, saying he has a “perfectly coordinated” plan to combat the coronavirus. While at least 16 deaths have now been reported at a Washington state nursing home. Many Americans have questions about what to do if they think they’ve been exposed to the coronavirus. J» Subscribe to NBC News: http://nbcnews.to/SubscribeToNBC» Watch more NBC video: http://bit.ly/MoreNBCNewsNBC News is a leading source of global news and information. Here you will find clips from NBC Nightly News, Meet The Press, and original digital videos. Subscribe to our channel for news stories, technology, politics, health, entertainment, science, business, and exclusive NBC investigations.Connect with NBC News Online!Visit NBCNews.Com: http://nbcnews.to/ReadNBCFind NBC News on Facebook: http://nbcnews.to/LikeNBCFollow NBC News on Twitter: http://nbcnews.to/FollowNBCFollow NBC News on Instagram: http://nbcnews.to/InstaNBCGrowing Fears Over Response To Coronavirus As Number of Confirmed Cases Soar | NBC Nightly News"
"0atug3XxODY","UFC 248: Israel Adesanya & Yoel Romero Octagon Interviews","2020-03-08T07:24:23.000Z","UCvgfXK4nTYKudb0rFR6noLA","UFC - Ultimate Fighting Championship","17","20.09.03","ufc|248|israel|adesanya|yoel|romero|octagon|interview|post|fight|middlweight|title|championship|highlights|joe|rogan|mma|ultimate fighting championship","3950158","37647","10366","17537","https://i.ytimg.com/vi/0atug3XxODY/default.jpg","False","False","Undefeated middleweight UFC champion Israel Adesanya successfully defended his belt against Yoel Romero in the main event of UFC 248 via unanimous decision.Subscribe to get all the latest UFC content: http://bit.ly/2uJRzRRExperience UFC live with UFC FIGHT PASS, the digital subscription service of the UFC. Visit https://ufcfightpass.com/To order UFC Pay-Per-Views on ESPN+, visit https://bit.ly/2vNIBE8 (U.S. only)To order UFC Pay-Per-Views, visit http://welcome.ufcfightpass.com/#PPV (Non U.S.)Connect with UFC online and on Social:Website: http://www.ufc.comTwitter: http://www.twitter.com/ufcFacebook: http://www.facebook.com/ufcInstagram: http://www.instagram.com/ufcSnapchat: UFCPeriscope: http://Periscope.tv/ufcConnect with UFC FIGHT PASS on Social:Twitter: http://www.twitter.com/ufcfightpassFacebook: http://www.facebook.com/ufcfightpassInstagram: http://www.instagram.com/ufcfightpass"
"ya3Pqasvyno","Fast moving developments in the coronavirus outbreak","2020-03-09T01:01:22.000Z","UCBi2mrWuNuyYy4gbM6fU18Q","ABC News","25","20.09.03","coronavirus|health|outbreak|developments|death|toll|rises|victims|washington|dc|world|news|wnt|abc|p_cmsid=2494279|p_vid=news-69474022","375563","4305","539","2586","https://i.ytimg.com/vi/ya3Pqasvyno/default.jpg","False","False","33 states and Washington D.C. have confirmed cases, two more today, and the death toll rising to 21 victims in the United States.WATCH THE FULL EPISODES OF 'WORLD NEWS TONIGHT':https://bit.ly/35ZFVjmWATCH OTHER FULL EPISODES OF WORLD NEWS TONIGHT:http://abc.go.com/shows/world-news-tonightWATCH WORLD NEWS TONIGHT ON HULU:https://hulu.tv/33iKepm#WorldNewsTonight #Coronavirus #Outbreak #DeathTollRises"
"GOT34s156NE","Manchester United v. Manchester City | PREMIER LEAGUE HIGHLIGHTS | 3/8/2020 | NBC Sports","2020-03-08T19:50:31.000Z","UCqZQlzSHbVJrwrn5XvzrzcA","NBC Sports","17","20.09.03","NBCSN|NBC|NBC Sports|nbc sports network|NBCSN Premier League|Premier League 2019-2020|premier league 2020|nbc sports soccer|Premier League|premier league matchday 29|matchday 29|Manchester City v Manchester United|Manchester United v Manchester City|Manchester City vs Manchester United|Man Utd vs Man City|Man City vs Man Utd|Man City fc|Manchester United|Scott McTominay|sp:ty=high|sp:dt=2020-03-08T17:30:00Z|sp:st=soccer|sp:li=epl|sp:ti:home=MUN|sp:ti:away=MCI","490639","6556","178","830","https://i.ytimg.com/vi/GOT34s156NE/default.jpg","False","False","Manchester United completed a league double over rivals Manchester City behind goals from Anthony Martial and Scott McTominay. #NBCSports #PremierLeague #ManCity #ManUnited #ScottMcominay #AnthonyMartial» Subscribe to NBC Sports: https://www.youtube.com/nbcsports?sub_confirmation=1» Watch Live Sports on NBCSports.com: http://www.nbcsports.com/live» Get more Premier League news on NBC Sports: https://nbcsports.com/soccer/premier-leagueWant more Premier League? Check out NBC Sports Gold: https://www.nbcsports.com/gold/premier-leagueNBC Sports Group serves sports fans 24/7 with premier live events, insightful studio shows, and compelling original programming. NBC Sports is an established leader in the sports media landscape with an unparalleled collection of sports properties that include the Olympics, NFL, Premier League, NHL, NASCAR, PGA TOUR, the Kentucky Derby, Tour de France, French Open, IndyCar and many more. Subscribe to our channel for the latest sporting news and highlights!The Premier League across NBC Sports Group launched in 2013 with their biggest and broadest programming commitment to-date in the United States. With live multi-platform coverage of all 380 games, analysis from best-in-class talent and extensive surrounding coverage all week long, NBC Sports Group has become the ultimate destination for new and existing Premier League fans.The Premier League maintains strong and consistent reach across NBC, NBCSN, CNBC, and NBC Sports Group’s live streaming products, led by the biggest stars and most prestigious teams in the world.Visit NBC Sports: https://www.nbcsports.comFind NBC Sports on Facebook: https://www.facebook.com/NBCSportsFollow NBC Sports on Twitter: https://twitter.com/nbcsportsFollow NBC Sports on Instagram: https://www.instagram.com/nbcsports/https://www.nbcsports.com/nfl/sunday-night-footballhttps://nbcsports.com/motors/nascarhttps://nbcsports.com/soccer/premier-leagueManchester United v. Manchester City | PREMIER LEAGUE HIGHLIGHTS | 3/8/2020 | NBC Sportshttps://www.youtube.com/nbcsports"
"fE2h3lGlOsk","ITZY WANNABE M/V","2020-03-09T09:00:00.000Z","UCaO6TYtlC8U5ttz62hTrZgg","jypentertainment","10","20.09.03","JYP Entertainment|JYP|ITZY|있지|ITZY Video|ITZY Yeji|ITZY Lia|ITZY Ryujin|ITZY Chaeryeong|ITZY Yuna|있지 예지|있지 리아|있지 류진|있지 채령|있지 유나|예지|리아|류진|채령|유나|Yeji|Lia|Ryujin|Chaeryeong|Yuna|ITZY BEHIND|ITZY VIDEOS|ITZY DEBUT|있지 데뷔|WANNABE|ITZY WANNABE|ITz ME|ITZY TEASER|있지 티저|WANNABE 티저|있지 뮤비 티저|WANNABE 뮤비 티저|ITZY MV TEASER|ITZY MV|M/V|TEASER|있지 컴백|ITZY COMEBACK|WANNABE MV|워너비 뮤비","6328067","939447","32438","58421","https://i.ytimg.com/vi/fE2h3lGlOsk/default.jpg","False","False","ITZY WANNABE M/VFind ITZY IT'z ME onMelOn https://www.melon.com/song/detail.htm?songId=32445339Apple Music https://music.apple.com/us/album/1501233592Spotify https://open.spotify.com/album/2gertXS08whDTzBWfmewPO[ITZY Official] http://ITZY.jype.comhttps://www.youtube.com/c/ITZYhttp://www.facebook.com/OfficialITZYhttp://www.twitter.com/ITZYOfficialhttp://fans.jype.com/ITZY#ITZY #ITzME #WANNABECopyrights 2020 ⓒ JYP Entertainment. All Rights Reserved"
"4_yV-7s2lWM","Accent Coach - SNL","2020-03-08T06:52:47.000Z","UCqFzWxSCi39LnW1JKFR3efg","Saturday Night Live","24","20.09.03","snl|saturday night live|snl season 45|snl 45|daniel craig|beck bennett|aidy bryant|mikey day|ego nwodim|bowen yang|accent coach|rian johnson|toni collette|jamie lee curtis|script read|movie|southern accent|butt talk|s45|s45e15|episode 15|live|new york|comedy|sketch|funny|hilarious|late night|host|music|guest|laugh|impersonation|actor|musician|James Bond|no time to die|007|spectre|skyfall|casino royale|starboy","1147386","16324","1366","1051","https://i.ytimg.com/vi/4_yV-7s2lWM/default.jpg","False","False","Daniel Craig brings his personal vocal coach (Beck Bennett) to a rehearsal for Knives Out.Subscribe to SNL: https://goo.gl/tUsXwMStream Current Full Episodes: http://www.nbc.com/saturday-night-live WATCH PAST SNL SEASONSGoogle Play - http://bit.ly/SNLGooglePlayiTunes - http://bit.ly/SNLiTunes SNL ON SOCIALSNL Instagram: http://instagram.com/nbcsnlSNL Facebook: https://www.facebook.com/snlSNL Twitter: https://twitter.com/nbcsnlSNL Tumblr: http://nbcsnl.tumblr.com/SNL Pinterest: http://www.pinterest.com/nbcsnl/ GET MORE NBCLike NBC: http://Facebook.com/NBCFollow NBC: http://Twitter.com/NBCNBC Tumblr: http://NBCtv.tumblr.com/YouTube: http://www.youtube.com/nbcNBC Instagram: http://instagram.com/nbctv #SNL #DanielCraig #TheWeeknd #SNL45"
"tcHDNQKBT8k","BASKETBALL GAME OF THE YEAR! 1vs1 Against RICEGUM!!","2020-03-08T22:19:06.000Z","UCvyTdLw8SkVmUcHYXSDEGwA","CashNasty","24","20.09.03","basketball 1v1|ricegum vs cash|basketball videos|1v1 irl|entertainment|cash vs ricegum|funny videos clean|ricegum|1vs1 basketball|irl basketball|basketball challenges|funny|flight|flight vs cash|close game|bball|irl basketball 1v1","337816","25336","513","4028","https://i.ytimg.com/vi/tcHDNQKBT8k/default.jpg","False","False","Thanks to SeatGeek For Sponsoring This Video!Download the SeatGeek app here:https://sg.app.link/cashUse code CASH for $20 off your first order! Sub to my 2nd Channel!: https://goo.gl/Se1qBH 2HYPE CHANNEL: https://www.youtube.com/channel/UCY4AlDv6wL2qhrX29iwdqAgFollow me on Twitter: www.twitter.com/cashnastygamingInstagram: @cashnastyI livestream on Twitch! www.twitch.tv/cashnastygaming"
"6K1nqPcLkZ4","Juventus 2-0 Inter | Ramsey and Dybala Seal HUGE Derby win! | Serie A TIM","2020-03-08T22:47:17.000Z","UCBJeMCIeLQos7wacox4hmLQ","Serie A","17","20.09.03","Ronaldo|Serie A|Higuain|Dybala|highlights|Insigne|Juventus|AC Milan|Inter Milan|Napoli|Roma|CR7|Cristiano Ronaldo|goals|full highlights|watch|stream|partita|calcio|Italia|lukaku|de ligt|Juventus 2-0 Inter|juventus vs inter milan|juventus vs inter milan live|juventus vs inter live|juventus v inter milan highlights|juve vs inter|ramsey v inter|ramsey|dybala v inter|sp:ty=high|sp:dt=2020-03-08T18:45:00Z|sp:st=soccer|sp:li=seri|sp:ti:home=JUV|sp:ti:away=INT|sp:vl=en","3258301","52612","1446","2522","https://i.ytimg.com/vi/6K1nqPcLkZ4/default.jpg","False","False","Juventus took a huge step towards the Serie A title with a Derby d’Italia win thanks to goals from Aaron Ramsey and Paulo Dybala | Serie A TIMThis is the official channel for the Serie A, providing all the latest highlights, interviews, news and features to keep you up to date with all things Italian football.Subscribe to the channel here! https://bit.ly/2OM2Eax Find out more about the Serie A at: http://www.legaseriea.it/en/ Questo è il canale ufficiale della Serie A, dove potrai avere accesso ai momenti salienti, alle interviste, alle notizie e alle funzionalità del momento per rimanere aggiornato sulle ultime novità del campionato.Iscriviti qui al canale! https://bit.ly/2OM2EaxPer maggiori infomazioni sulla Serie A: http://www.legaseriea.it/it"
"_YmxicsHHj0","HOW I PACK FOR FASHION WEEK *CHAOS*","2020-03-08T19:23:05.000Z","UC78cxCAcp7JfQPgKxYdyGrg","emma chamberlain","24","20.09.03","emma chamberlain|emma chambie|vlog|paris fashion week|pack with me|louis vuitton","1205618","89503","1044","3868","https://i.ytimg.com/vi/_YmxicsHHj0/default.jpg","False","False","Get Honey for FREE today ▸ http://joinhoney.com/emmaMy subscribers have already found over $300,000 in savings on stores like Target, Forever21, Sephora & PacSun. ThanksHoney for sponsoring!✩ CHECK OUT CHAMBERLAIN COFFEE ✩✭ website: https://www.chamberlaincoffee.com ✭ instagram: https://www.instagram.com/chamberlain...✩ MY SOCIAL MEDIA ✩✭ instagram: https://www.instagram.com/emmachamber...✭ twitter: https://twitter.com/emmachamberlain✭ tik tok (lol): emmachamberlain✭ snapchat: https://www.snapchat.com/emmachambie✭ spotify: http://open.spotify.com/user/emmachambie ✩ MY PODCAST ✩✭ search Anything Goes on spotify, apple podcasts, or wherever else you get your podcasts...✩ MERCH ✩✭  https://shopemmachamberlain.com (COMING SOON)I LUV U,-emma chamberlain"
"VQjAm_RtipM","EXTREME LAST TO _______ CHALLENGE!","2020-03-08T16:00:07.000Z","UCwIWAbIeu0xI0ReKWOcw3eg","Unspeakable","22","20.09.03","unspeakable|vlog|vlogs|unspeakablegaming|prank|comedy|challenge|laugh|funny|moments|craziest|pranks|crazy|no cursing|no swearing|how to|parody|troll|video|react|family friendly|funniest|adventure|trolling|unspeakable vlogs|real life|life|unspeakable real life|unspeakableplays","1163218","35042","997","4435","https://i.ytimg.com/vi/VQjAm_RtipM/default.jpg","False","False","👚 MERCH & TOYS 🡆 https://www.unspeakable.com/👍 FOLLOW ME! 🡆 Instagram - http://instagram.com/unspeakable🡆 Twitter - https://twitter.com/UnspeakableGame🎮 MY OTHER CHANNELS! 🡆 MAIN CHANNEL 🡆 https://goo.gl/Fxt9GF🡆 UNSPEAKABLEPLAYS 🡆 https://goo.gl/bbfyv7Thanks for watching! Likes are greatly appreciated! Subscribe to be notified when my next video is live!"
"TkVcBOtTpUQ","Swapping Outfits With Daisy Marquez!","2020-03-08T20:01:40.000Z","UCB0d0JLn1WcGYcwwZ87d2LA","Rclbeauty101","23","20.09.03","[none]","944864","36177","742","1898","https://i.ytimg.com/vi/TkVcBOtTpUQ/default.jpg","False","False","Swapping Outfits With Daisy Marquez!I decided it would be funny to swap styles with Daisy Marquez  because I swapped outfits with Tana Mongeau, Nikita Dragun, and the Beverly Hills brat, James Charles, and Amber Scholl, and you guys enjoyed that! Let me know who else you want me to do a style swap with!!STREAM MY SONG “MYSELF”- https://smarturl.it/RachelLevinMyselfALLBUY MY MAKEUP BRAND: https://rclocosmetics.com/PAJAMAS WORN- https://www.amazon.com/shop/rclbeauty101?listId=1AAW3AD44DMRCDAISYS CHANNEL: https://www.youtube.com/channel/UCKRzxQcorbRkk7Ofr5T0-lwCOVER CONTEST RULES: Sing a cover and post it on Instagram with @rclbeauty101 #MyselfCoverTiktok with #MyselfCoverYouTube titles Myself By Rachel Levin Cover"
"P4tf_5EG8Wo","Gorgeous Couple STUNS with Their Audition - American Idol 2020","2020-03-09T00:44:40.000Z","UCAMPco9PqjBbI_MLsDOO4Jw","American Idol","24","20.09.03","American Idol 2019|American Idol|singing competition|Katy Perry|Ryan Seacrest|Luke Bryan|Lionel Richie|covers|sing|ABC|Kat and Space Cowboy|Shallow|Lady Gaga|Bradley Cooper","654551","10104","402","606","https://i.ytimg.com/vi/P4tf_5EG8Wo/default.jpg","False","False","Kat and Space Cowboy step into our audition room and stun Lionel Richie, Luke Bryan and Katy Perry with their good looks--and even better voices. See more of American Idol 2020 on our official site: http://www.americanidol.comLike American Idol on Facebook: https://www.facebook.com/AmericanIdolFollow American Idol on Twitter: https://twitter.com/americanidolFollow American Idol on Instagram: https://www.instagram.com/americanidol/AMERICAN IDOL, the iconic series that revolutionized the television landscape by pioneering the music competition genre, returns on ABC.American Idol 2020Helping to determine who America will ultimately vote for to become the next singing sensation are music industry forces and superstar judges Luke Bryan, Katy Perry and Lionel Richie. Emmy® Award-winning host and producer Ryan Seacrest continues as host of the beloved series, while multimedia personality Bobby Bones serves at the in-house mentor."
"CD7UmmLhFR8","6 Middle Schoolers vs 1 Secret 5th Grader","2020-03-08T15:00:01.000Z","UCJjSDX-jUChzOEyok9XYRJQ","Jubilee","24","20.09.03","jubilee|jubilee media|jubilee project|live deeper|blind devotion|love language|middle ground|spectrum|odd man out|odd man out 6th graders|6th graders vs 5th graders|who is the 5th grader|who is the mole|middle schoolers|elementary school","1541057","76810","2065","15673","https://i.ytimg.com/vi/CD7UmmLhFR8/default.jpg","False","False","Follow us on INSTAGRAM: 👉https://www.instagram.com/jubileemedia/ 👈SUBSCRIBE for more! http://bit.ly/SUBSCRIBEjubilee Be in a Jubilee video: http://bit.ly/JubileeCastingAre you a loyal Jubilee fan? Join our Facebook group: https://www.facebook.com/groups/407942859721012/| ABOUT |We believe in the power of empathy for human good. Ultimately, we aim to inspire people to EMBRACE EMPATHY.| SOCIAL |Jubilee Facebook: https://www.facebook.com/jubileemediaJubilee Instagram: https://www.instagram.com/jubileemedia/Jubilee Twitter: https://www.twitter.com/jubileemediaJubilee Website: https://www.jubileemedia.comFor brands interested in partnering with Jubilee, email us:hello@jubileemedia.comHelp us caption & translate this video!https://amara.org/v/C0J8p/"
"OFK3wViiQUw","Patrick Beverley says guarding LeBron James is no challenge | NBA on ESPN","2020-03-09T01:05:01.000Z","UCVSSpcmZD2PwPBqb8yKQKBA","NBA on ESPN","17","20.09.03","patrick beverley|pat beverley|beverley lebron|lebron beverley|clippers vs lakers|lakers vs clippers|patrick beverley post|patrick beverley post game|patrick beverley interview|lou williams|pat bev lebron|la clippers|los angeles lakers|lakers clippers post|clippers post game|clippers interview|nba clippers|lou williams post game|los angeles lakers vs la clipers|clippers 2020|nba|espn|nba on espn|nba 2020|nba news|espn nba|#NBA|basketball","122099","1350","1502","1203","https://i.ytimg.com/vi/OFK3wViiQUw/default.jpg","False","False","Patrick Beverley and Lou Williams speak to the media after the LA Clippers’ 112-103 loss to the Los Angeles Lakers, with Beverley (1:20) shutting down a question about guarding LeBron James, calling it no challenge.#NBA #ESPN☑️ Subscribe to ESPN+: https://plus.espn.com/📱Get the ESPN App: http://www.espn.com/espn/apps/espn🏀 Subscribe to NBA on ESPN on YouTube: http://bit.ly/2yxs3Og☑️Subscribe to ESPN on YouTube: http://es.pn/SUBSCRIBEtoYOUTUBE☑️Watch ESPN on YouTube TV: http://es.pn/YouTubeTVESPN on Social Media:🐦 Follow on Twitter: https://twitter.com/espn👥 Like on Facebook: http://www.facebook.com/espn📸 Follow on Instagram: http://www.instagram.com/espnMore on ESPN.com: http://www.espn.com"
"7vbwgHFQQ9g","Real Betis 2-1 Real Madrid - HIGHLIGHTS & GOALS - 3/8/2020","2020-03-08T22:38:00.000Z","UC0YatYmg5JRYzXJPxIdRd8g","beIN SPORTS USA","17","20.09.03","beIN SPORTS|beIN SPORTS USA|Futbol|Football|Real Madrid|Betis|Real Betis|highlights|goals|goles|jugadas|replay|gol|laLiga|Liga española","281826","2547","175","621","https://i.ytimg.com/vi/7vbwgHFQQ9g/default.jpg","False","False","Real Madrid missed the opportunity to return to the top of the table in LaLiga as they fell to a late 2-1 defeat at Real Betis on Sunday.#Betis #RealMadrid #LaLiga Connect with beIN SPORTS Online:Watch us on TV: http://bit.ly/2d7bf5YWatch us Online: http://bit.ly/1WNtvkcVisit our WEBSITE: http://beINSPORTS.comLike us on FACEBOOK: http://facebook.com/beINSPORTSUSAFollow us on TWITTER: http://twitter.com/beINSPORTSUSAFollow us on INSTAGRAM: http://instagram.com/beINSPORTSUSA"
