video_id,title,publishedAt,channelId,channelTitle,categoryId,trending_date,tags,view_count,likes,dislikes,comment_count,thumbnail_link,comments_disabled,ratings_disabled,description
"PSO7Qld8aQM","Why BMW Is No Longer The Leader In Luxury Sales","2020-01-02T18:22:24.000Z","UCvJJ_dzjViJCoLf5uKUTwoA","CNBC","25","20.04.01","CNBC|business|news|finance stock|stock market|news channel|news station|breaking news|us news|world news|cable|cable news|finance news|money|money tips|financial news|Stock market news|stocks|top gear|motortrend channel|chrisfix|doug demuro|carwow|scotty kilmer","889667","11466","978","4455","https://i.ytimg.com/vi/PSO7Qld8aQM/default.jpg","False","False","BMW lost its crown as the top-selling luxury brand around the world to fellow German rival Mercedes-Benz. In 2012, the BMW brand led Mercedes-Benz in global annual sales, but Mercedes-Benz gained the top spot in 2016 and has held it since. Mercedes has also surpassed BMW in its home continent of Europe, a major market for both. BMW appointed a new CEO in August 2019 and has assured investors it is on its way to reinvigorating its brand, but progress could be a bit slow.» Subscribe to CNBC: https://cnb.cx/SubscribeCNBC» Subscribe to CNBC TV: https://cnb.cx/SubscribeCNBCtelevision» Subscribe to CNBC Classic: https://cnb.cx/SubscribeCNBCclassicAbout CNBC: From 'Wall Street' to 'Main Street' to award winning original documentaries and Reality TV series, CNBC has you covered. Experience special sneak peeks of your favorite shows, exclusive video and more.Connect with CNBC News OnlineGet the latest news: https://www.cnbc.com/Follow CNBC on LinkedIn: https://cnb.cx/LinkedInCNBCFollow CNBC News on Facebook: https://cnb.cx/LikeCNBCFollow CNBC News on Twitter: https://cnb.cx/FollowCNBCFollow CNBC News on Instagram: https://cnb.cx/InstagramCNBC#CNBC#BMWWhy BMW Is No Longer The Ultimate Driving Machine"
"EBsSY24M4G8","Fredo - Aint Nothing Ft Yung Bans & Swaghollywood (Official Music Video)","2020-01-02T00:00:10.000Z","UCGDumBSWK7q6Rpdwz8osbYA","Prettyboyfredo","10","20.04.01","Mr beast|Faze Rug|The Ace Family|Vlogs|Pranks|Trending|DK4L|Yung Bans|Playboi carti|lyrical lemonade|Prettyboyfredo|Aint nothing|Swaghollywood|Aint nothin","1072745","90490","3744","6887","https://i.ytimg.com/vi/EBsSY24M4G8/default.jpg","False","False","Official music video Aint Nothing By Fredo Ft Yung Bans & SwaghollywoodEdited by SupafrshProduced by Nick MiraEngineered by Brandon 24 KFilmed by Damien & Isaih ConcepcionSound Cloud Link - https://soundcloud.com/prettyboyfredo/yung-bans-aint-nothing-ft-fredo-swaghollywoodClick here to subscribe to my channel ! - https://www.youtube.com/user/prettyboyfredo?sub_confirmation=1 New videos posted weekly.All of my official social media links!!!Instagram-  https://www.instagram.com/prettyboyfredo/Twitter-  https://twitter.com/PrettyboyfredoBe sure to follow me on Twitch- http://www.twitch.tv/prettyboyfredo"
"sOrXp9jDJAA","COSWORTH - Everything You Need to Know | Up to Speed","2020-01-02T17:00:09.000Z","UCL6JmiMXKoXS6bpP1D3bk8g","Donut Media","2","20.04.01","Cosworth|Ford Cosworth|Ford Escort RS Cosworth|Aston Martin Cosworth|Aston Martin Valkyrie|Mercedes Cosworth|Mercedes-Benz Cosworth|Ford Cosworth RS200|Ford Sierra RS Cosworth|Mercedes-Benz 190E Cosworth|Chevrolet Vega|Audi RS4|cosworth rally|F1 Cosworth|F1|Formula 1|rally|Donut Media|donut|doughnut media|Cars|Automotive|Car Review|Car Science|Car Tech|Best Cars|James Pumphrey|Up to Speed|review|everything you need to know","679960","26340","586","2237","https://i.ytimg.com/vi/sOrXp9jDJAA/default.jpg","False","False","Cosworth is solely responsible for arguably some of the coolest ever: the Ford Cosworth RS200, Ford Escort RS Cosworth, Ford Sierra RS Cosworth, the Mercedes-Benz 190E Cosworth, Chevrolet Vega, the freakin’ Audi RS4, and a long list of Cosworth powered racing cars from rally to Formula 1. So how in the world did a small British company establish itself as a performance powerhouse that is still working with companies such as Aston Martin, helping develop one of the most powerful naturally aspirated V12 engines ever? Up to Speed is a weekly automotive history show about the best cars, brands, designers, drivers and influencers ever. Host James Pumphrey covers everything from the Toyota Supra to the Chevy El Camino, The VW GTI to the Subaru WRX. The origins of every car will be uncovered to get you Up to Speed..Some of our best videos ever are coming out soon, stay tuned so you won't miss a thing!►Subscribe here: http://bit.ly/1JQ3qvOCheck out more Donut Media Videos: https://youtu.be/Pz8IGLgFE2s?list=PLF…Want a Donut shirt or sticker?  Visit https://shop.donut.media/Like us on Facebook: https://www.facebook.com/donutmedia/Click here if you want to learn more about Donut Media: http://www.donut.media/Donut Media is at the center of digital media for the next generation of automotive and motorsports enthusiasts. We are drivers, drifters, and car enthusiasts who love to tell stories."
"n6G8BMkNw_w","The Bentley Turbo R Was the Flagship Bentley 30 Years Ago","2020-01-02T16:56:34.000Z","UCsqjHFMB_JYTaEnf_vmTNqg","Doug DeMuro","2","20.04.01","bentley turbo r|bentley turbo r review|turbo r review|turbo r|bentley review|old bentley|bentley|bentley mulsanne|bentley brooklands|doug demuro|demuro|doug de muro|rolls-royce","774470","17994","526","2977","https://i.ytimg.com/vi/n6G8BMkNw_w/default.jpg","False","False","GO READ MY COLUMN!http://autotradr.co/OversteerTHANKS TO WS AUTO SALES!https://www.wsautosalesinc.com/The Bentley Turbo R was the flagship Bentley from 30 years ago. Today I'm reviewing this 1990 Bentley Turbo R to show you what it was like to drive the ultimate Bentley three decades ago. I'm also going to show you all the quirks and features of the Turbo R, and I drive the Bentley Turbo R to show you what it's like on the road. ROLLS-ROYCE SILVER SPUR:https://www.youtube.com/watch?v=cnAUnGjMd5UWEBSITE & MERCH!http://www.dougdemuro.comFOLLOW ME!Twitter - http://www.twitter.com/dougdemuroInstagram - http://www.instagram.com/dougdemuroFacebook - http://www.facebook.com/ddemuroDOUGSCORE CHART: https://www.dougdemuro.com/dougscore"
"1URzr7nKsy8","New Year's Resolutions for the '20s... but from 1920!","2020-01-02T22:00:00.000Z","UCXq2nALoSbxLMehAvYTxt_A","The Grumps","23","20.04.01","new years|resolutions|the roaring 20s|1920s|2020|the 20s|the twenties|THE SWINE WORLD|pigs","241064","13620","170","829","https://i.ytimg.com/vi/1URzr7nKsy8/default.jpg","False","False","Our second guest on these Dan-less episodes is ROSS O'DONOVAN everybody! There are a lot of old timey accents here, and boy oh boy are they incredible, just stellar, the real bee's knees! Just like those beautiful, well-bred hogs! Follow Ross on Twitch! ►► http://twitch.tv/rubberninjaMERCH ►► http://gamegrumps.com/merchClick to SUBSCRIBE ► http://bit.ly/GrumpSubscribe*********************************************Dir/shot by Tucker ► http://www.tuckerprescott.com► http://www.instagram.com/tucker.prescottProduced by Allie ► https://twitter.com/lilyloo*********************************************We have NEW MERCH every THURSDAY! Visit our WEBSITE every THURSDAY to check out the NEW items!►►► http://gamegrumps.com/merch*********************************************FACEBOOK ► https://www.facebook.com/GameGrumpsTWITTER ► https://www.twitter.com/gamegrumpsINSTAGRAM ► https://www.instagram.com/gamegrumps/WEBSITE ► http://gamegrumps.comGame Grumps are:Arin ► http://www.youtube.com/EgoraptorDanny ► http://www.youtube.com/NinjaSexParty#gamegrumps #The20s #NewYearsResolutions"
"1wBsKxwzPyo","WHAT JUST HAPPENED?","2020-01-02T13:00:00.000Z","UCtinbF-Q-fVthA0qrFQTgXQ","CaseyNeistat","22","20.04.01","[none]","2233987","149017","2913","7971","https://i.ytimg.com/vi/1wBsKxwzPyo/default.jpg","False","False","my Nana - https://www.youtube.com/watch?v=WsYAXPqVnYMmusic Wolf Saga - https://www.youtube.com/channel/UCf3gT9UKQOqUWpMdJ3Zxgnwsoundcloud: https://soundcloud.com/enterwolfsagahttps://www.instagram.com/wolf.saga/"
"cK-bnfnj7ds","VLOG SQUAD SURPRISED HIM WITH FAVORITE MEAL!!","2020-01-01T23:34:21.000Z","UCCI_8nSz_TYWWaXMV475c9Q","Jason Nash","23","20.04.01","emma chamberlain|vlogsuad|jonah|hill|actor|howie|mandel|charlie|puth|erin gilfoy|carly incontro|matt king|mariah amato|corinna kopf|kristen mcatee|alex ernst|vlogsuad best moments|gamer|david dobrik food review|david dobrik best moments|youtube|youtubers|edit|instagram|scotty|sire|vines|best vlogs|best of vlogs|challenges|cringey compilation|surprise|wittek|gaming|best surprises|david dobrik flirting|sour candy challenge|suck it up","808778","29069","570","1549","https://i.ytimg.com/vi/cK-bnfnj7ds/default.jpg","False","False","On today's vlog, I surprised David with Ilya!! I also surprised him with his favorite meal the arugula steak salad from Tommy Bahama!! And I check in with you all for the new year!!RWID MERCH►https://fanjoy.co/collections/jason-nashVIEWS PODCAST ►http://tinyurl.com/lp4d47lCOMEDY CENTRAL SHOW ► https://tinyurl.com/y577udpeDOWNLOAD MY MOBILE GAME ►iPHONE- https://tinyurl.com/yygq6ceuANDROID - https://tinyurl.com/y3m7nbv8Subscribe to David's Channel ► https://tinyurl.com/y98pgyu6And check out some of best videos: David Dobrik Puppet ►https://youtu.be/HCrwJ5H9kDMMarching Band Wake Up►https://youtu.be/_ERcNInvcHwBuying Family A House►https://youtu.be/6W33w6vHnN8Vlog Squad Lie Detector Test ►https://youtu.be/IBRueRpZIpcNatalie Clones ► https://youtu.be/_ca4G3zgKv0SUBSCRIBE TO MY FAMILY CHANNEL ► http://tinyurl.com/y9lvznvaSUBSCRIBE TO THIS CHANNEL ►http://tinyurl.com/ycbohtzwINSTAGRAM►https://www.instagram.com/jasonnash/FACEBOOK ►http://tinyurl.com/ybcxvbewSNAPCHAT ►@Jason23nashTWITTER►https://twitter.com/jasonnashMY MOVIES: JASON NASH IS MARRIED ►https://tinyurl.com/khassayFML ►fmlthemovie.comPostmates Code: W7WCI (get $10 in delivery credit!)"
"N1vWbcoTmkk","We Took The Polar Plunge","2020-01-01T20:00:01.000Z","UCIcgBZ9hEJxHv6r_jDYOMqg","Unus Annus","23","20.04.01","unus annus|markiplier|crankgameplays|memento mori|polar plunge|ice bucket challenge|jumping into ocean in winter|cold water in winter|polar plunge in winter|swimming in freezing water|new years day|new years challenge|new years polar plunge","1315461","120096","826","9936","https://i.ytimg.com/vi/N1vWbcoTmkk/default.jpg","False","False","There is only one RIGHT way to start a new year: By submerging yourself in freezing cold water. #ColdusAnnusᴍᴇʀᴄʜ ➤ http://www.unusannus.comᴜɴᴜs ➣ http://www.youtube.com/crankgameplaysᴀɴɴᴜs ➢ http://www.youtube.com/markiplierᴛᴡɪᴛᴛᴇʀ ► http://www.twitter.com/unusannusɪɴsᴛᴀɢʀᴀᴍ ► http://www.instagram.com/unusannusʀᴇᴅᴅɪᴛ ► http://www.reddit.com/r/unusannusᴛᴜᴍʙʟʀ ► http://www.unusannus.tumblr.comEdited by  ► http://www.youtube.com/crankgameplaysThis channel, along with every video that has or will ever be uploaded on this channel, will be deleted after our year has ended. This is inevitable. Inescapable. Irreversible.Do not archive or re-upload anything. This is our last wish. Our parting gift. Stay true to the purpose of our final year or we shall lay down wrath upon those that attempt to escape the end.Memento Mori.Unus Annus."
"vVaw4wjLfZo","Photos that look PHOTOSHOPPED but are REAL","2020-01-01T20:18:24.000Z","UCpB959t8iPrxQWj7G6n0ctQ","SSSniperWolf","24","20.04.01","sssniperwolf|sniper wolf|reacting|reaction|funny|photoshop|photos|pictures|photoshopped|real","1864734","55486","2958","5522","https://i.ytimg.com/vi/vVaw4wjLfZo/default.jpg","False","False","Photos that look photoshopped but are REAL! Some of these pictures just don't look real but they are! Leave a Like if you enjoyed! Watch weirdest nail art that shouldn't exist https://youtu.be/Oe-se_N04Rg Subscribe to join the Wolf Pack and enable notifications! http://bit.ly/SubSSSniperWolfInstagram: http://instagram.com/sssniperwolfTwitter: http://www.twitter.com/sssniperwolfFacebook: https://www.facebook.com/sssniperwolfOfficial Merch: https://ogwolfpack.com/"
"nkVkWlD1szY","I Paid $500 for $24,000 Worth Of Mystery Returns - Amazon Return Pallet Unboxing","2020-01-02T00:00:09.000Z","UCt_ePtr2GAaHMvlVo6Jnq_g","LunkersTV","17","20.04.01","[none]","569082","12915","1354","1505","https://i.ytimg.com/vi/nkVkWlD1szY/default.jpg","False","False","Well hopefully this pans out for me..My eBay store for those who care - http://bit.ly/LunkersEbaySAVE 30% ON YOUR TACKLE HERE - http://bit.ly/Save30HereTHE KNIVES I USE -http://bit.ly/signedknivesORDER MY BOOK ON AMAZON HERE - https://amzn.to/2v2qAOx► GET GOOGAN BAITS HERE - http://bit.ly/GooganBaitss► SPONSOR HERE - http://bit.ly/SPONSORHERE► Subscribe Here - http://bit.ly/SubtoLUNKERS► My Apparel -  http://bit.ly/LUNKERSTVapparel► Googan Monthly Shirt - http://bit.ly/Monthlysubscription►Free Range Coffee - http://bit.ly/FreeRangeTrading►Send Mail Here-Googan Squad 1001 East Hebron Parkway Carrollton, TX 75010 Suite 118► Buy LunkersTV Gear Here → http://bit.ly/LUNKERSTVapparel- - - - FIND ME ON SOCIAL MEDIA BELOW!! - - - -► INSTAGRAM → http://bit.ly/InstagramLunkers► TWITTER → http://bit.ly/LunkersTVtwitter► FACEBOOK → http://bit.ly/FacebookLunkers- - - - My Camera Gear - - - -► Advanced Editing Software → http://amzn.to/2rArkb7► Starter Vlog Camera → http://amzn.to/24KtxMD► Starter Lens For Vlog Camera → http://amzn.to/2qAobtm► Starter Mic For Vlogging →  http://amzn.to/25SgJty► Wind Screen For Mic → http://amzn.to/1sBfg92► Advanced Vlogging Camera → http://amzn.to/2q2pXkp► Advanced Vlogging Camera Lens → http://amzn.to/2rmGfIQ► Advanced Vlogging Camera Mic → http://amzn.to/2q2fe9t► Memory Card For Camera → http://amzn.to/1UjHTRn► Bendy Tripod For Vlogging Camera→ http://amzn.to/1sBfq0e► The GoPro I Use For Filming On Boat → http://amzn.to/21hax7O► Micro SD For GoPro → http://amzn.to/1UjI7I8► The GoPro Batteries I Use → http://amzn.to/1tlj6TUOutro Music - http://bit.ly/2ljN8F7*above are associate links*"
"lQP4bk1uGXM","What's Coming to Disney+ in 2020","2020-01-01T14:42:22.000Z","UC_5niPa-d35gg88HaS7RrIw","Disney","24","20.04.01","disney+|lizzie mcguire|hilary duff|toy story|mandalorian|baby yoda|the child|star wars|marvel|lucas film|national geographic|nat geo|disney|the simpsons|streaming|series|tv|movies|films|blockbuster|the lion king","5466123","25567","1141","3451","https://i.ytimg.com/vi/lQP4bk1uGXM/default.jpg","False","False","New year, new stories—and some familiar ones! From Toy Story 4 and Aladdin to Lizzie McGuire and Marvel Studios’ WandaVision, here’s a look at the blockbusters and Originals coming to #DisneyPlus in 2020.For more updates, subscribe to Disney, Pixar, Marvel, Star Wars, and National Geographic. Disney+ is the ultimate streaming destination for entertainment from Disney, Pixar, Marvel, Star Wars, and National Geographic. Follow Disney+ for the latest:Disney+: https://disneyplus.com/Instagram: https://www.instagram.com/DisneyPlus/Twitter: https://www.twitter.com/DisneyPlus/Facebook: https://www.facebook.com/DisneyPlus/"
"xXBWi2u5IqM","Jerry Jones isn't rushing to fire Cowboys coach Jason Garrett - Damien Woody | First Take","2020-01-02T16:41:32.000Z","UCiWLfSweyRNmLpgEHekhoAg","ESPN","17","20.04.01","jerry jones|jason garrett|dallas cowboys espn|espn dallas cowboys|first take|first take cowboys|cowboys espn|espn cowboys|cowboys first take|espn first take|first take nfl|nfl first take|first take today|#firsttake|first take espn today|espn|first take espn|espn nfl|nfl on espn|espn first take today|jason garrett espn|espn jason garrett|nfl|dallas cowboys|jerry jones jason garrett|dallas cowboys news|dallas cowboys nfl|cowboys news|#nfl","183083","1302","127","324","https://i.ytimg.com/vi/xXBWi2u5IqM/default.jpg","False","False","Watch The Best of First Take 2019 | Part 1: https://youtu.be/8R-6-wpFMgoWatch The Best of First Take 2019 | Part 2: https://youtu.be/X7gMhIRwubwDamien Woody reacts to Cowboys owner Jerry Jones' decision to hold a third meeting with head coach Jason Garrett to discuss his future in Dallas.#FirstTake #NFL✔ Subscribe to ESPN+ https://plus.espn.com/✔ Get the ESPN App: http://www.espn.com/espn/apps/espn✔ Subscribe to ESPN on YouTube: http://es.pn/SUBSCRIBEtoYOUTUBE✔ Subscribe to ESPN FC on YouTube: http://bit.ly/SUBSCRIBEtoESPNFC✔ Subscribe to NBA on ESPN on YouTube: http://bit.ly/SUBSCRIBEtoNBAonESPN✔ Watch ESPN on YouTube TV: http://es.pn/YouTubeTVExclusive interviews with Rachel Nichols https://urlzs.com/jNUReStephen A. Smith on ESPN https://urlzs.com/W19TzESPN on Social Media:► Follow on Twitter: http://www.twitter.com/espn► Like on Facebook: http://www.facebook.com/espn► Follow on Instagram: www.instagram.com/f/espnVisit ESPN on YouTube to get up-to-the-minute sports news coverage, scores, highlights and commentary for NFL, NHL, MLB, NBA, College Football, NCAA Basketball, soccer and more. More on ESPN.com: https://www.espn.com"
"TAaTbf13ipg","My new laptop just got Dunked - XPS 13 Update","2020-01-02T17:56:57.000Z","UCXuqSBlHAE6Xw-yeJA0Tunw","Linus Tech Tips","28","20.04.01","Dell|XPS|13|Intel|10nm","721383","24112","2778","1924","https://i.ytimg.com/vi/TAaTbf13ipg/default.jpg","False","False","Thanks to monday.com for sponsoring this video! Sign up for an extended 30-day free trial at https://lmg.gg/gtyykGo to https://privacy.com/linus ​to get $5 off your first purchase!We're in San Francisco to get a first look at the all new Dell XPS 13 - and does it ever look good.Buy Dell XPS 13On Amazon (PAID LINK): https://geni.us/M4biOROn Newegg (PAID LINK): https://lmg.gg/Cb0CnPurchases made through some store links may provide some compensation to Linus Media Group.Discuss on the forum: https://linustechtips.com/main/topic/1141076-my-new-laptop-just-got-dunked/Our Affiliates, Referral Programs, and Sponsors: https://lmg.gg/sponsorsGet a Displate Metal Print at https://lmg.gg/displatelttGet a 30-day free trial of Amazon Prime at https://lmg.gg/8KV1vLinus Tech Tips merchandise at http://www.LTTStore.com/ Our Test Benches on Amazon: https://www.amazon.com/shop/linustechtips Our production gear: http://geni.us/cvOSTwitter - https://twitter.com/linustechFacebook - http://www.facebook.com/LinusTechInstagram - https://www.instagram.com/linustechTwitch - https://www.twitch.tv/linustech Intro Screen Music Credit:Title: Laszlo - SupernovaVideo Link: https://www.youtube.com/watch?v=PKfxmFU3lWYiTunes Download Link: https://itunes.apple.com/us/album/supernova/id936805712Artist Link: https://soundcloud.com/laszlomusicOutro Screen Music Credit: Approaching Nirvana - Sugar High http://www.youtube.com/approachingnirvana"
"XMv172RH9Is","SUNS at LAKERS | FULL GAME HIGHLIGHTS |  January 1, 2020","2020-01-02T06:11:39.000Z","UCWJ2lWNubArHWmf3FIHbfcQ","NBA","17","20.04.01","sp:ty=high|sp:dt=2020-01-02T03:30:00Z|sp:st=basketball|sp:li=nba|sp:ti:home=LAL|sp:ti:away=PHX|Full Game Recap|Full Game Highlights|NBA|Basketball|Pass|Assist|Dunk|Jump Shot|Steal|Rebound|Phoenix Suns|Los Angeles Lakers","732765","4392","298","742","https://i.ytimg.com/vi/XMv172RH9Is/default.jpg","False","False","SUNS at LAKERS | FULL GAME HIGHLIGHTS |  January 1, 2020The Los Angeles Lakers defeated the Phoenix Suns, 117-107. LeBron James (31 PTS, 13 REB, 12 AST) recorded a triple-double, while Anthony Davis had 26 PTS and 11 REB. Devin Booker led the Suns with 32 PTS.Catch Thursday's action on NBA TV: Toronto Raptors at Miami Heat, 7:30 pm/et & Detroit Pistons at LA Clippers, 10:30 pm/etSubscribe to the NBA: https://on.nba.com/2JX5gSN Full Game Highlights Playlist: https://on.nba.com/2rjGMgeFor news, stories, highlights and more, go to our official website at https://nba_webonly.app.link/nbasiteGet NBA LEAGUE PASS: https://nba.app.link/nbaleaguepass5"
"yM2QRNtkGDg","Lil Tjay - 20/20 (Official Audio)","2020-01-01T05:00:24.000Z","UChwzHCrvf74cjQzmubiV8nw","liltjayVEVO","10","20.04.01","True 2 Myself|Lil Tjay True 2 Myself|True2Myself|True To Myself|True|Myself|LilTjay|Tjay|Prince Of New York|New York|Hip-Hop|Rap|Bronx|New York Rap|2020|Twenty Twenty|Lil Tjay 2020|20/20|Columbia|Hip Hop|Lil Tjay","1785808","120170","872","6374","https://i.ytimg.com/vi/yM2QRNtkGDg/default.jpg","False","False","Official audio for 20/20 by Lil Tjay.Listen & Download “20/20 out now: https://LilTjay.lnk.to/2020Amazon - https://LilTjay.lnk.to/2020/amazonApple Music - https://LilTjay.lnk.to/2020/applemusiciTunes - https://LilTjay.lnk.to/2020/itunesSpotify - https://LilTjay.lnk.to/2020/spotifyYouTube Music - https://LilTjay.lnk.to/2020/youtubemusicFollow Lil TjayFacebook - https://www.facebook.com/LilTjayGunplay/Instagram - https://www.instagram.com/liltjay/Twitter - https://twitter.com/liltjay https://www.liltjaymusic.com/#LilTjay #2020"
"L_PvagQb_lA","Star Wars: The Rise of Skywalker - Nostalgia Critic","2020-01-01T23:00:02.000Z","UCiH828EtgQjTyNIMH6YiOSw","Channel Awesome","24","20.04.01","channel awesome|nostalgia critic|star wars|star wars the rise of skywalker|the rise of skywalker|the rise of skywalker review|movie|film|star wars movies|star wars review|new star wars movie|the rise of skywalker movie|movie review|film review|doug walker|star wars episode IX|j.j. abrams|star wars sequel|the rise of skywalker explained|the rise of skywalker ending|star wars ending|carrie fisher|mark hamill|adam driver|daisy ridley|john boyega","463296","20321","1960","5904","https://i.ytimg.com/vi/L_PvagQb_lA/default.jpg","False","False","Use code nostalgia10 to get 10 free meals including shipping. That’s $90 off your first month of HelloFresh! https://bit.ly/2SiE9GK Purchase required.The final installment in the new Star Wars trilogy has a lot of people split. Let's see if the Nostalgia Critic can figure out why.  Time to take a look at Star Wars: The Rise of Skywalker.Support this week's charity - https://actionministries.net/Special thanks to https://www.youtube.com/user/TheEricButtsStar Wars: The Rise of Skywalker (also known as Star Wars: Episode IX – The Rise of Skywalker) is a 2019 American epic space-opera film produced, co-written, and directed by J. J. Abrams. It is the third installment of the Star Wars sequel trilogy, following The Force Awakens (2015) and The Last Jedi (2017), and the final episode of the nine-part Skywalker saga. It was produced by Lucasfilm and Abrams's production company Bad Robot Productions, and was distributed by Walt Disney Studios Motion Pictures. The ensemble cast includes Carrie Fisher, Mark Hamill, Adam Driver, Daisy Ridley, John Boyega, Oscar Isaac, Anthony Daniels, Naomi Ackie, Domhnall Gleeson, Richard E. Grant, Lupita Nyong'o, Keri Russell, Joonas Suotamo, Kelly Marie Tran, Ian McDiarmid, and Billy Dee Williams. Go to our Store for Awesome Stuff - https://theawesomestore.comGet some Nostalgia Critic T-Shirts here - http://shrsl.com/?~96c0See more at our Site: http://channelawesome.comFacebook: https://www.facebook.com/channelawesomeTwitter: http://twitter.com/channelawesomeInstagram: https://www.instagram.com/channelawesome/Like Doug on Facebook: https://www.facebook.com/pages/Doug-Walker/127127037353766The ONLY Official Youtube channel for the Nostalgia Critic and Channel Awesome.New Nostalgia Critic episodes every Wednesday at 5PM CST.#StarWars #TheRiseofSkywalker #NostalgiaCritic"
"SDT9atA2LHk","EXPENSIVE THINGS I REGRET BUYING 2","2020-01-02T00:34:02.000Z","UC2hFZwNM71iOOCY3guLE7KQ","Little Lia","26","20.04.01","sssniperwolf|little lia|haul|shopping haul|luxury|expensive|cheap|gucci|chanel|regret","612533","21451","1840","2920","https://i.ytimg.com/vi/SDT9atA2LHk/default.jpg","False","False","Another luxury shopping haul of expensive things I regret buying like Gucci and Chanel... Download Cleo https://cleo.app.link/little_lia Leave a Like if you enjoyed this haul! Subscribe so you don’t miss videos!Main Channel: https://www.youtube.com/user/sssniperwolfInstagram: http://instagram.com/sssniperwolfTwitter: http://www.twitter.com/sssniperwolfFacebook: https://www.facebook.com/sssniperwolfOfficial Merch: https://ogwolfpack.com/"
"JGMLEsR-Hb4","The 2020 Rose Parade by KTLA 5","2020-01-01T18:16:20.000Z","UCinjnmQEwCddOudyCC1v7qA","KTLA 5","24","20.04.01","Rose Parade|2020 rose parade|tournament of roses|pasadena","608155","4446","381","641","https://i.ytimg.com/vi/JGMLEsR-Hb4/default.jpg","False","False","The 131st Rose Parade, on New Year's Day 2020, is themed The Power of Hope. The parade along 5 1/2 miles of Pasadena city streets includes 39 floral-decorated floats, 20 marching bands, 17 equestrians units, and of course the Royal Court and the 102nd Rose Queen, Camille Kennedy. Grand Marshalls:-Olympic gymnast Laurie Hernandez-actress Gina Torres-performer Rita Moreno KTLA's hosts for the broadcast of the parade:-Leeza Gibbons-Mark Steines-Micah Ohlman The Jan. 1, 2020, airing marks the 73rd consecutive television broadcast of the parade on KTLA, L.A.'s Very Own. #RoseParade"
