video_id,title,publishedAt,channelId,channelTitle,categoryId,trending_date,tags,view_count,likes,dislikes,comment_count,thumbnail_link,comments_disabled,ratings_disabled,description
"dlk7Q2t_-HM","The OFFICIAL GENDER REVEAL Of THE ROYALTY FAMILY! **BOY or GIRL?**.","2020-03-01T16:00:56.000Z","UCja7QUMRG9AD8X2F_vXFb9A","The Royalty Family","22","20.05.03","The Royalty Family|Royalty Family|Andrea Espada|Family Friendly|gender reveal|boy or girl|official gender reveal|royalty family gender reveal|royalty family baby|official gender reveal of the royalty family|ferran|royalty|royalty family challenges|official gender|boy|girl|family vlog|reveal gender|the official|royal|royal gender reveal","3746352","156613","9830","0","https://i.ytimg.com/vi/dlk7Q2t_-HM/default.jpg","True","False","The OFFICIAL GENDER REVEAL Of THE ROYALTY FAMILY! Boy or Girl?𝐒𝐔𝐁𝐒𝐂𝐑𝐈𝐁𝐄 ᕼEᖇE! ➡ https://youtube.com/RoyaltyFamMERCH ➡ https://royalty.laWe Tested VIRAL TikTok LIFE HACKS... **THEY WORKED** ➡ https://youtu.be/2vvr4PQ9ma4TELLING OUR SON FERRAN WE'RE HAVING a BABY! EMOTIONAL...➡ https://youtu.be/bjrHdVM3zl8#GenderReveal #FamilyVlog #TheRoyaltyFamilyWatch our RECENT VIDEOS  ➡ https://bit.ly/2JotKG4Watch Our POPULAR VIDEOS! ➡ http://bit.ly/2NgagCxWatch Our CHALLENGES  ➡ https://bit.ly/2kqDqVD FOLLOW IᑎᔕTᗩGᖇᗩᗰ HERE ☟ANDREA ➡ https://www.instagram.com/andreaespadatv/ALI           ➡https://www.instagram.com/4kpapi/FERRAN  ➡https://www.instagram.com/kingferran/BUSINESS INQUIRIES ➡ @AndreaEspada.Bookings@Gmail.comWelcome To THE ROYALTY FAMILY Youtube Channel. We are a modern blended family based in Los Angeles that love to entertain you. We believe in family, fun, Love and are passionate about fashion, comedy and culture. Join us every week in sharing the good times of Andrea, Ali, Ferran and our Chihuahua Princesa. Best of all, we believe everyone can be ROYALTY so don’t forget to SUBSCRIBE!!The OFFICIAL GENDER REVEAL Of THE ROYALTY FAMILY! **BOY or GIRL?**.https://youtu.be/dlk7Q2t_-HMThe Royalty Familyhttps://www.youtube.com/channel/UCja7QUMRG9AD8X2F_vXFb9A"
"jR7XCdSmtf4","Coronavirus: Italy infections jump 50 per cent in 24 hours - as global death toll pass 3,000","2020-03-02T20:02:21.000Z","UCTrQ7HXWRRxr7OsOtodr2_w","Channel 4 News","25","20.05.03","Channel 4 News|virus|china virus|coronavirus|china news|china disease|covid-19|coronavirus china|coronavirus risks|how to prevent coronavirus|coronavirus uk|coronavirus what is it|wuhan china coronavirus|coronavirus china 2020|coronavirus outbreak in china|coronavirus outbreak|new china virus|virus infection explained|british man coronavirus|coronavirus britain|coronavirus wales|wuhan|china virus wuhan|wuhan virus|wuhan coronavirus|coronavirus timeline","651460","4757","496","3902","https://i.ytimg.com/vi/jR7XCdSmtf4/default.jpg","False","False","The country worst affected by the coronavirus in Europe is Italy where infections have jumped by fifty per cent in 24 hours and 52 people have died. (Subscribe: https://bit.ly/C4_News_Subscribe) The death toll worldwide has now surpassed 3,000 , with more than 89,000 infections confirmed. Some of the latest countries to report cases include Azerbaijan, Ecuador, Latvia and Senegal. Iran is experiencing a severe outbreak.  66 people are said to have died from Covid-19, but there are fears that the government there has not reported its true scale.  -----------------------  Follow us on Instagram - https://www.instagram.com/Channel4News"
"pPUOg9eLVAk","The 2020 Subaru WRX is a Modern Day Classic","2020-03-03T13:00:17.000Z","UC86SBFIAgnYL3ll2ZDgmsuA","TheStraightPipes","2","20.05.03","TheStraightPipes|The Straight Pipes|Straight Pipes|StraightPipes|Exhaust|Sound|Review|2020|subaru|wrx|sti|subaru wrx|2020 subaru wrx|subaru wrx review|sport tech|sport tech rs|2020 subaru wrx review|subaru wrx sport tech|subaru wrx sport tech rs","297934","8656","229","1138","https://i.ytimg.com/vi/pPUOg9eLVAk/default.jpg","False","False","2020 Subaru WRX Review by The Straight Pipes. The Subaru WRX is pumping out 268hp and 258lb-ft tq from a 2L 4 cylinder turbo boxer engine. At $39,695, would this be your pick over the Subaru WRX STI, VW GTI, VW Jetta GLI, Honda Civic Si, Honda Civic Type R, Subaru BRZ, VW Golf R, Hyundai Veloster N?Support us on Patreon: https://www.patreon.com/thestraightpipesBecome a YouTube Member! https://www.youtube.com/channel/UC86SBFIAgnYL3ll2ZDgmsuA/joinSubscribe! http://www.youtube.com/subscription_center?add_user=TheStraightPipesFacebook! https://www.facebook.com/thestraightpipesInstagram! https://www.instagram.com/thestraightpipesTwitter! https://twitter.com/StraightPipersBuy our merch at https://teespring.com/stores/thestraightpipesCheck out Continental Tire at https://www.continentaltire.ca-------------------#subaru #wrx #subaruwrx-------------------"
"Qspam8ftpIc","Half-Life: Alyx Gameplay Video 3","2020-03-02T20:11:58.000Z","UCg0FSqPeiGD_lIiPaaAehQg","Valve","20","20.05.03","[none]","676429","39255","830","4200","https://i.ytimg.com/vi/Qspam8ftpIc/default.jpg","False","False","Return to City 17 on March 23, 2020.Set between the events of Half-Life and Half-Life 2, Half-Life: Alyx is a new full-length game built from the ground up by Valve for virtual reality.This video demonstrates the Shift locomotion style.Pre-purchase on Steam: https://store.steampowered.com/app/546560/HalfLife_Alyx/Read more: https://steamcommunity.com/games/546560/announcements/detail/1710743290795360946#HalfLifeAlyx#HalfLife"
"zCcIYhQ8mZc","BABY'S FIRST STEPS!","2020-03-02T19:34:52.000Z","UCR-QYzXrZF8yFarK8wZbHog","Colleen Ballinger","23","20.05.03","colleen ballinger|colleen|ballinger|psychosoprano|miranda sings|no lipstick|vlog|vlogging|singing|without lipstick|comedy|how to|tutorial|silly|funny","878791","57285","381","3872","https://i.ytimg.com/vi/zCcIYhQ8mZc/default.jpg","False","False","Come see me on tour!http://www.mirandasings.comFollow me on all the things! TikTok - ColleenSingsStuffTwitter - http://www.twitter.com/ColleenB123Facebook - https://www.facebook.com/ColleenB1234youtube - http://www.youtube.com/psychosopranoInstagram - http://instagram.com/colleenSnapchat - ColleenBusiness inquiries - msingsbranding@gmail.com"
"zF9PdMVteOQ","Real Madrid 2 - 0 FC Barcelona - HIGHLIGHTS & GOALS - 03/01/2020","2020-03-01T22:12:32.000Z","UC0YatYmg5JRYzXJPxIdRd8g","beIN SPORTS USA","17","20.05.03","beIN SPORTS|beIN SPORTS USA|Futbol|Football|real madrid|rma fcb|real madrid barcelona|barcelona|vinicius jr|vinicius jr goal|mariano goal|mariano|vinicius|zidane|fc barcelona|republica dominicana|santiago bernabeu|cristobal soria|y vinicius pa cuando remix|y vinicius pa cuando roncero|y vinicius pa cuando programa completo|y vinicius pa cuando|tito soria","1492231","15507","1150","2895","https://i.ytimg.com/vi/zF9PdMVteOQ/default.jpg","False","False","Real Madrid fought a hard battle to come victorious in this year's first #ElClasico. Vinicius Jr. & Mariano unexpected heroes.Real Madrid peleó una dura batalla para salir avante del primer clásico del año. Héroes inesperados: Vinicius Jr. y Mariano. Connect with beIN SPORTS Online:Watch us on TV: http://bit.ly/2d7bf5YWatch us Online: http://bit.ly/1WNtvkcVisit our WEBSITE: http://beINSPORTS.comLike us on FACEBOOK: http://facebook.com/beINSPORTSUSAFollow us on TWITTER: http://twitter.com/beINSPORTSUSAFollow us on INSTAGRAM: http://instagram.com/beINSPORTSUSA#LaLiga #RealMadrid #Barcelona"
"DbVgA3X8zAU","Clare Crawley announced as the new Bachelorette on ‘GMA’ l GMA","2020-03-02T14:44:25.000Z","UCH1oRy1dINbMVp3UFWrKP0w","Good Morning America","24","20.05.03","newest|Bachelorette|love|romance|Bachelor|star|Juan|Pablo|finale|of|season|18|entertainment|GMA|p_cmsid=2494279|p_vid=news-69331634|bachelorette 2020|who is the next bachelorette|clare crawley age|new bachelorette 2020|how old is clare crawley|the bachelor|The Bachelor Season 18|Bachelor Nation|Clare Crawley IG|Clare Crawley Insta|Good Morning America","429437","3292","807","1282","https://i.ytimg.com/vi/DbVgA3X8zAU/default.jpg","False","False","You may remember Crawley, who famously stood up to Juan Pablo in the finale of season 18 of “The Bachelor.”LEARN MORE: https://gma.abc/2PC6WUESubscribe to GMA's YouTube page:  https://bit.ly/2Zq0dU5 Visit Good Morning America's homepage:https://www.goodmorningamerica.com/ Follow GMA:Facebook: https://www.facebook.com/GoodMorningAmericaTwitter: https://twitter.com/gmaInstagram: https://instagram.com/goodmorningamericaWatch full episodes of GMA:http://abc.go.com/shows/good-morning-americahttps://hulu.tv/2YnifTH#GMA #TheBachelorette #ClareCrawley #TheBachelor"
"cITy9Kp1Bwo","$1000 FULL FACE LUXURY MAKEUP TESTED","2020-03-02T18:00:06.000Z","UC4qk9TtGhBKCkoWz5qGJcGg","Tati","26","20.05.03","YouTube|Beauty|Makeup|Tutorial|Review|blogger|Tati|Westbrook|GlamLifeGuru|how to|makeup tutorial|Beauty expert|drugstore|luxury|favorites|Best|cosmetics|Tati Westbrook|Tati Beauty|Halo Beauty|Makeup Review|New Makeup|Weird Makeup","593821","27397","1116","2070","https://i.ytimg.com/vi/cITy9Kp1Bwo/default.jpg","False","False","Today I'm testing over $1,000 of New Luxury Makeup!xo's ~ Tati 😇  SAVE w/ HALO DISCOUNT BUNDLES 🥝 » » » https://halobeauty.com/collections/bu...🦋 TATI BEAUTY MAKEUP  ✨» » »  https://TatiBeauty.com ✔﻿  P R O D U C T S  M E N T I O N E D & M A K E U P  W O R NCharlotte Tilbury | Charlotte's Magic Cream // $100Charlotte Tilbury | Mini Miracle Eye Wand // $45Lancer | Studio Filter Pore Perfecting Primer // $58Givenchy | Teint Couture City Balm Radiant Perfecting Skin Tint // $45Glow Recipe | Watermelon Glow Lip Pop // $22Dior | Forever Skin Correct Concealer // 1.5N // $36Koh Gen Do |Aqua Foundation Illuminator // $55Charlotte Tilbury |Airbrush Flawless Finish // 1 Fair // $45Jouer | Essential High Coverage Concealer Pen // $22Charlotte Tilbury | Filmstar Bronze & Glow // $68Tom Ford | Soleil Contouring Compact // $110Givenchy | Metallic Lipstick // $39Givenchy | Prisme Powder Blush Duo // $46Make Up For Ever | Pro Sculpting Brow Palette // $29Amazing Cosmetics | Illuminate Eye Primer // $24By Terry | V.I.P Expert Palette // Paris By Light // $56Natasha Denona | Love Palette // $65Charlotte Tilbury | Rock 'N' Kohl // Barbarella Brown // $29Hourglass | Arch Brow Volumizing Fiber Gel // $28By Terry | Lash-Expert Twist Brush Mascara // $30Dior | Lip Glow Oil // $34Natasha Denona | Lip Oh-Phoria Gloss & Balm // $26Victoria Beckham Beauty | Lip Definer // $24Fenty Beauty | What it Dew Makeup Refreshing Spray // $30✔﻿ S N A P C H A Thttps://www.snapchat.com/add/TatiWestbrook✔﻿ I N S T A G R A Mhttp://instagram.com/glamlifeguru✔﻿ T W I T T E Rhttp://twitter.com/#!/glamlifeguru✔﻿ F A C E B O O Khttp://facebook.com/GlamLifeGuru✔﻿ E M A I LTati@GlamLifeGuru.comFTC DISCLAIMER:  This video is Not Sponsored and there are no affiliate links.✔﻿ WRITE TO ME HERETati Westbrook1905 Wilcox AveSuite #111Los Angeles, CA  90068All Rights Reserved © 2020, Tati Westbrook Hi I'm Tati from GlamLifeGuru, thank you for watching my video, please be sure to check out my collection of makeup videos where you'll find my best beauty tips, tricks and favorites on everything from top luxury cosmetics to my favorite drugstore makeup. Whether you're looking for a new product review, tutorial, beauty tip, haul or perhaps even a giveaway, I hope you enjoy watching."
"k8fBQ0N5354","When you ACTUALLY answer a 'Scam Likely' call","2020-03-02T01:09:01.000Z","UCI1XS_GkLGDOgf8YLaaXNRA","CalebCity","23","20.05.03","[none]","1834816","213281","1413","8306","https://i.ytimg.com/vi/k8fBQ0N5354/default.jpg","False","False","I actually yelled at a scam caller to stop before and they just hung up 😠...then they called laterMusicOddwin - 19"
"1H6GBF4tADU","Acrylic Nails and ASMR - 10 Minute Power Hour","2020-03-02T22:00:02.000Z","UCXq2nALoSbxLMehAvYTxt_A","The Grumps","23","20.05.03","egoraptor|danny|game grumps|gamegrumps|funny|arin|thegrumps|grumps|asmr|nails|acrylic nails|manicure|nail art","354354","24988","219","1915","https://i.ytimg.com/vi/1H6GBF4tADU/default.jpg","False","False","The boys get fabulous and in your ear holes! Firsthand they experience how your entire posture and demeanor can change because there are some long pieces of plastic on the tips of your fingers. It really does something to the mind. It really brings out the SASS. MERCH ►► http://gamegrumps.com/merchClick to SUBSCRIBE ► http://bit.ly/GrumpSubscribe*********************************************Music from Stevia Sphere ► http://www.steviasphere.bandcamp.comMystery Sax Kevin MacLeod (incompetech.com)Licensed under Creative Commons: By Attribution 3.0 License*********************************************We have NEW MERCH every THURSDAY! Visit our WEBSITE every THURSDAY to check out the NEW items!►►► http://gamegrumps.com/merch*********************************************FACEBOOK ► https://www.facebook.com/GameGrumpsTWITTER ► https://www.twitter.com/gamegrumpsINSTAGRAM ► https://www.instagram.com/gamegrumps/WEBSITE ► http://gamegrumps.comGame Grumps are:Arin ► http://www.youtube.com/EgoraptorDanny ► http://www.youtube.com/NinjaSexParty#TheGrumps #AcrylicNails #ASMR"
"_c17qFtgxFw","IDOL HISTORY IS MADE as a Contestant Walks In Off the Street to Auditon - American Idol 2020","2020-03-02T01:42:58.000Z","UCAMPco9PqjBbI_MLsDOO4Jw","American Idol","24","20.05.03","American Idol 2019|American Idol|singing competition|Katy Perry|Ryan Seacrest|Luke Bryan|Lionel Richie|covers|sing|ABC|Courtney Timmons|Rise Up|Andra Day","3114419","67820","1070","4451","https://i.ytimg.com/vi/_c17qFtgxFw/default.jpg","False","False","Courtney Timmons walks in off of the street to audition for American Idol. She brings Ryan Seacrest to tears, but will her audition of Rise Up by Andra Day be enough to convince Katy Perry, Lionel Richie and Luke Bryan?See more of American Idol 2020 on our official site: http://www.americanidol.comLike American Idol on Facebook: https://www.facebook.com/AmericanIdolFollow American Idol on Twitter: https://twitter.com/americanidolFollow American Idol on Instagram: https://www.instagram.com/americanidol/AMERICAN IDOL, the iconic series that revolutionized the television landscape by pioneering the music competition genre, returns on ABC.American Idol 2020Helping to determine who America will ultimately vote for to become the next singing sensation are music industry forces and superstar judges Luke Bryan, Katy Perry and Lionel Richie. Emmy® Award-winning host and producer Ryan Seacrest continues as host of the beloved series, while multimedia personality Bobby Bones serves at the in-house mentor."
"bzs_l5-Emzo","Try Not To Get Anxiety Challenge #2","2020-03-01T16:25:00.000Z","UCYzPXprvl5Y-Sf0g4vX-m6g","jacksepticeye","23","20.05.03","jacksepticeye|try not to get anxiety|try not to get anxiety challenge|try not to get anxiety jacksepticeye|challenge|challenge videos|try not to anxiety|try not to get anxiety heights|try not to get anxiety impossible|anxiety challenge|impossible challenge|try not to|scared|reddit|sweaty palms|crazy challenge|try not to challenge|jacksepticeye challenge|funny|funny videos|funny try not to get anxiety challenge video","2035364","126301","1921","9825","https://i.ytimg.com/vi/bzs_l5-Emzo/default.jpg","False","False","Welcome back to the try not to get anxiety challenge. Last time I failed very badly, how will we do this time? SUB TO BE EPIC - https://www.youtube.com/user/jacksepticeye?sub_confirmation=1Become a Sponsor: https://youtube.com/jacksepticeye/join►Twitter : https://twitter.com/Jack_Septic_Eye►Instagram: http://instagram.com/jacksepticeye"
"6d7Vk_qaiB8","Airport Sushi - SNL","2020-03-01T07:06:50.000Z","UCqFzWxSCi39LnW1JKFR3efg","Saturday Night Live","24","20.05.03","snl|saturday night live|snl season 45|snl 45|john mulaney|david byrne|beck bennett|mikey day|pete davidson|kate mckinnon|chris redd|cecily strong|kenan thompson|melissa villaseñor|chloe fineman|musical|airport sushi|s45|s45e14|episode 14|live|new york|comedy|sketch|funny|hilarious|late night|host|music|guest|laugh|impersonation|actor|New In Town|The Comeback Kid|SpiderMan|Into the Spider-Verse|Spider-Ham|Kid Gorgeous|The Top Part","4534188","86105","5486","5277","https://i.ytimg.com/vi/6d7Vk_qaiB8/default.jpg","False","False","A man (Pete Davidson) surprises everyone (John Mulaney, Chris Redd) by buying sushi at LaGuardia Airport.Watch Diner Lobster: https://youtu.be/Pj-D0jc17D0Watch Bodega Bathroom: https://youtu.be/vgBxxEL-3TISubscribe to SNL: https://goo.gl/tUsXwMStream Current Full Episodes: http://www.nbc.com/saturday-night-live WATCH PAST SNL SEASONSGoogle Play - http://bit.ly/SNLGooglePlayiTunes - http://bit.ly/SNLiTunes SNL ON SOCIALSNL Instagram: http://instagram.com/nbcsnlSNL Facebook: https://www.facebook.com/snlSNL Twitter: https://twitter.com/nbcsnlSNL Tumblr: http://nbcsnl.tumblr.com/SNL Pinterest: http://www.pinterest.com/nbcsnl/ GET MORE NBCLike NBC: http://Facebook.com/NBCFollow NBC: http://Twitter.com/NBCNBC Tumblr: http://NBCtv.tumblr.com/YouTube: http://www.youtube.com/nbcNBC Instagram: http://instagram.com/nbctv #SNL #JohnMulaney #DavidByrne #SNL45"
"eVmQDR4vKRM","Spike in coronavirus cases and fatalities around the world","2020-03-02T02:28:01.000Z","UCBi2mrWuNuyYy4gbM6fU18Q","ABC News","25","20.05.03","coronavirus|fatalities|covid-19|washington|state|research|infecting|world|news|wnt|abc|p_cmsid=2494279|p_vid=news-69326714","826622","7896","885","6488","https://i.ytimg.com/vi/eVmQDR4vKRM/default.jpg","False","False","Researchers believe COVID-19 has been infecting people in Washington state for weeks.WATCH THE FULL EPISODES OF 'WORLD NEWS TONIGHT':https://bit.ly/35ZFVjmWATCH OTHER FULL EPISODES OF WORLD NEWS TONIGHT:http://abc.go.com/shows/world-news-tonightWATCH WORLD NEWS TONIGHT ON HULU:https://hulu.tv/33iKepm#WorldNewsTonight #Coronavirus #COVID-19 #Washington"
"OjlrRcMObEc","AWD BURNOUT IN MY 1000HP 4 ROTOR RX-7!","2020-03-02T12:02:38.000Z","UChg9P8du8Ykqy6MbMK5jpzQ","Rob Dahm","2","20.05.03","Custom & Performance Vehicles|Mazda|Sports Cars|Vehicle Modification & Tuning|Vehicle Parts & Accessories|Engine & Transmission|High Performance & Aftermarket Auto Parts|Vehicle Wheels & Tires|Used Vehicles|Vehicle Specs Reviews & Comparisons|Transmission Repair & Maintenance|Batteries|Brakes|Interior|Vehicle Fuels & Lubricants|Collision & Auto Body Repair|Oil Changes|Auto Glass Repair & Replacement|California|Rob Dahm|RX7|Hybrid & Alternative Vehicles","676964","29252","524","2570","https://i.ytimg.com/vi/OjlrRcMObEc/default.jpg","False","False","One of the greatest moments of my life.  Pressure testing a car built by hand in front of a massive crowd.T-Shirts: https://www.dahmracing.com/collections/shopPatreon for Build Videos: http://bit.ly/2koiw8GInstagram: http://bit.ly/RobDahmIGSubscribe to Rob Dahm: http://bit.ly/1OAN9yiAWD 4 Rotor Video Series: https://bit.ly/2QiFduE"
"R189VzXyt2Q","Hairdresser Reacts to Worst Bleach Fail Ever","2020-03-01T21:59:29.000Z","UCoc_XJPj6YLMQDWtPDQcDtA","Brad Mondo","24","20.05.03","bradmondo|bradmondonyc|hairdresserreacts|Hairdresser Reacts to Worst Bleach Fail Ever|hairdresser reacts|hair fail|30 vol|hair stylist|fall off|manic panic|diy hair|hair dresser|at home|40 vol|gone wrong|video react|funny fails|box dye|hair fails|bleach fail|jenna marbles|natural hair|bleaching hair at home|pink hair|blue hair|how to bleach hair at home|hairdresser reacts to bleach fails|hair cut|fall out|hair fail compilation","1745055","75154","1080","9775","https://i.ytimg.com/vi/R189VzXyt2Q/default.jpg","False","False","Hi Beautiful! This must be the worst bleach disaster I've ever seen in my life. I didn't even know what to say. Shop XMONDO Hair: https://www.xmondohair.com/Baylea Wilk Video: https://www.youtube.com/watch?v=bcONgI0DmO8&t=1091sInstagram: https://www.instagram.com/bradmondonyc/Twitter: https://twitter.com/bradmondonycTikTok: https://www.tiktok.com/@bradmondonyc?utm_source=tt_10XMONDO Instagram:  https://www.instagram.com/xmondohair/Video Editing By: Kris Edrosa Don't Forget To Live Your Extra Life."
"3ipoXHpG1VQ","ULTIMATE VEGGIE BURGER TASTE TEST *FAST FOOD*","2020-03-01T21:47:33.000Z","UC78cxCAcp7JfQPgKxYdyGrg","emma chamberlain","24","20.05.03","emma chamberlain|emma chambie|vlog|veggie burger|vegan|taste test","2022971","124964","1341","6031","https://i.ytimg.com/vi/3ipoXHpG1VQ/default.jpg","False","False","i try it, so you don't have to✩ CHECK OUT CHAMBERLAIN COFFEE ✩✭ website: https://www.chamberlaincoffee.com ✭ instagram: https://www.instagram.com/chamberlain...✩ MY SOCIAL MEDIA ✩✭ instagram: https://www.instagram.com/emmachamber...✭ twitter: https://twitter.com/emmachamberlain✭ tik tok (lol): emmachamberlain✭ snapchat: https://www.snapchat.com/emmachambie✭ spotify: http://open.spotify.com/user/emmachambie ✩ MY PODCAST ✩✭ search Anything Goes on spotify, apple podcasts, or wherever else you get your podcasts...✩ MERCH ✩✭  https://shopemmachamberlain.com (COMING SOON)I LUV U,-emma chamberlain"
"lCXUMvg_y1U","Justin Bieber - Habitual (CHANGES: The Movement)","2020-03-02T17:00:17.000Z","UCHkj014U2CQ2Nv0UZeYpE_A","JustinBieberVEVO","10","20.05.03","Justin|Bieber|Habitual|(CHANGES:|The|Movement)|RBMG/Def|Jam|Pop","1943861","132499","1986","4205","https://i.ytimg.com/vi/lCXUMvg_y1U/default.jpg","False","False","Changes Out Now: https://justinbieber.lnk.to/ChangesFollow Justin:http://facebook.com/justinbieberhttp://twitter.com/justinbieberhttp://instagram.com/justinbieber Sign up for Justin’s newsletter: http://justinbiebermusic.comProduction Company: OBB PicturesProduction Company: SB ProjectsDirected by: Nick DeMouraExecutive Producers: Justin Bieber, Scooter Braun, Michael D. Ratner, Scott Ratner, Miranda Sherman, Kfir GoldbergChoreography by: Tessandra ChavezDancers: Ashley Gonzales, Ashlynn Chong, Zack Everhart, Anthony Westlake, Denzel Chisolm, Stephanie Mincone, Nataly Santiago, Connor GormleyProduced by: Andrew Sandler Director of Photography: Taylor RandallProduction Designer: Francesca MaldonadoEditor: Jordan Orme#Habitual #Changes"
"D0v7sERrjpE","Another Book I Made as an Adult (and book tour!)","2020-03-01T17:38:02.000Z","UCo8bcnLyZH8tBIH9V1mLgqQ","TheOdd1sOut","23","20.05.03","[none]","3133093","195280","3470","24920","https://i.ytimg.com/vi/D0v7sERrjpE/default.jpg","False","False","Get tickets to my book tour ➤ https://theodd1sout.com/pages/eventsPre-Order my book ➤ https://theodd1sout.com/pages/the-first-sequel Second Channel ➤ https://www.youtube.com/channel/UC0GLNhtTu7yI8rl6ZZGeezw Everyone who worked on the bookRushlight Invader ➤ https://www.youtube.com/user/RushLightInvader Annie Loomis ➤ https://twitter.com/annieloomisart  PantslessPajamas ➤ https://www.youtube.com/channel/UCR0O-1cvuPNxDosvSDLpWHg Hexrin ➤ https://twitter.com/hexriin Kat ➤ https://twitter.com/NineDoodles funymony ➤ https://www.youtube.com/user/funymony Nine Doodles ➤ https://twitter.com/NineDoodlesFunyMony ➤ https://twitter.com/funymonyHiro the Hiroshark ➤ https://twitter.com/HirosharkTom Martin ➤ https://www.undeadwizard.com/artSecond channel ➤ https://www.youtube.com/channel/UC0GLNhtTu7yI8rl6ZZGeezw Twitter ➤ https://twitter.com/Theodd1sout Instagram ➤ https://www.instagram.com/theodd1sout/ Website/Merch ➤ https://theodd1sout.com/"
"HvaQw77UQcw","Japanese meal for cats","2020-03-02T10:52:48.000Z","UCRxAgfYexGLlu1WHGIMUDqw","JunsKitchen","26","20.05.03","taking|cats|walk|jun|junskitchen|juns kitchen|cat|cooking|cuisine|walking|Jun|Rachel|Japanese|food|Japan|猫|ねこ|ぬこ|ジュン|英語|日本|料理|クッキング|yt:cc=on|cook","1053776","81805","555","4565","https://i.ytimg.com/vi/HvaQw77UQcw/default.jpg","False","False","I tried to make a traditional-style Japanese meal for my cats! It's a set menu (miso soup, rice with furikake, and fish) except the food is all made out of cat-safe ingredients. ►My cooking vlog channel: https://www.youtube.com/junyoshizuki►Patreon: https://www.patreon.com/JunsKitchen►Channel with my wife: https://www.youtube.com/RachelandJun►EQUIPMENT I use on my channel that you can buy online (Amazon affiliates links) ―Knife―Chef Knife: Sekimagoroku Gyuto  (http://amzn.to/1OkxnYt)Chef & Utility Knife: Zwilling twin fin (http://amzn.to/1OkzyLF)―Sharpening Stone―KING Japanese Sharpening Stone 1000/6000 (http://amzn.to/2uokk32)―Camera―Panasonic GH5 (http://amzn.to/2uomMqi)Lens: LUMIX G LEICA (http://amzn.to/2eEYzbk)►Instagram (インスタ): https://www.instagram.com/junskitchen/►Music by Epidemic Sound: http://share.epidemicsound.com/rDvsz"
