video_id,title,publishedAt,channelId,channelTitle,categoryId,trending_date,tags,view_count,likes,dislikes,comment_count,thumbnail_link,comments_disabled,ratings_disabled,description
"sV6uuMAnJUE","The American Civil War  - OverSimplified (Part 2)","2020-01-31T23:32:33.000Z","UCNIuvl7V8zACPpTmmNIqP2A","OverSimplified","24","20.01.02","[none]","1390267","100299","793","8655","https://i.ytimg.com/vi/sV6uuMAnJUE/default.jpg","False","False","Get Honey for FREE and start saving money today ▸ https://joinhoney.com/oversimplifiedOur subscribers have already saved over $46,000 on stores like eBay, J. Crew & G2A.Thanks Honey for sponsoring today’s video!MERCH (Abraham Lincoln pin OUT NOW!) - https://oversimplified.tv/merch Support us on Patreon (please): https://www.patreon.com/OverSimple Instagram: https://www.instagram.com/over_simplifiedTwitter: https://twitter.com/over_simplified Reddit: https://www.reddit.com/r/OverSimplified/ Discord: https://discord.gg/zsE9rwM Facebook: https://www.facebook.com/OverSimplified/ Want to know how I make these videos? Get Adobe After Effects and Photoshop here - https://goo.gl/zPHcm2 https://www.oversimplified.tv Thank you to our Patreon Presidents - Bobby Dellinger, Brett Seekely and Yubo Zhang!Copyright disclaimer - We do not give anyone permission to translate and/or reupload our videos or designs on YouTube or other social media platforms.--------------- ATTRIBUTIONS ---------------Music (licensed under a Creative Commons license).Music by Kevin MacLeod:Fast TalkinMarty Gots A PlanMinimaCovert AffairExotic BattleDigyaExpeditionaryCeltic ImpulseHard BoiledEnter The MazeExpeditionaryAccralateInvestigationsDark MysteryFaceoffCrossing The ChasmFrom Artlist:Assaf Alayon - Sweet GlimpseIan Post - Into The BattleKevin Graham - AutumnMarco Martini - RenaissanceLMOP - The Whisper ManStanley Gurvich - PuddlesStanley Gurvich - OptimisticStanley Gurvich - At FirstAll images public domain or licensed from Shutterstock and Dreamstime.THANKS FOR WATCHING!!"
"aSiDu3Ywi8E","F9 - Official Trailer [HD]","2020-01-31T21:14:00.000Z","UCJCx8aQrdx_ueXPmxTD2odQ","The Fast Saga","1","20.01.02","Fast & Furious|Hobbs & Shaw","4797033","101966","4207","11516","https://i.ytimg.com/vi/aSiDu3Ywi8E/default.jpg","False","False","F9In Theaters May 22http://www.thefastsaga.com/No matter how fast you are, no one outruns their past. Summer 2020 is the time for F9, the ninth chapter in the saga that has endured for almost two decades and has earned more than $5 billion around the world.  Vin Diesel’s Dom Toretto is leading a quiet life off the grid with Letty and his son, little Brian, but they know that danger always lurks just over their peaceful horizon. This time, that threat will force Dom to confront the sins of his past if he’s going to save those he loves most. His crew joins together to stop a world-shattering plot led by the most skilled assassin and high-performance driver they’ve ever encountered: a man who also happens to be Dom’s forsaken brother, Jakob (John Cena, next year’s The Suicide Squad). F9 sees the return of Justin Lin as director, who helmed the third, fourth, fifth and sixth chapters of the series when it transformed into a global blockbuster. The action hurtles around the globe—from London to Tokyo, from Central America to Edinburgh, and from a secret bunker in Azerbaijan to the teeming streets of Tblisi. Along the way, old friends will be resurrected, old foes will return, history will be rewritten, and the true meaning of family will be tested like never before.  The film stars returning cast members Michelle Rodriguez, Tyrese Gibson, Chris “Ludacris” Bridges, Jordana Brewster, Nathalie Emmanuel and Sung Kang, with Oscar® winner Helen Mirren and Oscar® winner Charlize Theron. F9 also features Grammy-winning superstar Cardi B as new franchise character Leysa, a woman with a connection to Dom’s past, and a cameo by Reggaeton sensation Ozuna.  F9 is produced by Neal H. Moritz, Vin Diesel, Jeff Kirschenbaum, Joe Roth, Justin Lin, Clayton Townsend and Samantha Vincent.  www.thefastsaga.com"
"iD5pw65ZnsU","Jake Paul Defeats AnEsonGib Via First-Round Stoppage","2020-01-31T05:25:47.000Z","UCurvRE5fGcdUgCYWgh-BDsg","DAZN USA","17","20.01.02","jake paul|anesongib|paul gib|full fight|highlights|recap|ksi|dazn|boxing|logan paul|sidemen|face off|stream|free|eddie hearn|matchroom boxing","5369596","113989","18395","21562","https://i.ytimg.com/vi/iD5pw65ZnsU/default.jpg","False","False","Big fights. Any device. One price. DAZN is the only place to watch Gennadiy “GGG” Golovkin, Canelo Alvarez, and Anthony Joshua. Download the app now at http://bit.ly/DAZN_YT and get one of the best schedules in combat sports, including: Ryan Garcia vs. Fonseca (February 14)Mikey Garcia vs. Vargas (February 29)FOLLOW DAZN USA ON SOCIAL MEDIA! 👇 Twitter: http://www.twitter.com/dazn_usa Facebook: http://www.facebook.com/daznusa Instagram: http://www.instagram .com/dazn_usaFOLLOW CHANGEUP ON SOCIAL MEDIA! 👇 Twitter: http://www.twitter.com/changeupondazn  Instagram: http://www.instagram.com/changeupondaznFOLLOW PAT MCAFEE ON SOCIAL MEDIA! 👇 Twitter: http://www.twitter.com/patmcafeeondazn  Instagram: http://www.instagram.com/patmcafeeondazn"
"jGHQr2yy_4U","Los Angeles Lakers Pay Tribute To Kobe Bryant","2020-02-01T04:22:29.000Z","UCWJ2lWNubArHWmf3FIHbfcQ","NBA","17","20.01.02","Los Angeles Lakers|Portland Trail Blazers|NBA|Basketball|Pass|Assist|Steal|Rebound|Lakers|LA Lakers|Kobe|Kobe Bryant|Bryant|Kobe Bean Bryant|Bean|Kobe Bean","2860768","139054","1283","6398","https://i.ytimg.com/vi/jGHQr2yy_4U/default.jpg","False","False","Los Angeles Lakers pay tribute to Kobe Bryant Subscribe to the NBA: https://on.nba.com/2JX5gSN Full Game Highlights Playlist: https://on.nba.com/2rjGMgeFor news, stories, highlights and more, go to our official website at https://nba_webonly.app.link/nbasiteGet NBA LEAGUE PASS: https://nba.app.link/nbaleaguepass5"
"MRvKL8FnrtU","Meghan Trainor - Nice to Meet Ya (Official Music Video) ft. Nicki Minaj","2020-01-31T15:00:11.000Z","UCf3cbfAXgPFL6OywH7JwOzA","MeghanTrainorVEVO","10","20.01.02","meghan trainor|treat myself|let you be right|wave|mike sabbath|zara larsson|aj mitchell|daryl sabara|me too|dear future husband|no excuses|like i'm gonna lose you|all about that bass|charlie puth|evil twin|all the ways|blink|nice to meet ya|nicki minaj|funk|babygirl|workin' on it|lennon stella|sasha sloan|ashes|lie to me|here to stay|genetics|pussycat dolls|after you|another opinion|have you now|Epic|Meghan","3810551","322248","14223","21359","https://i.ytimg.com/vi/MRvKL8FnrtU/default.jpg","False","False","TREAT MYSELF available at: https://smarturl.it/TREATMYSELFDirected by Mathew CullenProduced by Luga Podesta for London AlleyConcept by Meghan TrainorChoreographed by Charm La’DonnaMeghan Trainor online: https://twitter.com/Meghan_Trainor https://www.instagram.com/meghan_trainor https://www.facebook.com/meghantrainorsongshttps://meghan-trainor.com(C) 2020 Epic Records, a division of Sony Music Entertainment"
"1ODypSlriLM","One h*ck of a sick day (I got robbed)","2020-01-31T21:45:59.000Z","UCvUmwreRrbxeR1mbmojj8fg","SomeThingElseYT","23","20.01.02","One heck of a sick day|sick day|animated story|animations|animation|i got robbed|but like not really|storytime|actually happened|funny|comedy|stand up comedy|robbed|comedian|somethingelseyt|something|else|yt|driver|lol","842855","88634","733","7353","https://i.ytimg.com/vi/1ODypSlriLM/default.jpg","False","False","I ordered food while sick and i will never do it again... until i do cuz i willNEW MERCH: http://creatorink.co/seyt-ytHelp put this team together, organize crap for me, and be super duper awesome please go follow and or hire them they are great ►Dee Helm - https://twitter.com/DeeRedHelmAnimators ► Me (SomeThingElseYT)Kaitlyn Marie - https://twitter.com/kaitlynmarart?s=09Storyboard Artist► Jack McGee - https://twitter.com/Drooling_DemonAnna Bohoc - https://twitter.com/anna_bohacBackground Artist►AntiDarkHeart- https://twitter.com/AntiDarkHeartEthan Yazel- https://twitter.com/EthanBurnsidesSongs used:Kevin macleodA loop i made by Somethingelseytand some other sounds i made using my OP-1"
"-juY5Q_iLYs","We Tested 9 More VIRAL TikTok Life Hacks to See if They Work!","2020-01-31T22:19:47.000Z","UC70Dib4MvFfT1tU6MqeyHpQ","Preston","24","20.01.02","funny|challenge|family|comedy|preston|brianna","957635","26022","780","3796","https://i.ytimg.com/vi/-juY5Q_iLYs/default.jpg","False","False","We Tested 9 More VIRAL TikTok Life Hacks to See if They Work! with Preston 👊❤️ FRIENDS!🡆 @Brianna 🡆 @Bahri 👀 FOLLOW ME HERE!🡆 TikTok - https://www.tiktok.com/@preston🡆 Instagram - https://instagram.com/realtbnrfrags🡆 Twitter - https://twitter.com/Preston👕 Get your merch below!🡆 http://www.prestonsstylez.com/ 🡆 https://royallyb.com🐲 Buy FLOOP Here! 🡆 https://amzn.to/37uLpV6🎮 Join my Fan Discord! 🡆 http://discord.gg/Preston------------------------------Additional music provided by Epidemic SoundClick here for a free trial! 🡆 http://share.epidemicsound.com/TBNR"
"a2KRXcwOeVM","KSI – Wake Up Call (feat. Trippie Redd) [Official Music Video]","2020-01-31T17:00:06.000Z","UCVtFOytbRpEvzLjvqGG5gxQ","KSI","24","20.01.02","Wake Up Call|KSI|Trippie Redd|Nayip Ramos|Asher Brown|Mams Taylor","3331491","355249","16932","21570","https://i.ytimg.com/vi/a2KRXcwOeVM/default.jpg","False","False","Get “WAKE UP CALL”  https://K-S-I.lnk.to/WakeUpCallID  Follow KSI on all platforms: https://linktr.ee/ksi Director: Nayip Ramos Producer: Asher Brown Management: Mams Taylor - mams@premierleaguemusic.com https://www.premierleagueentertainment.com/ Lyrics:  Trippie Redd  Don’t wake up when it’s too late They might think that you hate meIma get it in while you wait Better late than never Yeah, this the WAKE UP CALLAin’t no walking out you better wake up dawgYeah, this the WAKE UP Call Every other day I’m getting cake like Yooo!Yeah, this the WAKE UP CALL. Ain’t no walking out you better wake up dawgYeah, get your face bust off Your bitch with me now tryin’ to get face fucked dawgOkay  KSI  Funny innit (ha)Now they wanting to get it (money)Now they wanting to visit (Ay)Cos they watching the Richard (Mille)See me getting the cheddar (cheesy)See me sprinkle the pepper (season)Panoramic my view in leading and trending whatever,  Trippie Redd – Okay KSI  Bill it (yeah)Thurman how I go kill it (Bill)Hire steak and get fillet (Beef)X amount to exhibit I’m winning in different avenues (Views)Trippie my revenue(Yeah)Don’t see me ever lose I jump hurdles like kangaroos (damn) Trippie Redd  Don’t wake up when it’s too late They might think that you hate meIma get it in while you wait Better late than never Yeah, this the WAKE UP CALLAin’t no walking out you better wake up dawgYeah, this the WAKE UP Call Every other day I’m getting cake like Yooo!Yeah, this the WAKE UP CALL. Ain’t no walking out you better wake up dawgYeah, get your face bust off Your bitch with me now tryin’ to get face fucked dawgOkay  KSI  Picture perfect Now that they know I’m worth it(Winning)Before they hatedNow they say I deserve it(Living)Back the beefShowing them how I bring it(Hitting) At the beach Sipping on something different (Swimming) Swimming in money they said I’ll never earn Kicked out of school, they said I’ll never learn Now I learned to make it countMultiplied the vision and making a high amount bitch Trippie Redd  Yeah In a big body swervin’ No suburban Bitch this is a BentlyPussy do not tempt me YEAH Cause the choppa get a buzzin’ have a nigga lookin’ likeRicky!   Yeah, this the WAKE UP CALLAin’t no walking out you better wake up dawgYeah, this the WAKE UP Call Every other day I’m getting cake like Yooo!Yeah, this the WAKE UP CALL. Ain’t no walking out you better wake up dawgYeah, get your face bust off Your bitch with me now tryin’ to get face fucked dawgOkay#KSI #TrippieRedd #WakeUpCall"
"UmjpA6uW3v8","Lil Wayne - I Do It ft. Big Sean & Lil Baby (Official Audio)","2020-01-31T08:06:15.000Z","UCO9zJy7HWrIS3ojB4Lr7Yqw","Lil Wayne","10","20.01.02","lil wayne|lil wayne 2020|weezy|weezy wednesday|wayne carter|young money|hiphop|tha carter|ymcmb|hollyweezy|birdman|dwayne carter|wayne|hot boys|cash money|2 chainz|hollygrove|In Tune We Trust|tunechi|lil tunechi|tha carter v|the carter 5|The carter V|Tha carter V|carter|carter V|funeral|i do it|i do it lil wayne|lil wayne i do it|funeral lil wayne|lil wayne funeral|big sean|lil baby","813050","32382","883","1555","https://i.ytimg.com/vi/UmjpA6uW3v8/default.jpg","False","False","SUBSCRIBE: http://youtube.com/lilwayneOfficial audio “I Do It ft. Big Sean & Lil Baby” – off the new album 'Funeral’ available here: https://lilwayne.lnk.to/funeral►Subscribe to Lil Wayne’s Channel: https://lilwayne.lnk.to/funeralYD►Exclusive Merch: shop.lilwaynefuneral.com►Follow Lil Wayne online:Lil Wayne on Twitter: http://www.twitter.com/LilTunechiLil Wayne on Facebook: http://www.facebook.com/LilWayneLil Wayne on Instagram: https://www.instagram.com/liltunechi►Follow Young Money online:Young Money On Instagram: https://www.instagram.com/youngmoney/Young Money on Facebook: http://www.facebook.com/youngmoneyentAnimation:Katia Temkin@katiatemkin#LilWayne #Funeral #IDoIt"
"t73BkH3_9kM","I tried FLUID ART with a MOP... (Fluid 360 Art)","2020-01-31T20:45:02.000Z","UC6IijBsVf2PlWo_uq6P9wQw","Gloom","24","20.01.02","acrylic painting|fluid art|paint pouring|flow art|acrylic pouring|pour painting|fluid painting|abstract art|gloom|gloomgames|kassie|gloom tries|gloom tries painting|art supplies|painting|art|painting tutorial|i followed a painting tutorial|getting frustrated with painting|paint with me|mop painting|painting hack|2020|painting technique|techniques|style|interesting|pretty","736294","26476","484","2332","https://i.ytimg.com/vi/t73BkH3_9kM/default.jpg","False","False","I've tried a double measuring cup, I've tried to straight up paint a pretty picture, and now 2020 calls for a mop. Gone wrong this time? I don't think so. What you think?SUBSCRIBE HERE: https://www.youtube.com/channel/UC6IijBsVf2PlWo_uq6P9wQw?sub_confirmation=1My INSTAGRAM: http://www.instagram.com/gloomykassieMy TWITTER: http://www.twitter.com/gloomykassieMy DISCORD SERVER (13 and up only): http://discord.gg/GLOOMIf you wanna try the actual tutorial I tried: https://www.youtube.com/watch?v=dMLPw6DGHAcMERCH: http://gloom.storeWATCH SOME OF MY PROUDER MOMENTS: https://www.youtube.com/watch?v=LcpRcc1XClc&list=PLwbhb6Gu7AnU32_RS0duPQed2PHoQWHlvMy TIK TOK is @gloomdog, here's a link: http://vm.tiktok.com/JTHb8L/---------------------------------------------------------------------------I'm Kassie, also known as Gloom! I'm a variety gamer who does gameplay commentary on indie games and some bigger titles too. I also do silly sketches, challenges, Q&As, and whatever makes you goof balls giggle.---------------------------------------------------------------------------I do my best to upload at a few times a week (unless my life is a mess)."
"l_4bCFaSV0A","Live PD: Don't Be Swearing at the Cops (Season 4) | A&E","2020-01-31T20:07:59.000Z","UCNIFiHaLZkYASaWDdkC1njg","A&E","24","20.01.02","a&e|aetv|a&e tv|ae|a&e television|a&e shows|a and e|a+e|live pd|cops|live cops|live cop show|police|law enforcement|ride along|ridealong|police car|police ridealong|live pd full episode|live pd clip|live EMT|a&e (tv network)|full episodes|series|Live PD season 4 clips|Live PD s4 clips|Live PD season 4 videos|No Chance of Escape|watch live pd season 4|live pd clips|live pd seasson 4 episode 27|live pd s4 e27|live pd 4X27|live pd s04 e27","371797","4344","304","1072","https://i.ytimg.com/vi/l_4bCFaSV0A/default.jpg","False","False","Watch new episodes of Live PD Fridays and Saturdays at 9/8c, and stay up to date on all of A&E's premieres at http://aetv.com/scheduleWhile an officer is pulled over with a vehicle, a passerby screams profanities at him through the car window in this clip from 12.14.19.#LivePDSubscribe for more from Live PD and other great A&E shows:http://aetv.us/subscribe_aeFind out more about Live PD and watch full episodes on our site:http://aetv.us/LivePDOfficialWatch Dan Abrams and Sgt. Sticks Larkin analyze events from the show:http://po.st/LivePD_AfterActionCheck out exclusive A&E content: Website - http://www.aetv.com/  Facebook - https://www.facebook.com/AETV Twitter - https://twitter.com/AETVIn-studio host, ABC’s Dan Abrams, alongside analyst Tom Morris Jr., guide viewers through the night, giving insight to what audiences see in real time (via a mix of dash cams, fixed rig and handheld cameras), bouncing minute-by-minute between the featured police departments and offering an inside look at each live incident.A&E leads the cultural conversation through high-quality, thought provoking original programming with a unique point of view. Whether it’s the network’s distinctive brand of award-winning disruptive reality or groundbreaking documentary, A&E makes entertainment an art form. Visit us at aetv.com for more info."
"ZMqhjKRUGsY","The Kid LAROI - Diva ft. Lil Tecca (Dir. by @_ColeBennett_)","2020-01-31T17:00:01.000Z","UCtylTUUVIGY_i5afsQYeBZA","Lyrical Lemonade","24","20.01.02","the kid laroi|lil tecca|laroi|tecca|diva|tarantino|lyrical lemonade|cole bennett|my life is a movie|directed by tarantino|billie jean|billy jean|we know|trailer park|monster truck|hip hop|rap|2020|new|music video|ransom|let her go|australia","1584257","167623","4939","12362","https://i.ytimg.com/vi/ZMqhjKRUGsY/default.jpg","False","False","Lyrical Lemonade Presents:The Kid LAROI - Diva [ft. Lil Tecca] (Official Music Video)Directed + Edited by Cole BennettSong Produced by Dez WrightDir. of Photography - Michael StineSteadicam by Renard CherenAssisted 3D by KayoEx Produced by Sal Tarantino & Jay TauzinThe Kid LAROI's Socials:http://instagram.com/thekidlaroihttp://twitter.com/thekidlaroiLil Tecca's Socials:http://instagram.com/lilteccahttp://twitter.com/liltecca--Official Channel of Lyrical Lemonade Subscribe for updates on music videos, interviews, performance videos, etc.Lyrical Lemonade's Hot 25 Spotify Playlist:https://open.spotify.com/user/gh3vdz775oy18ah1wp9ucxsj5/playlist/5UuPeWDR2I8a8pORvW9vmrLyrical Lemonade Socials:http://www.twitter.com/lyricalemonadehttp://www.instagram.com/lyricalemonadehttp://www.facebook.com/lyricalemonadehttp://www.lyricallemonade.comCole Bennett Socials:http://www.twitter.com/_colebennett_http://www.instagram.com/_colebennett_LENNY ~ our hidden character representing happiness & good eneryhttp://instagram.com/lenny"
"B-GdSI5Ge0o","Should You Have to Put Your Shopping Cart Back?","2020-01-31T22:41:07.000Z","UC9k-yiEpRHMNVOnOi_aQK8w","Inside Edition","25","20.01.02","investigation|Inside Edition|Inside_Edition|IE Investigates|shopping carts|grocery store shopping carts|bad grocery store etiquette|abandoned shopping carts|okay to abandon shopping carts|is it okay to leave shopping carts out|grocery store","535575","8992","420","2070","https://i.ytimg.com/vi/B-GdSI5Ge0o/default.jpg","False","False","Runaway shopping carts can be a hazard in many parking lots across the country. YouTube is filled with videos showing them crashing into cars. The problem often stems from people abandoning their carts in the lot instead of returning them to designated shopping cart corrals. Simply by roaming around parking lots, Inside Edition’s Chief Investigative Correspondent Lisa Guerrero saw dozens of shoppers taking the lazy way out by ditching their carts. In a Los Angeles Costco parking lot, one woman named Monica was spotted leaving her cart between two cars when Guerrero approached her."
"Gu_tfM3JX9k","Jumping the Shark","2020-01-31T20:32:20.000Z","UCTSRIY3GLFYIpkR2QwyeklA","Drew Gooden","23","20.01.02","drew gooden|comedy|commentary|reaction|vine|drew gooden vine|road work ahead guy|parody|rant|cringe|the office|that 70s show|topher grace|the simpsons|ashton kutcher|friends|season 8|season 9|michael scott","799973","68644","450","14239","https://i.ytimg.com/vi/Gu_tfM3JX9k/default.jpg","False","False","Thanks to squarespace for sponsoring today's video! Head to www.squarespace.com/drew to get 10% your first purchase.https://www.pictureofhotdog.com/merch:https://www.drewgoodenshop.com/follow me:twitter - https://www.twitter.com/drewisgoodeninstagram - https://www.instagram.com/drewisgoodenfacebook - https://www.facebook.com/drewisgooden"
"siIQ1jPtmEQ","Mean Tweets - NFL Edition #4","2020-01-31T04:45:58.000Z","UCa6vGFO9ty8v5KZJXQxdhaw","Jimmy Kimmel Live","23","20.01.02","jimmy|jimmy kimmel|jimmy kimmel live|late night|talk show|funny|comedic|comedy|clip|comedian|mean tweets|Tom Brady|Patrick Mahomes|Travis Kelce|Corey Clement|Joey Bosa|Devin Funchess|Sony Michel|Todd Gurley|Jay Ajayi|Clay Matthews|Jared Goff|Michael Irvin|Mean Tweets|NFL|Super Bowl|Football","1539913","16853","630","1027","https://i.ytimg.com/vi/siIQ1jPtmEQ/default.jpg","False","False","Football fans are a passionate bunch, and from time to time we put that passion on display. With that said, it’s time once again for an all-new, all-NFL edition of #MeanTweets featuring Tom Brady, Patrick Mahomes, Travis Kelce, Corey Clement, Joey Bosa, Devin Funchess, Sony Michel, Todd Gurley, Jay Ajayi, Clay Matthews, Jared Goff, Michael Irvin & Terry Bradshaw.Buy Jimmy’s new children’s book The Serious Goose! All of the money he makes goes to children’s hospitals across the country. http://rhcbooks.com/books/592304/the-serious-gooseJimmy Kimmel Interviews Stoner from Michigan https://youtu.be/SErFK9MQxhgSUBSCRIBE to get the latest #KIMMEL: http://bit.ly/JKLSubscribe Watch Mean Tweets: http://bit.ly/KimmelMT10 Connect with Jimmy Kimmel Live Online: Visit the Jimmy Kimmel Live WEBSITE: http://bit.ly/JKLWebsiteLike Jimmy Kimmel on FACEBOOK: http://bit.ly/KimmelFBLike Jimmy Kimmel Live on FACEBOOK: http://bit.ly/JKLFacebookFollow @JimmyKimmel on TWITTER: http://bit.ly/KimmelTWFollow Jimmy Kimmel Live on TWITTER: http://bit.ly/JKLTwitterFollow Jimmy Kimmel Live on INSTAGRAM: http://bit.ly/JKLInstagram About Jimmy Kimmel Live: Jimmy Kimmel serves as host and executive producer of Emmy-winning Jimmy Kimmel Live, ABC's late-night talk show.Jimmy Kimmel Live is well known for its huge viral video successes with 5.6 billion views on YouTube alone.Some of Kimmel's most popular comedy bits include - Mean Tweets, Lie Witness News, Jimmy's Twerk Fail Prank, Unnecessary Censorship, YouTube Challenge, The Baby Bachelor, Movie: The Movie, Handsome Men's Club, Jimmy Kimmel Lie Detective and music videos like I (Wanna) Channing All Over Your Tatum and a Blurred Lines parody with Robin Thicke, Pharrell, Jimmy and his security guard Guillermo.Now in its seventeenth season, Kimmel's guests have included: Johnny Depp, Meryl Streep, Tom Cruise, Halle Berry, Harrison Ford, Jennifer Aniston, Will Ferrell, Katy Perry, Tom Hanks, Scarlett Johansson, Channing Tatum, George Clooney, Larry David, Charlize Theron, Mark Wahlberg, Kobe Bryant, Steve Carell, Hugh Jackman, Kristen Wiig, Jeff Bridges, Jennifer Garner, Ryan Gosling, Bryan Cranston, Jamie Foxx, Amy Poehler, Ben Affleck, Robert Downey Jr., Jake Gyllenhaal, Oprah, and unfortunately Matt Damon.Mean Tweets - NFL Edition #4https://youtu.be/siIQ1jPtmEQ"
"lv-NUTdB3M8","Looking at Long Lost Memes","2020-01-31T20:00:11.000Z","UCIcgBZ9hEJxHv6r_jDYOMqg","Unus Annus","23","20.01.02","unus annus|markiplier|crankgameplays|memento mori|memes|looking at memes|looking at long lost memes|looking at old memes|funny memes|classic memes|watching memes|reacting to memes|best memes|top 10 memes|meme|markiplier memes|crankgameplays memes|unus annus memes|unus nanus looking at long lost memes|long lost memes|spicy memes|funniest memes|2020 memes|90s memes|reactions|reacting|review|old school memes|old school|boomer memes","789883","75586","275","4371","https://i.ytimg.com/vi/lv-NUTdB3M8/default.jpg","False","False","Time never stops marching forward, even for memes. Like a black hole, once memes slip past the point of relevance they fade away into oblivion. Can we can pull them back from the shadows?ᴍᴇʀᴄʜ ➤ http://www.unusannus.comᴜɴᴜs ➣ http://www.youtube.com/crankgameplaysᴀɴɴᴜs ➢ http://www.youtube.com/markiplierᴛᴡɪᴛᴛᴇʀ ► http://www.twitter.com/unusannusɪɴsᴛᴀɢʀᴀᴍ ► http://www.instagram.com/unusannusʀᴇᴅᴅɪᴛ ► http://www.reddit.com/r/unusannusᴛᴜᴍʙʟʀ ► http://www.unusannus.tumblr.comEdited By ► http://www.youtube.com/LixianTVThis channel, along with every video that has or will ever be uploaded on this channel, will be deleted after our year has ended. This is inevitable. Inescapable. Irreversible.Do not archive or re-upload anything. This is our last wish. Our parting gift. Stay true to the purpose of our final year or we shall lay down wrath upon those that attempt to escape the end.Memento Mori.Unus Annus."
