video_id,title,publishedAt,channelId,channelTitle,categoryId,trending_date,tags,view_count,likes,dislikes,comment_count,thumbnail_link,comments_disabled,ratings_disabled,description
"psAOKgU4NuI","LIL BABY | FUNK FLEX | #Freestyle147","2020-03-06T10:00:12.000Z","UC5RwNJQSINkzIazWaM-lM3Q","HOT 97","10","20.09.03","hot97|hip hop|New York|NY|US|United States|HOT97.com|#hot97|breakfast|club|power|105|LIL BABY|MEEK MILL|TYLER THE CREATOR|YOUNG ME|YOUNG MA|FLEX|FUNK FLEX|FREESTYLES|FFF|F111|G UNIT|50CENT|baby|da baby","859481","32540","730","2288","https://i.ytimg.com/vi/psAOKgU4NuI/default.jpg","False","False","SUBSCRIBE: http://bit.ly/HOT97SubscribeFollow us:INSTAGRAM: https://www.instagram.com/hot97TWITTER:    https://twitter.com/HOT97FACEBOOK:  https://www.facebook.com/HOT97OFFICIAL"
"2b9lAHC6VIQ","10 of The Most Satisfying Products We Found Online!","2020-03-06T20:50:00.000Z","UC9VX0KXNH20x9MCH3xGjisg","DOPE or NOPE","23","20.09.03","top 10|top 5|trending|satisfying videos|satisfying|asmr|reacting to|in real life|do it yourself|diy|oddly satisfying|oddly|diy projects|life hacks|fun|funny videos|funny|memes|jokes|friends|friendship|best friends in the world|hi5 studios|matthias|dope or nope|dope|vat 19|amazon|amazon prime|prime day|reviews|try not to laugh|fails|haul|cringe","989265","30314","1237","2205","https://i.ytimg.com/vi/2b9lAHC6VIQ/default.jpg","False","False","Buy the DOPE or NOPE Card Game Here!! ➡ http://bit.ly/2TzgLp3 OR HERE!! ➡ https://www.amazon.com/stores/page/DBF7EEF5-43FE-4512-8369-A8E6E9D1A2D5?channel=DOPE1_3110 Products That'll Make You Never Have To Leave Your Room! ➡ https://www.youtube.com/watch?v=ecIv2R5lTXM&t=486s10 Food Gadgets That Will Change How You Eat FOREVER! ➡ https://www.youtube.com/watch?v=hxby9htqbXI&t=959sHey! Does watching our content make you happy and satisfied? If so, be prepared to be twice as satisfied in this video!!! Today we are checking out 10 of the most satisfying products we found online, now, i apologize in advance if we us presenting these products isn't as satisfying...we tried our best! Hahah! TWITTER ➡ https://twitter.com/Hi5DopeorNopeINSTAGRAM ➡ https://www.instagram.com/hi5dopeornope If you want to watch videos from Hi5 Studios, consider checking out these awesome videos by other channels in our network!Battle Universe ➡ https://www.youtube.com/watch?v=grysgIYRzzIGet Good Gaming ➡ https://www.youtube.com/watch?v=i23vpNnp4RIROZE ➡ https://www.youtube.com/watch?v=WaHKOdWOE0A"
"o84IgVcyf14","Is COVID-19 a Pandemic? | March 2020 Update","2020-03-06T23:37:51.000Z","UCZYTClx2T1of7BRZ86-8fow","SciShow","27","20.09.03","SciShow|science|Hank|Green|education|learn|COVID-19|SARS-CoV-2|Coronavirus|SARS|MERS|Wuhan|Pandemic|Epidemic","580959","27289","787","3094","https://i.ytimg.com/vi/o84IgVcyf14/default.jpg","False","False","Go to http://Brilliant.org/SciShow to try out Brilliant’s Daily Challenges. The first 200 subscribers get 20% off an annual Premium subscription.SARS-CoV-2 is a new kind of coronavirus that appeared suddenly in late 2019. The disease it causes, called COVID-19, is now showing signs that it's able to spread outside of its place of origin. This raises some questions... like, do we have a pandemic on our hands? What’s the difference between a pandemic and an epidemic? SciShow News has some facts to help you understand a complex and rapidly changing situation.Hosted by: Hank GreenSciShow has a spinoff podcast! It's called SciShow Tangents. Check it out at http://www.scishowtangents.org----------Support SciShow by becoming a patron on Patreon: https://www.patreon.com/scishow----------Huge thanks go to the following Patreon supporters for helping us keep SciShow free for everyone forever:Kevin Bealer, Jacob, KatieMarie Magnone, D.A. Noe, Charles Southerland, Christopher R Boucher, Alex Hackman, Matt Curls, Adam Brainard, Scott Satovsky Jr, Sam Buck, Avi Yashchin, Ron Kakar, Chris Peters, Kevin Carpentier, Patrick D. Ashmore, Piya Shedden, Sam Lutfi, charles george, Greg----------Looking for SciShow elsewhere on the internet?Facebook: http://www.facebook.com/scishowTwitter: http://www.twitter.com/scishowTumblr: http://scishow.tumblr.comInstagram: http://instagram.com/thescishow----------Sources:http://www.cidrap.umn.edu/news-perspective/2020/02/three-states-report-new-community-spread-covid-19https://jglobalbiosecurity.com/articles/10.31646/gbio.55/https://www.ajmc.com/newsroom/cdc-warns-that-covid19-is-likely-headed-toward-pandemic-stage-could-affect-us-schools-businesseshttps://www.cdc.gov/coronavirus/2019-ncov/about/prevention-treatment.htmlhttps://www.cdc.gov/coronavirus/2019-ncov/about/symptoms.htmlhttps://www.cdc.gov/coronavirus/2019-ncov/preparing-individuals-communities.htmlhttps://www.cdc.gov/coronavirus/2019-ncov/summary.htmlhttps://www.cdc.gov/media/releases/2020/s0226-Covid-19-spread.htmlhttps://www.cdc.gov/media/releases/2020/s0228-additional-COVID-19-cases.htmlhttps://www.cdc.gov/mmwr/volumes/69/wr/mm6908e1.htm?s_cid%3Dmm6908e1_e%26deliveryName%3DUSCDC_921-DM20815https://www.health.harvard.edu/blog/as-coronavirus-spreads-many-questions-and-some-answers-2020022719004https://www.nytimes.com/2020/02/28/health/coronavirus-pandemic-epidemic.htmlhttps://www.vox.com/2020/1/30/21076686/coronavirus-outbreak-wuhan-china-who-emergencyhttps://www.washingtonpost.com/health/2020/02/28/what-you-need-know-about-coronavirus/?arc404%3Dtruehttps://www.who.int/emergencies/diseases/novel-coronavirus-2019/events-as-they-happenhttps://www.who.int/news-room/q-a-detail/q-a-coronaviruseshttps://www.washingtonpost.com/health/coronavirus-may-have-spread-undetected-for-weeks-in-washington-state/2020/03/01/0f292336-5bcc-11ea-9055-5fa12981bbbf_story.htmlhttps://twitter.com/trvrb/status/1233970271318503426?s=21https://healthjournalism.org/blog/2020/02/where-to-get-more-answers-about-covid-19/https://gisanddata.maps.arcgis.com/apps/opsdashboard/index.html?fbclid=IwAR0jwCaN2Ls7RtVoJjlcu3REPJb4VmeYwbyrNghpn7fp9wDc3n44nOdwnL0#/bda7594740fd40299423467b48e9ecf6Image Sources:https://www.istockphoto.com/photo/airport-gm1149089169-310546330https://www.istockphoto.com/vector/genome-data-genetics-sequence-barcode-visualization-dna-test-and-genetic-medical-gm1130272673-298868317https://www.istockphoto.com/photo/sick-woman-with-flu-cold-fever-and-cough-sitting-on-couch-at-home-ill-person-blowing-gm1124732633-295379592https://www.istockphoto.com/photo/dispersed-corona-viruses-with-dark-background-3d-rendering-gm1203446233-345892077https://www.istockphoto.com/vector/school-closed-sign-gm1162613343-318964012https://www.istockphoto.com/vector/map-world-seperate-countries-light-blue-gm1138822517-304181263https://www.istockphoto.com/vector/flu-cough-vector-sign-gm1021782498-274380934https://www.istockphoto.com/photo/foam-on-black-gm1145385874-308277819https://commons.wikimedia.org/wiki/File:SARS-CoV-2_49531042877.jpghttps://www.istockphoto.com/photo/jet-airplane-flying-between-the-clouds-travel-around-the-world-travel-concept-idea-gm1153846898-313525163"
"YvVonQ7LUJ0","Dua Lipa - Let's Get Physical Work Out Video","2020-03-06T12:59:03.000Z","UC-J-KZfRV8c13fOCkhXdLiQ","Dua Lipa","10","20.09.03","dua lipa|new rules|dua leepa|dula peep|let's get physical|don't start now|dua physical|idgaf|work out|jane fonda workout|360ra|dua work out video|dua exercise video|dua physical excercise video|work out music video|excercise music video|physical work out video|physical alternative video|dua new rules|dua idgaf|dua don't start now|dua","5893453","288855","7854","10007","https://i.ytimg.com/vi/YvVonQ7LUJ0/default.jpg","False","False","Buy the merch from the video: https://smarturl.it/dualipastoreLet's Get Physical Work Out Video was mixed with an immersive 360 experience in mind, use headphones for the full effect. Listen to ‘Physical’ in full 360 Reality Audio, coming soon to Tidal, Amazon and Deezer. For more information on 360 Reality Audio and a free 3 month HiFi subscription coupon* visit https://cutt.ly/music_com_*Quantities are limited, while supplies last"
"muT82qO-uAs","I Can't Relax!  | Lele Pons","2020-03-06T18:30:53.000Z","UCi9cDo6239RAzPpBZO9y5SA","Lele Pons","23","20.09.03","[none]","1223217","49734","1772","1588","https://i.ytimg.com/vi/muT82qO-uAs/default.jpg","False","False","WATCH VETE PA LA MUSIC VIDEO ▶ https://youtu.be/IVZsfc0TqJoWATCH MORE ▶ https://youtube.com/playlist?list=PLmjMRs-v1tgTWmpYuBPugvLqBXVz5H-vPSUBSCRIBE HERE ▶ http://youtube.com/channel/UCi9cDo6239RAzPpBZO9y5SA?sub_confirmation=1THANKS FOR WATCHING! :) LIKE & SUBSCRIBE FOR MORE VIDEOS!-----------------------------------------------------------FIND ME ON:Instagram | http://instagram.com/leleponsTwitter | http://twitter.com/leleponsFacebook | http://facebook.com/lele TikTok | https://vm.tiktok.com/4CfRTgMerch | https://lilshop.comText Me | https://my.community.com/leleponsCAST: Lele Pons | http://youtube.com/c/leleponsMarlon Webb | https://instagram.com/marlonwebbHeidi Mendez Harrison | https://instagram.com/heidiharrisonmendezLeslie Stevens | https://instagram.com/leslie.stevens.927/Joey De Felice | https://instagram.com/jbroey17Alexis Figueroa | https://instagram.com/lexxxxissssssTwins from Russia | https://instagram.com/twinsfromrussiaWE HIT 500 VIDEOS WITH OVER 1 MILLION VIEWS ▶ https://youtu.be/VOzQW_fff5AShots Studios Channels:@Anwar Jibawi @Awkward Puppets @Benny the Bee @Delaney Glazer @Hannah Stocking @Juanpa Zurita Comedy @Lele Pons @Rudy Mancuso @Shots Studios #Lele#LelePons"
"y88JPeBqmAM","Alexandria Ocasio-Cortez Talks Bernie Sanders, the 2020 Census and Her New Puppy","2020-03-06T11:00:17.000Z","UCVTyTA7-g9nopHeHbeuvpRA","Late Night with Seth Meyers","23","20.09.03","Late Night|Seth Meyers|Alexandria Ocasio-Cortez|Talks|Bernie Sanders|2020 Census|New|Puppy|NBC|NBC TV|television|funny|talk show|comedy|humor|stand-up|parody|snl seth meyers|host|promo|seth|meyers|weekend update|news satire|satire|Alexandria Ocasio-Cortez on Meyers|Alexandria Ocasio-Cortez interview|AOC|New York|politics|news|current news|election|2020 election|presidential election|debate|democrats|democratic|Bernie|dogs|animals|dog|puppies|cute","500605","11926","3250","4095","https://i.ytimg.com/vi/y88JPeBqmAM/default.jpg","False","False","Alexandria Ocasio-Cortez talks about Bernie Sanders, the upcoming 2020 census and her new dog.Subscribe to Late Night: http://bit.ly/LateNightSeth Watch Late Night with Seth Meyers Weeknights 12:35/11:35c on NBC. Get more Late Night with Seth Meyers: http://www.nbc.com/late-night-with-seth-meyers/ LATE NIGHT ON SOCIALFollow Late Night on Twitter: https://twitter.com/LateNightSethLike Late Night on Facebook: https://www.facebook.com/LateNightSethFollow Late Night Instagram: http://instagram.com/LateNightSethLate Night on Tumblr: http://latenightseth.tumblr.com/ Late Night with Seth Meyers on YouTube features A-list celebrity guests, memorable comedy, and topical monologue jokes. GET MORE NBCLike NBC: http://Facebook.com/NBCFollow NBC: http://Twitter.com/NBCNBC Tumblr: http://NBCtv.tumblr.com/YouTube: http://www.youtube.com/nbcNBC Instagram: http://instagram.com/nbctv Alexandria Ocasio-Cortez Talks Bernie Sanders, the 2020 Census and Her New Puppy- Late Night with Seth Meyershttps://youtu.be/y88JPeBqmAMLate Night with Seth Meyershttp://www.youtube.com/user/latenightseth"
"v5zIyVuJPF4","BOWLBO - GAMEPLAY TRAILER","2020-03-06T17:00:13.000Z","UCV5wuGZmg_FGQp25uzKKDaw","OneyNG","1","20.09.03","oney|oneyng|sleepy|cabin|cartoons|cartoon","385089","39794","371","2912","https://i.ytimg.com/vi/v5zIyVuJPF4/default.jpg","False","False","ADD IT TO YOUR WISHLIST  ► https://store.steampowered.com/app/1048250/Bowlbo_The_Quest_for_Bing_Bing/Follow Development on Twitter  ► https://twitter.com/OneyWareGames"
"fGhDRvOq8u4","Lakers are not ready to 'go to the mat' with the Clippers — Chris Broussard | NBA | UNDISPUTED","2020-03-06T19:43:11.000Z","UCLXzq85ijg2LwJWFrz4pkmw","Skip and Shannon: UNDISPUTED","17","20.09.03","skip bayless|shannon sharpe|skip bayless shannon sharpe|fox|fox sports|fs1|undisputed|skip and shannon|fs1 undisputed|skip|bayless|shannon|sharpe|sports|news|nba|basketball|los angeles lakers|lakers|los angeles clippers|clippers|kawhi leonard|lebron james|milwaukee bucks|bucks|giannis antekounmpo|Los Angeles Lakers vs Los Angeles Clippers|Lakers vs Clippers|Los Angeles nba|Los Angeles Lakers vs Milwaukee Bucks|Lakers vs Bucks|Los Angeles vs Milwaukee","553118","6034","377","2089","https://i.ytimg.com/vi/fGhDRvOq8u4/default.jpg","False","False","The Los Angeles Lakers have two tough games coming up against the Los Angeles Clippers and Milwaukee Bucks. Hear what Chris Broussard has to say about who he thinks will prevail in both matchups.#Undisputed #NBA #Lakers #Clippers #BucksSUBSCRIBE to get the latest UNDISPUTED content: http://foxs.pt/SubscribeUNDISPUTED▶Watch our latest NFL content: http://foxs.pt/NFLonUNDISPUTED▶Watch our latest NBA content: http://foxs.pt/NBAonUNDISPUTED▶Watch our latest MLB content: http://foxs.pt/MLBonUNDISPUTED▶First Things First's YouTube channel: http://foxs.pt/SubscribeFIRSTTHINGSFIRST▶The Herd with Colin Cowherd’s YouTube channel: http://foxs.pt/SubscribeTHEHERD▶Speak for Yourself’s YouTube channel: http://foxs.pt/SubscribeSPEAKFORYOURSELF▶Fair Game with Kristine Leahy’s YouTube channel: http://foxs.pt/SubscribeFAIRGAMESee more from UNDISPUTED: http://foxs.pt/UNDISPUTEDFoxSportsLike UNDISPUTED on Facebook: http://foxs.pt/UNDISPUTEDFacebookFollow UNDISPUTED on Twitter: http://foxs.pt/UNDISPUTEDTwitterFollow UNDISPUTED on Instagram: http://foxs.pt/UNDISPUTEDInstagramFollow Skip Bayless on Twitter: http://foxs.pt/SkipBaylessTwitterFollow Shannon Sharpe on Twitter: http://foxs.pt/ShannonSharpeTwitterAbout Skip and Shannon: UNDISPUTED:UNDISPUTED is a daily two-and-a-half hour sports debate show starring Skip Bayless and Shannon Sharpe. Every day, Skip and Shannon will give their unfiltered, incisive, passionate opinions on the biggest sports topics of the day.Lakers are not ready to 'go to the mat' with the Clippers — Chris Broussard | NBA | UNDISPUTEDhttps://youtu.be/fGhDRvOq8u4Skip and Shannon: UNDISPUTEDhttps://www.youtube.com/c/UndisputedOnFS1"
"kTXTPe3wahc","Parallel Worlds Probably Exist. Here’s Why","2020-03-06T17:40:33.000Z","UCHnyfMqiRRG1u-2MsSQLbXA","Veritasium","27","20.09.03","veritasium|science|physics|quantum mechanics|many worlds|Schrodinger|Schrodinger's cat|shrodinger|cat|Sean Carroll|Everett|norton 360|norton|lifelock|norton antivirus|norton security|norton secure vpn|norton vpn|cyber|quantum|multiverse|parallel universe|universes|superposition|entanglement|branching|wave function|decoherence|security|cyber safety","1928126","85805","3172","11009","https://i.ytimg.com/vi/kTXTPe3wahc/default.jpg","False","False","The most elegant interpretation of quantum mechanics is the universe is constantly splittingA portion of this video was sponsored by Norton. Get up to 60% off the first year (annually billed) here: https://bit.ly/32SM0yd or use promo code VERITASIUMSpecial thanks to:Prof. Sean Carroll https://www.preposterousuniverse.comHis book, a major source for this video is 'Something Deeply Hidden: Quantum Worlds and The Emergence of Spacetime'I learned quantum mechanics the traditional 'Copenhagen Interpretation' way. We can use the Schrödinger equation to solve for and evolve wave functions. Then we invoke wave-particle duality, in essence things we detect as particles can behave as waves when they aren't interacting with anything. But when there is a measurement, the wave function collapses leaving us with a definite particle detection. If we repeat the experiment many times, we find the statistics of these results mirror the amplitude of the wave function squared. Hence the Born rule came into being, saying the wave function should be interpreted statistically, that our universe at the most fundamental scale is probabilistic rather than deterministic. This did not sit well with scientists like Einstein and Schrödinger who believed there must be more going on, perhaps 'hidden variables'.In the 1950's Hugh Everett proposed the Many Worlds interpretation of quantum mechanics. It is so logical in hindsight but with a bias towards the classical world, experiments and measurements to guide their thinking, it's understandable why the founders of quantum theory didn't come up with it. Rather than proposing different dynamics for measurement, Everett suggests that measurement is something that happens naturally in the course of quantum particles interacting with each other. The conclusion is inescapable. There is nothing special about measurement, it is just the observer becoming entangled with a wave function in a superposition. Since one observer can experience only their own branch, it appears as if the other possibilities have disappeared but in reality there is no reason why they could not still exist and just fail to interact with the other branches. This is caused by environmental decoherence.Schrodinger's cat animation by Iván TelloWave functions, double slit and entanglement animation by Jonny HymanFilming of opening sequence by Casey RentzSpecial thanks to Mithuna Y, Raquel Nuno and Dianna Cowern for feedback on the scriptMusic from https://epidemicsound.com Experimental 1 Serene Story 2 Seaweed Colorful Animation 4"
"UyKgYMQ-AlQ","Katy Perry - Never Worn White (Official)","2020-03-05T05:00:10.000Z","UC-8Q-hLdECwQmaWNwXitYDw","KatyPerryVEVO","10","20.09.03","katy perry|katy|perry|never worn white|nww|new katy|new katy perry|katy perry new song|katy perry 2020|katy 2020|kp5|never worn white katy|never worn white katy perry|pop|new|new song|teenage dream","19905026","1054639","30997","53022","https://i.ytimg.com/vi/UyKgYMQ-AlQ/default.jpg","False","False","Listen to Never Worn White: http://katy.to/NeverWornWhiteDirector: J.A.C.KProducer: Maggie McLeanVideo Commissioner: Targa SahyounKaty Perry Complete Collection on Spotify: http://katy.to/SpotifyCompleteYDKaty Perry Essentials on Apple Music: http://katy.to/AMEssentialsYDWatch your favorite Katy videos on YouTube: http://katy.to/MusicVideosYDFollow Katy Perry:Website: http://katy.to/WebsiteYDInstagram: http://katy.to/InstagramYDTwitter: http://katy.to/TwitterYDFacebook: http://katy.to/FacebookYDWeibo: http://katy.to/WeiboYDVK: http://katy.to/VKPageYDMusic video by Katy Perry performing Never Worn White. © 2020 Capitol Records, LLC"
"DeAu_iF6egE","If You Don’t Know, Now You Know: Toxic PFAS Chemicals | The Daily Show","2020-03-06T03:10:22.000Z","UCwWhs_6x42TyRM4Wstoq8HA","The Daily Show with Trevor Noah","23","20.09.03","the daily show|trevor noah|daily show with trevor noah|the daily show episodes|comedy central|comedians|comedian|funny video|comedy videos|funny clips|noah trevor|trevor noah latest episode|daily show|trevor|news|politics|toxic chemicals|dupont|forever chemicals|if you don’t know now you know|IYDKNYK|chemicals|EPA|environmental protection agency|environment|water|cancer|thyroid|health risks|PFAS","1248371","23598","731","1676","https://i.ytimg.com/vi/DeAu_iF6egE/default.jpg","False","False","Trevor breaks down the growing concern over the uses and health risks of PFAS, a.k.a. “forever chemicals.” #IfYouDontKnowNowYouKnow #IYDKNYK #TheDailyShowSubscribe to The Daily Show:https://www.youtube.com/channel/UCwWhs_6x42TyRM4Wstoq8HA/?sub_confirmation=1 Follow The Daily Show:Twitter: https://twitter.com/TheDailyShowFacebook: https://www.facebook.com/thedailyshowInstagram: https://www.instagram.com/thedailyshowWatch full episodes of The Daily Show for free: http://www.cc.com/shows/the-daily-show-with-trevor-noah/full-episodesFollow Comedy Central:Twitter: https://twitter.com/ComedyCentralFacebook: https://www.facebook.com/ComedyCentralInstagram: https://www.instagram.com/comedycentralAbout The Daily Show:Trevor Noah and The World's Fakest News Team tackle the biggest stories in news, politics and pop culture.The Daily Show with Trevor Noah airs weeknights at 11/10c on Comedy Central."
"tdSQkoryv3Q","Misread Waves (Short Film)","2020-03-06T18:07:02.000Z","UC9k23HZ1xMiqxf4gFfmxr5w","Kevin James","23","20.09.03","Kevin James|King of Queens|Mall Cop|Mall Cop 2|Paul Blart|Hitch|kevin james comedy|kevin james sound guy|parody|skits|kevin james skit|saturday night live|comedy sketch|skit|Adam Sandler|Movies|Kevin James Youtube|will smith|The Crew|comedy|funny|stand up comedy|sketch|a bad lip reading|movie meme|sound guy|misread waves|short film|drama|kevin james short film","502068","25864","327","2013","https://i.ytimg.com/vi/tdSQkoryv3Q/default.jpg","False","False","We all struggle with it...SUBSCRIBE: http://bit.ly/2UYcjkFFOLLOW KEVIN:Instagram: http://bit.ly/2P4s1qmFacebook: http://bit.ly/39JxUkPTwitter: http://bit.ly/38Hmf6aFor live shows and upcoming events visit www.KevinJames.com🎥: Kinnane Brothers"
"-6BvA4U1dLI","Pete Davidson Drips With Sweat While Eating Spicy Wings | Hot Ones","2020-03-05T16:00:00.000Z","UCPD_bxCRGpmmeQcbe2kpPaA","First We Feast","26","20.09.03","First we feast|fwf|firstwefeast|food|food porn|cook|cooking|chef|kitchen|recipe|cocktail|bartender|craft beer|complex|complex media|Cook (Profession)sean evans|pete davidson|pete davidson hot ones|pete davidson sean evans|pete davidson hot sauce|pete davidson spicy wings|pete davidson hot wings|pete davidson standup|pete davidson netflix|hot ones hot sauce|the last dab|pete davidson interview","4134569","146458","6530","16055","https://i.ytimg.com/vi/-6BvA4U1dLI/default.jpg","False","False","Pete Davidson is an actor and comedian you probably know best from Saturday Night Live. He also has a new comedy special on Netflix, Alive From New York, available right now. But how is he with spicy food? Find out as the Staten Island comic takes on the wings of death with host Sean Evans. Along the way, Davidson offers behind-the-scenes SNL stories, talks about walking in an Alexander Wang fashion show, and gives a ringing endorsement for Uncut Gems and Adam Sandler's basketball skills.Be sure to catch Hot Ones: The Game Show every Tuesday @ 10pm ET/PT on truTV!BUY THE LAST DAB XXX NOW: https://heatonist.com/products/hot-ones-the-last-dab?variant=378416136201BUY THE CLASSIC HOT ONES HOT SAUCE NOW: https://bit.ly/2Q1VfIhBUY LOS CALIENTES HOT SAUCE NOW: https://bit.ly/2LMDxqSNEW HOT ONES MERCH AVAILABLE NOW: https://bit.ly/2AIS271SIGN UP for the Hot Ones Monthly Hot Sauce Subscription box: https://bit.ly/2veY50PSubscribe to First We Feast on YouTube: http://goo.gl/UxFzhKCheck out more of First We Feast here:http://firstwefeast.com/https://twitter.com/firstwefeasthttps://www.facebook.com/FirstWeFeasthttp://instagram.com/firstwefeastFirst We Feast videos offer an iconoclastic view into the culinary world, taking you behind-the-scenes with some of the country's best chefs and finding the unexpected places where food and pop culture intersect."
