video_id,title,publishedAt,channelId,channelTitle,categoryId,trending_date,tags,view_count,likes,dislikes,comment_count,thumbnail_link,comments_disabled,ratings_disabled,description
"Unx9Y_Wy5pI","Zion Is Doing Something That Has Never Been Done Before...Or Is He?","2020-03-07T20:07:38.000Z","UC3L9XPe0_FGfRG-CMGtBvFg","JxmyHighroller","17","20.09.03","LeBron James|Michael Jordan|LA Lakers|LA Clippers|Bucks|House of Highlights|ESPN|NBA highlights|Zion Williamson|Giannis Antetokounmpo|Luka Doncic|Jimmy Highroller|Kristopher London|Lamelo Ball|James Harden|Stephen Curry|Best dunks|Kobe Bryant|Max Kellerman|Stephen A Smith|Shaq vs Michael Jordan|The Black Mamba|Kobe last game|Kobe and Shaq|Kobe Highlights|NBA trash talk|Ball Brothers|Lavar Ball|Zion Rookie|Zion vs LeBron|Giannis Vs Zion","803616","27803","550","2051","https://i.ytimg.com/vi/Unx9Y_Wy5pI/default.jpg","False","False","Ke Visions Youtube Channelhttps://www.youtube.com/user/Kdub31397/featuredIGke.visionsMusic provided by the talented LCS Beats: https://www.youtube.com/channel/UCc-LuGddmv1ETE5X-UiN6iQFollow me on Instagram - jxmyhighroller Be sure to subscribe and turn on notifications for the latest content from ya boy Jxmy! We doin this a couple times a week, every week! *Copyright Disclaimer Under Section 107 of the Copyright Act 1976, allowance is made for fair use for purposes such as criticism, comment, news reporting, teaching, scholarship, and research. Fair use is a use permitted by copyright statute that might otherwise be infringing. Non-profit, educational or personal use tips the balance in favor of fair use. No copyright infringement intended. ALL RIGHTS BELONG TO THEIR RESPECTIVE OWNERS"
"C1PNHRfaqCo","ULTIMATE FUSION COOKING BATTLE","2020-03-08T16:00:01.000Z","UCfyehHM_eo4g5JUyWmms2LA","SORTEDfood","26","20.09.03","ultimate fusion battle|fusion food|normal battle|normal vs normal|ultimate battle|cooking battle|cook off|food battle|cooking challenge|japanese food|sortedfood battle|sorted food|food challenge🔥|sortedfood ultimate battle playlist|roast dinner|british food|moroccan food|bunny chow|greek food|south african food|chicken katsu curry|creole food|creole sauce|sortedfood ben|sortedfood mike|sortedfood barry|sortedfood jamie|sortedfood james","296931","13096","92","1102","https://i.ytimg.com/vi/C1PNHRfaqCo/default.jpg","False","False","We love putting our ‘Normals’ under pressure and throwing them into an Ultimate Battle. In this episode, we put them to the test by challenging them to create a fusion dish from two cuisines to see if their cooking can create the perfect marriage of flavours. Have a watch to see if they managed to pull it off! Let us know if you’d like us to upload the recipes! Comment below and keep an eye out on our Community Tab!Ready to live the ultimate food lifestyle? Come and join the Sorted Club to make use of the smart tools that connect millions of foodies around the world and help you create your ultimate food lifestyle.- Simplify midweek cooking with smart meal packs and audio guides- Visit locally recommended restaurants & experiences in major cities around the world- Listen to weekly podcasts that debate trending food topics- Enjoy the full collection of Sorted Club Books and build your own cookbook.Check it out here:  http://bit.ly/2SiD6q6"
"BF8TE5qsOCs","Megan Thee Stallion - B.I.T.C.H [Official Video]","2020-03-06T05:00:10.000Z","UCKrdjiuS66yXOdEZ_cOD_TA","Megan Thee Stallion","10","20.09.03","Megan Thee Stallion|Rap|Hottie|300 Entertainment|Hip Hop 2019|Hip Hop|Megan Thee Stallion B.I.T.C.H|B.I.T.C.H|Megan Thee Stallion B.I.T.C.H Official Video|B.I.T.C.H Megan Thee Stallion|Official Audio Megan Thee Stallion B.I.T.C.H|B.I.T.C.H Official Audio|B.I.T.C.H Official Audio Megan Thee Stallion|Official Audio Megan Thee Stallion|Megan Official|BITCH|Megan Thee Stallion BITCH|BITCH Megan Thee Stallion|BITCH Official Video|BITCH Megan Thee Stallion Official","4228129","232673","9861","15139","https://i.ytimg.com/vi/BF8TE5qsOCs/default.jpg","False","False","The official music video for B.I.T.C.H by Megan Thee Stallion from 'SUGA' - Out Now!Stream 'SUGA' on all platforms: https://megantheestallion.ffm.to/sugaDirector: Eif RiveraExecutive Producer: Tara RazaviProducer: Omar Reynoso Creative Direction: Lauren DunnVideo Commissioner: Lucas PrevostProduction company: Happy PlaceFollow Megan Thee Stallion:https://www.instagram.com/theestallionhttps://twitter.com/theestallionhttps://www.facebook.com/theestallionnhttps://soundcloud.com/megan-thee-stallionLYRICSReal hot girl shit, ahIt ain't always about what you likeSometimes it's about what's right (Helluva made this beat baby) huhI'd rather be ya B-I-T-C-H (I'd rather keep it real with ya)'Cause that's what you gon' call me when I'm trippin' anywayYou know you can't control me babyYou need a real one in your lifeThem bitches ain't gon' give it to you rightI'd rather be ya B-I-T-C-H (I'd rather keep it real with ya)'Cause that's what you gon' call me when I'm trippin' anywayYou know you can't control me babyYou need a real one in your lifeThem bitches ain't gon' give it to you right (ay)Why you wanna play with me? You know I'm undefeatedA real hot girl know how to keep a nigga heatedYou say you want respect? Well treat me how you wanna be treatedYou told me to keep it real but you don't practice what you preachin'You want me to blow your phone up and come looking for you 'til I find yaYou really want me to whoop the hoe that you fuckin' with if I find herBitch you ain't that busy, I don't give a fuck what you ain't got time forYou look me in my eyes and know you lyin', man that's fraud, bruhMan you knew I was a player 'fore you met me, need to relaxYou know that you gon' hate me if I get to playin' get-backI ain't turn into no bad bitch when you met me, boy I been thatYou tryna make me something that I ain't, and I ain't with thatI'd rather be ya B-I-T-C-H (I'd rather keep it real with ya)'Cause that's what you gon' call me when I'm trippin' anywayYou know you can't control me babyYou need a real one in your lifeThem bitches ain't gon' give it to you rightI'd rather be ya B-I-T-C-H (I'd rather keep it real with ya)'Cause that's what you gon' call me when I'm trippin' anywayYou know you can't control me babyYou need a real one in your lifeThem bitches ain't gon' give it to you right (ay, ay, huh)I got my mind on gettin' paid, we ain't spoke in some daysHe prolly thinkin' I'm in pain, but I'm really on gameAin't no nigga finna stop me, independent, I got meAll the shit that I be needin' can't depend on a prollyAnd that's fucked up 'cause you know that I don't fuck with nobodyI be quiet, but you out here tellin' stories one-sidedI ain't perfect, and I try to fix the shit that ain't workingBut it's 2020, I ain't finna argue 'bout twerkingSince you wanna test the waters, might as well jump in with both feetIf you leave me, and you see me, better act like you don't know meIf you thinking shit get better with another bitch, go get herWhen you realize she ain't got you like I got you, I can't help youI'd rather be ya B-I-T-C-H (I'd rather keep it real with ya)'Cause that's what you gon' call me when I'm trippin' anywayYou know you can't control me babyYou need a real one in your lifeThem bitches ain't gon' give it to you rightI'd rather be ya B-I-T-C-H (I'd rather keep it real with ya)'Cause that's what you gon' call me when I'm trippin' anywayYou know you can't control me babyYou need a real one in your lifeThem bitches ain't gon' give it to you right (yuh)I'd rather be ya B-I-T-C-H (I'd rather keep it real with ya)'Cause that's what you gon' call me when I'm trippin' anywayYou know you can't control me babyYou need a real one in your lifeThem bitches ain't gon' give it to you rightI'd rather be ya B-I-T-C-H (I'd rather keep it real with ya)Ohh, ohh(I'd rather keep it real with ya)Ohh, ohh--#MeganTheeStallion #BITCH #SUGA #OfficialVideo© 2020 1501 Certified Ent LLC under exclusive license to 300 Entertainment"
"hWaRHIFUgB0","I Tried Selling My YouTube Channel... **they really offered this**","2020-03-07T18:56:00.000Z","UCilwZiBBfI9X6yiZRzWty8Q","FaZe Rug","24","20.09.03","faze rug|rug|rugfaze|fazerug|selling|i tried selling|i tried selling my youtube channel|they really offered this|selling my youtube channel|youtube channel|faze rug i tried selling|faze rug selling|i tried selling my youtube channel they really offered this|pawn|pawn shops","1785886","105936","1871","8873","https://i.ytimg.com/vi/hWaRHIFUgB0/default.jpg","False","False","I CAN'T BELIEVE IT!!I went to different pawn shops and asked how much they would buy my YouTube channel for.. The different answers we got were CRAZY!!• GET ME TO 15 MILLION SUBSCRIBERS ► http://bit.ly/SubToRugFollow me on my Social Media to stay connected!Twitter ► https://twitter.com/FaZeRugInstagram ► https://www.instagram.com/fazerug/Facebook ► https://www.facebook.com/RealFaZeRug/Snapchat ► thefazerug (Add me to see how I live my daily life) :DIf you read this far down the description I love you"
"oB-AXwSKRso","LA Galaxy vs. Vancouver Whitecaps | Can Chicharito Make An Impact On Home Debut? | MLS HIGHLIGHTS","2020-03-08T05:41:15.000Z","UCSZbXT5TLLW_i-5W8FZpFsg","Major League Soccer","17","20.09.03","LA Galaxy|Vancouver Whitecaps|LA Galaxy vs. Vancouver Whitecaps FC|sp:ty=high|sp:dt=2020-03-08T03:00:00Z|sp:st=soccer|sp:li=mls|sp:ti:home=LA|sp:ti:away=VAN|mls highlights|soccer highlights|football highlights|major league soccer","136859","1041","114","687","https://i.ytimg.com/vi/oB-AXwSKRso/default.jpg","False","False","Javier Chicharito Hernandez will make his anticipated home debut Saturday when the LA Galaxy host the Vancouver Whitecaps with both teams searching for their first win of the young season. March 7th 2020.#MLS #Soccer #Football"
"o6MkMuHspIU","Shenseea - The Sidechick Song (Official Music Video)","2020-03-07T22:00:10.000Z","UChSff_mx1n57Hf-k4zFXIjg","Shenseea","10","20.09.03","Shenseea|Shenseea Official|SHENYENG|Blessed|Jamaican|Pepsi|Campari|Romeich Entertainment|Dancehall|ShenseeaOfficial|Jamaica|Tyga|Dancehall Queen|Workout Twerkout|Dancehall Official|The Sidechick Song|Shenseea - The Sidechick Song|attomatic records|Rd Studios|ruption di boss|sexy song|shenseea sexy video|sex scenes|sexy scene|instapix|instapic|Dancehall song","814895","65951","1506","2747","https://i.ytimg.com/vi/o6MkMuHspIU/default.jpg","False","False","THE SIDECHICK SONG@Shenseea MUSIC VIDEO OUT NOWProduced by @attomatic_records and @romeichentertainmentVideo directed by @Shenseea and @RD Studios @ruptiondiboss Edited by @ruptiondiboss#OneTeamOneDream#RomeichEntertainment#ShenyengDon't forget to subscribe for more music!Follow Shenseea▶ Stream: https://ONErpm.lnk.to/ShenseeaID▶ Facebook: https://www.facebook.com/ShenseeaOfficial▶ Instagram: https://www.instagram.com/shenseea—Follow ONErpm:▶ On Socials: https://lnk.to/RSONEID▶ On Spotify: https://ONErpm.lnk.to/ONESpotID▶ On Apple Music: https://ONErpm.lnk.to/ONEappleID#Shenseea #Blessed #DancehallLyrics:Make mi tell uno a likkle story mi have a manweh have a womanweh no know mi mi knowshe but she no knowmi the buddy make mi happythough mi no own itThis a the originalsidechick song mi up inna mi feelings fi a nextgyal man mi know it wrong but it neva plan normallymi a wife mi no hold sidechick positionThis ano my style anno so mi ton mi up innami feelings fi a next gyal man mi know it wrongbut it neva plan normally mi a wifffyyyyMi no like bun if yuh lie mi no forgive so mifeel a like betta if a me him cheat with whenyou addi wife you no know who him a frig oowen you deh pon the side a you him a tell everythingHim rate mi highly spoil mi treat mi like awifey have respect naa text wen him besidemi the only thing a say mi low key and weprivite and if mi see them pon the gram mi affi avoid itJust know say mi naa go confront no gyal not no type to searchand contact no gyal if mi see them togethermi in my feelings but still mi naa leave him.This a the original sidechick song mi up innami feelings fi a next gyal man mi know it wrongbut it neva plan normally mi a wife mi no hold sidechick positionThis ano my style anno so mi ton mi up innami feelings fi a next gyal man mi know it wrongbut it neva plan normally mi a wifffyyyyA man is always gonna cheat caa it benifithim gimmi anything mi waa so mi naa go stresshim prefer know who him a fvck than be thevictim cause if mi find out from a stranger mi aggo left himAnno like mi no know mi worth mi wellalert mi can get hurt wee eva a flirt him makemi happy so mi aggo make it work micomfortable although mi anno firstPlus special occasion a her day mi get fi see himafter the birthday if mi see them togethermi in my feelings but still mi naa leave himThis a the original sidechick song mi up innami feelings fi a next gyal man mi know it wrongbut it neva plan normally mi a wife mi no holdsidechick positionThis ano my style anno so mi ton mi upinna mi feelings fi a nextgyal man mi know it wrongbut it neva plan normally mi a wifffyyyyMi no really know who the bowy a take fifool cause mi know him love mi and mi knowhim love she but mi a go with the flow naadisturb the peace make it flow on naturallyAnno like mi no know mi worth mi wellalert mi can get hurt wee eva a flirt him makemi happy so mi aggo make it work fi now"
"0TF329BFyow","Can You Find Him in This Video? • Hidden in Plain Sight #13","2020-03-07T13:00:01.000Z","UCDRbNGFusqlXX4a5vwi9ouQ","Vat19","24","20.09.03","vat19|vat 19|vat-19|hidden in plain sight|hiding in plain sight|mega construx|mega construx aliens","2024161","69357","1718","0","https://i.ytimg.com/vi/0TF329BFyow/default.jpg","False","False","Can Danny hide from his boss all day? Let's find out!Thank you, Mattel, for paying us and helping us create this video. Check out the new MEGA Construx Aliens in stores at a Walmart near you! https://www.walmart.com/ip/Mega-Construx-Aliens-Xenomorph-Egg-Pack-Styles-May-Vary/958391735More Hidden in Plain Sight: https://www.youtube.com/watch?v=jseZOkJ0cTk&list=PLSqiExuEA-RF4HU9PWHtpiQo94XkXV2nXSubscribe to Vat19: http://www.youtube.com/subscription_center?add_user=vat19comVisit the Vat19 Headquarters: https://www.vat19.com/tour****************** Follow Vat19:Facebook: https://facebook.com/vat19Instagram: https://instagram.com/vat19/Shop hundreds more curiously awesome products:https://www.vat19.com/?adid=youtubeWatch More Vat19:The White Elephant Gift Show: https://www.youtube.com/watch?v=rppcXroNgKI&list=PLSqiExuEA-RFpqW0Y3vn0pn8wDW_3LXAOLatest Uploads: https://www.youtube.com/user/vat19com/videos?shelf_id=1&view=0&sort=ddPopular Videos: https://www.youtube.com/user/vat19com/videos?shelf_id=7&view=0&sort=pFun Stuff to Eat: https://www.youtube.com/watch?v=7RXmNRr8x7I&list=PLSqiExuEA-REt5gzR0A9ernZNHlZ2glIlAbout Vat19:Vat19 is dedicated to curiously awesome gifts, candy, toys, gummy, putty, puzzles, games, and more! In addition to making funny commercials you'll actually want to watch, we produce amazing challenge videos, document our outrageous contraptions, and invite you to a front row seat for our silly stunts. Sometimes we blow things up, fill up a bathtub or pool with crazy stuff, dare each other to eat super spicy foods, and answer “burning questions” from our viewers."
"5TWDdOZPvM4","Blueface ft. NLE Choppa - Holy Moly (Official Video) ft. NLE Choppa","2020-03-06T05:00:00.000Z","UCqY8yST0Oj893uxV7T5tZfg","BluefaceVEVO","10","20.09.03","Blueface|Holy|Moly|Cash|Money|Records|Inc.|Hip|Hop","6288598","365913","12185","19839","https://i.ytimg.com/vi/5TWDdOZPvM4/default.jpg","False","False","Official music video by Blueface ft. NLE Choppa performing Holy Moly - available everywhere now: https://blueface.lnk.to/holymolyYD►Subscribe for more official content from Blueface: https://blueface.lnk.to/YTsubs/►Follow Blueface OnlineInstagram: https://www.instagram.com/bluefacebleedemFacebook: https://www.facebook.com/officialBlueFaceBleedemTwitter: https://twitter.com/bluefacebleedem Subscribe to YouTube Music: https://blueface.lnk.to/holymolyYD/youtubemusic#Blueface #HolyMolyMusic video by Blueface performing Holy Moly. © 2020 Cash Money Records, Inc.http://vevo.ly/9L7RRT"
"1FJra_KG3DY","Buying My FAKE Merch!","2020-03-08T01:16:56.000Z","UCjwmbv6NE4mOh8Z8VhPUx1Q","Rosanna Pansino","26","20.09.03","gadgets|amazon|shopping|haul|weird|insane|funny|practical|gifts|fun|tips|tricks|hacks|have a try|vlog|professional|girls|women|collab|guest|cute|bun|as seen on tv|on tv|put to the test|does it work|affordable|cheap|review|honest review|unboxing|unbox|react|reacting|impression|quality|reviewed|5 stars|1 star|gag gift|challenge|tech|soup|jeans|dress|onesie|fabric|clothing|clothes|wish|stretch|jeggings|dresses|dressing|fake|fake merch|my merch","342264","17161","313","1466","https://i.ytimg.com/vi/1FJra_KG3DY/default.jpg","False","False","HUGE MERCH SALE NOW! https://www.rosannapansino.comSUBSCRIBE ► https://www.youtube.com/subscription_center?add_user=rosannapansino--------------------------------------------------------------------------------------------*MERCH: https://rosannapansino.com/*Buy Nerdy Nummies Cookbook: https://tinyurl.com/NerdyNummiesCookbook*Buy Baking All Year Round Cookbook: https://tinyurl.com/BakingAllYearRoundCookbook  --------------------------------------------------------------------------------------------FOLLOW ME HERE:Facebook: http://www.facebook.com/rosannapansinoTwitter: http://www.twitter.com/RosannaPansinoInstagram: http://instagram.com/rosannapansinoTikTok: RosannaPansino--------------------------------------------------------------------------------------------I cant believe some of this fake #Merch that is for #Sale on the internet! This was such a silly #Vlog to make.What other videos would you like to see? Subscribe for more videos!This is not a sponsored video. All products purchased by me."
"spNxDF2Vh8c","Resumen y Goles | Atlas vs Guadalajara | Jornada 9 - Clausura 2020 | Liga BBVA MX","2020-03-08T05:16:39.000Z","UCq8BPLXtFeiSFOvmJrknWGg","LIGA BBVA MX","17","20.09.03","soccer|fútbol|sports|deportes|Clausura 2020 - Liga MX|Liga MX|Jornada 9|Atlas|Guadalajara|TV Azteca|LIGA|BBVA|MX|LIGA BBVA MX|Atlas Chivas|Atlas Chivas 2020|Atlas vs Chivas|Atlas contra Chivas|Accion Atlas Chivas|Atlas vs Chivas en vivo|Jornada 9 Liga MX|Liga Mx 2020|LigaMX 2020|Resumen|Highlights|Mexico|liga mexicana|futbol mexicano|cl20|football|J9|Accion jornada 9","908938","6006","648","790","https://i.ytimg.com/vi/spNxDF2Vh8c/default.jpg","False","False","Atlas 0-2 ChivasSábado 7 de marzo, 202021:00 hrs.Estadio: JaliscoAsistencia: 45516El Rebaño se llevó el Clásico Tapatío. Las Chivas ganaron en el Estadio Jalisco con marcador de 0-2 al Atlas. El juego se desarrolló en el marco de la Jornada 9 de la LIGA BBVA MX Clausura 2020. Con esto, el Guadalajara alcanzó 15 puntos; los Zorros se quedaron con 6 unidades.GolesMinuto 18, 0-1. Jesús Molina encontró el balón en el área y no dudó en disparar con potencia para hacer temblar las redes y abrir el marcador.Minuto 42, 0-2. Gran jugada entre Isaac Brizuela y José Juan Macías que terminó con un disparo raso y bien colocado del “9” de las Chivas.La FiguraJosé Juan Macías convirtió, con gran clase, la anotación que terminaría por inclinar la balanza en el Clásico Tapatío ante Atlas."
"0WeSAuoYsOQ","Doctor shares CDC's latest coronavirus warnings","2020-03-07T15:25:13.000Z","UC-SJ6nODDmufqBzPBwCvYvQ","CBS This Morning","25","20.09.03","video|cbs|news|coronavirus|outbreak|death|covid19|trump administration|test kits|CDC|health","500197","5514","446","3042","https://i.ytimg.com/vi/0WeSAuoYsOQ/default.jpg","False","False","As public concern over the coronavirus spreads almost as quickly as the disease itself, people are looking out for any information that would help them or their loved ones stay safe. Dr. David Agus joins CBS This Morning: Saturday to talk about what medical experts know so far and what precautions you can take.Watch CBS This Morning HERE: http://bit.ly/1T88yARDownload the CBS News app on iOS HERE: https://apple.co/1tRNnUyDownload the CBS News app on Android HERE: https://bit.ly/1IcphuXLike CBS This Morning on Facebook HERE: http://on.fb.me/1LhtdvIFollow CBS This Morning on Twitter HERE: http://bit.ly/1Xj5W3pFollow CBS This Morning on Instagram HERE: http://bit.ly/1Q7NGnYGet new episodes of shows you love across devices the next day, stream local news live, and watch full seasons of CBS fan favorites anytime, anywhere with CBS All Access. Try it free! http://bit.ly/1OQA29B Each weekday morning, CBS This Morning co-hosts Gayle King, Anthony Mason and Tony Dokoupil deliver two hours of original reporting, breaking news and top-level newsmaker interviews in an engaging and informative format that challenges the norm in network morning news programs. The broadcast has earned a prestigious Peabody Award, a Polk Award, four News & Documentary Emmys, three Daytime Emmys and the 2017 Edward R. Murrow Award for Best Newscast. The broadcast was also honored with an Alfred I. duPont-Columbia Award as part of CBS News division-wide coverage of the shootings at Sandy Hook Elementary School in Newtown, Connecticut. Check local listings for CBS This Morning broadcast times."
"h4z3nP-4cls","Do all the Sidemen think the same?","2020-03-07T17:00:09.000Z","UCh5mLn90vUaB1PbRRx_AiaA","MoreSidemen","22","20.09.03","sidemen|moresidemen|miniminter|ksi|zerkaa|behzinga|tbjzl|vikkstar|wroetoshaw","2074002","103504","1108","5645","https://i.ytimg.com/vi/h4z3nP-4cls/default.jpg","False","False","#SidemenSaturday• Sidemen: http://www.youtube.com/Sidemen• Sidemen Clothing: http://www.sidemenclothing.com• Sidemen Twitter: https://twitter.com/Sidemen---------------------------------------------------------------------Sidemen:• Miniminter: http://www.youtube.com/Miniminter• Zerkaa: http://www.youtube.com/Zerkaa• Behzinga: http://www.youtube.com/Behzinga• Vikkstar123: http://www.youtube.com/Vikkstar123• TBJZL: http://www.youtube.com/TBJZL• Wroetoshaw: http://www.youtube.com/Wroetoshaw• KSI: http://www.youtube.com/KSIedited by https://twitter.com/TegsRFoutro song - https://www.youtube.com/watch?v=3O7FQdHrHLM"
"hcKZ_6S6rMI","I Made my Dog out of Cotton Candy","2020-03-07T20:15:00.000Z","UC6IijBsVf2PlWo_uq6P9wQw","Gloom","24","20.09.03","cotton candy|cotton candy machine|cotton candy maker|candy|how to|edible|real|challenge|candy food|life hacks|amazon|funny|try|taste|gloom|gloomgames|kassie|2020|twinkie|diy|gloom dog|candy floss|gloom tries","595043","27355","395","3055","https://i.ytimg.com/vi/hcKZ_6S6rMI/default.jpg","False","False","I ordered a cotton candy machine in hopes to make a giant edible cotton candy version aka sculpture of my dog. Did it actually work? You tell Kartha.SUBSCRIBE HERE: https://www.youtube.com/channel/UC6IijBsVf2PlWo_uq6P9wQw?sub_confirmation=1My INSTAGRAM: http://www.instagram.com/gloomykassieMy TWITTER: http://www.twitter.com/gloomykassieMy DISCORD SERVER (13 and up only): http://discord.gg/GLOOMMERCH: http://gloom.storeWATCH MY HORRIBLE BITLIVES: https://www.youtube.com/watch?v=-RcgvL6bKZQ&list=PLwbhb6Gu7AnXcLWpGMezpMHtPc6MZIfwYMy TIK TOK is @gloomdog, here's a link: http://vm.tiktok.com/JTHb8L/---------------------------------------------------------------------------I'm Kassie, also known as Gloom! I'm a variety gamer who does gameplay commentary on indie games and some bigger titles too. I also do silly sketches, challenges, Q&As, and whatever makes you goof balls giggle.---------------------------------------------------------------------------I do my best to upload at a few times a week (unless my life is a mess)."
