video_id,title,publishedAt,channelId,channelTitle,categoryId,trending_date,tags,view_count,likes,dislikes,comment_count,thumbnail_link,comments_disabled,ratings_disabled,description
"J8AGD_p8F6I","The Oscars 2020 | Legendary comeback from Eminem “Lose Yourself” Live | FOX","2020-02-10T17:05:08.000Z","UCokpOoe2OrddBfl6I_oY5vQ","FOX Nederland","24","20.11.02","the oscars|92nd academy awards|the academy awards 2020|oscars 2020|the academy awards|academy awards|prijsuitreiking|dolby theatre|filmprijzen|winners2020|oscars2020vs|eminem comeback|eminem live|eminem 2020|lose yourself|eminem lose yourself|lose yourself 2020|oscars nominations|red carpet|best moments|elton john oscars|eminem oscars|movies|oscars|awards|academy|oscars billie eillish|8 miles|rapper|best rap song|live performance|comeback eminem","6093150","334790","6725","26345","https://i.ytimg.com/vi/J8AGD_p8F6I/default.jpg","False","False","Eminem verraste de gehele zaal, en vervolgens de hele wereld met een live optreden van Lose Yourself.Geen woorden voldoen aan zijn optreden. Het enige wat we willen zeggen is: deze video wil je op REPEAT.Je kunt nu The Oscars terug kijken bij FOX via jouw provider. Check hier hoe: http://foxtv.nl/gemist -------------------------------------------------------------- Abonneer nu voor meer The Oscars video’s: https://www.foxtv.nl/abonneren Like FOX op Facebook: https://www.facebook.com/foxtvnl/Meer The Oscars 2020: https://www.youtube.com/playlist?list=PLiWV7u4JGxAqY_2wiyTITSrVO-nAnsah5Over FOX:FOX is jouw #1 plek voor al je favoriete series.🍿 Wij zenden de exclusief de beste series uit, zoals: The Walking Dead, The X-Files, Empire, Legion, American Horror Story en nog veel meer. FOX is te vinden op kanaal 11 of 16. We zien je daar!-------------------------------------------------------------- Volg FOX voor meer The Oscars-------------------------------------------------------------- FACEBOOK: https://www.facebook.com/foxtvnl TWITTER: https://twitter.com/foxnl INSTAGRAM: https://www.instagram.com/fox_nederland/ WEBSITE: https://www.foxtv.nl/#Oscars2020"
"87zXvSCmSYk","Joaquin Phoenix Accepts the Oscar for Lead Actor","2020-02-10T04:24:30.000Z","UC_IpSl6O_-IRAA6fiNs05Gg","ABC","24","20.11.02","oscars|academy|awards|statue|ceremony|red|carpet|movies|actors|winners2020|oscars2020vs","2817055","99602","5953","17641","https://i.ytimg.com/vi/87zXvSCmSYk/default.jpg","False","False","Watch Joaquin Phoenix's Oscar 2020 acceptance speech for Actor in a Leading Role for his portrayal of Arthur Fleck in JOKER. Watch more highlights from Oscars 2020 on Oscar.com and in the ABC app!"
"hfzSedylBog","Water Bottle Flip 3 | Dude Perfect","2020-02-10T23:03:51.000Z","UCRijo3ddMTht_IHyNSNXpNQ","Dude Perfect","17","20.11.02","dude perfect|dude perfect stereotypes|dude perfect water bottle flip|bottle flip|water bottle flip|dude perfect bottle flip|dude perfect basketball|dp|dude perfect world record|edition|nerf|trick shots|trick shot|family|ping pong|bowling|clean|family friendly|bubble wrap|soccer|football|spinner|spinners|fidget spinners|dude|water|bottle|flip|fliping|flipping|best|viral|trending","4361216","325372","4740","14001","https://i.ytimg.com/vi/hfzSedylBog/default.jpg","False","False","TRIP FLIP! It's time for water bottle 3!Special thanks to TruLabs for sponsoring this video!Click HERE to get 15% off your first order http://bit.ly/TruLabs (use the code DUDE15)► Want an EXTRA Dude Perfect Video every week? Join the DP SQUAD! https://www.youtube.com/user/corycotton/join► Thanks for subscribing! - http://bit.ly/SubDudePerfectMusic by Future Royalty:► Click HERE to listen on Spotify - https://open.spotify.com/track/3N1McBmL4FxqiHSfKAB413?si=DtWt-DHBSM-xQafs-5X5tQ► Click HERE to listen on YouTube - https://youtu.be/cz2ZbS2hxbw► Click HERE to visit Future Royalty's Instagram - https://www.instagram.com/wearefutureroyalty/NEXT LEVEL STUFF -------------------------------------------🎒 NEW Merch - http://bit.ly/DPStore🎮 Play our FREE iPhone game! - http://smarturl.it/DudePerfect2📱 JOIN our VIP TEXT LIST - http://bit.ly/DPTextVIP🔔 Hit the bell next to Subscribe so you don't miss a video!👨🏻‍💻 Watch our newest vids! - http://bit.ly/NewDPVids📕 Read our Book - Go Big - http://amzn.to/OYdZ2sFollow our Instagrams so we can be best friends -------------------------------------------🏆 http://Instagram.com/DudePerfect🧔🏻 http://Instagram.com/TylerNToney👱🏻‍♂️ http://Instagram.com/Cody_Jones_🙋🏻‍♂️ http://Instagram.com/CobyCotton👨‍🦰 http://Instagram.com/GarrettHilbert⛹🏻‍♂️ http://Instagram.com/CoryCotton-------------------------------------------“The Best”Written by Taylor Coggins© Monster Party (ASCAP)As performed by Future RoyaltyCourtesy of Rock Salt Music-------------------------------------------Bonus points if you're still reading this! Comment your favorite series! (Trick Shots, Battles, Stereotypes, Overtime, Bucket List)Click here to learn more about Dude Perfect:http://bit.ly/AboutDudePerfectAs always...Go Big and God Bless!- Your friends at Dude PerfectBusiness or Media, please contact us at: Dude@DudePerfect.com5 Msgs/Month. Reply STOP to cancel, HELP for help. Msg&data rates may apply. Terms: slkt.io/DLd------------5 Best Friends and a Panda.If you like Sports + Comedy, come join the Dude Perfect team!Best known for trick shots, stereotypes, battles, bottle flips, ping pong shots and all-around competitive fun, Dude Perfect prides ourselves in making the absolute best family-friendly entertainment possible! Welcome to the crew! Pound it 👊🏻 Noggin 🙇🏻‍♂️ - Dude Perfect"
"M3Y_B7fNmjA","The Most Underrated Game Ever","2020-02-09T19:03:24.000Z","UCGwu0nbY2wSkW8N-cghnLpA","Jaiden Animations","1","20.11.02","jaiden|animations|jaidenanimation|jaidenanimations|jaidenanimation fossil fighters|jaiden animation fossil fighters|jaidenanimation video games|jaiden animation dinosaur|forgotten video game|underrated video game|dinosaur video game|pokemon|fossil fighters","3235255","250024","3246","35653","https://i.ytimg.com/vi/M3Y_B7fNmjA/default.jpg","False","False","dino time gets weirdChuggaconroy: https://www.youtube.com/user/chuggaaconroyScottFalco: https://www.youtube.com/user/ScottFalco♥ The Team ♥Atrox: https://twitter.com/AtroxChobatsuDavidBaronArt: http://davidbaronart.tumblr.com/Denny: https://twitter.com/90PercentDennyDuckdee: https://www.youtube.com/user/SirDuckD?app=desktopJaystarz: https://www.youtube.com/xjaystarzxJRF: jrfieldsend@aol.comMorganToast: https://morgantoast.tumblr.com/MsJolly: https://twitter.com/themsjollyNoodle: https://www.youtube.com/channel/UCj74rJ9Lgl3WTngq675wxKgPivots: https://www.youtube.com/user/ThePivotsXXDShooch: https://twitter.com/Shoocharu?s=09------------------------------------------------------------------------------------SUBSCRIBE for more animations!https://www.youtube.com/c/jaidenMERCH:https://jaidenanimations.com/TWITTER:https://twitter.com/JaidenAnimationINSTAGRAM:https://instagram.com/jaiden_animations/DEVIANTART:http://jaidenanimations.deviantart.com/Behind the Scenes:https://www.patreon.com/jaidenanimations?ty=hIf you're an animator, artist, gamer, or entertainer, then join us at Channel Frederator Network: https://frdr.us/JaidenWanna Send Fanart?You can send it to me through Twitter or Instagram (links above)------------------------------------------------------------------------------------Music: Fixing Elevators------------------------------------------------------------------------------------And this tells me you read the description, which means you respect what I have to say! Thank you :D seriously if you know where i can get a 3DS capture card from Loopy email me and I'll give you money"
"SczPkU9_aHs","Official Call of Duty®: Modern Warfare® – Season Two Trailer","2020-02-10T18:00:49.000Z","UC9YydG57epLqxA9cTzZXSeQ","Call of Duty","20","20.11.02","call of duty|cod|activision|mw|modern|warfare|modern warfare|multiplayer|mp|spec ops|fps|gaming|gamers|gamer|game|video game|video games|season two|s2|battle pass","477015","24835","1550","2774","https://i.ytimg.com/vi/SczPkU9_aHs/default.jpg","False","False","The War Rages On.✅ More Weapons✅ More Maps✅ More Modes✅ More Gunfight✅ More Ground WarThe fight continues in Season Two of Call of Duty®: Modern Warfare®, free on all platforms on February 11.Follow us for all the latest intel:Web: http://www.CallofDuty.com ;Facebook: http://facebook.com/CallofDuty and https://www.facebook.com/InfinityWard/ ;Twitter: http://twitter.com/CallofDuty and https://twitter.com/infinityward;Instagram: http://instagram.com/CallofDuty and https://www.instagram.com/infinityward/"
"IYo1Rks-tF4","Melanie Martinez - Copy Cat (feat. Tierra Whack) [Official Audio]","2020-02-10T15:00:04.000Z","UC2YnEq5Fc5_zEO6bo0oNzCQ","melanie martinez","10","20.11.02","melanie martinez|melanie|martinez|atlantic records|atlantic|crybaby|cry baby|dollhouse|doll house|pity party|sippy cup|copy cat|copy cat melanie martinez|copycat|copycat melanie martinez|melanie martinez - copy cat|after school|k-12 copy cat|copy cat audio|copy cat melanie martinez audio|melanie song meow|new melanie martinez|copy cat tierra whack|tierra whack|copy cat feat tierra whack|melanie martinez tierra whack","1646007","286664","2489","29005","https://i.ytimg.com/vi/IYo1Rks-tF4/default.jpg","False","False","Copy Cat feat. Tierra Whack available now: https://melanie.lnk.to/CopyCatIDK-12 available now: http://melanie.lnk.to/K-12ID Watch K-12: https://melanie.lnk.to/K-12TheFilmIDSubscribe for more official content from Melanie Martinez:https://melanie.lnk.to/MMsubscribe Follow Melanie Martinezhttp://melaniemartinezmusic.comhttps://instagram.com/littlebodybighearthttps://facebook.com/melaniemartinezmusichttps://twitter.com/melanielbbhhttps://soundcloud.com/melaniemartinezmusic#MelanieMartinez #CopyCat #K12"
"o0GBO9Wq3IM","The FUNNIEST Reactions To Eminem's SURPRISE Oscars 2020 Performance","2020-02-10T06:24:46.000Z","UCGWULexa_6MMvDZ4d9ExXSw","Shared News","24","20.11.02","eminem|eminem oscar|eminem oscars|eminem oscars 2020|eminem oscar performance|eminem oscars performance 2020|eminem lose yourself|eminem lose yourself oscar|eminem oscar reactions|why was eminem at the oscars|why did eminem perform at the oscars|eminem oscars 2020 reaction|martin scorcese|billie eilish|billie eilish reacts|shared news|oscars|oscars 2020|oscars 2020 performance|academy awards|academy awards 2020","1163131","10126","21700","3544","https://i.ytimg.com/vi/o0GBO9Wq3IM/default.jpg","False","False","Subscribe to us: http://bit.ly/SubSharedNewsSubscribe to Shared Channel: http://bit.ly/SubSharedChannelEminem surprised EVERYONE with a performance of his hit ‘Lose Yourself’ at the 2020 Oscars And I can honestly say, NO ONE saw this coming.  BUT before I get into the story, I just wanted to remind you to hit that subscribe button and notification bell, so we can keep you updated on all awards show coverage.Okay so, yes, Eminem performed his song ‘Lose Yourself’ tonight at the Oscars. Now. Because this was a surprise performance and… it’s not 2003, many people were caught off guard.In fact, at the award show, the camera panned over to a few celebrities that shared exactly how they were feeling about this surprise, through their faces alone. Starting off, with Indina Menzel. Who, honestly, just looked perplexed.Then of course there was Martin Scorsese who appeared to be so relaxed by the performance that he started to fall asleep.And lastly, there was Billie Eillish and her brother Fineas, who both, similar to Indina, looked absolutely baffled.Follow:http://www.twitter.com/reneearielhttp://www.instagram.com/reneearielhttp://www.twitter.com/fionazaringhttp://www.instagram.com/fionazaringSharing is Caring..."
"vZy8D4B8LLs","DBZA is Over, Here's Why","2020-02-10T02:00:03.000Z","UCsvazPPlhZlch0-Z3wPByeg","TeamFourStar","23","20.11.02","[none]","1338247","112610","14515","43302","https://i.ytimg.com/vi/vZy8D4B8LLs/default.jpg","False","False","Public Patreon Post:https://www.patreon.com/posts/end-of-dbza-33758684Thank you all so much."
"FRO8QkBUo6I","We can't believe you made this happen...","2020-02-09T20:00:15.000Z","UCUk7VggtJdo9XYTy3Z5QVAw","ItsFunneh","24","20.11.02","itsfunneh|funneh|funny moments|funny|krew|krew plays|gaming|games|krew vlogs|krew reacts|krewreacts|itsfunneh reacts|reacting to fan edits","1174369","53466","880","13188","https://i.ytimg.com/vi/FRO8QkBUo6I/default.jpg","False","False","Thank you for 5+ Million Subscribers! We love you guys so much.► Subscribe for more! http://bit.ly/Funneh► Previous Videos! http://bit.ly/KrewvideosBecome a member! https://www.youtube.com/itsfunneh/join► Twitter: https://twitter.com/itsfunneh► Instagram:  http://instagram.com/itsfunneh► Facebook: https://www.facebook.com/itsfunnehKREW!​@ItsFunneh @PaintingRainbows @GoldenGlare @Lunar Eclipse @DraconiteDragon WATCH THE FAN ANIMATIONS!The craziest elevator on roblox by Safire Galaxy: https://www.youtube.com/watch?v=xlxDSKcYTWY&feature=youtu.beGang Beasts by Hana Fandoms: https://www.youtube.com/watch?v=zYKk0sMW0gk&feature=youtu.beRoomates by Alicia: https://www.youtube.com/watch?v=KvjA-kRzKyY&feature=youtu.beHuman Fall Flat by BlueCherrie: https://www.youtube.com/watch?v=XUSED5bRpWE&feature=youtu.beEverybody Bounce Now by Twilight Diamond: https://www.youtube.com/watch?v=ffkZZXuK2cg&feature=youtu.beWhat are you Drawing by Salty Kelko: https://www.youtube.com/watch?v=wW44M18zpK8&feature=youtu.beMy Vacation by HannaHeavens: https://www.youtube.com/watch?v=U5bMWC-ahyg&feature=youtu.be&fbclid=IwAR2z7cGQ1w83BfMCfTGt6kd0oGh0cBBDIxRSfeZEe6hkw3SZU2RaxQGQO9YAirplane Story by Noora Cat: https://www.youtube.com/watch?v=FOHLO_VJ2GoRoblox Sailing Story by Safire Galaxy: https://www.youtube.com/watch?v=R48OhehYeRQMeep City Prison Food by Cyan-imations: https://www.youtube.com/watch?v=B3Gt6HJKVu0A Nightmare in Candyworld by Safire Galaxy: https://www.youtube.com/watch?v=qFjOPu4qd1MThe Trolliest Babies by Careecent: https://www.youtube.com/watch?v=iBvnvJO03P8ItsFunneh Fan Animation by LittleHedgehog Draws: https://www.youtube.com/watch?v=iK03UnCDaCAEnjoy the video and don't forget to like & subscribe for more.Thanks for watching! :]"
"F6ik8yFVyaU","Chris Makes Breakfast Sandwiches | From the Test Kitchen | Bon Appétit","2020-02-10T17:00:03.000Z","UCbpMy0Fg74eXXkvxJrtEn3w","Bon Appétit","26","20.11.02","bon appetit|test kitchen|breakfast sandwich|from the test kitchen|chris morocco|chris makes|chris bon appetit|chris makes breakfast sandwich|breakfast sandwich recipe|easy breakfast sandwich|make breakfast sandwich|making breakfast sandwich|how to breakfast sandwich|how to make breakfast sandwich|breakfast sandwich bon appetit|healthy breakfast sandwich|bacon egg and cheese|egg sandwich|egg sandwich recipe|bacon egg and cheese recipe|food","850984","26384","846","2046","https://i.ytimg.com/vi/F6ik8yFVyaU/default.jpg","False","False","Join Chris Morocco in the Bon Appétit Test Kitchen as he makes healthy breakfast sandwiches. You may not mistake these jammy-crisp, slow-cooked onions for bacon, but they are truly exceptional as a stand-in, giving a huge blast of umami to create a truly satisfying breakfast sandwich.Check out the recipe here: https://www.bonappetit.com/recipe/breakfast-sandwiches-onion-baconWant Bon Appétit shirts, hats and more? https://shop.bonappetit.com/?utm_source=youtube&utm_brand=ba&utm_campaign=aud-dev&utm_medium=video&utm_content=merch-shop-promoStill haven’t subscribed to Bon Appétit on YouTube? ►► http://bit.ly/1TLeyPnWant more Bon Appétit in your life? Subscribe to the magazine and score a free tote! http://bit.ly/2n0gbmuABOUT BON APPÉTITBon Appétit is a highly opinionated food brand that wants everyone to love cooking and eating as much as we do. We believe in seasonal produce, properly salted pasta water, and developing recipes that anyone can make at home. Chris Makes Breakfast Sandwiches | From the Test Kitchen | Bon Appétit"
"Msd40FNjZd0","2020 Democrats Make Their Final Push In New Hampshire | Morning Joe | MSNBC","2020-02-10T12:20:00.000Z","UCaXkIU1QidjPwiAYu6GcHjg","MSNBC","25","20.11.02","News|Democrats|Elections|New Hampshire|Best of last night|Decision 2020|Morning Joe|Joe Scarborough|Mika Brzezinski|Willie Geist|MSNBC|MSNBC news|MSNBC live|MSNBC TV|current events|US news|politics|politics news|political news|morning joe full|morning joe today|president|us president|election|us election|new hampshire debate|new hampshire primary|new hampshire 2020|2020 election|2020 democrats|dems|2020 dems|democratic candidates|bernie sanders","163013","742","2028","1255","https://i.ytimg.com/vi/Msd40FNjZd0/default.jpg","False","False","With the New Hampshire primary set for Tuesday, the 2020 Democrats make their final pitch in the state. Aired on 2/10/2020.» Subscribe to MSNBC: http://on.msnbc.com/SubscribeTomsnbcMSNBC delivers breaking news, in-depth analysis of politics headlines, as well as commentary and informed perspectives. Find video clips and segments from The Rachel Maddow Show, Morning Joe, Meet the Press Daily, The Beat with Ari Melber, Deadline: White House with Nicolle Wallace, Hardball, All In, Last Word, 11th Hour, and more.Connect with MSNBC OnlineVisit msnbc.com: http://on.msnbc.com/ReadmsnbcSubscribe to MSNBC Newsletter: http://MSNBC.com/NewslettersYouTubeFind MSNBC on Facebook: http://on.msnbc.com/LikemsnbcFollow MSNBC on Twitter: http://on.msnbc.com/FollowmsnbcFollow MSNBC on Instagram: http://on.msnbc.com/Instamsnbc2020 Democrats Make Their Final Push In New Hampshire | Morning Joe | MSNBC"
"01C_1tCjbsw","New $6 DRUGSTORE FOUNDATION ... Worth The Hype?","2020-02-10T18:00:00.000Z","UC4qk9TtGhBKCkoWz5qGJcGg","Tati","26","20.11.02","YouTube|Beauty|Makeup|Tutorial|Review|Tati|Westbrook|GlamLifeGuru|how to|makeup tutorial|Beauty expert|drugstore|luxury|Haul|favorites|Best|worst|cosmetics|Drugstore Foundation|Wet N Wild|Photo Focus","465126","24899","648","1904","https://i.ytimg.com/vi/01C_1tCjbsw/default.jpg","False","False","Today I'm testing the new Revamped version of one of my favorite Wet N Wild Foundations ... is it as good as the original?xo's ~ Tati 😇  HALO BEAUTY DISCOUNT BUNDLES 🥝 Can only be purchased here » » »  https://halobeauty.com/collections/bundles🦋 TATI BEAUTY Textured Neutrals Palette + The Blendiful ✨Can only be purchased here » » »  https://TatiBeauty.com ✔ P R O D U C T S  M E N T I O N E D Wet N Wild Photo Focus Foundation // $6.50✔ M A K E U P  W O R N FACE: Wet N Wild Prime Focus Primer Serum // $8.00 Charlotte Tilbury Magic Cream // $100.00Tarte Timeless Smoothing Primer // $39.00Graftobian Cosmetics HD Glamour Creme Super Palette // Warm // $84.00Wet N Wild Photo Focus Foundation // Buff Bisque // $6.50Wet N Wild Photo Focus Foundation // Classic Beige // $6.50 Wet N Wild Photo Focus Foundation // Deep Honey // $6.50RCMA Foundation Adjuster Palette // $30.00 Tarte Shape Tape Concealer // Light-Medium Honey // $27.00 Hourglass Ambient Lighting Edit Palette // $80.00 Charlotte Tilbury Airbrush Flawless Finish Setting Powder // 1 Fair // $45.00  Charlotte Tilbury Airbrush Flawless Finish Setting Powder // 2 Medium // $45.00 Kokie Strobing Palette Highlighter // $9.00 Honest Beauty Crèam Cheek Blush // Coral Peach // $13.00Huda Beauty Loose Baking & Setting Powder // Pound Cake // $34.00Jane Iredale D2O Hydration Spray // $33.00 EYES:L’Oréal Paris Brilliant Eyes Liquid Eye Shadow // Amber Sparkle // $12.00 L’Oréal Paris Brilliant Eyes Liquid Eye Shadow // Bronze Light // $12.00 L’Oréal Paris Brilliant Eyes Liquid Eye Shadow // Crystal Shine // $12.00 Fenty Beauty Full Frontal Volume, Lift & Curl Mascara // Cuz I’m Black // $24.00 BROWS: Charlotte Tilbury Brow Lift Eyebrow Pencil // Super Model // $30.00LIPS: Charlotte Tilbury Lip Cheat Lip Liner // Bond Girl // $22.00L’Oréal Paris Rouge Signature Matte Lip Stain // 456 Desired // $12.00✔﻿ S N A P C H A Thttps://www.snapchat.com/add/TatiWestbrook✔﻿ I N S T A G R A Mhttp://instagram.com/glamlifeguru✔﻿ T W I T T E Rhttp://twitter.com/#!/glamlifeguru✔﻿ F A C E B O O Khttp://facebook.com/GlamLifeGuru✔﻿ E M A I LTati@GlamLifeGuru.comFTC DISCLAIMER:  This video is Not Sponsored and there are no affiliate links.✔﻿ WRITE TO ME HERETati Westbrook1905 Wilcox AveSuite #111Los Angeles, CA  90068All Rights Reserved © 2020, Tati Westbrook Hi I'm Tati from GlamLifeGuru, thank you for watching my video, please be sure to check out my collection of makeup videos where you'll find my best beauty tips, tricks and favorites on everything from top luxury cosmetics to my favorite drugstore makeup. Whether you're looking for a new product review, tutorial, beauty tip, haul or perhaps even a giveaway, I hope you enjoy watching."
"iI_cnK_YSro","Idina Menzel, AURORA - Into the Unknown (Live from the 92nd Academy Awards)","2020-02-10T06:38:04.000Z","UCgwv23FVv3lqh567yagXfNg","DisneyMusicVEVO","10","20.11.02","Frozen 2|Frozen|Idina Menzel|Aurora|Elsa|Oscars 2020","6476086","319955","8245","18669","https://i.ytimg.com/vi/iI_cnK_YSro/default.jpg","False","False","The first time bringing together the world’s Elsas performing “Into the Unknown” with Idina Menzel and AURORA.Maria Lucia Heiberg Rosenberg (Danish)Willemijn Verkaik (German) Takako Matsu (Japanese) Carmen Sarahí (Spanish) Lisa Stokke (Norwegian) Kasia Łaska (Polish) Anna Buturlina (Russian) Gisela (Castilian) Gam Wichayanee (Thai)Disney’s Frozen 2 On Digital 2/11 and Blu-ray 2/25. https://movies.disney.com/frozen-2Watch all Frozen 2 music videos here: https://disneymusic.co/Frozen2Playlist/vevo?IQid=92ndAAWatch Into the Unknown (In 29 Languages): https://youtu.be/GgPmy8RnlCAFrozen 2 soundtrack is available now! Get it here: https://disneymusic.co/Frozen2?IQid=92ndAASubscribe to DisneyMusicVEVO: https://disneymusic.co/disneymusicYT?IQid=92ndAAInto the Unknown sheet music: Musicnotes: https://www.musicnotes.com/l/MN0204329 Sheet Music Direct: https://www.sheetmusicdirect.com/en-US/se/ID_No/432054/Product.aspx🍁🍂🍁🍂🍁🍂 Why was Elsa born with magical powers? What truths about the past await Elsa as she ventures into the unknown to the enchanted forests and dark seas beyond Arendelle? The answers are calling her but also threatening her kingdom. Together with Anna, Kristoff, Olaf and Sven, she'll face a dangerous but remarkable journey. In “Frozen,” Elsa feared her powers were too much for the world. In “Frozen 2,” she must hope they are enough. From the Academy Award®-winning team—directors Jennifer Lee and Chris Buck, producer Peter Del Vecho and songwriters Kristen Anderson-Lopez and Robert Lopez—and featuring the voices of Idina Menzel, Kristen Bell, Jonathan Groff and Josh Gad, Walt Disney Animation Studios’ “Frozen 2” is available on Digital 2/11 and Blu-ray 2/25. 🍁🍂🍁🍂🍁🍂 Connect with Disney Music on: Instagram: https://instagram.com/disneymusic Facebook: https://facebook.com/disneymusic Twitter: https://twitter.com/disneymusic For more Frozen 2: Facebook: https://facebook.com/DisneyFrozen Twitter: https://twitter.com/DisneyFrozen IG: https://www.instagram.com/DisneyFrozen #Frozen2 #IntoTheUnknown #92ndAcademyAwards Music video by Idina Menzel, AURORA performing Into the Unknown (From Frozen 2). © 2019 Walt Disney Recordshttp://vevo.ly/5lV6Ev"
"6Ljs9_yIiY0","Casually Explained: The Carbon Scale","2020-02-10T17:56:36.000Z","UCr3cBLTYmIK9kY0F_OdFWFQ","Casually Explained","23","20.11.02","Casually Explained|stand up comedy|comedy|animation|animated comedy|satire|how to|funny|stand up|comedian|hilarious|humor|climate change|global warming|bill gates|annual letter|carbon footprint|carbon emissions","1069192","93535","1872","4938","https://i.ytimg.com/vi/6Ljs9_yIiY0/default.jpg","False","False","Big thanks to Bill and Melinda for sponsoring this one, make sure to check out their annual letter that's just been released: http://www.inflcr.co/SH1jL#GatesPartner Check out the new merch if you'd like https://casuallyexplained.com/►https://www.twitch.tv/casuallyexplained►https://www.facebook.com/CasuallyExplained/ ►https://twitter.com/CasuallyE►https://www.instagram.com/casually_explained/►https://www.reddit.com/r/casuallyexplained/"
