video_id,title,publishedAt,channelId,channelTitle,categoryId,trending_date,tags,view_count,likes,dislikes,comment_count,thumbnail_link,comments_disabled,ratings_disabled,description
"PiZlXNXpF-A","Generations React To Super Bowl Commercials 2020","2020-02-04T22:00:03.000Z","UC0v-tlzsn0QZwJnkiaUSJVQ","FBE","24","20.11.02","generations react|kids react|teens react|adults react|college kids react|react|reaction|fbe|superbowl|super bowl|commercials|commercial super bowl 2020|super bowl commercials|super bowl 2020|super bowl 2020 commercials|super bowl ads 2020|baby nut commercial|baby peanut|superbowlliv|super bowl liv|ads|Generations React To Super Bowl Commercials 2020|mountain dew commercial|tiktok|rick and morty|groundhog day|bill murray|charli d'amelio|google","1714443","44934","1235","5726","https://i.ytimg.com/vi/PiZlXNXpF-A/default.jpg","False","False","Get updates like auditions, info about new shows and many more by joining our monthly newsletter! http://fbereact.com/infoGenerations React to 2020 Super Bowl commercials. Watch to see their reactions!Content Featured:Mountain Dewhttps://www.youtube.com/watch?v=tHoYKy1GMgMMicrosofthttps://www.youtube.com/watch?v=_xPn4DXIj5wSnickershttps://www.youtube.com/watch?v=SLAV4LYO-yUGooglehttps://www.youtube.com/watch?v=6xSxXiHwMrgSabra Hummushttps://www.youtube.com/watch?v=x9NTkInOe3YJeephttps://www.youtube.com/watch?v=AnhzGUcENWoPringleshttps://www.youtube.com/watch?v=Ffu_LU6KpQIBaby Nuthttps://www.youtube.com/watch?v=MoVpgtAJHfUFBE’s goal is to credit the original links to the content featured in its shows. If you see incorrect or missing attribution please reach out to credits@fbeteam.comReactors Featured:Albertohttps://www.instagram.com/Albertoamaya_/Ashbyhttps://www.instagram.com/theashbyclark/Beccahttps://www.instagram.com/beccahochman/Brandonhttps://www.instagram.com/brandocommando_/Braydenhttps://www.instagram.com/braymangoRebeccahttps://www.instagram.com/rebeccanoooPhilTorihttps://www.instagram.com/justxtori/VeraMERCH 👕 https://www.shopfbe.comFollow FBE:FBE WEBSITE: https://fbeteam.com/FBE: http://www.youtube.com/FBEREACT: http://www.youtube.com/REACTFBE2: https://www.youtube.com/FBE2FBELive: https://www.youtube.com/fbeliveFACEBOOK: http://www.facebook.com/FBEFACEBOOK: http://www.facebook.com/FBEShowsTWITTER: http://www.twitter.com/fbeINSTAGRAM: http://www.instagram.com/f/fbeSNAPCHAT: https://fbereact.com/snapchatDISCORD: https://fbereact.com/FBEdiscordTWITCH: https://www.twitch.tv/fbeliveAMAZON: https://www.amazon.com/v/FBEXUMO: https://fbereact.com/xumoSEND US STUFF:FBEP.O. BOX 4324Valley Village, CA 91617-4324Credits:Produced by Lauren HutchinsonExecutive Producers - Benny Fine & Rafi FineVice President of Production - Kate GradyVice President of Creative - Harris ShermanSenior Producer - Sierra MiddlebrooksAssociate Producer - Jesse TugasLine Producer - Hillary FreedmanProduction Manager - Seung-Wan ChoiCasting & Talent Relations - Steven CauseyProduction Coordinator - Laura EspinozaAsst. Production Coordinator - Laura LareauCoordinator Assistant - Ashley PazHead of Post Production - Jake MetivaPost Production Supervisor- Nick Weiss-RichmondEditor - Andrea Winslow, Alyssa Salter, Karen RivasAssistant Editor - Niomi YoungDirector of Photography - Sam KimJr. Studio Technician - Jayden RomeroProduction Tech - Edgar Plascencia, Ryan Johnson, Lake PetersonProduction Assistant - Michael JerrettGraphics - Kat Nieto, James Jennings, Winton FouldsSet design - Melissa JudsonMusic - Cyrus Ghahremani© FBE, Inc#SuperBowl2020 #SuperBowlCommercials #FBEGenerations React To Super Bowl Commercials 2020"
"fwK1S4PaVqU","Try Not To Laugh Challenge #39 - PROP TART!","2020-02-04T18:00:06.000Z","UCYJPby9DRCteedh5tfxVbrw","Smosh Pit","22","20.11.02","smosh|smosh pit|smosh games|funny|comedy|Try Not To Laugh Challenge #39 - PROP TART!|try not to laugh|smosh try not to laugh|tntl|courtney miller|shayne topp|damien haas|olivia sui|noah grossman|tommy bowe|audience choice","1484901","74324","1080","3711","https://i.ytimg.com/vi/fwK1S4PaVqU/default.jpg","False","False","Today's Try Not To Laugh twist comes from one of YOU! Someone commented and suggested we let the person in the hot seat choose which props everyone had to use to make them laugh, and to call it Prop Tart, SO WE DID!Punch that bell icon so you'll know when we add a new episode and leave your Try Not To Laugh suggestions in the comments, and we just may use yours like we used Vaibhav's!SHOP THE SMOSH CLOTHING LINE: https://smosh.storeWatch Every Annoying Person Ever: https://youtu.be/0-WamVtP6uAWatch It’s Time To Cancel Karens - SmoshCast #48: https://youtu.be/u_5IDIZCM6QWatch Your Memes are in Another Castle (Meme Review): https://youtu.be/Ux3jOxIRtvASubscribe To Smosh Pit: Smosh: https://smo.sh/Sub2SmoshPitFollow Us:Instagram: https://instagram.com/smoshFacebook: https://facebook.com/smoshTwitter: https://twitter.com/smoshCourtney Miller: https://www.instagram.com/co_mill/Shayne Topp: https://www.instagram.com/shaynetopp/Damien Haas: https://www.instagram.com/damienhaas/Olivia Sui: https://www.instagram.com/oliviasui/Noah Grossman: https://www.instagram.com/noahgrossman214/Tommy Bowe: https://www.instagram.com/tomeybones/Check Out Our Other Smosh Channels:Smosh: https://smo.sh/Sub2SmoshSmosh Games: https://smo.sh/Sub2SmoshGamesSmoshCast: https://smo.sh/Sub2SmoshCast"
"w7KEQ3DCtI0","EXTREME Paintball Hide and Seek vs MY WIFE Brianna!","2020-02-04T23:51:33.000Z","UC70Dib4MvFfT1tU6MqeyHpQ","Preston","24","20.11.02","funny|challenge|family|comedy|preston|brianna","973319","21504","572","3521","https://i.ytimg.com/vi/w7KEQ3DCtI0/default.jpg","False","False","EXTREME Paintball Hide and Seek - Challenge with Preston 👊❤️ FRIENDS!🡆@Brianna 👀 FOLLOW ME HERE!🡆 TikTok - https://www.tiktok.com/@preston🡆 Instagram - https://instagram.com/realtbnrfrags🡆 Twitter - https://twitter.com/Preston👕 Get your merch below!🡆 http://www.prestonsstylez.com/ 🡆 https://royallyb.com🐲 Buy FLOOP Here! 🡆 https://amzn.to/37uLpV6🎮 Join my Fan Discord! 🡆 http://discord.gg/PrestonFaZe Rug - Score on Me, You Get $1,000 VS Random People! **BASKETBALL CHALLENGE**https://youtu.be/LMfr7zQNAKg------------------------------Additional music provided by Epidemic SoundClick here for a free trial! 🡆 http://share.epidemicsound.com/TBNR"
"eexRvJvdbP8","TRYING BASKETBALL LIFE HACKS!","2020-02-05T01:00:06.000Z","UCaUwlJEE3Vxsw0eIG15xBiw","Jiedel","24","20.11.02","Jiedel Basketball Lifehacks|Jiedel|Lifehacks|basketball|basketball lifehacks|basketball tips","382966","13005","258","638","https://i.ytimg.com/vi/eexRvJvdbP8/default.jpg","False","False","Today Zack and I try some of the more unique basketball life hacks found on the internet!Zack: https://www.youtube.com/channel/UCTs5PJGf9AwnA7mNV3ejNTQ★FOLLOW ME ON SOCIAL MEDIA★●YOUTUBE! ► https://www.youtube.com/jiedel?sub_confirmation=1●Instagram (@Jiedel)► https://instagram.com/jiedel●Twitter (@Jiedel) ► https://twitter.com/jiedel●Second Channel! ► https://goo.gl/WzNI41 ★2HYPE★https://www.youtube.com/channel/UCY4AlDv6wL2qhrX29iwdqAg"
"LbPF6ptGLnI","U.S. Senate: Debate on Articles of Impeachment & FINAL VOTE","2020-02-05T22:31:26.000Z","UCb--64Gl51jIEVE-GLDAVTg","C-SPAN","25","20.11.02","Articles of Impeachment|Impeach|Impeachment|Constitution|Congress|Judiciary|House of Representatives|President of the United States|Ukriane|C-SPAN|CSPAN|Senate|Chief Justice|John Roberts|Supreme Court","671974","5601","1793","1289","https://i.ytimg.com/vi/LbPF6ptGLnI/default.jpg","False","False","Senators will speak for up to 10 minutes each on the articles of impeachment against President Trump - abuse of power and obstruction of Congress."
"97o1JuuzpFU","Using Only ONE COLOR to Hydro Dip Items! - Challenge","2020-02-04T23:05:36.000Z","UCXg4rJUbDP1IP3TmZ9KDpJg","Brianna","24","20.11.02","funny|comedy|challenge|family|brianna|preston","1023702","17386","1038","4586","https://i.ytimg.com/vi/97o1JuuzpFU/default.jpg","False","False","Using Only ONE COLOR to Hydro Dip Items! - Challenge with Brianna 👊❤️ FRIENDS!🡆 @Bahri 👀 FOLLOW ME HERE!🡆 Instagram - https://instagram.com/bri_baby_arsement🡆 Twitter - https://twitter.com/BriBabyArsement👕 Get your merch below!🡆 https://royallyb.com🡆 http://www.prestonsstylez.com/ 🐲 Buy FLOOP Here! 🡆 https://amzn.to/37uLpV6FaZe Rug - Score on Me, You Get $1,000 VS Random People! **BASKETBALL CHALLENGE**https://youtu.be/LMfr7zQNAKg------------------------------Additional music provided by Epidemic SoundClick here for a free trial! 🡆 http://share.epidemicsound.com/TBNR#Brianna"
"JC4xlDmwlOw","JR Smith Can Take A Joke | Cold as Balls Season 3 | Laugh Out Loud Network","2020-02-04T15:56:55.000Z","UCLRmIdRJgLfmdpJufmBhBuA","LOL Network","23","20.11.02","kevin hart|hartbeat productions|funny|comedy|comedian|plastic cup boyz|actor|stand up|lol|laugh out loud|LOL Network|laugh out loud network|african american|jr smith|cold as balls|cold as balls season 3|jr smith kevin hart|jr smith cold as balls|jr smith warriors|jr smith lebron|jr smith nba|nba|basketball|kevin hart cold as balls","2012410","54586","715","2909","https://i.ytimg.com/vi/JC4xlDmwlOw/default.jpg","False","False","On this episode of Cold as Balls, JR Smith sits down with Kevin Hart to talk about skipping college, life in the NBA, his relationship with LeBron and his infamous flub against the Golden State Warriors.#PoweredbyOldSpice#SweatDefense#ColdasBallswithOldSpice#CABSeason3#AvailableatWalmartSUBSCRIBE▶︎http://bit.ly/SubscribeLOLFOLLOW THE FUNNY:Facebook▶ http://bit.ly/LOLNetwork-FBTwitter▶ http://bit.ly/LOLNetwork-TWInstagram▶ http://bit.ly/LOLNetwork-IGYouTube▶ http://bit.ly/LOLNetwork-YouTubeSnapchat▶ LOLNetworkOfficial Website▶ http://www.laughoutloud.com Laugh Out Loud is a comedy brand and multi-platform network founded by the world’s top comedian Kevin Hart. Through his network, Hart delivers his vision for the future of comedy: social, mobile, multicultural and seriously funny. From stand-up legends to globally-recognized digital influencers, Hart and LOL curate comedy’s boldest voices to produce original scripted and unscripted series, stand-up specials, live broadcasts and special events.  Hart brings the groundbreaking social-first strategy that earned him 100 million+ followers to Laugh Out Loud, with one core mission: keep the world laughing.  Dope Comedy. Delivered Daily. Always On. Always Loud. Directly from Kevin Hart and his hand-picked crew of comedic rockstars."
"KQfnP4QqL2k","[EPISODE] Behind the Scenes of Big Hit's Group Photo!","2020-02-05T08:00:02.000Z","UC3IZKseVpdzPSBaWxBxundA","Big Hit Labels","10","20.11.02","BIGHIT|빅히트|방탄소년단|BTS|BANGTAN|방탄","5677147","872378","2544","32580","https://i.ytimg.com/vi/KQfnP4QqL2k/default.jpg","False","False",""
"pILCn6VO_RU","Shakira & J. Lo's FULL Pepsi Super Bowl LIV Halftime Show","2020-02-03T01:49:25.000Z","UCDVYQ4Zhbm3S2dlz7P1GBDg","NFL","17","20.11.02","NFL|Football|American Football|sport|sports|Shakira & J. Lo's FULL Pepsi Super Bowl LIV Halftime Show|super bowl halftime show 2020|super bowl|super bowl half time|super bowl halftime|super bowl halftime show shakira|super bowl halftime show jlo|jlo and shakira super bowl|jlo super bowl 2020|jlo halftime show|jlo halftime show 2020|jlo and shakira|shakira and jlo super bowl|shakira super bowl 2020|shakira halftime show|shakira super bowl","121049599","2556517","145246","246420","https://i.ytimg.com/vi/pILCn6VO_RU/default.jpg","False","False","Shakira & J. Lo perform at the Super Bowl LIV Pepsi Halftime Show.Para más contenido de la NFL en Español, suscríbete a https://www.youtube.com/nflenespanolSubscribe to NFL: http://j.mp/1L0bVBuCheck out our other channels:NFL Vault http://www.youtube.com/nflvaultNFL Network http://www.youtube.com/nflnetworkNFL Films http://www.youtube.com/nflfilmsNFL Rush http://www.youtube.com/nflrushNFL Play Football https://www.youtube.com/playfootballNFL Podcasts https://www.youtube.com/nflpodcasts#SuperBowlLIV #Shakira #JLo"
"2pnlSaQ-4Tk","My Girlfriend Can't Cook | Anwar Jibawi","2020-02-04T17:00:25.000Z","UCEr55381WIqO1w_IzgcI5DQ","Anwar Jibawi","23","20.11.02","[none]","2087878","81211","1766","2651","https://i.ytimg.com/vi/2pnlSaQ-4Tk/default.jpg","False","False","WATCH MORE ► https://youtube.com/playlist?list=PLbNDd5uPifopbYqGU2CX7_DNdQFutazzbSUBSCRIBE ► https://youtube.com/channel/UCEr55381WIqO1w_IzgcI5DQ?sub_confirmation=1-----------------------------------------------------------FIND ME ON: Instagram | http://instagram.com/anwarTwitter | http://twitter.com/anwarFacebook | https://facebook.com/anwarTikTok | https://vm.tiktok.com/XjFcDpMerch | https://lilshop.comText Me | https://my.community.com/anwarjibawiCAST:Anwar Jibawi | http://youtube.com/c/anwarAlexis Figueroa | https://instagram.com/lexxxxissssss WE HIT 500 VIDEOS WITH OVER 1 MILLION VIEWS ▶ https://youtu.be/VOzQW_fff5AShots Studios Channels:@Anwar Jibawi @Awkward Puppets @Benny the Bee @Delaney Glazer @Hannah Stocking @Juanpa Comedy Channel @Lele Pons @Rudy Mancuso @Shots Vlog Channel #Anwar#AnwarJibawi"
"1B040yB7bEw","Four-team deal is the largest NBA trade since the Knicks dealt Patrick Ewing in 2000 | SportsCenter","2020-02-05T13:30:00.000Z","UCVSSpcmZD2PwPBqb8yKQKBA","NBA on ESPN","17","20.11.02","clint capela trade|nba|nba trade deadline|nba on espn|espn nba|nba news|nba trade deadline 2020|woj|clint capela hawks|atlanta hawks|houston rockets|rockets|rockets trade|minnesota timberwolves|timberwolves trade|nba news today|sportscenter|nba blockbuster trade|warriors|jordan bell trade|robert covington trade|wolves nba|rockets trade deadline|hawks clint capela|adrian wojnarowski|woj news|basketball|sportscenter nba","416289","2742","161","957","https://i.ytimg.com/vi/1B040yB7bEw/default.jpg","False","False","Bobby Marks and Adrian Wojnarowski break down the massive 4-team, 12-player blockbuster trade headlined by the Houston Rockets trading Clint Capela to the Atlanta Hawks. Check out Woj’s article detailing the trade HERE:https://www.espn.com/nba/story/_/id/28638121/sources-robert-covington-clint-capela-part-4-team-12-player-deal#NBA✔ Subscribe to ESPN+: https://plus.espn.com/✔ Get the ESPN App: http://www.espn.com/espn/apps/espn✔ Subscribe to NBA on ESPN on YouTube: http://bit.ly/2yxs3Og✔ Subscribe to ESPN on YouTube: http://es.pn/SUBSCRIBEtoYOUTUBE✔ Watch Latest Episodes on WatchESPN: http://es.pn/LatestEpisodes✔ Watch ESPN on YouTube TV: http://es.pn/YouTubeTVGet more ESPN Shows on YouTube:► First Take: http://es.pn/FirstTakeonYouTube► SportsCenter with SVP: http://es/pn/SVPonYouTubeESPN on Social Media:► Follow on Twitter: http://www.twitter.com/espn► Like on Facebook: http://www.facebook.com/espn► Follow on Instagram: http://www.instagram.com/espnVisit NBA on ESPN on YouTube to get up-to-the-minute NBA coverage, scores, highlights and commentary.More on ESPN.com: http://www.espn.com"
"XFbwKRvlhjc","Everything Kylie Jenner Eats in a Day | Food Diaries: Bite Size | Harper's BAZAAR","2020-02-04T13:00:06.000Z","UCzsF1ghKHeif7AmTNlRYAzQ","Harper's BAZAAR","26","20.11.02","Harper's BAZAAR|Bazaar|Skincare|Fashion|Skincare Routines|Beauty Haul|kylie jenner|kylie jenner stormi birthday|kylie jenner eating|kylie jenner diet|harper's bazaar food diaries|harper's bazaar food|kylie jenner song|kylie jenner interview|everything eats in a day|kylie jenner food diaries|kylie jenner stormi|kylie jenner harper's bazaar|food diaries|food diaries bite size|kylie jenner food|kylie jenner everything I eat in a day|model eat in a day","2072952","60111","2409","3286","https://i.ytimg.com/vi/XFbwKRvlhjc/default.jpg","False","False","If there was a face of hangry, it would be me, Kylie Jenner, the 22-year-old beauty mogul, says in our latest episode of Food Diaries. And, Stormi has it, too. Because when that little girl's a little hungry, she turns into a different baby. So, if you wonder where she gets it from, it's me for sure. Here, our March 2020 cover star walks us through everything she eats over the course of one day.Read the full interview with Kylie: https://www.harpersbazaar.com/celebrity/a30680231/kylie-jenner-interview-2020/Don't miss out on the latest must-see video  ►► http://bit.ly/SUBSCRIBEtoBAZAAR// ABOUT BAZAAR //Sophisticated, elegant and provocative, Harper's BAZAAR is your source for everything beauty and skincare to the latest fashion trends straight from the runway. We've showcased the visions of legendary editors, photographers and stylists proudly since 1867.Everything Kylie Jenner Eats in a Day | Food Diaries: Bite Size | Harper's BAZAAR#KylieJenner #FoodDiaries #KylieCosmetics"
"yzYZxTp3tCM","WANDAVISION Trailer Breakdown! Easter Eggs & Details You Missed!","2020-02-04T20:41:08.000Z","UC7yRILFFJ2QZCykymr8LPwA","New Rockstars","24","20.11.02","wandavision|wandavision trailer|disney|disney+|disney+ trailer|disney plus trailer|disney wandavision|scarlet witch|vision|vision death|wandavision explained|wandavision trailer breakdown|wandavision trailer easter egg|wandavision easter egg|falcon|falcon winter soldier|wanda maximoff|house of m|mcu|marvel mutants|new rockstars","558377","18768","295","639","https://i.ytimg.com/vi/yzYZxTp3tCM/default.jpg","False","False","Disney+ Super Bowl Trailer reveals WandaVision footage, along with Falcon & Winter Soldier and Loki! Get Honey for FREE ▸ http://joinhoney.com/newrockstarsMy subscribers have already found over $200k in savings on stores like eBay & Newegg.Thanks Honey for sponsoring today’s video!WandaVision gets thrilling new looks in footage from a Disney+ trailer! What are all the famous sitcom Easter Eggs, and what do they mean for Wanda's attempt to resurrect Vision? What is the hidden truth of Wanda and Vision's CHILDREN in this footage? Erik Voss breaks down this WandaVision footage frame by frame for clues pointing to each WandaVision episode, including homages to I Love Lucy, Bewitched, The Brady Bunch, Full House, and Roseanne. Could Quicksilver return in WandaVision? And could WandaVision introduce mutants and X-Men to the MCU?CONNECT WITH US!Facebook: http://facebook.com/newmediarockstarsTwitter: http://twitter.com/newrockstarsPatreon: http://patreon.com/newrockstarsPATREON PRODUCERS:Dallas AndersonJake StormKelly HopperMatthew SalvasMiguel MendozaPony StarkSamuel MorseTodd SlawsbyUnder_CiegeProducer: Erik Voss http://www.twitter.com/eavossProducer: Zach HuddlestonWritten by: Erik VossExecutive Creative Director: Filup Molina http://www.twitter.com/filupmolinaPost Production Supervisor: John CostaEditors: Josh Hurd, Devin ClearyMusic: Sci Fi from Bensound.com"
"D0CWIRrAKzE","Young Reds Edge Past The Shrews At Anfield | Liverpool 1-0 Shrewsbury Town | Emirates FA Cup 19/20","2020-02-05T12:00:03.000Z","UCChcWqwYXCEs657MQ00qVWA","The Emirates FA Cup","17","20.11.02","liverpool|shrewsbury town|liverpool vs shrewsbury|liverpool highlights|shrewsbury highlights|emirates fa cup|fa cup|fa cup highlights|liverpool 1-0 shrewsbury|emirates fa cup fourth round|fa cup fourth round|fourth round highlights|ro-shaun williams|sp:ty=high|sp:dt=2020-02-04T19:45:00Z|sp:st=soccer|sp:li=eng_fa_cup|sp:ti:home=LIV|sp:ti:away=SHR","2601819","11737","1042","858","https://i.ytimg.com/vi/D0CWIRrAKzE/default.jpg","False","False","Ro-Shaun Williams' own goal was the deciding factor in Shrewsbury's Fourth Round defeat to Liverpool at Anfield.Catch the highlights for all Fourth Round ties from the Emirates FA Cup here; https://bit.ly/38FbNM2              Follow @EmiratesFACup on Twitter for in-game highlights and match updates!       https://twitter.com/emiratesfacup              Subscribe:       https://www.youtube.com/thefacup              To find out more about The FA Cup visit:       TheFA.com/EmiratesFACup              The FA Cup on Facebook       http://www.facebook.com/TheFACup"
"kUexle4jktU","I spent a day with VIRAL MEME STARS (Kombucha Girl, Hit or Miss, Chocolate Rain)","2020-02-04T21:40:06.000Z","UCPJHQ5_DLtxZ1gzBvZE99_g","AnthonyPadilla","24","20.11.02","anthony padilla|padilla|anthony|smosh anthony|anthony padilla smosh|i spent a day with|interview|meme stars|meme|memes|viral meme|tiktok|brittany_broski|kombucha girl|hit or miss|nyannyancosplay|chocolate rain|tay zonday|vine|tik tok|tik tok memes|tiktok memes|hit or miss tik tok|hit or miss girl|tik tok memes songs","1408698","107594","762","6017","https://i.ytimg.com/vi/kUexle4jktU/default.jpg","False","False","I spent a day with some of the most viral meme stars to learn the truth about becoming an overnight sensation on the Internet.🔴SUBSCRIBE ▶ https://youtube.com/subscription_center?add_user=AnthonyPadilla🚨GET MERCH ▶ http://padildoshop.com📸 INSTAGRAM ▶ @AnthonyPadilla🗯MORE I SPENT A DAY WITH...▸ ASEXUALS - https://youtu.be/zW29J3nxjis▸ EX-CULT MEMBERS - https://youtu.be/DrQG8jOXpM8▸ LEGENDARY OG YOUTUBERS - https://youtu.be/Jb-179F-uyI🧨HUGE thank you to:▸ BRITTANY - http://twitter.com/brittany_broski▸ KAT - https://tiktok.com/@nyannyancosplay▸ TAY - http://tiktok.com/@tayzonday🎥Crew▸ Director, Creator, Producer, Writer, etc. - Anthony Padilla▸ Assistant Producer, Co-writing & Research - Elise Felber▸ Director of Photography/Gaffer - Zach Zeidman▸ Editor - Mike Criscimagna▸ Assistant Camera Operator & Assistant Editor - Robert Butler III▸ Stage Manager - Cort Maclean📢BE ON THE SHOW▸ If you are part of an under represented subculture with a way of life you feel is not widely understood and would like to be interviewed by me in LA, email ispentadaywith [at] apadilla.co with your subculture in the title of the email.🚫Padildo Clan (exclusive member group) - http://facebook.com/groups/padildo❗️You dug this deep into the description. You owe it to yourself to subscribe ▶ https://youtube.com/subscription_center?add_user=AnthonyPadilla💉Self plug▸ http://instagram.com/anthonypadilla▸ http://twitter.com/anthonypadilla▸ http://facebook.com/anthonypadilla"
"EuU_uUb_3nQ","Binging with Babish: Mac & Cheese from Once Upon a Time in Hollywood","2020-02-04T14:00:05.000Z","UCJHA_jMfCvEnv-3kRjTCQXw","Binging with Babish","24","20.11.02","macaroni and cheese|mac and cheese|mac & cheese|mac and cheese recipe|easy mac and cheese|easy macaroni and cheese|kraft mac and cheese|quick mac and cheese|once upon a time in hollywood|cliff booth|cheese|macaroni|pasta from scratch|pasta extruder|pasta extruder recipe|pear qwerty horse|binging with babish|babbish|cooking with babish|instant mac and cheese recipe|instant mac and cheese|homemade cheese powder|cheese powder","2809252","102365","1655","4662","https://i.ytimg.com/vi/EuU_uUb_3nQ/default.jpg","False","False","Making mac and cheese with some help from my co-star in the kitchen Bounty, the Quicker Picker Upper. Head to http://spr.ly/BountyQPU to pick up a coupon.In Quentin Tarantino's latest drug-laced, blood-soaked, profanity-peppered revisionist history masterpiece, food once again takes center stage alongside our singular protagonists. In a departure from his penchant for fictional brand names, a familiar box emblazoned in blue is shown as the preferred dinner of stuntman Cliff Booth. Can we improve on this childhood classic? Is there even a need to? Well, I decided to anyway. Sort of.Music: XXV by Broke for Freehttps://soundcloud.com/broke-for-freeMy playlist of preferred cooking tunes, Bangers with Babish! https://spoti.fi/2TYXmiYBinging With Babish Website: http://bit.ly/BingingBabishWebsiteBasics With Babish Website: http://bit.ly/BasicsWithBabishWebsitePatreon: http://bit.ly/BingingPatreonInstagram: http://bit.ly/BabishInstagramFacebook: http://bit.ly/BabishFacebookTwitter: http://bit.ly/BabishTwitter"
"K4UQsAe9-E4","$169 eBay Turbo Dyno Results (EPIC!)","2020-02-05T02:36:01.000Z","UCgJRL30YS6XFxq9Ga8W2J3A","Mighty Car Mods","2","20.11.02","mighty|car|mods|mcm|MCM|moog|marty|turbo|jdm|how|to|diy|do|it|yourself|nissan|subaru|supercharged|race|yaris|hilton|dyno|haltech|elite 750|testing|2zrfe|ebay|ebay turbo|power|yaris hilton|mcm yaris","1167743","38066","572","3964","https://i.ytimg.com/vi/K4UQsAe9-E4/default.jpg","False","False","After installing our $169 Turbocharger we bought on Ebay, Yaris Hilton is strapped onto the dyno to see what kind of power we can extract from the 2ZRFE Corolla engine we bolted into it. In the search for more kilowatts we also installed bigger injectors, a front mount intercooler and in this episode upgrade the fuel system to support more power. Will it go or will it blow? Does a bargain hunter really pay twice? We find out in this epic episode of boosty action. Be sure to check out the MCM Facebook Page and Shop►http://www.facebook.com/mightycarmods►http://www.mightycarmods.com/collections/✌️ JDM Air Fresheners https://mightycarmods.com/collections/accessories/products/mcm-car-air-freshener👕 BRAND NEW Engine Heart T-shirt https://mightycarmods.com/collections/clothing/products/engine-heart-t-shirt🔔 Hit the bell next to Subscribe so you don't miss a video!Also something to note around Mighty Car Mods: we are normal guys and are not trained mechanics. We like to make interesting car mods and show you how we've gone about it, but we can't promise that anything we show you will work for your particular car, or that you won't harm yourself, someone else, your car or your warranty doing it. Please be safe, be responsible and unless you know what you're doing, do not fool around with very serious machinery just because you've seen us make it look so easy. Talk to a qualified mechanic if you are in any doubt."
