video_id,title,publishedAt,channelId,channelTitle,categoryId,trending_date,tags,view_count,likes,dislikes,comment_count,thumbnail_link,comments_disabled,ratings_disabled,description
"bZ8_DUBwOg4","Everything Wrong With Once Upon a Time in Hollywood","2020-02-13T16:30:32.000Z","UCYUQQgogVeQY8cMQamhHJcg","CinemaSins","1","20.16.02","wave jockey job|everything wrong with|eww|cinemasins|cinema sins|cinema|oscars|best picture|brad pitt|leonardo dicaprio|margot robbie|once upon a time in hollywood|ew once upon a time in hollywood|everything wrong with once upon a time in hollywood|once upon a time in hollywood review|movie|movie review|quentin tarantino|quentin tarantino movies|review|leonardo dicaprio once upon a time in hollywood|hollywood|once upon a time|oscars 202|oscars best picture","628771","18418","1521","2354","https://i.ytimg.com/vi/bZ8_DUBwOg4/default.jpg","False","False","Quentin Tarantino is back with Once Upon A Time In Hollywood. It's got Brad Pitt, Leonardo, Margo Robbie, and Bruce Lee & Charles Manson (no, really). Most everyone liked it and it was up for Best Picture, but it still has sins. So we counted them. Next week: Recent-past horror & recent narration.Remember, no movie is without sin! Which movie's sins should we expose next?!Patreon: https://www.patreon.com/CinemaSins Podcast: https://soundcloud.com/cinemasins TVSins: https://www.youtube.com/channel/UCe4bOvc1mYxFcQ5xPb9Zmow MusicVideoSins: https://www.youtube.com/channel/UCUBq8oBRVTsMpjWiHfjJpDw Twitters...Jeremy: http://twitter.com/cinemasins Barrett: http://twitter.com/musicvideosins Aaron: http://twitter.com/aarondicer Jonathan: http://twitter.com/samloomis13 Denee: http://twitter.com/deneesaysMerch: https://teespring.com/stores/cinemasins-storeSubreddit: http://reddit.com/r/cinemasins Website: http://cinemasins.com SinCast Facebook page: https://www.facebook.com/SinCastCinemaSins#CinemaSins#EverythingWrongWith#OnceUponATime"
"6Cvo1F7_o3I","Isiah Thomas gets booed by the First Take crowd for his Bulls-Pistons take","2020-02-13T16:24:55.000Z","UCiWLfSweyRNmLpgEHekhoAg","ESPN","17","20.16.02","giannis antetokounmpo|milwaukee bucks|bucks|giannis|first take|nba on espn|giannis antetokounmpo bucks|giannis bucks|giannis espn|giannis antetokounmpo espn|espn giannis|antetokounmpo|first take nba|first take today|stephen a smith|espn|espn first take|nba first take|nba espn|first take espn|espn first take today|#nba|stephen a|stephen a. smith|#firsttake|giannis mvp|espn first take nba|nba 2020|first take giannis|espn giannis antetokounmpo","470559","5150","218","1700","https://i.ytimg.com/vi/6Cvo1F7_o3I/default.jpg","False","False","Scottie Pippen reacts:https://youtu.be/s_qQMPYqC7QStephen A. Smith, Isiah Thomas and Max Kellerman’s conversation about Milwaukee Bucks star Giannis Antetokoumpo turns into a Chicago Bulls vs. Detroit Pistons debate.#FirstTake #NBA✔ Subscribe to ESPN+ https://plus.espn.com/✔ Get the ESPN App: http://www.espn.com/espn/apps/espn✔ Subscribe to ESPN on YouTube: http://es.pn/SUBSCRIBEtoYOUTUBE✔ Subscribe to ESPN FC on YouTube: http://bit.ly/SUBSCRIBEtoESPNFC✔ Subscribe to NBA on ESPN on YouTube: http://bit.ly/SUBSCRIBEtoNBAonESPN✔ Watch ESPN on YouTube TV: http://es.pn/YouTubeTVExclusive interviews with Rachel Nichols https://urlzs.com/jNUReStephen A. Smith on ESPN https://urlzs.com/W19TzESPN on Social Media:► Follow on Twitter: http://www.twitter.com/espn► Like on Facebook: http://www.facebook.com/espn► Follow on Instagram: www.instagram.com/f/espnVisit ESPN on YouTube to get up-to-the-minute sports news coverage, scores, highlights and commentary for NFL, NHL, MLB, NBA, College Football, NCAA Basketball, soccer and more. More on ESPN.com: https://www.espn.com"
"BgQ1AayBULY","One Last Job","2020-02-13T17:00:02.000Z","UC9Zc9eSANOmE-fbeT382Ozg","Phil Jamesson","23","20.16.02","one job|action movie|one last job","318824","8058","243","207","https://i.ytimg.com/vi/BgQ1AayBULY/default.jpg","False","False","one last job and you'll never hear from me againSUBSCRIBE ► http://bit.ly/2fTwFJy VIDS IN 60 SECONDS ► http://bit.ly/2F9iewhTWITCH ► http://www.twitch.tv/philjamessonMID-LENGTH VIDS ► http://bit.ly/2FajjjnCOMEDY THEORY VIDS ► http://bit.ly/2HZVe0Mhey Show More and mobile folks. i ran into some difficulty with the audio on this one and ended up refilming and editing the whole thing this morning (it's 11:29 AM when i'm writing). i think it came out a lot better though so i'm glad i did it. hope you're having a good day and i hope you don't get dragged into a romp that ends in your sacrificing yourself for the greater good in an emotional climax that teaches us the power of friendship and love but if it happens i'm sure it'll make for great tv"
"_4ngl4VdlZ0","Rebuilding A Wrecked 2020 Jeep Gladiator Rubicon Part 9","2020-02-13T17:02:19.000Z","UCwO_xoYm2vjhu4kZSxFO5mA","goonzquad","26","20.16.02","rebuilt|wrecked|salvaged|rebuilding a wrecked 2020 jeep gladiator rubicon|rebuilding a wrecked 2020 jeep gladiator|rebuilding a wrecked jeep gladiator|rebuilding a wrecked gladiator|rebuilding a salvaged 2020 jeep gladiator rubicon|rebuilding a salvaged 2020 jeep gladiator|2020 jeep gladiator rubicon rebuild|2020 jeep gladaitor build|rebuilding a wrecked truck|rebuilding a salvaged truck|goonzquad gladiator|goonzquad jeep|goonzquad","803138","33569","553","1833","https://i.ytimg.com/vi/_4ngl4VdlZ0/default.jpg","False","False","Finally got this 2020 Jeep Gladiator completely painted! This one was quite the challenge, especially the way we had to tape it up. However, after our painting experiences in the past, this jeep was no match for the goonzquad boys. Now it is time to move onto the next step! Be sure to stay tuned and watch what happens!!! Thanks For Watching!!!-GOONZQUAD NEW LIMITED T-Shirt!!!:  https://goonzquad.com-Instagram: https://www.instagram.com/goonzquad/-Email: goonzquadteam@gmail.com-P.O. Box 37  Rossville,GA 30741Music Credits:Song: LiQWYD - Feel (Vlog No Copyright Music)Music provided by Vlog No Copyright Music.Video Link: https://youtu.be/m-WOfLbaF2ESong: Markvard - Obsessed (Vlog No Copyright Music)Music provided by Vlog No Copyright Music.Video Link: https://youtu.be/4qkJ_nAG_w0Song: LiQWYD - Summer Nights (Vlog No Copyright Music)Music provided by Vlog No Copyright Music.Video Link: https://youtu.be/Q1bBAEhDBBgSong: Dipcrusher - Islands (Vlog No Copyright Music)Music provided by Vlog No Copyright Music.Video Link: https://youtu.be/CpFneq3zIt4Song: MusicbyAden - Dusk (Vlog No Copyright Music)Music provided by Vlog No Copyright Music.Video Link: https://youtu.be/je6iwUdvQD4Song: Niya - A Finale (Vlog No Copyright Music)Music provided by Vlog No Copyright Music.Video Link: https://youtu.be/1sXdoIECpukSong: Thomas Gresen - Pretty Lies (Vlog No Copyright Music)Music provided by Vlog No Copyright Music.Video Link: https://youtu.be/i_Fya3uP8WASong: Thomas Gresen - Spotlight (Vlog No Copyright Music)Music provided by Vlog No Copyright Music.Video Link: https://youtu.be/xSOOsPUdPz4A Magical Journey Through Space by Leonell Cassio https://soundcloud.com/leonellcassioCreative Commons — Attribution-ShareAlike 3.0 Unported — CC BY-SA 3.0Free Download / Stream: https://bit.ly/a-magical-journey-thro...Music promoted by Audio Library https://youtu.be/DRwYhxVNwzUBlue by Roa Music https://soundcloud.com/roa_music1031Creative Commons — Attribution 3.0 Unported  — CC BY 3.0 Free Download / Stream: https://bit.ly/blue-roa-music Music promoted by Audio Library https://youtu.be/QaDf_k7rdKQ Song: LiQWYD - Summer Nights (Vlog No Copyright Music)Music provided by Vlog No Copyright Music.Video Link: https://youtu.be/Q1bBAEhDBBg"
"uynBcLr8fEc","How a Tranquilizer Dart Works in Slow Motion - The Slow Mo Guys","2020-02-12T18:26:54.000Z","UCUK0HBIBWgM2c4vsPhkYY4w","The Slow Mo Guys","24","20.16.02","slomo|slow|mo|super|motion|Slow Motion|1000|1000fps|gav|dan|slowmoguys|phantom|guys|HD|flex|gavin|free|gavin free|high speed camera|the slow mo guys|2000|2000fps|5000|5000fps|tranqtranquilisertranquilizerdartanesthetic|tranq|tranquilizer|tranquiliser|dart|anaesthetic|anesthetic","11234301","243531","4978","6831","https://i.ytimg.com/vi/uynBcLr8fEc/default.jpg","False","False","Gav and Dan learn about tranquilizer dart physics using slow mo as a helpful tool. Don't try this at home unless you have 400lb gorilla running at full clip towards you. Watch outtakes here! https://www.youtube.com/watch?v=0qXu5kDy_zsFollow us on Instagram! https://www.instagram.com/gavinfree/https://www.instagram.com/danielgruchy/Filmed at 1000fps and 3000fps with a Phantom Flex 4KHow a Tranquilizer Dart Works in Slow Motion - The Slow Mo Guys"
"TcPk2p0Zaw4","THE FRENCH DISPATCH | Official Trailer","2020-02-12T13:59:55.000Z","UCor9rW6PgxSQ9vUPWQdnaYQ","SearchlightPictures","1","20.16.02","The French Dispatch|The French Dispatch Trailer|Fox Searchlight|Searchlight Pictures|Searchlight|Searchlight Movies|Searchlight movie|Wes Anderson|Wes Anderson movie|French|French movie|Benicio del Toro|Adrien Brody|Tilda Swinton|Léa Seydoux|Frances McDormand|Timothée Chalamet|Lyna Khoudri|Jeffrey Wright|Mathieu Amalric|Stephen Park|Bill Murray|Owen Wilson","2725191","54415","2645","3132","https://i.ytimg.com/vi/TcPk2p0Zaw4/default.jpg","False","False","THE FRENCH DISPATCH brings to life a collection of stories from the final issue of an American magazine published in a fictional 20th-century French city. It stars Benicio del Toro, Adrien Brody, Tilda Swinton, Léa Seydoux, Frances McDormand, Timothée Chalamet, Lyna Khoudri, Jeffrey Wright, Mathieu Amalric, Stephen Park, Bill Murray and Owen Wilson.Directed by: Wes AndersonScreenplay by: Wes AndersonProduced by: Wes Anderson, Steven Rales and Jeremy DawsonCast: Benicio del Toro, Adrien Brody, Tilda Swinton, Léa Seydoux, Frances McDormand, Timothée Chalamet, Lyna Khoudri, Jeffrey Wright, Mathieu Amalric, Stephen Park, Bill Murray and Owen Wilson#TheFrenchDispatch #SearchlightPicturesConnect with Searchlight Pictures Online:Visit the Searchlight Pictures WEBSITE: https://www.searchlightpictures.com/Like Searchlight Pictures on FACEBOOK: https://www.facebook.com/searchlightpics/Follow Searchlight Pictures on TWITTER: https://twitter.com/searchlightpicsTHE FRENCH DISPATCH | Official Trailer | Searchlight Pictureshttps://www.youtube.com/user/FoxSearchlight"
"GWAY5i3CMpo","Millionaire's Shortbread | Basics with Babish","2020-02-13T14:00:05.000Z","UCJHA_jMfCvEnv-3kRjTCQXw","Binging with Babish","24","20.16.02","binging with babish|cooking with babish|babbish|basics with babish|pear qwerty horse|shortbread|short bread|shortbread cookies|how to make shortbread|how to make shortbread cookies|shortbread recipe|millionaire's shortbread|millionaires shortbread|babish shortbread|millionaires shortbread babish|short bread recipe|shortbread cookies recipe|shortbread slices|shortbread slices recipe|homemade twix|homemade twix recipe|twix recipe|twix from scratch","1578173","67353","403","2677","https://i.ytimg.com/vi/GWAY5i3CMpo/default.jpg","False","False","Head to http://bit.ly/squarespacebabish to save 10% off your first purchase of a website or domain using code BABISH.This week on Basics, it's time to make the ultimate cookie: millionaire's shortbread.Ingredients & Shopping List coming soon!Music: Sweet Berry Wine by Blue Wednesdayhttps://soundcloud.com/bluewednesday"
"T2QBcV5nizY","WE GOT MARRIED! **Cody & Zoe's Official Wedding Video**","2020-02-12T23:27:53.000Z","UCM37rfFiIddTdDhhdamizqA","Cody Orlove","1","20.16.02","cody orlove|Zoe laverne|cody and zoe|zody|wedding|wedding video|official wedding video|we got married|cody and zoe got married|married|married couples|we got married for 24 hours|24 hours|24 hours challenge|24 hours video|wedding vows|vows|Zoe Laverne got married|cody orlove got married","870889","38077","2623","5137","https://i.ytimg.com/vi/T2QBcV5nizY/default.jpg","False","False","Watch till the end. We wish this could be real, but we wanted to try it out. We're too young, and definitely need more time. Just remember, one day it'll actually happen. We hope you all enjoyed the video! LIKE & SUBSCRIBE if you did enjoy even a little. It'd mean the WORLD to US! I do this for you guys, every day of the year. I'll see you guys in the next video. Until next time cows.. MOO! OUR MERCH IS SELLING OUT!https://www.shopwithzody.comZoe's Channel:https://www.youtube.com/channel/UCGCk...Socials:Instagram - @CodyOrlove TikTok - @CodyOrlove SnapChat - @CodyyOrlove WE GOT MARRIED! **Cody & Zoe's Official Wedding Video**"
"sRBjJddzbkY","FALLING IN LOVE","2020-02-13T00:36:52.000Z","UCxSz6JVYmzVhtkraHWZC7HQ","Liza Koshy","23","20.16.02","liza|lizza|lizzza|lizzzavine|lizzzak|lizzzako|koshy|lizakoshy|wednesdays|liza travel vlog|liza italy|liza in love|travel video|italian men|traveling|liza koshy|liza and mom|liza's parents|Koshy family|keeping up with the koshys|dancing liza|dancing|liza sisters|food|florence|rome|venice|italy|italian","1850455","161338","2832","8744","https://i.ytimg.com/vi/sRBjJddzbkY/default.jpg","False","False","I've waited this long to tell you......that I went to Italy 6 months ago with my family and fell in love with the country and several men in it. And a pigeon.This life has been a heaven of a ride... thank you for riding with me.I'll see you unexpectedly again, very soon.••••••••••••••••••••••••••••••••••••••••­­­•••••••••••Videographers: Liza Koshy, Mama Koshy, Papa Koshy, O. Koshy, R. KoshyEditor: My bro, Mark C. Roe Produced by Westbrook Media (and me lol)••••••••••••••••••••••••••••••••••••••••­­­•••••••••••Keep up with this little brown girl!INSTAGRAM: http://instagram.com/lizakoshyTWITTER: http://twitter.com/lizakoshyTIKTOK: @lizzzaSNAPCHAT: @lizakoshysnaps••••••••••••••••••••••••••••••••••••••••­­­•••••••••••Subscribe! If you want, no pressure:www.youtube.com/lizakoshywww.youtube.com/lizakoshytoo••••••••••••••••••••••••••••••••••••••••­­­•••••••••••I thank you, I've missed you, and I am so happy to be here with you.All my love always,Liza"
"9LLqHxKbZa8","Lil Huddy Asks Charli D'Amelio to Be His Valentine","2020-02-12T21:30:00.000Z","UCL4IdfbWMWMByRCKry6mh6g","Flighthouse TikToks","24","20.16.02","flighthouse|lil huddy asks charli d amelio to be his valentine|lil huddy asks charli to be his valentine|lilhuddy charli d'amelio|flighthouse lil huddy charli d amelio|lil huddy charli damelio flighthoouse|valentines day|camila cabello my oh my music video|demi lovato anyone reaction|social media marketing|influencer marketing|get to know me|bedroom pop|spotify|tiktok|suggestion box|tiktok couples|musically|vevo|loren gray tik tok|couple goals|february 2020","1861986","68400","1437","1432","https://i.ytimg.com/vi/9LLqHxKbZa8/default.jpg","False","False","Lil Huddy Asks Charli D'Amelio to Be His ValentineLil Huddy (Chase Hudson) and Charli D'Amelio stop by Flighthouse to play Suggestion Box. They prank call someone from the Hype House, play the Climb Your Partner Challenge and maybe give a cheek kiss or two. Comment your future suggestions below to be picked for the next Suggestion Box!Follow Flighthouse:Tik Tok: @FlighthouseInstagram: http://bit.ly/FH-Instagram"
"QiZaVclKXds","Harry Styles - Fine Line Live at the Forum BTS (Presented by American Express)","2020-02-13T16:00:06.000Z","UCbOCbp5gXL8jigIBZLqMPrw","HarryStylesVEVO","10","20.16.02","HarryStyles|Harries|Fine Line|Forum|The Forum|Harry Styles Fine Line|Harry Styles Fine Line Live|Harry Styles Fine Line At The Forum|Harry Styles Fine Line Forum|Fine Line Live At The Forum|Harry Styles Fans|Fans|HS2|American Express|BTS|Behind The Scenes|HS Fine Line|Fine Line Live Performance|Los Angeles|Fine Line Los Angeles|Fine Line Live Show|Harry Styles Live|Harry Styles Performance|Columbia|Fine|Line|Live","567532","86338","233","4528","https://i.ytimg.com/vi/QiZaVclKXds/default.jpg","False","False","HARRY STYLES. LOVE ON TOUR 2020 DATES: https://hstyles.co.uk/tour Listen to Harry Styles’ new album ‘Fine Line’ now: https://HStyles.lnk.to/FineLineAY   Follow Harry Styles:Facebook: https://HarryStyles.lnk.to/followFIInstagram: https://HarryStyles.lnk.to/followIITwitter: https://HarryStyles.lnk.to/followTIWebsite: https://HarryStyles.lnk.to/followWISpotify: https://HarryStyles.lnk.to/followSIYouTube: https://HarryStyles.lnk.to/subscribeYD Director: Alex BittanDP: Drew BienemannProducer: Molly HawkinsEditor: Jorge SandovalExecutive Producers: Holly Harding, Julia Ochsenreiter, Rik GreenProduction Companies: Caffeine Films, Pulse FilmsShoot Date: December 13, 2019#HarryStyles #FineLine #AmexExperiences"
"QCGLegCeyjg","Attending a Pyramid Scheme seminar","2020-02-13T02:37:56.000Z","UCWiY6fYdxuEe78r-0uFCnhA","LongBeachGriffy","24","20.16.02","[none]","882109","96498","437","5349","https://i.ytimg.com/vi/QCGLegCeyjg/default.jpg","False","False","Thank you for watching! Follow my socials of you want :) Www.instagram.com/longbeach_griffy Www.facebook.com/longbeachgriffy Www.twitter.com/longbeachgriffy"
"0y_2VU7x0hA","Luh Kel - Y.O.U. (Official Music Video)","2020-02-12T15:00:10.000Z","UCqwJGbr0bm8XbudrEsQhp4Q","Luh Kel","10","20.16.02","luh kel you|luh kel|i need you|if i said i need you by my side|luh kel wrong|you did me wrong lyrics|i i need you|luh kel you clean|lifewluhkel|luh kel 2019|instagram|wrong|kel|st louis|lifewluhkel pull up|lyrics|ne yo|lifewluhkel lyrics|luh kel brb|you got me tweaking all in my feelings luh kel|luhkell|you got me tweaking|you kel|lil kel|luhkel|just stay close to me|luh kel tik tok song|luh kel type beat|y.o.u luh kel|luh kel y.o.u lyrics|luhkelyou","1420069","116236","1106","3933","https://i.ytimg.com/vi/0y_2VU7x0hA/default.jpg","False","False","Watch the official music video for Y.O.U. by Luh Kel.Stream Y.O.U. now: https://ffm.to/luhkelyouShop: https://luhkel.comSubscribe: https://bit.ly/2YN32eCText ME! (816) 448-8039Song Produced by Bankroll Got it, DJ Luney Tunez for Beat Juug LLC and XZDirector: @jonprimo1 ⁣DP: @kaylahoff_  Executive Producers: @jonnyshipes @adam313 Executive Producers:@edgaresteves @christhedirector @bobbyhanaford  Production Company: @blanksquareproductionsProducer: @joanpabon_  Production Manager: @mccapturez  Supervising Producer(s): @gabslarosa @johnlarosa Production Coordinator: miketheproducerEditor: @callaird  Color: @lorenjameswhite 1st AD: @jchrisrouse  Steadicam: Top Branch Productions1st AC: @pintoproduction  2nd AC: Bihilio BriggsDIT: @joshuavallecr  Photographer: @rowmel_  Gaffer: @matthill313   Electric: Shai Keaton-NixKey Grip: Luis Batres⁣G&E: @luckychickenproductions  Art Director: @sunshine_acid PA: @angelvaughn_  PA: @iyex_  Playback: @drosworld  Camera: @lcarentals  MUA: @kimandglitter  Casting Director: @millticketceo  Project Manager: @Fame_combsThank you to cast & crew for making this visual come to life!Follow Luh Kelhttps://www.instagram.com/lifewluhkel/https://twitter.com/lifewluhkelhttps://www.facebook.com/lifewluhkel/http://vm.tiktok.com/ec4YaY/Lyrics: If I said I need you by my side Just stay close to meJust keep on holding me telling me you won’t ever leaveI feel like something inside me just keep control of meBut you take all the pain I need your energyI - I - Im in need of you I - I  Know you see me throughI - I - Ill be there for youI - I - Ill be there for youIts a different feeling when all the checks offIma chop it Ima chop it till the pack goneSometimes I know I’m right but I feel wrong When your arms not around me I feel all aloneI feel like I’m pacing chasing hoping Ima make it Its a lot of time and my lifes been super crazyPraying that one day my brother make it out them cages     You was there for me I swear that I -If I said I need you by my side Just stay close to meJust keep on holding me telling me you won’t ever leaveI feel like something inside me just keep control of meBut you take all the pain I need your energyI - I - Im in need of youI - I  Know you see me throughI - I - Ill be there for youI - I - Ill be there for youLately I’ve been in my mind I feel I’m faded Every time you come around my heart is racingIm grinding so hard I gotta make itBut you told me its going so I’m patient iv been in my g   It might take some time I’m strongI need you by my side because I need y’allAnd when you tell me I’m that n***a  boost my egoAll the way to the stars like the aliens I know we aint hit the top but are we grazing itWhen I look into your eyes its some amazing shitThank god you not  in love just for the place I’m inI- I - Im in need of youI - I  Know you see me throughI - I - Ill be there for youI - I - Ill be there for youIf I said I need you by my side Just stay close to meJust keep on holding me telling me you won’t ever leaveI feel like something inside me just keep control of meBut you take all the pain I need your energyI - I - Im in need of youI - I  Know you see me throughI - I - Ill be there for youI - I - Ill be there for you#LuhKel #YOU #INeedYou"
"ht7MNqZT_hU","I Got Styled By An Amazon Personal Shopper","2020-02-12T05:11:17.000Z","UCbAwSkqJ1W_Eg7wr3cp5BUA","Safiya Nygaard","22","20.16.02","i tried amazon's personal shopper service|amazon's personal shopper service|personal shopper|amazon wardrobe|amazon style|amazon|personal shopping|amazon styles me|i let amazon style me|safiya amazon|safiya nygaard|safia|safiya & tyler|tyler williams|amazon personal shopper|safiya fashion|amazon fashion|i got styled by an amazon personal shopper|sophia","3397619","177368","2248","7755","https://i.ytimg.com/vi/ht7MNqZT_hU/default.jpg","False","False","Hello friends & welcome back to our channel! A few months ago, I found out that Amazon started offering a personal shopping service. That's right, Amazon was styling people for a small fee each month - so I figured, we had to try it out to see what kind of clothing & accessories they would send me, and if they would be any good. So we took a quiz and good ole' Bezos sent me a sack of clothes. What do you guys think of my Amazon personal shopper haul? EDIT (for clarity) - although I eliminated most color options in the quiz, I did leave on every pattern except animal print, I said that I often wear edgy styles and I also liked boho styles, said that I would try pretty much every trend except for animal print and cropped pants, and clicked yes on multiple silhouettes and clothing items - so they had plenty of optionality! just in case you guys missed some answers!This video is NOT sponsored!You can check out our Colourpop frankenlipsticks here! https://colourpop.com/collections/safiya-nygaard-makeupSafiya's Instagram: https://www.instagram.com/safiyany/Twitter: https://twitter.com/safiyajnFacebook: https://www.facebook.com/safnygaard/Check out our merch here: https://fiendsbysaf.com/If your size is sold out, sign up for email updates!MUSICVia AudioNetworkAssistant EditorsEmily Linden & Josie Latino"
"4THFRpw68oQ","AJR - BANG! (Official Video)","2020-02-12T15:00:11.000Z","UCQ5w3fSomzziZfO7neK7eAg","AJR","10","20.16.02","[none]","926292","75076","1141","4971","https://i.ytimg.com/vi/4THFRpw68oQ/default.jpg","False","False","Grab the song here: http://ajrmusic.co/bangON TOUR: http://www.AJRBrothers.com/tourCheck us out everywhere online @AJRBrothersDirector: Se OhChoreographer: Caleb TeicherProduction: MAD RUK Entertainment BANG!I get up I get downAnd I’m jumping aroundAnd the rumpus and ruckus are comfortable nowBeen a hell of a rideBut I’m thinking it’s time to growSo I got an apartmentAcross from the parkPut quinoa in my fridgeStill I’m not feeling grownBeen a hell of a rideBut I’m thinking it’s time to go(Here we go)So put your best face on everybodyPretend you know this song everybodyCome hangLet’s go out with a bangI’m way too young to lie here foreverI’m way too old to try so whateverCome hangLet’s go out with a bangFeel like I’m gonna pukeCause my taxes are dueDo my password begin with a one or a two?Been a hell of a rideBut I’m thinking it’s time to grow(Metronome)Man I'm up to somethingOo-dee-la-dee-doeThank you all for comingI hope you like the showCause it’s on a budgetSo oo-dee-la-dee-doeYeah come on here we goYeah come on(Here we go)So put your best face on everybodyPretend you know this song everybodyCome hangLet’s go out with a bangI’m way too young to lie here foreverI’m way too old to try so whateverCome hangLet’s go out with a bangBeen a hell of a rideBut I’m thinking it’s time to goSo put your best face on everybodyPretend you know this song everybodyCome hangLet’s go out with a bangI’m way too young to lie here foreverI’m way too old to try so whateverCome hangLet’s go out with a bang"
"bthwytKdzIM","Janet Jackson Surprises 'The View'","2020-02-12T20:24:36.000Z","UCeH6qE4V7n5tVwP7NkdrtJg","The View","24","20.16.02","The View|Whoopi Goldberg|Joy Behar|Meghan McCain|Sunny Hostin|Janet Jackson|Surprise|Tickets|World Tour|2020|Black Diamond World Tour|Music|Star","617893","11830","452","2389","https://i.ytimg.com/vi/bthwytKdzIM/default.jpg","False","False","After announcing her “Black Diamond” world tour, Jackson celebrated the good news with the co-hosts.Subscribe to our YouTube channel: http://bit.ly/2Ybi4tM MORE FROM 'THE VIEW':Full episodes: http://abcn.ws/2tl10qhTwitter: http://twitter.com/theviewFacebook: http://facebook.com/TheViewInstagram: http://instagram.com/theviewabc"
