video_id,title,publishedAt,channelId,channelTitle,categoryId,trending_date,tags,view_count,likes,dislikes,comment_count,thumbnail_link,comments_disabled,ratings_disabled,description
"ybji16u608U","Marvel Studios' Black Widow | Final Trailer","2020-03-09T12:46:55.000Z","UCvC4D8onUfXzvjTOM-dBfEA","Marvel Entertainment","24","20.15.03","marvel|comics|black widow|scarlett johansson|black widow trailer|natasha romanoff|trailer|david harbour|florence pugh|2020|movie|mcu|avengers|black widow 2020|superhero|black widow movie|red guardian|rachel weisz|superheroes|official|final trailer|taskmaster","12563437","388202","5862","19934","https://i.ytimg.com/vi/ybji16u608U/default.jpg","False","False","At some point we all have to choose between what the world wants you to be and who you are.” Watch the new trailer for Marvel Studios’ #BlackWidow. In theaters May 1.► Learn more: https://www.marvel.com/movies/black-widow► Subscribe to Marvel: http://bit.ly/WeO3YJFollow Marvel on Twitter: ‪https://twitter.com/marvelLike Marvel on Facebook: ‪https://www.facebook.com/marvelFor even more news, stay tuned to:Tumblr: ‪http://marvelentertainment.tumblr.com/Instagram: https://www.instagram.com/marvelPinterest: ‪http://pinterest.com/marvelofficialReddit: http://reddit.com/u/marvel-official"
"YwodhCjFbQ8","Camilo, Evaluna Montaner - Por Primera Vez (Official Video)","2020-03-09T23:00:12.000Z","UCXQIVincj_W4CYfWKB1iPVQ","CamiloVEVO","10","20.15.03","Camilo Evaluna Por Primera Vez Official Video|Camilo Evaluna Por Primera Vez|Camilo Evaluna Por Primera Vez Video|Camilo Evaluna Por Primera Vez Video Oficial|Camilo Evaluna|Evaluna Montaner|Evaluna Montaner Por Primera Vez|Camilo Por Primera Vez|Camilo Evaluna boda|Camilo Evaluna wedding|Camilo Evaluna honeymoon|casamiento de evaluna y camilo|evaluna le lava los pies a camilo|camilo esposo de evaluna|Camilo & Evaluna Montaner","15090044","957053","9175","22757","https://i.ytimg.com/vi/YwodhCjFbQ8/default.jpg","False","False","Camilo, Evaluna Montaner - Por Primera Vez (Official Video)Música Disponible:All DSPs: https://smarturl.it/PorPrimeraVez Apple Music: https://SML.lnk.to/PorPrimeraVez Spotify: https://smarturl.it/PorPrimeraVez/spotify Amazon: https://smarturl.it/PorPrimeraVez/az YouTube: https://smarturl.it/PorPrimeraVez/youtube iTunes: https://smarturl.it/PorPrimeraVez/itunes Letra:Tengo tantas ganasAy, de besarte en las mañanas, justo cuando te levantas (Te amo)Pero tengo miedo (Tengo miedo)Que busques a alguien perfecto y yo tan de carne y hueso (Te amo)Si pudiera controlar el tiempoYo volvería a esperar de nuevoUna y mil veces, pa' ver cómo amanecesPor primera vez un amanecer bonitoPor primera vez lo que quiero y necesitoPor primera vez hoy duerme el cielo conmigoPor primera vez, yo volví a nacer contigo (Te amo)Yeah, yeah, contigoSi yo te tengo no me falta nada (No)Tan largo que fue ayer y ya casi es mañanaPa' darte los beso' que nunca nos dimo', mmm (Mm, mmm)Para decirte cosa' bonita' siempre yo aquí estaréPorque yo me siento bien cuando tú te sientes bienMi vida es vida solo contigoSi tú no estás, no tiene sentido, amorLo que quiero y necesito (Tú y yo)Por primera vez un amanecer bonito (Un amanecer bonito)Por primera vez lo que quiero y necesito (Tú eres lo que yo necesito)Por primera vez hoy duerme el cielo conmigo (Yeah, yeah; te amo)Por primera vez, yo volví a nacer contigo (Yeah, yeah, contigo)Mi vida es vida solo contigo (Solo contigo)Si tú no estás, no tiene sentido, amor (Que no tiene sentido)Lo que quiero y necesitoMi vida es vida solo contigoSi tú no estás, no tiene sentido, amorLo que quiero y necesito (Yeah, yeah, yeah)Por primera vez un amanecer bonito (Un amanecer bonito)Por primera vez lo que quiero y necesito (Que te quiero, ven)Por primera vez hoy duerme el cielo conmigo (Te amo)Por primera vez, yo volví a nacer contigo (Yeah, yeah, contigo)Si pudiera controlar el tiempoYo volvería a esperar de nuevoUna y mil veces, pa' ver cómo amanecesRedes:Camilo Facebook: https://www.facebook.com/camilomusicaTwitter: https://twitter.com/camilomusicaInstagram: https://www.instagram.com/camilomusicaEvaluna Facebook: https://www.facebook.com/Evaluna-Montaner-598938530142367/Instagram: https://www.instagram.com/evaluna/Twitter: https://twitter.com/MontanerevalunaDirector: Joy ProutyProductor: Don ProutyCasa Productora: The Proutrys / www.theproutys.co#Camilo #Evaluna #PorPrimeraVezOfficial Music Video by Camilo & Evaluna performing “Por Primera Vez (C) 2020 Sony Music Entertainment US Latin LLC/Hecho A Mano Music (HAMM)"
"f_HvoipFcA8","Disney's Jungle Cruise | Official Trailer","2020-03-10T13:00:08.000Z","UCuaFvcY4MhZY3U43mMt1dYQ","Walt Disney Studios","1","20.15.03","[none]","3852386","20557","767","1544","https://i.ytimg.com/vi/f_HvoipFcA8/default.jpg","False","False","Join the adventure of a lifetime and watch the action-packed new trailer for Disney’s JUNGLE CRUISE. The trailer was launched via a fun-filled Instagram Live featuring Dwayne Johnson, interacting with a boat full of skippers from the Jungle Cruise attraction at The Disneyland Resort. Inspired by the famous Disneyland theme park ride, Disney’s JUNGLE CRUISE is an adventure-filled, Amazon-jungle expedition starring Dwayne Johnson as the charismatic riverboat captain and Emily Blunt as a determined explorer on a research mission. Also starring in the film are Edgar Ramirez, Jack Whitehall, with Jesse Plemons, and Paul Giamatti. Jaume Collet-Serra is the director and John Davis, John Fox, Dwayne Johnson, Hiram Garcia, Dany Garcia and Beau Flynn are the producers, with Doug Merrifield serving as executive producer. Disney’s JUNGLE CRUISE opens in U.S. theaters on July 24, 2020. #JungleCruise"
"-K0WSJaZaiU","Vanessa Bryant and Daughters Visit Kobe and Gianna Mural","2020-03-09T21:00:00.000Z","UCdtXPiqI2cLorKaPrfpKc4g","Entertainment Tonight","24","20.15.03","Kobe Bryant|VANESSA BRYANT|GIANNA BRYANT|cw|Entertainment Tonight|etonline|et online|celebrity|Hollywood|news|trending|et|et tonight|2020|Vanessa and kobe|vanessa bryant reaction|vanessa bryant kobe death|kobe bryant death|gianna bryant death|kobe mural","1647746","14253","658","1403","https://i.ytimg.com/vi/-K0WSJaZaiU/default.jpg","False","False","Vanessa changed her Instagram profile picture over the weekend, posing in front of a mural dedicated to her late husband and daughter.Exclusives from #ETonline :https://www.youtube.com/playlist?list=PLQwITQ__CeH2Y_7g2xeiNDa0vQsROQQgv"
"0E44DClsX5Q","Call of Duty®: Warzone - Official Trailer","2020-03-09T16:46:12.000Z","UC9YydG57epLqxA9cTzZXSeQ","Call of Duty","20","20.15.03","call of duty|cod|activision|warzone|battle royale|modern warfare|mw|fps|br|free|free to play|freecallofduty|free call of duty","3432287","153071","6840","14253","https://i.ytimg.com/vi/0E44DClsX5Q/default.jpg","False","False","Warzone.Free to play for everyone.Drop in tomorrow. Explore Verdansk, bring home the money in Plunder, or fight until no one else stands in your way in Battle Royale. #FreeCallofDutyFollow us for all the latest intel:Web: http://www.CallofDuty.com ;Facebook: http://facebook.com/CallofDuty and https://www.facebook.com/InfinityWard/ ;Twitter: http://twitter.com/CallofDuty and https://twitter.com/infinityward;Instagram: http://instagram.com/CallofDuty and https://www.instagram.com/infinityward/"
"r_nK51C9Mlw","Star Wars: The Clone Wars | Unfinished Buisness Clip | Disney+","2020-03-10T16:00:10.000Z","UCZGYJFUizSax-yElQaFDp5Q","Star Wars","24","20.15.03","[none]","675302","31914","259","2026","https://i.ytimg.com/vi/r_nK51C9Mlw/default.jpg","False","False","Jedi Mace Windu and Obi-Wan Kenobi lead an attack against the Separatist forceson Anaxes while the Bad Batch and Anakin Skywalker infiltrate an enemy starship to ensure aRepublic victory in “Unfinished Business,” an all-new episode of Star Wars: The Clone Wars this FRIDAY, March 13th on Disney+."
"sYLTNvie3sA","Lil Uzi Vert - Eternal Atake ALBUM REVIEW","2020-03-10T02:43:24.000Z","UCt7fwAhXDy3oNFTAzF2o8Pw","theneedledrop","10","20.15.03","album|review|music|reviews|indie|underground|new|latest|lyrics|full song|listen|track|concert|live|performance|update|the needle drop|anthony fantano|vlog|talk|discussion|music nerd|lil uzi vert|eternal atake|rap|hip hop|trap|pop|atlantic|i'm sorry|patek|p2|silly watch|lo mein|baby pluto|concept","557439","28070","20334","7517","https://i.ytimg.com/vi/sYLTNvie3sA/default.jpg","False","False","Listen: https://www.youtube.com/watch?v=6y4Ww4rKRSUFor all its conceptual pretense, Eternal Atake is little more than a run-of-the-mill trap album.More rap reviews: https://www.youtube.com/playlist?list=PLP4CSgl7K7ormBIO138tYonB949PHnNcP===================================Subscribe: http://bit.ly/1pBqGCNPatreon: https://www.patreon.com/theneedledropOfficial site: http://theneedledrop.comTND Twitter: http://twitter.com/theneedledropTND Facebook: http://facebook.com/theneedledropSupport TND: http://theneedledrop.com/support===================================FAV TRACKS: HOMECOMING, BUST ME, PRICES, VENETIALEAST FAV TRACK: POPLIL UZI VERT - ETERNAL ATAKE / 2020 / ATLANTIC / TRAP RAP4/10Y'all know this is just my opinion, right?"
"VZqttqSbvVY","Hilary Duff's Busy Mom Makeup Routine | Beauty Secrets | Vogue","2020-03-09T19:13:35.000Z","UCRXiA3h1no_PFkb1JCP0yMA","Vogue","26","20.15.03","beauty|women's lifestyle|how-to|how to|celebrity|hilary duff|* beauty|hillary duff interview|hillary duff vogue|hillary duff 2020|hillary duff makeup|hillary duff routine|hillary duff beauty|hillary duff beauty secrets|beauty secrets|hillary duff makeup routine|hillary duff beauty routine|hillary duff getting ready|hillary duff gets ready|vogue beauty secrets|hillary duff how to|hillary duff style|hillary duff fashion|model makeup|duff|vogue","1803714","76377","717","4284","https://i.ytimg.com/vi/VZqttqSbvVY/default.jpg","False","False","In this video, Lizzie McGuire alum and newlywed Hilary Duff explains how she manages to look polished while running after her two young kids.Shop Hilary Duff’s beauty routine:Ole Henriksen Dark Spot Toner: https://fave.co/38y2sFbNurse Jamie Uplift Massaging Beauty Roller: https://fave.co/3aDFvlsSoleil Toujours Organic Set & Protect Micro Mist SPF 30: https://fave.co/3aEETMgRen Clean Skincare Keep Young and Beautiful Firm and Lift Eye Cream: https://fave.co/39DyAIO                                                            Perricone MD No Makeup Foundation Serum SPF 20: https://fave.co/39CZHnsGlossier Stretch Concealer: https://glossier.79ic8e.net/o9M09Chantecaille Mermaid Eyeshadow in Sylvie: https://fave.co/2VXJeWNStila Shimmer & GLow Liquid Eye Shadow in Kitten: https://fave.co/38DurmZBenefit ka-Brow! Cream Gel Eyeshadow Color & Brush: http://bit.ly/3aF1QyZNudestix Nudies Tinted Blur Stick: https://fave.co/2VWJ4z9Laura Mercier Longwear Lip Liner in Chestnut: https://fave.co/2VZi566Antonym Cosmetics Certified Organic Baked Foundation: https://amzn.to/2W4LFa2Grande Cosmetics GrandeDRAMA Intense Thickening Mascara: https://fave.co/38De4XESaje Euphoric Goddess Face and Body Mist: https://fave.co/2IyWdqcWhen you buy something through our retail links, we may earn an affiliate commission. Still haven’t subscribed to Vogue on YouTube? ►► http://bit.ly/vogueyoutubesub ABOUT VOGUEVogue is the authority on fashion news, culture trends, beauty coverage, videos, celebrity style, and fashion week updates. Hilary Duff's Busy Mom Makeup Routine | Beauty Secrets | Vogue"
"ZCg4S5bHzWg","The Sanitizer Watch","2020-03-10T01:51:16.000Z","UCPcFg7aBbaVzXoIKSNqwaww","jacksfilms","23","20.15.03","Jacksfilms|Jack Douglass|YGS|YGS 100|YGS 50|The Best of Your Grammar Sucks|Your Grammar Sucks|YIAY|Yesterday I Asked You|Fidget Spinners|Emoji Movie|Kermit Sings|JackAsk|Jack Ask|Dubstep Solves Everything|Frozen 2|iPhone Parody|Apple Parody","535666","61828","543","3846","https://i.ytimg.com/vi/ZCg4S5bHzWg/default.jpg","False","False",""
"_w9yR_rBU0Y","Destiny 2: Season of the Worthy – Gameplay Preview","2020-03-10T13:58:15.000Z","UC52XYgEExV9VG6Rt-6vnzVA","destinygame","20","20.15.03","Destiny|destiny 2|shadowkeep|bungie|games|gaming|season of the worthy|Trials of Osiris|seraph towers|rasputin|Ana Bray|Zavala|xbox|xbox one|ps4|playstation|stadia|sony|google|microsoft|pc|steam","385915","17056","757","2334","https://i.ytimg.com/vi/_w9yR_rBU0Y/default.jpg","False","False","The developers at Bungie discuss Rasputin, Trials of Osiris, Seraph Towers, and more from Season of the Worthy. Your choices matter and will change Destiny forever as loose story threads are brought to a conclusion.Learn more: https://destinythegame.com/Seasonoftheworthy Buy Shadowkeep: bung.ie/BuyFOLLOW DESTINY:https://www.facebook.com/DestinyTheGamehttps://www.twitter.com/destinythegamehttps://www.instagram.com/destinythegamehttp://www.discord.gg/destinygameFOLLOW BUNGIE: Facebook: https://www.facebook.com/Bungie/Twitter: https://www.twitter.com/bungieInstagram: https://www.instagram.com/bungie/Dive into the free-to-play world of Destiny 2 to experience responsive first-person shooter combat, explore the mysteries of our solar system, and unleash elemental abilities against powerful enemies. Create your Guardian and collect unique weapons, armor, and gear to customize your look and playstyle. Experience Destiny 2’s cinematic story alone or with friends, join other Guardians for challenging co-op missions, or compete against them in a variety of PvP modes."
"fE2h3lGlOsk","ITZY WANNABE M/V","2020-03-09T09:00:00.000Z","UCaO6TYtlC8U5ttz62hTrZgg","jypentertainment","10","20.15.03","JYP Entertainment|JYP|ITZY|있지|ITZY Video|ITZY Yeji|ITZY Lia|ITZY Ryujin|ITZY Chaeryeong|ITZY Yuna|있지 예지|있지 리아|있지 류진|있지 채령|있지 유나|예지|리아|류진|채령|유나|Yeji|Lia|Ryujin|Chaeryeong|Yuna|ITZY BEHIND|ITZY VIDEOS|ITZY DEBUT|있지 데뷔|WANNABE|ITZY WANNABE|ITz ME|ITZY TEASER|있지 티저|WANNABE 티저|있지 뮤비 티저|WANNABE 뮤비 티저|ITZY MV TEASER|ITZY MV|M/V|TEASER|있지 컴백|ITZY COMEBACK|WANNABE MV|워너비 뮤비","54038829","1639598","67990","105824","https://i.ytimg.com/vi/fE2h3lGlOsk/default.jpg","False","False","ITZY WANNABE M/VFind ITZY IT'z ME onMelOn https://www.melon.com/song/detail.htm?songId=32445339Apple Music https://music.apple.com/us/album/1501233592Spotify https://open.spotify.com/album/2gertXS08whDTzBWfmewPO[ITZY Official] http://ITZY.jype.comhttps://www.youtube.com/c/ITZYhttp://www.facebook.com/OfficialITZYhttp://www.twitter.com/ITZYOfficialhttp://fans.jype.com/ITZY#ITZY #ITzME #WANNABECopyrights 2020 ⓒ JYP Entertainment. All Rights Reserved"
"mJMk_QDxZ28","Coronavirus: Italy now on complete lockdown | DW News","2020-03-10T11:31:42.000Z","UCknLrEdhRCp1aegoMqRaCZg","DW News","25","20.15.03","coronavirus|corona virus|virus outbreak|china virus|virus china|virus outbreak china|wuhan virus|wuhan|wuhan virus outbreak|china virus news|corona|coronavirus china|wuhan coronavirus|coronavirus outbreak|virus|china|wuhan lockdown|coronavirus italy|italy|coronavirus travel|coronavirus spread|coronavirus ukraine|coronavirus outside china|coronavirus update|coronavirus news","488329","3920","227","1999","https://i.ytimg.com/vi/mJMk_QDxZ28/default.jpg","False","False","Italy has expanded its response to the coronavirus by locking down the entire country. Italian Prime Minister Giuseppe Conte says that as of Tuesday morning, travel restrictions will apply to the whole of Italy, not just the north as was previously the case. Meanwhile, more than 9,000 people in Italy are infected with COVID-19 - and so far, more than 640 people have died. Subscribe: https://www.youtube.com/user/deutschewelleenglish?sub_confirmation=1For more news go to: http://www.dw.com/en/Follow DW on social media:►Facebook: https://www.facebook.com/deutschewellenews/►Twitter: https://twitter.com/dwnews►Instagram: https://www.instagram.com/dw_stories/Für Videos in deutscher Sprache besuchen Sie: https://www.youtube.com/channel/deutschewelle#Coronavirus #Covid19 #Italy"
"m0FMk2zUHA0","How Not to Remember Where You Parked Your Car - Key & Peele","2020-03-09T20:00:03.000Z","UCdN4aXTrHAtfgbVG9HjBmxQ","Key & Peele","23","20.15.03","Key & Peele|Key and Peele|Jordan Peele|Keegan-Michael Key|keey & peele|Key & Peele full episodes|key and peele show|mnemonic Device|complicated|forget|remember|parked|car|high five|sketch comedy|funny|funny video|comedy videos|funny jokes|funny clips|parking the car|parking garage|key and peele mnemonic|keegan michael key|nemonic device|menomic device|word games|wordplay|memory|jordan peel|key & peele episodes|funny videos 2020","1648988","54773","1011","1991","https://i.ytimg.com/vi/m0FMk2zUHA0/default.jpg","False","False","Two friends struggle to remember where they parked their car. About Key & Peele: Key & Peele showcases the fearless wit of stars Keegan-Michael Key and Jordan Peele as the duo takes on everything from Gremlins 2 to systemic racism. With an array of sketches as wide-reaching as they are cringingly accurate, the pair has created a bevy of classic characters, including Wendell, the players of the East/West Bowl and President Obama's Anger Translator. Subscribe to Comedy Central: https://www.youtube.com/channel/UCUsN5ZwHx2kILm84-jPDeXw?sub_confirmation=1Watch more Comedy Central: https://www.youtube.com/comedycentral Follow Key & Peele:Facebook: https://www.facebook.com/KeyAndPeele/Twitter: https://twitter.com/keyandpeeleWatch full episodes of Key & Peele: http://www.cc.com/shows/key-and-peeleFollow Comedy Central:Twitter: https://twitter.com/ComedyCentralFacebook: https://www.facebook.com/ComedyCentral/Instagram: https://www.instagram.com/comedycentral/#KeyandPeele"
"U3Wsv_x2AUY","REVIEWING YouTuber MAKEUP BRANDS!","2020-03-09T17:00:05.000Z","UC4qk9TtGhBKCkoWz5qGJcGg","Tati","26","20.15.03","YouTube|Beauty|Makeup|Tutorial|Review|blogger|Tati|Westbrook|GlamLifeGuru|how to|makeup tutorial|Beauty expert|drugstore|luxury|favorites|Best|cosmetics|Tati Westbrook|Tati Beauty|Halo Beauty|Makeup Review|New Makeup|Weird Makeup","928664","38799","1794","2925","https://i.ytimg.com/vi/U3Wsv_x2AUY/default.jpg","False","False","With so many creator-owned brands and collaborations, there certainly wasn't a lack of cool products to review!  There's so many more creator brands I want to put to the test, please make your requests in the comments below!  xo's ~ Tati 😇  SAVE w/ HALO DISCOUNT BUNDLES 🥝 » » » https://halobeauty.com/collections/bu...🦋 TATI BEAUTY MAKEUP  ✨ » » »  https://TatiBeauty.com ✔  C R E A T O R S   M E N T I O N E DJACLYN HILL https://www.youtube.com/user/Jaclynhill1ANGEL MERINO https://www.youtube.com/user/itsmacdaddyyCHRISTEN DOMINIQUE https://www.youtube.com/user/christendominique WEYLIE HOANG https://www.youtube.com/user/ilikeweylieCRISTINE DOMINIQUE https://www.youtube.com/user/simplynailogicalKATHLEEN FUENTES https://www.youtube.com/user/KathleenLightsMINDY MCKNIGHT https://www.youtube.com/user/CuteGirlsHairstylesCARLI BYBEL https://www.youtube.com/user/CarliBel55LAURA LEE  https://www.youtube.com/user/laura88leeCHLOE MORELLO https://www.youtube.com/user/ChloeMorelloSONA GASPARIAN https://www.youtube.com/user/MakeupBySonaNIKKIA JOY https://www.youtube.com/user/nikkiajoyGIGI LAZZARATO https://www.youtube.com/channel/UCzco9CewPf0F-SP1p6LhWrw/aboutMANNY GUTIERREZ https://www.youtube.com/user/MannyMua733ALLIE GLINES https://www.youtube.com/user/TheAllieGardiner✔  P R O D U C T S  M E N T I O N E DProduct List:JACLYN COSMETICS Accent Light Highlighter Palette // The Flash // $49ARTIST COUTURE Diamond Glow Powder // Illuminati // $27DOMINIQUE COSMETICS Latte 2 Palette // $42PHYSICIANS FORMULA Butter Collection x Weylie Hoang // $14.99HOLO TACO Flakie Holo Taco // $13LIGHTS LACQUER Grl Pwr // $9.50HAIRITAGE Lazy Day Light Dry Shampoo // $7.94HAIRITAGE Mask-Querade Transforming Hair Mask // $7.94IL MAKIAGE X CARLI BYBEL Waterproof Lipliner // Bybel // $15DOMINIQUE COSMETICS Cream Matte Nude Liquid Lipstick // Nude Kiss // $18DOMINIQUE COSMETICS Cream Matte Nude Liquid Lipstick // Babe // $18LAURA LEE LOS ANGELES Cabana Liquid Lipstick // $16LAURA LEE LOS ANGELES Mai Tai Liquid Lipstick // $16PIXI X CHLOE MORELLO Lip Icing // Bonbon // $14PERSONA 24hr Waterproof Eyeliner // Black // $14PERSONA 24hr Waterproof Eyeliner // Plum // $14NIKKIA JOY COSMETICS The Wispy Set // $35COLOURPOP X KATHLEEN LIGHTS So Jaded Shadow Palette // $39IPSY X GIGI GORGEOUS BrushLUNAR BEAUTY Strawberry Dream Color Palette // $48ALLIE GLINES Full Bag Collection // $84✔ S N A P C H A Thttps://www.snapchat.com/add/TatiWestbrook✔ I N S T A G R A Mhttp://instagram.com/glamlifeguru✔ T W I T T E Rhttp://twitter.com/#!/glamlifeguru✔ F A C E B O O Khttp://facebook.com/GlamLifeGuru✔ E M A I LTati@GlamLifeGuru.comFTC DISCLAIMER:  This video is Not Sponsored and there are no affiliate links.✔ WRITE TO ME HERETati Westbrook1905 Wilcox AveSuite #111Los Angeles, CA  90068All Rights Reserved © 2020, Tati Westbrook Hi I'm Tati Westbrook, thank you for watching, please be sure to check out my collection of makeup review videos where you'll find my best beauty tips, tricks and favorites on everything from top luxury cosmetics to my favorite drugstore makeup. Whether you're looking for a new product review, tutorial, beauty tip, haul or perhaps even a giveaway, I hope you enjoy watching."
"0HowhZH51pE","PART TWO: A Man Wants His Girlfriend to Sign a Prenup Before She Moves In","2020-03-09T23:00:00.000Z","UCdM8C3ufiI-i-I1XSugKVvg","The Real Daytime","24","20.15.03","the real|daytime|talk show|women|tamera mowry|adrienne bailon|loni love|jeannie mai|amanda seales|therealdaytime","210476","2887","182","813","https://i.ytimg.com/vi/0HowhZH51pE/default.jpg","False","False","Real fam, would you sign a prenup before moving in with someone or have them sign one?"
"wD79NZroV88","Why You Can't Buy Dasani Water in Britain","2020-03-09T16:00:17.000Z","UCBa659QWEk1AI4Tg--mrJ2A","Tom Scott","27","20.15.03","tom scott|tomscott|things you might not know|dasani|mineral water|bottled water|coca-cola|only fools and horses","1622745","75131","1104","4794","https://i.ytimg.com/vi/wD79NZroV88/default.jpg","False","False","Coca-Cola's brand of bottled water, Dasani, was a flop in the UK after the public realised it was just filtered tap water. But the story's a bit more complicated than it might seem. | Drinking Dasani with Ashens: https://www.youtube.com/watch?v=c6VhcpwFZJMThanks to Sally Le Page on camera! https://www.youtube.com/channel/UC9AUeAvdEVJfyS9rd9pvp8gI'm at https://tomscott.comon Twitter at https://twitter.com/tomscotton Facebook at https://facebook.com/tomscottand on Instagram as tomscottgo"
"J8x0ru91jlY","Wacky Mini Golfing - 10 Minute Power Hour","2020-03-09T21:00:01.000Z","UCXq2nALoSbxLMehAvYTxt_A","The Grumps","23","20.15.03","[none]","455140","31904","194","2635","https://i.ytimg.com/vi/J8x0ru91jlY/default.jpg","False","False","You asked for it! The boys hit up a classic mini golf location and get their putt putt on! CHECK OUT GOLF N' STUFF  ►► https://golfnstuff.com/MERCH ►► http://gamegrumps.com/merchClick to SUBSCRIBE ► http://bit.ly/GrumpSubscribe*********************************************Music from Stevia Sphere ► http://www.steviasphere.bandcamp.comMystery Sax Kevin MacLeod (incompetech.com)Licensed under Creative Commons: By Attribution 3.0 License*********************************************We have NEW MERCH every THURSDAY! Visit our WEBSITE every THURSDAY to check out the NEW items!►►► http://gamegrumps.com/merch*********************************************FACEBOOK ► https://www.facebook.com/GameGrumpsTWITTER ► https://www.twitter.com/gamegrumpsINSTAGRAM ► https://www.instagram.com/gamegrumps/WEBSITE ► http://gamegrumps.comGame Grumps are:Arin ► http://www.youtube.com/EgoraptorDanny ► http://www.youtube.com/NinjaSexParty#TheGrumps #MiniGolf #GolfNStuff"
"ojzD-34NBmM","Prince Harry and Meghan Complete Final Engagement as Senior Royals","2020-03-09T17:23:09.000Z","UCCvgLV2Ixb8KCemj-UtXZ-g","The Royal Family Channel","25","20.15.03","royals|royal|royal family|commonwealth service|Westminster abbey|queen|charles|camilla|harry|meghan|william|kate|sussex|harry and meghan|harry and meghan final engagement|harry and meghan final event|harry and meghan no longer working royals|no longer royals|duke and duchess of sussex|duke of sussex|duchess of sussex|meghan markle|what will harry and meghan do now|westminster abbey","1560108","9519","1179","4572","https://i.ytimg.com/vi/ojzD-34NBmM/default.jpg","False","False","The Duke and Duchess of Sussex have made their last public appearance as working members of the Royal Family.Prince Harry and Meghan joined the Queen and other senior royals at the Commonwealth Day service at Westminster Abbey on Monday afternoon.The couple have been carrying out a series of public appearances in the UK before stepping back as working royals. #PrinceHarry #MeghanMarkle #DuchessOfSussexReport by Hannah Barnett."
