video_id,title,publishedAt,channelId,channelTitle,categoryId,trending_date,tags,view_count,likes,dislikes,comment_count,thumbnail_link,comments_disabled,ratings_disabled,description
"iNl0U1KCPZQ","Putting Weird Things In A Guillotine (Test)","2020-03-12T10:00:07.000Z","UC4PooiX37Pld1T8J5SYT-SQ","Good Mythical Morning","24","20.15.03","gmm|good mythical morning|rhettandlink|rhett and link|mythical|rhett|mclaughlin|link|neal|season 17|s17|will it|taste test|Putting Weird Things In A Guillotine (Test)|furby|guillotine","1123182","34312","595","1926","https://i.ytimg.com/vi/iNl0U1KCPZQ/default.jpg","False","False","What happens when you put a Furby under a guillotine? We would really love to find out, that's why in today's video, we're putting weird things in a guillotine!  GMM #1708Note that today's content was recorded in advance of the US outbreak of COVID-19. Please excuse any reference that is no longer accurate or seemingly disrespectful or unhealthy due to general effects of the COVID-19 pandemic.Subscribe to GMM: https://www.youtube.com/goodmythicalmorning?sub_confirmation=1Listen to Josh and Nicole's newest food podcast episode, Are Boneless Wings Really Wings? https://youtu.be/6W-7yVVkKVkWatch today's GMMORE: https://youtu.be/ObjGR5SHqE8Click the bell icon so you'll know when we add a new episode!Want more GMM? Check out these playlists:Season 16 - https://www.youtube.com/playlist?list=PLJ49NV73ttrvCQhgIj1Ovt3g0PBlO18s2Will It? - https://www.youtube.com/playlist?list=PLJ49NV73ttrucP6jJ1gjSqHmhlmvkdZufTaste Tests! - https://www.youtube.com/playlist?list=PLJ49NV73ttrsUefw67wH_pnEJ5KwJZ7lNGet a copy of our novel, The Lost Causes of Bleak Creek @ http://www.bleakcreek.comPick up official GMM and Mythical merch at https://mythical.comand https://www.amazon.com/mythicalDon’t miss our weekly podcast, Ear Biscuits: https://applepodcasts.com/earbiscuitsJoin the Mythical Society: https://www.mythicalsociety.comFollow Mythical:Instagram: https://instagram.com/mythicalFacebook: https://facebook.com/mythicalTwitter: https://twitter.com/mythicalWebsite: https://mythical.comCheck Out Our Other Mythical Channels:Mythical Kitchen: https://youtube.com/mythicalkitchenRhett & Link: https://youtube.com/rhettandlinkGood Mythical MORE: https://youtube.com/goodmythicalmoreWant to send us something? https://mythical.com/contactSubmit your Wheel of Mythicality intro video here: http://bit.ly/GMMWheelIntroSUBMISSIONSIntro Animation by Dana Schechter https://www.danaschechter.com/Intro & Outro Music by Mark Byers http://www.markaholic.com/Supplemental Music from Extreme Production Music: https://www.extrememusic.com/Mic: ‘The Mouse’ by Blue Microphones https://www.bluemic.com/mouse/Get the GMM Set Gear!* Apple AirPort Extreme: https://amzn.to/2NnIvvk* Apple iPad Pro (12.9-inch, Wi-Fi, 64GB) - Space Gray (Latest Model) - MTEL2LL/A: https://amzn.to/2NnKXlw* Guardian Industrial Products DH-CP-4 3 Channel Rubber Cable Ramp (Straight): https://amzn.to/2NdshoR* Cartoni Focus HD Fluid Head with 3 Tube Ultra-Light Tripod, Mid-Level Spreader and Soft Case - Black: https://amzn.to/2X4i7X8* ARRI SkyPanel S60-C LED Softlight (Blue/Silver, Edison): https://amzn.to/2YgM3km* Chef-Master 90050 Professional Heat Lamp, Silver: https://amzn.to/2Xa1Wwr* Samsung UN40H5003 40-Inch 1080p LED TV (2014 Model): https://amzn.to/2NdMU4e* Sony LMDA170 17 Production Video LCD Monitor, 16:9 Native Aspect Ratio, 1080p Resolution: https://amzn.to/2YlB9tH* Behringer Xenyx 1002 Premium 10-Input 2-Bus Mixer with XENYX Mic Preamps and British Eqs: https://amzn.to/2Yeeqzl* Elgato Game Capture Card HD60 S - Stream and Record in 1080p60, for PlayStation 4, Xbox One & Xbox 360 (Renewed): https://amzn.to/2NdOBP6* Pyle Universal Speaker Stand Mount Holder - Heavy Duty Tripod w/ Adjustable Height from 40” to 71” and 35mm Compatible Insert - Easy Mobility Safety PIN and Knob Tension Locking for Stability PSTND2: https://amzn.to/2JcCpce* JBL EON612 Portable 12 2-Way Multipurpose Self-Powered Sound Reinforcement: https://amzn.to/2Ndluvm* Bolt 500 XT 3G-SDI/HDMI Wireless TX/RX: https://amzn.to/2J1OeSk* Voigtlaender 17,5/0,95 Nokton 17.5 mm-17.5 mm Lens: https://amzn.to/2JjUCEP* Blackmagic Design Micro Converter SDI to HDMI (with Power Supply) BMD-CONVCMIC/SH/WPSU: https://amzn.to/2J6iw6y* Panasonic H-HSA35100 F2.8 II ASPH 35-100mm Mirrorless Micro Four Thirds Mount POWER Optical I.S. LUMIX G X VARIO Professional Lens: https://amzn.to/2RAhIul* PANASONIC LUMIX Professional 12-35mm Camera Lens G X VARIO II, F2.8 ASPH, Dual I.S. 2.0 with Power O.I.S., Mirrorless Micro Four Thirds, H-HSA12035 (2017 Model, Black): https://amzn.to/2J9WH5S* Decimator Design DMON-12S | 12 Channel Multi Viewer with HDMI SDI Outputs: https://amzn.to/2J9Xkwg* Decimator MD-HX HDMI and SDI Cross Converter with Scaling & Frame Rate Conversion: https://amzn.to/2Ymj52c* PANASONIC LUMIX GH4 Body 4K Mirrorless Camera, 16 Megapixels, 3 Inch Touch LCD, DMC-GH4KBODY (USA Black): https://amzn.to/2WZjlD6* Blue Microphones Mouse Microphone Kc: https://amzn.to/2Ybu12I"
"JyGO22pRyDk","UFC President Dana White Addresses Coronavirus Impact on UFC Events","2020-03-13T02:08:19.000Z","UCvgfXK4nTYKudb0rFR6noLA","UFC - Ultimate Fighting Championship","17","20.15.03","ufc|president|dana|white|addresses|coronavirus|update|live|events|brazil|brasilia|london|portland|columbus|mma|ultimate fighting championship","1540747","60892","1476","8727","https://i.ytimg.com/vi/JyGO22pRyDk/default.jpg","False","False","UFC President Dana White addresses the ongoing Coronavirus epidemic and its impact on upcoming UFC live events.Subscribe to get all the latest UFC content: http://bit.ly/2uJRzRRExperience UFC live with UFC FIGHT PASS, the digital subscription service of the UFC. Visit https://ufcfightpass.com/To order UFC Pay-Per-Views on ESPN+, visit https://bit.ly/2vNIBE8 (U.S. only)To order UFC Pay-Per-Views, visit http://welcome.ufcfightpass.com/#PPV (Non U.S.)Connect with UFC online and on Social:Website: http://www.ufc.comTwitter: http://www.twitter.com/ufcFacebook: http://www.facebook.com/ufcInstagram: http://www.instagram.com/ufcSnapchat: UFCPeriscope: http://Periscope.tv/ufcConnect with UFC FIGHT PASS on Social:Twitter: http://www.twitter.com/ufcfightpassFacebook: http://www.facebook.com/ufcfightpassInstagram: http://www.instagram.com/ufcfightpass"
"QYPKXRD_zyM","FINDING OUT WHO OUR BABY BOY LOOKS LIKE!!! **4D ULTRASOUND**","2020-03-12T01:58:38.000Z","UCWwWOFsW68TqXE-HZLC3WIA","The ACE Family","22","20.15.03","the ace family finding out who our baby boy looks like|ace family finding out who our baby boy looks like|finding out who our baby boy looks like|finding out who our baby looks like|4d ultrasound|4d baby ultrasound|baby 4d ultrasound|baby ultrasound|the ace family|ace family|ace family baby ultrasound|ace family baby","2729575","146165","3596","12389","https://i.ytimg.com/vi/QYPKXRD_zyM/default.jpg","False","False","Finding out who our baby boy looks like!!! **4D Ultrasound**PURCHASE NEW ACE FAMILY CUPS HERE: http://shopacefamily.comSpotlight IG: Spotlightbaby4dJOIN THE ACE FAMILY & SUBSCRIBE: http://bit.ly/THEACEFAMILY LAST VIDEO: https://www.youtube.com/watch?v=hqp7K4ipr1s*TURN ON OUR POST NOTIFICATIONS FOR SHOUTOUTS IN OUR VIDEOS****BUSINESS INQUIRIES : INFO.THEACEFAMILY@GMAIL.COMMAKE SURE YOU LIKE, COMMENT, SHARE & SUBSCRIBE TO OUR YOUTUBE CHANNEL AND FOLLOW US ON OUR FAMILY ADVENTURES!WATCH MORE VIDEOS!!! VLOGS: https://youtube.com/playlist?list=PLq...PRANKS: https://youtube.com/playlist?list=PLq...CHALLENGES: https://youtube.com/playlist?list=PLq...POPULAR VIDEOS: https://youtube.com/playlist?list=PLq...LATEST VIDEOS: https://youtube.com/playlist?list=PLq... STALK US :)Catherine's Instagram: https://www.instagram.com/catherinepaiz/Catherine's Twitter: http://twitter.com/catherinepaizCatherine's SnapChat: Catherinepaiz"
"dtjEK2nB_RY","Rebuilding The Worlds Biggest Forklift Part 2","2020-03-12T15:26:14.000Z","UCwO_xoYm2vjhu4kZSxFO5mA","goonzquad","26","20.15.03","rebuilt|wrecked|salvaged|rebuilding the worlds biggest forklift|rebuilding a salvaged forklift|rebuilding an old forklift|goonzquad forklift|goonzquad|rebuilding a wrecked forklift|copra build|copart rebuild|restoring an old forklift","848086","37538","743","4501","https://i.ytimg.com/vi/dtjEK2nB_RY/default.jpg","False","False","This massive forklift is going to be a new challenge for us but I think we will definitely figure it out! The very first thing that we want to do is completely service this beast so we can immediately put it to work. Since this lift goes back to 1985 we're sure its going to need a good tune up to be back in business. We are super excited to take you guys along this journey and learn a lot in the process as well. This is going to be epic so be sure to stay tuned! Thanks For Watching!!!-GOONZQUAD T-SHIRTS!!!:  https://goonzquad.com-Instagram: https://www.instagram.com/goonzquad/-Email: goonzquadteam@gmail.com-P.O. Box 37  Rossville,GA 30741Music Credits:Song: AWN - We KnowMusic provided by Vlog No Copyright Music.Creative Commons - Attribution-ShareAlike 3.0 UnportedVideo Link: https://youtu.be/9jw3QO49pFoSong: Dipcrusher - Islands (Vlog No Copyright Music)Music provided by Vlog No Copyright Music.Video Link: https://youtu.be/CpFneq3zIt4Blue by Roa Music https://soundcloud.com/roa_music1031Creative Commons — Attribution 3.0 Unported  — CC BY 3.0 Free Download / Stream: https://bit.ly/blue-roa-music Music promoted by Audio Library https://youtu.be/QaDf_k7rdKQ Lioness (Instrumental) by DayFox https://soundcloud.com/dayfoxFree Download / Stream: https://bit.ly/lioness-instrumentalMusic promoted by Audio Library https://youtu.be/ZATMh49j49MSong: Niya - A Finale (Vlog No Copyright Music)Music provided by Vlog No Copyright Music.Video Link: https://youtu.be/1sXdoIECpukA Magical Journey Through Space by Leonell Cassio https://soundcloud.com/leonellcassioCreative Commons — Attribution-ShareAlike 3.0 Unported — CC BY-SA 3.0Free Download / Stream: https://bit.ly/a-magical-journey-thro...Music promoted by Audio Library https://youtu.be/DRwYhxVNwzUSong: Erik Lund - Summertime (Vlog No Copyright Music)Music promoted by Vlog No Copyright Music.Video Link: https://youtu.be/E338aF6QHu8Song: Thomas Gresen - Pretty Lies (Vlog No Copyright Music)Music provided by Vlog No Copyright Music.Video Link: https://youtu.be/i_Fya3uP8WASong: MusicbyAden - Dusk (Vlog No Copyright Music)Music provided by Vlog No Copyright Music.Video Link: https://youtu.be/je6iwUdvQD4Song: Thomas Gresen - Let Me FallMusic provided by Vlog No Copyright Music.Creative Commons — Attribution 3.0 Unported  — CC BY 3.0 Video Link: https://youtu.be/FZytqehKXZg"
"sSdMX8AWurI","I Challenged an Actual SWAT Team to Camo Hide and Seek!","2020-03-10T21:07:21.000Z","UC70Dib4MvFfT1tU6MqeyHpQ","Preston","24","20.15.03","funny|challenge|family|comedy|preston|brianna","8552979","294371","17069","11940","https://i.ytimg.com/vi/sSdMX8AWurI/default.jpg","False","False","I Challenged an Actual SWAT Team to Camo Hide and Seek! with Preston 👊❤️ FRIENDS!🡆 @Brianna 👀 FOLLOW ME HERE!🡆 TikTok - https://www.tiktok.com/@preston🡆 Instagram - https://instagram.com/realtbnrfrags🡆 Twitter - https://twitter.com/Preston👕 Get your merch below!🡆 http://www.prestonsstylez.com/ 🡆 https://royallyb.com🐲 Buy FLOOP Here! 🡆 https://amzn.to/37uLpV6🎮 Join my Fan Discord! 🡆 http://discord.gg/Preston------------------------------Additional music provided by Epidemic SoundClick here for a free trial! 🡆 http://share.epidemicsound.com/TBNR"
"XZS8UXevgkw","Chris Harrison on What Happened After Cameras Stopped Rolling on Wild ‘Bachelor’ Finale","2020-03-11T22:42:01.000Z","UCVr-TwiGNnveWyOouIyz2fQ","extratv","24","20.15.03","chris harrison|renee bargh|the bachelor|the bachelorette|bachelor nation|bachelor in paradise|reality tv|reality television|reality tv shows|relationships|season finales|shocking finales|peter weber|madison prewett|hannah ann sluss|dating shows|breakups|barbara weber|peter weber sr.|drama|going overboard|over the top|mean moments|mothers and sons|engagements|getting engaged|breaking off engagements|breaking things off|viral moments|hurtful","530781","3775","215","1176","https://i.ytimg.com/vi/XZS8UXevgkw/default.jpg","False","False","Chris Harrison was with “Extra’s” Renee Bargh Wednesday morning, fresh off Peter Weber’s wild “Bachelor” finale.Harrison said he is still trying to figure out what happened himself, after the episode showed Hannah Ann and Peter breaking up, then Peter trying to patch things up with Madison. It all went down to the dismay of Weber’s mother Barb, who made it clear she doesn't condone their relationship."
"cZFhjMQrVts","How Serious is the Coronavirus? Infectious Disease Expert Michael Osterholm Explains | Joe Rogan","2020-03-10T19:30:00.000Z","UCnxGkOGNMqQEUMvroOWps6Q","JRE Clips","22","20.15.03","Joe Rogan|JRE|Joe Rogan Experience|JRE Clips|PowerfulJRE|Joe Rogan Fan Page|Joe Rogan Podcast|podcast|MMA|Joe Rogan MMA Show|UFC|comedy|comedian|stand up|funny|clip|favorite|best of","18561385","254190","9312","49514","https://i.ytimg.com/vi/cZFhjMQrVts/default.jpg","False","False","Taken from JRE #1439 w/Michael Osterholm:https://youtu.be/E3URhJx0NSw"
"gP767-3IiJY","Highballing Strangers on the Internet & ACTUALLY Paying for It...","2020-03-11T20:51:48.000Z","UCilwZiBBfI9X6yiZRzWty8Q","FaZe Rug","24","20.15.03","faze rug|rug|rugfaze|fazerug|highball|highballing|highballing strangers|highballed|highball people|highballing strangers then actually paying for it|highball internet|highballing internet|highballing strangers on the internet and actually paying for it","2112973","107862","2435","5715","https://i.ytimg.com/vi/gP767-3IiJY/default.jpg","False","False","THAT WAS SO FUNNYI highballed people that were selling used items and then actually met up with them and payed for it.. They were so confused!!• GET ME TO 15,000,000 SUBSCRIBERS ► http://bit.ly/SubToRugOriginal Video by Ryan Trahan:https://youtu.be/wVcocXNYVK0Follow me on my Social Media to stay connected!Twitter ► https://twitter.com/FaZeRugInstagram ► https://www.instagram.com/fazerug/Facebook ► https://www.facebook.com/RealFaZeRug/Snapchat ► thefazerug (Add me to see how I live my daily life) :DIf you read this far down the description I love you"
"QmzqhhKlARk","PSG 2-0 Borussia Dortmund (3-2 agg.): Champions League Recap with Goals, Highlights and Best Moments","2020-03-11T22:30:23.000Z","UClvow1RFSyeh5CRwRB_m5sA","B/R Football","17","20.15.03","Borussia Dortmund|Paris Saint-Germain|Paris Saint-Germain vs. Borussia Dortmund|Neymar PSG|Neymar Dortmund|Neymar Haaland|PSG 2-0 Dortmund|sp:ty=high|sp:dt=2020-03-11T20:00:00Z|sp:st=soccer|sp:li=chlg|sp:ti:home=PRSG|sp:ti:away=DOR","699191","7539","239","1416","https://i.ytimg.com/vi/QmzqhhKlARk/default.jpg","False","False","Full highlights as PSG turn around a first leg deficit with a 2-0 win over Borussia Dortmund at an empty Parc des Princes to advance in the Champions League."
"NvBshoIkxLc","Liverpool vs Atletico Madrid (2-3 AET) | UEFA Champions League highlights","2020-03-11T23:40:22.000Z","UC4i_9WvfPRTuRWEaWyfKuFw","BT Sport","17","20.15.03","Liverpool|Atletico|Liverpool vs Atletico|Liverpool 2-3 Atletico|highlights|Champions League|football|Morata|Marcos Llorente|Klopp|Simeone|all goals|BT Sport|sp:ty=high|sp:dt=2020-03-11T20:00:00Z|sp:st=soccer|sp:li=chlg|sp:ti:home=LIV|sp:ti:away=ATLM","6345794","88288","3421","11320","https://i.ytimg.com/vi/NvBshoIkxLc/default.jpg","False","False","Liverpool crash out of the Champions League after a rare Anfield defeat at the hands of Atletico Madrid.Subscribe to our YouTube channel for the best videos from BT Sport  ➡️ http://bit.ly/17YTeL5Subscribe to our Boxing YouTube channel ➡️ http://po.st/NoFilterYTTwitter: http://twitter.com/btsportFacebook: http://www.facebook.com/btsportInstagram:http://instagram.com/btsportWebsite: http://sport.bt.com"
"Ut1ZF18LIBA","TELLING MY BOYFRIEND IM PREGNANT!!! **EMOTIONAL REACTION*","2020-03-11T23:32:04.000Z","UCSmUMOEPlAfAzbXIVuXso2w","Through Our Eyes","24","20.15.03","[none]","1026011","61369","1329","2228","https://i.ytimg.com/vi/Ut1ZF18LIBA/default.jpg","False","False","This video was shot on 11/1/2019!! We waited to upload this for the perfect time!Much love,Ryan, Leslie, Bellamy and Tiny Peanut:)-----------------------------------------------------------------------------------------------------------------------FOLLOW US ON OUR PATH & SUBSCRIBE: https://www.youtube.com/throughourseyes*TURN ON OUR POST NOTIFICATION FOR SHOUTOUTS IN THE VIDEOS*LAST VIDEO: https://www.youtube.com/watch?v=8VbF9....ALWAYS LIKE, COMMENT, SHARE & SUBSCRIBE TO OUR YOUTUBE CHANNEL SO YOU CAN SEE LIFE THROUGH OUR EYES!FOLLOW US!!Ryan’s instagram: @jbuddhaRyan’s snapchat: @thejbuddhaEmail: Throughryanseyes@gmail.comLeslie's IG: lesliehernaandez"
"_nLhbKmLdSc","Hannah Ann: ‘Things Weren’t Adding Up’ With Peter Weber","2020-03-11T19:41:21.000Z","UChnGFN2LRHBq-0PM6dOaq5A","Bachelor Nation","24","20.15.03","[none]","366787","2359","164","265","https://i.ytimg.com/vi/_nLhbKmLdSc/default.jpg","False","False","Hannah Ann Sluss opens up to Rachel Lindsay and Becca Kufrin about why she showed up to Peter Weber’s proposal in Australia and how their relationship changed once “The Bachelor” season began."
"H7akPKxwUto","Peter Weber's Parents Don't Think It'll Work Out with Madison - The Bachelor","2020-03-11T02:22:36.000Z","UCVc-qp-0L4zjR_QUEr0SAHw","Bachelor Nation on ABC","24","20.15.03","bachelor|dating|bachelorettes|house|love|fail|succeed|relationship|work out|peter weber|barbara weber|peter's mom|peter's dad","2026461","10667","3871","6506","https://i.ytimg.com/vi/H7akPKxwUto/default.jpg","False","False","As Madison and Peter say that they have a long road ahead, but they're willing to do the work, Peter's parents think it'll be harder than they think. Peter's mother, Barbara, says that only Peter is compromising here, and that this relationship simply won't work out. Peter's father seems to agree. From 'Season Finale, Part 2,' season 24, episode 12 of The Bachelor. Watch The Bachelor 2020 MONDAY 8|7c on ABC, streaming, on demand, and Hulu."
"G_Lhkhxl8BU","ITZY WANNABE Dance Practice","2020-03-11T15:00:04.000Z","UCDhM2k2Cua-JdobAh5moMFg","ITZY","24","20.15.03","JYP Entertainment|JYP|ITZY|있지|ITZY Video|ITZY Yeji|ITZY Lia|ITZY Ryujin|ITZY Chaeryeong|ITZY Yuna|있지 예지|있지 리아|있지 류진|있지 채령|있지 유나|예지|리아|류진|채령|유나|Yeji|Lia|Ryujin|Chaeryeong|Yuna|ITZY VIDEOS|ITZY DEBUT|있지 데뷔|ITZY MV|WANNABE MV|ITZY WANNABE MV|IT'z WANNABE JACKET|ITZY SHOWCASE|ITZY IT'z ME|ITZY WANNABE|WANNABE|IT'z ME|ITZY COMEBACK|wannabe behind","6772955","409361","6257","13929","https://i.ytimg.com/vi/G_Lhkhxl8BU/default.jpg","False","False","ITZY WANNABE Dance PracticeFind ITZY IT'z ME onMelOn https://www.melon.com/song/detail.htm?songId=32445339Apple Music https://music.apple.com/us/album/1501233592Spotify https://open.spotify.com/album/2gertXS08whDTzBWfmewPO[ITZY Official] http://ITZY.jype.comhttps://www.youtube.com/c/ITZYhttp://www.facebook.com/OfficialITZYhttp://www.twitter.com/ITZYOfficialhttp://fans.jype.com/ITZY#ITZY #ITzME #WANNABECopyrights 2020 ⓒ JYP Entertainment. All Rights Reserved"
"n0nbEpfY9Nc","99% of people CANT guess THESE (Emoji)","2020-03-10T23:05:36.000Z","UCke6I9N4KfC968-yRcd5YRg","SSundee","20","20.15.03","[none]","2440560","255391","6639","12063","https://i.ytimg.com/vi/n0nbEpfY9Nc/default.jpg","False","False","Today we try and SOLVE These emoji questions!🔔 Subscribe & click the bell!  https://www.youtube.com/user/SSundee?sub_confirmation=1👍 Hit the Thumbs Up if you liked this video! 🤖 My Friends! 🤖@Nicovald ❗️ Follow Me! ❗️Twitter: https://www.twitter.com/SSundeeDiscord: https://discord.gg/SSundeeInstagram: https://instagram.com/ssundeeytFacebook:  https://www.facebook.com/pages/SSundee/200010033358843👨🏻‍🍳 Awesome Video Editor ► Russellhttps://www.youtube.com/russelledits👨🏼‍🎨 Awesome Thumbnail Maker ► Flashhttps://www.youtube.com/channel/UCLy01oVLarj7RNQm52jnGKw🎶 Music by Ninety9 ► LivesTobu - Such FunVideo Link: https://www.youtube.com/watch?v=d3Oc26AFDdUChannel: https://99l.tv/SubscribeDownload the album! https://99l.tv/Levelup-iThanks for watching!"
"JJIsmDhzoD0","Conan Shares Coronavirus Tips With His Staff - CONAN on TBS","2020-03-11T03:38:53.000Z","UCi7GJNg51C3jgmYTUwqoUXA","Team Coco","23","20.15.03","Conan O'Brien|Conan|Conan (TV Series)|TBS (TV Channel)|Team Coco","2932658","74423","3405","4545","https://i.ytimg.com/vi/JJIsmDhzoD0/default.jpg","False","False","CONAN Highlight: Conan writes a new hand washing song and removes his office’s biggest source of contamination.More CONAN @ http://teamcoco.com/videoTeam Coco is the official YouTube channel of late night host Conan O'Brien, CONAN on TBS & TeamCoco.com. Subscribe now to be updated on the latest videos: http://bit.ly/W5wt5DFor Full Episodes of CONAN on TBS, visit http://teamcoco.com/videoGet Social With Team Coco:On Facebook: ‪https://www.facebook.com/TeamCoco‬On Google+: https://plus.google.com/+TeamCoco/On Twitter: http://twitter.com/TeamCocoOn Tumblr: http://teamcoco.tumblr.comOn YouTube: http://youtube.com/teamcocoFollow Conan O'Brien on Twitter: http://twitter.com/ConanOBrien"
"SoWSuxBy6oo","Do All Autistic People Think The Same?","2020-03-11T19:45:02.000Z","UCJjSDX-jUChzOEyok9XYRJQ","Jubilee","24","20.15.03","jubilee|jubilee media|jubilee project|live deeper|blind devotion|love language|middle ground|spectrum|autism|autism awareness|do all autistic people think the same|do all people with autism think the same|autism spectrum","1365349","61904","1108","9114","https://i.ytimg.com/vi/SoWSuxBy6oo/default.jpg","False","False","Our first apparel drop of 2020 is here! NEW humangood collection SURFACE LEVEL - pre-orders open NOW! 👉https://humangoodla.com 👈Follow us on INSTAGRAM: 👉https://www.instagram.com/jubileemedia/ 👈SUBSCRIBE for more! http://bit.ly/SUBSCRIBEjubilee Be in a Jubilee video: http://bit.ly/JubileeCastingAre you a loyal Jubilee fan? Join our Facebook group: https://www.facebook.com/groups/407942859721012/| ABOUT |We believe in the power of empathy for human good. Ultimately, we aim to inspire people to EMBRACE EMPATHY.| SOCIAL |Jubilee Facebook: https://www.facebook.com/jubileemediaJubilee Instagram: https://www.instagram.com/jubileemedia/Jubilee Twitter: https://www.twitter.com/jubileemediaJubilee Website: https://www.jubileemedia.comFEATURING:Jai - https://www.instagram.com/lunalovejai/Joseph - https://www.instagram.com/onlysmithalive/Josiah - https://www.instagram.com/siahscroggs/Shaina - https://www.instagram.com/runawaygerm/Yoni - https://www.instagram.com/yoni_yasss/For brands interested in partnering with Jubilee, email us:hello@jubileemedia.comHelp us caption & translate this video!https://amara.org/v/C0NTP/"
"tej_6X3kZOw","Fredo Bang - Waitin 4 (Official Music Video)","2020-03-10T23:00:10.000Z","UC8FHFLWe9KkG0eoxPMIgcpg","Fredo Bang","10","20.15.03","Fredo Bang|Fredo|Bang|Waitin 4|Waiting 4|Waitin|Yo Slime|Waitin For|Hip-Hop|Hip hop|Rap|Louisiana Rap|Rapper|Viral Rap Video|Viral Rap|Viral|2020 Rapper|XXL Rapper|Oouuhh|Father|Rap Music Video|Baton Rouge Rap|TBG|Bang Biz|BangBiz|Box Freestyle|The Box Freestyle|Bang Biz Ent|Bang Man|Da Real Gee Money|Gee Money|Cleezy5|Cleezy 5|Cleezy|Yoshi|FYP","738212","31399","1081","3166","https://i.ytimg.com/vi/tej_6X3kZOw/default.jpg","False","False","MOST HATED Coming Soon.https://instagram.com/fredobanghttps://www.facebook.com/fredobangbiz/https://twitter.com/fredobangDirected by: ShotByDemarcusTV https://www.instagram.com/shotbydemar...2020 Bang Biz Ent. LLC"
"fFAteIp0UjA","Resumen y Goles | América 3 - 0 Atlanta | CONCACAF Champions - 4tos Ida | TUDN","2020-03-12T05:22:42.000Z","UCSo19KhHogXxu3sFsOpqrcQ","TUDN USA","17","20.15.03","Televisa|Univisión|televisa deportes|Univisión deportes|soccer|deportes|TUDN|TUDN USA|TUDN México|futbol|Liga Mx|CONCACAF|Concachampions|highlights|America vs Atlanta|America concachampions|Atlanta concachampions|Piojo Herrera|Piojo|Memo Ochoa|Paul Aguilar|Federico Viñas|Viñas|Sebastian Cordova|Cordova|Renato Ibarra|Gol de Henry Martin|Gol de Leo Suarez|Gol de Bruno Valdez|Goles xde America|Resumen America vs Atlanta|Resumen","309178","2100","125","287","https://i.ytimg.com/vi/fFAteIp0UjA/default.jpg","False","False","¡Las Águilas con un pie en semifinales de la Concachampions!. Liquidaron al Atlanta United en el partido de ida y se perfilan a las últimas instancias del torneo de la Concacaf.Síguenos en nuestras redes sociales:https://www.facebook.com/tudnusa/https://www.instagram.com/tudnusa/https://twitter.com/TUDNUSASitio Web: https://www.tudn.com/TUDN USA te ofrece la cobertura más completa del mundo deportivo con lo mejor del fútbol mexicano, de Estados Unidos y del mundo, boxeo, UFC, las grandes personalidades del deporte y mucho más.#CONCACAF #America #Atlanta"
