video_id,title,publishedAt,channelId,channelTitle,categoryId,trending_date,tags,view_count,likes,dislikes,comment_count,thumbnail_link,comments_disabled,ratings_disabled,description
"nSLY-_eIQTs","Recovering a Truck Stuck in the MUD.","2020-02-10T02:34:11.000Z","UChRlaISXbl2gECFAmDzxgzg","Westen Champlin","2","20.11.02","mud|stuck|mudding|diesel|old truck|cummins|restore|30 years|westen|dodge ram|ram|towing|ram cummins|powerstroke|7.3l powerstroke|westen champlin","208787","15460","230","605","https://i.ytimg.com/vi/nSLY-_eIQTs/default.jpg","False","False","So our friend got his truck stuck in the mud and we helped. Also first gen Cummins things..Follow me on Instagram: https://www.instagram.com/westengwFacebook:https://www.facebook.com/westengw"
"-X-p5C4SLVo","Solar Orbiter Launch to Spot the Sun","2020-02-10T06:16:23.000Z","UCLA_DiR1FfKNvjuUpBHmylQ","NASA","28","20.11.02","[none]","308549","7518","309","495","https://i.ytimg.com/vi/-X-p5C4SLVo/default.jpg","False","False","Get ready for liftoff to the Sun! 🚀Solar Orbiter, a collaboration between European Space Agency and NASA, is launching Sunday, Feb. 9, to study the inner workings of our nearest star. Tune in for launch coverage starting at 10:30 p.m. on Sunday, Feb. 9 to see liftoff, currently targeted for 11:03 p.m. EST.More info: https://go.nasa.gov/2SiKpNn"
"vF_bMn-Aj2w","Song Association Game with my Sis #funnyaf","2020-02-09T00:46:00.000Z","UC3EFKdXAU99j3ppGgvTz7XQ","Bretman Rock","22","20.11.02","[none]","3229398","194626","2956","9379","https://i.ytimg.com/vi/vF_bMn-Aj2w/default.jpg","False","False","Please give it a thumbs up and share this video! ------------------------------------------------------------------------------- AFFILIATION/DISCOUNT CODES -Morphe - 10% off entire purchasehttps://www.morphebrushes.comCode: BretmanRockOfra Cosmetics: Code: BretmanRockOfracosmetics.com Nubounsom Lashes - 20% entire purchasehttps://www.nubounsom.comCode: Bretman Lilly Lashes - 10% off entire Purchasehttps://www.lillylashes.comCode: BretmanWhite With Style - $28 for any whitening kitshttps://www.whitewithstyle.comLAGirlUsa.comCode: BretmanRock10 for 10% off_____________________- KEEP IN TOUCH - Website | BretmanRock.comInstagram | @Bretmanrock - http://instagram.com/bretmanrock/Twitter | @BretmanRock - https://twitter.com/bretmanrockSnapchat | @BretmanRockTumblr | bretmanrock.tumblr.comFacebook | The Bretman RockEmail/Business | Bretmanpromo@gmail.com"
"L4nQeJ46AwQ","Querétaro - América [1-2] | GOLES | Jornada 5 | Liga MX","2020-02-10T02:19:21.000Z","UCUf4RLsG_TsjinvtL2jT-VA","FOX Sports MX","17","20.11.02","FOX Sports MX|Liga MX|liga mexicana|futbol mexicano|goles futbol mexicano|goles liga mx|Fox Sports|goles|show de goles|golazos|liga de mexico|highlights|jornada 5|1-2|queretaro|america|club america|queretaro america|goles queretaro america|queretaro 1 america 2|goles ibargüen|gol nahuelpan|aguilas|gallos blancos|sp:ty=high|sp:dt=2020-02-10T00:00:00Z|sp:st=soccer|sp:li=fmf|sp:ti:home=QRO|sp:ti:away=AME","1186294","7323","666","1046","https://i.ytimg.com/vi/L4nQeJ46AwQ/default.jpg","False","False","Club América se impuso por 2-1 ante Querétaro en el partido disputado por jornada 5 de la Liga MX. En un partido muy entretenido en el Estadio Corregidora, las Águilas quedaron con la victoria gracias al doblete marcado por Andrés Felipe Ibargüen. El descuento de los Gallos Blancos lo marcó Ariel Nahuelpán. Revive los goles y lo mejor del partido resumen de FOX Sports.-SUSCRÍBETE a nuestro canal  https://bit.ly/2CuvmcVVISITA nuestro sitio web http://www.foxsportsla.comSÍGUENOS en nuestras redes  - FACEBOOK: https://www.facebook.com/foxsportsla/- TWITTER: https://twitter.com/FOXSportsMX- INSTAGRAM: https://www.instagram.com/foxsportsmx"
"3T-KR08kqxk","JAZZ at ROCKETS | FULL GAME HIGHLIGHTS | February 9, 2020","2020-02-10T02:40:00.000Z","UCWJ2lWNubArHWmf3FIHbfcQ","NBA","17","20.11.02","sp:ty=high|sp:dt=2020-02-10T00:00:00Z|sp:st=basketball|sp:li=nba|sp:ti:home=HOU|sp:ti:away=UTA|Full Game Recap|Full Game Highlights|NBA|Basketball|Pass|Assist|Dunk|Jump Shot|Buzzer Beater|Tissot","747330","6360","275","1358","https://i.ytimg.com/vi/3T-KR08kqxk/default.jpg","False","False","JAZZ at ROCKETS | FULL GAME HIGHLIGHTS | February 9, 2020Bojan Bogdanovic knocked down a game-winning 3PM from the top of the key at the final buzzer to lift the Jazz over the Rockets, 114-113, in Houston. Jordan Clarkson recorded a team-high 30 PTS for the Utah, while Russell Westbrook tallied 39 PTS, 6 REB and 4 AST for the Rockets.Catch Monday's action on NBA TV: Sacramento Kings at Milwaukee Bucks, 8:00 pm/et & Phoenix Suns at Los Angeles Lakers, 10:30 pm/etSubscribe to the NBA: https://on.nba.com/2JX5gSN Full Game Highlights Playlist: https://on.nba.com/2rjGMgeFor news, stories, highlights and more, go to our official website at https://nba_webonly.app.link/nbasiteGet NBA LEAGUE PASS: https://nba.app.link/nbaleaguepass5"
"r22-K87tEPk","Rebuilding A Wrecked 2020 Jeep Gladiator Rubicon Part 8","2020-02-09T14:30:02.000Z","UCwO_xoYm2vjhu4kZSxFO5mA","goonzquad","26","20.11.02","rebuilt|wrecked|salvaged|rebuilding a wrecked 2020 jeep gladiator rubicon|rebuilding a wrecked 2020 jeep gladiator|rebuilding a wrecked jeep gladiator|rebuilding a salvaged 2020 jeep gladiator rubicon|rebuilding a salvaged 2020 jeep gladiator|2020 jeep gladiator rebuild|2020 jeep gladiator build|2020 jeep gladiator|goonzquad gladiator|goonzquad|rebuilding a wrecked truck|rebuilding a salvaged truck|copart build|copart rebuild","859039","36714","540","1969","https://i.ytimg.com/vi/r22-K87tEPk/default.jpg","False","False","Here it goes! We finally are putting this beast back together after tearing it completely apart. This 2020 Jeep Gladiator has been a blast to work on and we can't to test drive it. We are planning on doing some crazy things to it as well so stay tuned! Thanks For Watching!-GOONZQUAD MERCH!!!:  https://goonzquad.com-Instagram: https://www.instagram.com/goonzquad/-Email: goonzquadteam@gmail.com-P.O. Box 37  Rossville,GA 30741Music CreditsSong:Song: Niya - A Finale (Vlog No Copyright Music)Music provided by Vlog No Copyright Music.Video Link: https://youtu.be/1sXdoIECpukLioness (Instrumental) by DayFox https://soundcloud.com/dayfoxFree Download / Stream: https://bit.ly/lioness-instrumentalMusic promoted by Audio Library https://youtu.be/ZATMh49j49MSong: LiQWYD - Explore (Vlog No Copyright Music)Music provided by Vlog No Copyright Music.Video Link: https://youtu.be/0X2TzATvpewSong: Dipcrusher - Islands (Vlog No Copyright Music)Music provided by Vlog No Copyright Music.Video Link: https://youtu.be/CpFneq3zIt4Song: Thomas Gresen - Pretty Lies (Vlog No Copyright Music)Music provided by Vlog No Copyright Music.Video Link: https://youtu.be/i_Fya3uP8WASong: MusicbyAden - Dusk (Vlog No Copyright Music)Music provided by Vlog No Copyright Music.Video Link: https://youtu.be/je6iwUdvQD4A Magical Journey Through Space by Leonell Cassio https://soundcloud.com/leonellcassioCreative Commons — Attribution-ShareAlike 3.0 Unported — CC BY-SA 3.0Free Download / Stream: https://bit.ly/a-magical-journey-thro...Music promoted by Audio Library https://youtu.be/DRwYhxVNwzUSong: Thomas Gresen - Spotlight (Vlog No Copyright Music)Music provided by Vlog No Copyright Music.Video Link: https://youtu.be/xSOOsPUdPz4Song: Wonki - Sunset Paradise (Vlog No Copyright Music)Music provided by Vlog No Copyright Music.Video Link: https://youtu.be/Q23BZRDjh-USong: Markvard - Obsessed (Vlog No Copyright Music)Music provided by Vlog No Copyright Music.Video Link: https://youtu.be/4qkJ_nAG_w0Song: NOWË - Undefeated (Vlog No Copyright Music)Music provided by Vlog No Copyright Music.Video Link: https://youtu.be/4uPVLYXbF4MSong: SKANDR - Summer Booty (Vlog No Copyright Music)Music provided by Vlog No Copyright Music.Video Link: https://youtu.be/OrtQp9dz9Ys"
"Bk1kLB707DI","30","2020-02-09T16:00:01.000Z","UCYzPXprvl5Y-Sf0g4vX-m6g","jacksepticeye","22","20.11.02","jacksepticeye","1038479","103959","787","21576","https://i.ytimg.com/vi/Bk1kLB707DI/default.jpg","False","False","30"
"SYPMnNGa1Mo","We Tested VIRAL TikTok FOOD HACKS... **SHOCKING**","2020-02-08T19:17:49.000Z","UCilwZiBBfI9X6yiZRzWty8Q","FaZe Rug","24","20.11.02","faze rug|rug|rugfaze|fazerug|tiktok|tiktok hacks|tiktok food|tiktok food hacks|we tested|we tested tiktok|we tested tiktok food|we tested tiktok food hacks|we tested tiktok hacks|faze rug tiktok|tik tok|faze rug tiktok hacks|food hacks","3663592","138666","5137","13499","https://i.ytimg.com/vi/SYPMnNGa1Mo/default.jpg","False","False","THIS WAS SO GOOD!There are so many different ways to eat your food that make it taste better that you didn't even know existed.. I show you exactly how to do that in this video!• MY NEW MERCH IS OUT ► https://ynr.la/rugyt• SUBSCRIBE IF YOU'RE NEW ► http://bit.ly/SubToRugFollow me on my Social Media to stay connected!Twitter ► https://twitter.com/FaZeRugInstagram ► https://www.instagram.com/fazerug/Facebook ► https://www.facebook.com/RealFaZeRug/Snapchat ► thefazerug (Add me to see how I live my daily life) :DIf you read this far down the description I love you"
"hoxeIZeX6WI","Hershey’s Chocolate Makeup... Is It Jeffree Star Approved?!","2020-02-08T17:00:21.000Z","UCkvK_5omS-42Ovgah8KRKtg","jeffreestar","26","20.11.02","jeffree star|jeffree star review|jeffree star cosmetics|hershey's makeup|hershey's eyeshadow palette|etude house|jeffree star makeup|makeup review|beauty tutorial|jeffree star approved|shawnee dawson|ryland adams|garrett watts|the ace family|jaclyn hill|NikkieTutorials|morphe jeffree star|shane jeffree makeup|chocolate makeup","6847668","358006","11073","23158","https://i.ytimg.com/vi/hoxeIZeX6WI/default.jpg","False","False","Hi new makeup review, how are ya?? Today I'm reviewing the Hershey's chocolate makeup by the Korean beauty brand Etude House. 🍫 Does the makeup smell like the iconic candy?? Is it Jeffree Star Approved™?? Watch and find out the truth.WANT MORE?? 💛 Watch Shane Dawson & I Review Kylie Skin... ▷ https://www.youtube.com/watch?v=gnhub9-KLsE⭐ SHOP the Magic Star™ Concealer & Setting Powders: https://bit.ly/2GvMZdU🍓 SHOP THE JEFFREE STAR x MORPHE PART 2 COLLECTION: https://www.morphe.com/pages/jeffree-starYou can now use code JSTAR at checkout on Morphe.com for 10% OFF ANY Morphe product!*SHOP: http://www.jeffreestarcosmetics.com+ FOLLOW MY BRAND ON Instagram: http://instagram.com/jeffreestarcosmetics+FOLLOW ME ON IG: http://instagram.com/jeffreestar+ SNAPCHAT: jeffreedahmer+ TWITTER: @jeffreestarSWEATER BY: Gucci x Disney collabWHAT LIP ARE YOU WEARING?: Jeffree Star Cosmetics 'Mannequin Velour Liquid LipWATCH MORE VIDEOS...................❤️🔮 WATCH TRYING THE CHEETOS MAKEUP COLLAB  ► https://www.youtube.com/watch?v=tHFXF0w6apU🎀 WATCH MY PINK VAULT CLOSET TOUR ▷ https://www.youtube.com/watch?v=CwMBrNEpYfs😱 TRYING DOLLAR GENERAL MAKEUP FOR THE FIRST TIME ▷ https://bit.ly/2kptBHyMUSIC: JPB  ► What I Want - https://www.youtube.com/watch?v=1GcNIvUBdlM (courtesy of of NoCopyrightSounds)"
"jvvXm5o9AuM","Charli D'Amelio vs. Chase Hudson - Guess Their Age","2020-02-09T17:00:22.000Z","UCwQApaIcl3emwQ2AhQ14ofw","Famous Birthdays","22","20.11.02","[none]","1097873","50890","1023","0","https://i.ytimg.com/vi/jvvXm5o9AuM/default.jpg","True","False","Charli and Chase played Guess Their Age at Famous Birthdays on February 7th, 2020"
"ihalG3Rw_QA","ADAM SANDLER wins Best Male Lead for UNCUT GEMS at the 35th Film Independent Spirit Awards","2020-02-09T01:04:55.000Z","UCZWlScCmjiezyIRAybUgXYQ","Film Independent","1","20.11.02","adam sandler|Adam Sandler|Adam Sandler Acceptance Speech|Adam Sandler Speech|Adam Sandler Wins|Adam Sandlar Wins|Saturday Night Live|SNL Actor|Comedy Actor wins|Drama|Idina Menzel|Safdie Brothers|Adam Sandler Brags|Adam Sandler jokes|Adam Sandler Dad jokes|Jackie Sandler|Adam Sandler: 100% Fresh|Adam|Sandler|Adam Sandler Uncut Gems|Uncut Gems|Waterboy wins|Oscar win adam sandler","1314515","25890","278","1498","https://i.ytimg.com/vi/ihalG3Rw_QA/default.jpg","False","False","ADAM SANDLER wins Best Male Lead for UNCUT GEMS at the 35th Film Independent Spirit Awards.#spiritawards #adamsandler #uncutgemsThe 2020 Film Independent Spirit Awards will took place February 8 on the beach in Santa Monica and were broadcast LIVE on IFC.MORE SPIRIT AWARDS:http://www.spiritawards.com/COMPLETE NOMINEE LIST:https://tinyurl.com/vmzjw9jSUBSCRIBE TO FILM INDEPENDENT'S YOUTUBE CHANNEL:http://bit.ly/2dZw8nwFOLLOW US ON TWITTER:http://bit.ly/2gibehwLIKE US ON FACEBOOK:http://bit.ly/1T2jvEKINSTAGRAM:http://bit.ly/2fPyFAfVISIT OUR WEBSITE:http://www.filmindependent.org/BECOME A MEMBER OF FILM INDEPENDENT:http://bit.ly/2cR6VcL"
"-XoxWF-4NAw","Hairdresser Reacts To Relaxer Treatment (Satisfying)","2020-02-09T21:58:14.000Z","UCoc_XJPj6YLMQDWtPDQcDtA","Brad Mondo","24","20.11.02","bradmondo|bradmondonyc|hairdresserreacts|Hairdresser Reacts To Relaxer Treatment|hair relaxer|texlax|textured hair|permanently straighten hair at home|4c hair|4c hair treatment|4c hair protein treatment|devacurl|4c hair relaxer|natural hair|curly hair|type 4 hair|kinky hair|wash day routine|wash day|natural|natural to relaxer|healthy hair|tutorial|hair fail|diy hair|at home|hair stylist|fall off|gone wrong|jenna marbles|wig|lace front wig","488034","19982","403","2601","https://i.ytimg.com/vi/-XoxWF-4NAw/default.jpg","False","False","Hi Beautiful! Today we dive into the world of relaxer treatments. An irreversible way of premaritally straightening your hair.  Shop XMONDO Hair: https://www.xmondohair.com/What a relaxer is doing to your hair: https://youtu.be/_lMauJ9-jUERelaxer dos and don’t s: https://youtu.be/zcrLlgpzNvEDamasterstylist: https://www.youtube.com/watch?v=W0RJCIE7mMYTierra J: https://www.youtube.com/watch?v=hZ73nhERf-ACiera Danielle: https://www.youtube.com/watch?v=dZIUjkN7dOo Instagram: https://www.instagram.com/bradmondonyc/Twitter: https://twitter.com/bradmondonycTikTok: https://www.tiktok.com/@bradmondonyc?utm_source=tt_10XMONDO Instagram:  https://www.instagram.com/xmondohair/Video Editing By: Kris Edrosa Don't Forget To Live Your Extra Life."
"kYiC8lzpTyM","A Stranger’s Last 3 Months to Live","2020-02-09T18:00:06.000Z","UCvK4bOhULCpmLabd2pDMtnA","Yes Theory","24","20.11.02","yestheory|seek discomfort|last 24 hours|last 3 months to live|cancer patient|how to deal with cancer|friendship|terminally ill|friend with cancer|rare cancer|yes theory|yes theory stranger","1290958","138197","516","7796","https://i.ytimg.com/vi/kYiC8lzpTyM/default.jpg","False","False","When I met Xavier Romero in July of 2019, he'd been given 1 week left to live. He was suffering from a rare form of liver cancer and doctors had given up hope. After hearing his story, I knew I wanted to meet him. Little did I know Xavier would beat all the odds and that we would get to know each other and become brothers. Over three months of getting to know him, he taught me about what it means to fight for your life, to love unconditionally and to appreciate every single breath. He always wanted to start a YouTube channel and I told him that no matter what, his story would be told. He took comfort in that. Here is that story. I know he's here with us. I know he's watching this video and smiling at these beautiful moments we got to spend with each other. I miss him and I know I'll see him again one day. Thank you for watching. It means a lot to me and I know it means a lot to him.Love,MattIf you want to join the Yes Fam Facebook group which is 100,000+ of our most engaged and badass community members, you can apply here: https://www.facebook.com/groups/15653...PERFECT ROYALTY FREE MUSIC FOR YOUTUBE: free 30 day trial here: http://share.epidemicsound.com/wFFbr Musicbed has amazing montage and cinematic music:http://share.mscbd.fm/YesTheoryFor an amazing b-roll and footage library, checkout: http://storyblocks.com/YesTheoryYes Theory Spotify Playlist: https://open.spotify.com/user/t-boogy...Exclusive challenges on Instagram: https://www.instagram.com/yestheory/Who are we? We believe that life can be as fulfilling as you wish, so long as you're willing to seek discomfort. And we make videos about it.Business Inquiries: zack@yestheory.comhttps://www.instagram.com/yestheory/https://twitter.com/yestheoryhttps://www.facebook.com/yestheory/Hosts: Thomas Brag, Ammar Kandil, Matt DajerEditors: Thomas Brag, Thomas Dajer, Cam Peddle, Bryce Perry"
"5sywiXbm3-c","My Final Decision with the Channel","2020-02-09T17:00:03.000Z","UC8CbFnDTYkiVweaz8y9wd_Q","Star Wars Theory","24","20.11.02","My Final Decision with the Channel|star wars theory|star wars|darth vader|star wars explained|anakin skywalker|luke skywalker|kylo ren|darth maul|obi-wan kenobi|the last jedi|order 66|darth sidious|mace windu|vader fan film|darth vader suit|darth vader death|darth vader lightsaber|revenge of the sith|clone wars|the rise of skywalker|star wars trailer|star wars episode 9|anakin vs obi wan|vader fan film episode 2","616764","48520","889","7163","https://i.ytimg.com/vi/5sywiXbm3-c/default.jpg","False","False","I've been thinking about this for a long time. I believe I made the right decision. It's not the smartest thing to do, but it's what I want. I hope you'll be there with me on this big decision, I'm here because of you.I want to tell the story of Anakin Skywalker, from a fan's perspective. This won't be for profit, and it won't be monetized, just like Vader Episode 1 Shards of the Past Fan Film.Here we go!!!!Amethyst Merch - https://drop.teespring.com/swt/2 weeks and these are gone (Champion collab)Become a Patron:https://www.patreon.com/StarWarsTheoryJOIN on YouTube- https://www.youtube.com/channel/UC8CbFnDTYkiVweaz8y9wd_Q/joinALL EMAILS GO TO: Vaderfanfilm@gmail.comSHOP MERCH - https://teespring.com/stores/swtheory Official Website - https://www.starwarstheory.comInstagram - https://www.instagram.com/star.wars.theory/?hl=enTwitter - https://twitter.com/SWTheory66#starwars #starwarstheory"
"DX-F0B0hG1M","Apple should have gone AMD","2020-02-09T19:56:25.000Z","UCXuqSBlHAE6Xw-yeJA0Tunw","Linus Tech Tips","28","20.11.02","apple|mac|mac pro|cpu|processor|upgrades|memory|gpu|comparison|threadripper|amd|intel|xeon w|performance|benchmarks|what to buy|recommendation|vfx|audio engineer|programmer","1237889","43009","809","4100","https://i.ytimg.com/vi/DX-F0B0hG1M/default.jpg","False","False","Go to https://privacy.com/linus ​to get $5 off your first purchase!Save 10% and Free Worldwide Shipping at Ridge Wallets by using offer code LINUS at https://www.ridge.com/LINUSWe reviewed Apple’s 2019 Mac Pro and came to the conclusion that it’s a machine that’s not for you. But if it IS for you, which one do you buy? Or do you buy one at all?Buy a Mac Pro:From Apple: https://lmg.gg/vplG8Buy a Threadripper 3970X:On Amazon (PAID LINK): https://geni.us/Ru5KBOn Newegg (PAID LINK): https://geni.us/H6txTXDBuy a Ryzen 9 3950X:On Amazon (PAID LINK): https://geni.us/UcA4AXnOn Newegg (PAID LINK): https://geni.us/ItkU9WPurchases made through some store links may provide some compensation to Linus Media Group.Discuss on the forum: https://linustechtips.com/main/topic/1153909-apple-should-have-gone-amd/Our Affiliates, Referral Programs, and Sponsors: https://lmg.gg/sponsorsGet a Displate Metal Print at https://lmg.gg/displatelttGet a 30-day free trial of Amazon Prime at https://lmg.gg/8KV1vLinus Tech Tips merchandise at http://www.LTTStore.com/ Our Test Benches on Amazon: https://www.amazon.com/shop/linustechtips Our production gear: http://geni.us/cvOSCome see us at LTX 2020: https://www.ltxexpo.com/Twitter - https://twitter.com/linustechFacebook - http://www.facebook.com/LinusTechInstagram - https://www.instagram.com/linustechTwitch - https://www.twitch.tv/linustech Intro Screen Music Credit:Title: Laszlo - SupernovaVideo Link: https://www.youtube.com/watch?v=PKfxmFU3lWYiTunes Download Link: https://itunes.apple.com/us/album/supernova/id936805712Artist Link: https://soundcloud.com/laszlomusicOutro Screen Music Credit: Approaching Nirvana - Sugar High http://www.youtube.com/approachingnirvana"
"Z743oNzfIcY","Even Thinner Than AirPods...","2020-02-09T17:00:12.000Z","UCsTcErHg8oDvUnTzoqsYeNw","Unbox Therapy","28","20.11.02","unbox therapy|unboxtherapy|tech|technology|gadgets|gadget|unboxing|review|unbox|therapy|new|youtube|airpods|airpods pro|apple|apple airpods|apple airpods pro|wireless headphones|wireless|wireless earbuds|fully wireless|lew later|headphones|earbuds|earphones|best headphones|2020|bluetooth|airpods 2|apple airpods 2|galaxy buds|airpods 2 review|airpods 2019|iphone 11|iphone 11 pro max|iphone 11 pro|11 pro|powerbeats pro|airpods 2 unboxing|bluetooth earbuds","1252491","37959","3607","2344","https://i.ytimg.com/vi/Z743oNzfIcY/default.jpg","False","False","A new company has taken a crack at the fully wireless earbuds form factor. They managed to deliver a package thinner than Apple's AirPods and AirPods Pro.FOLLOW ME IN THESE PLACES FOR UPDATESTwitter - http://twitter.com/unboxtherapyFacebook - http://facebook.com/lewis.hilsentegerInstagram - http://instagram.com/unboxtherapy"
"veAokpNxYpg","Testing How The Army Creates HEAT With WATER","2020-02-09T20:00:06.000Z","UC1zZE_kJ8rQHgLTVfobLi_g","The King of Random","27","20.11.02","thekingofrandom|tkor|grant thompson|nate|calli|random happens|MRE heaters|MRE testing|meals ready to eat|meal ready to eat|military ration|freeze dried|flameless ration heater chemical reaction|flameless ration heater thermochemistry and redox in action|meals ready to eat military|meals ready to eat army|testing mre food","533103","14797","391","1399","https://i.ytimg.com/vi/veAokpNxYpg/default.jpg","False","False","Today we're ripping open some MRE's and playing with what's inside, especially the heaters. What is the compound inside of it, and how does it react with different things? To pre-order Grant's book, head to one of the retailers below!Amazon: https://www.amazon.com/Garage-Science-Incredible-Projects-Backyard/dp/1250184509/Barnes & Noble: https://www.barnesandnoble.com/w/52-random-weekend-projects-grant-thompson-the-king-of-random/1134307752Books-A-Million: https://www.booksamillion.com/product/9781250184504IndieBound: https://www.indiebound.org/book/9781250184504Kobo:https://www.kobo.com/us/en/ebook/52-random-weekend-projectsiBooks: https://books.apple.com/us/book/52-random-weekend-projects/id1455110002Check out the TKOR Shop: http://bit.ly/2UCNpEbSee What Else We're Up To:TKOR Discord: http://bit.ly/2LTTRoyTKOR Reddit: http://bit.ly/2XOFn0mTKOR Instagram: http://bit.ly/2Ihef1jNate's Instagram: http://bit.ly/2CZx05FCalli's Instagram: http://bit.ly/2YWWryaTKOR Facebook: http://bit.ly/2Kl2zgrTKOR Pinterest: http://bit.ly/2InY0iTSend Us Some Mail:TKOR1881 W Traverse ParkwaySte. E #221Lehi, UT 84043Business Inquiries: For sponsorship requests or business opportunities please contact us directly: http://bit.ly/2VwFw3xMusic by: Baszz - Energetic Upbeat Rock Commercial rights purchased from www.audiojungle.netPip Mondy - Walkin' With the Eagle & Devil's Little HelperMarc Torch - What Do You Want (Instrumental Version)Royalty Free Music from Epidemic Sound: http://bit.ly/2YZS8SHWARNING:This video is only for entertainment purposes. If you rely on the information portrayed in this video, you assume the responsibility for the results. Have fun, but always think ahead, and remember that every project you try is at YOUR OWN RISK.✌️👑  RANDOM NATION: TRANSLATE this video and you'll GET CREDIT! Click Here: http://bit.ly/39huGoo Want credit TRANSLATING other videos? Click Here to see where else you can contribute: http://bit.ly/2UFOm1OThis video is dedicated to our friend and founder Grant Thompson- the one and only King of Random. Click here to to see our tribute to him: http://bit.ly/2MwG5bNTHANK YOU!! ✌️👑"
