video_id,title,publishedAt,channelId,channelTitle,categoryId,trending_date,tags,view_count,likes,dislikes,comment_count,thumbnail_link,comments_disabled,ratings_disabled,description
"LGR-Qfeb88c","2020 NBA Slam Dunk Contest - Full Highlights - 2020 NBA All-Star Saturday Night","2020-02-16T04:19:35.000Z","UCqQo7ewe87aYAe7ub5UqXMw","House of Highlights","17","20.16.02","2020 NBA Slam Dunk Contest|Slam Dunk|Contest|Dunk Contest|Full Highlights|2020 NBA All-Star Saturday Night|All-Star|Saturday Night","3987423","65289","7200","12288","https://i.ytimg.com/vi/LGR-Qfeb88c/default.jpg","False","False","2020 NBA Slam Dunk Contest - Full Highlights - 2020 NBA All-Star Saturday Night📌REGISTER FOR BRxCHI FEATURING QUAVO ON FEB 16! https://www.bleacherreportevents.com📌 SUBSCRIBE, LIKE & COMMENT for MORE!------------------▶️ WATCH HOH Originals: https://www.youtube.com/playlist?list=PL_HppZy-GwSzf1Ot-A4MIJTfqF9mm0WBT▶️ WATCH TTW Podcasts: https://www.youtube.com/playlist?list=PL_HppZy-GwSwGkOvnE3gUxvlIBEl3Yo-5▶️ WATCH Instagram Moments: https://www.youtube.com/playlist?list=PL_HppZy-GwSz3ngOnW-KrExOScABfYfTi▶️ WATCH 2019-20 Players Highlights: https://www.youtube.com/playlist?list=PL_HppZy-GwSzO5avP_DTAgtHuVFSsSrRr▶️ WATCH 2019-20 Full Game Highlights: https://www.youtube.com/playlist?list=PL_HppZy-GwSzraIU44yYfSb3PW7Q8V6mh▶️ WATCH 2019-20 Best of NBA: https://www.youtube.com/playlist?list=PL_HppZy-GwSznNzog1_eJt7Y-Z4Uci_22"
"pADVAnd8xJo","How Far Can You SPLIT CHALLENGE!","2020-02-15T23:41:15.000Z","UCC3OGYxHwV8pB5yLobw9KdA","Dobre Brothers","24","20.16.02","Dobre Brothers|The Dobre Brothers|Lucas and Marcus|Dobre Twins|Marcus and Lucas|Cyrus Dobre|Darius Dobre|Dobre Brothers YouTube|Lucas and Marcus pranks|Dobre brothers gymnastics|Dobre brothers pranks|Pranks|Gymnastics|Dance|Challenges|Music|Rap|Grocery Store|Cars|Reactions|Makeup|Make-up|Games|Food|Family|Collabs|SPLIT CHALLENGE","1162657","60653","2414","656","https://i.ytimg.com/vi/pADVAnd8xJo/default.jpg","False","False","This was SO HARD 😂🇦🇺AUSTRALIA! SEE US ON TOUR!! http://bit.ly/dobretourAuckland - March 28Perth - March 29Adelaide - April 1Brisbane - April 2Melbourne - April 3Sydney - April 5DOWNLOAD & PLAY DOBRE DUNK http://bit.ly/DownloadDOBREDUNKMERCH 🔥 http://bit.ly/NewDobreMerchTURN ON OUR POST NOTIFICATIONS!SUBSCRIBE!! https://www.youtube.com/channel/UCC3OGYxHwV8pB5yLobw9KdACHECK OUT OUR DOBRE CARS CHANNEL!https://www.youtube.com/channel/UC7Irjups5A2nxStONM3JJmwFOLLOW US! Instagram -http://instagram.com/dobrebrothersSnapchat - https://www.snapchat.com/discover/Dobre_Brothers/5255767112CyrusInstagram - @CyrusdobreTwitter - @CyrusdobreTikTok - @CyrusdobreDariusInstagram - @DariusdobreTwitter - @DariusdobreTikTok - @DariusdobreLucas Instagram - @lucas_dobreTwitter - @DobrelucasTikTok - @dobretwinsMarcusInstagram - @MarcusdobreTwitter - @DobremarcusTikTok - @dobretwinsBIZ - dobrebrothersmgmt@gmail.comTHANKS FOR WATCHING! :)How Far Can You SPLIT CHALLENGE! https://www.youtube.com/channel/UCC3OGYxHwV8pB5yLobw9KdA"
"l3_sEhYBErw","SURPRISING MY PREGNANT WIFE FOR VALENTINES DAY!!!","2020-02-15T20:00:09.000Z","UCWwWOFsW68TqXE-HZLC3WIA","The ACE Family","22","20.16.02","The ace family surprising my pregnant wife for valentines day|ace family surprising my pregnant wife for valentines day|surprising my pregnant wife for valentines day|valentines day surprise|surprising her for valentines day|valentines surprise|the ace family|ace family|surprising my wife|surprisin=g my girlfriend|the best suprise ever","2042916","147681","2740","9104","https://i.ytimg.com/vi/l3_sEhYBErw/default.jpg","False","False","Surprising my pregnant wife for Valentines Day!!!DOWNLOAD ACE PLAY HERE: https://play.google.com/store/apps/details?id=com.jumpbuttonstudio.aceplayJOIN THE ACE FAMILY & SUBSCRIBE: http://bit.ly/THEACEFAMILYThe Ace Family store: http://shopacefamily.com LAST VIDEO: https://www.youtube.com/watch?v=7xuGI7xO_cQ*TURN ON OUR POST NOTIFICATIONS FOR SHOUTOUTS IN OUR VIDEOS*MAKE SURE YOU LIKE, COMMENT, SHARE & SUBSCRIBE TO OUR YOUTUBE CHANNEL AND FOLLOW US ON OUR FAMILY ADVENTURES!WATCH MORE VIDEOS!!! VLOGS: https://youtube.com/playlist?list=PLq...PRANKS: https://youtube.com/playlist?list=PLq...CHALLENGES: https://youtube.com/playlist?list=PLq...POPULAR VIDEOS: https://youtube.com/playlist?list=PLq...LATEST VIDEOS: https://youtube.com/playlist?list=PLq... STALK US :)Catherine's Instagram: https://www.instagram.com/catherinepaiz/Catherine's Twitter: http://twitter.com/catherinepaizCatherine's SnapChat: CatherinepaizAustin's Instagram: https://www.instagram.com/austinmcbroom/Austin's Twitter: https://twitter.com/AustinMcbroomAustin's SnapChat: TheRealMcBroom"
"iZCKM0Wp-6M","Resumen | Guadalajara 1 - 2 Cruz Azul | Liga MX - Clausura 2020  - Jornada 6 | LIGA BBVA MX","2020-02-16T05:17:04.000Z","UCq8BPLXtFeiSFOvmJrknWGg","LIGA BBVA MX","17","20.16.02","soccer|fútbol|sports|deportes|Clausura 2020 - Liga MX|Liga MX|Jornada 6|Guadalajara|Cruz Azul|Televisa|LIGA|BBVA|MX|LIGA BBVA MX","415420","2748","396","859","https://i.ytimg.com/vi/iZCKM0Wp-6M/default.jpg","False","False","📹 #ElResumen Revive los goles y mejores momentos del partido correspondiente a la #Jornada6 del #Clausura2020 entre Chivas y Cruz Azul. #SienteTuLiga ⚽#CreandoOportunidades ⚽ #PorLaEducación️"
"deAs21Dx_Vo","I Asked Her To Be My Girlfriend On Camera **IT'S OFFICIAL**","2020-02-15T18:06:53.000Z","UCilwZiBBfI9X6yiZRzWty8Q","FaZe Rug","24","20.16.02","faze rug|rug|rugfaze|fazerug|girlfriend|faze rug girlfriend|faze rug kaelyn|i asked her to be my girlfriend|i asked her to be my girlfriend on camera|asking her to be my girlfriend|its official","2320740","243541","6608","30999","https://i.ytimg.com/vi/deAs21Dx_Vo/default.jpg","False","False","SHE SAID YES!!!I finally asked Kaelyn to be my official girlfriend on camera!! Thank you for the ones who respect my decision. I appreciate you guys!• MY NEW MERCH IS OUT ► https://ynr.la/rugyt• SUBSCRIBE IF YOU'RE NEW ► http://bit.ly/SubToRugFollow me on my Social Media to stay connected!Twitter ► https://twitter.com/FaZeRugInstagram ► https://www.instagram.com/fazerug/Facebook ► https://www.facebook.com/RealFaZeRug/Snapchat ► thefazerug (Add me to see how I live my daily life) :DIf you read this far down the description I love you"
"i6OUv48w1bk","Surprising My Girlfriend With 100,000 Roses For Valentines Day","2020-02-14T21:00:04.000Z","UCX6OQ3DkcsbYNE6H8uQQuVA","MrBeast","24","20.16.02","[none]","15671197","843025","20628","55106","https://i.ytimg.com/vi/i6OUv48w1bk/default.jpg","False","False","BUY OUR NEW MERCH! https://shopmrbeast.com/Maddys Instagram - https://www.instagram.com/maddyspidell/My Instagram - https://www.instagram.com/mrbeastNew Merch - https://shopmrbeast.com/SUBSCRIBE OR I TAKE YOUR DOG----------------------------------------------------------------follow all of these or i will kick you• Facebook - https://www.facebook.com/MrBeast6000/• Twitter - https://twitter.com/MrBeastYT•  Instagram - https://www.instagram.com/mrbeast--------------------------------------------------------------------"
"m0D4ux830M8","Cast - ZOMBIES 2 - Flesh & Bone (From ZOMBIES 2)","2020-02-15T02:30:05.000Z","UCgwv23FVv3lqh567yagXfNg","DisneyMusicVEVO","10","20.16.02","Cast|ZOMBIES|Flesh|Bone|(From|Walt|Disney|Records|Soundtrack","2485613","44388","2990","3789","https://i.ytimg.com/vi/m0D4ux830M8/default.jpg","False","False","This is our declaration! Zombies, cheerleaders, and werewolves stand together to protect the moon stone! 🎶 Watch the ZOMBIES 2 Cast perform “Flesh & Bone” in the official music video from ZOMBIES 2! For more ZOMBIES 2 music videos: http://disneymusic.co/zombies2playlist/vevo?iqid=dmvevoDownload/stream the ZOMBIES 2 soundtrack here: https://disneymusic.co/Zombies2Soundtrack?iqid=dmvevoSubscribe to DisneyMusicVEVO 🔔 for all the latest ZOMBIES music videos: https://disneymusic.co/disneymusicYT?iqid=zombies2Follow Disney Music:Instagram: https://www.instagram.com/disneymusic  Twitter: https://twitter.com/disneymusic  Facebook: https://www.facebook.com/disneymusicDisney+ is the only place to stream your favorites from Disney, Pixar, Marvel, Star Wars, National Geographic and more. Access it all at https://disneymusic.co/JoinDisneyPlus?IQid=dmvevo. Coming to UK, France, Germany, Italy, Spain, Austria and Switzerland on March 24, 2020.#ZOMBIES2 #FleshAndBone #DisneyChannelMusic video by Cast  - ZOMBIES 2 performing Flesh & Bone (From ZOMBIES 2). © 2020 Walt Disney Recordshttp://vevo.ly/Mhni99"
"6aIJmbPuG-I","Painting My Boyfriend's Toe Nails In His Sleep","2020-02-15T16:30:29.000Z","UCGCVyTWogzQ4D170BLy2Arw","Simply Nailogical","24","20.16.02","nails|nail art|nail tutorial|beauty tutorial|nail art tutorial|diy nails|diy nail art|simply nailogical|cristine|sleep|beyyyn|fall asleep|painting ben's nails|prank|couples prank|pranking simplynailogical|painting your boyfriends nails|surprise while asleep|painting in bed|plan|mission|boyfriend prank|painting toenails|toenails|holo taco|3am challenge|sleeping challenge|challenge","845743","90423","871","9267","https://i.ytimg.com/vi/6aIJmbPuG-I/default.jpg","False","False","Simply's Back🤠💅👀👀👀 *omg* http://bit.ly/SimplyPodLogicalGot boring nails? Just add a Holo Taco 💿🌮 Sign up for email updates to be notified about restocks ➡️ http://holota.co/holothere1 ♡ Subscribe to never miss n̶e̶w̶ ̶n̶a̶i̶l̶ ̶a̶r̶t̶ ̶t̶u̶t̶o̶r̶i̶a̶l̶s̶! http://bit.ly/subsimply♡ Subscribe to my SECOND CHANNEL for no reason: http://bit.ly/SubSimplyNot♡ Subscribe to Holo Taco (for nail videos lol): http://bit.ly/SubHoloTaco_ _ _ _ _ _ _ _ _ _ _ _ _ _ _ _ _ _ _ _ _ _ _ _ _ _ _ _ _ _ _ _ _ _♡PRODUCTS USED IN THIS VIDEO:♡♥Play Rosé: https://www.holotaco.com/products/play-rose♥ Glossy Tacos (top coats): https://www.holotaco.com/collections/base-top-coatsON MY OTHER HAND: 👀 _ _ _ _ _ _ _ _ _ _ _ _ _ _ _ _ _ _ _ _ _ _ _ _ _ _ _ _ _ _ _ _ _ _Stalk me on all the social medias!http://www.simplynailogical.comhttp://instagram.com/simplynailogicalhttps://www.snapchat.com/add/simplynailogicahttps://twitter.com/nailogicalhttps://www.facebook.com/simplynailogicalhttps://youtube.com/user/simplynailogicalhttps://www.youtube.com/c/simplynotlogicalhttp://simplynailogical.tumblr.com/_ _ _ _ _ _ _ _ _ _ _ _ _ _ _ _ _ _ _ _ _ _ _ _ _ _ _ _ _ _ _ _ _ _I filmed my face in this video with this camera: https://amzn.to/327OB7bThis lens: https://amzn.to/38HnBgUVlog cam: https://amzn.to/31Vb4E6Security camera: https://amzn.to/2vE3lysAudio recorder: https://amzn.to/2SvhXZHVoiceover mic: http://amzn.to/1MefGpGI edit my videos with: http://bit.ly/videoeditor1I get some cool editing filters from: https://motionvfx.sjv.io/Ze3bRCheck out my personalized Amazon page with stuff I like! https://www.amazon.com/shop/simplynailogicalMusic: http://share.epidemicsound.com/SIMPLY_ _ _ _ _ _ _ _ _ _ _ _ _ _ _ _ _ _ _ _ _ _ _ _ _ _ _ _ _ _ _ _ _ _Disclaimer cause I love you guys: This video was not sponsored by any of the brands mentioned. All artwork/design is my own. Some links above are affiliate links."
"PEEoaKwwxbg","Polo G, Stunna 4 Vegas & NLE Choppa feat. Mike WiLL Made-It - Go Stupid (Official Video)","2020-02-14T16:00:10.000Z","UCojuFn_hfMyScH5hSHTBADQ","PoloGVEVO","10","20.16.02","PoloG|Polo|Stunna 4 Vegas|NLE Choppa|NLE|Billion Dollar Baby ENT|Da Baby|DaBaby|Stunna4Vegas|4 Vegas|Stunna|Hip-Hop|Rap|GoStupid|GoStoopid|Go Stupid Polo G|Pop Out|Die A Legend|Music Video|Viral Videos|Official Video|Columbia|Go Stupid|Hip Hop|Polo G|Stunna 4 Vegas & NLE Choppa feat. Mike WiLL Made-It","3053525","223562","4142","13794","https://i.ytimg.com/vi/PEEoaKwwxbg/default.jpg","False","False","Official video for “Go Stupid“ by Polo G featuring Stunna 4 Vegas & NLE Choppa.  Listen & Download “Go Stupid” out now: https://PoloG.lnk.to/GoStupid  Amazon - https://PoloG.lnk.to/GoStupid/amazon Apple Music - https://PoloG.lnk.to/GoStupid/applemusic iTunes - https://PoloG.lnk.to/GoStupid/itunes Spotify - https://PoloG.lnk.to/GoStupid/spotify YouTube Music - https://PoloG.lnk.to/GoStupid/youtubemusic  Director: Michael GarciaConcept by: Polo GProduction Company: Hidden Pictures LLCExecutive Producers: Shiri Fauer , Bruno BreilDP: Gevorg SarkisianEditor: Michael GarciaCommissioner: Saul LevitzSong produced by Mike WiLL Made-It & Tay KeithFollow Polo GFacebook - https://www.facebook.com/pologofficial/Instagram - https://www.instagram.com/polo.capalot/Twitter - https://twitter.com/Polo_CapalotFollow Stunna 4 VegasFacebook - https://www.facebook.com/officialstunna4vegas/Instagram - https://www.instagram.com/stunna4vegas/Twitter - https://twitter.com/stunna4vegas_Follow NLE ChoppaFacebook - https://www.facebook.com/NLEChoppaMusic/Instagram - https://www.instagram.com/choppacottonwood/Twitter - https://twitter.com/nlechoppa1https://www.polocapalot.com/#PoloG #Stunna4Vegas #NLEChoppa"
"UwD_ueQRuj4","FULL FIGHT | Ryan Garcia VICIOUSLY KOs Francisco Fonseca","2020-02-15T06:05:03.000Z","UCurvRE5fGcdUgCYWgh-BDsg","DAZN USA","17","20.16.02","ryan garcia|dazn|boxing|highlights|recap|replay|francisco fonseca|knockout|first round|golden boy|garcia","3491234","82051","1892","7557","https://i.ytimg.com/vi/UwD_ueQRuj4/default.jpg","False","False","Big fights. Any device. One price. DAZN is the only place to watch Gennadiy “GGG” Golovkin, Canelo Alvarez, and Anthony Joshua. Download the app now at http://bit.ly/DAZN_YT and get one of the best schedules in combat sports, including: Mikey Garcia vs. Jessie Vargas (February 29)Vergil Ortiz vs. Samuel Vargas (March 28)FOLLOW DAZN USA ON SOCIAL MEDIA! 👇 Twitter: http://www.twitter.com/dazn_usa Facebook: http://www.facebook.com/daznusa Instagram: http://www.instagram.com/dazn_usaFOLLOW CHANGEUP ON SOCIAL MEDIA! 👇 Twitter: http://www.twitter.com/changeupondazn  Instagram: http://www.instagram.com/changeupondaznFOLLOW PAT MCAFEE ON SOCIAL MEDIA! 👇 Twitter: http://www.twitter.com/patmcafeeondazn  Instagram: http://www.instagram.com/patmcafeeondazn"
"oB2GYwbIAlM","Stranger Things 4 | From Russia with love… | Netflix","2020-02-14T13:59:59.000Z","UChmpTxQ0Gp8KEJKsqzeg9Lg","Stranger Things","24","20.16.02","Stranger Things|Stranger Things 4|Stranger Things 3|Netflix|David Harbour|Hopper|Hopper Alive|Jim Hopper|The American|Noah Schnapp|Will Byers|Millie Bobby Brown|Eleven|Duffer Brothers|Finn Wolfhard|Mike Wheeler|Caleb Mclaughlin|Lucas Sinclair|Gaten Matarazzo|Dustin Henderson|Sadie Sink|Max Mayfield|Dacre Montgomery|Billy Hargrove|Shawn Levy|Winona Ryder|Joyce Byers|Joe Keery|Steve Harrington|Nancy Wheeler|Natalia Dyer|Television","8447561","328231","7108","33141","https://i.ytimg.com/vi/oB2GYwbIAlM/default.jpg","False","False","From Russia with love..."
"aGwjq5nYv4E","I Tested Viral TikTok Food Hacks to see if they work","2020-02-15T20:23:02.000Z","UCpB959t8iPrxQWj7G6n0ctQ","SSSniperWolf","24","20.16.02","sssniperwolf|sniper wolf|reaction|reacting|funny|life hacks|tiktok hacks|tiktok|tik tok|diy|do it yourself|to|see|if|they|work|tiktok life hacks|life hack|food hacks|tiktok food hacks chick fil a","1451699","52086","1323","5145","https://i.ytimg.com/vi/aGwjq5nYv4E/default.jpg","False","False","I tested viral TikTok Food Hacks to see if they work! Today we’re trying out some diy life hacks including the Chik Fil A one! Leave a Like if you enjoyed! Watch the last one https://youtu.be/kavAz6QvMQ8 Subscribe to SSSniperWolf to join the Wolf Pack http://bit.ly/SubSSSniperWolfInstagram: http://instagram.com/sssniperwolfTwitter: http://www.twitter.com/sssniperwolfFacebook: https://www.facebook.com/sssniperwolfOfficial Merch: https://ogwolfpack.com/"
"kOdTgTQ2lHc","People Say My Dad Was Better Than Me. Mikey Williams Opens Up For The First Time On His Family ❤️","2020-02-15T17:01:11.000Z","UCPHKMJbis1c0R7d7WJQ35tA","Overtime","17","20.16.02","mikey williams overtime|mikey williams show|mikey williams reality show|mikey williams fear nothing|mikey williams overtime show|mikey williams day in the life|mikey williams mix|mikey williams dunk|mikey williams highlights|mikey williams mixtape|mikey williams tattoo|mikey williams dunk highlights|mikey williams best player in high school|mikey williams san ysidro|fear nothing|mikey williams|overtime|mikey williams dad|mikey williams family|Bronny James","420802","15978","401","792","https://i.ytimg.com/vi/kOdTgTQ2lHc/default.jpg","False","False","Fear Nothing Episode 1 ►► https://ovrt.me/3bz5aNqMikey Day In The Life ►► https://ovrt.me/2BSlzvHGET OVERTIME APPAREL ►► https://ovrt.me/2OG5RbBEpisode 2 of FEAR NOTHING is unreal. It starts with Mikey celebrating his 1 MILLION FOLLOWERS. You know he had to turn up. My guy is ONLY 15. He went to the Hollywood sign with his boy because he's on another level now!!Mikey also opened up on his mentors, including LeBron who played a huge role in his basketball stardom! Mikey was getting real for this episode. We take you inside the realest relationship in the game. Mikey Williams and his dad Mahlon. Mikey's dad was a basketball legend coming up. Some people say he was better than Mikey. We get to see them play 1 on 1 and open up on everything they have overcome to get to this moment.We love seeing Mikey and his fam because it's REAL and they're really something special.Finally, it's time for Mikey's first game of the year, but first we gotta have an intense practice and see how coach is getting him prepared. This episode has a TON in it. Better get ready for the ride. Mikey Williams is UP NOW. Y'all better show love to the KING.Another episode of FEAR NOTHING drops next Saturday at noon EST. ---------------------------------Follow Us On Social!---------------------------------Instagram: https://www.instagram.com/overtimeTwitter: https://twitter.com/overtimeFacebook: https://www.facebook.com/GetOvertime/Tik Tok: https://www.tiktok.com/@overtime"
"4S7iCPqATic","#MtnDew3PT Contest | 2020 NBA All-Star | Full Highlights","2020-02-16T03:04:32.000Z","UCWJ2lWNubArHWmf3FIHbfcQ","NBA","17","20.16.02","NBA|Basketball|3 point contest|All-Star|All-Star Weekend|Chicago|NBA All-Star","365935","5199","133","346","https://i.ytimg.com/vi/4S7iCPqATic/default.jpg","False","False","Check out the best of the #MtnDew3PT ContestSubscribe to the NBA: https://on.nba.com/2JX5gSN Full Game Highlights Playlist: https://on.nba.com/2rjGMgeFor news, stories, highlights and more, go to our official website at https://nba_webonly.app.link/nbasiteGet NBA LEAGUE PASS: https://nba.app.link/nbaleaguepass5"
"jseZOkJ0cTk","Can You Find Him in This Video? • Hidden in Plain Sight #12","2020-02-15T13:00:07.000Z","UCDRbNGFusqlXX4a5vwi9ouQ","Vat19","24","20.16.02","vat19|vat 19|vat-19|hidden in plain sight|hidden in plain sight 12|hiding in plain sight|hide and seek|top golf","1848019","66391","1205","5601","https://i.ytimg.com/vi/jseZOkJ0cTk/default.jpg","False","False","Can Danny evade his boss all day without being found?Buy here: https://www.vat19.com?adid=youtubeMore Hidden in Plain Sight: https://www.youtube.com/playlist?list=PLSqiExuEA-RF4HU9PWHtpiQo94XkXV2nXSubscribe to Vat19: http://www.youtube.com/subscription_center?add_user=vat19comVisit the Vat19 Headquarters: https://www.vat19.com/tour****************** Follow Vat19:Facebook: https://facebook.com/vat19Instagram: https://instagram.com/vat19/Shop hundreds more curiously awesome products:https://www.vat19.com/?adid=youtubeWatch More Vat19:The White Elephant Gift Show: https://www.youtube.com/watch?v=rppcXroNgKI&list=PLSqiExuEA-RFpqW0Y3vn0pn8wDW_3LXAOLatest Uploads: https://www.youtube.com/user/vat19com/videos?shelf_id=1&view=0&sort=ddPopular Videos: https://www.youtube.com/user/vat19com/videos?shelf_id=7&view=0&sort=pFun Stuff to Eat: https://www.youtube.com/watch?v=7RXmNRr8x7I&list=PLSqiExuEA-REt5gzR0A9ernZNHlZ2glIlAbout Vat19:Vat19 is dedicated to curiously awesome gifts, candy, toys, gummy, putty, puzzles, games, and more! In addition to making funny commercials you'll actually want to watch, we produce amazing challenge videos, document our outrageous contraptions, and invite you to a front row seat for our silly stunts. Sometimes we blow things up, fill up a bathtub or pool with crazy stuff, dare each other to eat super spicy foods, and answer “burning questions” from our viewers."
"b8bvFrhpzDU","The Try Guys Take Lie Detector Tests (Again)","2020-02-15T16:00:06.000Z","UCpi8TJfiA4lKGkaXs__YdBA","The Try Guys","23","20.16.02","try guys|keith|ned|zach|eugene|habersberger|fulmer|kornfeld|yang|buzzfeedvideo|buzzfeed|ariel|ned & ariel|comedy|education|funny|try|learn|fail|experiment|test|tryceratops|lie detector|polygraph|john|buzfeed lie detector|couples|boyfriend|girflfriend|partner|bffs|best friends|marriage|married|quiz|game|challenge|win|lose|best|worse|lie|truth|hard|easy|questions|answers|interview","1715668","128453","652","5596","https://i.ytimg.com/vi/b8bvFrhpzDU/default.jpg","False","False","It's been 3 years and it's time to get some ANSWERS! Which Try Guy is gonna crack under the pressure? Watch us take a lie detector test! Are you a business looking to work with The Try Guys? Reach out to us at 2ndtrybusiness@gmail.com for all business inquiries! 🎧THE TRYPOD 🎧: watch our new podcast at https://youtube.com/trypod or listen at https://tryguys.com/podcast📘THE HIDDEN POWER OF F*CKING UP 📘: check out our new book at https://tryguys.com/bookGet your official Try Guys color hoodies and phone cases at https://tryguys.com/collections/color-line 💙❤️💚💜Support us! http://www.patreon.com/tryguys. Join our Patreon to get videos a day early, plus, live streams, chatrooms, BTS footage, exclusive merchandise, and more!SUBSCRIBE TO AND FOLLOW THE TRY GUYS http://www.youtube.com/c/tryguyshttp://www.facebook.com/tryguys  http://www.twitter.com/tryguyshttps://www.instagram.com/tryguysFOLLOW THE GUYShttp://www.Instagram.com/keithhabshttp://www.Instagram.com/nedfulmerhttp://www.Instagram.com/korndiddyhttp://www.instagram.com/eugeneleeyang http://www.twitter.com/keithhabshttp://www.twitter.com/nedfulmer http://www.twitter.com/korndiddyhttp://www.twitter.com/eugeneleeyang THE TRY GUYSThe #TryGuys is the flagship channel of 2ND TRY, LLC. Tune in twice a week for shows from Keith, Ned, Zach and Eugene, the creators and stars of The Try Guys.APPEARANCESProfessional Polygraph - John GroganEDITED BYElliot DickerhoofMUSICLicensed from AudioNetworkSFXLicensed from AudioblocksVIDEOLicensed from VideoblocksOfficial Try Guys Photos By Mandee Johnson Photography | @mandeephoto2nd Try, LLC STAFFExecutive Producer - Keith HabersbergerExecutive Producer - Ned FulmerExecutive Producer - Zach KornfeldExecutive Producer - Eugene Lee YangProducer - Rachel Ann ColeProducer - Nick RufcaProduction Manager - Alexandria HerringEditor - Devlin McCluskeyEditor - YB ChangEditor - Elliot DickerhoofAssistant Editor - Will WitwerCamera Operator - Miles BonsignoreSound Operator - Jonathan KirkAssistant Production Coordinator - Sam JohnsonContent Strategist - Kaylin BurkeSpecial Thanks To! Thanks to all of our Gold Level Patrons! AJ S., Amy Fleming, Ana Camba, Cat Hicks, Elisa Proust, Emma Godfrey, Erica Rao, Jared Aarons, Kelsey Bock, Kourtney Wong, Loretta Wen, Matthew Tadros, Miha, Paulus, Sarah Waxman, Traci Lew, Wendy Tran, Lily"
"fD_ELtkl50Y","[BANGTAN BOMB] Workout Boys - BTS (방탄소년단)","2020-02-16T10:00:01.000Z","UCLkAepWjdylmXSltofFvsYQ","BANGTANTV","10","20.16.02","방탄소년단|BTS|BANGTAN|HIPHOP|알엠|RM|슈가|SUGA|제이홉|jhope|지민|JIMIN|뷔|정국|JUNGKOOK|진|JIN","1542891","391804","905","12452","https://i.ytimg.com/vi/fD_ELtkl50Y/default.jpg","False","False","BTS Official Homepage http://bts.ibighit.comBTS Blog http://btsblog.ibighit.comBTS Facebook https://www.facebook.com/bangtan.official"
"P2UKuJ0LVDg","Women Try One Size Fits All Clothes","2020-02-15T15:32:16.000Z","UCjwmbv6NE4mOh8Z8VhPUx1Q","Rosanna Pansino","26","20.16.02","gadgets|amazon|shopping|haul|weird|insane|funny|practical|gifts|fun|tips|tricks|hacks|have a try|vlog|professional|girls|women|collab|guest|cute|bun|as seen on tv|on tv|put to the test|does it work|affordable|cheap|review|honest review|unboxing|unbox|react|reacting|impression|quality|reviewed|5 stars|1 star|gag gift|challenge|tech|soup|jeans|dress|onesie|fabric|clothing|clothes|wish|stretch|jeggings|dresses|dressing","731197","31519","920","2980","https://i.ytimg.com/vi/P2UKuJ0LVDg/default.jpg","False","False","Would you guys buy any of these???SUBSCRIBE ► https://www.youtube.com/subscription_center?add_user=rosannapansino--------------------------------------------------------------------------------------------*MERCH: https://rosannapansino.com/*Buy Nerdy Nummies Cookbook: https://tinyurl.com/NerdyNummiesCookbook*Buy Baking All Year Round Cookbook: https://tinyurl.com/BakingAllYearRoundCookbook  --------------------------------------------------------------------------------------------FOLLOW ME HERE:Facebook: http://www.facebook.com/rosannapansinoTwitter: http://www.twitter.com/RosannaPansinoInstagram: http://instagram.com/rosannapansinoTikTok: RosannaPansinoiJUSTINE’S LINKS:YouTube: https://www.youtube.com/iJustineFacebook: https://www.facebook.com/ijustineInstagram: https://www.instagram.com/ijustine/Twitter: https://twitter.com/ijustine--------------------------------------------------------------------------------------------We had so much fun #Trying all of these #Funny #Clothes! They say they are one size fits all so we put them to the test. My friend Justine is taller than me so it is the perfect way to see if they really do fit people of all sizes!What other videos would you like to see? Subscribe for more videos!This is not a sponsored video. All products purchased by me."
