video_id,title,publishedAt,channelId,channelTitle,categoryId,trending_date,tags,view_count,likes,dislikes,comment_count,thumbnail_link,comments_disabled,ratings_disabled,description
"1v6wtnmJYIw","Coronavirus Disrupts Daily Life As Trump Declares National Emergency | TODAY","2020-03-14T14:38:33.000Z","UChDKyKQ59fYz3JO2fl0Z6sg","TODAY","25","20.15.03","Weekend TODAY|News|White House|Donald Trump|Editor's picks|Politics|Big News|Coronavirus|Coronavirus - Culture|Today|coronavirus|corona|wuhan|china|trump|white house|mike pence|news conference|press conference","1690531","13019","2107","7260","https://i.ytimg.com/vi/1v6wtnmJYIw/default.jpg","False","False","President Donald Trump declared a national state of emergency on Friday as the coronavirus continues to spread in the United States. The pandemic is affecting millions and the National Guard is assisting with basic necessities in some states. NBC’s Erin McLaughlin, Hans Nichols and Janis Mackey Frayer report for Weekend TODAY, and Dr. Amesh Adalja and Stephanie Ruhle joins for analysis.» Subscribe to TODAY: http://on.today.com/SubscribeToTODAY» Watch the latest from TODAY: http://bit.ly/LatestTODAYAbout: TODAY brings you the latest headlines and expert tips on money, health and parenting. We wake up every morning to give you and your family all you need to start your day. If it matters to you, it matters to us. We are in the people business. Subscribe to our channel for exclusive TODAY archival footage & our original web series.  Connect with TODAY Online!Visit TODAY's Website: http://on.today.com/ReadTODAYFind TODAY on Facebook: http://on.today.com/LikeTODAYFollow TODAY on Twitter: http://on.today.com/FollowTODAYFollow TODAY on Instagram: http://on.today.com/InstaTODAYFollow TODAY on Pinterest: http://on.today.com/PinTODAY#Coronavirus #PresidentTrump #TodayShowCoronavirus Disrupts Daily Life As Trump Declares National Emergency | TODAY"
"yH4cp4dssGw","WATCH LIVE: Trump gives coronavirus update","2020-03-14T20:05:59.000Z","UCHd62-u_v4DvJ8TCFtpi4GA","Washington Post","25","20.15.03","coronavirus preparations|community spread|us health|covid-19|virus|disease|pandemic|health officials|health|trump administration|cdc|coronavirus|breaking news video|video updates|live video|live updates|breaking news|press conference|live speeches|real time coverage","641499","4008","1658","2014","https://i.ytimg.com/vi/yH4cp4dssGw/default.jpg","False","False","Members of the White House Coronavirus Task Force are expected to speak to reporters. Read more: https://wapo.st/2QhSCkF. Subscribe to The Washington Post on YouTube: https://wapo.st/2QOdcqKFollow us:Twitter: https://twitter.com/washingtonpostInstagram: https://www.instagram.com/washingtonpost/Facebook: https://www.facebook.com/washingtonpost/"
"_mdKvblL_8s","$70,000 Extreme Hide And Seek - Challenge","2020-03-13T20:00:04.000Z","UCX6OQ3DkcsbYNE6H8uQQuVA","MrBeast","24","20.15.03","[none]","12881014","664102","8079","40301","https://i.ytimg.com/vi/_mdKvblL_8s/default.jpg","False","False","watch until the end to see who wins the $70,000DOWNLOAD HERE: https://dragoncity.onelink.me/3213014026/MrBeastOpen to legal residents of the Eligible Countries. Must be 18+. Challenge begins at 12:00:00 AM (UTC) on March 13, 2020  and ends at 11:59:59 PM (utc) on March 19, 2020. Void where prohibited. Subject to T&Cs: https://socialpoint.helpshift.com/a/dragon-city/?l=en&s=hot-topics-what-s-new&f=mr-beast-quest-giveaway.New Merch - https://shopmrbeast.com/SUBSCRIBE OR ELSE----------------------------------------------------------------follow all of these or i will kick you• Facebook - https://www.facebook.com/MrBeast6000/• Twitter - https://twitter.com/MrBeastYT•  Instagram - https://www.instagram.com/mrbeast--------------------------------------------------------------------"
"61-gFtHJOd8","Coronavirus: 'Get prepared as soon as you can', says Italian doctor","2020-03-14T19:52:37.000Z","UCoMdktPbSTixAyNGwb-UYkQ","Sky News","25","20.15.03","covid19|coronavirus|pandemic|epidemic|covid-19|hospital|doctor|turin|italy|world news|crisis|health|sky news","1383753","15772","605","5365","https://i.ytimg.com/vi/61-gFtHJOd8/default.jpg","False","False","We are expecting a surge in the coming days and hope it will not reach the intensity of Lombardy... my suggestion is you get prepared as soon as you can. Sky News speaks to a doctor in a hospital in Turin, Italy. The latest on #Coronavirus here: https://trib.al/j5ZIPJfSUBSCRIBE to our YouTube channel for more videos: http://www.youtube.com/skynews Follow us on Twitter: https://twitter.com/skynews and https://twitter.com/skynewsbreak Like us on Facebook: https://www.facebook.com/skynews Follow us on Instagram: https://www.instagram.com/skynews For more content go to http://news.sky.com and download our apps:  Apple https://itunes.apple.com/gb/app/sky-news/id316391924?mt=8 Android https://play.google.com/store/apps/details?id=com.bskyb.skynews.android&hl=en_GB"
"ek3T8xiu1Fw","The Race To Develop A Coronavirus Vaccine","2020-03-14T18:34:25.000Z","UCvJJ_dzjViJCoLf5uKUTwoA","CNBC","25","20.15.03","CNBC|business|news|finance stock|stock market|news channel|news station|breaking news|us news|world news|cable|cable news|finance news|money|money tips|financial news|Stock market news|stocks|coronavirus outbreak china cases|coronavirus deaths|coronavirus stock picks|coronavirus vaccines|coronavirus travel|coronavirus pandemic|coronavirus lockdown|coronavirus flights","816854","14179","713","3060","https://i.ytimg.com/vi/ek3T8xiu1Fw/default.jpg","False","False","The growing coronavirus outbreak is causing chaos in global financial markets, freezing supply chains and causing companies all over the world to create work-for-home plans and ban business travel. At drug companies and research labs, though, the race is on to develop a cure for coronavirus, or at least its symptoms. Here's what's at stake, and when the world can expect a coronavirus vaccine.» Subscribe to CNBC: https://cnb.cx/SubscribeCNBC» Subscribe to CNBC TV: https://cnb.cx/SubscribeCNBCtelevision» Subscribe to CNBC Classic: https://cnb.cx/SubscribeCNBCclassicAbout CNBC: From 'Wall Street' to 'Main Street' to award winning original documentaries and Reality TV series, CNBC has you covered. Experience special sneak peeks of your favorite shows, exclusive video and more.Connect with CNBC News OnlineGet the latest news: https://www.cnbc.com/Follow CNBC on LinkedIn: https://cnb.cx/LinkedInCNBCFollow CNBC News on Facebook: https://cnb.cx/LikeCNBCFollow CNBC News on Twitter: https://cnb.cx/FollowCNBCFollow CNBC News on Instagram: https://cnb.cx/InstagramCNBC#CNBCThe Race To Develop A Coronavirus Vaccine"
"zLlwOzAG8rM","Global National: March 14, 2020 | New cases surface in Canada; Trump travel ban expands","2020-03-15T01:53:54.000Z","UChLtXXpo4Ge1ReTEboVvTDg","Global News","25","20.15.03","[none]","580743","3098","292","1567","https://i.ytimg.com/vi/zLlwOzAG8rM/default.jpg","False","False","New cases of COVID-19 have surfaced in Canada, with Prince Edward Island and Newfoundland and Labrador reporting their first positive cases and Saskatchewan confirming its first two cases. Ontario reported 22 new cases on Saturday as well, with Quebec's total rising to 24 after seven cases were confirmed.Abigail Bimman reports on the new developments with Canadian travelers being urged to come home as soon as they can. Plus, Mike Armstrong looks at new risks that Canada's already vulnerable homeless population faces amid the growing outbreak.In the U.S., Jennifer Johnson takes a look at how the COVID-19 pandemic is forcing lawmakers to come up with strategies to help Americans, with an emergency bill passed early Saturday to help with free testing and paid sick leave. Robin Gill also takes a look at Apple's decision to close all of its stores outside China in an effort to limit the virus' spread.Multiple countries around the world are now taking immediate countermeasures in an effort to contain and mitigate the spread. Redmond Shannon reports on the increasingly dire situation in Europe, now seen as the epicentre of the outbreak, as Spain prepares a 15-day national lockdown. Plus, Robin Gill provides new updates on the pandemic's impact across the globe, including Japan and Iran.For more info, please go to https://globalnews.ca/news/6666897/latest-updates-coronavirus-pandemic/Subscribe to Global News Channel HERE: http://bit.ly/20fcXDcLike Global News on Facebook HERE: http://bit.ly/255GMJQFollow Global News on Twitter HERE: http://bit.ly/1Toz8mtFollow Global News on Instagram HERE: https://bit.ly/2QZaZIB#GlobalNews #cdnpoli #COVID19 #Coronavirus"
"8Ds56JTcBv8","Trump says he took coronavirus test in press conference","2020-03-14T17:19:24.000Z","UCXIJgqnII2ZOINSWNOGFThA","Fox News","25","20.15.03","president trump|donald trump|donald trump coronavrus|coronavirus donald trump|donald trump test|trump tested for coornavirus|coronavirus fever|white house physician|travel restrictions|coronavirus|coronavirus precautions|mike pence|coronavirus task force|fox news|fox news channel|fox news media|fox news network|coronavirus outbreak|coronavirus symptoms|breaking news|coronavirus update|covid-19 news|covid-19|test kits|google coronavirus","1391773","25168","1669","14676","https://i.ytimg.com/vi/8Ds56JTcBv8/default.jpg","False","False","President Donald Trump and coronavirus task force team give updates on the disease in a White House briefing. #FoxNewsFOX News operates the FOX News Channel (FNC), FOX Business Network (FBN), FOX News Radio, FOX News Headlines 24/7, FOXNews.com and the direct-to-consumer streaming service, FOX Nation. FOX News also produces FOX News Sunday on FOX Broadcasting Company and FOX News Edge. A top five-cable network, FNC has been the most-watched news channel in the country for 17 consecutive years. According to a 2018 Research Intelligencer study by Brand Keys, FOX News ranks as the second most trusted television brand in the country. Additionally, a Suffolk University/USA Today survey states Fox News is the most trusted source for television news or commentary in the country, while a 2017 Gallup/Knight Foundation survey found that among Americans who could name an objective news source, FOX News is the top-cited outlet. FNC is available in nearly 90 million homes and dominates the cable news landscape while routinely notching the top ten programs in the genre. Subscribe to Fox News!  https://bit.ly/2vBUvASWatch more Fox News Video: http://video.foxnews.comWatch Fox News Channel Live: http://www.foxnewsgo.com/Watch full episodes of your favorite showsThe Five: http://video.foxnews.com/playlist/longform-the-five/Special Report with Bret Baier: http://video.foxnews.com/playlist/longform-special-report/The Story with Martha MacCallum: http://video.foxnews.com/playlist/longform-the-story-with-martha-maccallum/Tucker Carlson Tonight: http://video.foxnews.com/playlist/longform-tucker-carlson-tonight/Hannity:  http://video.foxnews.com/playlist/longform-hannity/The Ingraham Angle: http://video.foxnews.com/playlist/longform-the-ingraham-angle/Fox News @ Night: http://video.foxnews.com/playlist/longform-fox-news-night/ Follow Fox News on Facebook: https://www.facebook.com/FoxNews/Follow Fox News on Twitter: https://twitter.com/FoxNews/Follow Fox News on Instagram: https://www.instagram.com/foxnews/"
"jNn2F39G-6s","Fiddlesticks: Terror in Demacia | Champion Update Trailer - League of Legends","2020-03-13T17:00:17.000Z","UC2t5bjwHdUX4vM2g8TRDq5g","League of Legends","20","20.15.03","Riot Games|Riot|League of Legends|League|LoL|MOBA|Fiddlesticks|champion|rework|VGU|update|fiddle|trailer|teaser|demacia|new|champ|horror|scare|lol fiddlesticks|fiddlesticks League|fiddlesticks lol|fiddlesticks reveal|League of Legends champ reveal|champion reveal|champion trailer|league|Fiddlesticks rework|fiddlesticks vgu|fiddlesticks update|fiddle rework|the ancient fear","5278469","280373","2409","15851","https://i.ytimg.com/vi/jNn2F39G-6s/default.jpg","False","False","An ancient fear awakens.League of Legends Sign Up & Downloadhttps://signup.leagueoflegends.com/"
"7pt0ereyG8c","Letting INSTAGRAM FILTERS Decide What I Eat for 24 Hours","2020-03-14T19:23:50.000Z","UCpB959t8iPrxQWj7G6n0ctQ","SSSniperWolf","24","20.15.03","sssniperwolf|sniper wolf|reacting|reaction|funny|instagram|instagram filters|decide|what|eat|decide what i eat|food","727498","35982","685","5174","https://i.ytimg.com/vi/7pt0ereyG8c/default.jpg","False","False","Letting INSTAGRAM FILTERS Decide What I Eat for 24 Hours! Using these food filters on instagram to decide what to eat... would you do this? Leave a Like if you enjoyed! Watch the last vid https://youtu.be/Pw3KIrGl5wA Subscribe to join the Wolf Pack and enable notifications! http://bit.ly/SubSSSniperWolfInstagram: http://instagram.com/sssniperwolfTwitter: http://www.twitter.com/sssniperwolfFacebook: https://www.facebook.com/sssniperwolfvideosOfficial Merch: https://ogwolfpack.com/"
"9cfYC4YLsu4","CDC Briefing Room: COVID-19 Update: March 14, 2020","2020-03-14T22:53:32.000Z","UCiMg06DjcUk5FRiM3g5sqoQ","Centers for Disease Control and Prevention (CDC)","25","20.15.03","CDC|Centers for Disease Control and Prevention|Public Health|Government|Coronavirus|COVID-19|CDC guidelines|situation update|news","727182","18256","1604","0","https://i.ytimg.com/vi/9cfYC4YLsu4/default.jpg","False","False","Watch to learn the latest on COVID-19Comments on this video are allowed in accordance with our comment policy:http://www.cdc.gov/SocialMedia/Tools/CommentPolicy.htmlThis video can also be viewed athttps://www.cdc.gov/video/socialmedia/315974_COVID19_CDCBriefingRoom_Mar14_lowres.wmv"
"y4DTW4B3Sjs","The Macabre Death Of Edgar Allan Poe","2020-03-13T22:00:16.000Z","UCKijjvu6bN1c-ZHVwR7-5WA","BuzzFeed Unsolved Network","22","20.15.03","buzzfeed|buzzfeed unsolved|buzzfeed unsolved network|unsolved true crime|true crime|edgar allen poe|unsolved mysteries|cold case|the raven|shane madej|ryan bergara|unsolved|unsolved mystery|cold-case|investigation|mystery|ryan and shane|theories|bizarre|unsolved network|unexplained mysteries|The Macabre Death Of Edgar Allan Poe|poe|literature|PL-Unsolved|PL-UnsolvedTrueCrime|PL-UnsolvedTrueCrime-S6","2137742","155401","1375","11838","https://i.ytimg.com/vi/y4DTW4B3Sjs/default.jpg","False","False","How much do we really know about the death of one of the most famous poets in the world?Credits: https://www.buzzfeed.com/bfmp/videos/99805MUSICLicensed via Audio NetworkWelcome to the BuzzFeed Unsolved Network! This channel is your one-stop destination for all things mystery, conspiracy, supernatural, true crime, and everything in between. Subscribe here: http://bit.ly/2zuaR06.STILLSGangsters123foto/Getty ImagesSteam train silhouetteSnowshill/Getty ImagesA growing pile of dollar billsWalker and Walker/Getty Imageshand shakeHolloway/Getty Imagesstar award trophy David Muir/Getty ImagesPortrait of Jefferson Daviswynnter/Getty ImagesAmerican writer Edgar Allan PoePhotos.com/Getty ImagesMan smoking cigar in libraryHoward Berman/Getty ImagesElfreth's Alley at Nightaimintang/Getty ImagesKing of HeartsCaseyHillPhoto/Getty Imagesraw amberTadoma/Getty ImagesTwo Couples in 1901.Sepia TonedLisa-Blue/Getty ImagesEdwardian Gentlemenduncan1890/Getty ImagesPortrait of mature man in gardenSimon Winnall/Getty ImagesPortrait of Edgar Allen Poedrnadig/Getty ImagesRubbing Hands Togetherpink_cotton_candy/Getty ImagesA fossilized Brain in a dried out desertartpartner-images/Getty ImagesVictorian Lady Portlait No.8noriko_london/Getty ImagesCandle and Skull on BooksJeffrey Coolidge/Getty ImagesNight Car parkAaron Foster/Getty ImagesCar hit scenesestovic/Getty ImagesScenic CampusQizhangJia/Getty ImagesIsolated Vintage Armchairmrdoomits/Getty ImagesDancezoranm/Getty ImagesEdgar Allan Poe Tombstone with NamLocked Ballot Boxtraveler1116/Getty ImagesStudent Standing Before Complex Math EquationPeter M. Fisher/Getty ImagesMan Giving Gift to WomanMark Weiss/Getty ImagesToasting glasses with copy spacePeter Dazeley/Getty ImagesAncient books with skullcyano66/Getty ImagesThree Men StandingBlake Little/Getty ImagesAutumn lightsSanderStock/Getty ImagesTraditional wooden steps in vintage library.Dougal Waters/Getty ImagesAntique photograph of World's famous sites: Commonwealth Avenue, Bostonilbusca/Getty ImagesAntique photograph of people from the World: Dr Kochilbusca/Getty ImagesAntique photograph of World's famous sites: Washington monument, Baltimore, Marylandilbusca/Getty ImagesAntique photograph of World's famous sites: Chestnut Street, Philadelphia, Pennsylvaniailbusca/Getty ImagesAntique photograph of London: Bartholomew's Hospitalilbusca/Getty ImagesBlank Folded NewspaperMichael Burrell/Getty ImagesOld black and white photo of cemetery with trees in mist in autumn.ysbrandcosijn/Getty ImagesSyphilis positivejarun011/Getty ImagesAntique wet plate photo of mysterious 1920s english gangster with flat cap and black coat.ysbrandcosijn/Getty ImagesOld Map America East Coasty-studio/Getty ImagesYoung romantic couple in love flirting in rain. Black and whiteNiseriN/Getty ImagesAntique American Photograph: Hudson River at West Point, New York, United States, 1893bauhaus1000/Getty Imagesconcrete polished texture backgroundchingraph/Getty ImagesAntique London's photographs: Pub in Hendonilbusca/Getty Imagesaluxum/Getty ImagesClenched fistfotorince/Getty ImagesAntique BookGlasshouse Images/Getty ImagesProfessional Beard CompetitorDavid Sacks/Getty ImagesBbenPhotographer/Getty ImagesVintage interior with bed and wooden trunk. Nicely fits for book coverArman Zhenikeyev/Getty ImagesAnton Rubinstein - Illustration from 1894suteishi/Getty ImagesTombstone 3Francesco Milanese/Getty ImagesWriter table.undefined undefined/Getty ImagesAntique photo: Portrait of woman, actressilbusca/Getty ImagesAntique photo: Alexandre Dumasilbusca/Getty ImagesUS Army black and white photos: Steamer Yucatan ready for Cubailbusca/Getty ImagesForest trees without leaves. Winter trees set, silhouette vector. Сollection of isolated tree trunks with knotsNosyrevy/Getty ImagesCrowd of protesters people. Silhouettes of people with banners and megaphones. Concept of revolution or protestYevhenii Dubinko/Getty ImagesVector silhouettes of people.majivecka/Getty ImagesVIDEOGroom puts on the bride's finger an engagement ring. Wedding coupleAndrii Iemelyanenko/Getty ImagesFalling ice into a glass and pouring whiskeyShaiith/Getty ImagesRaven eye close-up, macro, eye of hooded crow. tonedMriyaWildlife/Getty Imageshand writes a letter with an old pen and inkwellЮрий Алейников/Getty ImagesOld letter 2Daniel Christel/Getty ImagesSwirling atmospheric smokebarnburna/Getty ImagesDepressive man in dark room standing by the windowstevanovicigor/Getty ImagesTeenage hand holding baseball bat, threat and juvenile delinquent, youth gangMotortion/Getty Imageslandscape of the clear skykokoroyuki/Getty ImagesSilhouette of a raven against a full moonrawheadrex/Getty ImagesSLOW MOTION: Scary spruce forest on dark winter night during heavy snow blizzardhelivideo/Getty ImagesWooden diceserjiosoob/Getty ImagesRaven fence perchhumanizr_AV/Getty Images"
"F7V8DRfZBQI","True Facts: Freaky Nudibranchs","2020-03-14T16:58:54.000Z","UCVpankR4HtoAVtYnFDUieYA","zefrank1","15","20.15.03","ze|nudibranch|flabellina|zefrank|true facts|glaucus|dorid|aeolid","630762","52372","318","2384","https://i.ytimg.com/vi/F7V8DRfZBQI/default.jpg","False","False","Cuz the ocean is weird.Join https://www.patreon.com/truefactsCREDITS:written and voiced by Ze Frankthanks to Patreon supporter Sydney Brown for the Pikachu Swiffer line that she left in a comment. Join the community! It's fun!Hal Brindley: https://travel4wildlife.comHal has an amazing vid of a botfly on his channel... sooooo gross.https://www.youtube.com/channel/UCFpC5ryzit5KLY-0Ku24jKwDr. Jeffrey Goddard: Marine Science Institute, UCSB; Midland SchoolWilliam Goddard: Midland SchoolDr. Goddard and his son were very generous with their time and footage! Gave me some great notes so I didn't get my facts bungled!msi.ucsb.eduDr. Jamie Seymour: Tropical Australian Stinger Research Unit (TASRU)Dr. Seymour has captured some of the most remarkable footage of nematocysts firing I have ever seen. Ptowwww.Bocas Del Toro Research Station Smithsonian Tropical Research InstituteThank you to the Smithsonian and to Dr. Maria Pia Miglietta for the wonderful image of the unexploded nematocyst.Dr. Louise Page : University of VictoriaDr. Page's footage of the veligers (Melibe) were a lifesaver. I wish I had more time to spend on their fantastic lifecycle.Dr. Leslie S Babonis : Whitney Laboratory for Marine BioscienceDr.Babonis has the coolest job. Firing lasers to trigger nematocyst firing!Phil Lemley https://www.youtube.com/watch?v=cdossfwVHm0Phil was so generous to allow me the use of his attacking rainbow nudi...yeah the proctologist...Dr. Marta Pola Perez (CIBC-UAM)Universidad Autónoma de MadridDr.Perez has looked at the possibility of self fertilization in Nudis - and you never know!Costasiella footage courtesy of David Palfrey/Hydra Productions Film, Photo and Training, Indonesiawww.hydraproductions.com @hydra.underwaterDavid let me use his Shaun the Sheep slug footage, which is really some of the best footage I have seen of this cute slug. WetTraveler : http://youtube.com/c/wettravelerPinneng was kind enough to share his Pikachu footage... Quick attack! Electric Shock!Elyse Messick captured nematocysts firing as a student and I tracked her down on linked in!Thank you to the following photographers that uploaded their work on Flickr with commercial licenses! A huge help to people like me:Greg Schechter: https://www.flickr.com/photos/gregthebuskerNOAA: https://www.flickr.com/photos/noaaphotolib/Chika Watanabe : https://www.flickr.com/photos/chikawatanabeKris-Mikael Krister : https://www.flickr.com/photos/148835878@N08Christian Gloor : https://www.flickr.com/photos/christian_gloorAdditional Footage from ShutterStock and Envato ElementsMusic by Tom Moore: https://soundcloud.com/querflote"
"q_WM_pMp0Hg","Trump Holds News Conference On Coronavirus Pandemic | NBC News (Live Stream Recording)","2020-03-13T21:12:36.000Z","UCeY0bbntWzzVIaj2z3QigXg","NBC News","25","20.15.03","nbc news|nbc|news|breaking news|us news|world news|politics|nightly news|current events|top stories|pop culture|lester holt|coronavirus|coronavirus update|coronavirus us|coronavirus news|coronavirus latest news|illness|cdc|center for disease control|safety|symptoms|sickness|virus protection|outbreak|coronavirus outbreak|COVID-19|pandemic|coronavirus pandemic|coronavirus prevention|coronavirus explained|covid-19 news|covid-19 updates|covid-19 outbreak","3154797","20317","8164","6108","https://i.ytimg.com/vi/q_WM_pMp0Hg/default.jpg","False","False","President Donald Trump holds a news conference on the coronavirus pandemic which is spreading across the United States. The president is expected to declare a national emergency.» Subscribe to NBC News: http://nbcnews.to/SubscribeToNBC» Watch more NBC video: http://bit.ly/MoreNBCNewsNBC News Digital is a collection of innovative and powerful news brands that deliver compelling, diverse and engaging news stories. NBC News Digital features NBCNews.com, MSNBC.com, TODAY.com, Nightly News, Meet the Press, Dateline, and the existing apps and digital extensions of these respective properties.  We deliver the best in breaking news, live video coverage, original journalism and segments from your favorite NBC News Shows.Connect with NBC News Online!NBC News App: https://apps.nbcnews.com/mobileBreaking News Alerts: https://link.nbcnews.com/join/5cj/breaking-news-signup?cid=sm_npd_nn_yt_bn-clip_190621Visit NBCNews.Com: http://nbcnews.to/ReadNBCFind NBC News on Facebook: http://nbcnews.to/LikeNBCFollow NBC News on Twitter: http://nbcnews.to/FollowNBCFollow NBC News on Instagram: http://nbcnews.to/InstaNBCTrump Holds News Conference On Coronavirus Pandemic | NBC News (Live Stream Recording)"
