video_id,title,publishedAt,channelId,channelTitle,categoryId,trending_date,tags,view_count,likes,dislikes,comment_count,thumbnail_link,comments_disabled,ratings_disabled,description
"BtN-goy9VOY","The Coronavirus Explained & What You Should Do","2020-03-19T15:37:18.000Z","UCsXVk37bltHxD1rDPwtNM8Q","Kurzgesagt – In a Nutshell","27","20.22.03","Corona|Corona Virus|Corinavirus|Covid|Covid 19|Pandemic|Virus|epidemic|lung|respiratory|droplet infection|infection|immune system|death|death toll|bacteria|pneumonia|bacterial pneumonia|health care|health care systems|hospital|intensive care|flu|swine flu|bird flu|WHO|soap|disinfection|quarantine|healing|treatment|vaccine|spanish flu|death rate|immunity","12335115","648429","6614","36423","https://i.ytimg.com/vi/BtN-goy9VOY/default.jpg","False","False","Get Merch designed with ❤ from https://kgs.link/shop  Join the Patreon Bird Army 🐧 https://kgs.link/patreon  ▼▼ More infos and links are just a click away ▼▼A huge thanks to the experts who helped us on short notice with the video. Especially “Our World in Data”, the online publication for research and data on the world’s largest problems – and how to make progress solving them. Check out their site. It also includes a constantly updated page on the Corona Pandemic.In December 2019 the Chinese authorities notified the world that a virus was spreading through their communities. In the following months it spread to other countries, with cases doubling within days. This virus is the “Severe acute respiratory syndrome-related coronavirus 2”, that causes the disease called COVID19, and that everyone simply calls Coronavirus.What actually happens when it infects a human and what should we all do?Sources & further reading: https://sites.google.com/view/sourcescorona OUR CHANNELS▀▀▀▀▀▀▀▀▀▀▀▀▀▀▀▀▀▀▀▀▀▀▀▀▀▀German Channel: https://kgs.link/youtubeDE by FUNKSpanish Channel: https://kgs.link/youtubeES by WIXHOW CAN YOU SUPPORT US?▀▀▀▀▀▀▀▀▀▀▀▀▀▀▀▀▀▀▀▀▀▀▀▀▀▀This is how we make our living and it would be a pleasure if you support us!Get Merch designed with ❤ from https://kgs.link/shop  Join the Patreon Bird Army 🐧 https://kgs.link/patreon  DISCUSSIONS & SOCIAL MEDIA▀▀▀▀▀▀▀▀▀▀▀▀▀▀▀▀▀▀▀▀▀▀▀▀▀▀Reddit:            https://kgs.link/redditInstagram:     https://kgs.link/instragramTwitter:           https://kgs.link/twitterFacebook:      https://kgs.link/facebookDiscord:          https://kgs.link/discordNewsletter:    https://kgs.link/newsletterOUR VOICE▀▀▀▀▀▀▀▀▀▀▀▀▀▀▀▀▀▀▀▀▀▀▀▀▀▀The Kurzgesagt voice is from Steve Taylor:  https://kgs.link/youtube-voiceOUR MUSIC ♬♪▀▀▀▀▀▀▀▀▀▀▀▀▀▀▀▀▀▀▀▀▀▀▀▀▀▀700+ minutes of Kurzgesagt Soundtracks by Epic Mountain:Spotify:            https://kgs.link/music-spotifySoundcloud:   https://kgs.link/music-soundcloudBandcamp:     https://kgs.link/music-bandcampYoutube:          https://kgs.link/music-youtubeFacebook:       https://kgs.link/music-facebookThe Soundtrack of this video:Soundcloud:   https://bit.ly/2WsTOFOBandcamp:     https://bit.ly/2IYT7vJ🐦🐧🐤 PATREON BIRD ARMY 🐤🐧🐦▀▀▀▀▀▀▀▀▀▀▀▀▀▀▀▀▀▀▀▀▀▀▀▀▀▀Many Thanks to our wonderful Patreons from http://kgs.link/patreon who support us every month and made this video possible:Rick Pearson, Michał Nieć, Stepan Tikhonkikh, Yurii Smalko, Callum, Ghaith Tarawneh, Csilla Budai, Sebastian Sturgeon, Robin Wersich, Tom Craggs, TJ Vaught, Christoph Bühler, Jonathan Levin, Tomáš Mařík, william jager, Curtis Boortz, Thor-Rune Hansen, Ketill Gudmundsson, Chris Burris, Steffen Thurner, Jeremy Jay, Antreas Antoniou, Phoenyx Nist-Ferrare, Julianne Taylor, SleepyKid123, Mika Pagani, Corey Freeman, Alexander, Kesarchan, Julio Dieguez, Tommaso Javidi, Sergey, Oleksandr Shymanskyi, Max Madell, Dmitry Zaruta, Max Yiu, Martin Devreese, Davy Jones, Menno Amoraal, Leonardus Herryanto, Olivier Boulanger, Marcello Maiorana, Kristian Trenskow, Philipp Hofmann, Tobias Marstaller, Nick Giannetti, Stimson Snead, Xfennec, DONGWOOK KIM, Rogier Lagas, Marco Johne, Ghanem Al-mar, Jakub Jasaň, Isabelle Hallman, Cedric Ith, Guilhem Poy, Alexis, Reflective Desire, Wayne Liu, Jack Byass, Arjun Annapureddy, Ryan Yohnk, Tigo Middelkoop, KyZaK, william4916, BlueCheetah, Vitalii Lytvynov, Bennett Phillips, Jan Andrle, Akiro, Dragan Tutic, Lolita L., Noel Anderson, TheTonkiDonker, Galihad Chow, Alexis Vilmard, Rich, Sergey Chukanov, Omar Jenblat, Jan, Tyler Harley, Moly, Joseph Yannessa, Les Howard, Ross Burhans, Matt Herrington, Daniel Lucas, Lio, Peter Harrer, Kevin Minnebusch, TylerJ, Robin Hellsten, richard chalmers, Steve Avery, Pornthep Achatsachat, Cauterize1750, Christian Vandament, Lukas Praninskas, Akshaj Darbar, james unwin, AviatorGeek, Elizabeth Stevanovic, Donga, Jordan, shadowpuffin, Étienne Lévesque, Mloren, Michael Arndt, theLastDragon, Cody S., Jem Altieri, EsperSKS, Jake Gamer, Samantha Fisher, Lukas Halbeisen, cameron hartley, David Rangel, Juan Pablo, Billy Smith, Eric Berthe, airboume, Moji Hasan, Mark Mu, Brennan Ratican, Sam Fogarty, Vinsnt, Dmitrii Tretiakov, apple00juice, Agerius Na'Howul, Gabi ., Eric Kim, John Schafer, Jacob Sheffield, Sawamura, Ben Harrison, Jetbo, Revan, James Hatherell, istoOi, Blueberry Yoghurt, Tyler Jacobsen, Rilquer Mascarenhas, Cilestin, Lucia Fernandez, BluePlane, Sumedh Attarde, Dan M, Justin Galowich, Ben Thompson, Dominik Cekliniak, Amanda Lin, Lys, Joe Schafer, Gabeee, Arkfille, H.S. Crow, Moritz No., Dave Richmond, Theodoros Theodoridis, Misir Jafarov, Jordy Tjon, Cameron Geracitano, acrobat1 ., CrazyBatman, rag3047, Jan Thümmler, Rose Johnstone, Clark Kent, philbill07, Semerket, Steven Diaz, Chris M, Pierre Muller, Tyler Williams, Bernd Sing, Ettore Randazzo, Baraa Dajani,"
"lv2bQ6lMvvw","This Is What's REALLY Happening With Coronavirus Vaccines, Possible “Cures”, Dr. Fauci, & More...","2020-03-20T21:03:38.000Z","UClFSU9_bUb4Rc6OYfTt5SPw","Philip DeFranco","25","20.22.03","Coronavirus updates|coronavirus vaccine|coronavirus cure|COVID-19|covid19|fauci|update|vaccine|vaccines|Dr. Fauci|news|philip defranco show|philip defranco|quarantine|stay at home|pds|the philip defranco show|current events|international news","673534","49284","747","2806","https://i.ytimg.com/vi/lv2bQ6lMvvw/default.jpg","False","False","Pssst. Just made a Snapchat. Add me! https://www.snapchat.com/add/p_defranco20FRIENDLY REMINDER! During this time of coronavirus uncertainty, I am uploading Every Single Weekday including FRIDAYS AND this week I’ll also have at least a Sunday video for you!WATCH yesterday’s PDS: https://youtu.be/db0xzM7Lyjo --Go to http://ShopDeFranco.com and check out classic SPORTS! merch and some new goodies too! Use code “TAKE15OFF” to get 15% off your purchase!Check out the BRAND NEW ACW Clips channel: https://www.youtube.com/aconvowithclips?sub_confirmation=1 WATCH my New Podcast w/ Daniel Sloss: https://youtu.be/FIBBqOS15TELISTEN On The Podcast Platform Of Your Choice: http://LinksHole.com✩ FOLLOW ME ✩✭ TEXT ME: 813-213-4423✭ TWITTER: http://Twitter.com/PhillyD✭ INSTAGRAM: https://instagram.com/PhillyDeFranco/✩ SUPPORT THE SHOW ✩✭ Buy Merch: http://ShopDeFranco.com✭ Lemme Touch Your Hair: http://BeautifulBastard.com✭ Paid Subscription: http://DeFrancoElite.com ✩ IMPORTANT LINKS ✩ https://www.newyorker.com/news/news-desk/how-long-will-it-take-to-develop-a-coronavirus-vaccinehttps://investors.modernatx.com/news-releases/news-release-details/moderna-ships-mrna-vaccine-against-novel-coronavirus-mrna-1273https://www.businessinsider.com/sign-up-for-coronavirus-vaccine-trial-nih-kaiser-2020-3https://www.nih.gov/news-events/news-releases/nih-clinical-trial-investigational-vaccine-covid-19-beginshttps://www.theguardian.com/world/2020/mar/20/when-will-a-coronavirus-vaccine-be-ready—————————— Edited by: Will Crespo Produced by: Amanda MoronesArt Director: Brian Borst Writing/Research: Philip DeFranco, Cory RayScript Editor: Brian Espinoza Production Team: Zack Taylor, Luke Manning, Alex Elnicki, Zach McIntyre ————————————#DeFranco #Covid19 #Vaccine————————————"
"yoUCDJ6PxUE","WATCH: Trump and White House Coronavirus Task Force hold news conference - 3/20 (FULL LIVE STREAM)","2020-03-20T17:41:32.000Z","UCHd62-u_v4DvJ8TCFtpi4GA","Washington Post","25","20.22.03","covid 19|coronavirus press conference|trump coronavirus|sars|diamond princess|coronavirus update|coronavirus news|virus|symptoms|yokohama|florida|new york|king county|seattle|washington|japan|china|wuhan china|who coronavirus|cdc coronavirus|new coronavirus|what is the coronavirus|symptoms of coronavirus|corona virus|wuhan|corona|covid-19|what is coronavirus|coronavirus|breaking news video|video updates|live video|live updates","984154","5794","2451","3696","https://i.ytimg.com/vi/yoUCDJ6PxUE/default.jpg","False","False","President Trump and the coronavirus task force hold a news conference at White House. Global restrictions are dramatically ramping up amid the growing coronavirus outbreak, with U.S. officials urging Americans abroad to return home or prepare to shelter in place and the entire state of California going into effective lockdown. Read more: https://wapo.st/3a7Q2FM. Subscribe to The Washington Post on YouTube: https://wapo.st/2QOdcqKFollow us:Twitter: https://twitter.com/washingtonpostInstagram: https://www.instagram.com/washingtonpost/Facebook: https://www.facebook.com/washingtonpost/"
"S1ho8DFHCK0","Community Cardio with David Dobrik and Kevin Hart","2020-03-19T16:00:06.000Z","UCLRmIdRJgLfmdpJufmBhBuA","LOL Network","23","20.22.03","What the Fit S3|What the Fit Season 3|What the Fit S1|Kevin Hart|WTF S2|YouTube Originals|YouTube Originals Series|Series|WTF|Fitness|Fun|Funny|Comedy|Laugh|Jimmy Kimmel|Mindy Kaling|Dolan Twins|Ethan Dolan|Grayson Dolan|Keegan-Michael Key|David Dobrik|Keke Palmer|Emma Chamberlain|Nick Jonas|Jonas Brothers|Adam Devine|Chelsea Handler|Harlem|Globetrotters|Galaxy|Soccer","3404398","149982","2030","4375","https://i.ytimg.com/vi/S1ho8DFHCK0/default.jpg","False","False","This episode was filmed on January 18th, 2020 in Los Angeles, CA.  Given the current and evolving situation involving COVID-19, please continue to practice social distancing, stay informed about and comply with local guidelines, and we look forward to working out together someday soon. Kevin Hart wants to motivate an entire city to get healthy, so with the help of David Dobrik, they put out a call for over 1,000 fans to meet up for a community fitness event. The third season of What The Fit starring Kevin Hart follows Kevin and a new squad of famous friends as they continue to inspire the world to work out. They’ll take on the courts of the Harlem Globetrotters, organize a community workout for the entire city, and keep in step with a high school marching band. How much success they’ll have with any of these things is up for debate, but one thing they’ve proved time and time again, is that nothing is too bold, too outrageous or too ridiculous for Kevin and his guests if it can get the world on its feet.FOLLOW THE FUNNY:Facebook▶ http://bit.ly/LOLNetwork-FBTwitter▶ http://bit.ly/LOLNetwork-TWInstagram▶ http://bit.ly/LOLNetwork-IGYouTube▶ https://www.youtube.com/user/HartBeatProductionsSnapchat▶ LOLNetworkOfficial Website▶ http://www.laughoutloud.com Laugh Out Loud is a comedy brand and multi-platform network founded by the world’s top comedian Kevin Hart. Through his network, Hart delivers his vision for the future of comedy: social, mobile, multicultural and seriously funny. From stand-up legends to globally-recognized digital influencers, Hart and LOL curate comedy’s boldest voices to produce original scripted and unscripted series, stand-up specials, live broadcasts and special events. Hart brings the groundbreaking social-first strategy that earned him 100 million+ followers to Laugh Out Loud, with one core mission: keep the world laughing. Dope Comedy. Delivered Daily. Always On. Always Loud. Directly from Kevin Hart and his hand-picked crew of comedic rockstars.© MMXX LIONS GATE TELEVISION, INC.ALL RIGHTS RESERVED. Executive ProducersMATT KUNITZPIP WELLSDAVID SHUMSKYREBECCA SHUMSKY QUINNMARK HARRISJEFF CLANAGANKEVIN HART Co-Executive ProducersMATT KAYED. MAX PORIS Hosted ByKEVIN HART Guest StarringDAVID DOBRIK Directed ByALEX VAN WAGNER Supervising ProducersNICK ALARCON JASON BICERYAN O’LEARY JONES Line ProducerRACHEL KIELBORN ProducersROBYN ADAMSJAMALA GAITHERKRISTINA GOROLEVICHCANDICE C. WILSON Comedy ProducerHARRY RATCHFORDEditorsJASON BERLINERIC TORRES Associate DirectorANNA MOULAISON-MOORE Stage ManagerDREW LEWANDOWSKI Director of PhotographyJEFFREY WILKINS Post Production SupervisorLINDSAY HEMPEL Associate ProducersEMMA ALTMEYERJULIE ATHANSDARIUS CLEMONSJEREMEY CONNORS MICHAEL A. ROWE Art DirectorJOSEPH MYERS Production ManagerGUILLERMO GUTIERREZ Camera OperatorsSCOTT CARRITHERSALEX GARCIAERIK HAMILTONMARQUES SMITHNICK TRAMONTANO SteadicamTRAVIS HAYS Lead Camera AssistantDAVE HAWES Camera AssistantsJOSH CAREYTONY GARCIADE’ANDRE GREENDARY HOSSEINI Tech SupervisorMIKE DELLAMONICA Tech DepartmentANDREW CURTISFRANK D’ALESSANDROWALLACE DIXON DITLUIS HERNANDEZ Audio SupervisorKENYATA WESTBROOK Front of House MixerTRAVIS FRANKLIN Audio MixersBRYAN DIAZJUSTIN JUNIORROBERT P. MATTHEWS JR. A2JORDAN DIAZ GafferAJ TAYLOR Best BoyDANNY VINCENT ElectriciansNATE BECKTIM RYAN Key GripROLAND MARTINEZ Best Boy GripTIM SHINKLE GripsANDRE COSTAJAMES IRONSDAVID GONZALEZMASON SEMBLE Lead ManSEAN GENRICH Set DressersCHRIS DAVISBUDDY RAYJOSH WEBB Production AccountantSHARON PACK Payroll AccountantISABELLA FREDERIKSEN Talent ProducerASHLEY HOLM Talent ManagerRICHARD SMITH-CONNELL Production AssociatesKIERRA FLOWERSHANNAH HIGGINS WardrobeASHLEY NORTHDARI ANN SETTEL MakeupASHLEY TARVER Location ManagerPATRICK THOMPSON Key Assistant Location ManagerLINDSAY STALOFF Transportation CaptainMICHAEL MERRICKTransportation Assistant CaptainMICHAEL MERRICK JR. DriversBRIAN BOZILEROBERT BIRNEYCLAUDIA CASTROCHRIS CLARKJEFF JOHNSONJUSTIN JOHNSONSTEVE MARTINEZRANDY MELLISONANTHONY OLMOSJACK RUDOLPHANTHONY SISCO Lead Assistant EditorCHRIS HICKS Assistant EditorTIM SEELY Online Editor / ColoristJOSIAH COHEN Re-Recording MixerJAMIE SANTOS Talent Casting ByJB TALENT Additional Casting ByKATY WALLIN, CSAJACK MARASHALLIE STONE Music ByUNIVERSAL PRODUCTION MUSIC Graphics ByMIDNIGHT SHERPA MedicADAM LEMCraft ServiceJENNIFER PARKJUSTIN PARK Production AssistantsCHELSEA CHARLESMUSTAN DAWOODJAKE DYBDAHLTIM FORDCYNTHIA MARINAUGUST MORANJOSEPH PETERSALEX ROSELUCIANO RUSSOKELSEY RICHMONDKAFKA SANTILLAN Special ThanksATLAS DIGITALBRUCE’S CATERINGC-MOUNT INDUSTRIESILLUMINARRICK KRIMBELONSET PRODUCTIONSSUNDAY NIGHT DINNER CRAFTYTHE BOSCHETTI GROUPVER EQUIPMENT RENTALS"
"JH398xAYpZA","The Weeknd - Alone Again (Audio)","2020-03-20T04:00:02.000Z","UCF_fDSgPpBQuh1MsUTgIARQ","TheWeekndVEVO","10","20.22.03","The|Weeknd|Alone|Again|(Audio)|Republic|Records","1926527","86180","1228","3838","https://i.ytimg.com/vi/JH398xAYpZA/default.jpg","False","False","Official audio for The Weeknd Alone Again” off the new album ‘After Hours’ – available everywhere now: http://theweeknd.co/afterhoursVD ►Subscribe to The Weeknd on YouTube: http://theweeknd.co/subscribeYD ►Get tickets: https://www.theweeknd.com/tour►Get exclusive merch: https://shop.theweeknd.com/►Follow The Weeknd:https://twitter.com/theweeknd https://www.facebook.com/theweeknd https://www.instagram.com/theweeknd https://www.theweeknd.comMusic video by The Weeknd performing Alone Again (Audio). © 2020 The Weeknd XO, Inc., manufactured and marketed by Republic Records, a division of UMG Recordings, Inc."
"5TtNUaH-gNk","Can We Guess Which Candy Bars Were Combined? (GAME)","2020-03-20T10:00:02.000Z","UCzpCc5n9hqiVC7HhPwcIKEg","Good Mythical MORE","24","20.22.03","gmm|good mythical morning|rhettandlink|rhett and link|mythical|rhett|mclaughlin|link|neal|season 17|s17|good mythical more|gmmore|will it|taste test|Can We Guess Which Candy Bars Were Combined? (GAME)|almond joy|butterfinger","601361","20949","379","1689","https://i.ytimg.com/vi/5TtNUaH-gNk/default.jpg","False","False","Today, we're tasting custom candy bars seeing if we can guess which candy bars were combined to create it. Check it out on Good Mythical MORE, the show after the show! GMMORE #1714Note that today's content was recorded in advance of the US outbreak of COVID-19. Please excuse any reference that is no longer accurate or seemingly disrespectful or unhealthy due to general effects of the COVID-19 pandemic.Subscribe to GMMORE: https://www.youtube.com/goodmythicalmore?sub_confirmation=1Watch today's GMM: https://youtu.be/eRTDGLTuLj8Click the bell icon so you'll know when we add a new episode!Want more GMMORE? Check out these playlists:Season 16 - https://www.youtube.com/playlist?list=PL9VBXk6S6HT8Ng7UBr0LhPJ85ZKScenf5Good Mythical More | Summer 2019: https://www.youtube.com/playlist?list=PL9VBXk6S6HT9FUKo3GyFP2gTwUhyBRD1KGet a copy of our novel, The Lost Causes of Bleak Creek @ http://www.bleakcreek.comPick up official GMM and Mythical merch at https://mythical.comand https://www.amazon.com/mythicalDon’t miss our weekly podcast, Ear Biscuits: https://applepodcasts.com/earbiscuitsJoin the Mythical Society: https://www.mythicalsociety.comFollow Mythical:Instagram: https://instagram.com/mythicalFacebook: https://facebook.com/mythicalTwitter: https://twitter.com/mythicalWebsite: https://mythical.comCheck Out Our Other Mythical Channels:Good Mythical Morning: https://youtube.com/goodmythicalmorningMythical Kitchen: https://youtube.com/mythicalkitchenRhett & Link: https://youtube.com/rhettandlinkWant to send us something? https://mythical.com/contactSubmit your Wheel of Mythicality intro video here: http://bit.ly/GMMWheelIntroSUBMISSIONSIntro Animation by Dana Schechter https://www.danaschechter.com/Intro & Outro Music by Mark Byers http://www.markaholic.com/Supplemental Music from Extreme Production Music: https://www.extrememusic.com/Mic: ‘The Mouse’ by Blue Microphones https://www.bluemic.com/mouse/Get the GMM Set Gear!* Apple AirPort Extreme: https://amzn.to/2NnIvvk* Apple iPad Pro (12.9-inch, Wi-Fi, 64GB) - Space Gray (Latest Model) - MTEL2LL/A: https://amzn.to/2NnKXlw* Guardian Industrial Products DH-CP-4 3 Channel Rubber Cable Ramp (Straight): https://amzn.to/2NdshoR* Cartoni Focus HD Fluid Head with 3 Tube Ultra-Light Tripod, Mid-Level Spreader and Soft Case - Black: https://amzn.to/2X4i7X8* ARRI SkyPanel S60-C LED Softlight (Blue/Silver, Edison): https://amzn.to/2YgM3km* Chef-Master 90050 Professional Heat Lamp, Silver: https://amzn.to/2Xa1Wwr* Samsung UN40H5003 40-Inch 1080p LED TV (2014 Model): https://amzn.to/2NdMU4e* Sony LMDA170 17 Production Video LCD Monitor, 16:9 Native Aspect Ratio, 1080p Resolution: https://amzn.to/2YlB9tH* Behringer Xenyx 1002 Premium 10-Input 2-Bus Mixer with XENYX Mic Preamps and British Eqs: https://amzn.to/2Yeeqzl* Elgato Game Capture Card HD60 S - Stream and Record in 1080p60, for PlayStation 4, Xbox One & Xbox 360 (Renewed): https://amzn.to/2NdOBP6* Pyle Universal Speaker Stand Mount Holder - Heavy Duty Tripod w/ Adjustable Height from 40” to 71” and 35mm Compatible Insert - Easy Mobility Safety PIN and Knob Tension Locking for Stability PSTND2: https://amzn.to/2JcCpce* JBL EON612 Portable 12 2-Way Multipurpose Self-Powered Sound Reinforcement: https://amzn.to/2Ndluvm* Bolt 500 XT 3G-SDI/HDMI Wireless TX/RX: https://amzn.to/2J1OeSk* Voigtlaender 17,5/0,95 Nokton 17.5 mm-17.5 mm Lens: https://amzn.to/2JjUCEP* Blackmagic Design Micro Converter SDI to HDMI (with Power Supply) BMD-CONVCMIC/SH/WPSU: https://amzn.to/2J6iw6y* Panasonic H-HSA35100 F2.8 II ASPH 35-100mm Mirrorless Micro Four Thirds Mount POWER Optical I.S. LUMIX G X VARIO Professional Lens: https://amzn.to/2RAhIul* PANASONIC LUMIX Professional 12-35mm Camera Lens G X VARIO II, F2.8 ASPH, Dual I.S. 2.0 with Power O.I.S., Mirrorless Micro Four Thirds, H-HSA12035 (2017 Model, Black): https://amzn.to/2J9WH5S* Decimator Design DMON-12S | 12 Channel Multi Viewer with HDMI SDI Outputs: https://amzn.to/2J9Xkwg* Decimator MD-HX HDMI and SDI Cross Converter with Scaling & Frame Rate Conversion: https://amzn.to/2Ymj52c* PANASONIC LUMIX GH4 Body 4K Mirrorless Camera, 16 Megapixels, 3 Inch Touch LCD, DMC-GH4KBODY (USA Black): https://amzn.to/2WZjlD6* Blue Microphones Mouse Microphone Kc: https://amzn.to/2Ybu12I"
"87VRaM5_bAE","Jackson Wang - 100 Ways (Official Music Video)","2020-03-20T04:00:06.000Z","UCJS0K01yC8BmQtSuRdqqo3w","Jackson Wang","10","20.22.03","jackson wang|mirrors|got7|bullet to the heart|papillon|dway!|titanic|88rising|head in the clouds|team wang|lostboy|walking|daniel cloud campos|one hundred ways|100 ways|kinjaz|official music video|lyrics","3341414","459637","1761","42293","https://i.ytimg.com/vi/87VRaM5_bAE/default.jpg","False","False","Music video by Jackson Wang performing 100 Ways, out now.Stream/Listen to 100 Ways: https://TEAMWANG.lnk.to/100WaysIDSpotify: https://TEAMWANG.lnk.to/100WaysID/spotifyApple Music: https://TEAMWANG.lnk.to/100WaysID/applemusiciTunes: https://TEAMWANG.lnk.to/100WaysID/itunesAmazon Music: https://TEAMWANG.lnk.to/100WaysID/amazonmusicYouTube Music: https://TEAMWANG.lnk.to/100WaysID/youtubemusicTidal: https://TEAMWANG.lnk.to/100WaysID/tidalDeezer: https://TEAMWANG.lnk.to/100WaysID/deezerGoogle Play: https://TEAMWANG.lnk.to/100WaysID/google-playMusic Produced by: LostboyMusic Video Directed by Daniel Cloud CamposProduction Company: Collidoscope LLCChoreography by and featuring: The Kinjazhttps://www.youtube.com/user/TheKinjazOfficial 100 Ways LyricsYou turn over the hour glassThe sand is falling down, oh it’s too fast for youFor you, for youDon’t waste your love, just let it last Cause once it's gone, it's never coming back It’s trueCould you love me the same?Tell me what makes you stayThere’s a hundred ways to leave a loverLeave a loverLeave a loverHundred ways to leave a loverLeave a loverLeave a... There’s a hundred ways to leave a loverI won’t wait a minute longerHundred ways to leaveBut I’m the only one that you needIt’s the final curtain call, but if you’re ready I will give my allFor you, for youLet them say it how they wantIf I can love you good, it's no one's faultOohCould you love me the same?Tell me what makes you stayThere’s a hundred ways to leave a loverLeave a loverLeave a loverHundred ways to leave a loverLeave a loverLeave a...There’s a hundred ways to leave a loverI won’t wait a minute longerHundred ways to leaveBut I’m the only one that you needI’m the only one that you needI’m the only one that you needI’m the only one that you needThere’s a hundred ways to leave a loverLeave a loverLeave a loverHundred ways to leave a loverLeave a loverLeave a...There’s a hundred ways to leave a loverI won’t wait a minute longerHundred ways to leaveBut I’m the only one that you needI’m the only one that you needI’m the only one that you needFollow Jackson WangOfficial Instagram: http://instagram.com/jacksonwang852g7Official Twitter: http://twitter.com/JacksonWang852Official Facebook: http://facebook.com/jacksonwang852g7Official Weibo: http://weibo.com/jacksonwangG7Subscribe to Jackson Wang's YouTube Channel: http://TEAMWANG.lnk.to/YouTube#100Ways #JacksonWang"
"hURUDrx33TU","Coronavirus: Death toll passes 10,000 - BBC News","2020-03-20T12:45:55.000Z","UC16niRr50-MSBwiO3YDb3RA","BBC News","25","20.22.03","bbc|bbc news|news","1220703","8220","752","4114","https://i.ytimg.com/vi/hURUDrx33TU/default.jpg","False","False","Death toll passes 10,000, confirmed cases near 250,000, more than 80,000 recovered Please subscribe HERE http://bit.ly/1rbfUog"
"koPg_DZUfOc","2020 MacBook Air Impressions: A Clean Refresh!","2020-03-20T12:30:40.000Z","UCBJycsmduvYEL83R_U4JriQ","Marques Brownlee","28","20.22.03","Macbook Air|2020 Macbook Air|new Macbook Air|Macbook air review|impressions|Macbook|Macbook hands on|MKBHD","2178737","105940","1601","4982","https://i.ytimg.com/vi/koPg_DZUfOc/default.jpg","False","False","The new MacBook Air! What a time to be alive... and releasing new products.MKBHD Merch: http://shop.MKBHD.comVideo Gear I use: http://kit.co/MKBHD/video-gear#recom...Tech I'm using right now: https://www.amazon.com/shop/MKBHDIntro Track: https://youtube.com/20sylPlaylist of MKBHD Intro music: https://goo.gl/B3AWV5~http://twitter.com/MKBHDhttp://instagram.com/MKBHDhttp://facebook.com/MKBHD"
