video_id,title,publishedAt,channelId,channelTitle,categoryId,trending_date,tags,view_count,likes,dislikes,comment_count,thumbnail_link,comments_disabled,ratings_disabled,description
"s0h7WwWdt_s","Who Is The Fastest FaZe Member? - Challenge","2020-03-15T21:47:10.000Z","UCvxfEIG3PHpgM0TMJJ_SH-w","Jarvis","24","20.22.03","[none]","1574779","58100","2029","2758","https://i.ytimg.com/vi/s0h7WwWdt_s/default.jpg","False","False","Who is the fastest FaZe member with FaZe Teeqo, Cizzorz, Temperrr, FaZe Kay, and TeaWap! 5 likes for more FaZe House challenges?!🕺 TikTok: https://www.tiktok.com/@jarvis📸 Instagram: https://www.instagram.com/fazejarvis🐦 Twitter: https://www.twitter.com/liljarviss🍉 edited by TeaWaphttps://instagram.com/TeaWap"
"XdOCnXYNI2k","Resumen | América 0 - 1 Cruz Azul | Liga Mx Clausura 2020 - Jornada 10 | TUDN","2020-03-16T04:57:31.000Z","UCSo19KhHogXxu3sFsOpqrcQ","TUDN USA","17","20.22.03","Televisa|Univision|TUDN|Televisa deportes|Deportes|futbol mexicano|Liga Mx|Liga Mx 2020|Clausura 2020|Jornada 10|America vs Cruz Azul|Aguilas vs Maquina|America Liga Mx|Cruz Azul Liga Mx|Clasico Capitalino|Clasico Joven|Clasico|Viñas|Cordova|Renato Ibarra|Caso Renato Ibarra|Piojo Herrera|Piojo|Cabecita Rodriguez|Jesus Corona|Chuy Corona|Resumen América vs Cruz Azul|Resumen|atajada de corona|Atajada|Penal|Penal fallado de America|Coronavirus","371173","1826","280","525","https://i.ytimg.com/vi/XdOCnXYNI2k/default.jpg","False","False","Cruz Azul exhibe al América en el 'adiós' del Clausura 2020. En los últimos minutos del partido, las Águilas pudieron empatar, pero Jesús Corona atajó el penal.Síguenos en nuestras redes sociales:https://www.facebook.com/tudnusa/https://www.instagram.com/tudnusa/https://twitter.com/TUDNUSASitio Web: https://www.tudn.com/TUDN USA te ofrece la cobertura más completa del mundo deportivo con lo mejor del fútbol mexicano, de Estados Unidos y del mundo, boxeo, UFC, las grandes personalidades del deporte y mucho más.#Clausura2020  #América #Chivas"
"QmR9t8s2xb0","I never wanted to make this video","2020-03-15T19:00:22.000Z","UCbO9bltbkYwa56nZFQx6XJg","Manny Mua","26","20.22.03","manny mua|lunar beauty|makeup revolution|makeup revolution copy|laura lee|james charles|new makeup|new makeup 2020|glass collection|moon prism powder","1631055","56901","9942","7605","https://i.ytimg.com/vi/QmR9t8s2xb0/default.jpg","False","False","hey guys, todays video is a bit different then the usual video. Thank you guys for hearing me out, what do you think about this? let me know down below!Lunar Beauty - https://lunarbeauty.comSNAPCHAT - MannymuaIf you wanna join the Mannyac family... Subscribe to my Channel here - http://goo.gl/fLSvRP Instagram - http://instagram.com/mannymua733Twitter - https://twitter.com/MannyMua733----------------------------------------------------------------------------------------------------------------AFFILIATES! I SERIOUSLY appreciate it so much when you guys use my codes and links :D means a lot to me guys. Thank you for always supporting me! Colourpop Cosmetics - Use code MANNYMUA To save 10% off all new releases and makeup! - https://colourpop.com/Morphe Brushes - use code MANNYMUA all caps for 10% off everything! - http://morphebrushes.com/index.phpTARTE cosmetics - use code “MANNYMUA” to save 15% off Tarte! - https://tartecosmetics.comArdency Inn - Use code MANNYMUA to save 15% off - https://www.ardencyinn.comJouer - Use code MANNYMUA to save 15% off - https://www.jouercosmetics.comOfra x MannyMua Lipsticks - ofracosmetics.com/mannyxofra Use code Mannymua to save you 30% off entire site! :DArtist Couture - Use code MANNYMUA to save 15% off! - http://www.artistcouture.comNubounsom Lashes - use code MANNYMUA for 20% off! - http://nubounsom.comLilly Lashes - use code MANNYMUA for %10 off! - https://lillylashes.com/----------------------------------------------------------------------------------------------------------------Music - NoCopyRightSounds as always! They're amazing! Check them out - https://www.youtube.com/user/NoCopyrightSoundsSad Money https://soundcloud.com/sadmoneymusic--------------------------------------------------------------------------------------------Disclaimer: All opinions in today’s video are my own! I will always state when a video is sponsored and I’ve partnered with a brand. I do earn a small commission when my code and some links are used. Thank you for the support!  See you in my next video :D"
"RVCyeX7AWpE","Gordon Ramsay Shows a NFL Star How To Make The Perfect Ribeye","2020-03-15T16:38:02.000Z","UCIEv3lZ_tNXHzL3ox-_uUGQ","Gordon Ramsay","24","20.22.03","Gordon|Gordon Ramsay|Ramsay|Ramsey|Chef Ramsay|Recipe|Recipes|Food|Cooking|Cookery|Baltimore Raven|Gordon ramsay steak|Baltimore Ravens gordon ramsay|Baltimore Ravens steak|gordon ramsay steak tutorial|gordon ramsay cooking tips|gordon ramsay|baltimore ravens|NFL|steak","2064501","29426","803","1622","https://i.ytimg.com/vi/RVCyeX7AWpE/default.jpg","False","False","Gordon was in Baltimore a few weeks ago at Gordon Ramsay Steak at the Horseshoe Casino to surprise some culinary students as well as give a NFL Star, who's also a Super Bowl Winner, Baltimore Raven Sam Koch a lesson in how to make the perfect Ribeye. And get ready for next week when Sam gives Gordon a lesson.....For Reservations at Gordon Ramsay Steak Baltimore: http://bit.ly/GRSBaltimore Follow Gordon: Follow Gordon: Text him: +1 (310) 620-6468Instagram: http://www.instagram.com/gordongramTwitter: http://www.twitter.com/gordonramsayFacebook: http://www.facebook.com/GordonRamsay"
"3oUbUru-krE","COVID-19: Canada announces new travel restrictions","2020-03-16T20:59:53.000Z","UCuFFtHWoLl5fauMMD5Ww2jA","CBC News","25","20.22.03","COVID-19|coronavirus|Coronavirus outbreak|outbreak|Canada|public health|health|travel|self-isolation|Trudeau|Justin Trudeau|Canada border|Canada border coronavirus|Canada closing border|travel restriction|travel ban|pandemic|coronavirus pandemic|CBC News","862875","4388","1320","674","https://i.ytimg.com/vi/3oUbUru-krE/default.jpg","False","False","Canada is barring entry to all travellers who are not Canadian citizens, permanent residents or Americans, Prime Minister Justin Trudeau has announced. (Trudeau begins to speak at 39:25.)To read more: https://www.cbc.ca/1.5498835»»» Subscribe to CBC News to watch more videos: http://bit.ly/1RreYWSConnect with CBC News Online:For breaking news, video, audio and in-depth coverage: http://bit.ly/1Z0m6iXFind CBC News on Facebook: http://bit.ly/1WjG36mFollow CBC News on Twitter: http://bit.ly/1sA5P9HFor breaking news on Twitter: http://bit.ly/1WjDyksFollow CBC News on Instagram: http://bit.ly/1Z0iE7ODownload the CBC News app for iOS: http://apple.co/25mpsUzDownload the CBC News app for Android: http://bit.ly/1XxuozZ»»»»»»»»»»»»»»»»»»For more than 75 years, CBC News has been the source Canadians turn to, to keep them informed about their communities, their country and their world. Through regional and national programming on multiple platforms, including CBC Television, CBC News Network, CBC Radio, CBCNews.ca, mobile and on-demand, CBC News and its internationally recognized team of award-winning journalists deliver the breaking stories, the issues, the analyses and the personalities that matter to Canadians."
"sSZBdwnVkgg","7-ELEVEN DOMINOS PIZZA (BOBA) & LUXURY Instant Noodles! 24 Hours Only Eating 7-ELEVEN in Taipei","2020-03-15T16:32:36.000Z","UCXOKEdfOFxsHO_-Su3K8SHg","Strictly Dumpling","19","20.22.03","taiwan 7 eleven|7-eleven|7-11|seven eleven|taipei 7-11|taipei 7 eleven|taiwan 7-11|taipei taiwan|taiwanese food|taiwan food|7-11 food|7 eleven food|taiwan eats|taiwanese eats|ramen|ramen noodles|instant ramen|noodles|dominos pizza|pizza|boba pizza|travel taiwan|food tour|taiwan food tour|travel taipei","1562600","32776","947","2272","https://i.ytimg.com/vi/sSZBdwnVkgg/default.jpg","False","False","I'm back in #Taiwan Taipei for a 24 hour #7Eleven food tour. The 7- Eleven in Taipei Taiwan had a #DOMINOS pizza! With bubble tea boba pizza! I also found some luxury royal instant noodles.★ Check out my Twitch: https://www.twitch.tv/eatwithmikey***MORE EXCLUSIVE Content on Instagram***✩ http://instagr.am/Mikexingchen➔ Get tickets to the best show on earth!!! http://bit.ly/2gu7REI✸ Strictly Dumpling T-Shirts HERE: http://bit.ly/2IVM2ts➣ Subscribe for MORE videos about food! http://bit.ly/1hsxh41➣ Subscribe to my Vlog Channel! https://bit.ly/2FJOGo1------------------------------------------------------------------------------------------★↓FOLLOW ME ON SOCIAL MEDIA!↓★Facebook Show Page: https://www.facebook.com/strictlydumplingFacebook Mike Fan Page: https://www.facebook.com/mikeychenxTwitter: http://twitter.com/Mikexingchen◈ Equipment I use for filming◈ :Sony RX100 Mark V: https://go.magik.ly/ml/cgc5/PANASONIC LUMIX G85: https://go.magik.ly/ml/cgcd/Wide Angle Lens: https://go.magik.ly/ml/cgck/Camera Mic: https://go.magik.ly/ml/cgcn/Camera Lights: https://go.magik.ly/ml/cgcq/Handheld Audio Recorder: https://go.magik.ly/ml/cgcr/Tripod: https://go.magik.ly/ml/cgcu/Drone: https://go.magik.ly/ml/cgcx/My Favorite Cookware！wok/pan http://amzn.to/2f5G0upAlso this pan http://amzn.to/2f5QnyiPressure pan http://amzn.to/2wJIS7uNonstick pot http://amzn.to/2wHRgq1-------------------------------------♫ Music from: Epidemic Soundhttp://www.epidemicsound.com"
"UTw-MMk98h4","Dutch Oven Fun - Rooster Teeth Animated Adventures","2020-03-16T13:00:13.000Z","UCzH3iADRIq1IJlIXjfNgTpA","Rooster Teeth","23","20.22.03","Rooster Teeth|RT|animation|television|filmmaking|games|video games|comics|austin|texas|production|movies|web series|RTAA|Animated Adventures|animated|stick figures|short|sketch|skit|comedy|humor|real life animated|jordan cwierz|storytelling|personal|embarrassing|history|Gus Sorola|James Willems|Bruce Greene|Burnie Burns|Funhaus|farts|green room|brown room|dutch oven|gas|rip|corner|manager|cloud|filthy|fart|dodgeball|Seatle","285328","9935","158","92","https://i.ytimg.com/vi/UTw-MMk98h4/default.jpg","False","False","The Funhaus team is a little too gassy for Gus' taste. Join FIRST to watch episodes early: http://bit.ly/2uRn6OxAudio from: Rooster Teeth Podcast #341https://roosterteeth.com/watch/rt-podcast-season-1-the-mathematic-mishap-341» Get your RTAA merch: http://bit.ly/2tRKzOf» Subscribe: http://bit.ly/13y3GumAnimated by: Quinn WestonDirected by: Jordan BattleAbout Rooster Teeth Animated Adventures:The animated shenanigans of the Rooster Teeth staff. Audio taken from various Rooster Teeth podcasts.More Rooster Teeth:» Achievement Hunter: http://bit.ly/AHYTChannel » Let's Play: http://bit.ly/1BuRgl1 » Rooster Teeth Animation: http://bit.ly/RTAnim_Channelhttps://www.youtube.com/user/RoosterTeeth#RTAA #RoosterTeethAnimatedAdventures #RoosterTeeth"
"A1D520DnCZE","6 Asians vs 1 Secret Non-Asian","2020-03-15T14:00:02.000Z","UCJjSDX-jUChzOEyok9XYRJQ","Jubilee","24","20.22.03","jubilee|jubilee media|jubilee project|live deeper|blind devotion|love language|middle ground|spectrum|odd man out|jubilee odd man out|6 asians vs 1 secret non asian|asian american|asians vs asian american|who is not asian?|who is the mole?|odd man out asians|odd man out asians blindfolded","1918853","64414","2490","7486","https://i.ytimg.com/vi/A1D520DnCZE/default.jpg","False","False","PRE-ORDERS for our latest humangood drop SURFACE LEVEL ends 3/18! Get yours before it sells out! 👉https://humangoodla.com 👈Follow us on INSTAGRAM: 👉https://www.instagram.com/jubileemedia/ 👈SUBSCRIBE for more! http://bit.ly/SUBSCRIBEjubilee Be in a Jubilee video: http://bit.ly/JubileeCastingAre you a loyal Jubilee fan? Join our Facebook group: https://www.facebook.com/groups/407942859721012/| ABOUT |We believe in the power of empathy for human good. Ultimately, we aim to inspire people to EMBRACE EMPATHY.| SOCIAL |Jubilee Facebook: https://www.facebook.com/jubileemediaJubilee Instagram: https://www.instagram.com/jubileemedia/Jubilee Twitter: https://www.twitter.com/jubileemediaJubilee Website: https://www.jubileemedia.comFEATURING:Aaron - https://www.instagram.com/aaron_seng_/Brianna - https://www.instagram.com/nanirotten/Kriselle - http://instagram.com/krisellemg/Michelle - https://instagram.com/michelleepark/Preet - https://instagram.com/preetchristian/Zaldy - https://www.instagram.com/zaldytv/For brands interested in partnering with Jubilee, email us:hello@jubileemedia.comHelp us caption & translate this video!https://amara.org/v/C0QHV/"
"9SSYviES-rI","Coronavirus outbreak: WHO says key to stopping COVID-19 spread is 'test and isolate'","2020-03-16T16:56:47.000Z","UChLtXXpo4Ge1ReTEboVvTDg","Global News","25","20.22.03","coronavirus|COVID-19|corona virus|coronavirus update|coronavirus news|coronavirus latest news|coronavirus update news live stream|coronavirus outbreak|global news live|corona virus update|coronavirus pandemic|coronavirus today|WHO update|WHO livestream|WHO coronavirus update|WHO coronavirus response|WHO livestream coronavirus update","331821","1801","582","633","https://i.ytimg.com/vi/9SSYviES-rI/default.jpg","False","False","The World Health Organization's director-general, Dr. Tedros Adhanom Ghebreyesus, said on Monday that while he is pleased to see increased social distancing globally, the best way to stop COVID-19 from spreading is to test and isolate. He said countries must increase testing and isolate those who test positive, as well as close contacts, stressing their key message is test, test, test.Ghebreyesus added that as some countries have exceeded their capacities to care for patients with mild symptoms and they should focus on more severe cases and prioritize those with underlying conditions. He said mild cases could be isolated at home and gave directions on safety procedures on how to take care of patients at home, including sleeping in a different bedroom, using a different bathroom, and wearing protective masks.The director-general called COVID-19 the defining global health crisis of our time, and that fighting it would be a test of trust in science and in solidarity. He said moments like people applauding health workers in places like Italy shows the type of human solidarity that should become more infectious than the disease.***Please note that this press conference is virtual. ***For more info, please go to https://globalnews.ca/news/6683518/who-testing-coronavirus-march-16/Subscribe to Global News Channel HERE: http://bit.ly/20fcXDcLike Global News on Facebook HERE: http://bit.ly/255GMJQFollow Global News on Twitter HERE: http://bit.ly/1Toz8mtFollow Global News on Instagram HERE: https://bit.ly/2QZaZIB#GlobalNews #COVID19 #Coronavirus"
"FmohRbF1O1s","Dog Who Wanted To Hide From The World Learns To Let Love In | The Dodo","2020-03-15T13:00:03.000Z","UCINb0wqPz-A0dV9nARjJlOQ","The Dodo","15","20.22.03","animal video|animals|the dodo|Animal Rescue|dodo|cute animals|pets|wildlife|pet videos|wildlife videos|animals the dodo|the dodo animals|rescuing animals|husky|lilac the husky|the dodo husky|husky adoption|adopting a husky|the dodo dog|dogs|husky dogs|stray dog","1988904","56008","956","2989","https://i.ytimg.com/vi/FmohRbF1O1s/default.jpg","False","False","Lilac, a stray husky was found living outside of an elementary school. She lived there for so long that she just wanted to hide from the world. But finally, she's learning to let love in.Special thanks to Hope for Paws: http://thedo.do/hfp. You can follow them for rescue updates! Special thanks also to Farren & Tanja for sharing their amazing footage with us!( reference: https://www.facebook.com/hopeforpawscalifornia)Introducing Dodo swag!  https://shop.thedodo.com/Love Animals? Subscribe: http://thedo.do/2tv6Ocd¿Hablas español?: https://thedo.do/2BsuN4oFollow The Dodo:Tweet with us on Twitter: https://thedo.do/2Jast1MHowl with us on Musical.ly: https://thedo.do/2qFkbGTTake a peek at our Snapchat: http://thedo.do/2gkVhszLove our Instagram: http://thedo.do/2agAEceLike us on Facebook: http://thedo.do/1dJ9lmnRead more on our site: http://thedo.do/KWDoNtFor the love of animals. Pass it on.#thedodo #animals #dog #cat #kitten #puppy"
"jozTz1lzOA0","Holo Taco Unicorn Skin Collection Reveal🦄","2020-03-15T15:31:32.000Z","UCGCVyTWogzQ4D170BLy2Arw","Simply Nailogical","24","20.22.03","nails|nail art|nail tutorial|beauty tutorial|nail art tutorial|diy nails|diy nail art|simply nailogical|cristine|HOLO TACO|unicorn skin|not milky white|one coat white|iridescent|unicorn skin nail polish|holo taco collection box|white nail polish|unicorn nails|colour changing nails|shifting nails|trend nails|flakies|flakie nail polish|iridescent flakes|magic nails|magic nail polish","1174972","97251","701","8394","https://i.ytimg.com/vi/jozTz1lzOA0/default.jpg","False","False","Got boring nails? Just add a Unicorn Skin🦄Shop ➡️ http://holota.co/simplyunicornskin♡ Subscribe to never miss n̶e̶w̶ ̶n̶a̶i̶l̶ ̶a̶r̶t̶ ̶t̶u̶t̶o̶r̶i̶a̶l̶s̶! http://bit.ly/subsimply♡ Subscribe to Holo Taco (for nail videos lol): http://bit.ly/SubHoloTaco♡ Subscribe to the Podcast to hear me have adult conversations: http://bit.ly/SubSimplyPodLogical_ _ _ _ _ _ _ _ _ _ _ _ _ _ _ _ _ _ _ _ _ _ _ _ _ _ _ _ _ _ _ _ _ _💿🌮🦄NOW AVAILABLE: http://holota.co/simplyunicornskin♥ Holo Taco Unicorn Skin Collection box set - $60 (USD) ***LIMITED EDITION and LIMITED QUANTITIES of box*** ♥ 3 Iridescent Flakie toppers polishes - $13♥ 2 new crème polishes, Indigo Away and Not Milky White -$11Note: The collection box set is limited edition and there will not be a restock. The individual polishes are not limited edition, and will restock if sold out so long as supplies and materials are available.***UPDATE MARCH 15: The collection box set sold out within 12 hours of launch! The 3 Unicorn Skin toppers and 2 crème polishes will be restocked as individual polishes. Thank you guys for your support💞***Don't forget to pick up the following to complete the perfect mani!♥ Glossy Taco or Super Glossy Taco, for that super smooth glossy finish and to make your nail polish last longer without chipping: http://holota.co/sosoglossy♥ Flakie Holo Taco (back in stock after 7 months of dry supply!): https://www.holotaco.com/products/flakie-holo-taco♥ Long-Lasting Base coat: http://holota.co/simplylonglastingbase♥ Smoothing Base coat: http://holota.co/simplysmoothingbaseFollow the holo:https://www.instagram.com/holotaco/https://twitter.com/holotacohttps://www.facebook.com/holotaco/Nail polish thinner - any kind works! https://amzn.to/2CSEtmAOld-school Simply unicorn skin origins:2017: http://bit.ly/UnicornSkinTests2016: http://bit.ly/UltimateUnicornNails2016: http://bit.ly/UnicornVeinsAllure article: https://www.allure.com/story/iridescent-nail-art-trendIf you're bored at home, catch up on our podcast episodes! http://bit.ly/SubSimplyPodLogical_ _ _ _ _ _ _ _ _ _ _ _ _ _ _ _ _ _ _ _ _ _ _ _ _ _ _ _ _ _ _ _ _ _Stalk me on all the social medias!http://instagram.com/simplynailogicalhttps://www.snapchat.com/add/simplynailogicahttps://twitter.com/nailogicalhttps://www.facebook.com/simplynailogicalhttp://www.simplynailogical.com (archival materials)My other YouTube channels:https://www.youtube.com/simplypodlogicalhttps://www.youtube.com/holotacohttps://www.youtube.com/simplynotlogical_ _ _ _ _ _ _ _ _ _ _ _ _ _ _ _ _ _ _ _ _ _ _ _ _ _ _ _ _ _ _ _ _ _I film my nail videos with this camera: http://amzn.to/1MgznhtThis 105mm macro lens: http://amzn.to/1Pi8PM3I filmed my face in this video with this camera: https://amzn.to/327OB7bThis lens: https://amzn.to/38HnBgUVoiceover mic: http://amzn.to/1MefGpGAudio recorder: http://amzn.to/2cU7t3jExternal mic: https://amzn.to/32AnO3gRing light for face-cams: http://amzn.to/2cU7cNOI edit my videos with: http://bit.ly/videoeditor1I get some cool editing filters from: https://motionvfx.sjv.io/Ze3bRCheck out my personalized Amazon page with stuff I like! https://www.amazon.com/shop/simplynailogicalMusic: http://share.epidemicsound.com/SIMPLY_ _ _ _ _ _ _ _ _ _ _ _ _ _ _ _ _ _ _ _ _ _ _ _ _ _ _ _ _ _ _ _ _ _Disclaimer cause I love you guys: I didn't pay myself specifically to make this video for Holo Taco but I do benefit from Holo Taco sales so I'm not sure what disclosure to write, fire me😹 Some other links above are affiliate links."
"DCdxKgJFX9Q","I'm in Quarantine in Germany","2020-03-15T21:39:00.000Z","UC1n_PfsVqxllCcnMPlxBIjw","Wilbur Soot","20","20.22.03","wilbur soot|live|wilbur live|wilbur plays","811350","69154","1075","7305","https://i.ytimg.com/vi/DCdxKgJFX9Q/default.jpg","False","False","I need food and a plane ticketFollow me:https://twitter.com/WilburSoot                    https://www.instagram.com/wilbursoot/Thumbnail: James MarriottEdited: me (on a trackpad laptop)Music used:Incompetech - Kevin Macleod"
"Gq7yFiki0Qs","Coronavirus: What Are The Facts?","2020-03-15T17:00:26.000Z","UC-FQUIVQ-bZiefzBiQAa8Fw","BBC Radio 1","25","20.22.03","coronavirus|covid19|covid-19|wuhan|virus|pandemic|bbc|bbc news|newsbeat|bbc newsbeat|bbc radio 1|radio one|radio 1|epidemic|self isolate|social distancing|work from home|china|pangolin|bats|bat|pangolins|nhs|111|wash your hands|disease|illness|fever|dry cough","502508","4097","754","0","https://i.ytimg.com/vi/Gq7yFiki0Qs/default.jpg","True","False","For the latest advice on Coronavirus Covid-19 disease from the NHS go to: https://111.nhs.uk/And get the latest news on the pandemic from BBC here: https://www.bbc.co.uk/newsBBC Newsbeat's Kirsty Grant gets to the truth behind the Covid-19 pandemic, including where it came from, how to protect yourself from it and how it might affect us in the future.--Official Channel of BBC Radio 1Here you can find your favourite live performances, the biggest movie stars, amazing interviews and more... Still haven’t subscribed to Radio 1 on YouTube? ►► https://goo.gl/QSjLSr Follow us on socials:https://en-gb.facebook.com/bbcradio1/https://twitter.com/bbcr1https://www.instagram.com/bbcradio1/https://www.bbc.co.uk/radio1"
"LwrlLN0XxPg","Single Dad (Jason Nash) Surprises His Kids with Room Makeovers! Mr. Kate","2020-03-14T21:32:28.000Z","UCDVPcEbVLQgLZX0Rt6jo34A","Mr. Kate","26","20.22.03","[none]","2168169","105891","1052","3875","https://i.ytimg.com/vi/LwrlLN0XxPg/default.jpg","False","False","Watch Part 1 here: https://www.youtube.com/watch?v=5WtU3kNGnts and subscribe!Huge thanks to Function of Beauty for sponsoring today's episode! Get 20% off your custom hair formula here: https://cen.yt/functionmrkate+JOIN THE CREATIVEWEIRDO FAM and SUBSCRIBE!: http://bit.ly/mrkateyoutube+SUBSCRIBE TO JASON!: https://www.youtube.com/user/JasonNashComedy#vlogsquad #interiordesign #makeover #creativeweirdosClick here https://cen.yt/functionmrkate to get 20% off your custom formula from Function of Beauty. Available in the US, GB, EU, CA, AUS, NZ & more! Function of Beauty makes unique personalized hair care that is vegan and cruelty-free._________________________Tik Tok: @mrkate Instagram: http://www.instagram.com/mrkate and http://www.instagram.com/joeyzehr Snapchat: MrKateTwitter: http://www.twitter.com/mrkateFacebook: http://www.facebook.com/mrkatedotcomPinterest: http://www.pinterest.com/mrkate/Blog Post: https://mrkate.com/2020/03/14/jason-nash-surprises-teen-kids-with-bedroom-makeovers/ Become a member for exclusive VLOGS, LIVE CHATS, EMOJIS, BADGES and DISCOUNT CODES: https://www.youtube.com/channel/UCDVPcEbVLQgLZX0Rt6jo34A/join _________________________Related Videos!:  LIZA KOSHY GUEST BEDROOM  MAKEOVER:LIZA KOSHY PATIO MAKEOVER:BROTHER AND SISTER BEDROOM MAKEOVERS: _________________________Shop these rooms!: Charley’s Room:Duvet: http://bit.ly/2wRvpPtRug: http://bit.ly/2TPjyKxWallpaper: http://bit.ly/2TOKb2jBed: http://bit.ly/2vp23YiSide Table: http://bit.ly/33gJou9 Dresser: http://bit.ly/2wXcxOM Rattan Chair: http://bit.ly/2xFtbmJ  Mirror (similar): http://bit.ly/2TSlz97  Desk Chair: https://bit.ly/2vUeRGp Purple Blanket: http://bit.ly/38VmZUA Peach Curtains: http://bit.ly/39Q0mC7 White Curtains: http://bit.ly/2TS96lLWhite Pillow: http://bit.ly/38SCLPQ Cloud Lamp: http://bit.ly/2TOEeCB Potted Hydrangeas: http://bit.ly/39SB2voPotted Succulents: http://bit.ly/39OIyXT Starry Lamp: http://bit.ly/33jep0IWooden Llama: http://bit.ly/2IJNDoz Flower Mirror: http://bit.ly/33jgSI8Plush Narwhal: http://bit.ly/2wTXbe8 Wyatt’s Room: Wallpaper: http://bit.ly/2TMhByCFloor Lamp: http://bit.ly/38KdhnKCabinets: http://bit.ly/39PNtaZ Bedding: http://bit.ly/2xA4xnf Bed (similar): http://bit.ly/2xDAgnF Side Table: http://bit.ly/39SAMwqMetal Side Table: http://bit.ly/38OkRh6Blue Chair: http://bit.ly/33lN8KPRug: http://bit.ly/39Rb37xWoven Stool (similar): http://bit.ly/33jUuyl Striped Blanket: http://bit.ly/38ONoDd Gold Frame: http://bit.ly/2TODxJvMagnifying Glass: http://bit.ly/39RmwnrFaux Tree: http://bit.ly/39RmtrL Wall Mirror: http://bit.ly/2TS9hgV _________________________Creative Credit: Audio Tracks - Epidemic Sound: http://share.epidemicsound.com/rGjgCA Mr. Kate ProductionExecutive Producers: Kate Albrecht and Joey ZehrDirected and Edited by: Vianne RobitailleProducer: Annie O’RourkeShot by: Marco Bottiglieri, David RivieraAssistant Camera: Noah MaxeySound: Blake ChristianArt Department: Emily Banks, Leo Martinez, Gabe Gonzales, Amy Patterson"
