video_id,title,publishedAt,channelId,channelTitle,categoryId,trending_date,tags,view_count,likes,dislikes,comment_count,thumbnail_link,comments_disabled,ratings_disabled,description
"AiGKBNGlzHo","I Ran A Marathon In The World's Largest Shoes","2020-03-21T20:00:02.000Z","UCX6OQ3DkcsbYNE6H8uQQuVA","MrBeast","24","20.22.03","[none]","10207586","717368","8771","39821","https://i.ytimg.com/vi/AiGKBNGlzHo/default.jpg","False","False","Get the best deals while you’re stuck at home ▸ http://joinhoney.com/mrbeastHoney is FREE and finds coupons with the click of a button. Thanks Honey for sponsoring!New Merch - https://shopmrbeast.com/SUBSCRIBE OR I TAKE YOUR SHOES (my leg hurt)----------------------------------------------------------------follow all of these or i will kick you• Facebook - https://www.facebook.com/MrBeast6000/• Twitter - https://twitter.com/MrBeastYT•  Instagram - https://www.instagram.com/mrbeast--------------------------------------------------------------------"
"u2lh3yCKWbc","My Wife Destroys My $100,000 Truck with a CrowBar","2020-03-22T00:14:32.000Z","UCdqp0KK_Io7TwK5cJMBvB0Q","WhistlinDiesel","22","20.22.03","[none]","420034","18924","3465","6042","https://i.ytimg.com/vi/u2lh3yCKWbc/default.jpg","False","False","I hand my wife the crowbar and let her go HAM on the body panels. Sending a message that it really doesn't matter what trim package your expensive new truck has because that thang gonna be in the junkyard soon. Retro Customz www.retrocustomz.com @retrocustomz1 #happilymarried"
"8zYAOR7DZoU","Filling my ENTIRE House with BALL PIT BALLS!! **insane**","2020-03-21T18:20:26.000Z","UCilwZiBBfI9X6yiZRzWty8Q","FaZe Rug","24","20.22.03","faze rug|rug|rugfaze|fazerug|ball pit|ball pit balls|plastic balls|filling my house|filling my entire house|filling my entire house with ball pit balls|filling my house with ball pit balls|filling my house with plastic balls|filling my entire house with plastic balls|house ball pit|insane ball pit|ball pit in house","1238833","81073","1260","9388","https://i.ytimg.com/vi/8zYAOR7DZoU/default.jpg","False","False","THAT WAS SO COOL• Be sure to download CURRENT: https://www.current.com/FaZeRugI decided to fill my entire house with 100,000 plastic balls since I have nothing else to do.. It was actually CRAZY!!GO SUBSCRIBE TO BRANDON NOW:https://www.youtube.com/channel/UCvtRTOMP2TqYqu51xNrqAzg• JOIN THE RUGRAT ARMY ► http://bit.ly/SubToRugGO SPAM MY OTHER PAGES!!Instagram ► https://www.instagram.com/fazerug/TikTok ► https://www.tiktok.com/@rugFacebook ► https://www.facebook.com/RealFaZeRug/Twitter ► https://twitter.com/FaZeRugSnapchat ► thefazerug If you're reading this that means you noticed I changed the last line of my description and I STILL LOVE YOU :)"
"VNP30CyV7qo","Nightly News Full Broadcast (March 21st)","2020-03-22T03:11:35.000Z","UCeY0bbntWzzVIaj2z3QigXg","NBC News","25","20.22.03","Nightly Netcast|Nightly News Netcast","1946103","13178","1485","6350","https://i.ytimg.com/vi/VNP30CyV7qo/default.jpg","False","False","More than 80 million Americans under lockdown to slow coronavirus spread, companies step in to manufacture much-needed medical supplies, and inside a hard-hit Italian hospital."
"J5wqeUewAXk","Doing Charli D'Amelio's Makeup!","2020-03-20T19:00:13.000Z","UCucot-Zp428OwkyRm2I7v2Q","James Charles","24","20.22.03","james|james charles|makeup artist|mua|covergirl|coverboy|cute|easy makeup|how-to|reviews|tutorials|funny videos|beauty tips|hacks|beauty|sister|sisters apparel|morphe|james charles x morphe|beauty hacks|makeup routines|e girl makeup|e boy makeup|makeup 2020|prom makeup|how to apply makeup for beginners|tik tok makeup|tik tok hacks|tik tok beauty hacks|charli damelio|charli damelio tik tok|charli damelio makeup|charli damelio james charles|charli","10706800","640126","23969","41656","https://i.ytimg.com/vi/J5wqeUewAXk/default.jpg","False","False","HI SISTERS! In today's video, I sat down with Charli D'Amelio, Tik Tok star, to talk about makeup, her rise to fame, hate comments, how her life has changed, and so much more! Enjoy and don't forget to thumbs up and subscribe!!Charli's Video » https://youtu.be/LIH8W-TFk5sWebsite: https://www.charlidamelio.com/TikTok: https://www.tiktok.com/@charlidamelioInstagram: https://www.instagram.com/charlidamelio/Twitter: http://twitter.com/charlidamelioYoutube: https://www.youtube.com/charlidamelio🎥 PREVIOUS VIDEO » https://youtu.be/IYQzyA3TjWs👕 SISTER'S APPAREL » http://sisters-apparel.com🛎 Subscribe to my channel to join the sisterhood & hit the notification bell so you never miss an upload! » http://bit.ly/JamesCharles for new videos!__❤️ LET'S BE BFFSINSTAGRAM » http://instagram.com/jamescharlesFACEBOOK » http://facebook.com/jcharlesbeautyTWITTER » http://twitter.com/jamescharlesSNAPCHAT » jamescharlessTIKTOK » jamescharlesSISTERS APPAREL INSTAGRAM » @sistersapparel__💸 COUPON CODES 💸MORPHE BRUSHES » http://morphebrushes.comUse code JAMES for 10% off all products online AND in store!LILLY LASHES » https://lillylashes.com/Use code JAMES for 15% off all lashesLAURAS BOUTIQUE » http://lauras-boutique.comUse code JAMES for 10% off all items__♡ MY AMAZING TEAMDIRECTOR OF CONTENT: Louis Gargiulahttp://instagram.com/louisgargiulaEDITOR: Ryan Allenhttp://www.youtube.com/user/helloxryan GRAPHICS: Michael Rusakovhttp://instagram.com/michael.ny"
"YyEr4HP0fHs","2HYPE 2 HOUR CUSTOM OUTFIT DIY CHALLENGE!","2020-03-21T23:10:02.000Z","UCY4AlDv6wL2qhrX29iwdqAg","2HYPE","17","20.22.03","2hype|lsk|kristopher london|jsr|jesser|cash|zackttg|mopi|jiedel|basketball|nba|custom jordan|jiedel jordan|jesser shoe collection|jiedel shoe collection|2hype shoe collection|custom shoes|jiedel custom|custom shorts|custom|diy|boat|2hype basketball|challenge|family friendly|24 hours|how to|for kids|diy raft|last one wins|custom vans|air force 1s|1 hour","480467","26841","238","4443","https://i.ytimg.com/vi/YyEr4HP0fHs/default.jpg","False","False","Vote who had the best full custom outfit here: http://www.strawpoll.me/19587429/rWelcome to the Official 2HYPE Channel! Uploads are Every Saturday!Subscribe now to be the first like next video!http://www.2hype.comMitchell (Judge): https://www.youtube.com/channel/UCY-BsNVd33_mzyXQzMorv1Q★FOLLOW US ON INSTAGRAM★https://www.instagram.com/2hypehouse/★2HYPE MEMBERS★JESSER -Channel: https://www.youtube.com/user/JesserPlaysInstagram https://www.instagram.com/jesser/KRIS -Channel: https://www.youtube.com/KristopherLondonInstagram: https://www.instagram.com/iamkrislondon/JAMES -Channel: https://www.youtube.com/user/JiedelPlaysInstagram: https://www.instagram.com/jiedel/CASH -Channel: https://www.youtube.com/user/WhatChaMaCallingInstagram: https://www.instagram.com/cashnasty/ZACK -Channel: https://www.youtube.com/channel/UCTs5PJGf9AwnA7mNV3ejNTQInstagram: https://www.instagram.com/zackttg/MOPI -Channel: https://www.youtube.com/channel/UCOYSYNsxTfGTGbMu2c-kpfgInstagram: https://www.instagram.com/commonmopi/Filmed/Edited by Josh: https://www.instagram.com/itsjossha/#2HYPE"
"N4WKdZjnU2s","Cases in coronavirus pandemic surge in US","2020-03-22T01:59:28.000Z","UCBi2mrWuNuyYy4gbM6fU18Q","ABC News","25","20.22.03","cases|coronavirus|COVID-19|US|surge|new|york|pandemic|soared|health|world|news|wnt|abc|p_cmsid=2494279|p_vid=news-69731549","2102542","16587","2432","11554","https://i.ytimg.com/vi/N4WKdZjnU2s/default.jpg","False","False","The number of cases in the U.S. soared to more than 24,000 while New York now has more than 11,000 cases.WATCH THE FULL EPISODES OF 'WORLD NEWS TONIGHT':https://bit.ly/35ZFVjmWATCH OTHER FULL EPISODES OF WORLD NEWS TONIGHT:http://abc.go.com/shows/world-news-tonightWATCH WORLD NEWS TONIGHT ON HULU:https://hulu.tv/33iKepm#WorldNewsTonight #Coronavirus #PandemicUS #CasesSurge"
"rc7-MQJeEuU","HILARIOUS PREGNANCY YOGA CHALLENGE!!! **WHOLE FAMILY TRYING IMPOSSIBLE POSES**","2020-03-21T21:09:25.000Z","UCWwWOFsW68TqXE-HZLC3WIA","The ACE Family","22","20.22.03","the ace family hilarious pregnancy yoga challenge|ace family hilarious pregnancy yoga challenge|hilarious pregnancy yoga challenge|hilarious yoga challenge|pregnancy yoga challenge|pregnant yoga challenge|yoga challenge|the ace family|ace family|ace family yoga challenge|ace family pregnant yoga","1385842","107818","1041","8588","https://i.ytimg.com/vi/rc7-MQJeEuU/default.jpg","False","False","Hilarious pregnancy yoga challenge!!! **Whole family trying impossible poses**PURCHASE NEW ACE FAMILY CUPS HERE: http://shopacefamily.comLAST VIDEO: https://www.youtube.com/watch?v=Ecz5cEtpxpEJOIN THE ACE FAMILY & SUBSCRIBE: http://bit.ly/THEACEFAMILY *TURN ON OUR POST NOTIFICATIONS FOR SHOUTOUTS IN OUR VIDEOS****BUSINESS INQUIRIES : INFO.THEACEFAMILY@GMAIL.COMMAKE SURE YOU LIKE, COMMENT, SHARE & SUBSCRIBE TO OUR YOUTUBE CHANNEL AND FOLLOW US ON OUR FAMILY ADVENTURES!WATCH MORE VIDEOS!!! VLOGS: https://youtube.com/playlist?list=PLq...PRANKS: https://youtube.com/playlist?list=PLq...CHALLENGES: https://youtube.com/playlist?list=PLq...POPULAR VIDEOS: https://youtube.com/playlist?list=PLq...LATEST VIDEOS: https://youtube.com/playlist?list=PLq... STALK US :)Catherine's Instagram: https://www.instagram.com/catherinepaiz/Catherine's Twitter: http://twitter.com/catherinepaizCatherine's SnapChat: Catherinepaiz"
"EeL2rc2uUOo","Joe Rogan Reacts to LA Shutdown, Latest Coronavirus News","2020-03-21T19:30:02.000Z","UCnxGkOGNMqQEUMvroOWps6Q","JRE Clips","22","20.22.03","Joe Rogan|JRE|Joe Rogan Experience|JRE Clips|PowerfulJRE|Joe Rogan Fan Page|Joe Rogan Podcast|podcast|MMA|Joe Rogan MMA Show|UFC|comedy|comedian|stand up|funny|clip|favorite|best of","2385039","41834","2441","15534","https://i.ytimg.com/vi/EeL2rc2uUOo/default.jpg","False","False","Taken from JRE #1445 w/Andy Stumpf:https://youtu.be/OlFJm2wK7eo"
"97OfRNNFqJo","Can You Find Him in This Video? • Hidden in Plain Sight #14","2020-03-21T12:00:03.000Z","UCDRbNGFusqlXX4a5vwi9ouQ","Vat19","24","20.22.03","vat19|vat 19|vat-19|hidden in plain sight|hide from boss|hiding in plain sight","1765028","58163","1079","5118","https://i.ytimg.com/vi/97OfRNNFqJo/default.jpg","False","False","Kan Danny hide from his boss alll day? Lets find out!Buy here: https://www.vat19.com?adid=youtubeFind more Hidden in Plain Sight: https://www.youtube.com/watch?v=jseZOkJ0cTk&list=PLSqiExuEA-RF4HU9PWHtpiQo94XkXV2nXSubscribe to Vat19: http://www.youtube.com/subscription_center?add_user=vat19comVisit the Vat19 Headquarters: https://www.vat19.com/tour****************** Follow Vat19:Facebook: https://facebook.com/vat19Instagram: https://instagram.com/vat19/Shop hundreds more curiously awesome products:https://www.vat19.com/?adid=youtubeWatch More Vat19:The White Elephant Gift Show: https://www.youtube.com/watch?v=rppcXroNgKI&list=PLSqiExuEA-RFpqW0Y3vn0pn8wDW_3LXAOLatest Uploads: https://www.youtube.com/user/vat19com/videos?shelf_id=1&view=0&sort=ddPopular Videos: https://www.youtube.com/user/vat19com/videos?shelf_id=7&view=0&sort=pFun Stuff to Eat: https://www.youtube.com/watch?v=7RXmNRr8x7I&list=PLSqiExuEA-REt5gzR0A9ernZNHlZ2glIlAbout Vat19:Vat19 is dedicated to curiously awesome gifts, candy, toys, gummy, putty, puzzles, games, and more! In addition to making funny commercials you'll actually want to watch, we produce amazing challenge videos, document our outrageous contraptions, and invite you to a front row seat for our silly stunts. Sometimes we blow things up, fill up a bathtub or pool with crazy stuff, dare each other to eat super spicy foods, and answer “burning questions” from our viewers."
"rj25YHshXo8","My Best Friend Got The Coronavirus","2020-03-21T23:55:58.000Z","UCtinbF-Q-fVthA0qrFQTgXQ","CaseyNeistat","22","20.22.03","[none]","1048155","58771","2991","5744","https://i.ytimg.com/vi/rj25YHshXo8/default.jpg","False","False","to make a donation and a resource for those in need of food assistance; https://www.feedingamerica.org/100% of merch proceeds donated to Feeding America https://shopcaseyneistat.com/music in this video is from;  http://smarturl.it/jordynedmonds"
"Gczmj1F42vc","New York becomes epicenter of coronavirus in the United States","2020-03-21T23:14:21.000Z","UC8p1vwvWtl6T73JiExfWs1g","CBS News","25","20.22.03","coronavirus|new york|new york city|cuomo|testing|emergency|healthcare|disaster","783503","3643","471","2533","https://i.ytimg.com/vi/Gczmj1F42vc/default.jpg","False","False","New confirmed coronavirus cases are skyrocketing in New York as the state ramps up testing. New York has conducted roughly 45,000 tests so far -- more than any other state -- and Governor Andrew Cuomo maintains that as testing increases, so will the number of infections. Michael George reports."
"E7IOrrkFR3U","Goodbye Cookie... Losing My Best Friend","2020-03-21T15:44:05.000Z","UCjwmbv6NE4mOh8Z8VhPUx1Q","Rosanna Pansino","26","20.22.03","sad|emotional|dog|rosanna pansino|cookie|blueberry muffin|puppy|sad news|cry|crying|update|life|vlog|vlogging|pet|frenchie|french bulldog|memories","1544054","150941","828","38212","https://i.ytimg.com/vi/E7IOrrkFR3U/default.jpg","False","False","She was the best dog.My Dogs Instagram: http://www.instagram.com/cookieandblueberry"
"qrkg44RBRD4","Never Leaving My House Again...","2020-03-20T17:00:18.000Z","UCkvK_5omS-42Ovgah8KRKtg","jeffreestar","26","20.22.03","jeffree star|jeffree star cosmetics|jeffree star makeup review|jeffree star approved|jeffree star new house|pink McLaren|jeffree star car collection|jeffree star dogs|louis vuitton bench|pink cars|home tour|jeffree star palette|Pomeranians|makeup tutorial|jawbreaker palette|shane dawson|ryland adams|nikkietutorials|abh lash brag|pink lamborghini|Charli D'Amelio|bretman rock","5876911","313924","11226","20335","https://i.ytimg.com/vi/qrkg44RBRD4/default.jpg","False","False","I'd like to officially announce that 2020 is NOT Jeffree Star Approved. Here is a video I filmed a few days ago before California went on full lock down. Right now we are not allowed to leave our homes unless to get food or medicine.. We've never seen anything like this happen before. It's been hard to sit down and film with all of this craziness happening but I hope this gives you a distraction for a few minutes. Love you guys so much. Lashes: 'Dime Piece' by Cammy Nguyen - https://bit.ly/3beDZ9QEyeshadow: Jeffree Star Cosmetics - Jawbreaker palette - https://jeffreestarcosmetics.com/collections/eyesMascara: Anastasia Beverly Hills - 'Lash Brag' - https://bit.ly/2wsoADTHighlighter: Jeffree Star Cosmetics - 'Sour Ice' Extreme Frost - https://bit.ly/33EiKvlWANT MORE? ❤️ WATCH ME REVIEW KYLIE SKIN w/SHANE DAWSON: https://bit.ly/3a8uPeO*SHOP: http://www.jeffreestarcosmetics.com+ FOLLOW MY BRAND ON Instagram: http://instagram.com/jeffreestarcosmetics+FOLLOW ME ON IG: http://instagram.com/jeffreestar+ SNAPCHAT: jeffreedahmer+ TWITTER: @jeffreestarWATCH MORE VIDEOS...................❤️🔮 WATCH FULL FACE OF BRANDS THAT HATE ME  ► https://bit.ly/2O6GgJi💜 WATCH THE SHANE x JEFFREE COLLECTION REVEAL ▷ https://bit.ly/39oZuDS🍔 WATCH my TACOBELL MUKBANG feat. Trisha Paytas ▷ https://bit.ly/2w7amYfMUSIC: THYKIER - 51  ► - https://www.youtube.com/watch?v=T0vJNhstIWs (courtesy of NoCopyrightSounds)"
"dkozG3IcXUU","Italian doctor on how virus 'exploded', having coronavirus & how to fight it","2020-03-21T17:23:00.000Z","UCTrQ7HXWRRxr7OsOtodr2_w","Channel 4 News","25","20.22.03","Channel 4 News|virus|china virus|coronavirus|covid-19|coronavirus china|coronavirus risks|how to prevent coronavirus|coronavirus uk|coronavirus symptoms|coronavirus what is it|coronavirus outbreak|coronavirus britain|china virus wuhan|coronavirus timeline|quarantine|who|coronavirus vaccine|covid-19 vaccine|coronavirus explained|world health organisation|italy|italy coronavirus|italy doctor|italy doctor interview|italy coronavirus interview|italy hospital","924541","11503","426","3163","https://i.ytimg.com/vi/dkozG3IcXUU/default.jpg","False","False","Dr Sylvia Bignamini is the Health Director of San Francesco Clinic in Bergamo, Italy, the city at the epicentre of the country's outbreak. (Subscribe: https://bit.ly/C4_News_Subscribe)She conducted the first coronavirus test in her nursing home and also caught the virus herself. She is now living and working in isolation at home.  -------Watch more of our explainer series here - https://www.youtube.com/playlist?list...Get more news at our site - https://www.channel4.com/news/ Follow us:Facebook - https://www.facebook.com/Channel4News/Twitter - https://twitter.com/Channel4News"
"5qx7v8K3ODY","Things You DIDN’T KNOW About Everyday Objects","2020-03-21T19:19:21.000Z","UCpB959t8iPrxQWj7G6n0ctQ","SSSniperWolf","24","20.22.03","sssniperwolf|sniper wolf|reacting|reaction|funny|things|you|didnt|know|about|things you didnt know|things you didnt know about|everyday|objects","851379","46761","693","4557","https://i.ytimg.com/vi/5qx7v8K3ODY/default.jpg","False","False","Things You Didn’t Know About Everyday Objects! Comment if you knew about these things! Leave a Like if you enjoyed! Watch Survival Life Hacks https://youtu.be/s8lQTi8h_HI Subscribe to join the Wolf Pack and enable notifications! http://bit.ly/SubSSSniperWolfInstagram: http://instagram.com/sssniperwolfTwitter: http://www.twitter.com/sssniperwolfFacebook: https://www.facebook.com/sssniperwolfvideosOfficial Merch: https://ogwolfpack.com/"
"V1SeYVASfXk","How We're Equipping 25 Crown Vics With NITROUS and ROLL CAGES For Our Freedom 500 Race!","2020-03-21T16:39:09.000Z","UCh8f8vssLddD2PbnU3Ag_Bw","Cleetus McFarland","1","20.22.03","leroy|1320video|drag racing|boosted|cleetus McFarland|cleetus|McFarland|Leroy|bald eagles|bald eagle machine|procharger|1320|modified|boost|turbo|twin turbo|precision turbo|precision turbo and engine|Texas speed|resleeved 427|Texas speed and performance|Fasterproms|tuning|tuned|burnout|stick shift|six speed|corvette|Leroy Vette|c5 corvette|Chevrolet|unicorn|c5|supercharging Leroy|turbocharging Leroy","830399","31173","1056","2407","https://i.ytimg.com/vi/V1SeYVASfXk/default.jpg","False","False","Thanks again PUBG Mobile for sponsoring the video. Click the link http://www.inflcr.co/SH1wR and join the 600+ million players for free!We had some fun today AND talked about our equipment we're using for the Freedom 500 cars!Straw Hats RESTOCKED and Sweatshirts ADDED!!! -  https://www.cleetusmcfarland.comOur 2020 Sponsors: https://www.holley.comhttps://texas-speed.comhttps://www.motionraceworks.comhttps://www.nittotire.comhttps://www.summitracing.comPurchase the FREEDOM 500 PPV here - https://www.cleetusmcfarland.com/free...Broadcast @ 7pm EST. Race @ 9pm Friday, April 3, 2020* This is not a public race. PPV only. *Check out our schedule for 2020 here - https://www.cleetusmcfarland.com/year2020/Cleetus2 Channel - https://goo.gl/Ph2wyoHolley's channel - https://www.youtube.com/channel/UCeQfJXzg0gnfuM4tgmagCCw**Social Media:Instagram - https://goo.gl/LZvy5eFacebook - https://goo.gl/gdwhh1**SEND ME FAN MAIL... (bald eagles welcome) Cleetus McFarland12961 44th St N. Ste BClearwater, FL 33762United States of America"
"TlXWB9B30Lw","Conan Becomes A UPS Deliveryman - Late Night With Conan O'Brien","2020-03-21T15:00:10.000Z","UCi7GJNg51C3jgmYTUwqoUXA","Team Coco","23","20.22.03","Late Night With|Conan|O'Brien|NBC|HD|HQ|Remote|Comedy|Sketch|UPS|Post Office|FedEx|Fan Favorite|Request|Funny|Humor|Conan Classic|Official|Best Of","1245581","36363","1041","2537","https://i.ytimg.com/vi/TlXWB9B30Lw/default.jpg","False","False","(Original airdate: 07/18/08) Conan fulfills his lifelong dream of being a UPS deliveryman. Watch more classic clips @ http://conanclassic.com."
"fyIcQ1Xl-rs","NLE Choppa - Walk Em Down feat. Roddy Ricch (Official Music Video)","2020-03-19T23:05:33.000Z","UCWICXNlSLc7eeNazpzUZcLg","NLE CHOPPA","10","20.22.03","Walk Em Down|NLE Choppa|Roddy Ricch|New Roddy Ricch|New NLE Choppa|Please Excuse Me For Being Antisocial|New Choppa|New Rody Rich|Roddy Choppa|New Rap Music|Choppa|Camelot|Shotta Flow|The Box|Start Wit Me|New Hip Hop|Roddy The Box|Rody Rich|Walk Them Down|Choppa Roddy|Roddy Ricch The Box|Roddy Walk Em Down|Roddy|Complex|Hot New Hip Hop|High Fashion|Worldstar|Worldstar Hip Hop|Genius|Choppa Walk Em Down","5746543","358476","6722","25673","https://i.ytimg.com/vi/fyIcQ1Xl-rs/default.jpg","False","False","Listen to Walk Em Down: https://nlechoppa.lnk.to/walkemdownhttps://nlechoppa.comhttps://instagram.com/nlechoppamusichttps://facebook.com/nlechoppamusichttps://twitter.com/nlechoppa1https://snapchat.com/add/nlechoppamusicTikTok: @NLEChoppaMusicTriller: @NLEChoppaA Psycho Films ProductionDirector: Christian SuttonEP: Sam CanterProducers: Geenah Krisht & Mary Margaret MerrittDP: Dannel EscallonPD: Dre Day Designz1st AD: Erik MateoEditor: Tyler Sobel-MasonVFX: Warm & Fuzzy, Nuclear Creative, Max Goodrich, & Will TookeColorist: Stephen DerluguianLasers: FutureWeapons Lasers#WalkEmDown #NLEChoppa #RoddyRicch #WalkEmDownChallenge"
"fDObf2AeAP4","75 million Americans ordered to stay home","2020-03-21T01:07:50.000Z","UCupvZG-5ko_eiXAupbDfxWw","CNN","25","20.22.03","latest News|Happening Now|CNN","1644187","13125","1825","10213","https://i.ytimg.com/vi/fDObf2AeAP4/default.jpg","False","False","Connecticut, Illinois and New York joined California on Friday in ordering nonessential workers to remain at home to slow the spread of coronavirus, which means more than 1 in 5 Americans live in a state under general stay-at-home orders.#CNN #News"
"LIH8W-TFk5s","James Charles did my makeup!  |  Charli D'Amelio","2020-03-20T19:00:08.000Z","UCi3OE-aN09WOcN9d2stCvPg","charli d'amelio","22","20.22.03","[none]","2380582","188620","2884","8952","https://i.ytimg.com/vi/LIH8W-TFk5s/default.jpg","False","False","hi angels!i first want to say that i hope everyone is staying safe and healthy during this crazy time.  none of us can control what the future holds but each of us can do our best to spread positivity. don’t forget to take care of yourself, keep your body moving, wash your hands but also stay in contact with your friends and family online as often as you can so you can be mentally healthy, too. we need each other now more than ever.  i love you all so much.now on to the video…. it’s been a long time coming but finally, my 'sister' james charles and i did our very first collab together and it was so awesome!  i’m excited to share it with you guys!!my video is a behind-the-scenes look at the making of our collab including going to his house, meeting his dog and seeing how the magic happens on his channel. don’t miss how i reveal my new, total glam look to my parents at the end.  do they love it or hate it?  (you’ll have to watch to find out!) In james’ video, he does my make-up and along the way, he asks me a bunch of super fun and interesting questions that i’ve never answered before.  It’s ‘classic james charles’ at his best.  check out the link to james’ video here: https://youtu.be/J5wqeUewAXkspecial thank you’s to james and his amazing team including louis and jake and to my clip’s videographers lance and jacob!  follow james charles:Instagram: https://www.instagram.com/jamescharlesYouTube: https://www.youtube.com/jamescharlesTikTok: https://www.tiktok.com/@jamescharles Twitter: http://twitter.com/jamescharlesSnap: https://www.snapchat.com/add/jamescharlessTwitch: https://www.twitch.tv/jamescharlesFacebook: http://www.facebook.com/jcharlesbeautyApparel: https://sisters-apparel.com/follow these videographers:   lance sanchez Instagram - https://www.instagram.com/xlancesanchez  Tiktok https://www.tiktok.com/@xlancesanchez jacob ferrufino Instagram https://www.instagram.com/ferrufilms  Tiktok https://www.tiktok.com/@ferrufilmsmy socials: website: https://www.charlidamelio.com/TikTok: https://www.tiktok.com/@charlidamelioInstagram: https://www.instagram.com/charlidamelio/Twitter: http://twitter.com/charlidamelioYoutube: https://www.youtube.com/charlidamelioadd me on Snap: https://www.snapchat.com/add/damelioc"
