video_id,title,publishedAt,channelId,channelTitle,categoryId,trending_date,tags,view_count,likes,dislikes,comment_count,thumbnail_link,comments_disabled,ratings_disabled,description
"U8WTIQkfOGE","President Trump & Coronavirus Task Force Deliver Briefing on COVID-19 | TIME","2020-03-24T00:20:39.000Z","UC8Su5vZCXWRag13H53zWVwA","TIME","25","20.24.03","Time|time magazine|magazine|time (magazine)|time.com|news today|world news|interview|science|technology|health|politics|entertainment|business|news|breaking news|live|lifestyle|video|coronavirus|COVID-19|President Trump|Donald Trump|Mike Pence|Vice President Pence|White House|virus|pandemic|quarantine|self-quarantine|social distancing|centers for disease prevention and control|CDC|shelter-in-place|unemployment|economy","915378","5833","2509","2405","https://i.ytimg.com/vi/U8WTIQkfOGE/default.jpg","False","False","Coronavirus Task Force holds news conference at White House about COVID-19 outbreak.Subscribe to TIME ►► http://bit.ly/SubscribeTIME Get closer to the world of entertainment and celebrity news as TIME gives you access and insight on the people who make what you watch, read and share.https://www.youtube.com/playlist?list=PL2EFFA5DB900C633F  Find out more about the latest developments in science and technology as TIME’s access brings you to the ideas and people changing our world.https://www.youtube.com/playlist?list=PLYOGLpQQfhNIzsgcwqhT6ctKOfHfyuaL3 Let TIME show you everything you need to know about drones, autonomous cars, smart devices and the latest inventions which are shaping industries and our way of livinghttps://www.youtube.com/playlist?list=PL2862F811BE8F5623 Stay up to date on breaking news from around the world through TIME’s trusted reporting, insight and accesshttps://www.youtube.com/playlist?list=PLYOGLpQQfhNJeIsW3A2d5Bs22Wc3PHma6CONNECT WITH TIMEWeb: http://time.com/Twitter: https://twitter.com/TIMEFacebook: https://www.facebook.com/time Instagram: https://www.instagram.com/time/?hl=enMagazine: http://time.com/magazine/Newsletter: time.com/newsletterABOUT TIMETIME brings unparalleled insight, access and authority to the news. A 24/7 news publication with nearly a century of experience, TIME’s coverage shapes how we understand our world. Subscribe for daily news, interviews, science, technology, politics, health, entertainment, and business updates, as well as exclusive videos from TIME’s Person of the Year, TIME 100 and more created by TIME’s acclaimed writers, producers and editors. President Trump & Coronavirus Task Force Deliver Briefing on COVID-19https://www.youtube.com/user/TimeMagazine"
"a7TY4h2u-Ps","We Force James Charles to Run a Military Obstacle Course","2020-03-23T22:00:00.000Z","UCIcgBZ9hEJxHv6r_jDYOMqg","Unus Annus","23","20.24.03","unus annus|markiplier|crankgameplays|memento mori|james charles|military obstacle course|collab|assauolt course|obstacle course|fitness|austen alexander|military|marines|fitness test|fit test|markiplier fitness|crankgameplays fitness|james charles fitness|funny|funny collab|youtubers|youtubers fitness test|james charles collab","1102604","122133","3277","16805","https://i.ytimg.com/vi/a7TY4h2u-Ps/default.jpg","False","False","James Charles joins us as we attempt to run a Military Obstacle Course!Subscribe to James ► https://www.youtube.com/jamescharlesSubscribe to Austen ► https://www.youtube.com/austenalexanderSubscribe to Matt ► https://www.youtube.com/channel/UCqFV...ᴍᴇʀᴄʜ ➤ http://www.unusannus.comᴜɴᴜs ➣ http://www.youtube.com/crankgameplaysᴀɴɴᴜs ➢ http://www.youtube.com/markiplierᴛᴡɪᴛᴛᴇʀ ► http://www.twitter.com/unusannusɪɴsᴛᴀɢʀᴀᴍ ► http://www.instagram.com/unusannusʀᴇᴅᴅɪᴛ ► http://www.reddit.com/r/unusannusᴛᴜᴍʙʟʀ ► http://www.unusannus.tumblr.comEdited By ► https://www.youtube.com/nerdfictionThis channel, along with every video that has or will ever be uploaded on this channel, will be deleted after our year has ended. This is inevitable. Inescapable. Irreversible.Do not archive or re-upload anything. This is our last wish. Our parting gift. Stay true to the purpose of our final year or we shall lay down wrath upon those that attempt to escape the end.Memento Mori.Unus Annus."
"pNlOl6MXufo","EASY TikTok Life Hacks To Do When You're BORED! **they actually work**","2020-03-23T18:18:47.000Z","UCilwZiBBfI9X6yiZRzWty8Q","FaZe Rug","24","20.24.03","faze rug|rug|rugfaze|fazerug|life hacks|tiktok|tiktok life hacks|faze rug life hacks|faze rug tiktok|faze rug tiktok life hacks|tiktok life hacks they actually work|life hacks to do when you're bored|bored|faze rug hacks|hacks|easy life hacks|easy tiktok life hacks|easy life hacks to do when you're bored","1592576","92745","1517","8409","https://i.ytimg.com/vi/pNlOl6MXufo/default.jpg","False","False","THIS WAS SO COOLI know a lot of you watching this are bored at home with everything going on around the world, so I hope these life hacks help you out!• GET ME TO 15 MILLION SUBSCRIBERS ► http://bit.ly/SubToRugGO SPAM MY OTHER PAGES!!Instagram ► https://www.instagram.com/fazerug/TikTok ► https://www.tiktok.com/@rugFacebook ► https://www.facebook.com/RealFaZeRug/Twitter ► https://twitter.com/FaZeRugSnapchat ► thefazerug If you're reading this that means you noticed I changed the last line of my description and I STILL LOVE YOU :)"
"dqRZDebPIGs","The Weeknd - In Your Eyes (Official Video)","2020-03-23T16:00:10.000Z","UCF_fDSgPpBQuh1MsUTgIARQ","TheWeekndVEVO","10","20.24.03","The|Weeknd|Your|Eyes|Republic|Records|the weeknd in your eyes|in your eyes the weeknd|the weeknd your eyes|your eyes the weeknd|in your eyes official music video|in your eyes premiere|the weeknd in your eyes music video|your eyes official music video|the weekend|weekend|the weekend in your eyes|in your eyes the weekend|in your eyes lyrics|the weeknd|the weeknd new song|after hours|the weeknd after hours|after|hours|the","3617935","316385","5227","20861","https://i.ytimg.com/vi/dqRZDebPIGs/default.jpg","False","False","Official music video by The Weeknd performing In Your Eyes– 'After Hours available everywhere now: http://theweeknd.co/afterhoursYD►Subscribe to The Weeknd on YouTube: http://theweeknd.co/subscribeYD ►Get tickets: https://www.theweeknd.com/tour►Get exclusive merch: https://shop.theweeknd.com/►Follow The Weeknd:https://twitter.com/theweeknd https://www.facebook.com/theweeknd https://www.instagram.com/theweeknd https://www.theweeknd.com Director: Anton TammiStarring: Zaina MiucciaProduction Company: SomesuchExecutive Producer: Saskia WhinneyProducer: Sarah ParkDirector of Photography: Oliver Millar2nd Unit DP: Devin Daddy KarringtenSteadicam Op: Nick MuellerProduction Designer: Miranda LorenzCostume Designer: Alana MorsheadSFX Makeup: Koji OhmuraMake up Artist: Fatma BendrisMake up Artist: Christine Nelli1st AD: Kenneth TaylorEditor: Andreas ArvidssonAssistant Editor: Janne Vartia2nd Assistant Editor: Tim MontanaPost Production Supervisor: Alec ErnestColorist: Nicke JacobssonAssistant Colorist: Sander van WijkEditorial/Color Talent Mgmt: Sofia Misgena & HeleneMisgena @ The Talent GroupSound Design: Anton Ahlberg @ Red Pipe StudiosVFX: MathematicTitle Design: Aleksi TammiLyrics:I just pretend that I’m in the darkI don’t regret cause my heart can’t take a lossI’d rather be so obliviousI’d rather be with youWhen it’s said, when it’s done yeahI don’t ever wanna knowI can tell what you done yeahWhen I look at youin your eyesI see there’s something burning inside youOh inside youIn your eyes, I know it hurts to smileBut you try to, oh you try toYou always try to hide the painYou always know just what to sayI always look the other wayI’m blind, I’m blindIn your eyes, you lie but I don’t let it define youOh define youI tried to find love in someone else too many timesBut I hope you know I mean itWhen I tell you you’re the one that was on my mind ohWhen it’s said, when it’s doneI would never let you knowI’m ashamed of what I doneWhen I look at youIn your eyesI see there’s something burning inside youOh inside youIn your eyes I know it hurts to smileBut you try to, oh you try toYou always try to hide the painYou always know just what to sayI always look the other wayI’m blind, I’m blindIn your eyes you lie but I don’t let it define youOh define youIn your eyesI see there’s something burning inside youOh inside youYou always try to hide the painYou always know just what to sayI always look the other wayI’m blind, I’m blindIn your eyes you lie but I don’t let it define youOh define you#TheWeeknd #InYourEyes #AfterHoursMusic video by The Weeknd performing In Your Eyes. © 2020 The Weeknd XO, Inc., manufactured and marketed by Republic Records, a division of UMG Recordings, Inc."
"d0uFNajqTZI","We broke up... we're not moving in together anymore","2020-03-22T21:45:01.000Z","UCnM1ay_QoQOpa1N2iejLA7A","Jatie Vlogs","1","20.24.03","we broke up|break up|broke up|why we broke up|were not moving in together anymore|its over|jatie vlogs break up|jatie vlogs|jatie vlogs pranks|move in vlog|emtpy house tour|the break up|why we arent together anymore|boyfriend|girlfriend|calling off the engagement|prank|jatie house|josh and katie|jatie house tour|josh brueckner|katie betzing|house tour|opening up about our break up|im sorry|why we really broke up","2493258","79546","39327","58912","https://i.ytimg.com/vi/d0uFNajqTZI/default.jpg","False","False","We're sorry guys, we love you and appreciate all the support. Thanks for everything.20% off JATIE BEAUTY LINK: https://jatiebeauty.com/PROPOSAL VID: https://youtu.be/U7VEN2EZkI8NEW MERCH: http://fanjoy.co/jatieMakeup giveaway! Follow @jatiebeauty for a chance to win! SUBSCRIBE & FOLLOW ON THE IG FOR A CHANCE TO WIN SOME AIRPODS!@joshbrueckner@katiebetzing @jatiebeauty Tiktok: @joshxkatie-PRANK WARS-You can look but you CANT touch prank: https://youtu.be/WtVe0typDVIBeing PDA in front of our friends: https://youtu.be/-MP2E1IiHXgBeing mean to my fiancé: https://youtu.be/Yi6T9UCslx0•Follow Us On Social Media•Instagram: @katiebetzing @JoshbruecknerFitness Instagram @J80FitTwitter: @ktbetzing @Joshbrueckner Snapchat: @k80betz @JoshbruecknerHow we met: https://youtu.be/Ed6MYkS1-eoKatie’s Main Channel: https://www.youtube.com/user/Beautygu...Business inquiries: j80vlogs@gmail.com"
"yWOvw2jd3Vk","DC Young Fly & Karlous Miller Get Too Turnt With Their Squads 🔥😂 Wild 'N Out","2020-03-23T20:26:05.000Z","UCrkzfc2yf-7q6pd7EtzgNaQ","Wild 'N Out","24","20.24.03","karlous miller|Diss side|Dat Side|WWE|Naomi|wwe naomi|wwe naomi and jimmy uso|Uso Twins|wild n out debut|sneak peek|wildstyle|WNO|Wild|Out|Delaghetto|Nick Cannon|Justina Valentine|DC Young Fly|Timothy DeLaGhetto|Conceited|Chico Bean|Corey Charron|Darren Brand|Charlie Clips|Hitman Holla|pick up and kill it|let me holla|bullspittin|talking spit|wild style|improv|battle","662669","33980","295","1338","https://i.ytimg.com/vi/yWOvw2jd3Vk/default.jpg","False","False","DC & Karlous kicked off our new game ‘Diss Side Dat Side’ as ring leaders for their squads ft WWE’s Naomi & Uso Twins, but which squad was able to go harder than the other? 😂🙌#WildNOut #MTVSubscribe to stay updated on the newest content! http://goo.gl/YuLQAoWant even more Wild ‘N Out? We’re pulling up to a city near you. Grab your tickets here 👉 http://livemu.sc/WildNOut2020Get ready to take your Wild ‘N Out obsession to new heights cause WE JUST DROPPED MERCH 👉 http://bit.ly/3841mRLMore from Wild 'N Out!Official Wild 'N Out Website: http://www.mtv.com/shows/nick-cannon-presents-wild-n-outWild 'N Out Twitter: https://twitter.com/wildnoutWild 'N Out Instagram: https://www.instagram.com/mtvwildnout/Wild 'N Out Facebook: https://www.facebook.com/nickcannonwildnout/Nick Cannon Presents: Wild 'N Out delivers lightning-fast improv and head-to-head battles, helmed by the master of ceremonies, Nick Cannon. The stakes are high as teams face off in a series of visceral, hip-hop-edged comedy showdowns, all culminating in a rap battle for the championship belt."
"z2KpsZRpoZ8","‘Brace Yourself’: Doctors in Italy Share Coronavirus Advice | NYT News","2020-03-23T20:00:13.000Z","UCqnbDFdCpuN8CMEg0VuEBqA","The New York Times","25","20.24.03","italy news|italy coronavirus|italy hospitals|italy covid 19|what's happening in italy|why did italy get so bad|covid 19 news|covid 19 healthcare|covid 19 hospitals|coronavirus news|covid 19 symptoms|coronavirus symptoms|news|new york times|nytimes video|video from the new york times","1111430","11769","721","3180","https://i.ytimg.com/vi/z2KpsZRpoZ8/default.jpg","False","False","Officials in the U.S. and elsewhere fear they’ll face a coronavirus scenario similar to Italy’s soon. Three doctors and a nurse in Lombardy, the region hit hardest by the virus, described what they faced and offered advice to those awaiting the storm.Subscribe: http://bit.ly/U8Ys7nMore from The New York Times Video:  http://nytimes.com/video----------Whether it's reporting on conflicts abroad and political divisions at home, or covering the latest style trends and scientific developments, New York Times video journalists provide a revealing and unforgettable view of the world. It's all the news that's fit to watch."
"iVfWEoerrTY","Dobre Brothers - You Know You Lit ft. Lil Pump (Official Video)","2020-03-22T23:00:10.000Z","UCwD4x63A9KC7Si2RuSfg-SA","Lucas and Marcus","10","20.24.03","lucas and marcus|dobre twins|dobre brothers|24 hours|challenge|family friendly|handcuffed|girlfriend|twins|twin brother|challenges|gymnastics|dance|marcus and lucas|music|rap|pranks|grocery store|cars|reactions|games|family|animals|new|ivanita lomeli|cyrus and christina|relationship|crush|boyfriend|lil pump","2245516","125805","49691","35121","https://i.ytimg.com/vi/iVfWEoerrTY/default.jpg","False","False","It's LIT Dobre Army!🔥 STREAM You Know You Lit here➡https://open.spotify.com/track/429k38tTAHEXrAYZRvvxYA?si=gA51TlZ7SbmDAZkRME5gdAhttps://music.apple.com/us/album/you-know-you-lit-feat-lil-pump/1503987313?i=1503987320Directed by Alex HassanProduced by laviedeericEngineered by NakuuCover art by primo_estiloOriginal Beat by Young D of Trap Team BeatsDOWNLOAD DOBRE DUNK! 🏀http://bit.ly/DownloadDOBREDUNKMERCH 🔥 http://bit.ly/NewDobreMerchWE POST TUESDAY,THURSDAY, & SUNDAY!TURN OUR POST NOTIFICATIONS ON FOR A SHOUTOUT!SUBSCRIBE TO THE DOBRE VLOG CHANNEL! https://www.youtube.com/channel/UCC3O...SUBSCRIBE TO THE LUCAS AND MARCUS CHANNEL!https://www.youtube.com/user/TwiNboTz... Lucas's Social Media  Instagram: https://www.instagram.com/lucas_dobre/Twitter: https://twitter.com/dobrelucasFacebook: https://www.facebook.com/dobrelucas/Snapchat: lucas_dobreTik Tok: DobreTwins Marcus's Social Media  Instagram: https://www.instagram.com/marcusdobreTwitter: https://twitter.com/dobremarcusFacebook: https://www.facebook.com/marcusdobre/Snapchat: marcusdobre1Tik Tok: DobretwinsFollow the Dobre Brothers: Instagram: https://www.instagram.com/dobrebrothers/BIZ - dobrebrothersmgmt@gmail.com THANKS FOR WATCHING!Dobre Brothers - You Know You Lit ft. Lil Pump (Official Video)https://www.youtube.com/user/TwiNboTzVids#DobreBrothers #LilPump #YouKnowYouLit #LucasandMarcus"
"drQlHxI6pUM","Arthur Gunn Puts an INCREDIBLE Spin on a Creedence Clearwater Revival Classic - American Idol 2020","2020-03-24T00:20:49.000Z","UCAMPco9PqjBbI_MLsDOO4Jw","American Idol","24","20.24.03","American Idol 2019|American Idol|singing competition|Katy Perry|Ryan Seacrest|Luke Bryan|Lionel Richie|covers|sing|ABC|Have You Ever Seen the Rain|Arthur Gunn|Creedence Clearwater Revival","954072","47351","343","3554","https://i.ytimg.com/vi/drQlHxI6pUM/default.jpg","False","False","Arthur Gunn recycles his very first audition song and adds a new twist. Will the band be able to back him in the unique arrangement of Have You Ever Seen the Rain?See more of American Idol 2020 on our official site: http://www.americanidol.comLike American Idol on Facebook: https://www.facebook.com/AmericanIdolFollow American Idol on Twitter: https://twitter.com/americanidolFollow American Idol on Instagram: https://www.instagram.com/americanidol/AMERICAN IDOL, the iconic series that revolutionized the television landscape by pioneering the music competition genre, returns on ABC.American Idol 2020Helping to determine who America will ultimately vote for to become the next singing sensation are music industry forces and superstar judges Luke Bryan, Katy Perry and Lionel Richie. Emmy® Award-winning host and producer Ryan Seacrest continues as host of the beloved series, while multimedia personality Bobby Bones serves at the in-house mentor."
"O4FXhpRzrNc","Lucky People Having The BEST DAY EVER","2020-03-23T20:22:02.000Z","UCpB959t8iPrxQWj7G6n0ctQ","SSSniperWolf","24","20.24.03","sssniperwolf|sniper wolf|reacting|reaction|funny|lucky people|lucky|people|best day|best day ever|lucky people have the best day ever","1340996","60349","1499","7370","https://i.ytimg.com/vi/O4FXhpRzrNc/default.jpg","False","False","Lucky People Having The BEST DAY EVER! Do you wish you were one of these lucky people? Leave a Like if you enjoyed! Watch last video https://youtu.be/P21a2bDvUVA Subscribe to join the Wolf Pack and enable notifications! http://bit.ly/SubSSSniperWolfInstagram: http://instagram.com/sssniperwolfTwitter: http://www.twitter.com/sssniperwolfFacebook: https://www.facebook.com/sssniperwolfvideosOfficial Merch: https://ogwolfpack.com/"
"x_R-qzjZrKQ","2020 iPad Pro Review: It's... A Computer?!","2020-03-24T12:30:48.000Z","UCBJycsmduvYEL83R_U4JriQ","Marques Brownlee","28","20.24.03","iPad Pro|new iPad Pro|2020 iPad Pro|iPad Pro 2020|LIDAR|A12Z|A12Z bionic|magic keyboard|MKBHD|magic keyboard review|iPad review|iPad Pro review","976056","77650","1314","5921","https://i.ytimg.com/vi/x_R-qzjZrKQ/default.jpg","False","False","The iPad Pro refresh is impressive. But does it answer the question?The shirt! http://shop.MKBHD.comMKBHD Merch: http://shop.MKBHD.comVideo Gear I use: http://kit.co/MKBHD/video-gear#recom...Tech I'm using right now: https://www.amazon.com/shop/MKBHDIntro Track: Zebulon by AllttaPlaylist of MKBHD Intro music: https://goo.gl/B3AWV5~http://twitter.com/MKBHDhttp://instagram.com/MKBHDhttp://facebook.com/MKBHD"
"pPn-Bay_ANU","SCIENCE CLASS- WHY Does Helium Make Your Voice Higher?","2020-03-23T20:47:42.000Z","UCY1kMZp36IQSyNx_9h4mpCg","Mark Rober","28","20.24.03","[none]","1209993","93802","890","5935","https://i.ytimg.com/vi/pPn-Bay_ANU/default.jpg","False","False","Live stream with demos your brain will enjoy where we answer a basic question every time.Does farting make you weigh more or less?!?!  Place your guess and give me feedback too- https://forms.gle/gqNw9Ht83Vzo2va4A"
"9Suu5DPnntw","The Try Guys Work From Home For 168 Hours","2020-03-23T15:00:02.000Z","UCpi8TJfiA4lKGkaXs__YdBA","The Try Guys","23","20.24.03","try guys|keith|ned|zach|eugene|habersberger|fulmer|kornfeld|yang|buzzfeedvideo|buzzfeed|ariel|ned & ariel|comedy|education|funny|try|learn|fail|experiment|test|tryceratops|work from home|work from home challenge|stay at home|vlog|vlogging|family vlog|make money online|work from home 2020|work from home jobs|today trending|bullet journal|online job|morning routine|make money|rank king|hide and seek|board games|games to play|play games|news","1726196","102735","790","9424","https://i.ytimg.com/vi/9Suu5DPnntw/default.jpg","False","False","We've been working from home all week and this is how it's going so far! What have you been doing to stay busy during your stay at home? #StayHome #WithMe #StayHomeSaveLivesAre you a business looking to work with The Try Guys? Reach out to us at 2ndtrybusiness@gmail.com for all business inquiries! 🎧THE TRYPOD 🎧: watch our new podcast at https://youtube.com/trypod or listen at https://tryguys.com/podcast📘THE HIDDEN POWER OF F*CKING UP 📘: check out our new book at https://tryguys.com/bookGet your official Try Guys color hoodies and phone cases at https://tryguys.com/collections/color-line 💙❤️💚💜Support us! http://www.patreon.com/tryguys. Join our Patreon to get videos a day early, plus, live streams, chatrooms, BTS footage, exclusive merchandise, and more!SUBSCRIBE TO AND FOLLOW THE TRY GUYS http://www.youtube.com/c/tryguyshttp://www.facebook.com/tryguys  http://www.twitter.com/tryguyshttps://www.instagram.com/tryguysFOLLOW THE GUYShttp://www.Instagram.com/keithhabshttp://www.Instagram.com/nedfulmerhttp://www.Instagram.com/korndiddyhttp://www.instagram.com/eugeneleeyang http://www.twitter.com/keithhabshttp://www.twitter.com/nedfulmer http://www.twitter.com/korndiddyhttp://www.twitter.com/eugeneleeyang THE TRY GUYSThe #TryGuys is the flagship channel of 2ND TRY, LLC. Tune in twice a week for shows from Keith, Ned, Zach and Eugene, the creators and stars of The Try Guys.EDITED BYYB Chang @xoyboxMUSICLicensed from AudioNetworkSFXLicensed from AudioblocksVIDEOLicensed from VideoblocksOfficial Try Guys Photos By Mandee Johnson Photography | @mandeephoto2nd Try, LLC STAFFExecutive Producer - Keith HabersbergerExecutive Producer - Ned FulmerExecutive Producer - Zach KornfeldExecutive Producer - Eugene Lee YangProducer - Rachel Ann ColeProducer - Nick RufcaProduction Manager - Alexandria HerringEditor - Devlin McCluskeyEditor - YB ChangEditor - Elliot DickerhoofAssistant Editor - Will WitwerCamera Operator - Miles BonsignoreSound Operator - Jonathan KirkAssistant Production Coordinator - Sam JohnsonContent Strategist - Kaylin BurkeSpecial Thanks To! Thanks to all of our Gold Level Patrons! AJ S., Amy Fleming, Ana Camba, Cat Hicks, Elisa Proust, Emma Godfrey, Erica Rao, Jared Aarons, Kelsey Bock, Kourtney Wong, Loretta Wen, Matthew Tadros, Miha, Paulus, Sarah Waxman, Traci Lew, Wendy Tran, Lily"
"bS5ve8rG-Ik","Every Quarantine Ever","2020-03-23T16:00:22.000Z","UCY30JRSgfhYXA6i6xX1erWg","Smosh","23","20.24.03","smosh|smosh pit|smosh games|funny|comedy|every blank ever|ebe|smosh ebe|smosh every blank ever|every quarantine ever|quarantine|work from home","1302173","82923","1855","7214","https://i.ytimg.com/vi/bS5ve8rG-Ik/default.jpg","False","False","Keep calm and wash your hands. This is EVERY QUARANTINE EVER!Punch that bell icon so you'll know when we add a new episode!CASTIan Hecox // https://www.instagram.com/ianhecox/Courtney Miller // https://www.instagram.com/co_mill/Shayne Topp // https://www.instagram.com/shaynetopp/Damien Haas // https://www.instagram.com/damienhaas/Olivia Sui // https://www.instagram.com/oliviasui/Monica Vasandani // https://www.instagram.com/monicavas/Sam Lerner // https://www.instagram.com/samlerner/Mark Raub // https://www.instagram.com/markraub/Directed by: Ian Hecox, Courtney Miller, Olivia Sui, Damien Hass, Shayne Topp & Monica VasandaniExecutive Producer: Ryan FinnertyWritten by: Monica Vasandani, Kurt Maloney, Olivia Sui & Courtney MillerEditor: Mike SmallGFX: Brittany MetzContent Manager: Kiana ParkerProduction Manager: Alicia GaynorSHOP THE SMOSH CLOTHING LINE: https://smosh.storeWatch Try Not To Laugh Challenge # 42 w/ Flula: https://youtu.be/YgISe3KowC8Watch Who Makes the Best Ship? | Awkward: https://youtu.be/bwY5nNrajWYWatch Podcast Courtney Hits Different - SmoshCast #55: https://youtu.be/lZY0NDENuAYSubscribe To Smosh: https://smo.sh/Sub2SmoshFollow Us:Instagram: https://instagram.com/smoshFacebook: https://facebook.com/smoshTwitter: https://twitter.com/smoshCheck Out Our Other Smosh Channels:Smosh Pit: https://smo.sh/Sub2SmoshPitSmosh Games: https://smo.sh/Sub2SmoshGamesSmoshCast: https://smo.sh/Sub2SmoshCast"
"kyYgxiF2aTM","How Sports Companies Looking for Stuff to Post","2020-03-24T00:26:41.000Z","UC4G10tk3AHFuyMIuD3rHOBA","RDCworld1","23","20.24.03","rdcworld|rdcworld1|rdc world|rdc world sports|rdc sports|sports channels|how sports companies|how sports companies looking for stuff to post|house of highlights|sports center","472219","66982","191","2956","https://i.ytimg.com/vi/kyYgxiF2aTM/default.jpg","False","False","All the sports companies posting anything they can find right now 🤣🤣🤣😭Social Media all sites!: @supremedreams_1@RDCworld1 @ive_ben_jammin@CleanUniform @23_is_leland@l0veandpeac3@dylanpatel4@playthatjohn"
"xswZseaLcy4","WATCH LIVE: Gov. Inslee issues statewide 'Stay Home' order in Washington amid coronavirus pandemic","2020-03-24T01:28:27.000Z","UCp1KrVaZDZ7BOI_QBuTWWmg","KING 5","25","20.24.03","[none]","82560","699","201","802","https://i.ytimg.com/vi/xswZseaLcy4/default.jpg","False","False","Washington Gov. Jay Inslee announced a statewide 'stay-at-home' order  in Washington state to help stop the spread of coronavirus. Real-time updates: https://www.king5.com/article/news/health/coronavirus/real-time-updates-coronavirus-washington-state/281-93237780-8117-4eb0-9852-ae7d07893384"
