video_id,title,publishedAt,channelId,channelTitle,categoryId,trending_date,tags,view_count,likes,dislikes,comment_count,thumbnail_link,comments_disabled,ratings_disabled,description
"Rk0kNhHGRL0","Highlights FC Barcelona vs RCD Mallorca (5-2)","2019-12-07T22:44:43.000Z","UCTv-XvfzLX3i4IGWAm4sbmA","LaLiga Santander","17","19.14.12","española|oficial|soccer|football|spanish league|laliga|resumen|highlight|FC Barcelona vs RCD Mallorca 5-2|sp:st=soccer|sp:vl=en|sp:dt=2019-12-07T20:00:00Z|sp:ti:home=fcb|sp:ti:away=mll|sp:ty=high|sp:or=2|sp:li=liga|matchday|hl|highlights|Balon de Oro|Balón de Oro|Ter Stegen|Manolo Reina|Sastre|Budimir|Frenkie De Jong|Salva Sevilla|Sergi Roberto|Luis Suárez|Lenglet|Piqué|Pique|Vicente Moreno|Valverde|Rakitic|Busquets","4235447","37788","1562","1689","https://i.ytimg.com/vi/Rk0kNhHGRL0/default.jpg","False","False","FC Barcelona's strong win against RCD Mallorca at the Camp Nou with hat-trick by Leo Messi and goals from Griezmann and Luis Suarez #BarçaRCDMallorca J16 LaLiga Santander 2019/2020Subscribe to the Official Channel of LaLiga Santander in HD | 2019-12-07 00.00h | J16 | BAR | MLLLaLiga Santander on YouTube: http://goo.gl/Cp0tCLaCopa on YouTube: http://bit.ly/1P4ZriPLaLiga SmartBank on YouTube: http://bit.ly/1OvSXbiFacebook: https://www.facebook.com/LaLigaTwitter: https://twitter.com/LaLigaInstagram: https://instagram.com/laligaGoogle+: http://goo.gl/46Py9"
"X2m-08cOAbc","Free Guy | Official Trailer | 20th Century FOX","2019-12-07T18:32:52.000Z","UC2-BeLxzUBSs0uSrmzWhJuQ","20th Century Fox","1","19.14.12","Free Guy|Ryan Reynolds|Trailer|Jodie Comer|Taika Waititi|Comedy|Action","9816554","262562","8713","15148","https://i.ytimg.com/vi/X2m-08cOAbc/default.jpg","False","False","In Twentieth Century Fox’s epic adventure-comedy “Free Guy,” a bank teller who discovers he is actually a background player in an open-world video game, decides to become the hero of his own story…one he rewrites himself. Now in a world where there are no limits, he is determined to be the guy who saves his world his way…before it is too late. Starring Ryan Reynolds, Jodie Comer, Joe Keery, Lil Rel Howery, Utkarsh Ambudkar and Taika Waititi, Directed by Shawn Levy from a story by Matt Lieberman and a screenplay by Lieberman and Zak Penn. Produced by Ryan Reynolds, Shawn Levy, Greg Berlanti, Sarah Schechter and Adam Kolbrenner with Mary McLaglen, Josh McLaglen, George Dewey, Dan Levine and Michael Riley McGrath serving as executive producers.Free Guy opens in U.S. theaters July 3, 2020.Connect with Free Guy Online:Visit the Free Guy WEBSITE: http://www.freeguymovie.comLike Free Guy on FACEBOOK: https://www.facebook.com/FreeGuyMovie/Follow Free Guy on TWITTER: https://twitter.com/FreeGuyMovieFollow Free Guy on INSTAGRAM: https://www.instagram.com/FreeGuyMovie#FreeGuy #RyanReynolds Connect with 20th Century FOX Online:Visit the 20th Century FOX WEBSITE: http://bit.ly/FOXMovieLike 20th Century FOX on FACEBOOK: http://bit.ly/FOXFacebookFollow 20th Century FOX on TWITTER: http://bit.ly/TwitterFOX"
"KHsMUXSVl6g","Wonder Woman 1984 Trailer REACTION","2019-12-08T21:42:52.000Z","UCAXR2zenCwvRIyQd9ydtfaA","Beyond The Trailer","24","19.14.12","Wonder Woman 1984 Trailer|Wonder Woman 1984 Trailer Reaction|Wonder Woman 1984 Trailer Review|Wonder Woman 1984 Trailer Today|Wonder Woman 1984|Trailer|Reaction|Review|Today|Trailer Reaction|Trailer Review|Trailer Today|CCXP|DC|DCEU|Gal Gadot|Maxwell Lord|Cheetah|2020|Movie|Official|Beyond The Trailer|Grace Randolph|Sneak Peek|Preview|First Look|Part|Full Movie|Clip|Scene|News|Update|This Week","295053","12160","566","2266","https://i.ytimg.com/vi/KHsMUXSVl6g/default.jpg","False","False","Wonder Woman 1984 Trailer REACTION today! Beyond The Trailer's reaction & review of official trailer 2020! Golden Armor! Maxwell Lord!http://bit.ly/subscribeBTTWonder Woman 1984 Trailer REACTION today! Beyond The Trailer host Grace Randolph's reaction & review of the official trailer for Wonder Woman 1984 starring Gal Gadot vs Cheetah released at CCXP!  Share your own reaction to the official trailer for Wonder Woman 1984 before you see the full movie in 2020!  And be sure to make Beyond The Trailer your first stop for movie and entertainment news here on YouTube today!Interact with host & creator Grace Randolph!Twitter: http://bit.ly/GraceOnTwitter#WonderWoman1984 #WonderWoman #DCEU"
"zuzg5LRMaGU","REACTION | Steven Gerrard | Rangers 0-1 Celtic","2019-12-08T17:42:08.000Z","UCVaGyBPoEAZItDjlFPsRcSA","Rangers Football Club (Official)","17","19.14.12","Rangers|Rangers FC|Rangers Football Club|RangersTV|Steven Gerrard","66513","0","0","468","https://i.ytimg.com/vi/zuzg5LRMaGU/default.jpg","False","True","The manager's verdict after defeat at Hampden.CLICK to subscribe for FREE and never miss another video: http://rng.rs/1KpxkIWSubscribe to RangersTV to receive even more official content and exclusive interviews: http://www.rangerstv.tv/pricing.phphttp://www.rangers.co.ukhttp://www.facebook.com/rangersfchttp://www.twitter.com/RangersFChttp://www.twitter.com/RangersTV"
"wBbM7kOLOTM","Anthony Joshua beats Andy Ruiz Jr to reclaim world heavyweight titles","2019-12-08T10:42:39.000Z","UCoMdktPbSTixAyNGwb-UYkQ","Sky News","25","19.14.12","anthony joshua|andy|ruiz|jr|joshua|andy ruiz|sky|news|saudi|arabia|boxing|championship|boxer|heavyweight|title|rematch|sports|belt|fighter|fighting|Riyadh|match|judges|Diriyah Arena|triumph|british|mexican|american|punch|wrestle|grab|action|hit|violence|game|sportswashing|controversy|cheering|sport|boxing ring|ring|knock|out|winner|won","588630","2708","298","693","https://i.ytimg.com/vi/wBbM7kOLOTM/default.jpg","False","False","Anthony Joshua has beaten Andy Ruiz Jr in their world heavyweight title rematch in Saudi Arabia.The British fighter has reclaimed the IBF, WBA, WBO and IBO belts he lost to his Mexican-American opponent in New York in June.SUBSCRIBE to our YouTube channel for more videos: http://www.youtube.com/skynewsFollow us on Twitter: https://twitter.com/skynews Like us on Facebook: https://www.facebook.com/skynewsFollow us on Instagram: https://www.instagram.com/skynewsFor more content go to http://news.sky.com and download our apps: Apple: https://itunes.apple.com/gb/app/sky-news/id316391924?mt=8Android https://play.google.com/store/apps/details?id=com.bskyb.skynews.android&hl=en_GB"
"NbaWrbJDr48","Last To Leave Toilet Wins $1,000,000 - Challenge (Part 3)","2019-12-07T21:11:07.000Z","UCX6OQ3DkcsbYNE6H8uQQuVA","MrBeast","24","19.14.12","[none]","14225139","593585","7790","38419","https://i.ytimg.com/vi/NbaWrbJDr48/default.jpg","False","False","New Merch - https://shopmrbeast.com/Instagram - https://www.instagram.com/mrbeastSUBSCRIBE OR I TAKE YOUR DOG----------------------------------------------------------------follow all of these or i will kick you• Facebook - https://www.facebook.com/MrBeast6000/• Twitter - https://twitter.com/MrBeastYT•  Instagram - https://www.instagram.com/mrbeast--------------------------------------------------------------------"
"ZWWXE291NUQ","Rapper Juice Wrld Dead at Age 21 | E! News","2019-12-08T22:46:26.000Z","UCjDsbbzHgTrGc4Ff26TJtsA","E! News","24","19.14.12","Top Stories|Entertainment|News|Death|Music|Tragedy|E! News|E! Entertainment|E!|Pop Culture|Breaking News|Breaking|Interviews|Red Carpet|Fashion|Trending|Celeb News|Gossip|Hollywood|Celebrities|Celebrity","993233","11493","610","4082","https://i.ytimg.com/vi/ZWWXE291NUQ/default.jpg","False","False","The hip-hop star who just celebrated his 21st birthday six days ago has died on Sunday morning after suffering a seizure in Chicago's Midway Airport. Get the details.Full Story: https://www.eonline.com/news/1100601/rapper-juice-wrld-dead-at-age-21-report#JuiceWrld #ENewsSubscribe: http://bit.ly/enewssubAbout E! News:Giuliana Rancic, Jason Kennedy and the rest of the E! News team bring you the latest breaking entertainment, fashion and Pop Culture news. Featuring exclusive segments, celebrity highlights, trend reports and more, The E! News channel is the only destination Pop Culture fans need to stay in the know.Download the E! News App: https://eonline.onelink.me/yMtl/4ead5017Connect with E! News:Visit the E! News WEBSITE: http://eonli.ne/enewsLike E! News on FACEBOOK: http://eonli.ne/ENewsFBCheck out E! News on INSTAGRAM: http://eonli.ne/ENewsIGFollow E! News on TWITTER: http://eonli.ne/ENewsTWRapper Juice Wrld Dead at Age 21 | E! Newshttp://www.youtube.com/user/enews"
"NQtVn-knyjU","Anthony Joshua outpoints Andy Ruiz Jr. to reclaim titles | Post Match Analysis | CBS Sports HQ","2019-12-08T00:16:33.000Z","UCja8sZ2T4ylIqjggA1Zuukg","CBS Sports","17","19.14.12","CBS|CBS Sports|sports","1503002","4414","1194","1230","https://i.ytimg.com/vi/NQtVn-knyjU/default.jpg","False","False","Six months after a stunning knockout loss, Anthony Joshua used his size and feet to regain control of the heavyweight division and put both his career and status as a global boxing superstar back on track. Joshua (23-1, 21 KOs), who came in 11 pounds lighter than his upset loss in June, outboxed Andy Ruiz Jr. in Saturday's rematch and avoided trouble to regain his WBA, WBO and IBF titles via wide unanimous decision. SUBSCRIBE TO OUR CHANNEL:https://www.youtube.com/user/CBSSports FOLLOW US ON:Facebook - https://www.facebook.com/CBSSports/Instagram - https://www.instagram.com/cbssports/Twitter - https://twitter.com/CBSSports"
"aHszQUzxiZU","SE DONS vs LAMBETH ALLSTARS | SOUTH LONDONS BIGGEST DERBY | LONDON CUP QF | Sunday League Football","2019-12-08T13:05:26.000Z","UCDS72f-TgUOfYkOzdB17leA","donstrapzytv","24","19.14.12","Se dons|sunday league tackles|sunday league football|arsenal fan tv|longest 90|slash football|baiteze|soccer am|fifa 19|arsenal|manchester united|jimmy bullard|bbc sport|bt sport|sky sports news|sky sports|fa cup|champions league|europa league|premiere league|love island|ian wright|puma football|jadon sancho|mesut ozil|nicholas pepe|aubameyang|liverpool|sadio mane|sergio aguero|lionel messi|ksi|logan paul","148053","5126","72","501","https://i.ytimg.com/vi/aHszQUzxiZU/default.jpg","False","False","Join us on Patreon:www.patreon.com/sedonsBUY YOUR DØNS MERCH & SE DØNS KIT NOW FROM www.sedons.comSE Dons is the journey of a Sunday League Football Club in South London hosted by UK Rap/Grime Artist Don Strapzy. Follow us on: Instagram @officialdons Twitter @sedonsfc Merch - www.sedons.com"
"ViPE4w1hczM","Aisling Bea Being ICONIC for 20 Minutes | Best Moments from 8 Out of 10 Cats Does Countdown & More!","2019-12-08T08:00:08.000Z","UCz1hQ68G3XPVYEBoFDgSjcQ","Channel 4","24","19.14.12","Aisling Bea|Channel 4|8 Out of 10 Cats Does Countdown|8 Out of 10 Cats|The Last Leg|Travel Man|Richard Ayoade|Virtually Famous|The Big Fat Quiz|The Lateish Show with Mo Gilligan|Jimmy Carr|Jon Richardson|Sean Lock|Russell Howard|aisling bea stand up|aisling bea paul rudd|aisling bea 8 out of 10 cats|aisling bea interview|aisling bea mcdonalds advert|aisling bea living with yourself|this way up|aisling bea this way up|sharon horgan","202815","2964","100","181","https://i.ytimg.com/vi/ViPE4w1hczM/default.jpg","False","False","Aisling Bea's funniest moments on 8 Out of 10 Cats Does Countdown, The Last Leg, Travel Man, Big Fat Quiz and more!Subscribe to Channel 4 for more: https://bit.ly/2v2I6SYWatch 8 Out of 10 Cats: http://bit.ly/2OU6fGgWatch 8 Out of 10 Cats Does Countdown: http://bit.ly/2VQiJAwWatch Virtually Famous: http://bit.ly/2FUNSvWWatch The Last Leg: http://bit.ly/31n4GnqWatch Travel Man: http://bit.ly/2VRHGeTWatch Big Fat Quiz: http://bit.ly/2Ynlvi5Watch The Lateish Show with Mo Gilligan: http://bit.ly/2Z0UsIR#AislingBea #8OutOf10CatsDoesCountdown #Channel4"
"_Y5mjOI9WQ0","Advent Calendars 2019 Day 8 | Ashens & Nerdcubed","2019-12-08T19:47:14.000Z","UCjscRSFwAXMnV7YN3vAR2Gw","extraashens","24","19.14.12","advent calendar|advent calendars|advent calendar 2019|grass masks|toy advent calendar|advent calendar opening 2018|ashens|dannerdcubed|nerdcubed|funny|review|2019 advent calendars|advent calendar opening|barbecue|barbecue spices|spice calendar|funko pops|funko pop|funko pop advent|funko pop calendar|Vtech|toot-toot|day 8","80872","4419","25","314","https://i.ytimg.com/vi/_Y5mjOI9WQ0/default.jpg","False","False","This is basic pluckingor The Staunton Lick#advent #2019 #ashens"
"X08E31sT0ic","BUDGET WOWCHER OUTFIT CHALLENGE! | Syd and Ell AD","2019-12-08T10:01:01.000Z","UCTOqGA8U2Ms7AuRkMW6T08g","SYDANDELL","1","19.14.12","wowcher|new|hail|haul|challenge|clorhes|clothes|fun|budget|outfit|coord|popcorn|machine|necklace|cheap|affordable|bargain|personalised|impressed|items|flask|sucess|winner|lifestyle|fashion|beauty|funny|girls|vloggers|blog|review|testing|fail","52318","1974","57","92","https://i.ytimg.com/vi/X08E31sT0ic/default.jpg","False","False","Use ELL10 or SYD10 FOR 10% off Wowcher!!!Knitted co-ord http://bit.ly/ELL10 Popcorn Maker http://bit.ly/ELL11Tracksuit http://bit.ly/SYD_11 Teddy Coat http://bit.ly/SYD_10Want more of SYD AND ELL annnnnd VLOGMAS... Subscribe to our vlog channel! https://www.youtube.com/channel/UC3T_... WEEKLY VLOGS KEEP UP WITH US & FOLLOW US ON SOCIALS! SYD'S: Twitter - twitter.com/sydneycrouchInstagram - https://www.instagram.com/sydneymaycr...Snapchat - sydneycrouch  ELL'S: Twitter - twitter.com/elliejarrett2Instagram - https://www.instagram.com/elliejarrett2/Snapchat - elliejarrett2This video was kindly sponsored by Wowcher, however all opinions are our own. #outfitchallenge #£50challenge #wowcher"
"dZGxwyEZJuc","Bologna 2-3 Milan | The Rossoneri is back on track with a second victory in a row | Serie A","2019-12-08T22:31:24.000Z","UCBJeMCIeLQos7wacox4hmLQ","Serie A","17","19.14.12","AC Milan|bologna vs milan|Bologna 2-3 Milan|bologna milan 2-3|bologna milan highlights|theo hernandez vs bologna|theo hernandez bologna|Inter Milan|hernandez milan|theo hernandez|Serie A|highlights|goals|migliori gol|Roma|Ronaldo|Higuain|Dybala|Insigne|Juventus|Napoli|CR7|Cristiano Ronaldo|full highlights|watch|stream|partita|federcalcio|calcio|Italia|sp:ty=high|sp:dt=2019-12-08T18:45:00Z|sp:st=soccer|sp:li=seri|sp:ti:home=BGN|sp:ti:away=MIL|sp:vl=en","919632","10699","266","421","https://i.ytimg.com/vi/dZGxwyEZJuc/default.jpg","False","False","AC Milan wins the second consecutive game, still away, and rises to -1 from Napoli. Goals by Piatek, Hernandez and Bonaventura | Serie AThis is the official channel for the Serie A, providing all the latest highlights, interviews, news and features to keep you up to date with all things Italian football.Subscribe to the channel here! https://bit.ly/2OM2Eax Find out more about the Serie A at: http://www.legaseriea.it/en/ Questo è il canale ufficiale della Serie A, dove potrai avere accesso ai momenti salienti, alle interviste, alle notizie e alle funzionalità del momento per rimanere aggiornato sulle ultime novità del campionato.Iscriviti qui al canale! https://bit.ly/2OM2EaxPer maggiori infomazioni sulla Serie A: http://www.legaseriea.it/it"
"d1D6qrZyCSU","Neil Lennon on the Match | Rangers 0-1 Celtic | CELTIC WIN 10TH TROPHY IN A ROW!","2019-12-08T20:04:10.000Z","UCBN-bb-hE7jYlcp4exwXRsQ","Celtic FC","17","19.14.12","celtic|bhoys|ghirls|hoops|football|soccer|green|white","31552","627","23","156","https://i.ytimg.com/vi/d1D6qrZyCSU/default.jpg","False","False","🗣️ Neil Lennon: I’m thrilled. I’m really proud. We had to dig in today. I don’t think we played well first-half, and we had to reply on Fraser at times to make some world-class saves, and then we showed great resilience and a great mentality to get the goal.#CelticXMen ❎---Watch exclusive player and manager interviews, full-match replays and go behind the scenes of Celtic FC ONLY on Celtic TV. Subscribe today!https://www.celticfc.tv/Subscribe to Official YouTube channel of the Champions and never miss another video.http://www.youtube.com/subscription_center?add_user=celticfchttp://www.celticfc.net/http://http://www.celticfc.tv/http://www.facebook.com/CelticFC/http://www.twitter.com/CelticFC/www.instagram.com/CelticFC/https://www.snapchat.com/add/celticfc/"
"kYRodGeJMkw","Trick Questions In Public!","2019-12-07T18:13:34.000Z","UCv-GNHtqM97EaU_i7gN_Ikw","Chunkz","24","19.14.12","Chunkz Entertainment|comedy|family friendly|Funny Challenges Fun|Chunkz|Public video|Trick question|Chunkz trick|Chunkz in public|Public questions|chunkz footasylum|chunkz prodirect","474916","69473","330","2821","https://i.ytimg.com/vi/kYRodGeJMkw/default.jpg","False","False","TRICK QUESTIONS IN PUBLIC! Subscribe: https://bit.ly/2PGvXfx | 🔔Make sure to enable ALL push notifications!🔔Watch the NEWEST videos: https://bit.ly/2PzaVSYInstagram: https://instagram.com/chunkz_en/Twitter: https://twitter.com/Chunkz_ENSnapChat: https://snapchat.com/add/SpiceggWatch more Chunkz :1V1 RAP BATTLE: https://bit.ly/2RY6Ar1COOKING WITH CHUNKZ: https://bit.ly/2pWEXlc2V2 RAP BATTLE: https://bit.ly/2RYtyOHLatest Videos: https://bit.ly/2PzaVSYPopular Videos: https://bit.ly/2yGdppi"
"sfjzXaB9JJ0","MALIGNAGGI REACTS TO ANTHONY JOSHUA BEATING ANDY RUIZ; DETAILED TAKE ON WHY THE JURY IS STILL OUT","2019-12-08T02:14:09.000Z","UCmxZw7N4Jyljr1RbSs4Ymaw","FightHype.com","17","19.14.12","Paulie Malignaggi|Anthony Joshua|Andy Ruiz Jr.|Boxing|FightHype","129928","1149","207","1071","https://i.ytimg.com/vi/sfjzXaB9JJ0/default.jpg","False","False","FightHype.com is on hand at the Barclays Center in Brooklyn, New York where middleweight champion Jermall Charlo is set to defend his title against challenger Dennis Hogan. You don't want to miss what those in attendance had to say about the fights and much more. Check it out!"
"TDLGl9Z_DOU","Anthony Joshua vs Andy Ruiz was frustrating to watch...","2019-12-08T07:15:57.000Z","UCRlvF4jIeBWqXJDGNXfPyVw","Chael Sonnen","24","19.14.12","MMA|mixed martial arts|Chael Sonnen|UFC|Bellator|Ultimate Fighting Championships|Bellator MMA|MMA Fights|MMA podcast|Beyond the Fight|Chael Sonnen podcast|mma fights|Fighter|Bad Guy Inc","297263","6447","582","2375","https://i.ytimg.com/vi/TDLGl9Z_DOU/default.jpg","False","False","LOSE WEIGHT NOW! https://www.amazon.com/Four-Pack-Revolution-Lower-Cheat-Weight-ebook/dp/B06Y1QFFDPChael Sonnen talks Anthony Joshua vs Andy Ruiz on this episode of Beyond the Fight.Click here to subscribe - https://www.youtube.com/chaelsonnenofficial?sub_confirmation=1"
"VK1He8VmaUs","A Battery that'll change Smartphones forever.","2019-12-08T11:56:56.000Z","UCMiJRAwDNSNzuYeN2uWa0pA","Mrwhosetheboss","28","19.14.12","smartphone|android|solid state battery|smartphone battery|solid|state|battery|android phone|best smatphone|2020|2020 smartphones|2020 phones|2020 iphone|iphone|apple|iphone 11 pro|iphone 12|Samsung|Galaxy S11|Galaxy S11 Plus|tech|technology","1138837","46699","1602","3133","https://i.ytimg.com/vi/VK1He8VmaUs/default.jpg","False","False","5 Smartphone Technologies coming in 2020 and onwards, including Solid State Batteries!  Go to https://Surfshark.deals/boss - Enter promo code BOSS for 83% off and 3 extra months for free!For the Ultimate Google Phone Comparison: Subscribe for more content (IT'S FREE) : https://goo.gl/pLg6fEIt would make my day if you could also follow me on:🌈 Instagram: https://goo.gl/OUqBBa🐦 Twitter: https://goo.gl/EFhwqL😊 Facebook: https://goo.gl/Aluzl1Amazon Affiliate links:Amazon US: https://goo.gl/3yS2aPAmazon UK: https://goo.gl/gvrsGZMy Filming Gear:https://goo.gl/5HKrBpMusic is from Epidemic sound:http://share.epidemicsound.com/pHDFT"
"KAZxjHxvlXk","Wrecked Honda S2000 Is Finally Back!!!","2019-12-08T14:30:01.000Z","UCwO_xoYm2vjhu4kZSxFO5mA","goonzquad","26","19.14.12","rebuilding a wrecked honda s2000|rebuilding a wrecked s2000|rebuilding a wrecked s2k|rebuilding a salvaged honda s2000|wrecked s2000 rebuild|rebuilding a wrecked ferrari 458 spider|rebuilding a wrecked ferrari 458|rebuilding a wrecked ferrari|rebuilding a salvaged ferrari 458|rebuilding a wrecked car|rebuilding a salvaged car|goonzquad s2000|goonzquad ferrari|copart build|copart rebuild","691138","28050","675","3242","https://i.ytimg.com/vi/KAZxjHxvlXk/default.jpg","False","False","This is where it gets interesting!!! We are bringing back one of our fallen builds that we never had time to get back to. Sometime you have to take some time to think things through then go at it with a different approach. We know that there will be problems that try to get in the way but we won't let that ever stop us. Thanks For Watching And Enjoy!!!-GOONZQUAD NEW MERCH!!!:  https://goonzquad.com-Instagram: https://www.instagram.com/goonzquad/-Email: goonzquadteam@gmail.com-P.O. Box 37  Rossville,GA 30741Music Credits:Song: Chris Lehman - Flash (Vlog No Copyright Music)Music promoted by Vlog No Copyright Music.Video Link: https://youtu.be/CZbq2c4p0csSong: Dipcrusher - Islands (Vlog No Copyright Music)Music provided by Vlog No Copyright Music.Video Link: https://youtu.be/CpFneq3zIt4Song: Daloka - My Holidays (Vlog No Copyright Music)Music promoted by Vlog No Copyright Music.Video Link: https://youtu.be/ZLiVZZzbZoQSong: Arensky - Shallows (Vlog No Copyright Music)Music promoted by Vlog No Copyright Music.Video Link: https://youtu.be/uiHcZmFFw2ISong: LiQWYD - You (Vlog No Copyright Music)Music provided by Vlog No Copyright Music.Video Link: https://youtu.be/aQt1soUa4J8Lioness (Instrumental) by DayFox https://soundcloud.com/dayfoxFree Download / Stream: https://bit.ly/lioness-instrumentalMusic promoted by Audio Library https://youtu.be/ZATMh49j49MSong: Markvard - Dawn (Vlog No Copyright Music)Music provided by Vlog No Copyright Music.Video Link: https://youtu.be/HEhF7zL7LDoSong: MBB - Feel Good (Vlog No Copyright Music)Music provided by Vlog No Copyright Music.Video Link: https://youtu.be/wIDKJeLXO5QSong: Nekzlo - Palm Shadows (Vlog No Copyright Music)Music promoted by Vlog No Copyright Music.Video Link: https://youtu.be/NjaN0uA0LjQSong: NOWË - Undefeated (Vlog No Copyright Music)Music provided by Vlog No Copyright Music.Video Link: https://youtu.be/4uPVLYXbF4M"
"9fStxEEBcOM","GUESS WHO *YOUTUBER EDITION* w/ CLICK","2019-12-07T21:30:01.000Z","UCELEYV16ItX8pNkg8EuVY7g","Click","24","19.14.12","click|click house|click crew|click plays|muselk|loserfruit|crayator|bazzagazza|lachlan|lazarbeam|lannan|vlogs|fortnite|challenge|lufu|bazz|cray|prank|reactions|travel|game show|gaming|sketch|comedy|funny|guess who|youtubers|jake paul|logan paul|pewdiepie|ksi|mrbeast|giant|youtuber guess who|guess the youtuber","1052232","48749","842","2925","https://i.ytimg.com/vi/9fStxEEBcOM/default.jpg","False","False","We play guess who but with your favourite (and not so favourite) youtubers! Click Social Links:YouTube | http://bit.ly/CLICK-SUBSCRIBEDouble Click YouTube | http://bit.ly/DOUBLECLICKTik Tok | http://vm.tiktok.com/m68E3N/Twitter | https://twitter.com/TheClickCrewInstagram | https://instagram.com/clickOur Partners:Produced and edited by the Click Management Team | http://clickmgmt.com.au/team4G data powered by Boost Mobile Australia | https://boost.com.au/Audio Equipment by Rode Microphones | http://www.rode.com/Click Roster:Muselk | https://www.youtube.com/user/MrMuselkLoserfruit | https://www.youtube.com/user/TheLoserfruitCrayator | https://www.youtube.com/user/CrayatorBazzaGazza | https://www.youtube.com/c/BazzaGazzaLazarBeam | https://www.youtube.com/LazarBeamTannar | https://www.youtube.com/c/tannareacottWe have opened a PO Box! You can send your letters or packages to all of us here at Click for a chance to be featured in a future video:PO Box 183Pyrmont 2009Australia"
"ZOFCH1AMoZw","Solskjaer, Rashford & Maguire react to Derby win | Man City 1-2 Manchester United | Premier League","2019-12-07T21:15:01.000Z","UC6yW44UGJJBvYTlfC7CRg2Q","Manchester United","17","19.14.12","manchester united|mufc|man utd|manutd|mu|ggmu|old trafford|solskjaer|rashford|maguire","542510","12797","136","1024","https://i.ytimg.com/vi/ZOFCH1AMoZw/default.jpg","False","False","Hear from Ole Gunnar Solskjaer, Marcus Rashford & Harry Maguire as the Reds clinched all three points at the Etihad Stadium.Subscribe to Manchester United on YouTube at http://bit.ly/ManU_YTVisit Manchester United at http://www.manutd.comLike Manchester United on Facebook at http://www.facebook.com/manchesterunitedFollow Manchester United on Twitter at http://www.twitter.com/ManUtdFollow Manchester on Instagram at http://www.instagram.com/manchesterunitedSubscribe to MUTV at https://bit.ly/2L9ymRs"
"9wTqfqPkOY8","THEY GOT 40! Kelvin & Oti Quickstep to The Lady is a Tramp - Week 12 Semi-Final | BBC Strictly 2019","2019-12-07T21:31:11.000Z","UC0-p7mK8hRVvV86yREq342A","BBC Strictly Come Dancing","24","19.14.12","Strictly Come Dancing|Dancing With the Stars UK|BBC|Strictly|Come|Dancing|bbc one|bbc 1|bbc1|strictly come dancing|strictly|strictly 2019|bbc strictly|scd|series 17|celebrities|professional dancers|pro dancers|dance|choreography|entertainment|competition|bbc iplayer|strictly series 17|bbc strictly come dancing|strictly come dancing 2019","238377","2345","61","242","https://i.ytimg.com/vi/9wTqfqPkOY8/default.jpg","False","False","Stream Strictly LIVE on BBC iPlayer 💃🕺 https://bbc.in/2MyAdzwSubscribe and 🔔 to BBC Strictly ✨ https://bit.ly/2kzjjATSubscribe and 🔔 to BBC 👉 https://bit.ly/2IXqEInKelvin Fletcher and Oti Mabuse Quickstep to The Lady is a Tramp by Glee Cast.It's Semi-Final time and the pressure is well and truly on as our couples have not one, but two routines to perform this week!Celebrities take to the dance floor to perform a dazzling display of ballroom routines.Strictly Come Dancing | Series 17 Week 12 Semi-Final | BBC#BBCStrictly #BBCStrictlyComeDancing #BBCiPlayer #BBCStrictly2019 #StrictlyComeDancing #Strictly #SCD"
