video_id,title,publishedAt,channelId,channelTitle,categoryId,trending_date,tags,view_count,likes,dislikes,comment_count,thumbnail_link,comments_disabled,ratings_disabled,description
"fhHc327QrKs","Bugzy Malone - December","2019-12-08T18:00:10.000Z","UCLd_hRzn-yr9Nh73XNviNWg","Bugzy Malone","10","19.14.12","bugzy malone|bugzy|malone|december|bugzy malone december|new song|new music|bugzy 2019|bugzy malone 2019|official video|bugsy malone|bugsy december|uk hip hop|grime|manchester","933018","44391","586","2040","https://i.ytimg.com/vi/fhHc327QrKs/default.jpg","False","False","BUY / STREAM 'DECEMBER':https://BugzyMalone.lnk.to/DecemberIDDirected by @dir.lxFor Bugzy Malone merchandise, tour dates, events and music - http://www.thebugzymaloneshow.co.uk B Malone clothing line - https://www.bmalonestore.com---SOCIAL MEDIA---Twitter - https://twitter.com/TheBugzyMaloneInstagram - https://instagram.com/thebugzymaloneFacebook – https://Facebook.com/TheBugzyMaloneShowSnapchat – Bugzy_MaloneSoundcloud - Soundcloud.com/BugzyMaloneBookings - bugzymaloneteam@gmail.com"
"oEiI5c2iUDY","Anthony Joshua on becoming a two-time world heavyweight champion and what went wrong in New York","2019-12-09T19:45:06.000Z","UCx_wVpf59cvUvaXqWVngTWw","BBC Radio 5 Live","17","19.14.12","Anthony Joshua|Andy Ruiz|AJ|Joshua|Ruiz Jr|Boxing|Heavyweight|5 Live Sport|BBC|BBC Radio 5 Live|BBC Radio 5|Sport|BBC Sport|BBC Sounds|Champion|WBO|WBA|IBF|#RuizJoshua2|#JoshuaRuiz2|Mike Costello|Steve Bunce|Boxing with Costello & Bunce","149891","2004","87","794","https://i.ytimg.com/vi/oEiI5c2iUDY/default.jpg","False","False","Listen to the latest 5 Live Boxing with Costello & Bunce podcast here on BBC Sounds: https://www.bbc.co.uk/sounds/play/p07x9bt1Anthony Joshua sits down with Mike Costello and Steve Bunce to discuss his unanimous points victory over Andy Ruiz Jr.Joshua also reveals for the first time what went wrong in the first fight at Madison Square Garden and how being a role model will inspire the next generation of boxers."
"nxQoq1i3NWk","Ghostbusters: Afterlife - Official Trailer (My Thoughts)","2019-12-10T08:57:01.000Z","UC7v3-2K1N84V67IF-WTRG-Q","Jeremy Jahns","24","19.14.12","ghostbusters|ghostbusters afterlife|teaser|trailer|fin wolfhard|reitman|review|my thoughts|awesometacular","253908","13531","197","1506","https://i.ytimg.com/vi/nxQoq1i3NWk/default.jpg","False","False","A new Ghostbusters film that looks to be the 3rd in continuity. We have a teaser trailer, so here are my thoughts on the trailer for GHOSTBUSTERS: AFTERLIFE!Watch the trailer here: https://www.youtube.com/watch?v=ahZFCF--uRY&t=1s#Ghostbusters #GhostbustersAfterlife"
"EhQXAm66Sjg","Every Sick Day Ever","2019-12-09T17:00:02.000Z","UCY30JRSgfhYXA6i6xX1erWg","Smosh","23","19.14.12","smosh|smosh pit|smosh games|funny|comedy","1267401","55842","1192","4754","https://i.ytimg.com/vi/EhQXAm66Sjg/default.jpg","False","False","If your coughs are as loud and powerful as the bass in your speakers, you should probably stay home. This is EVERY SICK DAY EVER!Punch that bell icon so you'll know when we add a new episode!Ian Hecox // https://www.instagram.com/ianhecox/Courtney Miller // https://www.instagram.com/co_mill/Shayne Topp // https://www.instagram.com/shaynetopp/Damien Haas // https://www.instagram.com/damienhaas/Vanessa Merrell // https://www.instagram.com/vanessamerrell/Veronica Merrell // https://www.instagram.com/veronicamerrell/Jacklyn Uweh // https://www.instagram.com/blkjack76/CREWDirector: Ryan ToddWriters: Monica Vasandani & Ryan FinnertyExecutive Producer: Ryan ToddProduction Manager: Margo McHughProduction Coordinator: Nancy Azcona1st AD: David Gutel DP: Billy YatesCam Op: Brennan Iketani1st AC: Jacqi JonesDIT: Matt DuranArt Director: Cassie VanceArt Department Assistant: Yasmeen MughalSet Decorator: Tayler NicholsonSet Dresser: Sam ValladresProps & Stage Coordinator: David HillSound Mixer: Greg JonesScript Supervisor: Eddie Vigil VHair & Makeup Department Head: Rachel JenkinsWardrobe: Lena Frostestad Gaffer: Nick Giomuso Best Boy Grip: Dustin BloodgoodGrip: Jonathan NaKey PA: Austin BarrettEditor: Mike SmallAssistant Editor: Matt DuranGFX: Brittany MetzContent Manager: Kiana ParkerIT/Equipment Manager: Tim BakerExecutive Assistant: Nancy AzconaWatch Surprising Shayne with a Graduation Ceremony (he cries): https://youtu.be/8yXMTfApDcAWatch Mystery Baby Bottle Challenge!: https://youtu.be/uvlG3rFs_uwWatch Bonus: Live from VidCon 2019! - SmoshCast: https://youtu.be/cwnI9IJKA7ISHOP THE SMOSH CLOTHING LINE: https://smosh.storeSubscribe To Smosh: https://smo.sh/Sub2SmoshFollow Us:Instagram: https://instagram.com/smoshFacebook: https://facebook.com/smoshTwitter: https://twitter.com/smoshCheck Out Our Other Smosh Channels:Smosh Pit: https://smo.sh/Sub2SmoshPitSmosh Games: https://smo.sh/Sub2SmoshGamesSmoshCast: https://smo.sh/Sub2SmoshCast"
"D0QpldEWmlY","I used The Sims to perfect my apartment | Unraveled","2019-12-09T20:00:01.000Z","UCuVxaQDraOja6xKidcmoufA","Polygon","20","19.14.12","the sims|sims|sims 4|unraveled|brian david gilbert|bdg|videogames|video games|polygon|perfect|apartment|decoration|redecoration|simulation|simulated|jazz|painting|money|happiness|perfection|house|interior design|real life|irl|recreating|paint night|wholesome|joy|funny|pee|ridiculous","812457","86224","616","3920","https://i.ytimg.com/vi/D0QpldEWmlY/default.jpg","False","False","Is The Sims just another fun video game... or is it the perfect simulation device? Today, Brian David Gilbert is using The Sims 4 to test out a perfect apartment before recreating it in real life.Subscribe to our YouTube channel! https://goo.gl/D8prdfLike us on Facebook: http://bit.ly/PolygonFBFollow us on Twitter: http://bit.ly/PolygonTwitterFollow us on Instagram: http://bit.ly/PolygonInstaAnd for more gaming and entertainment coverage, visit www.polygon.com"
"Qk6mqX_Lnvs","The Grand Tour Presents: Seamen - Exclusive First Look","2019-12-09T18:53:59.000Z","UCZ1Sc5xjWpUnp_o_lUTkvgQ","The Grand Tour","24","19.14.12","[none]","719211","28517","181","1176","https://i.ytimg.com/vi/Qk6mqX_Lnvs/default.jpg","False","False","Here's a never-before-seen sneak peek at Seamen.Watch on Prime Video 13 December."
"sfM7_JLk-84","Wonder Woman 1984 – Official Trailer","2019-12-08T21:02:09.000Z","UCjmJDM5pRKbUlVIzDYYWb6g","Warner Bros. Pictures","24","19.14.12","Wonder|Woman|1984|WW84|Patty|Jenkins","20192451","526447","17869","48612","https://i.ytimg.com/vi/sfM7_JLk-84/default.jpg","False","False","A new era of wonder begins. #WW84 in theaters June 5.www.wonderwomanfilm.comhttps://www.instagram.com/wonderwomanfilm/https://twitter.com/WonderWomanFilmwww.facebook.com/wonderwomanfilmFast forward to the 1980s as Wonder Woman’s next big screen adventure finds her facing two all-new foes: Max Lord and The Cheetah.  With director Patty Jenkins back at the helm and Gal Gadot returning in the title role, “Wonder Woman 1984” is Warner Bros. Pictures’ follow up to the DC Super Hero’s first outing, 2017’s record-breaking “Wonder Woman,” which took in $822 million at the worldwide box office.  The film also stars Chris Pine as Steve Trevor, Kristen Wiig as The Cheetah, Pedro Pascal as Max Lord, Robin Wright as Antiope, and Connie Nielsen as Hippolyta.Charles Roven, Deborah Snyder, Zack Snyder, Patty Jenkins, Gal Gadot and Stephen Jones are producing the film.  Rebecca Steel Roven Oakley, Richard Suckle, Marianne Jenkins, Geoff Johns, Walter Hamada, Chantal Nong Vo and Wesley Coller are the executive producers.Patty Jenkins directed from a screenplay she wrote with Geoff Johns & David Callaham, story by Jenkins & Johns, based on characters from DC.  Joining the director behind the scenes are several members of her “Wonder Woman” team, including director of photography Matthew Jensen, Oscar-nominated production designer Aline Bonetto (“Amélie”), and Oscar-winning costume designer Lindy Hemming (“Topsy-Turvy”).  Oscar-nominated editor Richard Pearson (“United 93”) is cutting the film.  The music is by Oscar-winning composer Hans Zimmer (“Dunkirk,” “The Lion King”).Warner Bros. Pictures Presents an Atlas Entertainment/Stone Quarry Production, a Patty Jenkins Film, “Wonder Woman 1984.”  Set to open in theaters on June 5, 2020 in 2D and 3D in select theaters and IMAX, it will be distributed worldwide by Warner Bros. Pictures."
"LkH2r-sNjQs","Why Electronic Voting Is Still A Bad Idea","2019-12-09T16:00:07.000Z","UCBa659QWEk1AI4Tg--mrJ2A","Tom Scott","27","19.14.12","tom scott|tomscott|the basics|computer science|online voting|electronic voting|voting|elections|election security","751994","47897","1130","3933","https://i.ytimg.com/vi/LkH2r-sNjQs/default.jpg","False","False","We still shouldn't be using electronic voting. Here's why. • Sponsored by Dashlane — for free on your first device @  https://www.dashlane.com/tomscottMORE BASICS: https://www.youtube.com/playlist?list=PL96C35uN7xGLLeET0dOWaKHkAlPsrkchaREFERENCES:Computerphile video: https://www.youtube.com/watch?v=w3_0x6oaDmIStories about voter identification happening outside the law: https://www.theguardian.com/notesandqueries/query/0,,-1051,00.htmlVoting machines left connected to the internet: https://www.vice.com/en_us/article/3kxzk9/exclusive-critical-us-election-systems-have-been-left-exposed-online-despite-official-denialsHackers getting voting machines to play Doom: https://www.salon.com/2019/08/14/hackers-can-easily-break-into-voting-machines-used-across-the-u-s-play-doom-nirvana/Small, well-funded team backed by a national government: https://www.nytimes.com/2019/07/25/us/politics/russian-hacking-elections.htmlScottish election: https://www.theguardian.com/politics/2007/jun/20/scotland.devolution and http://news.bbc.co.uk/1/hi/scotland/6627657.stm - with the Excel detail on page 50 of https://www.openrightsgroup.org/wp-content/uploads/org_election_report.pdf?page=50Report on e-voting in Estonia: https://estoniaevoting.org/Written by Sean M Elliott and Tom ScottDirected by TomekGraphics by Mooviemakers https://www.mooviemakers.co.uk/Audio mix by Haerther Productions https://haerther.net/I'm at https://tomscott.comon Twitter at https://twitter.com/tomscotton Facebook at https://facebook.com/tomscottand on Instagram as tomscottgo"
"IWhD1iFwsc0","It's like an Apple MacBook Micro...","2019-12-09T17:02:58.000Z","UCsTcErHg8oDvUnTzoqsYeNw","Unbox Therapy","28","19.14.12","onemix|laptop|tiny laptop|core i5|core i7|macbook|macbook pro|macbook air|apple|apple macbook|apple macbook pro|macbook pro 16|macbook pro 16 inch|2019|unboxing|onemix 3s|onemix 3s platinum|platinum|unbox therapy|lew later|review|umpc|new macbook|mini laptop|intel|dell|lenovo|hp|computer|tech|technology|one netbook|macbook pro keyboard|macbook pro 13|new macbook pro|macbook pro review|macbook pro 2019|best macbook|yoga|3s yoga","1479990","33638","2867","1990","https://i.ytimg.com/vi/IWhD1iFwsc0/default.jpg","False","False","The OneMix 3S Yoga Platinum is a tiny, powerful touchscreen convertible laptop. It might be the smallest core i7 laptop on the market.FOLLOW ME IN THESE PLACES FOR UPDATESTwitter - http://twitter.com/unboxtherapyFacebook - http://facebook.com/unboxtherapyInstagram - http://instagram.com/unboxtherapy"
"pFJoXEdsBAA","The Beginning of the End – Surface Pro X Review","2019-12-09T20:02:52.000Z","UCXuqSBlHAE6Xw-yeJA0Tunw","Linus Tech Tips","28","19.14.12","Microsoft|Surface Pro X|review|Surface Pro|2019|ARM|Windows 10 on ARm|Arm Windows 10|arm-powered|Qualcomm|laptop|Snapdragon|Microsoft SQ1|Snapdragon laptop|notebook|best|tablet|2-in-1|Surface Pro X review|Linus","944699","31359","893","2647","https://i.ytimg.com/vi/pFJoXEdsBAA/default.jpg","False","False","Use code LINUS to get $6 off your first box at https://lmg.gg/comicgarageCheck out NVIDIA GeForce RTX Powered ORIGIN PC's at http://bit.ly/2XhXMiLThe Surface Pro X represents the best of what Windows 10 on Arm has to offer. Unfortunately, the best needs to get better.Buy Surface Pro X:On Amazon: https://geni.us/DjbV4jZOn Microsoft Store: https://geni.us/ysDAWPurchases made through some store links may provide some compensation to Linus Media Group.Discuss on the forum: https://linustechtips.com/main/topic/1132778-the-beginning-of-the-end-%E2%80%93-surface-pro-x-review/Our Affiliates, Referral Programs, and Sponsors: https://lmg.gg/sponsorsGet a Displate Metal Print at https://lmg.gg/displatelttGet a 30-day free trial of Amazon Prime at https://lmg.gg/8KV1vLinus Tech Tips merchandise at http://www.LTTStore.com/ Our Test Benches on Amazon: https://www.amazon.com/shop/linustechtips Our production gear: http://geni.us/cvOSTwitter - https://twitter.com/linustechFacebook - http://www.facebook.com/LinusTechInstagram - https://www.instagram.com/linustechTwitch - https://www.twitch.tv/linustech Intro Screen Music Credit:Title: Laszlo - SupernovaVideo Link: https://www.youtube.com/watch?v=PKfxmFU3lWYiTunes Download Link: https://itunes.apple.com/us/album/supernova/id936805712Artist Link: https://soundcloud.com/laszlomusicOutro Screen Music Credit: Approaching Nirvana - Sugar High http://www.youtube.com/approachingnirvana"
"YxXbB0NbLIo","The Try Guys Rewind 2019, from 4 Different Perspectives","2019-12-09T16:00:09.000Z","UCpi8TJfiA4lKGkaXs__YdBA","The Try Guys","23","19.14.12","try guys|2nd try|why i quit buzzfeed|left buzzfeed|why i left buzzfeed|keith|ned|zach|eugene|habersberger|fulmer|kornfeld|yang|buzzfeedvideo|buzzfeed|ariel|ned & ariel|comedy|education|funny|try|learn|fail|experiment|test|tryceratops|storytime|stories|story|vlogmas|vlog|vlogging|how to|week in my life|on our own|youtuber|youtubers|creators|success|successful|tips|professional|series|horror story|worst moments|worst|best|moments|i'm gay|coming out|tour|book|author","1171604","71110","540","2401","https://i.ytimg.com/vi/YxXbB0NbLIo/default.jpg","False","False","#TheTryGuys reflect on their craziest year ever and share stories about their book, tour, and podcast, from 4 different perspectives.Are you a business looking to work with The Try Guys? Reach out to us at 2ndtrybusiness@gmail.com for all business inquiries! 🎧THE TRYPOD 🎧: watch our new podcast at https://youtube.com/trypod or listen at https://tryguys.com/podcast📘THE HIDDEN POWER OF F*CKING UP 📘: check out our new book at https://tryguys.com/bookGet your official Try Guys color hoodies and phone cases at https://tryguys.com/collections/color-line 💙❤️💚💜Support us! http://www.patreon.com/tryguys. Join our Patreon to get videos a day early, plus, live streams, chatrooms, BTS footage, exclusive merchandise, and more!SUBSCRIBE TO AND FOLLOW THE TRY GUYS http://www.youtube.com/c/tryguyshttp://www.facebook.com/tryguys  http://www.twitter.com/tryguyshttps://www.instagram.com/tryguysFOLLOW THE GUYShttp://www.Instagram.com/keithhabshttp://www.Instagram.com/nedfulmerhttp://www.Instagram.com/korndiddyhttp://www.instagram.com/eugeneleeyang http://www.twitter.com/keithhabshttp://www.twitter.com/nedfulmer http://www.twitter.com/korndiddyhttp://www.twitter.com/eugeneleeyang THE TRY GUYSThe #TryGuys is the flagship channel of 2ND TRY, LLC. Tune in twice a week for shows from Keith, Ned, Zach and Eugene, the creators and stars of The Try Guys.EDITED BY Esau Hamadanyan MUSICLicensed from AudioNetwork SFXLicensed from Audioblocks VIDEOLicensed from Videoblocks Official Try Guys PhotosBy Mandee Johnson Photography | @mandeephotoPhotos from JD Renes 2nd Try, LLC STAFFExecutive Producer - Keith HabersbergerExecutive Producer - Ned FulmerExecutive Producer - Zach KornfeldExecutive Producer - Eugene Lee YangProducer - Rachel Ann ColeProducer - Nick RufcaProduction Manager - Alexandria HerringEditor - Devlin McCluskeyEditor - YB ChangEditor - Elliot DickerhoofAssistant Editor - Will WitwerCamera Operator - Miles BonsignoreSound Operator - Jonathan Kirk Production Assistant - Sam JohnsonContent Strategist - Kaylin Burke Special Thanks To! Thanks to all of our Gold Level Patrons! AJ S., Amy Fleming, Ana Camba, Cat Hicks, Elisa Proust, Emma Godfrey, Erica Rao, Jared Aarons, Kelsey Bock, Kourtney Wong, Loretta Wen, Matthew Tadros, Miha, Paulus, Sarah Waxman, Traci Lew, Wendy Tran, Lily"
"-l6gmDLFgak","No budget Christmas present exchange swap w/ my BESTFRIEND!! ft Anastasia Kingsnorth","2019-12-08T16:58:48.000Z","UCFanrVWRodCwCw43U7KBAQg","Saffron Barker","24","19.14.12","saffron barker|saffron barker youtube|youtube saffron barker","855342","35968","610","1155","https://i.ytimg.com/vi/-l6gmDLFgak/default.jpg","False","False","No budget present exchange swap w/ my BESTFRIEND!! ft Anastasia KingsnorthSubscribe to my vlogs here: http://bit.ly/2clXIs6Subscribe: http://bit.ly/sub-SB | 🔔Make sure to enable ALL push notifications!🔔Watch MY NEWEST videos: https://youtube.com/playlist?list=PLN7q64zaVsnE0c5YtL5oqqtXge29NOzSP&playnext=2 Competition rules:Follow and be active on my Instagram ( SaffronBarker ) for a entry! Winner will be announced on this channel aug 11th! Good luck!!Follow Saffron Barker:Vlog Channel: http://bit.ly/1N1v8uK Instagram: https://instagram.com/saffronbarker Twitter: https://twitter.com/SaffronBarker SnapChat: https://snapchat.com/add/saffronbarker Watch more of Saffron Barker:Challenges: https://www.youtube.com/playlist?list=PLN7q64zaVsnE8gdkOqFgJwutSC90A-5HHplaynext=1Makeup & Beauty: https://www.youtube.com/playlist?list=PLN7q64zaVsnHaPeuTzC9BL51Zk33y__I8playnext=1VS: https://www.youtube.com/playlist?list=PLN7q64zaVsnESfvMvfG5EZrzTo55qX1oKplaynext=1Newest Videos: https://youtube.com/playlist?list=PLN7q64zaVsnE0c5YtL5oqqtXge29NOzSP&playnext=1Popular Videos: https://www.youtube.com/playlist?list=PLN7q64zaVsnHkeeXVfhW2lLCjT7X-gC3qplaynext=1About Saffron Barker:Welcome to the official Saffron Barker YouTube channel! On this channel, you’ll find a variety of lifestyle, beauty, and challenge videos including routine videos, boyfriend and girlfriend videos, q&as, makeup & beauty tutorials, clothing and American hauls, and more! Make sure to subscribe and enable ALL notifications so you never miss a video! For instant updates, follow us on our social media accounts below.BUSINESS ONLY : saffronbarker@mcsaatchisocial.com"
"kP-vvnPwieg","Trying DIY Clothing Hacks For Fashion Emergencies","2019-12-08T21:30:00.000Z","UC6IijBsVf2PlWo_uq6P9wQw","Gloom","24","19.14.12","5-minute crafts|do it yourself|123 go|life hacks|diy projects|5 minute crafts|diy activities|life hacks for kids|i tried crazy life hacks|see if they actually work|gloom|gloomgames|testing hacks|troom|pranks|gloom tries|trying diwhys|awful life hacks|trying lifehacks|dumbest life hacks|parody|satire|2019|how to|clothing hacks","1574163","35444","1420","3815","https://i.ytimg.com/vi/kP-vvnPwieg/default.jpg","False","False","Clothing tips for girls amiright? I need all the help that I can get so I'm about to try some quick fix tips by 123 Go because you know for a fact they've never led me astray..........Subscribe to 123 Go:https://www.youtube.com/channel/UCBXNpF6k2n8dsI6nBH8q4sQ?sub_confirmation=1SUBSCRIBE HERE: https://www.youtube.com/channel/UC6IijBsVf2PlWo_uq6P9wQw?sub_confirmation=1My INSTAGRAM: http://www.instagram.com/gloomykassieMy TWITTER: http://www.twitter.com/gloomykassieMy DISCORD SERVER (13 and up only): http://discord.gg/GLOOMNEW MERCH: http://gloom.storeWATCH OTHER HORRIBLE MOMENTS OF MY LIFE: https://www.youtube.com/watch?v=-RcgvL6bKZQ&list=PLwbhb6Gu7AnXcLWpGMezpMHtPc6MZIfwYMy TIK TOK is @gloomdog, here's a link: http://vm.tiktok.com/JTHb8L/---------------------------------------------------------------------------I'm Kassie, also known as Gloom! I'm a variety gamer who does gameplay commentary on indie games and some bigger titles too. I also do silly sketches, challenges, Q&As, and whatever makes you goof balls giggle.---------------------------------------------------------------------------I do my best to upload at a few times a week (unless my life is a mess)."
"ELLmSjuLPF0","Update: New Zealand volcano, Sydney smoke warning | Nine News Australia","2019-12-10T00:54:22.000Z","UCIYLOcEUX6TbBo7HQVF2PKA","Nine News Australia","25","19.14.12","Nine News Australia|Channel 9|Breaking News|Sydney News|Melbourne News|Brisbane News|Politics|new zealand volcano|nz volcano|white island volcano|white island eruption|sydney smoke|sydney smog|sydney air quality","73226","326","29","0","https://i.ytimg.com/vi/ELLmSjuLPF0/default.jpg","True","False","There are 'no signs of life' after the devastating volcanic eruption on White Island in New Zealand. In Sydney, major health alerts have been issued as a thick, hazardous smoke cloaks the harbour city.Subscribe: https://bit.ly/2noaGhv Get more breaking news at: https://bit.ly/2nobVgFJoin Nine News for the latest in news and events that affect you in your local city, as well as news from across Australia and the world.Follow Nine News on Facebook: https://www.facebook.com/9News/Follow Nine News on Twitter: https://twitter.com/9NewsAUSFollow Nine News on Instagram: https://www.instagram.com/9news/#9News #NineNewsAustralia #9NewsAUS"
"4HArq6qR0GI","Trick Free Kicks ft. Eden Hazard, W2S, Mariano & Álvaro Odriozola","2019-12-08T21:14:45.000Z","UCQ-YJstgVdAiCT52TiBWDbg","ChrisMD","24","19.14.12","free kick|free kicks|challenge|real madrid|eden hazard|hazard|w2s|sidemen|football","1471171","56062","749","1430","https://i.ytimg.com/vi/4HArq6qR0GI/default.jpg","False","False","Free kicks with Real Madrid's Eden Hazard, Mariano, Odriozola and a couple of lost amateurs. This was recorded during pre-season in July. Harry: https://www.youtube.com/user/wroetoshaw► Follow my Instagram: http://instagram.com/chrismd10► Follow me on Twitter: https://twitter.com/chrismd10► My book: http://amzn.to/2hvWgIUHow I record my gameplay!: https://www.elgato.com/gaming/?utm_source=chrismd&utm_medium=youtube&utm_campaign=GameCaptureHDMusic:0:00 | (Audiomachine) Mark Petrie – Redshift 0:14, 3:14 | (Audiomachine) Kevin Rix – Water Wars 0:35 | Sightless in Shadow - The Pit of Doom0:45 | Arc North – Slash https://soundcloud.com/arcnorth/slash0:59 | Aero Chord – Resistance1:13, 1:41, 2:42, 4:22 | Strlght – Flames1:35 | Adam Peters – Restitution1:41 | MoonBeat x OpenWater – Time; Instagram.com/dcat12 .2:10 | FEWZ – Drive https://www.youtube.com/watch?v=q1L9sI_FdSM; Music provided by Free Songs To Us2:28 | Marc Madness – Mean https://www.youtube.com/watch?v=NGgNlXdqG90 3:02, 3:34 | Arc North – Lost Time https://youtu.be/zens2riLTzY3:22, 4:11 |Elijah N, Killrude – On My Own (Killrude Remix) (Instrumental Version)5:16 | Niklas Johansson – The End Of All Things 5:59, 7:19 | Hallman – Endless Dawn6:13 | Jim Yosef Anna Yvette – Linked [NCS Release] Music provided by NoCopyrightSounds. Watch: https://youtu.be/yHLtE1wFeRQ  Free Download / Stream: http://ncs.io/2017LinkedMusic by Epidemic Sound (http://www.epidemicsound.com) & others."
"e5dir37rPok","The History of my Hair","2019-12-08T19:04:47.000Z","UCGwu0nbY2wSkW8N-cghnLpA","Jaiden Animations","1","19.14.12","jaiden|animations|jaidenanimation|jaidenanimations|haircuts|hair styles|jaidenanimations hair|jaiden animation hair|bad haircut|coconut hair|hair|hello","5737415","383763","3299","50381","https://i.ytimg.com/vi/e5dir37rPok/default.jpg","False","False","So many haircuts in a reasonable amount of time♥ The Team ♥Atrox: https://twitter.com/AtroxChobatsuDavidBaronArt: http://davidbaronart.tumblr.com/Denny: https://twitter.com/90PercentDennyDuckdee: https://www.youtube.com/user/SirDuckD?app=desktopJaystarz: https://www.youtube.com/xjaystarzxJRF: jrfieldsend@aol.comMorganToast: https://morgantoast.tumblr.com/Noodle: https://www.youtube.com/channel/UCj74rJ9Lgl3WTngq675wxKgShooch: https://twitter.com/Shoocharu?s=09------------------------------------------------------------------------------------SUBSCRIBE for more animations!https://www.youtube.com/c/jaidenMERCH:https://jaidenanimations.com/TWITTER:https://twitter.com/JaidenAnimationINSTAGRAM:https://instagram.com/jaiden_animations/DEVIANTART:http://jaidenanimations.deviantart.com/Behind the Scenes:https://www.patreon.com/jaidenanimations?ty=hIf you're an animator, artist, gamer, or entertainer, then join us at Channel Frederator Network: https://frdr.us/JaidenWanna Send Fanart?You can send it to me through Twitter or Instagram (links above)------------------------------------------------------------------------------------Music: March of the Spoons by Kevin Macleod------------------------------------------------------------------------------------And this tells me you read the description, which means you respect what I have to say! Thank you :D May you never have a coconut haircut"
