video_id,title,publishedAt,channelId,channelTitle,categoryId,trending_date,tags,view_count,likes,dislikes,comment_count,thumbnail_link,comments_disabled,ratings_disabled,description
"K-WCAEwMJhI","I Love Sausage Rolls (Official Music Video) - LadBaby","2019-12-13T09:00:13.000Z","UCVBXTHC8cAKUHyK3LytUzHA","LadBaby","24","19.14.12","Christmas|christmas number 1|xmas number 1|number 1|sausage rolls|sausage roll sing along|song|music|ladbaby song|sausage roll song|lad baby|christmas present|number one|Christmas number one 2019|xmas number 1 2019|ladbaby|nottingham|lad|parenting|parent|lad dad|dad|family|funny|comedy|british family|british comedy|yes mate|daddy|london|xmas|december|presents|santa|festive|magical|I love sausage rolls|I love rock n roll|trussel trust","534246","45865","1704","3912","https://i.ytimg.com/vi/K-WCAEwMJhI/default.jpg","False","False","I Love Sausage Rolls (Official Music Video) - LadBabyDOWNLOAD HERE: https://frtyfve.lnk.to/ILoveSausageRollsID!12This epic cover of ‘I Love Sausage Rolls’ by LadBaby (Mark and Roxanne Hoyle) in support of The Trussell Trust and UK food banks. Money raised from this charity single will allow The Trussell Trust to support more than 1,200 food bank centres in the UK to provide emergency food to people who have been referred in crisis, and support to help people resolve these crises, while also challenging the structural economic issues that lock people into poverty.The Trussell Trust support a nationwide network of food banks and together provide emergency food and support to people locked in poverty, while also campaigning for change to end the need for food banks in the UK.For every download of LadBaby’s charity Christmas song, ‘I Love Sausage Rolls’, 100% of all song profits from every download will go towards the work of Trussell Trust charity in England & Wales (1110522) and Scotland (SC044246).FACEBOOK: @LadBabyOfficial INSTAGRAM: @LadBabyOfficial TWITTER: @LadBabyOfficial#ILoveSausageRolls #LadBaby"
"jvcfj0x2pJA","Taking Off My BOYFRIEND'S ..... Makeup","2019-12-13T20:00:12.000Z","UCoziFm3M4sHDq1kkx0UwtRw","Glam&Gore","24","19.14.12","Taking off my boyfriend’s makeup|doing my boyfriend’s makeup|boyfriend|glam and gore|glam&gore|mykie|q and a|q&a|sfx makeup|fx makeup|beauty makeup|alien|punk|face reveal|dating|2019|2020|makeup removal","810733","90955","365","10191","https://i.ytimg.com/vi/jvcfj0x2pJA/default.jpg","False","False","Alexa, cue careless whisper cause today we’re taking off my boyfriend’s……. makeup. To do that, we’re throwing down an uno reverse card & doing this video backwards. Makeup first, questions in between, clean face last. If you skip ahead to the end a headless ghost will appear at the foot of your bed tonight.Seriously though, he’s the absolute best. If you’re not totally sick of us by the end of this video, check out some cute pics of us on insta! https://www.instagram.com/mykie/---------------------------------------------------------------------------------------Follow me on other sites:Instagram: https://www.instagram.com/mykie/Twitter: https://twitter.com/GlamAndGoreFacebook: https://www.facebook.com/GlamAndGoreMakeupSnapchat: GlamNgorewww.glamandgore.comPersonal Channel: https://www.youtube.com/mykieCopyright Glam&Gore ©2019---------------------------------------------------------------------------------------S   O   N   G   S :Hyperfun, Monkeys Spinning Monkeys by Kevin MacLeod is licensed under a Creative Commons Attribution license (https://creativecommons.org/licenses/...)Source: http://incompetech.com/music/royalty-...Artist: http://incompetech.com/Track: Droptek - New Style [NCS Release]Watch: https://youtu.be/ZXK4FTUcrOcTaking off my boyfriend’s makeup , doing my boyfriend’s makeup , boyfriend , glam and gore , glam&gore , mykie ,q and a, q&a, sfx makeup , fx makeup , beauty makeup , alien , punk , face reveal , dating , 2019 , 2020 , makeup removal"
"0tUqIHwHDEc","Xbox Series X - World Premiere - 4K Trailer","2019-12-13T02:12:32.000Z","UCjBp_7RuDBUYbd1LegWEJ8g","Xbox","20","19.14.12","Xbox|Xbox360|xbox 360|Xbox One|new Xbox|Xbox Series X|new Xbox console|Xbox console|Xbox trailer|Xbox video|Xbox One X|Xbox One S|Halo|Halo Infinite|Forza|Fifa|Master Chief|console|gaming|next-gen console|Power Your Dreams|console gaming|next-gen Xbox console","6098168","200113","16301","18692","https://i.ytimg.com/vi/0tUqIHwHDEc/default.jpg","False","False","Introducing the new Xbox Series X*. Power Your Dreams. Coming Holiday 2020. Learn more at: https://www.xbox.com/consoles/xbox-series-xFOLLOW XBOX:Youtube: https://www.youtube.com/Xbox  Facebook: https://www.facebook.com/Xbox   Twitter: https://www.twitter.com/Xbox   Instagram: https://www.instagram.com/Xbox *The availability and sale of Xbox Series X is subject to required regulatory approval(s) in your jurisdiction."
"bwNV7TAWN3M","Wham! - Last Christmas (Official 4K Video)","2019-12-13T18:00:11.000Z","UCm1QnxCbcLB8fQwoTDk39iQ","WhamVEVO","10","19.14.12","wham!|Last christmas|Wham! Last Christmas 4K|George Michael|Wham! remastered|Wham! official video|Wham Last Christmas 4k video official video|Wham! Last Christmas lyrics|last Christmas remastered|Wham! Last Christmas full album|Wham! Last Christmas soundtrack|last Christmas soundtrack|Christmas Songs|last christmas remastered|official video|Wake Me Up Before You Go Go|Wham! Last Christmas|Christmas movies|george|michael|Pop","617970","44631","335","2739","https://i.ytimg.com/vi/bwNV7TAWN3M/default.jpg","False","False","Wham! - Last Christmas (Official 4K Video)Stream the full Last Christmas soundtrack here: https://smarturl.it/LastChristmasOSTFollow on Spotify - http://smarturl.it/Greatest_HitsListen on Apple Music - http://smarturl.it/GeorgeEssentialsListen on Amazon - http://smarturl.it/GeorgeLWP_AmazonPre-order Last Christmas Limited Edition 7 White Vinyl - https://smarturl.it/LastChristmasVinyl﻿Subscribe to the George Michael YouTube channel: https://smarturl.it/GM_SUBSCRIBESubscribe to the Wham! YouTube channel: https://smarturl.it/WHAM_SUBSCRIBEWATCH LAST CHRISTMAS MUSIC VIDEO ► https://smarturl.it/YT_LastChristmasWATCH WAKE ME UP BEFORE YOU GO GO MUSIC VIDEO IN HD ► https://smarturl.it/WAKE_ME_UP_HDWATCH CARELESS WHISPER MUSIC VIDEO IN HD ► https://smarturl.it/GM_CarelessWhisperHDWATCH CLUB TROPICANA MUSIC VIDEO ► https://smarturl.it/YT_ClubTropicanaWATCH FAITH MUSIC VIDEO ► https://smarturl.it/YT_Faith_officialWATCH FREEDOM '90 MUSIC VIDEO ► https://smarturl.it/YT_Freedom90Follow George Michael:Official website - http://www.georgemichael.comFacebook - https://www.facebook.com/georgemichael/Twitter - https://twitter.com/GeorgeMOfficialInstagram - https://www.instagram.com/georgemoffi…#Wham #LastChristmas #Remastered #GeorgeMichael #ChristmasSongs #WhamOfficialVideo #EmiliaClarke #EmmaThompson #WhamLastChristmasSoundtrack #WhamGreatestHits #Christmas #LastChristmasSoundtrack #WhamLastChristmas #GeorgeMichaelLastChristmas #ChristmasMoviesLyricsLast Christmas, I gave you my heartBut the very next day you gave it awayThis year, to save me from tearsI'll give it to someone specialLast Christmas, I gave you my heartBut the very next day you gave it awayThis year, to save me from tearsI'll give it to someone special Once bitten and twice shyI keep my distanceBut you still catch my eyeTell me, babyDo you recognize me?Well, it's been a yearIt doesn't surprise me(Happy Christmas!) I wrapped it up and sent itWith a note saying, I love you,  I meant itNow, I know what a fool I've beenBut if you kissed me nowI know you'd fool me againLast Christmas, I gave you my heartBut the very next day you gave it awayThis year, to save me from tears I'll give it to someone specialLast Christmas, I gave you my heartBut the very next day you gave it awayThis year, to save me from tearsI'll give it to someone specialOh, oh babyA crowded room, friends with tired eyesI'm hiding from you, and your soul of iceMy god, I thought you were someone to rely onMe? I guess I was a shoulder to cry onA face on a lover with a fire in his heartA man under cover but you tore me apartNow, I've found a real love you'll never fool me againLast Christmas, I gave you my heartBut the very next day you gave it awayThis year, to save me from tearsI'll give it to someone specialLast Christmas, I gave you my heartBut the very next day you gave it awayThis year, to save me from tearsI'll give it to someone specialA face on a lover with a fire in his heartA man under cover but you tore him apartMaybe next year I'll give it to someoneI'll give it to someone special"
"GLcA6llz7MI","I Opened A 5 Star Restaurant On A London Underground Train","2019-12-12T17:03:52.000Z","UCdcUmdOxMrhRjKMw-BX19AA","Niko Omilana","24","19.14.12","london underground|Restaurant|Challenge|FREE|Free food|Food|niko omilana|niko|NDL|tube|london tube|public transport","1115750","155767","943","4629","https://i.ytimg.com/vi/GLcA6llz7MI/default.jpg","False","False","I decided to challenge myself by turning the london underground train into a 5 star restaurant AND EVERYTHING WAS FREE including the food!!BUY MY MERCH- https://www.shopndl.com/SUB TO JACK AND ZAY- https://www.youtube.com/channel/UCcjx6m03fZwtRBFn1Cf7kKQSUB TO MARK- https://www.youtube.com/channel/UCQNbfWASCZedLPFChbJ6AEgFollow me on Instagram- http://instagram.com/nikoomilanaFollow me on Twitter- https://twitter.com/NikoOmilanaMY SNAPCHAT: NikolasOmilanaBusiness Email - Nikolasomilana@gmail.com"
"vpNUzNBw6FI","Joyner Lucas - Revenge Intro/ADHD (official video)","2019-12-13T17:02:54.000Z","UCUebubwSuTHfHjWJI4gCS9A","Joyner Lucas","10","19.14.12","eminem|logic|adhd|j cole|kendrick lamar|xxl|hip hop|joyner|joyner lucas|isis|devils work|i love","1155054","135650","1301","9627","https://i.ytimg.com/vi/vpNUzNBw6FI/default.jpg","False","False","Written and Distributed on Tully: https://bit.ly/2BFcGEVStream Now: https://orcd.co/adhdsingleADHD Merch: https://bit.ly/2RDQs0b"
"IFWal8wAvbI","UFC 245 Embedded: Vlog Series - Episode 5","2019-12-13T19:00:34.000Z","UCvgfXK4nTYKudb0rFR6noLA","UFC - Ultimate Fighting Championship","17","19.14.12","ufc|embedded|ultimate|fighting|championship|champion|champ|title|welterweight|featherweight|bantamweight|245|kamaru|usman|nigerian|nightmare|colby|covington|chaos|amanda|nunes|lioness|double|germaine|de randamie|iron|lady|max|holloway|blessed|alexander|volkanovski|great|las|vegas|t-mobile|arena","612389","8779","237","2872","https://i.ytimg.com/vi/IFWal8wAvbI/default.jpg","False","False","On Episode 5 of UFC 245 Embedded, welterweight champion Kamaru Usman receives support from heavyweight Francis Ngannou. Featherweight champion Max Holloway gets a haircut from his longtime barber, and opponent Alexander Volkanovski does an outdoor photo shoot. Bantamweight Hall of Famer Urijah Faber feels fresh ahead of a bout in which he’s the underdog. The stars of the night’s three title fights attend Ultimate Media Day for interviews and faceoffs. Bantamweight champion Amanda Nunes and Germaine de Randamie have kind words for one another ahead of their championship bout, but the opposite is true for Usman and Colby Covington. UFC 245 Embedded is an all-access, behind-the-scenes video blog leading up to the three title fights taking place Saturday December 14. Order the Pay-Per-View at ESPNPlus.com/PPV   Connect with UFC Online and on SocialWebsite: http://www.ufc.comFollow UFC Twitter: http://www.twitter.com/ufcFacebook: http://www.facebook.com/ufcInstagram: http://www.instagram.com/ufcSnapchat: UFCPeriscope: http://Periscope.tv/ufcTwitch: https://www.twitch.tv/ufc Follow Kamaru The Nigerian Nightmare UsmanTwitter https://twitter.com/USMAN84kgFacebook https://www.facebook.com/KamaruusmanmmaInstagram https://www.instagram.com/usman84kg/ Follow Colby “Chaos” CovingtonTwitter https://twitter.com/ColbyCovMMAInstagram https://www.instagram.com/ColbyCovMMAFacebook https://www.facebook.com/colbycov  Follow Amanda “The Lioness” NunesTwitter https://twitter.com/Amanda_LeoaInstagram https://www.instagram.com/amanda_leoa/Facebook https://www.facebook.com/amanda.n.lioness/ Follow Germaine The Iron Lady de RandamieTwitter https://twitter.com/IronLadyMMAInstagram https://www.instagram.com/ironladymma/?hl=enFacebook https://www.facebook.com/germaine.derandamie?fref=tsFollow Max Blessed HollowayTwitter https://twitter.com/BlessedMMAInstagram https://www.instagram.com/blessedmma/?hl=enFacebook https://www.facebook.com/BlessedMMAoffical/ Follow Alexander The Great Volkanovskihttps://www.instagram.com/AlexVolkanovski/https://www.facebook.com/alexvolkanovski/https://twitter.com/AlexVolkanovskiConnect with UFC Online and on SocialWebsite: http://www.ufc.comFollow UFC Twitter: http://www.twitter.com/ufcFacebook: http://www.facebook.com/ufcInstagram: http://www.instagram.com/ufcSnapchat: UFCPeriscope: http://Periscope.tv/ufcTwitch: https://www.twitch.tv/ufc About UFC®UFC® is the world’s premier mixed martial arts organization (MMA), with more than 300 million fans and 75 million social media followers. The organization produces more than 40 live events annually in some of the most prestigious arenas around the world, while broadcasting to nearly one billion TV households across more than 170 countries. UFC’s athlete roster features the world’s best MMA athletes representing more than 65 countries. The organization’s digital offerings include UFC FIGHT PASS®, one of the world’s leading streaming services for combat sports. UFC was acquired in 2016 by global entertainment, sports and content company Endeavor, along with strategic investors Silver Lake Partners and KKR. UFC is headquartered in Las Vegas, Nevada. For more information, visit UFC.com and follow UFC at Facebook.com/UFC, Twitter, Snapchat and Instagram: @UFC."
"6e50Dfm3f0g","Man Utd vs AZ Alkmaar (4-0) | UEFA Europa League Highlights","2019-12-12T22:28:22.000Z","UC4i_9WvfPRTuRWEaWyfKuFw","BT Sport","17","19.14.12","bt sport|bt sport official|sp:ty=high|sp:dt=2019-12-12T20:00:00Z|sp:st=soccer|sp:li=uefa|sp:ti:home=MAN|sp:ti:away=AZ|man utd|manchester united|europa league|man utd highlights|europa league highlights","1047404","13028","350","1225","https://i.ytimg.com/vi/6e50Dfm3f0g/default.jpg","False","False","Four goals in 11-minutes saw Man Utd finish the group stage in fine style at Old Trafford.Hit 'Subscribe' above to ensure you never miss a video from the BT Sport YouTube channel.Visit and subscribe to our 'BT Sport Boxing' YouTube channel ➡️ http://www.youtube.com/c/btsportboxingTwitter: http://twitter.com/btsportFacebook: http://www.facebook.com/btsportInstagram:http://instagram.com/btsportWebsite: http://sport.bt.com"
"9s4jcxqjNBk","Roman Reigns unleashes on King Corbin & Dolph Ziggler: SmackDown, Dec. 13, 2019","2019-12-14T03:54:36.000Z","UCJ5v_MCY6GNUBTO8-D3XoAg","WWE","17","19.14.12","wwe|world wrestling entertainment|wrestling|wrestler|wrestle|superstars|कुश्ती|पहलवान|डब्लू डब्लू ई|मैच|सुपरस्टार|व्यावसायिक कुश्ती|مصارعه|wwe 2019|SmackDown|Roman Reigns|Dolph Ziggler|King Corbin|Kofi Kingston|Big E|Scott Dawson|Dash Wilder|New Day|Revival|Smackdown clips|smackdown highlights|smackdown winners|smackdown match card|smackdown tonight|friday night smackdown","1962827","67828","1631","2471","https://i.ytimg.com/vi/9s4jcxqjNBk/default.jpg","False","False","The Big Dog is unchained and bites back at King Corbin and Dolph Ziggler to pay back last week’s humiliating dog food attack.#SmackDownGET YOUR 1st MONTH of WWE NETWORK for FREE: http://wwe.yt/wwenetwork---------------------------------------------------------------------Follow WWE on YouTube for more exciting action!---------------------------------------------------------------------Subscribe to WWE on YouTube: http://wwe.yt/Check out WWE.com for news and updates: http://goo.gl/akf0J4Find the latest Superstar gear at WWEShop: http://shop.wwe.com---------------------------------------------Check out our other channels!---------------------------------------------The Bella Twins: https://www.youtube.com/thebellatwinsUpUpDownDown: https://www.youtube.com/upupdowndownWWEMusic: https://www.youtube.com/wwemusicTotal Divas: https://www.youtube.com/wwetotaldivas------------------------------------WWE on Social Media------------------------------------Twitter: https://twitter.com/wweFacebook: https://www.facebook.com/wweInstagram: https://www.instagram.com/wwe/Reddit: https://www.reddit.com/user/RealWWEGiphy: https://giphy.com/wwe------------------------------------WWE Podcasts------------------------------------After the Bell with Corey Graves: http://bit.ly/afterthebellpodcastThe New Day: Feel the Power: https://link.chtbl.com/7Fp6uOqk"
"GBpXBxK1H2M","Election 2019 Live: The Results | ITV News","2019-12-13T06:47:57.000Z","UCFQgi22Ht00CpaOQLtvZx2A","ITV News","25","19.14.12","Election|UK politics|Politics|Brexit|Conservatives|Labour|Liberal Democrats|Green Party|Brexit Party|Scottish National Party|DUP|Plaid Cymru|UKIP","1159667","7638","1984","1203","https://i.ytimg.com/vi/GBpXBxK1H2M/default.jpg","False","False","Live coverage through the night from ITV News as the results of the 2019 UK General Election come in.Accompanied by renowned psephologists Colin Rallings and Jane Green, as well as a range of other high-profile guests and familiar faces, anchor Tom Bradby will once again guide viewers through the wins and losses of the night, in this most unpredictable of general elections.• Subscribe to ITV News on YouTube: http://bit.ly/2lOHmNj • Get breaking news and more stories at http://www.itv.com/newsFollow ITV News on Facebook: https://www.facebook.com/itvnews/ Follow ITV News on Twitter: https://twitter.com/itvnews Follow ITV News on Instagram: https://www.instagram.com/itvnews/"
"iIFOw2ZjOTI","WHICH COFFEE CHAIN IS THE BEST?","2019-12-13T21:38:21.000Z","UC78cxCAcp7JfQPgKxYdyGrg","emma chamberlain","24","19.14.12","emma chamberlain|emma chambie|vlog|which coffee chain is the best|coffee|taste test","944368","66864","1304","4689","https://i.ytimg.com/vi/iIFOw2ZjOTI/default.jpg","False","False","if you can't tell, im passionate about coffee. i guess.✩ MY PODCAST ✩✭ listen on SPOTIFY: https://bit.ly/StupidGeniusShow✭ listen on APPLE PODCASTS: https://bit.ly/StupidGeniusPod✭ or just search Stupid Genius on spotify, apple podcasts, or wherever else you get your podcasts...✭ podcast merch NOW AVAILABLE: https://shopemmachamberlain.com/products/stupid_genius_podcast_hoodie✩ MERCH ✩✭  https://shopemmachamberlain.com✩ MY SOCIAL MEDIA ✩✭ instagram: https://www.instagram.com/emmachamberlain✭ twitter: https://twitter.com/emmachamberlain✭ snapchat: https://www.snapchat.com/emmachambie✭ spotify: http://open.spotify.com/user/emmachambie ✭ tik tok (lol): emmachambieI LUV U,-emma chamberlain"
"302OrfgtTkk","Nigel Farage Reacts to the Brexit Party Unable to Win a Seat | Good Morning Britain","2019-12-13T12:47:17.000Z","UCq18eeL7D9Vd8DhjMcLh9QQ","Good Morning Britain","24","19.14.12","nigel farage|nigel farage brexit|nigel farage brexit party|nigel farage good morning britain|brexit party nigel farage|good morning britain interview|good morning britain|nigel farage piers morgan itv|piers morgan|breakfast show|news|morning news|gmb|itv|susanna reid|Talk Shows - Topic|uk politics|general election|boris johnson|general election 2019 uk|general election results 2019|general election uk","244371","3492","231","0","https://i.ytimg.com/vi/302OrfgtTkk/default.jpg","True","False","Brexit Party leader Nigel Farage talks to GMB with his thoughts on the results of the general election and reacts to his party being unsuccessful to win a seat. Subscribe now for more! http://bit.ly/1NbomQaBroadcast on 13/12/2019Like, follow and subscribe to Good Morning Britain!The Good Morning Britain YouTube channel delivers you the news that you’re waking up to in the morning. From exclusive interviews with some of the biggest names in politics and showbiz to heartwarming human interest stories and unmissable watch again moments. Join Susanna Reid, Piers Morgan, Ben Shephard, Kate Garraway, Charlotte Hawkins and Sean Fletcher every weekday on ITV from 6am.Website: http://bit.ly/1GsZuhaYouTube: http://bit.ly/1Ecy0g1Facebook: http://on.fb.me/1HEDRMbTwitter: http://bit.ly/1xdLqU3http://www.itv.com#GMB #PiersMorgan #SusannaReid"
"1zmBEZnII0Q","Boris Johnson Downing Street FULL SPEECH - 2019 General Election | BBC","2019-12-13T15:43:15.000Z","UCCj956IF62FbT7Gouszaj9w","BBC","24","19.14.12","BBC iPlayer|bbc news|boris johnson|brexit|news|new prime minister|primeminister|boris johnson speech|boris johnson first speech|boris johnson downing street|boris johnson pm|boris johnson uk|boris johnson number 10|boris johnson full speech|boris johnson interview","89498","1806","337","1070","https://i.ytimg.com/vi/1zmBEZnII0Q/default.jpg","False","False","Subscribe and 🔔 to OFFICIAL BBC YouTube 👉 https://bit.ly/2IXqEInStream original BBC programmes FIRST on BBC iPlayer 👉 https://bbc.in/2J18jYJSpeaking, outside the steps of 10 Downing Street, Prime Minister Boris Johnson gave his first public speech having retained office. In the largest Tory majority since 1987, the results of the 2019 General Election saw the Conservatives win 365 seats, Labour 203, the SNP 48, Liberal Democrats 11 and the DUP eight. Sinn Fein have seven MPs, Plaid Cymru four, the SDLP have two; and the Green Party and Alliance Party one each.#BBC #BBCNews #BBCiPlayer #BBCGeneralElectionAll our TV channels and S4C are available to watch live through BBC iPlayer, although some programmes may not be available to stream online due to rights. If you would like to read more on what types of programmes are available to watch live, check the 'Are all programmes that are broadcast available on BBC iPlayer?' FAQ 👉 https://bbc.in/2m8ks6v."
"RaKxMVBwxRc","D Block Europe (Young Adz x Dirtbike LB) - Darling [Music Video] | GRM Daily","2019-12-12T20:01:04.000Z","UCqTwKvjbTENZDGbz2si47ag","GRM Daily","10","19.14.12","Music|GRM|GRM Daily|Video|d block europe|young adz|dirtbike lb|home p*ssy|large amounts|the shard|uk hip hop|grm daily d block europe","449960","24632","313","916","https://i.ytimg.com/vi/RaKxMVBwxRc/default.jpg","False","False","🚨 SUBSCRIBE: http://bit.ly/GRMsubscribe  📲 FOLLOW: @grmdaily📰 VISIT: http://grmdaily.com/"
"aBvfkuSpr2M","Shot on iPhone 11 Pro — Making of ‘Snowbrawl’ with director David Leitch","2019-12-06T19:27:11.000Z","UCfJcxY7o1UjUQE4oObwritw","Apple United Kingdom","28","19.14.12","Apple|Apple United Kingdom","23604","332","107","0","https://i.ytimg.com/vi/aBvfkuSpr2M/default.jpg","True","False","Go behind the scenes with director David Leitch as he turns a snowball fight into an epic action movie. Learn more about iPhone 11 Pro at https://apple.co/2DUnlxyFollow us on Instagram https://apple.co/2Mo2S6bLearn how to shoot on iPhone https://apple.co/38dGLeyAttend a photography or video workshop at an Apple Store https://apple.co/2nufiTkFind the right iPhone for you https://apple.co/2mDlzvN"
"AS4kaxRJYqU","Nicola Sturgeon filmed celebrating Jo Swinson's defeat to SNP's Amy Callaghan","2019-12-13T05:06:20.000Z","UCIRYBXDze5krPDzAEOxFGVA","Guardian News","25","19.14.12","uk|general election|general election 2019|election|uk election|election exit polls|election results|election result|brexit|scottish national party|nicola sturgeon|sturgeon|nicola sturgeon election speech|scotland|nicola sturgeon speech|nicola sturgeon news|nicola sturgeon celebrates|sturgeon dance|2019|lib dems|jo swinson|jo swinson loses|sturgeon celebration|snp|scottish|guardian|politics|nicola sturgeon sky|nicola sturgeon funny|nicola sturgeon meme|news","233977","1328","271","633","https://i.ytimg.com/vi/AS4kaxRJYqU/default.jpg","False","False","The leader of the Scottish National party, Nicola Sturgeon, was caught on Sky celebrating as the Lib Dem leader, Jo Swinson, lost her seat to the SNP. She later said she commiserated with Swinson on a personal level, but was happy with her party's results in the general electionSubscribe to Guardian News on YouTube ► http://bit.ly/guardianwiressubUK general election 2019: Jo Swinson loses seat as Corbyn says he won't lead Labour into next election – live news ► https://www.theguardian.com/politics/live/2019/dec/12/general-election-2019-uk-live-labour-tories-corbyn-boris-johnson-results-exit-pollSupport the Guardian ► https://support.theguardian.com/contributeToday in Focus podcast ► https://www.theguardian.com/news/series/todayinfocusThe Guardian YouTube network:The Guardian ► http://www.youtube.com/theguardianOwen Jones talks ► http://bit.ly/subsowenjonesGuardian Football ► http://is.gd/guardianfootballGuardian Sport ► http://bit.ly/GDNsportGuardian Culture ► http://is.gd/guardianculture"
"p4J8TPqbAc0","Xbox Series X: Are You SERIOUS?","2019-12-13T05:57:19.000Z","UCXGgrKt94gR6lmN4aN3mYTg","Austin Evans","28","19.14.12","xbox series x|series x|microsoft|xbox|game console|microsoft series x|xbox series x gameplay|xbox series x announcement|gaming|ps4|playstation|ps5|xbox one|xbox one x|xbox series s|next xbox|new xbox|next gen xbox|next gen|2020 xbox|xbox 2020|this is|austin evans","1293629","44763","2683","6626","https://i.ytimg.com/vi/p4J8TPqbAc0/default.jpg","False","False","Microsoft just surprised announced the next gen Xbox Series X. 🎮We built our own PS5/Series X: https://www.youtube.com/watch?v=05a26FvwfIsEvery Xbox ever compared: https://www.youtube.com/watch?v=rCFXbCzhHu4Check out our new channel! http://www.youtube.com/thisisSubscribe! http://www.youtube.com/austinevansInstagram: http://instagram.com/austinnotduncanTwitter: http://twitter.com/austinnotduncan"
