video_id,title,publishedAt,channelId,channelTitle,categoryId,trending_date,tags,view_count,likes,dislikes,comment_count,thumbnail_link,comments_disabled,ratings_disabled,description
"9nsKvax_EJ8","Liv Morgan returns to drop a bombshell during Lana’s wedding to Lashley: Raw, Dec. 30, 2019","2019-12-31T05:09:52.000Z","UCJ5v_MCY6GNUBTO8-D3XoAg","WWE","17","19.31.12","wwe|world wrestling entertainment|wrestling|wrestler|wrestle|superstars|कुश्ती|पहलवान|डब्लू डब्लू ई|मैच|सुपरस्टार|व्यावसायिक कुश्ती|مصارعه|wwe 2019|Raw|Lana|Bobby Lashley|Rusev|Liv Morgan|raw highlights|bobby lashley and lana|lana and bobby lashley|raw highlights this week|liv morgan returns|liv morgan new theme|wwe raw|liv morgan return promo|liv morgan and lana|lana and liv morgan|liv morgan lana|liv returns|lana wedding|lashley wedding","1640538","42208","6522","7122","https://i.ytimg.com/vi/9nsKvax_EJ8/default.jpg","False","False","Liv Morgan returns to help Rusev make an absolute mess of Lana and Bobby Lashley’s wedding on the final Monday Night Raw of 2019.#RAW #LanaLashleyWeddingGET YOUR 1st MONTH of WWE NETWORK for FREE: http://wwe.yt/wwenetwork---------------------------------------------------------------------Follow WWE on YouTube for more exciting action!---------------------------------------------------------------------Subscribe to WWE on YouTube: http://wwe.yt/Check out WWE.com for news and updates: http://goo.gl/akf0J4Find the latest Superstar gear at WWEShop: http://shop.wwe.com---------------------------------------------Check out our other channels!---------------------------------------------The Bella Twins: https://www.youtube.com/thebellatwinsUpUpDownDown: https://www.youtube.com/upupdowndownWWEMusic: https://www.youtube.com/wwemusicTotal Divas: https://www.youtube.com/wwetotaldivas------------------------------------WWE on Social Media------------------------------------Twitter: https://twitter.com/wweFacebook: https://www.facebook.com/wweInstagram: https://www.instagram.com/wwe/Reddit: https://www.reddit.com/user/RealWWEGiphy: https://giphy.com/wwe------------------------------------WWE Podcasts------------------------------------After the Bell with Corey Graves: http://bit.ly/afterthebellpodcastThe New Day: Feel the Power: https://link.chtbl.com/7Fp6uOqk"
"kx7P_ENnDPE","JACKBOYS, Pop Smoke, Travis Scott - GATTI (Official Video)","2019-12-30T20:00:06.000Z","UClRx3MMyYUyqOxyEqA5F2nQ","TravisScottVEVO","10","19.31.12","Cactus Jack / Epic|GATTI|Hip Hop|JACKBOYS|Pop Smoke & Travis Scott","1815577","152176","4843","7355","https://i.ytimg.com/vi/kx7P_ENnDPE/default.jpg","False","False","JACKBOYS OUT NOW: https://JACKBOYS.lnk.to/JACKBOYSOFFICIAL STORE: https://JACKBOYS.travisscott.com/Directed by CACTUS JACK & WHITE TRASH TYLERProduced by Sam Lecca & Jay Tauzinhttps://instagram.com/travisscotthttps://instagram.com/sheckweshttps://instagram.com/dontoliverhttps://instagram.com/ogchasebhttps://instagram.com/cactusjackrecordshttps://travisscott.com (C) 2019 Epic Records/Sony. With Cactus Jack."
"ItMpKIxXwlw","Hockey Trick Shots | Dude Perfect","2019-12-30T22:56:38.000Z","UCRijo3ddMTht_IHyNSNXpNQ","Dude Perfect","17","19.31.12","dude perfect|dude perfect stereotypes|dude perfect water bottle flip|bottle flip|water bottle flip|dude perfect bottle flip|dude perfect basketball|dp|dude perfect world record|edition|nerf|trick shots|trick shot|family|ping pong|bowling|clean|family friendly|bubble wrap|soccer|football|spinner|spinners|fidget spinners|dude|hockey|ice|winter|classic|nhl|nbc|dallas|stars|jamie|benn|tyler|seguin|sweet|spot|panda|sports","3755398","227880","2542","12611","https://i.ytimg.com/vi/ItMpKIxXwlw/default.jpg","False","False","Time for round 2 of hockey trick shots with some familiar NHL all-stars! Thanks to NBC Sports for sponsoring this video! Click HERE to watch the NHL Winter Classic on January 1st at 1pm EST: https://dudeperfect.com/nbcsports/► Want an EXTRA Dude Perfect Video every week? Join the DP SQUAD! https://www.youtube.com/user/corycotton/join► Thanks for subscribing! - http://bit.ly/SubDudePerfectMusic by Paper Kings:► Click HERE to listen on YouTube: https://youtu.be/BO_qliP3z4E► Click HERE to Stream/Buy “Fire On Up by Paper Kings: https://fanlink.to/PaperKingsLAMN► Click HERE to visit Position Music's Instagram: https://www.instagram.com/positionmusic/► Click HERE to subscribe to Position Music on YouTube -https://www.youtube.com/positionmusicNEXT LEVEL STUFF -------------------------------------------🎒 NEW Merch - http://bit.ly/DPStore🎮 Play our FREE iPhone game! - http://smarturl.it/DudePerfect2📱 JOIN our VIP TEXT LIST - http://bit.ly/DPTextVIP🔔 Hit the bell next to Subscribe so you don't miss a video!👨🏻‍💻 Watch our newest vids! - http://bit.ly/NewDPVids📕 Read our Book - Go Big - http://amzn.to/OYdZ2sFollow our Instagrams so we can be best friends -------------------------------------------🏆 http://Instagram.com/DudePerfect🧔🏻 http://Instagram.com/TylerNToney👱🏻‍♂️ http://Instagram.com/Cody_Jones_🙋🏻‍♂️ http://Instagram.com/CobyCotton👨‍🦰 http://Instagram.com/GarrettHilbert⛹🏻‍♂️ http://Instagram.com/CoryCotton-------------------------------------------Fire On UpPerformed by Paper KingsCourtesy of Position MusicWritten by Stephen Gomez, John Gomez, Jeffrey Goldford(C) Mixed Metaphor Music (BMI), Position Music Publishing (ASCAP), Young Mountain (BMI), 97 Bulls (BMI), Silver Chevy (ASCAP)-------------------------------------------Bonus points if you're still reading this! Comment: What pro athletes should we film with next?! Click here to learn more about Dude Perfect:http://bit.ly/AboutDudePerfectAs always...Go Big and God Bless!- Your friends at Dude PerfectBusiness or Media, please contact us at: Dude@DudePerfect.com5 Msgs/Month. Reply STOP to cancel, HELP for help. Msg&data rates may apply. Terms: slkt.io/DLd------------5 Best Friends and a Panda.If you like Sports + Comedy, come join the Dude Perfect team!Best known for trick shots, stereotypes, battles, bottle flips, ping pong shots and all-around competitive fun, Dude Perfect prides ourselves in making the absolute best family-friendly entertainment possible! Welcome to the crew! Pound it 👊🏻 Noggin 🙇🏻‍♂️ - Dude Perfect"
"4Dk7eYoj5GI","BEST Premier League Goals of the Decade | 2010 - 2019 | Part 1","2019-12-30T13:01:30.000Z","UCG5qGWdu8nIRZqJ_GgDwQ-w","Premier League","17","19.31.12","Premier league|premier league goals|premier league highlights|epl|epl goals|epl highlights|best premier league goals|best prem goals|premier league goal of the decade|premier league best goal of the decade|goals of the decade|best goals|best ever goals|football|soccer|wayne rooney|Olivier Giroud|Olivier Giroud scorpion kick|wayne rooney bicycle|Papiss Cissé newcastle chelsea|manchester united|manchester city|man united|man city|chelsea|arsenal|liverpool","627879","12230","215","1271","https://i.ytimg.com/vi/4Dk7eYoj5GI/default.jpg","False","False","A compilation of the best goals scored in the Premier League throughout the last decade, 2010 - 2019. This video features Wayne Rooney’s bicycle kick v Manchester City, Papiss Cissé’s wonder strike against Chelsea, Olivier Giroud’s scorpion kick against Crystal Palace and loads more!What’s your favourite goal of the decade? Let us know in the comments.Subscribe to the official Premier League YouTube channel: http://preml.ge/PremierLeagueYouTube Premier League website: http://preml.ge/PremierLeagueWebsiteFollow the Premier League on Instagram: http://preml.ge/PremierLeagueInstagramFollow the Premier League on Twitter: http://preml.ge/PremierLeagueTwitterLike the Premier League on Facebook: http://preml.ge/PremierLeagueFacebookPlay Fantasy Premier League: http://preml.ge/FantasyPremierLeagueTo license Premier League match footage: https://imgreplay.com/contact"
"xOlbfZgFeio","This FOOD Time Lapse Video Will SHOCK YOU","2019-12-30T20:30:02.000Z","UCzeB_0FNcPIyUSjL_TL5lEw","AzzyLand","24","19.31.12","azzyland|azzy|reaction|reacting|funny|food|time lapse|Timelapse","702619","70086","2335","4758","https://i.ytimg.com/vi/xOlbfZgFeio/default.jpg","False","False","This FOOD Time Lapse Timelapse  Video Will SHOCK YOUSUBSCRIBE and become part of the AzzyLand family :D Hello Citizens of Azzyland.... I'm Azzy and welcome to another amazing reaction video! Today we are reacting to life hacks that will literally change your life. SOCIAL MEDIA•Instagram: https://www.instagram.com/azzyland/?hl=en•Twitter: https://twitter.com/AzzyLand•Facebook: https://www.facebook.com/azzyland/•Twitch: https://www.twitch.tv/azzylandOUTRO SONG: https://www.youtube.com/watch?v=xVzeZGRZk0s"
"pUL0ja--0Vk","Jake Paul Sparring Footage (LEAKED)","2019-12-30T20:06:25.000Z","UCcgVECVN4OKV6DH1jLkqmcA","Jake Paul","22","19.31.12","jake paul|mini jake paul|jake paul pranks|logan paul|jake paul scary vids|team 10|morgz|lucas and marcus|jake paul song|its everyday bro|scary clowns","474354","25326","5640","3752","https://i.ytimg.com/vi/pUL0ja--0Vk/default.jpg","False","False","I can't believe I'm showing you this... SUBSCRIBE TO DAZN NOW: http://bit.ly/DAZNJakeStream my new single 'These Days' NOW: https://jakepaul.ffm.to/thesedaysGet some FIRE new merch: https://fanjoy.co/collections/jake-paul and get your FREE Team10 CHAIN: http://gotdrip.com/TEXT ME, I'M BOREEEED - 310-870-3349🔴SUBSCRIBE ➤ http://bit.ly/SUB2JAKEPAUL ↪ watch sum mo stuff➤  https://www.youtube.com/watch?v=GLHYcXLOlWMINSTAGRAM ➤  https://www.instagram.com/JakePaul TWITTER ➤  http://twitter.com/JakePaul ⚠ WARNING ⚠Please be warned (and we cannot possibly stress this enough); under no circumstances should any challenges, stunts, or pranks be attempted by any of our viewers. All challenges, stunts, and pranks are performed by trained professionals in a controlled environment and are for entertainment purposes only. Again, do not try anything you see in this content at home and always consult a parent or adult with any questions or concerns.Jake Paul SongJake Paul PranksJake Paul Scary VidsMini Jake PaulJake Paul Ouija Boardthis is the truthtruth about alissa violet#JakePaul #Team10 #ItsEverydayBro"
"Yepxu1lfzzI","Sober Convos","2019-12-31T06:07:36.000Z","UCn1XB-jvmd9fXMzhiA6IR0w","Domics","23","19.31.12","domics|animation","544119","68014","430","4331","https://i.ytimg.com/vi/Yepxu1lfzzI/default.jpg","False","False","Start listening with a 30-day Audible trial. Choose 1 audiobook and 2 Audible Originals absolutely free.  Visit http://www.audible.com/domics  or text domics to 500 500.   Kressh: https://www.instagram.com/_kressh/Jomm: https://twitter.com/FlashJomm | https://www.instagram.com/jommish/ Additional Animators: Aaron Estrada: https://www.instagram.com/g4nimatorCiel: https://twitter.com/KaachielEhlboy: https://www.youtube.com/ehlboyJommSimonBeed: https://twitter.com/SimonBeed Christopher Carlone YT: https://www.youtube.com/carlonec Website: http://www.christophercarlone.com/ Check out GG! Gaming Cafe https://www.gggaming.ca/ ~Follow me!~ TWITTER: https://twitter.com/OmNomDomz FACEBOOK: http://www.facebook.com/domics.me INSTAGRAM: https://www.instagram.com/omnomdomz/"
"HzXpu9BRBXk","Celtic 1-2 Rangers | Katić Header Gives ’Gers Win in Old Firm Classic | Ladbrokes Premiership","2019-12-30T00:00:00.000Z","UCakRszbIjjGYtFrDPeg5Ieg","SPFL","17","19.31.12","SPFL|SPFL Highlights|Scottish football highlights|scottish football goals|ladbrokes premiership|ladbrokes premiership highlights|celtic rangers highlights|rangers vs celtic|rangers vs celtic highlights|old firm|old firm derby|celtic vs rangers highlights|steven gerrard rangers|nikola katic|nikola katic celtic|alfredo morelos vs celtic|alfredo morelos red card vs celtic|sp:ty=high|sp:dt=2019-12-29T12:30:00Z|sp:st=soccer|sp:li=scot|sp:ti:home=CFC|sp:ti:away=RFC","782557","10607","722","1773","https://i.ytimg.com/vi/HzXpu9BRBXk/default.jpg","False","False","A second-half Nikola Katić header gave Steven Gerrard’s Rangers a first win at Celtic Park in 9 years to go just two points behind their Old Firm rivals.Subscribe to the SPFL YouTube here!: http://goo.gl/jq3jXNLike us on Facebook: http://www.facebook.com/spflofficialFollow us on Twitter: https://twitter.com/spfl & https://twitter.com/spflnewsLADBROKES PREMIERSHIP CONTENT AVAILABILITY INFORMATION - GOALS FROM SATURDAY'S MATCHES WILL BE AVAILABLE IN THE UK & IRELAND FROM 6PM ON SUNDAY. GOALS FROM ALL OTHER MATCHDAYS WILL BE AVAILABLE TO VIEW WORLDWIDE FROM MIDNIGHT AFTER THE MATCH.The SPFL is the leading sporting competition in Scotland, covering the top 42 football teams in the country. Subscribe to the official SPFL YouTube channel to make sure you catch all the best bits from Scottish league football. Scottish football is famous for passionate and exciting matches featuring top teams like Celtic, Rangers, Aberdeen, Hearts, Hibs and Dundee United.The top league is called the Ladbrokes Premiership. Below the top level, there are a further three leagues -- the Ladbrokes Championship, Ladbrokes League 1 and Ladbrokes League 2."
"R6-IEQhjLKw","Semi-Final Highlights | 2019/20 World Darts Championship","2019-12-30T23:05:50.000Z","UCRvCwDp_1DwOlOpnlJf9iYw","Professional Darts Corporation","17","19.31.12","darts|PDC|Official PDC|Professional Darts Corporation|Professional Darts Company|Exclusive Darts|2019 darts|darts 2019|wright|Suljovic|price|mvg|Van Gerwen|Michael Van Gerwen|nine darter|ally pally|world champs|world championships|world championship|William Hill|best darts|best checkouts|great darts|bullseye|170|highlights|session highlights|darts highlights|Fallon|Fallon Sherrock|Sherrock|Sherrock suljovic","254653","1914","67","566","https://i.ytimg.com/vi/R6-IEQhjLKw/default.jpg","False","False","Catch up with all the action from the Semi-Finals of the 2019/20 William Hill World Darts Championship"
"5ybWEA2VvdI","Kris Makes Khloé Kardashian See An OCD Specialist | Season 17 | Keeping Up With The Kardashians","2019-12-31T09:00:00.000Z","UCn3jIZe_5xsAgo5FlvyYCXw","hayu","24","19.31.12","hayu|keeping up with the kardashians|real housewives|reality tv|kim kardashian|khloe kardashian|kourtney kardashian|bethenny frankel|lisa vanderpump|nene leakes|andy cohen|yolanda hadid|botched|southern charm|kendall jenner|kylie jenner|bruce jenner|kris jenner|caitlyn jenner|scott disick|kanye west|e! news|true thompson|new season|kuwtk s17|khloe kardashian ocd|khloe kardashian organization full video|khloe kardashian organization cookies","240973","5417","135","422","https://i.ytimg.com/vi/5ybWEA2VvdI/default.jpg","False","False","Watch All Your Favourite Reality Shows Here: https://www.hayu.com/Subscribe to the Official Hayu Channel https://www.youtube.com/c/hayuHayu is the place to watch your favourite reality shows whenever and wherever you want. With loads of shows the same day as the U.S. and thousands of episodes of binge-worthy Box Sets from the start, hayu is the undoubted home of reality TV. And if all that wasn't enough, we've got exclusive clips and snippets you can share and your fave stars' social media all in one place.With hayu, you can literally have it all.#KhloéKardashian #KrisJenner #KUWTKS17"
"YEI_2Q-CeEE","Peter Wright on beating Gerwyn Price: He wanted to have a joke downstairs but not on stage","2019-12-30T21:58:01.000Z","UCgsVwqcgH87320YoYG0EsCw","Live Darts TV","17","19.31.12","Peter Wright v Gerwyn Price|Peter Wright incident|Gerwyn Price incident|PDC Darts|William Hill World Championship|World Darts Championship 2020","104691","532","19","350","https://i.ytimg.com/vi/YEI_2Q-CeEE/default.jpg","False","False","Seventh seed Peter Wright has his say on a 6-3 victory over Grand Slam champion Gerwyn Price in a fiery encounter to progress to his second World Championship final. #Darts --------------------------------------------------------------------------------------------------------------------------Follow @livedarts on social media:Facebook -  https://www.facebook.com/LiveDartsTV/Twitter - https://twitter.com/livedartsInstagram - https://www.instagram.com/livedartsOnline - https://www.live-darts.com/Follow @WilliamHill on social media:Facebook - https://www.facebook.com/WilliamHillSports/Twitter - https://twitter.com/WilliamHillInstagram - https://www.instagram.com/williamhill/"
"7sJTieB9Gyo","Talking Kitty Cat 69 - Sylvester Goes To Court","2019-12-31T02:14:24.000Z","UCYFo16eFDNhD3W_POj9gKFw","Talking Kitty Cat","15","19.31.12","talking kitty|sylvester|gibson|gibbyson|random kitty|stevecash83|talking cat|flaggle claggle|flaggle|claggle","352703","44342","394","10290","https://i.ytimg.com/vi/7sJTieB9Gyo/default.jpg","False","False","When Steve makes up for Sylvester's missed birthday with a giant present, Sylvester finds himself stuck in his own gift, wishing it had been catnip. GG (Gibson's Granddaughter) gets her butt stuck and Steve finds himself in trouble with the law. Flaggle Claggle. All music except for The Headlines created by Steve Cash.Music Credit: OurMusicBox (Jay Man)Track Name: The HeadlinesMusic By: Jay Man @ https://ourmusicbox.com/Official OurMusicBox YouTube Channel: http://www.youtube.com/c/ourmusicboxLicense for commercial use: Creative Commons Attribution 4.0 International (CC BY 4.0) https://creativecommons.org/licenses/...Music promoted by NCM https://goo.gl/fh3rEJ"
"2B-dsQLS1yk","Going Ice Fishin' - Fortnite Shorts","2019-12-30T13:00:01.000Z","UClG8odDC8TS6Zpqk9CGVQiQ","Fortnite","20","19.31.12","Fortnite|Epic Games|PC|PS4|Xbox One|Battle Royale|Unreal Tournament|Unreal Engine|Fortnite Battle Royale|Fortnite Creative","1770051","96729","4871","5887","https://i.ytimg.com/vi/2B-dsQLS1yk/default.jpg","False","False","It's getting cold outside and two pals are going out to do some ice fishing. Who knows what they might catch?Read more about Winterfest here: https://www.epicgames.com/fortnite/news/winterfest-2019-beginsPlay Fortnite Battle Royale, the completely free 100-player PvP mode. One giant map, A Battle Bus, Last one standing wins. ESRB Rating: Teen with Violence.Instagram: https://www.instagram.com/fortnite/Twitter: https://twitter.com/FortniteGameFacebook: https://www.facebook.com/FortniteGame/Learn More: https://www.epicgames.com/fortnite/en-US/"
"D3jxx8Yyw1c","Why 2020 Started On December 30th","2019-12-30T16:00:02.000Z","UCBa659QWEk1AI4Tg--mrJ2A","Tom Scott","27","19.31.12","tom scott|tomscott|iso weeks|dates|computer minutaie|date format|twitter|bug","960029","57678","912","3240","https://i.ytimg.com/vi/D3jxx8Yyw1c/default.jpg","False","False","Weird calendar edge-cases and computer bugs. It's an old-school video. • Video sponsor Fasthosts are giving UK viewers the chance to win a trip to SXSW 2020 by answering my Techie Test question: https://fasthosts.co.uk/tomscottFURTHER READING:The ISO 8601 Standards for date and time: https://www.iso.org/iso-8601-date-and-time-format.htmlThe tweet referenced in the video: https://twitter.com/_ninji/status/549365454322802688The Guardian article mentioned: https://www.theguardian.com/technology/2014/dec/29/twitter-2015-date-bugI'm at https://tomscott.comon Twitter at https://twitter.com/tomscotton Facebook at https://facebook.com/tomscottand on Instagram as tomscottgo"
"dIWfpkstlTo","You Blink You Lose","2019-12-30T20:00:02.000Z","UCIcgBZ9hEJxHv6r_jDYOMqg","Unus Annus","23","19.31.12","unus annus|markiplier|crankgameplays|memento mori|staring contest|most intense staring contest|world record stare|world record staring contest|staring contest hallucinations|funny staring contest|unus annus staring contest","764858","75335","308","5895","https://i.ytimg.com/vi/dIWfpkstlTo/default.jpg","False","False","The eyes are the window into the soul. You better not look away... you might miss something.PEEN ►https://youtu.be/553CfZAADagᴍᴇʀᴄʜ ➤ http://www.unusannus.comᴜɴᴜs ➣ http://www.youtube.com/crankgameplaysᴀɴɴᴜs ➢ http://www.youtube.com/markiplierᴛᴡɪᴛᴛᴇʀ ► http://www.twitter.com/unusannusɪɴsᴛᴀɢʀᴀᴍ ► http://www.instagram.com/unusannusʀᴇᴅᴅɪᴛ ► http://www.reddit.com/r/unusannusᴛᴜᴍʙʟʀ ► http://www.unusannus.tumblr.comEdited by  ► http://www.youtube.com/crankgameplaysThis channel, along with every video that has or will ever be uploaded on this channel, will be deleted after our year has ended. This is inevitable. Inescapable. Irreversible.Do not archive or re-upload anything. This is our last wish. Our parting gift. Stay true to the purpose of our final year or we shall lay down wrath upon those that attempt to escape the end.Memento Mori.Unus Annus."
"7OJjLNO1IBw","Why is this pickup SOOO popular?","2019-12-31T11:02:01.000Z","UCUhFaUpnq31m6TNX2VKVSVA","carwow","2","19.31.12","carwow|mat watson|4k review|car review|car review 2019|car review 2020|chevvy|chevrolet|chevrolet silverado|pickup truck|new pickup truck|pickup truck review|chevrolet silverado 2020 review|new chevrolet silverado review|american pickup truck|american pickup truck review|best pickup truck|best american pickup truck 2020|best pickup truck 2020|new pickup","167960","7546","162","848","https://i.ytimg.com/vi/7OJjLNO1IBw/default.jpg","False","False","This is the Chevrolet Silverado! It's an absolute behemoth on the roads, and Mat's got his hands on this popular American pickup to find out just why it's so popular over in the states! The top-of-the-range model comes with a 6.2-litre V8 which can achieve 460hp and hit 0-60 in just 6 seconds! But does this gigantic pickup do enough to set it apart from the rest of the competition? And more importantly, is it THE must-have American pickup of 2020? Join Mat to find out!Subscribe to our Local Channels! carwow Arabic - https://www.youtube.com/channel/UCqLF...carwow Indonesia - https://www.youtube.com/carwowIndonesiacarwow Japanese - http://www.youtube.com/carwow日本語 carwow Korean - https://www.youtube.com/channel/UCzm5...carwow Portuguese - https://www.youtube.com/channel/UC0vI...carwow Russian - https://www.youtube.com/channel/UCh3g...carwow Spanish - http://www.youtube.com/c/carwowEspañolSubscribe to Mat’s Channel – https://www.youtube.com/user/MatWatso...Instagram – http://www.instagram.com/carwowcarsFacebook – http://www.facebook.com/carwowukTwitter – http://www.twitter.com/carwowukAwkward haggling is a thing of the past with carwow. Choose your perfect car with our configurator tool and let the country’s best dealers compete over you. Compare the five best offers by price, location and dealer ratings and choose the one that’s right for you – no hassle, no haggling, just a great deal. Visit our site to save money on your new car – http://bit.ly/carwow-UK Oder auch in Deutschland Geld beim Autokauf sparen – http://bit.ly/carwow-DEVisita nuestra página web para saber cuánto te puedes ahorrar en tu nuevo coche – http://bit.ly/carwow-E"
"-2pffpPl1lQ","2020 Tech I'm Ready For!","2019-12-31T01:54:57.000Z","UCBJycsmduvYEL83R_U4JriQ","Marques Brownlee","28","19.31.12","2020 tech|future tech|MKBHD|Galaxy S11|iPhone 12|iPhone 11s|iPhone 12 Pro|Galaxy Fold 2","1136309","63659","1258","3919","https://i.ytimg.com/vi/-2pffpPl1lQ/default.jpg","False","False","Foldables, iPhone 12 Pro, Tesla Roadster and more. So ready for a new decade of tech!Waveform Podcast: http://bit.ly/WaveformMKBHDWVFRM Twitter: https://twitter.com/WVFRMNY Empire Highlights: https://youtu.be/xGWPGodrSIkPixel 4A concept video https://youtu.be/uvndipJ46KMGalaxy S11 render video: https://youtu.be/8yDPrtjADpQPlaid Model S testing: https://youtu.be/K_i0m2FYA2ADave2D video: https://youtu.be/A7hgf-RfHycRED Komodo testing: https://www.instagram.com/instajarred/MKBHD Merch: http://shop.MKBHD.comVideo Gear I use: http://kit.co/MKBHD/video-gear#recom...Tech I'm using right now: https://www.amazon.com/shop/MKBHDIntro Track: Ongoing Thing by 20sylPlaylist of MKBHD Intro music: https://goo.gl/B3AWV5~http://twitter.com/MKBHDhttp://instagram.com/MKBHDhttp://facebook.com/MKBHD"
