video_id,title,publishedAt,channelId,channelTitle,categoryId,trending_date,tags,view_count,likes,dislikes,comment_count,thumbnail_link,comments_disabled,ratings_disabled,description
"kGq8F3Uu66M","£200 PRESENT SWAP w/LITTLE SISTER & GIRLFRIEND!! (OPENING CHRISTMAS PRESENTS EARLY)","2019-12-22T18:00:05.000Z","UCahx478FV8W0qz4LGTrs1CA","Brandonio","24","19.31.12","brandonio|brandonio sister|user friendly|brandonio challenge|brandonio girlfriend|£200 PRESENT SWAP w/LITTLE SISTER & GIRLFRIEND!! (OPENING CHRISTMAS PRESENTS EARLY)|present swap|opening christmas presents|opening christmas presents early|christmas present swap|christmas present opening|present swap with sister and girlfriend|£200 present swap|present swap brandonio|christmas 2019|opening presents early 2019|christmas presents|opening presents|present exchange","272825","16396","213","1021","https://i.ytimg.com/vi/kGq8F3Uu66M/default.jpg","False","False","£200 PRESENT SWAP w/LITTLE SISTER & GIRLFRIEND!! (OPENING CHRISTMAS PRESENTS EARLY)LEAVE A LIKE FOR ME & COMMENT DOWN BELOW ONCE DONE FOR A HEART BACKNEW VIDEO EVERY SUNDAY 6PM (UK TIME)Make sure you SUBSCRIBE with NOTIFICATIONS on so you can be on time to EVERY video🔔By subscribing you'll be helping towards my dream of hitting over 1 Million Subscribers so don't let it pass!KT&A: https://www.kenttrainingandapprenticeships.co.uk/learners/Contact: 0800 731 4297Email: KT&A@kent.gov.ukThanks to KT&A for sponsoring their part of the video.2018 Present Swap: https://www.youtube.com/watch?v=tePA417aW6U&t=869s2017 Present Swap: https://www.youtube.com/watch?v=-2aklHcxOXM&t=10s••••••••••••••••••••••••••••••••••••••••••••••••••••••••••••••••••••••••••••••••••••••NEW MERCH HERE (LIMITED SO BE QUICK)http://www.brandoniostore.com/••••••••••••••••••••••••••••••••••••••••••••••••••••••••••••••••••••••••••••••••••••••FOLLOW ME FOR GOOD LUCK😉(I follow back a lot if I see you active)• Instagram: Brandonio_ https://www.instagram.com/brandonio_/• Snapchat: BrandonioSnaps• Twitter: https://twitter.com/BrandonioTweets• TikTok: Brxndonio• Sisters Instagram: Holly_Bxnnxtt https://www.instagram.com/holly_bxnnxtt/• Girlfriends Instagram: erinbowyer_ https://www.instagram.com/erinbowyer_/••••••••••••••••••••••••••••••••••••••••••••••••••••••••••••••••••••••••••••••••••••••Business Enquiries:brandohvlogs@gmail.com•••••••••••••••••••••••••••••••••••••••••••••••••••••••••••••••••••••••••••••••••••••••MORE VIDEOS: https://www.youtube.com/watch?v=lSd6alhwKQU&list=PL8Y4bbcq6EiJL45wwn9TlM9jnUMdLD9lHThank you SO much for your support, every single one of you genuinely mean so much to me, I'll always appreciate what you do to support me & I'll always show my support back. YOU never go unnoticed trust me, what we have is so different & this is for life xuser friendly , family friendly , brandonio#presentswap #christmaspresentswap #xmasSTAY TRUE TO YOURSELF🙏🏻"
"v3y8AIEX_dU","How to Move the Sun: Stellar Engines","2019-12-22T13:30:06.000Z","UCsXVk37bltHxD1rDPwtNM8Q","Kurzgesagt – In a Nutshell","27","19.31.12","Stellar Engine|Stellar Engines|Shkadov Truster|Solarsystem|Universe|Supernova|Star|Red Dwarf|Dyson Sphere|Planet|Planets|Gravity|Sun|Rocket|Photon|Radiation|Aluminum foil|Parabola|Sun Orbit|Pole|light year|space|space travel|Hydrogen|Helium|fuel|rocket|Fusion|Fusion Energy|Caplan Thruster|Galaxy","3538701","270168","2420","17401","https://i.ytimg.com/vi/v3y8AIEX_dU/default.jpg","False","False","Sources and further reading:https://sites.google.com/view/sources-stellar-enginesGet your Stellar Engine Infographic Poster here:https://shop.kurzgesagt.orgNothing in the Universe is static. In the milky way, billions of stars orbit the galactic center.Some, like our sun, are pretty consistent, keeping a distance of around 30,000 light years from the galactic center, completing an orbit every 230 million years.This dance is not an orderly ballet -  more like a skating rink filled with drunk toddlers. This chaos makes the galaxy dangerous. Our solar neighbourhood is constantly changing, with stars moving hundreds of kilometers every second.Only the vast distances between objects protect us from the dangers out there. But we might get unlucky in the future. At some point we could encounter a star going supernova. Or a massive object passing by and showering earth with asteroids.If something like this were to happen we would likely know thousands, if not millions of years in advance. But we still couldn’t do much about it.Unless… we move our whole solar system out of the way.Support us on Patreon so we can make more videos (and get cool stuff in return): https://www.patreon.com/Kurzgesagt?ty=hSteady: https://steadyhq.com/de/kurzgesagtMerchandise:  https://shop.kurzgesagt.org Newsletter: http://eepurl.com/cRUQxzFacebook: http://bit.ly/1NB6U5OTwitter: http://bit.ly/2DDeT83Instagram: http://bit.ly/2DEN7r3Discord: https://discord.gg/cB7ycdvThe Voice of Kurzgesagt: Steve Taylor: http://voice-pool.com/en/english/The music of the video here: Soundcloud: https://bit.ly/34L3USGBandcamp: https://bit.ly/38YgiC5Youtube: https://bit.ly/2CZ6PeNFacebook: http://bit.ly/2qW6bY4 THANKS A LOT TO OUR LOVELY PATRONS FOR SUPPORTING US:Patrick Hall, Evan Wenden, riz, Nick Rose, Kevin, Patrick Huizinga, Mike Chang, Deddy Jobson, David Nir, Danny Mill, Kai Hebeler, Gabriel Averett, Pierre Xavier, Rohan Kapoor, Bray Demonbreun, Olivier L, Jared Capelle, Mike, Pierre Krenn, Kristofer Kirss, The Captain, Имяя Фамилияя, Marie Samira, Hekmon, Dsurian, Martina, William Wold, Carston Cook, Daniel Bruce, Milan Juza, michal pol, Dmitry Sadakov, Brian Tieskoetter, kagami suigin, Rosamelia, Amir Johnson, Spencer Byars, Jarrod Parsons, Tayler Martin, bmwniquester, Saito Nakamura, Arnulf Kraan, Emilia Liu, Roosevelt Perry, Frank Blood, Máté Szabó, Kasper Kylmälä, Zach Riddle, Damian Campbell, XeleX55, Johann Pardanaud, Cemil Urganci, 3theNet"
"P3TFjAYeSsw","CAT-O-MATIC auto cat feeder/terrifier YTMakers Secret Santa","2019-12-22T16:00:03.000Z","UCp68_FLety0O-n9QU6phsgw","colinfurze","24","19.31.12","Colin|furze|secret Santa|cat o Matic|cats|Wallace and grommit|machine|cat feeder|funny|making of|building|engineering|maker|kids invent stuff","822817","35975","1609","1819","https://i.ytimg.com/vi/P3TFjAYeSsw/default.jpg","False","False","Fear not your cat feeding issues are sorted...........FurzestyleNo cat was harmed in making of this but it did run off..........but came back and is fine.Thanks to the Kids Invent Stuff channel for organising this Secret Santa check them out here https://www.youtube.com/channel/UC-glo52BMvZH9PPUamjGIcwAnd the other channels involved Estefannie Explains https://www.youtube.com/user/estefannieggSufficiently Advanced https://www.youtube.com/channel/UCVS89U86PwqzNkK2qYNbk5ALook Mum No Computer https://www.youtube.com/channel/UCafxR2HWJRmMfSdyZXvZMTwThe Hacksmiths https://www.youtube.com/user/MstrJamesCheck out the new FURZE Merch store. https://www.colinfurzeshop.comFollow me on Social Media for behind the scenes and extras.Instagram https://www.instagram.com/realcolinfurze/Twitter https://twitter.com/colin_furzeFacebook https://www.facebook.com/Colin-furze-521680751253584MusicTrack 1 and 2 are by The Paletines and are called Burn't out by Xmas and Demons Whisperingbandcamp: thepalatines.bandcamp.comInstagram: @thepalatinestxFacebook: facebook.com/thepalatinestx/Spotify: https://open.spotify.com/artist/4rwbOddotCs4QrXFcnYjO7Track 3 is called What seems true to you by High school football heroeshttps://highschoolfootballheroes.bandcamp.com/ In a band? Want your music on my videos! Send your tracks to furzemail@yahoo.co.uk as all music on this channel is from viewers#ytmakerssecretsanta #colinfurze #catomatic"
"ln1-J-00HA8","Rise of Skywalker PALPATINE RETURN Explained!","2019-12-22T22:00:06.000Z","UC7yRILFFJ2QZCykymr8LPwA","New Rockstars","24","19.31.12","rise of skywalker|star wars the rise of skywalker|palpatine|palpatine return|palpatine explained|palpatine plan explained|how did palpatine come back|emperor explained|rise of skywalker palpatine|rise of skywalker scene|rise of skywalker opening scene|rise of skywalker rey palpatine|star wars episode 9|rise of skywalker movie|rise of skywalker palpatine death|new rockstars","595378","15581","800","1713","https://i.ytimg.com/vi/ln1-J-00HA8/default.jpg","False","False","Star Wars Episode 9 The Rise of Skywalker features a return of EMPEROR PALPATINE! How is this possible, and what is his master plan?Spoilers ahead!Darth Sidious aka Emperor Palpatine is the true villain of the Star Wars series, and he returns with a vengeance in The Rise of Skywalker. But what processes did he use to resurrect himself? Erik Voss analyzes the deeper plot of Palpatine in Episode 9, how he combined the secrets of Darth Plagueis and dark cloning technology, and his shocking connection to Rey. And why does Palpatine's plan ultimately fail?CONNECT WITH US!Facebook: http://facebook.com/newmediarockstarsTwitter: http://twitter.com/newrockstarsPatreon: http://patreon.com/newrockstarsPATREON PRODUCERS:Dallas AndersonJake StormKelly HopperMatthew SalvasMiguel MendozaPony StarkSamuel MorseTodd SlawsbyUnder_CiegeProducer: Erik Voss http://www.twitter.com/eavossProducer: Zach HuddlestonWritten by: Erik VossExecutive Creative Director: Filup Molina http://www.twitter.com/filupmolinaPost Production Supervisor: John CostaEditors: Joshua Hurd"
"aqKuy31zV48","SPENCER LOSES IT!! 😡- HASHTAG SUNDAY LEAGUE S3 E3","2019-12-22T11:30:08.000Z","UCeJ73ymlLhLctITwdi9iCVw","Hashtag United","17","19.31.12","hashtag united|hashtag fc|Spencer fc|Spencer Owen|football|soccer|non league football|non league|Sunday league|Sunday league football|Hashtag highlights|football highlights|soccer highlights|non-league highlights","246878","5490","108","326","https://i.ytimg.com/vi/aqKuy31zV48/default.jpg","False","False","Highlights of Hashtag's Sunday League...what made Spencer so angry? Comment down below your favourite moment in the video!► SUBSCRIBE...AND HELP US GET TO 500K!: http://bit.ly/hashtagutd► OUR WEBSITE!: http://www.footballfancast.com/hashtag-united► SUB TO OUR ESPORTS CHANNEL: http://bit.ly/ESPORTSSUB► MERCH! https://spencerfc.bigcartel.com/ ► Follow us on Twitter! - http://twitter.com/HashtagUtd► Follow us on Instagram! - http://instagram.com/HashtagUtd► Like us on Facebook! - http://facebook.com/HashtagUnitedFC★ HASHTAG UNITED TWITTER ★Manager:Devs -  https://twitter.com/Devs76Player/Asst Manager:Neil Richmond - https://twitter.com/NeilRicho10First Team:Ryan Adams - https://twitter.com/HashtagRAdamsMatt Carter - https://twitter.com/MJCarter04Ricky Evans - https://twitter.com/RickyEvans14Harry Honesty - https://twitter.com/HarryHonestyLee Hursit -  https://twitter.com/LeeHursit97Jacko - https://twitter.com/HashtagJackoAlbie Keith - http://twitter.com/albert_keith10Charlie Morley - https://twitter.com/charliemorley_Marcus Stamp - https://twitter.com/bigmarcs_  Farai Tsingano - https://twitter.com/Farry321Tom Williams - https://twitter.com/MrTomWilliamsCain Brougham - https://twitter.com/CainBrogsGeorge Smith - https://twitter.com/GeorgeSmith10_Izu - https://twitter.com/IzutheMulattoJack Martin - https://twitter.com/JackMartin95Jamie Hursit - https://twitter.com/JhursitofficialJesse Waller-Lassen - https://twitter.com/The_JWLJosh Osude - https://twitter.com/JoshOsudeLuke Wilson - https://twitter.com/Luke_Wilson89Sam Byles - https://twitter.com/SamBylesRoss Gleed - https://twitter.com/RossGleedSamraj Gill - https://twitter.com/SamrajGill16Simon Peddie - https://twitter.com/Peds_4Tashan Richmond - https://twitter.com/TashRich10_Tim Pitman - https://twitter.com/TimPitman93Louis Hawes - https://twitter.com/HawesLouisesports FIFA Team:Hashtag Harry: https://twitter.com/hashtagharry__Hashtag Shawrey: https://twitter.com/HashtagShawreyHashtag Tom: https://twitter.com/HashtagTom_Sunday League Team: Spencer - https://twitter.com/SpencerOwenRyan Coughlan -  https://twitter.com/RyanCoughlannCharlie Occleshaw -  https://twitter.com/Charlie_OccGeorge Vallentyne -  https://twitter.com/GVallentyneeBen Glander - https://twitter.com/ben_glanderMatt Creasey - https://twitter.com/mattcreasey31Michael Dill - https://twitter.com/mdill1Dave Hopwood - https://twitter.com/dave_hoppersZac Clarke - https://twitter.com/_ZacClarke_Marius Hjerpeth - https://twitter.com/HjerpethDaniel Adjei - https://twitter.com/danielb_93Theo Baker - https://twitter.com/theobaker_Aaron Couch - https://twitter.com/AaronCouch11Fehinti Falola - https://twitter.com/Falola10George Irving - https://twitter.com/GeorgeIrvinggLuis Berkane - https://twitter.com/LuisBerkane124Sean Alexander - https://twitter.com/SeanAlexanderr8Backroom:Physio:Stevie CB - https://twitter.com/carmichaelbrownKitman:https://twitter.com/IG_RuminMedia/Operations:Lewis Preston - https://twitter.com/LewisPrestonAlex Osipczak- https://twitter.com/alexosipczakNeil Smythe - https://twitter.com/neilsmytheYani Ourabah - https://twitter.com/YaniOurabahSeb - https://twitter.com/sebcbrown4Wes Tanser - https://twitter.com/westanserMusic from Epidemic Sound."
"5rI-Pv1Xp1E","Juventus vs Lazio (1-3) | Italian Supercup Highlights","2019-12-22T20:28:13.000Z","UC4i_9WvfPRTuRWEaWyfKuFw","BT Sport","17","19.31.12","Lazio|Juventus|Juventus vs Lazio|Lazio vs Juventus|Italian Supercup|Supercoppa Italiana|Serie A|highlights|all goals|Cristiano Ronaldo|Paulo Dybala|Senad Lulic|Danilo Cataldi|Luis Alberto|Calcio|Football|BT Sport","330421","4642","113","857","https://i.ytimg.com/vi/5rI-Pv1Xp1E/default.jpg","False","False","Lazio defeated Juventus in the 2019 Supercoppa Italiana in Saudi Arabia thanks to goals from Luis Alberto, Senad Lulic, and Danilo Cataldi.Subscribe to our YouTube channel for the best videos from BT Sport  ➡️ http://bit.ly/17YTeL5Subscribe to our Boxing YouTube channel ➡️ http://po.st/NoFilterYTTwitter: http://twitter.com/btsportFacebook: http://www.facebook.com/btsportInstagram:http://instagram.com/btsportWebsite: http://sport.bt.com"
"z54ghkkmmqg","Disney OFFICIALLY Confirms Next Star Wars Movie","2019-12-23T00:08:28.000Z","UCdIt7cmllmxBK1-rQdu87Gg","The Stupendous Wave","24","19.31.12","Star Wars|Star Wars Theory|Star Wars Explained|Old Republic Star Wars|Lightsaber|The RIse of Skywalker","582707","16067","3418","2988","https://i.ytimg.com/vi/z54ghkkmmqg/default.jpg","False","False","STAR WARS MERCH: https://m.beautifulhalo.com/?main_page=promotion&id=208&track=tb16492&utm_souce=YoutubeBusiness: tmarvelouswave@gmail.comTwitter: @StupendousWaveI believe all content used falls under the remits of Fair Use, but if any content owners would like to dispute this I will not hesitate to immediately remove said content. It is not my intent to in any way infringe on their content ownership. If you happen to find your art or images in the video please let me know and I will be glad to credit you."
"FjdktjP7LmA","Ariana Grande - raindrops (an angel cried) (swt live)","2019-12-23T07:01:18.000Z","UC9CoOnJkIBMdeijd9qYoT_g","Ariana Grande","10","19.31.12","ariana grande|raindrops|an angel cried|k bye for now|swt live|sweetener tour","299670","34101","220","1480","https://i.ytimg.com/vi/FjdktjP7LmA/default.jpg","False","False","https://arianagrande.lnk.to/swtlive"
"n-siktLSCFI","Saying Goodbye To Our Pink House Forever 😢","2019-12-21T18:00:16.000Z","UCkvK_5omS-42Ovgah8KRKtg","jeffreestar","26","19.31.12","jeffree star|jeffree star moving|jeffree star selling my house|we're moving houses!|jeffree star cosmetics|shane saison|ryland adams|morgan adams|ace family|david dobrick|pink vault tour|jeffree star approved|shane x jeffree collection|jeffree star house|saying goodbye to our house!|jeffree star car tour|deep cleaning my home","8996291","391598","10300","28230","https://i.ytimg.com/vi/n-siktLSCFI/default.jpg","False","False","HEY EVERYONE… Welcome BACK to my channel! Today we're saying goodbye to the iconic pink Jeffree Star house in Calabasas! I can't believe it's been over 4 years since we moved in and there ae so many memories here. It's time for a change and we actually found our dream home! This week we have the movers come over and officially say GOODBYE to our crazy pink house.WANT MORE?? 💄 WATCH us CLEAN our entire MESSY house! ► https://bit.ly/2PGvlc5⭐ SHOP the Magic Star™ Concealer & Setting Powders: https://bit.ly/2GvMZdU🍓 SHOP THE JEFFREE STAR x MORPHE PART 2 COLLECTION: https://www.morphe.com/pages/jeffree-starYou can now use code JSTAR at checkout on Morphe.com for 10% OFF ANY Morphe product!*SHOP: http://www.jeffreestarcosmetics.com+ FOLLOW MY BRAND ON Instagram: http://instagram.com/jeffreestarcosmetics+FOLLOW ME ON IG: http://instagram.com/jeffreestar+ SNAPCHAT: jeffreedahmer+ TWITTER: @jeffreestarWATCH MORE VIDEOS...................❤️🔮 WATCH SURPRISING MY BOYFRIEND W HIS DREAM CAR  ► https://bit.ly/2ObF2At🎀 WATCH MY PINK VAULT CLOSET TOUR ▷ https://www.youtube.com/watch?v=CwMBrNEpYfs😱 TRYING DOLLAR GENERAL MAKEUP FOR THE FIRST TIME ▷ https://bit.ly/2kptBHy"
"YvKpmK_-Wg4","Charlo vs. Harrison II: Charlo avenges loss, now 2-time champ | FULL FIGHT HIGHLIGHTS | PBC ON FOX","2019-12-22T07:13:36.000Z","UCxm10NbD7LF1fVYcbHbcbXg","PBC ON FOX","17","19.31.12","Fox|fox sports|fs1|fox sports 1|news|sports|highlights|game|PBC|boxing|fighting|pro boxing|championship|knockout|tko|kate abdo|ray mancini|Errol spence|shawn porter|manny pacquiao|tony harrison|jermell charlo|Premier Boxing Champions|PBC highlights|Jermell Charlo PBC|Jermell Charlo PBC highlights|Tony Harrison PBC|Tony Harrison PBC highlights|Jermell Charlo vs Tony Harrison|Jermell Charlo vs Tony Harrison highlights|Jermell Charlo vs Tony Harrison full game","1192734","11680","692","3420","https://i.ytimg.com/vi/YvKpmK_-Wg4/default.jpg","False","False","Re-live every key moment from the rematch between Jermell Charlo and Tony Harrison, which saw Charlo take back the super welterweight title with an 11th-round TKO.#PBConFOX #JermellCharlo #TonyHarrisonSUBSCRIBE for more from PBC ON FOX: http://foxs.pt/SubscribePBCONFOX►FOX Sports YouTube channel: http://foxs.pt/SubscribeFOXSPORTSSee more from PBC ON FOX: http://foxs.pt/PBCONFOXFoxSports Like PBC ON FOX on Facebook: http://foxs.pt/PBCONFOXFacebook Follow PBC ON FOX on Twitter: http://foxs.pt/PBCONFOXTwitter Follow PBC ON FOX on Instagram: http://foxs.pt/PBCONFOXInstagram About PBC ON FOX:The official FOX Sports home of PBC coverage. We see every jab, cross, and knockout and share it with you, THE FAN. Our talent includes past and current PBC fighters such as Lennox Lewis, Shawn Porter, Tony Harrison, Abner Mares, and many more.PBC ON FOX content includes highlights, press conferences, weigh-ins and analysis from all PPV events and Fight Nights on FOX and FS1. You’ll also find clips from original studio shows like ‘Inside PBC Boxing’ and ‘PBC Face to Face’ as well as the best from the top athletes in the sport.Charlo vs. Harrison II: Charlo avenges loss, now 2-time champ | FULL FIGHT HIGHLIGHTS | PBC ON FOXhttps://youtu.be/YvKpmK_-Wg4PBC ON FOXhttps://www.youtube.com/channel/UCxm10NbD7LF1fVYcbHbcbXg"
"rQhToR3Ypn0","When you're asked to play piano for the holidays","2019-12-23T07:59:43.000Z","UCnZx--LpG2spgmlxOcC-DRA","Daniel Thrasher","23","19.31.12","When you learn a riff and put|If pianists could clone themse|When you have big jazz energy|daniel thrasher|Daniel Thrasher|how you look when you play wit|how to play piano|piano for beginners|piano lessons online","407604","41217","150","1738","https://i.ytimg.com/vi/rQhToR3Ypn0/default.jpg","False","False","Click https://skl.sh/danielthrasher4 to get 2 months of Skillshare for FREE!"
"Szkx1B7CO1Q","BEAT THE CHEF: MYSTERY BOX CHALLENGE VOL. 6","2019-12-22T16:00:03.000Z","UCfyehHM_eo4g5JUyWmms2LA","SORTEDfood","26","19.31.12","Sortedfood|Sorted food|Sorted Food's Ben Ebbrell|BEAT THE CHEF: MYSTERY BOX CHALLENGE VOL. 6|Sorted Beat The Chef|cooking challenge|mystery box|food challenge|chef vs normal|beat the chef|festive mystery ingredients|james currie|mystery box challenge|Chocolate brownie|Eggnog|Festive Espresso Martini|white chocolate snowball|mulled cider clementine","364421","12910","90","746","https://i.ytimg.com/vi/Szkx1B7CO1Q/default.jpg","False","False","Chef Ben and ‘normal’ cook Mike are challenged to make the best sweet dish from a box of mystery festive ingredients. The world is their oyster. What will they cook up to impress the judges this Christmas?COMMENT BELOW!Do you like the see the normal's trying to beat the chef? Let us know!WANT TO SUPPORT SORTED?? Here's how to get involved...Join our food journey each week by SUBSCRIBING to the channel. Press the bell button to get notifications every time we post: https://goo.gl/pqaw14Become a member of the Sorted club and access the AMAZING podcast and apps that have been designed for you to live your best life through food: https://goo.gl/otD6NFGrab the Packs Starter Kit for everything you need to create your own SMART kitchen and nail midweek meals: https://sorted.club/buy-the-packs-starter-kit/Grab a copy of one of our UNIQUE cookbooks for major cooking inspo: https://sorted.club/books/"
"COA7UkaeJAs","SE DONS vs KENNINGWELL | PPC CUP QUARTER FINAL | Sunday League Football","2019-12-22T13:08:24.000Z","UCDS72f-TgUOfYkOzdB17leA","donstrapzytv","24","19.31.12","Se dons|sunday league tackles|sunday league football|arsenal fan tv|longest 90|slash football|baiteze|soccer am|fifa 19|arsenal|manchester united|jimmy bullard|bbc sport|bt sport|sky sports news|sky sports|fa cup|champions league|europa league|premiere league|love island|ian wright|puma football|jadon sancho|mesut ozil|nicholas pepe|aubameyang|liverpool|sadio mane|sergio aguero|lionel messi|ksi|logan paul|mikel arteta|carlo ancelotti","149987","5863","66","283","https://i.ytimg.com/vi/COA7UkaeJAs/default.jpg","False","False","Join us on Patreon:www.patreon.com/sedonsBUY YOUR DØNS MERCH & SE DØNS KIT NOW FROM www.sedons.comSE Dons is the journey of a Sunday League Football Club in South London hosted by UK Rap/Grime Artist Don Strapzy. Follow us on: Instagram @officialdons Twitter @sedonsfc Merch - www.sedons.com"
"Dc2VjZzFk8g","Responsibilities of a Best Friend (ft. Reese Witherspoon)","2019-12-22T21:30:03.000Z","UCfm4y4rHF5HGrSr-qbvOwOg","Lilly Singh","23","19.31.12","iisuperwomanii|superwoman|team super|comedy|skit|rant|lilly singh|youtube superwoman|manjeet|paramjeet|parents|types of people|superwoman youtube|lily singh|lilly singh reese witherspoon|reese witherspoon|reese witherspoon friends|reese witherspoon sketches|lilly singh collabs|lilly singh collabs 2019|lilly singh friendships|lilly singh friends|collabs|youtube collabs|lilly singh collab videos|lilly singh celebs","867275","70675","1089","2185","https://i.ytimg.com/vi/Dc2VjZzFk8g/default.jpg","False","False","All best friends have an unspoken code of conduct. Thou shall hit all my most flattering angles even if it means you’re busting a serious squat. My bestie Reese Witherspoon knows wussupppp. Check out my bestie Reese:https://www.youtube.com/channel/UCkIR1fGlhdr5RQvxAEpj1SQhttps://www.instagram.com/reesewitherspoon/?hl=enSubscribe: http://bit.ly/SubLillySingh | MERCH: https://lillysingh.comWatch Breaking Up With Your Best Friend! https://youtube.com/watch?v=2ohIVoR2WRA If you want to add translations, click the gear icon and go to Subtitles/CC then to Add subtitles or CC! Follow Paramjeet:Instagram: https://instagram.com/iiparamjeetii/Twitter: https://twitter.com/iiparamjeetii/ Follow Manjeet:Instagram: https://instagram.com/iimanjeetii/Twitter: https://twitter.com/iimanjeetii/ Get HOW TO BE A BAWSE: https://lillysinghbook.com Follow Lilly Singh:Facebook: https://facebook.com/IISuperwomanII/Instagram: https://instagram.com/iisuperwomanii/Twitter: https://twitter.com/iisuperwomaniiLilly Singh Vlogs: https://youtube.com/user/SuperwomanVlogsOfficial Website: http://lillysingh.com/ Watch More Lilly Singh:Types Of People: https://youtube.com/watch?v=eR_nzGqYXNw&list=PLuBXqtS2jaLMu81JnF6AOnRHzG6Csbd6yMy Parents: https://youtube.com/watch?v=EPHMXbZml_s&list=PLuBXqtS2jaLOGQynSYvxaqUgvNl7Ovz8xSkits: https://youtube.com/watch?v=jyxi0rfEDnE&list=PLuBXqtS2jaLMhu9PU0tAaHbnqloWibwl0The Super Rants: https://youtube.com/watch?v=KYadw8gNOok&list=PLuBXqtS2jaLPopv899QwFphiirmD_XWdqLatest Uploads: https://youtube.com/user/IISuperwomanII/videos?view=0&sort=dd&shelf_id=2 Thanks for watching and don't forget to keep smiling. You're worth it! xoxo"
