video_id,title,publishedAt,channelId,channelTitle,categoryId,trending_date,tags,view_count,likes,dislikes,comment_count,thumbnail_link,comments_disabled,ratings_disabled,description
"DwsPImGeyqA","Hayley and David explode at one another | MAFS 2020","2020-03-01T09:45:00.000Z","UCsmoWCw09GX78oIU5g1MG0g","Married At First Sight Australia","24","20.02.03","MAFS|Married At First Sight|MAFS Australia|Reality show|caught cheating|mafs 2020|married at first sight 2020|mafs australia 2020|marry a stranger|Aleks and Ivan|Amanda and Tash|Cathy and Josh|Connie and Jonethen|Hayley and David|Mishel and Steve|Natasha and Mikey|Poppy and Luke|Stacey and Michael|Vanessa and Chris|John Aiken|Mel Schilling|Dr Trisha Stratford|blind date","97009","684","124","0","https://i.ytimg.com/vi/DwsPImGeyqA/default.jpg","True","False","Hayley and David's relationship breaks down.Subscribe 👉: https://bit.ly/2lmJXRO Full Episodes 👉: https://bit.ly/35Ch9qtAustralia’s No. 1 series, Married At First Sight, returns in 2020 for its seventh explosive season, bringing another powerful combination of love and fireworks.Relationship experts John Aiken, Mel Schilling and neuropsychotherapist Trisha Stratford will pair 20 brave singles from across Australia, using a mix of neuroscience and psychology, with the goal of creating 10 perfect matches.Relationships will be put to the ultimate test by our experts to determine whether science really can predict true love.Viewers will be captivated by incredible weddings, romantic honeymoons, provocative dinner parties and confronting commitment ceremonies, which will again lure you into this addictive reality TV juggernaut.Official Website: http://nine.com.au/MAFSLike Married At First Sight on Facebook: http://facebook.com/MAFSFollow Married At First Sight on Twitter: http://twitter.com/MarriedAUFollow Married At First Sight on Instagram: http://instagram.com/MAFS#MAFS #MarriedAtFirstSight #MAFS2020"
"nW5CyyksdtI","Customizing Everything In An Apple Store, Then Giving It To People!!📱📞ft. Charli D'Amelio (Giveaway)","2020-02-29T20:29:19.000Z","UClQubH2NeMmGLTLgNdLBwXg","ZHC","24","20.02.03","zhc|charli d'amelio|charli damelio|lilhuddy|chase hudson|hypehouse|hype house|tik tok|tiktok|tiktok life hacks|apple store|iphone|airpods|iphone 11|iphone x|macbook|ipad|airpods pro|experiment|test|mrbeast|mr beast|hacks|tiktoks|viral|fazerug|faze rug|marko|custom iphone|custom iphone 11|iphone 12|apple|phone|customizing 11 iphone 11s|Customizing Everything In An Apple Store|Then Giving It To People!!📱📞ft. Charli D'Amelio (Giveaway)|viral life hacks","3926415","267864","2877","119663","https://i.ytimg.com/vi/nW5CyyksdtI/default.jpg","False","False","Hope you enjoyed! Make sure to enter the huge iPhone 11s giveaway! Thanks for watching:)Subscribe, Click on another vid in recommendations, and Follow my socials! Instagram : @ zhcomicartTwitter: @ hsieh_zachary"
"bMpgsD5o8bs","Thoughts on Getting Robbed","2020-02-29T17:10:42.000Z","UC-lHJZR3Gqxm24_Vd_AJ5Yw","PewDiePie","24","20.02.03","SATIRE","5298134","579683","8650","46652","https://i.ytimg.com/vi/bMpgsD5o8bs/default.jpg","False","False","Pewdiepie robbed not epic100 CLUB MERCH OUT NOW! https://represent.com/store/pewdiepie (Thank you)Pewdiepie's Pixelings DOWNLOAD:iOS: https://buff.ly/2pNG0aTAndroid: https://buff.ly/34C68nZ#pewdiepie #pixelingsMinecraft Playlist:https://www.youtube.com/watch?v=mhgS6...My Stores:TSUKI:https://tsuki.market/Merch:https://represent.com/store/pewdiepieI drink GFUEL (affiliate link):https://gfuel.ly/31KargrMy Setup (affiliate links):Chair: https://clutchchairz.com/pewdiepie/Official Razer hardware:Razer Nari Ultimate headset: http://rzr.to/pdp-razer-nari Razer Customs phone cases: http://rzr.to/pdp-razer-caseNordVPN DOWNLOAD (affiliate link):Go to https://NordVPN.com/pewdiepie and use code PEWDIEPIE to get 70% off a 3 year plan plus 1 additional month free.I stream on DLive (ad):https://go.dlive.tv/pewdiepie"
"u0qDV1rRsF0","Cagliari 3-4 Roma | Nikola Kalinic scores twice in 7-Goal Thriller! | Serie A TIM","2020-03-01T20:16:22.000Z","UCBJeMCIeLQos7wacox4hmLQ","Serie A","17","20.02.03","Roma|cagliari vs roma|Nikola Kalinic|nikola kalinic serie a tim|Cagliari 3-4 Roma|cagliari roma 4 3|Serie A|Ronaldo|Higuain|Dybala|highlights|Insigne|Juventus|AC Milan|Inter Milan|Napoli|CR7|Cristiano Ronaldo|goals|full highlights|watch|stream|partita|migliori gol|migliori in campo|migliori al mondo|gol del mese|federcalcio|calcio|Italia|lukaku|de ligt|balotelli|sp:ty=high|sp:dt=2020-03-01T16:00:00Z|sp:st=soccer|sp:li=seri|sp:ti:home=CAG|sp:ti:away=ROM|sp:vl=en","535225","8116","156","320","https://i.ytimg.com/vi/u0qDV1rRsF0/default.jpg","False","False","Nikola Kalinic scores twice as Roma claim a 4-3 win against Cagliari | Serie A TIMThis is the official channel for the Serie A, providing all the latest highlights, interviews, news and features to keep you up to date with all things Italian football.Subscribe to the channel here! https://bit.ly/2OM2Eax Find out more about the Serie A at: http://www.legaseriea.it/en/ Questo è il canale ufficiale della Serie A, dove potrai avere accesso ai momenti salienti, alle interviste, alle notizie e alle funzionalità del momento per rimanere aggiornato sulle ultime novità del campionato.Iscriviti qui al canale! https://bit.ly/2OM2EaxPer maggiori infomazioni sulla Serie A: http://www.legaseriea.it/it"
"u6R7F8MfD0s","Health Secretary: A coronavirus vaccine is many months away","2020-03-01T10:14:53.000Z","UCoMdktPbSTixAyNGwb-UYkQ","Sky News","25","20.02.03","SKY|NEWS|LIVE|SROS|SOPHY|RIDGE|ON|SUNDAY|CORONAVIRUS|HEALTH|CONCERNS|COVD-19|UK|SAFETY|PUBLIC|GOVERNMENT PLANS","133231","746","201","791","https://i.ytimg.com/vi/u6R7F8MfD0s/default.jpg","False","False","Health Secretary Matt Hancock outlines the government’s plans to contain coronavirus and how the public can try to prevent catching the illness. SUBSCRIBE to our YouTube channel for more videos: http://www.youtube.com/skynews Follow us on Twitter: https://twitter.com/skynews  Like us on Facebook: https://www.facebook.com/skynews Follow us on Instagram: https://www.instagram.com/skynews For more content go to http://news.sky.com and download our apps:  Apple: https://itunes.apple.com/gb/app/sky-news/id316391924?mt=8 Android https://play.google.com/store/apps/details?id=com.bskyb.skynews.android&hl=en_GBSky News videos are now available in Spanish here/Los video de Sky News están disponibles en español aquí https://www.youtube.com/channel/UCzG5BnqHO8oNlrPDW9CYJog"
"sLj9pqGHoFw","How to Get Jacked Forearms (CONTROVERSIAL!)","2020-03-01T18:18:32.000Z","UCe0TLA0EsQbE-MjuHXevj2A","ATHLEAN-X™","26","20.02.03","how to get big forearms|build bigger forearms|forearm workout|forearm exercises|forearm exercise|best forearm exercises|exercises for bigger forearms|brachioradialis exercises|how to build brachioradialis|get jacked forearms|get jacked|how to build big forearms|best forearm workout|perfect forearm workout|increase forearm size|increase forearm mass|exercises for big forearms|get big forearms|athleanx|athlean x|jeff cavaliere","403391","28758","197","2714","https://i.ytimg.com/vi/sLj9pqGHoFw/default.jpg","False","False","If you want to get jacked forearms and you aren’t sure what forearm muscles to concentrate on, you’re going to want to watch this video. Here I show you that one of the biggest muscles in the forearm, responsible for a major portion of the size, is not even technically a forearm muscle. The brachioradialis is a powerful elbow flexor that also has abilities to pronate the forearm. Many will focus all of their forearm workouts and exercises on wrist curls and wrist extensions. This is a mistake when trying to build up mass in the forearm muscles.To start, it helps to revisit the anatomy of the lower arm. The brachioradialis starts on the upper arm bone, the humerus, and inserts on the distal end of the radius (the bone on the thumb side of the forearm). This muscle does not cross the wrist joint and therefore has no action on the wrist. This means that the brachioradialis does not extend or flex the wrist like the other forearm muscles does.In order to work it the most you need to spend your time focusing on the actions of the elbow, specifically flexing the elbow. The position with which you do this matters however. If you do it with the forearm supinated you will instantly place most of the load on the biceps rather than the brachioradialis. To get the brachioradialis you will want to have your forearm either in neutral or pronated. Here is where some controversy comes in.Many will point to the fact that the brachioradialis is strongest in the neutral position of the forearm. This is true. That does not mean however that the muscle is most fully shortened or activated in this position. It can achieve a greater level of contraction when it is both flexed at the elbow and pronated at the forearm. Does this mean that you should not train it out of the neutral position? No. It means that you can choose exercises that allow it to be trained heavier for progressive overload in this position but that you still need to include forearm exercises that allow it to be trained from a pronated position. The most classic forearm exercise when it comes to this is the reverse barbell curl. Here, you can do it with either a straight bar to achieve the fully pronated position or with an EZ bar to get a more neutral position. Remember to adjust your weights accordingly to stimulate the muscle as discussed above. Also, the amount of brachioradialis activation is higher with elbow flexion above 90 degrees so remember not to cut the range of motion short on any rep.You can also do this with dumbbells. As shown, you can hold the dumbbell with an offset grip which will help you to overload pronation at the same time that you can flex the elbow to train the brachioradialis optimally. The version shown here is good at accomplishing both and can be done with most dumbbells at the gym.The lat pulldown variation is another great option for achieving a reverse curl and training the brachioradialis to get bigger forearms. The key is to keep the bar moving behind the head and not just to the head to take advantage of the greater activation with greater elbow flexion.When it comes down to it however, if you want to get jacked forearms one of the easiest things you can do is remember to pick up the weights when you’re done with them. Yes, the position of carrying plates and racking them is one of the best ways to activate this muscle and get it to grow with the additional volume you achieve by doing this repeatedly during the workout week. Not just that, you’ll be more liked at the gym for not being that guy who never picks up his weights.If you’re looking to get bigger forearms and want to build your entire body at the same time, be sure to head to athleanx.com at the link below. Start training like an athlete and get ripped forearms and a strong athletic body in just 90 days by using the ATHLEAN-X Training System that matches your exact goals.For more videos on how to build big forearms and a stronger grip, be sure to subscribe to our channel here on youtube at the link below and don’t forget to turn on your notifications so you never miss a new video when it’s published.Build Muscle in 90 Days - http://athleanx.com/x/my-workoutsSubscribe to this channel here - http://bit.ly/2b0coMW"
"OCEHY2IftHo","Model S vs 3 vs X - Tesla Performance DRAG RACE, ROLLING RACE & BRAKE TEST!","2020-03-01T09:02:32.000Z","UCUhFaUpnq31m6TNX2VKVSVA","carwow","2","20.02.03","carwow|mat watson|4k review|car review|car review 2019|car review 2020|tesla|tesla model s|model s|tesla model s performance|tesla model 3|model 3|tesla model 3 performance|tesla model x|model x|model x p100d|tesla p100d|best electric car|best electric cars|electric car 2020|best electric car 2020|electric car drag race|drag racing|new electric car|performance cars|performance electric car","1097235","37207","760","2191","https://i.ytimg.com/vi/OCEHY2IftHo/default.jpg","False","False","It's the one you electric fanboys have been waiting for... the ultimate Tesla DRAG RACE! We've brought together the most powerful edition of the Model X, Model S and Model 3, and they're going head-to-head over the quarter-mile! Sure, you might think the Model S has it in the bag, but when you consider the Model X can produce 795hp and 1140Nm, is it going to be closer than we anticipated?! You'll have to keep watching to find out!Teslas courtesy of R Symons LTD - https://rsymons.co.ukSubscribe to our Local Channels! carwow Arabic - https://www.youtube.com/channel/UCqLF...carwow Chinese - https://www.youtube.com/channel/UC7Ei...carwow Germany - https://www.youtube.com/channel/UCcft...carwow Indonesia - https://www.youtube.com/carwowIndonesiacarwow Japanese - http://www.youtube.com/carwow日本語 carwow Korean - https://www.youtube.com/channel/UCzm5...carwow Portuguese - https://www.youtube.com/channel/UC0vI...carwow Russian - https://www.youtube.com/channel/UCh3g...carwow Spanish - http://www.youtube.com/c/carwowEspañolSubscribe to Mat’s Channel – https://www.youtube.com/user/MatWatso...Instagram – http://www.instagram.com/carwowcarsFacebook – http://www.facebook.com/carwowukTwitter – http://www.twitter.com/carwowukAwkward haggling is a thing of the past with carwow. Choose your perfect car with our configurator tool and let the country’s best dealers compete over you. Compare the five best offers by price, location and dealer ratings and choose the one that’s right for you – no hassle, no haggling, just a great deal. Visit our site to save money on your new car – http://bit.ly/carwow-UK Oder auch in Deutschland Geld beim Autokauf sparen – http://bit.ly/carwow-DEVisita nuestra página web para saber cuánto te puedes ahorrar en tu nuevo coche – http://bit.ly/carwow-ES"
"pwD09TYSGeE","전세계를 홀린 '방탄소년단'의 'ON' 인기가요 컴백무대! / DIRECTOR's CUT","2020-03-01T07:49:30.000Z","UCS_hnpJLQTvBkqALgapi_4g","스브스케이팝 / SBS KPOP","24","20.02.03","Inkigayo|BTS|방탄소년단|인기가요","3258122","373517","2740","11069","https://i.ytimg.com/vi/pwD09TYSGeE/default.jpg","False","False","전세계를 홀린 '방탄소년단'의 'ON' 인기가요 컴백무대! / DIRECTOR's CUTCOMEBACK!넘어져도 다시 일어나 scream!BTS, 'ON' 컴백무대!인기가요에서 특별히 스브스 케이팝에 본방과 다른 버전을 제공해줬습니다.미묘한 차이도 크게 만드는 'BTS'의 무대를 함께 즐겨보세요!방탄소년단 - ON (BTS - ON)#BTS #방탄소년단 #ON"
"RUjVC1f5GSA","Hoffenham vs Bayern Munich (0-6) | Bundesliga highlights","2020-02-29T20:59:08.000Z","UC4i_9WvfPRTuRWEaWyfKuFw","BT Sport","17","20.02.03","Bayern|Bayern Munich|Bayern fans|Bayern ultras|ultras|Hoffenheim|Hoffenheim owner|Dietmar Hopp|Bayern vs Hoffenheim|Hoffenheim vs Bayern|0-6|6-0|highlights|all goals|Bundesliga|BT Sport","260029","4409","78","395","https://i.ytimg.com/vi/RUjVC1f5GSA/default.jpg","False","False","Bayern Munich beat Hoffenheim comfortably in Bundesliga action, although the main headlines came from a stand-off between the away side's fans and their own players.Subscribe to our YouTube channel for the best videos from BT Sport  ➡️ http://bit.ly/17YTeL5Subscribe to our Boxing YouTube channel ➡️ http://po.st/NoFilterYTTwitter: http://twitter.com/btsportFacebook: http://www.facebook.com/btsportInstagram:http://instagram.com/btsportWebsite: http://sport.bt.com"
"tSE1bZkFMP0","K Trap | Tiffany Calver Freestyle","2020-02-29T22:00:06.000Z","UCqrimRUsQ-hTI8ceDP9c3FQ","BBC Radio 1Xtra","24","20.02.03","Freestyle|K Trap|Rapper|1Xtra|Drill|Trap|Hip hop|Music|Song|Beat|Type beat|Lambeth|London|BBC|Radio|Performance|Tiffany Calver","97702","4282","75","269","https://i.ytimg.com/vi/tSE1bZkFMP0/default.jpg","False","False","Lambeth's own K Trap steps up for his Tiffany Calver Freestyle on the 1Xtra Rap Show.#KTrap #TiffanyCalver#1Xtra--Official Channel of BBC Radio 1XtraHere you can find your favourite freestyles, incredible live performances, in-depth interviews + more!Still haven’t subscribed to 1Xtra on YouTube? ►► https://goo.gl/3ZE9reFollow us on socials:https://www.facebook.com/bbc1xtra/https://twitter.com/1xtrahttps://www.instagram.com/bbc1xtrahttps://www.bbc.co.uk/1xtra"
"UNZqm3dxd2w","Roddy Ricch - The Box [Official Music Video]","2020-02-28T23:00:10.000Z","UChQdA1rid5kKZh6oIc6DLNg","Roddy Ricch","10","20.02.03","Roddy Ricch|Die Young|Feed The Streets|Compton|Rap|Hip Hop|Please Excuse Me For Being Antisocial|roddy rich antisocial|roddy rich|roddy ricch album|roddy ricch the box|the box|roddy ricch box|antisocial|juice wrld|the box lyrics|the box lyric video|pullin out the coupe out the lot|box lyrics|the box lyric|top songs|top hits|drake|dababy|a boogie|post malone|youngboy nba|the box music video|roddy ricch box video|ee er|eee err|fast and furious","16094186","1221042","18719","71832","https://i.ytimg.com/vi/UNZqm3dxd2w/default.jpg","False","False","Roddy Ricch - The BoxStream/Download - https://roddyricch.lnk.to/PleaseExcuseMeForBeingAntisocialGet official merch here: http://smarturl.it/RoddyRicchStoreDon't wear no shoes in my house floor mat: http://ricchessentials.comFollow Roddy Ricchhttps://instagram.com/roddyricchhttps://twitter.com/roddyricchhttps://soundcloud.com/roddyricchhttps://facebook.com/RoddyRicch/http://roddyricch.com"
"QitVWwWyjK8","James May unboxes our 1 million subscriber YouTube plaque! | Mail Time Ep.6","2020-03-01T12:00:42.000Z","UChiwLDIBJrV5SxqdixMHmQA","DRIVETRIBE","2","20.02.03","jeremy clarkson|richard hammond|james may|cars|top gear|the grand tour","141190","9123","81","807","https://i.ytimg.com/vi/QitVWwWyjK8/default.jpg","False","False","Watch James May open our most exciting piece of post yet – our 1 million subscriber plaque from YouTube! Thank you all for subscribing, and enjoy today's episode of Mail Time!If you'd like to send something in for May to open on the next episode, the address is in the video.See more from James here: http://bit.ly/38ieuUsFollow us:https://twitter.com/drivetribehttps://facebook.com/drivetribeSubscribe to the DRIVETRIBE YouTube channel: http://bit.ly/D_TRBsubs"
"kKe8TXnFSSI","Trying Genius Viral DIY Food Hacks","2020-02-29T18:15:01.000Z","UC6IijBsVf2PlWo_uq6P9wQw","Gloom","24","20.02.03","awful pranks|awful diys|trying lifehacks|diwhy|trying diwhys|reddit|funny|silly|instagram life hacks|edible pranks|awful life hacks|dumbest life hacks|trying|gloom tries|gloom|gloomgames|kassie|123 go|troom troom|pregnancy|pregnant|2020|how to eat food|how to|life hacks|troomtroom pranks|food hacks|viral hacks","995164","26871","1367","2435","https://i.ytimg.com/vi/kKe8TXnFSSI/default.jpg","False","False","These DIY life and food hacks aren't even funny, they're frightening. Thanks for the tips 123 Go!Subscribe to 123 Go: https://www.youtube.com/channel/UCBXNpF6k2n8dsI6nBH8q4sQ?sub_confirmation=1SUBSCRIBE HERE: https://www.youtube.com/channel/UC6IijBsVf2PlWo_uq6P9wQw?sub_confirmation=1My INSTAGRAM: http://www.instagram.com/gloomykassieMy TWITTER: http://www.twitter.com/gloomykassieMy DISCORD SERVER (13 and up only): http://discord.gg/GLOOMMERCH: http://gloom.storeWATCH MY HORRIBLE BITLIVES: https://www.youtube.com/watch?v=-RcgvL6bKZQ&list=PLwbhb6Gu7AnXcLWpGMezpMHtPc6MZIfwYMy TIK TOK is @gloomdog, here's a link: http://vm.tiktok.com/JTHb8L/---------------------------------------------------------------------------I'm Kassie, also known as Gloom! I'm a variety gamer who does gameplay commentary on indie games and some bigger titles too. I also do silly sketches, challenges, Q&As, and whatever makes you goof balls giggle.---------------------------------------------------------------------------I do my best to upload at a few times a week (unless my life is a mess)."
"ocVzr6J2zTw","Saturday Night Takeaway Stitch Up! ~ Anthony Joshua","2020-02-29T20:07:09.000Z","UCughIsCoDkmTpwcX47lZQQw","Anthony Joshua","22","20.02.03","Anthony Joshua|Ant and Dec|Ant & Dec|Saturday Night Takeaway|Anthony Joshua Saturday Night Takeaway|Get out of my ear|Anthony Joshua on Saturday Night takeaway|Prank","275391","8118","149","866","https://i.ytimg.com/vi/ocVzr6J2zTw/default.jpg","False","False","The 'making of' my Saturday Night Takeaway Get Me Out Of Your Ear. Cheers for your help Ant & Dec! ~ Anthony Joshua TWITTER: https://twitter.com/anthonyfjoshua INSTAGRAM: https://www.instagram.com/anthony_joshua FACEBOOK: https://www.facebook.com/anthonyjoshuaboxer WEBSITE: http://www.anthonyjoshua.com"
"6umo--lyYxI","REACTION | Steven Gerrard | Hearts 1-0 Rangers","2020-02-29T21:00:00.000Z","UCVaGyBPoEAZItDjlFPsRcSA","Rangers Football Club (Official)","17","20.02.03","Rangers|Rangers FC|Rangers Football Club|RangersTV","94828","0","0","902","https://i.ytimg.com/vi/6umo--lyYxI/default.jpg","False","True","Steven Gerrard spoke to RangersTV after the defeat at Tynecastle in the Scottish Cup.CLICK to subscribe for FREE and never miss another video: http://rng.rs/1KpxkIWSubscribe to RangersTV to receive even more official content and exclusive interviews: http://www.rangerstv.tv/pricing.phphttp://www.rangers.co.ukhttp://www.facebook.com/rangersfchttp://www.twitter.com/RangersFChttp://www.twitter.com/RangersTV"
"Go0E-DUjIxI","I ASKED EDDY REYNOSO, WHO YOU FIGHTING?' - EDDIE HEARN DENIES CANELO/SAUNDERS DEAL, GARCIA/PACQUIAO?","2020-03-01T07:43:05.000Z","UCdl_gZZR6BtKi45eHFGAduw","iFL TV","17","20.02.03","ifl tv|ifltv|mtk global|boxing news now|boxing news uk|boxing news|boxing today|british boxing|boxing uk|boxing rankings|boxing results|boxing updates|boxing|sports","71532","817","60","320","https://i.ytimg.com/vi/Go0E-DUjIxI/default.jpg","False","False","I ASKED EDDY REYNOSO, WHO YOU FIGHTING?' - EDDIE HEARN DENIES CANELO/BJS DEAL, DALLAS CARD & GARCIA/PACQUIAO NEXT?INTERVIEW BY ANDREW McCART IN DALLAS#CANELO #BILLYJOESAUNDERS #EDDIEHEARN🥊 | Furys vs Wilder II Playlist: https://www.youtube.com/playlist?list=PL0O9MupJ4YWEPxo5lNZUMlxC048v_BAw6Why not keep up to date with us on social media? 🥊▶ | INSTAGRAM: https://www.instagram.com/ifltvboxing▶ | TWITTER: https://twitter.com/IFLTV▶ | FACEBOOK: https://www.facebook.com/ifltvDon’t miss the action – tune into BoxNation, Sky Sports and BT Sports and watch the fights live. Not signed up? You’ll find the best offers for new UK customers here:▶ | Sky - http://tidd.ly/452d9811▶ | BT - http://tidd.ly/90e75d54▶ | TalkTalk - http://tidd.ly/2d34a477🥊 | CHECK OUT OUR MOST POPULAR VIDEOS: https://goo.gl/dHeoTk🥊 | ANTHONY JOSHUA PLAYLIST: https://goo.gl/QZ58RD🥊 | TYSON FURY PLAYLIST: https://goo.gl/HdWpGj"
"uAr8v0NoMTQ","Highlights | Hull City 0-4  Leeds United | 2019/20 EFL Championship","2020-03-01T01:00:09.000Z","UCyQcJHDN4uYfPa1DHzKVSnw","Leeds United Official","17","20.02.03","sp:ty=high|sp:dt=2020-02-29T12:30:00Z|sp:st=soccer|sp:li=eng_ch|sp:ti:home=HUL|sp:ti:away=LEE","91329","1610","48","221","https://i.ytimg.com/vi/uAr8v0NoMTQ/default.jpg","False","False","Highlights from Leeds United’s 0-4 win against Hull City in the 2019/20 EFL Championship. Presented by Wish - Shopping Made Fun.Get exclusive Leeds United video content first - download the Official App: http://bit.ly/LUTVappIf you thought this video was 🔥 don't forget to subscribe and hit the like 👍 button! Also if you want to get a notification every time we post hit the bell 🛎 button in the top right corner. MOT. ALAW. ⚽️If you want to keep up with everything Leeds, go check out our other pages https://www.facebook.com/LeedsUnited/https://twitter.com/LUFChttps://www.instagram.com/leedsunited/?hl=enhttps://www.leedsunited.com"
"WPOIfNxm_0Y","DON'T BREAK iPhone 11 And Win £1,000 - iPhone Drop Test Challenge","2020-02-29T14:17:19.000Z","UCxOzbkk0bdVl6-tH1Fcajfg","Beta Squad","24","20.02.03","iphone 11|iphone 11 drop test|iphone drop test|iphone 11 challenge|challenge|drop test|breaking iphone 11|beta squad|win £1000|iphone|apple|chunkz|niko omilana|kingkennytv|aj shabeel|sharky|dont break iphone","431890","29321","255","1894","https://i.ytimg.com/vi/WPOIfNxm_0Y/default.jpg","False","False","iPhone 11 drop test challenge, today the beta squad had to build a device to protect their iPhone 11's from a 100 foot drop, and the winner receives a brand new iPhone 11.. Who do you think won?!Subscribe to everyone! Aj: http://www.youtube.com/ajshabeelSharky: http://www.youtube.com/afcsharkyChunkz: http://www.youtube.com/chunkzeast Niko: http://www.youtube.com/omilana7Kenny: http://www.youtube.com/mrkennyojFollow us on Social Media to stay connected!Twitter ► https://twitter.com/BetaSquad5Instagram ►  https://www.instagram.com/betasquad5"
