video_id,title,publishedAt,channelId,channelTitle,categoryId,trending_date,tags,view_count,likes,dislikes,comment_count,thumbnail_link,comments_disabled,ratings_disabled,description
"s5fPCcm-h9s","Highlights Real Madrid vs FC Barcelona (2-0)","2020-03-01T23:14:44.000Z","UCTv-XvfzLX3i4IGWAm4sbmA","LaLiga Santander","17","20.02.03","española|oficial|soccer|football|spanish league|laliga|resumen|highlight|Real Madrid vs FC Barcelona|sp:st=soccer|sp:vl=en|sp:dt=2020-03-01T20:00:00Z|sp:ti:home=rma|sp:ti:away=fcb|sp:ty=high|sp:or=2|sp:li=liga|Vinicius|Vinicius Jr|Isco|Kroos|Benzema|Casemiro|Marcelo|Sergio Ramos|Carvajal|Courtois|Mariano|Messi|Griezmann|Busquets|Piqué|ter Stegen|Frenkie de Jong|Braithwaite|Jordi Alba|elclásico|elclasico|clásico|clasico|real madrid|fc barcelona|barça|barca","1699854","23974","1425","1379","https://i.ytimg.com/vi/s5fPCcm-h9s/default.jpg","False","False","Real Madrid back on top after the victory over FC Barcelona with the goals in the second half of Vinicius Jr and Mariano #RealMadridBarça #ElClásico. LaLiga Santander 2019/2020Subscribe to the Official Channel of LaLiga Santander in HD | 2020-03-01 00.00h | J26 | RMA | BARLaLiga Santander on YouTube: http://goo.gl/Cp0tCLaCopa on YouTube: http://bit.ly/1P4ZriPLaLiga SmartBank on YouTube: http://bit.ly/1OvSXbiFacebook: https://www.facebook.com/LaLigaTwitter: https://twitter.com/LaLigaInstagram: https://instagram.com/laligaGoogle+: http://goo.gl/46Py9"
"Vp9bNHgT5Pg","12 new coronavirus cases in UK takes total to 35","2020-03-01T18:12:38.000Z","UCTrQ7HXWRRxr7OsOtodr2_w","Channel 4 News","25","20.02.03","Channel 4 News|china|virus|china virus|coronavirus|virus in china|china news|china disease|covid-19|corona|coronavirus china|coronavirus risks|how to prevent coronavirus|face masks|coronavirus uk|coronavirus what is it|wuhan china coronavirus|coronavirus china 2020|coronavirus outbreak in china|coronavirus outbreak|new china virus|virus infection explained","394426","2939","259","2152","https://i.ytimg.com/vi/Vp9bNHgT5Pg/default.jpg","False","False","Today's revelation that there are 12 new confirmed coronavirus cases brings the total number in the UK to 35. (Subscribe: https://bit.ly/C4_News_Subscribe) Three of the new patients are close contacts of the first known COVID-19 case to be transmitted within the UK by the Surrey resident in Haslemere. Another of the new patients is from Essex and they also have not travelled to an affected area outside the UK.  The eight remaining new cases are from London, West Yorkshire, Greater Manchester, Hertfordshire and Gloucestershire. Six of those eight people had recently travelled from Italy, while two had been in Iran. The Prime Minister will chair an emergency COBRA meeting tomorrow, and the government is expected to release more details of contingency plans in the next few days.  -----------------------  Follow us on Instagram - https://www.instagram.com/Channel4News"
"FNFTmV1DLp0","Ancelotti sent off after controversial winner disallowed! | Everton 1-1 Man Utd | EPL Highlights","2020-03-01T16:20:01.000Z","UCNAf1k0yIjyGu3k9BwAg3lg","Sky Sports Football","17","20.02.03","sky sports|premier league|Football League|football|Sky Sports live|Sky|Sports|stream|sky sports football|premier league highlights|epl 1920|epl highlights 1920|everton offside|everton man utd|everton var|ancelotti red card|ancelotti sent off|everton 1 man utd 1|de gea blunder|de gea man utd|de gea everton|epl today|super sunday","952937","11785","362","2644","https://i.ytimg.com/vi/FNFTmV1DLp0/default.jpg","False","False","SUBSCRIBE ► http://bit.ly/SSFootballSubPREMIER LEAGUE HIGHLIGHTS ► http://bit.ly/SkySportsPLHighlightsHighlights from Goodison Park where Bruno Fernandes spared David de Gea's blushes as he rescued a point for Manchester United after the goalkeeper's howler gifted Everton the lead in an incident-packed 1-1 draw, with VAR also ruling out a late Dominic Calvert-Lewin winner. Carlo Ancelotti was sent off at full time following his protests towards the referee.Watch Premier League LIVE on Sky Sports here ► http://bit.ly/WatchSkyPL►TWITTER: https://twitter.com/skysportsfootball►FACEBOOK: http://www.facebook.com/skysports►WEBSITE: http://www.skysports.com/footballMORE FROM SKY SPORTS ON YOUTUBE:►SKY SPORTS FOOTBALL: http://bit.ly/SSFootballSub►SKY SPORTS BOXING: http://bit.ly/SSBoxingSub►SOCCER AM: http://bit.ly/SoccerAMSub►SKY SPORTS F1: http://bit.ly/SubscribeSkyF1"
"0jz0GAFNNIo","Drake - When To Say When & Chicago Freestyle","2020-03-01T04:13:08.000Z","UCByOQJjav0CUDwxCk-jVNRQ","Drake","10","20.02.03","[none]","6775833","404368","9695","24226","https://i.ytimg.com/vi/0jz0GAFNNIo/default.jpg","False","False","When To Say When & Chicago Freestyle (Official Video)Director: Theo SkudraProducer: Christian TylerExecutive Producer: Leslie McCartneyProduction Company: ColossaleCinematographer: Theo SkudraEditor: Theo SkudraWhen To Say WhenProducer: Gaetan RousseauProducer: Nico ThauProduction Manager: John MorrowLocation Scout: Conlan OlberdingB Cam Operator: Pierrick Reiss1st AC (A Cam): Tsyen Shen1st AC (B Cam): Luna Burns 1st AC: Vincent Howard2nd AC: Greg HowardGaffer: John WardGaffer: Amaal MustafaBest Boy Electric: Jonathan MejiaKey Grip: Phil SokoloffBest Boy Grip: Kurtis RileyDriver: Jonathan Charles Equipment Van Driver: Iraki KurdianiSet PA: Sebastien Le CozSet PA: Achille VanderhaeghenChicago FreestyleProduction Coordinator: Cameron Frangopoulos1st AC: Nick Coffin1st AC: Nick PetrieGaffer: Alex PoutiainenSteady Cam: Greg FrankovichConform & Online: Assembly RepsColour: ArtjailColourist: Clinton HomuthFilm Processed at FotoKem Los Angeles Senior Dailies Producer: Mary Chamberlain"
"PV6LRI24dd8","D Block Europe (Young Adz x Dirtbike LB) - Pain Game [Music Video] | GRM Daily","2020-03-01T19:30:11.000Z","UCqTwKvjbTENZDGbz2si47ag","GRM Daily","10","20.02.03","Music|GRM|GRM Daily|Video|d block europe|young adz|dirtbike lb|d-block europe|lb dirtbike|street trauma|young adz x dirtbike lb|d block europe nassty|home p*ssy","302557","19314","354","873","https://i.ytimg.com/vi/PV6LRI24dd8/default.jpg","False","False","🚨 SUBSCRIBE: http://bit.ly/GRMsubscribe  📲 FOLLOW: @grmdaily📰 VISIT: http://grmdaily.com/"
"ttLuAMFT-XA","$10,000 vs. $100 Football Tickets ft. Sidemen","2020-03-01T12:29:12.000Z","UCQ-YJstgVdAiCT52TiBWDbg","ChrisMD","24","20.02.03","$10000|sidemen|football|chrismd|$100|$10|worth it|w2s|behzinga|calfreezy|callux|arsenal","953651","44810","544","1474","https://i.ytimg.com/vi/ttLuAMFT-XA/default.jpg","False","False","Got hold of row Z standard seats and a box at Fortress Emirates for Arsenal vs. Everton.Callux: https://www.youtube.com/user/OfficialCalluxTheo: https://www.youtube.com/channel/UCAvwetms56ntZtQWkYoqEIQReev: https://www.youtube.com/user/TheReevHD► Follow my Instagram: http://instagram.com/chrismd10► Follow me on Twitter: https://twitter.com/chrismd10► My book: http://amzn.to/2hvWgIUHow I record my gameplay!: https://www.elgato.com/gaming/?utm_source=chrismd&utm_medium=youtube&utm_campaign=GameCaptureHDMusic:0:00 | Danny Cocke – Parasite0:29, 2:36 | (Audiomachine) Piotr Adam Musial – Festival of Light0:57 | (Audiomachine) Steffan Koch– Diaspora1:20, 4:02, 16:13 | Hallmore – The Sky1:49 | Kings and Creatures – As The Empire Falls2:11 | Diviners - Escape (feat. Rossy) [NCS Release] Music provided by NoCopyrightSounds. Watch: https://youtu.be/4EYp7VPa__8 Free Download / Stream: http://ncs.io/EscapeYO3:19 | Niklas Johansson – The End Of All Things 5:09 | Suedo – Not letting Go6:17 | Steerner & Tjernberg Ft. Beerg & Haal - Names (Original Mix)10:16 | Phoenix Music – Guardians of the Earth       Music by Epidemic Sound (http://www.epidemicsound.com) & others."
"-FeZiV5DkpA","Feel the romance with Perri & Vanessa! | Dancing on Ice 2020","2020-03-01T20:38:26.000Z","UCHP_B9PT4LvW4tWSrewhvcw","Dancing on Ice","24","20.02.03","dancing on ice|ice skating|ashley banjo|jayne torvill|christopher dean|torvill and dean|holly willoughby|phillip schofield|holly and phil|john barrowman|kem cetinay|ben hanlin|caprice bourret|libby clegg|joe swash|trisha goddard|maura higgins|ian h watkins|perri kiely|lucrezia millarini|itv|perri and vanessa|perri dancing on ice|perri dancing on ice performance|perri dancing on ice 2020|perri and vanessa dancing on ice|perri kiely dancing","111286","0","0","0","https://i.ytimg.com/vi/-FeZiV5DkpA/default.jpg","True","True","This one is going to hit you right in the heart as Perri & Vanessa go all Romeo & Juliet on us. Just gorgeous.Watch our Week 9 Playlist!: https://bit.ly/3ajXQnAFollow and subscribe to the official YouTube channel for Dancing On Ice! https://bit.ly/35zHG6Mhttp://www.itv.comhttp://www.stv.tvYouTube: https://goo.gl/mN4RddWebsite: http://www.itv.com/dancingoniceFacebook: https://www.facebook.com/dancingoniceInstagram: https://www.instagram.com/dancingoniceTwitter: https://twitter.com/dancingonice#dancingonice"
"bzs_l5-Emzo","Try Not To Get Anxiety Challenge #2","2020-03-01T16:25:00.000Z","UCYzPXprvl5Y-Sf0g4vX-m6g","jacksepticeye","23","20.02.03","jacksepticeye|try not to get anxiety|try not to get anxiety challenge|try not to get anxiety jacksepticeye|challenge|challenge videos|try not to anxiety|try not to get anxiety heights|try not to get anxiety impossible|anxiety challenge|impossible challenge|try not to|scared|reddit|sweaty palms|crazy challenge|try not to challenge|jacksepticeye challenge|funny|funny videos|funny try not to get anxiety challenge video","1305528","97049","1140","8099","https://i.ytimg.com/vi/bzs_l5-Emzo/default.jpg","False","False","Welcome back to the try not to get anxiety challenge. Last time I failed very badly, how will we do this time? SUB TO BE EPIC - https://www.youtube.com/user/jacksepticeye?sub_confirmation=1Become a Sponsor: https://youtube.com/jacksepticeye/join►Twitter : https://twitter.com/Jack_Septic_Eye►Instagram: http://instagram.com/jacksepticeye"
"XdP1ejKBQ-A","Strongman swaps diet with wife for a day | Ft Eddie Hall","2020-03-01T19:01:03.000Z","UCTEpWW26-LKVvIP9mZkvlRw","Eddie 'The Beast' Hall","22","20.02.03","Eddie hall|Larry wheels|Brian shaw|worlds strongest man|deadlift|world record|strongman|giants live|history|hathor bjornsson|mattdoesfitness|strength|strong|official strongman|diet swap|I swapped diets with my wife for a day|eating challenge|I swapped diets for 24 hours|24 hour food challenge|beard meets food|Leah shutkever|matt stonie|beardmeetsfood|furious Pete|first we feast|shawstrength|randy santel|mashed|man vs food|food network|food network uk","840835","31962","468","4477","https://i.ytimg.com/vi/XdP1ejKBQ-A/default.jpg","False","False","Watch my wife consume my diet for a day eating nearly 8000calories and also watch me almost die from starvation... 1200 calories for me😢 Thanks for watching guys: Check out my website for all links and products mentioned in the video:- https://www.eddiehallstrongman.com 👈Don't forget to Like and Subscribe to the Channel 🙏🎥 https://www.instagram.com/felicityfilms_/Big LoveTeam Beast"
"dlk7Q2t_-HM","The OFFICIAL GENDER REVEAL Of THE ROYALTY FAMILY! **BOY or GIRL?**.","2020-03-01T16:00:56.000Z","UCja7QUMRG9AD8X2F_vXFb9A","The Royalty Family","22","20.02.03","The Royalty Family|Royalty Family|Andrea Espada|Family Friendly|gender reveal|boy or girl|official gender reveal|royalty family gender reveal|royalty family baby|official gender reveal of the royalty family|ferran|royalty|royalty family challenges|official gender|boy|girl|family vlog|reveal gender|the official|royal|royal gender reveal","2389641","124464","6552","0","https://i.ytimg.com/vi/dlk7Q2t_-HM/default.jpg","True","False","The OFFICIAL GENDER REVEAL Of THE ROYALTY FAMILY! Boy or Girl?𝐒𝐔𝐁𝐒𝐂𝐑𝐈𝐁𝐄 ᕼEᖇE! ➡ https://youtube.com/RoyaltyFamMERCH ➡ https://royalty.laWe Tested VIRAL TikTok LIFE HACKS... **THEY WORKED** ➡ https://youtu.be/2vvr4PQ9ma4TELLING OUR SON FERRAN WE'RE HAVING a BABY! EMOTIONAL...➡ https://youtu.be/bjrHdVM3zl8#GenderReveal #FamilyVlog #TheRoyaltyFamilyWatch our RECENT VIDEOS  ➡ https://bit.ly/2JotKG4Watch Our POPULAR VIDEOS! ➡ http://bit.ly/2NgagCxWatch Our CHALLENGES  ➡ https://bit.ly/2kqDqVD FOLLOW IᑎᔕTᗩGᖇᗩᗰ HERE ☟ANDREA ➡ https://www.instagram.com/andreaespadatv/ALI           ➡https://www.instagram.com/4kpapi/FERRAN  ➡https://www.instagram.com/kingferran/BUSINESS INQUIRIES ➡ @AndreaEspada.Bookings@Gmail.comWelcome To THE ROYALTY FAMILY Youtube Channel. We are a modern blended family based in Los Angeles that love to entertain you. We believe in family, fun, Love and are passionate about fashion, comedy and culture. Join us every week in sharing the good times of Andrea, Ali, Ferran and our Chihuahua Princesa. Best of all, we believe everyone can be ROYALTY so don’t forget to SUBSCRIBE!!The OFFICIAL GENDER REVEAL Of THE ROYALTY FAMILY! **BOY or GIRL?**.https://youtu.be/dlk7Q2t_-HMThe Royalty Familyhttps://www.youtube.com/channel/UCja7QUMRG9AD8X2F_vXFb9A"
"CMUQIlvv1to","Coronavirus: EU raises virus risk level as world cases grow  - BBC News","2020-03-02T12:49:12.000Z","UC16niRr50-MSBwiO3YDb3RA","BBC News","25","20.02.03","bbc|bbc news|news","277420","4359","315","2455","https://i.ytimg.com/vi/CMUQIlvv1to/default.jpg","False","False","Number of deaths worldwide now more than 3,000More than 90% are in Hubei, China, but there have been deaths in 10 other countriesEuropean Union disease prevention agency raises risk level to moderate to highSouth Korea reports 476 new cases, total 4,212, and four more deaths, total 26The leader of a South Korean church linked to the outbreak gets on his knees to apologiseIndonesia, Iceland, Portugal, Armenia and Andorra confirm their first cases of the virusAustralia confirms first person-to-person transmissionChina reports 42 more deaths - a total of 2,912Please subscribe HERE http://bit.ly/1rbfUog"
"Nabxn2f4ulg","David Pours Jordan's Special Cocktail Down the Sink! | Ibiza Weekender","2020-03-01T21:57:34.000Z","UCEUZtNDp7U6vO7FhFeqS8Kw","Ibiza Weekender","24","20.02.03","ibiza weekender|ibiza weekender full episode|ibiza weekender jordan|weekender boat party|David Potts|Ibiza Weekender David Potts|Imogen Townley|Ibiza Weekender Imogen Townley|British TV Show|Gameshow|TV Show|TV Show - Topic|Boat Party|Weekender Boat Party|Ibiza Weekender Boat Party","55474","807","23","0","https://i.ytimg.com/vi/Nabxn2f4ulg/default.jpg","True","False","#IbizaWeekenderJust let that sink in... HA!"
"0TNSZihOsLY","McDonald’s BIG MAC MUKBANG! They sent me the LIMITED EDITION SAUCE?!","2020-03-01T10:00:01.000Z","UCwR-g7XxcLxjYVTS5qncFhg","Anastasia Kingsnorth","24","20.02.03","[none]","338058","16446","399","1368","https://i.ytimg.com/vi/0TNSZihOsLY/default.jpg","False","False","Business Email: anastasiakingsnorth@mcsaatchisocial.comPODCAST: https://browse.entale.co/show/0a8f5f52-184a-40d8-af7d-419bbe3432ddPO Box: Anastasia KingsnorthC/O M&C Saatchi Social36 Golden SquareLondonW1F 9EEDisclaimer - I am not trying to brag, all opinions are my own. I will state in the video and in the description if the video is sponsored by a brand or company.\Links:Instagram - www.instagram.com/anastasiakingsnorthTwitter - www.twitter.com/AnastasiaK_xoxoFacebook - www.facebook.com/AnastasiaKingsnorthSocial Snapchat - anastasiaa3xoTiktok - @anastasiakingsnorthxoxo,Anastasia"
"D0v7sERrjpE","Another Book I Made as an Adult (and book tour!)","2020-03-01T17:38:02.000Z","UCo8bcnLyZH8tBIH9V1mLgqQ","TheOdd1sOut","23","20.02.03","[none]","2271147","168313","2793","22231","https://i.ytimg.com/vi/D0v7sERrjpE/default.jpg","False","False","Get tickets to my book tour ➤ https://theodd1sout.com/pages/eventsPre-Order my book ➤ https://theodd1sout.com/pages/the-first-sequel Second Channel ➤ https://www.youtube.com/channel/UC0GLNhtTu7yI8rl6ZZGeezw Everyone who worked on the bookRushlight Invader ➤ https://www.youtube.com/user/RushLightInvader Annie Loomis ➤ https://twitter.com/annieloomisart  PantslessPajamas ➤ https://www.youtube.com/channel/UCR0O-1cvuPNxDosvSDLpWHg Hexrin ➤ https://twitter.com/hexriin Kat ➤ https://twitter.com/NineDoodles funymony ➤ https://www.youtube.com/user/funymony Nine Doodles ➤ https://twitter.com/NineDoodlesFunyMony ➤ https://twitter.com/funymonyHiro the Hiroshark ➤ https://twitter.com/HirosharkTom Martin ➤ https://www.undeadwizard.com/artSecond channel ➤ https://www.youtube.com/channel/UC0GLNhtTu7yI8rl6ZZGeezw Twitter ➤ https://twitter.com/Theodd1sout Instagram ➤ https://www.instagram.com/theodd1sout/ Website/Merch ➤ https://theodd1sout.com/"
"1AElONvi9WQ","Why Blue Whales Don't Get Cancer - Peto's Paradox","2020-03-01T13:30:00.000Z","UCsXVk37bltHxD1rDPwtNM8Q","Kurzgesagt – In a Nutshell","27","20.02.03","Cancer|healing|peto’s paradox|paradox|peto|therapy|biology|rhinoceros|blue whale|mouse|elephant|giraffe|cell|human cell|body cell|cancer cell|immune system|cancer rate|human being|evolution|hyper tumor|hyper parasite|mutation|Gene|DNA|proto oncogene|tumor suppressor gene|caretaker|gatekeeper|age|aging|ulcer|tumor|metabolism|cell structure","2888305","248387","1227","9210","https://i.ytimg.com/vi/1AElONvi9WQ/default.jpg","False","False","Get Merch designed with ❤ from https://kgs.link/shop  Join the Patreon Bird Army 🐧 https://kgs.link/patreon  ▼▼ More infos and links are just a click away ▼▼Cancer is a creepy and mysterious thing. While we tried to understand it, to get better at killing it, we discovered a biological paradox that remains unsolved to this day: large animals seem to be immune to cancer. Which doesn’t make any sense – the bigger a being, the more cancer it should have. To understand why, we first need to take a look at the nature of cancer itself.Sources & further reading: https://sites.google.com/view/sourcespetosparadox/OUR CHANNELS▀▀▀▀▀▀▀▀▀▀▀▀▀▀▀▀▀▀▀▀▀▀▀▀▀▀German Channel: https://kgs.link/youtubeDE by FUNKSpanish Channel: https://kgs.link/youtubeES by WIXHOW CAN YOU SUPPORT US?▀▀▀▀▀▀▀▀▀▀▀▀▀▀▀▀▀▀▀▀▀▀▀▀▀▀This is how we make our living and it would be a pleasure if you support us!Get Merch designed with ❤ from https://kgs.link/shop  Join the Patreon Bird Army 🐧 https://kgs.link/patreon  DISCUSSIONS & SOCIAL MEDIA▀▀▀▀▀▀▀▀▀▀▀▀▀▀▀▀▀▀▀▀▀▀▀▀▀▀Reddit:            https://kgs.link/redditInstagram:     https://kgs.link/instragramTwitter:           https://kgs.link/twitterFacebook:      https://kgs.link/facebookDiscord:          https://kgs.link/discordNewsletter:    https://kgs.link/newsletterOUR VOICE▀▀▀▀▀▀▀▀▀▀▀▀▀▀▀▀▀▀▀▀▀▀▀▀▀▀The Kurzgesagt voice is from Steve Taylor:  https://kgs.link/youtube-voiceOUR MUSIC ♬♪▀▀▀▀▀▀▀▀▀▀▀▀▀▀▀▀▀▀▀▀▀▀▀▀▀▀700+ minutes of Kurzgesagt Soundtracks by Epic Mountain:Spotify:            https://kgs.link/music-spotifySoundcloud:   https://kgs.link/music-soundcloudBandcamp:     https://kgs.link/music-bandcampYoutube:          https://kgs.link/music-youtubeFacebook:       https://kgs.link/music-facebookThe Soundtrack of this video:Soundcloud:   https://bit.ly/3cjYgvWBandcamp:     https://bit.ly/39h7E1C🐦🐧🐤 PATREON BIRD ARMY 🐤🐧🐦▀▀▀▀▀▀▀▀▀▀▀▀▀▀▀▀▀▀▀▀▀▀▀▀▀▀Many Thanks to our wonderful Patreons from http://kgs.link/patreon who support us every month and made this video possible:Dennis Barzanoff, HGING231, Taylor Sutton, Agazzy Kan, Isabelle Sagastume, Richard Larsen, Carini, Arvīds Pelēcis, chrisnov, Anish Weerasooriya, Erik Stafford, Apoorva Chandra, Renee Annan, Alex Cross, Jan Karlík, Alexander Fielding, Lukas Schmidt, André, Jianzhuo Wu, Dina Andrei, Iskandar 323, Promethius84 ., Michael Altherr, Devon Meyer, Honza Tomášek, Da Yi, stephanie santos, Kyrill Abrams, Scott Blechman, Alexandre Valdetaro, Balázs Varju, TheBozzCL, Bufe, Mr_Blu42, Kamil, Scott, Alan Lu, Chris Gardner, Youssef Adib, Sean Markham, R, Severin Klingler, Sebastian, Gurneel Kang, SatanicPanic, ohad shalev, Grayson Gordon, 健樑 黃, Taavi Taijala, Lara Rimassa, Paul Wittau, Sir. Forest, schanuel, Cleo Wong, Mihaela Ciobanu, Tibor, secure taka, GeF, rolf redford, Martin Kärgell, Devyn Phillips, Tiger Darian"
"_c9v0N3RS_4","SE DONS vs REAL GIMA | KENT CUP QUARTER FINAL | 'I'M THE MAN | Sunday League Football","2020-03-01T12:27:59.000Z","UCDS72f-TgUOfYkOzdB17leA","donstrapzytv","24","20.02.03","Se dons|sunday league tackles|sunday league football|arsenal fan tv|longest 90|slash football|baiteze|soccer am|fifa 19|arsenal|manchester united|jimmy bullard|bbc sport|bt sport|sky sports news|sky sports|fa cup|champions league|europa league|premiere league|love island|ian wright|puma football|jadon sancho|mesut ozil|nicholas pepe|aubameyang|liverpool|sadio mane|sergio aguero|lionel messi|ksi|logan paul","114983","5583","59","324","https://i.ytimg.com/vi/_c9v0N3RS_4/default.jpg","False","False","Join us on Patreon:www.patreon.com/sedonsBUY YOUR DØNS MERCH & SE DØNS KIT NOW FROM www.sedons.comSE Dons is the journey of a Sunday League Football Club in South London hosted by UK Rap/Grime Artist Don Strapzy. Follow us on: Instagram @officialdons Twitter @sedonsfc Merch - www.sedons.com"
"TKgoCIaAj-U","HIGHLIGHTS Aston Villa 1-2 Man City | Carabao Cup Final | Agüero, Rodri, Samatta","2020-03-01T21:15:02.000Z","UCkzCjdRMrW2vXLx8mvPVLdQ","Man City","17","20.02.03","man city|manchester city|Aston Villa|highlights|goals|villa 1-2 manc ity|villa 1-2 man city|Sergio Aguero|Rodri|Trophy|Wembley|2020|2019/20 season|Carabao Cup|League Cup","1005961","13559","617","799","https://i.ytimg.com/vi/TKgoCIaAj-U/default.jpg","False","False","CITY SECURE HAT-TRICK OF CARABAO CUP WINSGoals from Sergio Aguero and Rodri secured a third consecutive Carabao Cup final triumph for City as we overcame Aston Villa 2-1 in a pulsating contest at Wembley.Aguero and Rodri both struck in the opening half hour with City in dominant form.But Mbwanna Samatta’s late first half effort gave the Villans a shot in the arm and made for a compelling second half.And it needed a stunning late save from Claudio Bravo, who pushed Bjorn Engels 88th minute header onto a post to maintain our lead.SUBSCRIBE! http://www.youtube.com/subscription_center?add_user=mancityhttp://www.mancity.comhttp://www.facebook.com/mancityhttp://www.twitter.com/mancityhttp://www.instagram.com/mancityhttps://www.snapchat.com/add/mancityofficialAbout the Official Man City YouTube Channel:Here you will find all the latest videos from Manchester City, including, all Premier League goals, highlights, behind-the-scenes footage, training and much more.Get closer to the likes of Sergio Aguero, Kevin De Bruyne, Gabriel Jesus, Raheem Sterling, Riyad Mahrez, Benjamin Mendy and the rest of Pep Guardiola's team."
"VdLCHsgse7U","UFC 248 Countdown: Adesanya vs Romero","2020-03-01T20:00:02.000Z","UCvgfXK4nTYKudb0rFR6noLA","UFC - Ultimate Fighting Championship","17","20.02.03","ufc|248|countdown|israel|adesanya|yoel|romero|segment|preview|show|middleweight|title|championship|promo|behind|the|scenes|training|fight|camp|episode|mma|ultimate fighting championship","940143","16789","455","3306","https://i.ytimg.com/vi/VdLCHsgse7U/default.jpg","False","False","At UFC 248, middleweight champion Israel Adesanya faces the dangerous Yoel Romero.  See these two athletes train and prepare for their upcoming bout on March 7.Subscribe to get all the latest UFC content: http://bit.ly/2uJRzRRExperience UFC live with UFC FIGHT PASS, the digital subscription service of the UFC. Visit https://ufcfightpass.com/To order UFC Pay-Per-Views on ESPN+, visit https://bit.ly/2vNIBE8 (U.S. only)To order UFC Pay-Per-Views, visit http://welcome.ufcfightpass.com/#PPV (Non U.S.)Connect with UFC online and on Social:Website: http://www.ufc.comTwitter: http://www.twitter.com/ufcFacebook: http://www.facebook.com/ufcInstagram: http://www.instagram.com/ufcSnapchat: UFCPeriscope: http://Periscope.tv/ufcConnect with UFC FIGHT PASS on Social:Twitter: http://www.twitter.com/ufcfightpassFacebook: http://www.facebook.com/ufcfightpassInstagram: http://www.instagram.com/ufcfightpass"
"F4Y3Pkn95GI","I Ate A $70,000 Golden Pizza","2020-02-29T21:00:22.000Z","UCX6OQ3DkcsbYNE6H8uQQuVA","MrBeast","24","20.02.03","[none]","12939769","801893","14339","45145","https://i.ytimg.com/vi/F4Y3Pkn95GI/default.jpg","False","False","I cant believe we actually did this...Please vote and help me win a Kids Choice Award (I'm on page 20) https://kca.nick.tv/vote/vote now or ill delete your fortnite accountNew Merch - https://shopmrbeast.com/SUBSCRIBE OR I TAKE YOUR DOG----------------------------------------------------------------follow all of these or i will kick you• Facebook - https://www.facebook.com/MrBeast6000/• Twitter - https://twitter.com/MrBeastYT•  Instagram - https://www.instagram.com/mrbeast--------------------------------------------------------------------"
