video_id,title,publishedAt,channelId,channelTitle,categoryId,trending_date,tags,view_count,likes,dislikes,comment_count,thumbnail_link,comments_disabled,ratings_disabled,description
"xi3c-9qzrPY","Mabel - Boyfriend","2020-02-26T08:00:09.000Z","UCodP65FAmmdVWTaGFD5Qz-Q","MabelVEVO","10","20.02.03","boyfriend|trailer|pop|music|mad|love|dont|call|mable|mebel|maybel|song|lyrics|mabel|boyfriend mabel|mabel boyfriend|boyfriend trailer|mable boyfriend|boyfriend mable|maybel boyfriend|boyfriend maybel|mabel new song|boyfriend premiere|mebel boyfriend|boyfriend mebel|boyfriend official|boyfriend official video|boyfriend music video|boyfriend lyrics","5689857","147332","3885","4017","https://i.ytimg.com/vi/xi3c-9qzrPY/default.jpg","False","False","Mabel - Boyfriend Listen/Download - https://Mabel.lnk.to/BoyfriendID ‘High Expectations’ the debut album is out now! Get it here: https://mabel.lnk.to/HighExpectationsYTBuy exclusive Mabel merch including the 'Boyfriend Tee' - https://mabel.lnk.to/MabelShopIDWatch the complete playlist of Mabel's music videos including 'Don't Call Me Up', 'Mad Love' & 'Finders Keepers' - https://Mabel.lnk.to/MusicVideos Follow Mabel:Subscribe to Mabel's channel on YouTube - https://Mabel.lnk.to/Channel Instagram: https://www.instagram.com/mabel/Twitter: https://twitter.com/MabelFacebook: https://www.facebook.com/mabelmcvey/Sign Up to Mabel's mailing list to be first for news, exclusives and tickets - https://Mabel.lnk.to/SignUpGet tickets to see Mabel on tour: http://www.mabelofficial.com/live 'Boyfriend' Lyrics - Verse 1 I’ve been looking for somebody, tryna kick it with somebody I need a rude boy to tell me something sweet same time got his hands up on my body I wanna get high when he take it low low, make me feel strong when I’m taking control I’ve been looking for my shawty, so come and get it if you got itPre chorusAll my girls round the world I know you know what I mean, I get little sexy when I’m lonely, one thing on my mind, I know what I needAll my girls round the world, hands up and sing it with me coz everything I got you know it’s all me, even though a man ain’t something I needChorus I wanna boyfriend, so put it on meI’m looking for a man who can take that heatWanna boyfriend, but not too sweet, My baby gotta be tough while he running that streetIs he ride or die?I’ve been looking so long for a guy, to turn me on I want a boyfriend, yeh yeh I want a boyfriend, yeh yeh I be looking like, Where you at, where you at ?Where you at, where you at ?Where you at, where you at ?Where you at, where you at ?Verse 2 I need you and me togetherI ain’t looking for forever I had so much stress from my ex to the next Want you better, love me betterI need a bad boy that don’t bring me drama He aint tryna roll when he get the nah nahBoy you ready for the pleasure? And don’t you know its now or never Pre Chorus All my girls round the world I know you know what I mean, I get little sexy when I’m lonely, one thing on my mind I know what I needAll my girls round the world, hands up and sing it with me coz everything I got you know it’s all me, even though a man ain’t something I needChorus I wanna boyfriend, so put it on meI’m looking for a man who can take that heatWanna boyfriend, but not too sweet, My baby gotta be tough while he running that streetIs he ride or die?I’ve been looking so long for a guy, to turn me on I want a boyfriend, yeh yeh I want a boyfriend, yeh yeh I be looking like, Where you at, where you at ?Where you at, where you at ?Where you at, where you at ?Where you at, where you at ?Pre ChorusAll my girls round the world I know you know what I mean, I get little sexy when I’m lonely, one thing on my mind I know what I needAll my girls round the world, hands up and sing it with me coz everything I got you know it’s all me, even though a man ain’t something I needChorusI wanna boyfriend, so put it on meI’m looking for a man who can take that heatWanna boyfriend, but not too sweet, My baby gotta be tough while he running that streetIs he ride or die?I’ve been looking so long for a guy, to turn me on I want a boyfriend, yeh yeh I want a boyfriend, yeh yeh I be looking like, Where you at, where you at ?Where you at, where you at ?Where you at, where you at ?Where you at, where you at ?#Boyfriend #MabelMusic video by Mabel performing Boyfriend. © 2020 Mabel McVey, under exclusive  license to Polydor, a division of Universal Music Operations Limitedhttp://vevo.ly/AuNzvo"
"144D7JoRwms","UNHhhh Ep. 116: Walking Children in Nature Part 2","2020-02-26T20:04:02.000Z","UCUUUpaMp8DV6KUOfQwoIiLg","WOWPresents","24","20.02.03","world of wonder|world of wonder productions|wow report|rupaul's drag race|unh|trixie|katya|tracy|tracy martel|trixie mattel|katya zamo|katya zamolodchikova|season 5|unh season 5|unhhhh|women|nature|outdoors|outside|walking|children|walking children in nature|tammie|tammie brown","625906","29800","467","1857","https://i.ytimg.com/vi/144D7JoRwms/default.jpg","False","False","Trixie & Katya had too much fun outside... they are back for more!These two squirrel-friends fantasize about how they would like to die in nature and what kind of animal they would like to be. Oh and remember that fly that landed on Trixie's mouth? We do too.Follow Trixie on Twitter: @trixiemattelFollow Katya on Twitter: @katya_zamoProduced byPete WilliamsEdited byJeff MaccubbinRon HillCome to RuPaul's DragCon LA, May 1, 2, 3! Learn more and get your tickets here: http://bit.ly/38qllehSubscribe: http://youtube.com/subscription_center?add_user=wowpresentsRead More at: http://worldofwonder.net/From World of Wonder, the producers of films and TV shows such as The Eyes of Tammy Faye, Party Monster, Liberty: Mother of Exiles, Backyard Envy, RuPaul's Drag Race, Werq The World, and Million Dollar Listing. Plus, creators of your favorite live events such as RuPaul's DragCon and RuPaul's Drag Race Live in Las Vegas. Looking to watch this content uncensored before it hits YouTube? Check out our streaming service, WOW Presents Plus."
"XlznhdGuvWg","Trying Relationship Life Hacks","2020-02-26T18:40:35.000Z","UCTSRIY3GLFYIpkR2QwyeklA","Drew Gooden","23","20.02.03","drew gooden|comedy|commentary|reaction|vine|drew gooden vine|road work ahead guy|parody|rant|cringe|life hacks|crafts|5 minutes crafts|couple life hacks|weird","1654747","120778","1768","6123","https://i.ytimg.com/vi/XlznhdGuvWg/default.jpg","False","False","Head to https://www.squarespace.com/drew to save 10% off your first purchase of a website or domain.Today we find out that we are bad at crafts.new 'hey guy' shirts:https://www.drewgoodenshop.com/follow me:twitter - https://www.twitter.com/drewisgoodeninstagram - https://www.instagram.com/drewisgoodenfacebook - https://www.facebook.com/drewisgoodenhttps://www.pictureofhotdog.com/"
"-p3aAn5FOTs","We made a Grandma Famous at London Fashion Week (Featured in Vogue)","2020-02-26T19:08:05.000Z","UCcjx6m03fZwtRBFn1Cf7kKQ","The Zac and Jay Show","24","20.02.03","Zac and Jay|the Zac and Jay show|Zac Alsop|Jamie Rawsthorne|zac alsop|jamie rawsthorne|zac and jay|london fashion week|london fashion week 2019|fake model prank|sneaking into fashion week|fashion week tips|fashion week prank|fake celebrity prank|fake it till you make it|comedy|funny video|funny compilation|fake celebrity|fake celebrity at fashion week|fake paparazzi prank|fake paparazzi|/r/actlikeyoubelong|act like you belong","810686","47595","387","1113","https://i.ytimg.com/vi/-p3aAn5FOTs/default.jpg","False","False","FOLLOW ELICIA - https://www.instagram.com/eliciaverde/?hl=enVogue Article - https://www.vogue.com/vogueworld/slideshow/best-street-style-photos-from-london-fashion-week-fall-2020Follow us on Insta - https://www.instagram.com/zacandjay/ Zac: https://www.instagram.com/zacalsop/Jamie - https://www.instagram.com/jamie_rawsthorne/Follow us on Twitter:Zac:  https://twitter.com/zacalsopp/ Jamie: https://twitter.com/jamierawsthorneElicias acting profile - https://www.mandy.com/talent/profile/elizabeth-ann-iliffeThis episode was co-produced by the wonderful  - https://www.instagram.com/coco.a.anthony/Maximus - https://instagram.com/max.fosh?igshid=1rv3fsxhyxyemGabe - https://www.instagram.com/gabefg/?hl=enMUSIC: 30 DAY FREE TRIAL! http://share.epidemicsound.com/tmP6GHOUSE/DISCO - https://soundcloud.com/just-hugo/hugo-give-me-ur-loveShopping - https://soundcloud.com/gnawdog/spark97Outro - https://soundcloud.com/tobsthehacker/hakuna-jamboAnimations:INSTA/SUBSCRIBE ANIMATION -  https://www.instagram.com/finn.hitchcock/INTRO - https://www.instagram.com/theoconjures/"
"28jynXJ7ZK8","BEST COKE AND MENTOS ROCKET WINS $10,000","2020-02-26T19:37:01.000Z","UCtNBFUsxj2YVbEc5HquzFqg","Carter Sharer","24","20.02.03","[none]","733403","18688","838","1849","https://i.ytimg.com/vi/28jynXJ7ZK8/default.jpg","False","False","🔥GET MERCH NOW!!🔥━► https://www.teamrar.com/ In today's video, Carter Sharer invites Team RAR including Lizzy Capri, Ryan Prunty, and Stove's Kitchen as well as Juggling Josh Horton to an epic coca cola and mentos rocket challenge for a chance to win a grand prize of $10,000 dollars cash money. Carter challenges his friends Lizzy, Ryan, Stove, and Jugglin Josh to see who can create the highest flying soda and mentos rocket for a chance to win $10000. Watch to see who can send their fanta soda coke bottle rocket the highest and win the ten thousand dollar prize and Comment below with what you thought about this epic vlog!Check out my friend Josh's channel!https://www.youtube.com/channel/UCc4JGh0O0_AO0Asj6MAS0-w❇️ MORE EPIC VLOGS ❇️FROM KID TO 6 MILLION SUBSCRIBERS!! (DECADE IN REVIEW)https://youtu.be/l-zxMgpv9ZwLAST TO LEAVE GIANT LEGO HOUSE WINS $10,000https://youtu.be/4VF8q95LLxsBUILDING A HUGE 3 STORY LEGO HOUSE!!https://youtu.be/DldCGsc_f90-----------------------------------------------------------------------------------------------------------Follow Us For a Chance to WIN Some Epic Stuff!📷INSTAGRAM → @CarterSharer https://goo.gl/DkjB5J📘FACEBOOK → CARTER SHARER OFFICIAL https://goo.gl/WM7mBu📷INSTAGRAM → @LizzySharer https://goo.gl/jALBqj📘FACEBOOK → LIZZY SHARER https://goo.gl/AX1d4tSubscribe to my channel! https://goo.gl/XjjCA8-----------------------------------------------------------------------------------------------------------Business Inquiries: carter.integrations@teamrar.comWARNING: This video is only for entertainment purposes. Do not attempt to recreate any of the acts in this video, as they may be dangerous if not done correctly, and could result in serious injury. If you rely on the information portrayed in this video, you assume the responsibility for the results. Have fun, but always think ahead, and remember that every project you try is at YOUR OWN RISK.This footage is property of Dream Team Studios LLC and is not allowed to be repurposed without written consent from Dream Team Studios LLC. For any requests from media contact us at carter.integrations@teamrar.com"
"vbwgDf-xQZ8","DDG - MEET ME IN THE LOBBY (Official Music Video)","2020-02-26T20:00:06.000Z","UC9OAeZY8zp976DwRvHGjuSA","DDGVEVO","10","20.02.03","ddg|queen naija|pontiacmade|sorry 4 the hold up|arguments|pontiac|michigan|rap|run it up|take me serious|DDG YouTube|Lil Baby|Too Much To Lose|Young Rich Black|Accountant|YBN Almighty Jay|YBN Nahmir|YBN Cordae|BlocBoy JB|Jay Critch|VALEDICTORIAN|meet me in the lobby|DDG|DDG/Epic Records|Hip Hop|MEET ME IN THE LOBBY","848458","66684","1655","7894","https://i.ytimg.com/vi/vbwgDf-xQZ8/default.jpg","False","False","VALEDICTORIAN available at: https://smarturl.it/VALEDICTORIAN.DDGFollow DDG:https://twitter.com/pontiacmadeddg https://www.facebook.com/Pontiacmadeddg/ https://www.instagram.com/pontiacmadeddg https://soundcloud.com/pontiacmadeddg https://www.youtube.com/channel/UCKqqDlf6lfo3ChRA4-gzusQ(C) 2020 DDG Entertainment, Inc., under exclusive license to Epic Records, a division of Sony Music Entertainmenthttp://vevo.ly/hfUd6O"
"BcqaQzZ3T-8","Firefox will save us.","2020-02-27T03:25:27.000Z","UCeeFfhMcJa1kjtfZAGskOCA","TechLinked","28","20.02.03","Techlinked|netlinked|Linus|Firefox|DNS over HTTPS|DNS|doH|encryption|privacy|security|Cloudflare|Firefox DNS|Firefox encryption|safest browser|safest web browser","557397","29479","565","1501","https://i.ytimg.com/vi/BcqaQzZ3T-8/default.jpg","False","False","Get an unrestricted 30-day free trial of FreshBooks at https://freshbooks.com/techlinkedGET MERCH: http://www.LTTStore.comTwitter: http://twitter.com/TechLinkedYTInstagram: http://instagram.com/TechLinkedYTFacebook: http://facebook.com/TechLinkedNEWS SOURCES:THIS FOX IS ON FIRE, BOIIIIIIFirefox encrypts DNS requests by defaulthttps://www.techradar.com/news/firefox-rolls-out-encrypted-dns-over-https-by-defaulthttps://mobilesyrup.com/2020/02/25/firefox-dns-https-support-isps-tracks/https://www.laptopmag.com/news/firefox-will-protect-your-browsing-history-with-new-encryption-and-isps-are-pissedhttps://www.theverge.com/tech/2020/2/26/21153525/firefox-dns-encryption-amazon-go-browsing-shopping-privacyREAD: “FREE GAMES”GOG adds 30-day refund windowhttps://www.pcgamer.com/gogs-new-refund-policy-is-way-more-generous-than-steams/https://www.pcgamesn.com/gog-refundshttps://www.extremetech.com/gaming/306638-gog-launches-expansive-new-refund-policy-asks-customers-not-to-abuse-itplz be nice thohttps://arstechnica.com/gaming/2020/02/gog-asks-you-to-please-not-abuse-its-expansive-new-30-day-refund-policy/PHOTOGRAPHIC MEMORYXbox Series X can resume games after reboot, have “ray traced audio”https://www.gamerevolution.com/news/635596-xbox-series-x-quick-resume-after-system-updatehttps://www.windowscentral.com/xbox-series-x-features-custom-built-ssd-audio-ray-tracing-and-restart-save-stateshttps://www.techzimo.com/microsofts-xbox-series-x-will-be-able-to-resume-games-even-after-a-reboothttps://majornelson.com/podcast/647-what-you-can-expect-from-the-next-generation-of-gaming/QUICK BITSA COSMOS OF UNNECESSARY CHOICESNew confusing HTC Cosmos lineuphttps://www.anandtech.com/show/15541/htc-expands-vive-cosmos-vr-family-elite-xr-playhttps://youtu.be/xYEVcptQ33Ehttps://www.engadget.com/2020/02/24/htc-vive-cosmos-elite-pre-order/VIEW WAS A BIT TOO CLEARClearview had their client list stolenhttps://www.cnn.com/2020/02/26/tech/clearview-ai-hack/index.htmlhttps://www.vox.com/recode/2020/2/26/21154606/clearview-ai-data-breachhttps://www.axios.com/report-full-list-of-clearview-ais-law-enforcement-clients-stolen-6de9225f-f403-4ab4-930f-50d074cc17b9.htmlVERSATILITY, WHAT’S THAT?Cool new Sony phone(s)https://www.androidpolice.com/2020/02/25/sony-xperia-1-ii-10-ii-5g-headphone-jack-triple-camera/SOMEHOW HE KNOWSGood ol’ Ming-Chi Kuo doin’ his thing, first ARM-powered Mac in 2021https://www.kitguru.net/channel/generaltech/matthew-wilson/apple-expected-to-release-first-arm-powered-mac-in-2021/“HEY! STOP VAPING ME!”Juul could help people quit nicotine WITH AIhttps://www.digitaltrends.com/news/juul-ai-powered-vape-to-quit-nicotine-patent/https://techthelead.com/juul-ai-vape-could-help-you-quit-nicotine/"
"coR5NB6PCtQ","Star Wars Battlefront 2: The Age of Rebellion – Community Update","2020-02-26T11:00:18.000Z","UCOsVSkmXD1tc6uiJ2hc0wYQ","EA Star Wars","20","20.02.03","Star Wars|Star Wars Battlefront|Star Wars Battlefront II|Star Wars multiplayer|Battlefront|Battlefront 2|Coop|Ewok|ISB agent|Original Era|A New Hope|Empire Strikes Back|Return of the Jedi|Age of Rebellion|Ewok gameplay|ISB agent gameplay|Battlefront 2 2020|Star Wars offline|Star Wars single player|Darth Vader|Luke Skywalker|Celebration Edition|EA Star Wars|DICE|Dennis Brännvall|Dennis Brannvall","1253624","66910","999","7064","https://i.ytimg.com/vi/coR5NB6PCtQ/default.jpg","False","False","Return to the era that started it all with the Ewok and ISB agent in Star Wars Battlefront II – in the next free content update coming February 26! Play Co-Op throughout classic locations including the ominous Death Star II and the dusty alleyways of Mos Eisley, equip and modify new weapons, and more.Full details on the update here: http://x.ea.com/62663Buy or upgrade to the Star Wars Battlefront II: Celebration Edition now: https://www.ea.com/games/starwars/battlefront/star-wars-battlefront-2/buyFollow EA Star Wars on social: Twitter: https://twitter.com/EAStarWars  Instagram: https://www.instagram.com/eastarwars/  Facebook: https://www.facebook.com/EAStarWars/"
"A2qA5fMpZAk","Stephen A. reacts to Deontay Wilder blaming his costume for loss to Tyson Fury | First Take","2020-02-25T16:45:01.000Z","UCiWLfSweyRNmLpgEHekhoAg","ESPN","17","20.02.03","stephen a smith|stephen a|deontay wilder|deontay wilder vs tyson fury 2|deontay wilder vs tyson fury|tyson fury vs deontay wilder 2|tyson fury vs deontay wilder|wilder vs fury|fury vs wilder 2|fury vs wilder|wilder|wilder fury|fury wilder|deontay wilder espn|tyson fury espn|stephen a smith deontay wilder|espn|stephen a smith tyson fury|max kellerman boxing|first take deontay wilder|first take espn|first take today|first take|deontay wilder entrance","2943929","38443","1909","11753","https://i.ytimg.com/vi/A2qA5fMpZAk/default.jpg","False","False","Stephen A. Smith and Max Kellerman react to Deontay Wilder blaming his loss to Tyson Fury on his 40-pound pre-fight costume.✔ Subscribe to ESPN+ https://plus.espn.com/✔ Get the ESPN App: http://www.espn.com/espn/apps/espn✔ Subscribe to ESPN on YouTube: http://es.pn/SUBSCRIBEtoYOUTUBE✔ Subscribe to ESPN FC on YouTube: http://bit.ly/SUBSCRIBEtoESPNFC✔ Subscribe to NBA on ESPN on YouTube: http://bit.ly/SUBSCRIBEtoNBAonESPN✔ Watch ESPN on YouTube TV: http://es.pn/YouTubeTVExclusive interviews with Rachel Nichols https://urlzs.com/jNUReStephen A. Smith on ESPN https://urlzs.com/W19TzESPN on Social Media:► Follow on Twitter: http://www.twitter.com/espn► Like on Facebook: http://www.facebook.com/espn► Follow on Instagram: www.instagram.com/f/espnVisit ESPN on YouTube to get up-to-the-minute sports news coverage, scores, highlights and commentary for NFL, NHL, MLB, NBA, College Football, NCAA Basketball, soccer and more. More on ESPN.com: https://www.espn.com"
"n8IypLpjhFw","Sewing a Suit for my Wedding","2020-02-25T19:18:07.000Z","UC0CG8Kj2DqFc9bJld0hJKBA","Ryland Adams","24","20.02.03","Ryland Adams|Morgan Adams|Shane Dawson|Andrew siwicki|Clothing|Wedding|Sewing|Haul|DIY|Funny Fails","2536552","158868","1662","13207","https://i.ytimg.com/vi/n8IypLpjhFw/default.jpg","False","False","Subscribe to Morgan https://www.youtube.com/channel/UCSfLUmBHOLoL0uHcxhRCwFwSubscribe to Shane https://www.youtube.com/user/shane/vi... Follow Andrew https://www.instagram.com/andrewsiwicki/I finally have merch!! https://www.amazon.com/rylandadamsWATCH MY LAST VIDEO: https://www.youtube.com/watch?v=tBxTXxPj9YU https://youtu.be/tBxTXxPj9YUADD ME ON:INSTAGRAM: https://www.instagram.com/rylandadams...TWITTER: https://twitter.com/ryland_adams?lang=enSNAPCHAT: @rylandadamsspark effect created by MultiVerse Studio https://www.youtube.com/watch?v=47HhkkVgbCU"
"bFpYddFzt_I","Peshawar Zalmi vs Multan Sultans | Full Match Instant Highlights | Match 8 | 26 Feb | HBL PSL 2020","2020-02-26T19:28:32.000Z","UCpNzXJ5jpcJojC5mHQvGA8w","Pakistan Super League","17","20.02.03","PSL|PSLT20|Pakistan Super League|T20|PCB|PSL Live|PSL Highlights|PSL Official|Cricket|Pakistan Cricket|PSL 2020|PSL 5|Multan|Sultans|Multan Sultans|Peshawar|Zalmi|Peshawar Zalmi|Multan Sultans vs Peshawar Zalmi|Highlights|1st Inning|1st Inning Highlights|Match 8|26 Feb 2020|HBL PSL 2020|Multan Sultans vs Peshawar Zalmi Highlights|2nd Inning Highlights|Match 8 | 26 Feb 2020|Full Match|Full Match Instant|Instant Highlights","1580011","19711","1222","582","https://i.ytimg.com/vi/bFpYddFzt_I/default.jpg","False","False","Peshawar Zalmi vs Multan Sultans | Full Match Instant Highlights | Match 8 | 26 Feb | HBL PSL 2020Subscribe to Official HBL Pakistan Super League Channel and stay updated with the latest happenings. http://bit.ly/PakistanSuperLeagueOfficial#HBLPSLV #HBLPSL2020Cricket fans from around the world are excited about the Fifth edition of the HBL Pakistan Super League. Competition is heating up among fans as their favorite HBL Pakistan Super League teams take on each other in the lucrative cricket extravaganza which includes leading Pakistan national cricketers, established international players, and emerging players in each of the team’s Playing XI."
"wzXcTplqROQ","Planning the HOUSE UPGRADE!","2020-02-25T19:22:58.000Z","UCFYs3KYHDPoZfwGv0A4sYGQ","Life of Tom","22","20.02.03","life of tom|lifeoftom|tom syndicate|syndicate|syndicate vlog|vlogger|daily vlog|uk vlogger|tom cassell|adventure|travel|exploration","202621","6367","170","506","https://i.ytimg.com/vi/wzXcTplqROQ/default.jpg","False","False","I invited 100 random people into my Minecraft World.. (Here’s what happened) Check out the video here: https://youtu.be/b7dgyrm9CCo ● Click SUBSCRIBE to see more of my Videos 😀Don’t forget to click that LIKE button! 👍‎I upload new videos everyday at 7pm GMT, so see you again tomorrow! :) Grab yourself a Syndicate Shirt! ► http://www.syndicateoriginal.com/‎‎Send me something! ‎Tom Syndicate PO Box 418 ‎HYDE SK14 9DN‎My Socials‎● My Twitter ► ⁦‪https://twitter.com/ProSyndicate‎● My Instagram ► http://instagram.com/syndicate‎● My Facebook ► ⁦‪https://www.facebook.com/LifeOfTom‎● My Snapchat ► ItsSyndicate‎● My Gaming Channel ► https://www.youtube.com/Syndicate‎‎Want to upgrade your gaming equipment?‎Check out Razer ► ⁦‪http://rzr.to/lifeoftom‎‎Syndicate Original Clothing‎● Shop: ⁦‪http://www.syndicateoriginal.com‎● Twitter: https://twitter.com/SyndicateOG‎● Facebook: ⁦‪ ⁦‪https://www.facebook.com/SyndicateOG‎Thank you so much for watching, I hope you enjoyed the video!"
"mqqAv8Qtgfo","Having a Tall Girlfriend (Part 2) | Anwar Jibawi","2020-02-25T16:59:29.000Z","UCEr55381WIqO1w_IzgcI5DQ","Anwar Jibawi","23","20.02.03","[none]","1545670","56892","1169","1968","https://i.ytimg.com/vi/mqqAv8Qtgfo/default.jpg","False","False","Watch Having a Tall Girlfriend (Part 1) ► https://youtu.be/ZN9RaGnunwkWATCH MORE ► https://youtube.com/playlist?list=PLbNDd5uPifopbYqGU2CX7_DNdQFutazzbSUBSCRIBE ► https://youtube.com/channel/UCEr55381WIqO1w_IzgcI5DQ?sub_confirmation=1-----------------------------------------------------------FIND ME ON: Instagram | http://instagram.com/anwarTwitter | http://twitter.com/anwarFacebook | https://facebook.com/anwarTikTok | https://vm.tiktok.com/XjFcDpMerch | https://lilshop.comText Me | https://my.community.com/anwarjibawiCAST:Anwar Jibawi | http://youtube.com/c/anwarStephanie Jean Heiner | https://instagram.com/stephjheiner WE HIT 500 VIDEOS WITH OVER 1 MILLION VIEWS ▶ https://youtu.be/VOzQW_fff5AShots Studios Channels:@Anwar Jibawi @Awkward Puppets @Benny the Bee @Delaney Glazer @Hannah Stocking @Juanpa Zurita Comedy @Lele Pons @Rudy Mancuso @Shots Vlog Channel #Anwar#AnwarJibawi"
"4l5i53fDpzo","Pastry Chef Attempts to Make Gourmet Combos | Bon Appétit","2020-02-25T17:00:06.000Z","UCbpMy0Fg74eXXkvxJrtEn3w","Bon Appétit","26","20.02.03","claire saffitz|pastry chef|combos|claire makes|claire|gourmet makes|claire bon appetit|claire gourmet makes|claire makes combos|claire combos|combos recipe|make combos|making combos|how to combos|how to make combos|gourmet combos|diy combos|homemade combos|combos bon appetit|make combos at home|how combos are made|combos snack|combos food|combos snacks|what are combos|bon appetit combos|claire saffitz combos|food|bon appetit","2309903","61868","736","5738","https://i.ytimg.com/vi/4l5i53fDpzo/default.jpg","False","False","While we have a list of ingredients, nobody really knows how Combos are made. There is little to no information about Combos on the internet, which begs the question: what are they hiding? But not to worry, pastry chef Claire Saffitz is on the case! Join her as she attempts to unpack this mystery and make gourmet Combos!Check out Claire's Instagram: https://www.instagram.com/csaffitz/Want Bon Appétit shirts, hats and more? https://shop.bonappetit.com/?utm_source=youtube&utm_brand=ba&utm_campaign=aud-dev&utm_medium=video&utm_content=merch-shop-promoStill haven’t subscribed to Bon Appétit on YouTube? ►► http://bit.ly/1TLeyPnWant more Bon Appétit in your life? Subscribe to the magazine and score a free tote! http://bit.ly/2n0gbmuABOUT BON APPÉTITBon Appétit is a highly opinionated food brand that wants everyone to love cooking and eating as much as we do. We believe in seasonal produce, properly salted pasta water, and developing recipes that anyone can make at home. Pastry Chef Attempts to Make Gourmet Combos | Bon Appétit"
