video_id,title,publishedAt,channelId,channelTitle,categoryId,trending_date,tags,view_count,likes,dislikes,comment_count,thumbnail_link,comments_disabled,ratings_disabled,description
"vPGgwMv6f1Y","🎮FIFA 20 TOTY - The Selection!🎮 (Team of the Year 2019 Parody Reveal Trailer)","2020-01-07T17:24:56.000Z","UC4SUUloEcrgjsxbmy_rQQXA","442oons","17","20.12.01","funny|lol|parody|football|spoof|comedy|premier|league|soccer|442oons|animation|cartoons|scores|games|cartoon|goals|highlights|footy|EPL|BPL|goal|vs|44200NS|4-4-2oons|44toons|fifa|fifa20|ea sports|team of the year|team|toty|2019|2020|messi|ronaldo|lewandowski|liverpool|van dijk|trailer|teaser|reveal|fifa 20","736304","28586","480","2461","https://i.ytimg.com/vi/vPGgwMv6f1Y/default.jpg","False","False","✋Please note: these shitty cartoons are not made for kids in any way. They contain profanity, cartoon violence and non-child themes✋ ⚽️ Subscribe to 442oons: http://bit.ly/442oonsSUB ⚽️👕New Merch! 442oons T-Shirts+Phone Cases👕👉🏻https://teespring.com/stores/442oons⚽️⬅️🏃‍♂️442oons Football Runner!⚽️⬅️🏃‍♂️Download free now ios👉🏻http://bit.ly/442RUNappDownload free now android👉🏻http://bit.ly/442RUNand442oons Footballer Manager App👉🏻https://bnc.lt/xzHc/aMIpiA9ioN ⭐Celebrity Cartoons👉🏻http://bit.ly/Celebri2oons ⭐Don't forget to like, comment on and share the vids! I reply to as many as I can. Thanks for watching!THIS IS A PARODY. ALL CHARACTERS ARE FICTIONAL CARICATURESFor non-You Tube short videos, sneak previews, pictures, behind the scenes, polls, fan choices, updates and more, follow me on: ▶️http://facebook.com/442oons ▶️http://instagram.com/442oons▶️http://twitter.com/442oons▶️442oons@gmail.com442oons was created by me... Dean Stobbart! I do the voices/scripts/ideas/directing/editing/characters blah blah blah ... and now I've got four animators doing all the hard work, the animation...Bravo Sam Dunscombe, Mike Myler, James Williams and Karl Hargreaves (Karl does the art these days ... which is why it looks better)Help us caption & translate this video!https://amara.org/v/CZdPd/"
"5wXviygwdBE","MY FIRST AMERICAN MAGAZINE COVER","2020-01-07T21:00:05.000Z","UC78cxCAcp7JfQPgKxYdyGrg","emma chamberlain","24","20.12.01","emma chamberlain|emma chambie|vlog|magazine cover|photoshoot|cosmopolitan|magazine","2412729","142423","2028","3808","https://i.ytimg.com/vi/5wXviygwdBE/default.jpg","False","False","COVER REVEAL: https://youtu.be/2QKt8fAnGPoEXPENSIVE TASTE TEST: https://youtu.be/6ohVydvxUvE✩ CHECK OUT CHAMBERLAIN COFFEE ✩✭ website: https://www.chamberlaincoffee.com ✭ instagram: https://www.instagram.com/chamberlaincoffee✩ MY SOCIAL MEDIA ✩✭ instagram: https://www.instagram.com/emmachamberlain✭ twitter: https://twitter.com/emmachamberlain✭ tik tok (lol): emmachamberlain✭ snapchat: https://www.snapchat.com/emmachambie✭ spotify: http://open.spotify.com/user/emmachambie ✩ MERCH ✩✭  https://shopemmachamberlain.com✩ MY PODCAST ✩✭ listen on SPOTIFY: https://bit.ly/StupidGeniusShow✭ listen on APPLE PODCASTS: https://bit.ly/StupidGeniusPod✭ or just search Stupid Genius on spotify, apple podcasts, or wherever else you get your podcasts...I LUV U,-emma chamberlain"
"XkeU8w2Y-2Y","Test","2020-01-02T22:44:53.000Z","UCAVojJ1k03GZzjSbdXXunkw","ShaneGlossin","22","20.12.01","[none]","3145659","333180","10528","12975","https://i.ytimg.com/vi/XkeU8w2Y-2Y/default.jpg","False","False","Test upload"
"FVy_siAKyV8","WELCOME TO THE HYPE HOUSE","2020-01-07T21:42:48.000Z","UCfjFQY3M_nQjFTohDMDahFg","The Hype House","22","20.12.01","[none]","733938","40204","6585","3410","https://i.ytimg.com/vi/FVy_siAKyV8/default.jpg","False","False","Welcome to the Hype House! We want to thank all of you for your questions and comments from instagram. We will try to answer any further questions you have in the comments. Follow us:Instagram: https://www.instagram.com/thehypehousela/Tik Tok: https://www.tiktok.com/@thehypehouseMembers Instagram:Alex Warren: https://www.instagram.com/alexwaarren/Patrick Huston: https://www.instagram.com/patrickhuston/Kouvr Annon: https://www.instagram.com/k0uvr/Connor Yates: https://www.instagram.com/connoryates/Calvin Goldby: https://www.instagram.com/calvingoldby/Ryland Storms: https://www.instagram.com/rylandstorms/Tony Lopez: https://www.instagram.com/lopez_tony/Wyatt Xavier: https://www.instagram.com/wyattxavier/Hootie Hurley: https://www.instagram.com/hootiehurley/Jack Wright: https://www.instagram.com/jack.wright21/Addison Sterling: https://www.instagram.com/addisoneasterling/Dixie D'Amelio: https://www.instagram.com/dixiedamelio/Avani: https://www.instagram.com/avaannii/Ondreaz Lopez: https://www.instagram.com/ondreazlopez/Daisy Keech: https://www.instagram.com/daisykeech/Chase Hudson: https://www.instagram.com/lilhuddy/Nick Austin: https://www.instagram.com/nickaustin/James Wright: https://www.instagram.com/james.wright/Thomas Petrou: https://www.instagram.com/petroutv/Charli D'Amelio: https://www.instagram.com/charlidamelio/"
"jraxu22cHy4","Clinton Morrison, Rhys James and S-X take on Soccer AM Pro AM!","2020-01-07T18:00:09.000Z","UCE97AW7eR8VVbVPBy4cCLKg","Soccer AM","17","20.12.01","Soccer AM|Football|Soccer|Premier League|Sky Sports|SoccerAM|Clinton Morrison|Rhys James|S-X|Soccer AM Pro AM|Soccer AM Pro AM Fail|Clinton Morrison missed penalty|S-X goal|Goals|Football goals|Football Funnies|Top Bins|Free Kick|Goalkeeper Save|Soccer AM Goalkeeper Save|Soccer AM Best Bits|Soccer AM Funny|Jimmy Bullard Funny|soccer am pro am|rhys james soccer am|producer sx|s-x|producer s-x|soccer am football|soccer am goal","396773","7245","159","520","https://i.ytimg.com/vi/jraxu22cHy4/default.jpg","False","False","SUBSCRIBE ► http://bit.ly/SoccerAMSubClinton Morrison, Rhys James and S-X take on Soccer AM Pro AM to win money for the Tranmere Rovers fans. ►PODCAST: http://bit.ly/SoccerAMPodcast►FACEBOOK: http://www.facebook.com/SoccerAM►SNAPCHAT:  'SoccerAM'►INSTAGRAM: http://www.instagram.com/SoccerAM►TWITTER: https://www.twitter.com/SoccerAMMORE FROM SKY SPORTS ON YOUTUBE:►SKY SPORTS FOOTBALL: http://bit.ly/SSFootballSub►SKY SPORTS BOXING: http://bit.ly/SSBoxingSub►SOCCER AM: http://bit.ly/SoccerAMSub►SKY SPORTS F1: http://bit.ly/SubscribeSkyF1"
"-7LYis_XC4E","sony's lead graphic designer coming up with the PS5 logo","2020-01-07T03:15:37.000Z","UC9f5yLRPzU7304CtoYN_zDQ","Chris Trenary","23","20.12.01","playstation|ps5|sony|meme|ps4|ces|sonyces|dora|we did it","667991","35218","631","1351","https://i.ytimg.com/vi/-7LYis_XC4E/default.jpg","False","False","they've done it again guysFOR THE RECORD: I'm totally fine with the logo, it's just funny to me that at Sony's conference it was pretty much the only new thing revealed, and it's basically exactly what everyone was expecting anyway lolthis was originally on my twitter: https://twitter.com/bagel_chris/status/1214366684695465984?s=20#Playstation #PS5 #Sony"
"sdYb8-7sbuw","You're In Shrek's Swamp ASMR","2020-01-07T20:00:58.000Z","UCE6acMV3m35znLcf0JGNn7Q","Gibi ASMR","22","20.12.01","gibi|shrek|swamp|onion|meme|donkey|farquaad|faarquad|farquad|fiona|funny|asmr","658149","43321","1897","11231","https://i.ytimg.com/vi/sdYb8-7sbuw/default.jpg","False","False","Dedicated to Ace, and to all of y'all who donated to get to this ridiculous charity stream goal. I hope you're happy. Never ask me for anything again. (Just kidding this was really fun to make, albeit way too involved for what it is LOL). NOW GET OUT OF MY SWAMPThis was the $10,000 stretch goal reward, all proceeds going to CURE Epilepsy. Check them out! We ended up raising $75,000 for them which still blows my mind. https://www.cureepilepsy.org/🎵I’m now on Spotify! Listen while your phone is off :) https://open.spotify.com/artist/56r9ccCkwBCSDHIYviwhcvI'm also on APPLE MUSIC HECK YEAH!https://itunes.apple.com/us/artist/gibi-asmr/1373500921-----------------------------------------------------------------------------------------My upload schedule:►Every Tuesday►Every Thursday►Every Saturday------------------------------------------------------------------------------------------I donate regularly to The Brain and Behavior Research Foundation. I highly recommend it! They give grants to scientists who do studies to better understand and treat mental illnesses.(http://bbrfoundation.org/)------------------------------------------------------------------------------------------Find me on the internet!►DOWNLOAD ZEES - our ASMR App: https://CatchSomeZees.com►Get ZEES Sleepphones + More! https://zees.merchforall.com/►TWITCH/LIVESTREAMING: https://www.twitch.tv/gggibi►TWITTER: https://www.twitter.com/GibiOfficial (I use this the most)►INSTAGRAM: https://www.instagram.com/GibiOfficial►MERCH/SHOP: https://gibi.merchforall.com/►GAMING/SECOND CHANNEL: https://goo.gl/a75KLT------------------------------------------------------------------------------------------OUTRO by https://twitter.com/FlashJomm :)This video was edited by Shawn, my full-time editor! Give him some love: https://twitter.com/MrTheVestman"
"Sp14hVR4_Ok","Safiya & Tyler's Wedding Highlight Film","2020-01-07T22:48:11.000Z","UCc6BTuuTzfMLKj_RgwuDnQw","Tyler Williams","22","20.12.01","safiya and tyler's wedding highlight film|wedding highlights|safiya & tyler's wedding|safiya and tyler|safiya and tyler wedding|safiya wedding|safiya nygaard|tyler williams|safiya nygaard dress|safiya wedding dress|safiya wedding cake|tyler wedding|tyler|safia","1209388","120419","422","3945","https://i.ytimg.com/vi/Sp14hVR4_Ok/default.jpg","False","False","Hello! As some of you guys may know, we got married this past November! Here is a highlight reel of our wedding as some bonus content, shot & edited by Amari Productions!You can check out our full wedding vlog here! https://www.youtube.com/watch?v=HDntl7yzzVIYou can check out Amari Productions behind the scenes video here!https://youtu.be/5YI7dJy3AvkWEDDING DETAILS:PLANNER: So Smitten Special Eventshttps://www.instagram.com/sosmittenevents/VIDEO: Amari Productions https://www.youtube.com/channel/UCBv9z_forbv8IygLm1UjFvADRESS: Odylyne The Ceremony https://www.instagram.com/odylynetheceremony/HAIR: Kayley Melissahttps://www.youtube.com/user/LetsMakeitUp1MAKEUP: Yukina Mitsuhashihttps://www.instagram.com/makeupbyyukina/PHOTO: Love Tribe Weddingshttps://www.instagram.com/lovetribeweddings/FLORALS: GingerSnap Floralshttps://www.instagram.com/gingersnapflorals/VENUE: Carondelet Househttps://www.instagram.com/carondelethouse/PHOTOBOOTH: Paper Moon Shoppehttps://www.instagram.com/papermoonshoppe/NAILS: Simply Nailogicalhttps://www.youtube.com/user/simplynailogicalBRIDESMAIDS DRESSES: BHLDNhttps://www.bhldn.com/TUXEDOS: The Black Tuxhttps://theblacktux.com/BRIDESMAIDS HAIR & MAKEUP: Meg O’Hare Beautyhttps://www.instagram.com/megoharebeauty/CATERING: Très LAhttps://www.tresla.com/RENTALS: MTB Event Rentalshttps://www.mtbeventrentals.com/Music via Music BedMusic License: MB01LBOQL28PO1P"
"oV-jml4jRQs","Boris Johnson's first Prime Minister's Questions since election victory, watch it again in full","2020-01-08T12:51:38.000Z","UCPgLNge0xqQHWM5B5EFH9Cg","The Telegraph","25","20.12.01","[none]","66435","497","77","122","https://i.ytimg.com/vi/oV-jml4jRQs/default.jpg","False","False","Boris Johnson returns to Parliament to face questions from MPs for the first time since the general election victory. He is expected to face questions regarding the upcoming Brexit deal negotiations and the tensions in the Middle EastFor more context and updates in UK politics read our live blog: https://www.telegraph.co.uk/politics/2020/01/08/brexit-news-latest-labour-party-leadership-long-bailey/?WT.mc_id=tmg_youtube_offsite_televideo-youtubevideo&utm_source=tmgoff&utm_medium=tmg_youtube&utm_content=offsite_televideo&utm_campaign=tmg_youtube_offsite_televideo-youtubevideoTelegraph.co.uk and YouTube.com/TelegraphTV are websites of The Telegraph, the UK's best-selling quality daily newspaper providing news and analysis on UK and world events, business, sport, lifestyle and culture."
"of-F44HGa2k","Honest Trailers | Every Quentin Tarantino Movie","2020-01-07T18:00:10.000Z","UCOpcACMWblDls9Z6GERVi1A","Screen Junkies","1","20.12.01","screenjunkies|screen junkies|honest trailers|honest trailer|quentin taratino|tarantino|tarantino movies|honest trailers tarantino|honest trailers quentin|quentin tarantino golden globes|golden globes 2020|tarantino trailer|tarantino review|pulp fiction|once upon a time in hollywood|quentin tarantino golden globes 2020","1201730","42543","835","3227","https://i.ytimg.com/vi/of-F44HGa2k/default.jpg","False","False","►►Find out How to Watch 'Never Surrender' Our Galaxy Quest Documentary at This Link►►https://www.journeyman.tv/film/7688/never-surrender►►iTunes Link►►https://itunes.apple.com/us/movie/never-surrender-a-galaxy-quest-documentary/id1486843892?mt=6&ign-mpt=uo%3D4►►Amazon Link►►https://www.amazon.com/gp/video/detail/B08175LBM1►►Google Play Link►►https://play.google.com/store/movies/details?id=3tPdBD7QwiA.P►►Vimeo Link►►https://vimeo.com/ondemand/neversurrenderdoc?ref=tw-sharePresented by Fandom►►Subscribe to ScreenJunkies!►► https://fandom.link/SJSubscribeHonest Trailers | Every Quentin Tarantino MovieVoice Narration: Jon Bailey aka Epic Voice GuyWritten by: Spencer Gilbert, Joe Starr, Dan Murrell, Danielle Radford & Lon HarrisProduced by: Spencer Gilbert, Joe Starr, Dan Murrell, & Max DionneEdited by: Randy Whitlock & Kevin WilliamsenFoot song by Matt citron Vocals: Annie Worden and Matt CitronPost-Production Supervisor: Emin BassavandProduction Coordinator: Ryan OToole#HonestTrailers"
"nwE_BsjBSUw","Lil Uzi Vert - Futsal Shuffle 2020 [Official Music Video]","2020-01-06T23:30:01.000Z","UCqwxMqUcL-XC3D9-fTP93Mg","LIL UZI VERT","10","20.12.01","Lil|Uzi|Vert|Lil Uzi Vert|lil uzi|lil uzi vert|lil uzi vert futsal shuffle 2020|lil uzi futsal shuffle 2020|futsal shuffle 2020|futsal shuffle|lil uzi futsal shuffle|lil uzi 2020|lil uzi futsal|lil uzi futbal shuffle|luv is rage|luve is rage 2|the way life goes|l.u.v.|luv|sanguine paradise|you was right|ps and qs|xo tour life|xo tour llif3|money longer","7113913","506281","9597","37828","https://i.ytimg.com/vi/nwE_BsjBSUw/default.jpg","False","False","Lil Uzi Vert - Futsal Shuffle 2020Download/Stream: https://Uzi.lnk.to/FutsalShuffle2020Connect with Lil Uzi Vert:https://twitter.com/LILUZIVERThttps://www.instagram.com/liluzivert/https://www.facebook.com/LilUziVert/https://www.youtube.com/user/LILUZIVERThttp://liluziofficial.com/Director: Jay WenetaVideo Commissioner: Joseph BoydProducers: Jonathan Coria, Robin Day, Brien JustinianoProd Co: FREENJOY and Streets Ahead Productions"
"uxN5hTyfKOY","Gunners Survive Leeds Threat with Nelson on Target | Arsenal 1-0 Leeds  | Emirates FA Cup 19/20","2020-01-07T12:01:39.000Z","UCChcWqwYXCEs657MQ00qVWA","The Emirates FA Cup","17","20.12.01","arsenal vs leeds|arsenal vs leeds highlights|arsenal highlights|leeds highlights|arsenal vs leeds fa cup|fa cup highlights|fa cup third round highlights|reiss nelson|nelson goal|reiss nelson goal vs leeds|fa cup|emirates fa cup|jack harrison|luke ayling|kelvin phillips|alexandre lacazette|mesut ozil|sp:ty=high|sp:dt=2020-01-06T19:56:00Z|sp:st=soccer|sp:li=eng_fa_cup|sp:ti:home=ARS|sp:ti:away=LUFC|bournemouth vs arsenal|arsenal fa cup|leeds united fa cup","655847","3071","187","347","https://i.ytimg.com/vi/uxN5hTyfKOY/default.jpg","False","False","Arsenal faced early pressure from a determined Leeds United side in the first half, but withheld the threat and forced a breakthrough from youngster Reiss Nelson in the second half. Follow @EmiratesFACup on Twitter for in-game highlights and match updates!         Subscribe: https://www.youtube.com/thefacup        To find out more about The FA Cup visit: http://thefa.com/TheEmiratesFACup        The FA Cup on Facebook http://www.facebook.com/TheFACup"
"W-mE0KZnzyc","SAVAGE! Ricky Gervais roasts Hollywood in Golden Globes monologue","2020-01-06T06:50:58.000Z","UCXM_e6csB_0LWNLhRqrhAxg","On Demand Entertainment","24","20.12.01","ricky gervais|golden globes|ricky gervais golden globes|golden globe awards|all jokes|tom hanks|ricky gervais funniest moments|ricky gervais oscars|golden globes 2020|golden globes ricky gervais|ricky gervais golden globes 2020|golden globes 2020 ricky gervais|news today|ricky gervais roast|savage moments|ricky gervais golden globes monologue|ricky gervais monologue|ricky gervais 2020|ricky gervais opening monologue 2020|ricky gervais funny moments","2717821","65597","1232","5967","https://i.ytimg.com/vi/W-mE0KZnzyc/default.jpg","False","False","CREDIT: Golden Globe® Awards clips provided by the Hollywood Foreign Press Association and DCP Rights, LLC*Please note: We are only allowed to show one minute in total of the ceremony*Ricky Gervais warned the audience at the Golden Globes that he was going to be as mean as he's always been as host, but not to take it too hard.Remember, they're just jokes, Gervais said to open the 77th annual Golden Globe Awards in Beverly Hills. We're all going to die soon. And there's no sequel.He immediately started poking fun at celebrities, starting with the college admissions scandal.#RickyGervais #GoldenGlobes #GoldenGlobes2020"
"3_8V5hQc9Ds","30 Day Vegan Challenge","2020-01-06T18:20:15.000Z","UCSfLUmBHOLoL0uHcxhRCwFw","Morgan Adams","23","20.12.01","Morgan Adams|Ryland Adams","3611462","194914","5818","11605","https://i.ytimg.com/vi/3_8V5hQc9Ds/default.jpg","False","False","Download Lifesum for free: https://bit.ly/32OiAiR30% off the 12 months subscription: http://Lifesum.com/redeem/morgan30Subscribe to my channel! http://bit.ly/YouTubeMorganAdamsFOLLOW ME OTHER PLACES to see more of my poor life choices: Instagram- https://www.instagram.com/morrganics/Twitter- https://twitter.com/_morganadams_"
"yxQYSR8D56Y","Sony at CES 2020 in under 6 minutes","2020-01-07T02:34:25.000Z","UCddiUEpeqJcYeBxX1IVBKvQ","The Verge","28","20.12.01","sony|sony 2020|sony ces|ps5|psvr|vision s|sony vision s|electric car|sony electric car|ces 2020|ces|2020|sony ces 2020|ces sony|sony electronics|press conference|keynote|event|tech news|tech|consumer tech|new tech|latest tech|sony audio|4k tv|sony tv|international ces|supercut|technology|gadgets|latest updates|how to|apple|google|iphone|review|microsoft|verge|the verge","1561252","24151","1422","1901","https://i.ytimg.com/vi/yxQYSR8D56Y/default.jpg","False","False","Sony’s CES 2020 press conference in Las Vegas on Monday was a brief one, but it had some big news in the gaming and, believe it or not, auto department. Sony gave us our first glimpse at the new PlayStation 5 logo, and it shared some new sales milestones for the PS4 and PSVR virtual reality headset. But it’s biggest surprise was a new electric concept car called the Vision-S. Yes, Sony made a car. And it’s here at CES.Read more: https://bit.ly/35uQN8GSubscribe: http://goo.gl/G5RXGsLike The Verge on Facebook: https://goo.gl/2P1aGcFollow on Twitter: https://goo.gl/XTWX61Follow on Instagram: https://goo.gl/7ZeLvXWhy'd You Push That Button Podcast: https://pod.link/1295289748The Vergecast Podcast: https://pod.link/430333725More about our podcasts: https://www.theverge.com/podcastsRead More: http://www.theverge.comCommunity guidelines: http://bit.ly/2D0hlAvWallpapers from The Verge: https://bit.ly/2xQXYJrSubscribe to Verge Science on YouTube, a new home base for our explorations into the future of science: http://bit.ly/2FqJZMl"
"3BQI60FBy-s","Ricky Gervais' Golden Globes 2020 Monologue Shades Felicity Huffman, Leonardo DiCaprio and More","2020-01-06T04:51:33.000Z","UCdtXPiqI2cLorKaPrfpKc4g","Entertainment Tonight","24","20.12.01","Ricky Gervais|2020 Golden Globes|Golden Globes|Entertainment Tonight|etonline|et online|celebrity|Hollywood|news|trending|et|et tonight|2019|golden globes|awards|golden globes 2020|2020 golden globes|golden globes red carpet|opening monologue|ricky gervais golden globes|opening monologue golden globes|comedy|stand up","2170986","11940","9975","1129","https://i.ytimg.com/vi/3BQI60FBy-s/default.jpg","False","False","The 58-year-old comedian hosted the 2020 Golden Globes on Sunday and didn't shy away from taking jabs at Hollywood's biggest stars."
"W_vJhUAOFpI","The New Mutants | Official Trailer | 20th Century FOX","2020-01-06T14:00:06.000Z","UC2-BeLxzUBSs0uSrmzWhJuQ","20th Century Fox","1","20.12.01","Trailer|X-Men|The New Mutants|Josh Boone|Marvel|Superhero|X Men|DISNEY|FOX|fox movies|disney movies|maisie williams|henry zaga|blu hunt|alice braga|charlie heaton|anya taylor-joy","5563260","125250","6653","11267","https://i.ytimg.com/vi/W_vJhUAOFpI/default.jpg","False","False","20th Century Fox in association with Marvel Entertainment presents “The New Mutants,” an original horror thriller set in an isolated hospital where a group of young mutants is being held for psychiatric monitoring. When strange occurrences begin to take place, both their new mutant abilities and their friendships will be tested as they battle to try and make it out alive.In Theaters April 3, 2020Directed by: Josh Boone Screenplay by: Josh Boone & Knate LeeProduced by: Simon Kinberg, p.g.a., Karen Rosenfelt, p.g.a., Lauren Shuler DonnerCast: Maisie Williams, Anya Taylor-Joy, Charlie Heaton, Alice Braga, Blu Hunt, Henry Zaga Connect with The New Mutants Online:Visit The New Mutants WEBSITE: http://www.TheNewMutants.com Like The New Mutants on FACEBOOK: https://www.facebook.com/NewMutantsFilmFollow The New Mutants on TWITTER: https://www.twitter.com/NewMutantsFilm Follow The New Mutants on INSTAGRAM: https://www.instagram.com/NewMutantsFilm#NewMutantsAbout 20th Century FOX:Official YouTube Channel for 20th Century Fox Movies. Home of Avatar, Aliens, X-Men, Die Hard, Deadpool, Ice Age, Alvin and the Chipmunks, Rio, Peanuts, Maze Runner, Planet of the Apes, Wolverine and many more.Connect with 20th Century FOX Online:Visit the 20th Century FOX WEBSITE: http://bit.ly/FOXMovieLike 20th Century FOX on FACEBOOK: http://bit.ly/FOXFacebookFollow 20th Century FOX on TWITTER: http://bit.ly/TwitterFOX"
"i3pdeTv-8GI","Joaquin Phoenix Drops F-Bombs in 'Joker' Speech at the Golden Globes","2020-01-06T04:35:51.000Z","UCgRQHK8Ttr1j9xCEpCAlgbQ","Variety","24","20.12.01","Variety|Variety Studio|Joaquin Phoenix|Joker|Golden Globes|Best Actor|Joaquin speech|Joaquin Phoenix speech","5990218","147415","7329","17896","https://i.ytimg.com/vi/i3pdeTv-8GI/default.jpg","False","False","Joaquin Phoenix took home the Golden Globe on Sunday night for his role in “Joker,” but not without some drama.After acknowledging his fellow nominees, Phoenix, a long-time skeptic of Hollywood awards shows, said “There is no f—ing best actor.” NBC proceed to cut out the audio as he appeared to drop multiple f-bombs, all of which were muted for viewers.http://bit.ly/VarietySubscribehttp://www.facebook.com/varietyhttp://www.instagram.com/varietyhttp://www.twitter.com/variety"
"PVz0EwJLntg","Susanna Gets Piers a Greggs' Vegan Steak Bake | Good Morning Britain","2020-01-06T09:05:35.000Z","UCq18eeL7D9Vd8DhjMcLh9QQ","Good Morning Britain","24","20.12.01","good morning britain|breakfast show|news|morning news|gmb|good morning britain interview|itv|piers morgan|susanna reid|Talk Shows - Topic|Greggs|Vegan|Steak Bake|Vegan Sausage Roll|Charlotte Hawkins|Vegetarian|climate change|global warming|food|funny","412833","5453","1828","0","https://i.ytimg.com/vi/PVz0EwJLntg/default.jpg","True","False","Subscribe now for more! http://bit.ly/1NbomQaAfter the popularity of the vegan sausage roll, last week Greggs launched a vegan steak bake.  Susanna Reid brought some in for Piers Morgan to try!  Broadcast on 06/01/2020Like, follow and subscribe to Good Morning Britain!The Good Morning Britain YouTube channel delivers you the news that you’re waking up to in the morning. From exclusive interviews with some of the biggest names in politics and showbiz to heartwarming human interest stories and unmissable watch again moments. Join Susanna Reid, Piers Morgan, Ben Shephard, Kate Garraway, Charlotte Hawkins and Sean Fletcher every weekday on ITV from 6am.Website: http://bit.ly/1GsZuhaYouTube: http://bit.ly/1Ecy0g1Facebook: http://on.fb.me/1HEDRMbTwitter: http://bit.ly/1xdLqU3http://www.itv.com#GMB #PiersMorgan #SusannaReid"
