video_id,title,publishedAt,channelId,channelTitle,categoryId,trending_date,tags,view_count,likes,dislikes,comment_count,thumbnail_link,comments_disabled,ratings_disabled,description
"w4Ro3SsYT5s","We Broke Up.","2020-01-11T17:00:14.000Z","UCkvK_5omS-42Ovgah8KRKtg","jeffreestar","26","20.12.01","jeffree star|we broke up|jeffree star break up|jeffree star cosmetics|Nathan Schwandt|jeffree star approved|jeffree star house tour|pink vault tour|jeffree star house|jeffree and nathan break up|nathan velour liquid lipstick|star family|jeffree star dogs","21862764","1333096","44928","214686","https://i.ytimg.com/vi/w4Ro3SsYT5s/default.jpg","False","False","Thank you all for the love and support during this difficult time. 💔I'll be back to filming and creating with makeup soon. My heart is trying to heal and repair. I love you guys so much.*SHOP: http://www.jeffreestarcosmetics.com+ FOLLOW MY BRAND ON Instagram: http://instagram.com/jeffreestarcosmetics+FOLLOW ME ON IG: http://instagram.com/jeffreestar+ SNAPCHAT: jeffreedahmer+ TWITTER: @jeffreestar"
"6VF0GEf3S0I","SURPRISING PEOPLE WITH JUSTIN BIEBER!!","2020-01-11T22:05:30.000Z","UCmh5gdwCx6lN7gEC20leNVA","David Dobrik","22","20.12.01","david|dobrik|vlog|vlogger|how|to|justin|bieber|yummy|music|video|song|singer|celeb|vine|dating|date|erin|jason|nash|zane|hijazi|heath|hussar|emotional|surprise|reaction|react|challenge|try|not|laugh|comedy|cringe","6406104","634134","9799","23769","https://i.ytimg.com/vi/6VF0GEf3S0I/default.jpg","False","False","We surprise some students with Justin Bieber!!Yummy music video: https://www.youtube.com/watch?v=8EJ3zbKTWQ8 Yummy on itunes: https://music.apple.com/us/album/yummy/1492502421?i=1492502431 Follow the man that runs Hollywood and my father: https://instagram.com/johnny?igshid=esznx95gowiyHelp our friends in Australia: https://fundraise.redcross.org.au/drrFollow me on insta quick! https://instagram.com/daviddobrikSUBSCRIBE TO JOE HE IS GREAT!: https://www.youtube.com/watch?v=8YeIi3_ZEksGET THE NEW MERCH WHILE IT LASTS: https://fanjoy.co/dobrik GO TO MY INSTAGRAM FOR MORE CONTENT: https://www.instagram.com/daviddobrik/?hl=en CHECKOUT OUR PODCAST WHERE WE TALK ABOUT RELATIONSHIPS:  https://itunes.apple.com/us/podcast/views-with-david-dobrik-and-jason-nash/id1236778275?mt=2       ADD ME ON SNAPCHAT TO KEEP UP WITH OUR VEGAS TRIP: @Daviddobrik  WATCH MY NEW HOUSE TOUR HERE: https://www.youtube.com/watch?v=C4yECzFCdZk&t=26s   Comment how much you love our bunny if you read this!!ADD ME ON SNAPCHAT TO BE INVITED TO OUR HOUSE NEXT: @DavidDobrikThanks for watching :) Throww it a like if you like throwing stuff!Turn my notifications on these to be the next shoutout!!Twitter: @DavidDobrikInstagram: @DavidDobrikSnapchat: @DavidDobrikVine: @DavidDobrikMusically: @DavidDobrikBusiness email: daviddobrikbusiness@gmail.comOther people in the video:Liza- Twitter; @lizakoshy Instagram; @lizakoshy Snapchat; @lizakoshysnapsAlex Ernst- Twitter; @AlexErnst Instagram; @Ernst Snapchat; @AlexErnstJason Nash- Twitter and Instagram; @JasonNashJosh Peck- Instagram: @shuapeck Twitter: @Itsjoshpeck Snapchat: @joshuapeckScottysire- Twitter; @imnotscottysire Instagram; @VanillaDingDongToddysmith- Twitter; @todderic_ Instagram; @todderic_Zane- Twitter; @Zane Instagram; @Zane Snapchat; @ZaneHijaziDom: Instagram/Twitter: @DomZeglaitisJeff: Instagram: @Jeff Twitter; @JeffWittekThe Gabbie Show- Twitter; @TheGabbieShow Instagram; @TheGabbieShow Snapchat; @TheGabbieShowCorinna- Snapchat/Twitter/Instagram: @CorinnaKopfBignik- Twitter: @BigNik Instagram: @RealBigNik Snapchat; @BignikVineHeath- Twitter; @HeathHussar Instagram; @HeathHussar Snapchat; @HeathHussarSeth - @sethfrancoisJonah Hill- Insta: @nickantonyanBrandon Calvillo- Twitter; @BJCalvillo Instagram; @BJCalvillo Snapchat; @BJCalvilloMatt King - Twitter/Instagram/Snapchat: @MattRKingCarly incontro- Twitter/Instagram: @CarlyIncontroErin Gilfoy- Twitter and Instagram: goddess_eriu Snapchat: erin_gilfoyJack Dytrych: Twitter: @BigJuicyJack Instagram: jdytrych22Cailee: Twitter/Instagram: @CaileeRaeMusic Lindsey: @lindseygrollJulia Abner- Instagram; @JuliaAbnerElton Castee- Twitter; @EltonCastee, Instagram; @EltonCasteeMeghan McCarthy- Twitter: @MeghanWMcCarthyJcyrus snapchat: @Jcyrusvine .mike"
"tEjvoEfnQYQ","FIRST LOOK: The Islanders enter the villa | Love Island Series 6","2020-01-12T14:07:26.000Z","UCgM5P6QGHmrvu5fDPx79mug","Love Island","24","20.12.01","love island 2019|love island|islanders 2019|Love island couples|love island 2018|love island uk|love island 2020|islander 2020|itv2|love island season 6|dating game show|iain stirling|laura whitmore|winter love island|love island series 6","83401","0","0","0","https://i.ytimg.com/vi/tEjvoEfnQYQ/default.jpg","True","True","The Islanders step into our shiny new villa and couple up for the very first time! But there’s double the trouble as a surprise sends the new couples into shock… Subscribe for more! http://bit.ly/1U9dtB0Download the Official Love Island App here:iOS: http://bit.ly/2uC0FvsAndroid: http://bit.ly/2thKW50Like, follow and subscribe to Love Island!#LoveIslandYouTube: https://www.youtube.com/loveislandWebsite: http://www.itv.com/loveislandFacebook: https://www.facebook.com/LoveIslandITV2Twitter: https://twitter.com/LoveIslandInstagram: https://www.instagram.com/loveislandWatch more videos from Love Island on the official YouTube channel https://www.youtube.com/loveislandhttp://www.itv.com"
"uQZR110Kg1E","I'm a Dad now!","2020-01-11T18:05:01.000Z","UCS5Oz6CHmeoF7vSad0qqXfw","DanTDM","22","20.12.01","dantdm|dantdm baby","2452091","220673","2425","68176","https://i.ytimg.com/vi/uQZR110Kg1E/default.jpg","False","False","Our Baby Boy Asher was born on the 5th January. We will not be sharing his face on YouTube or social media to protect his privacy so please respect that. I will be back soon!Twitch : http://www.twitch.tv/DanTDMTwitter : http://www.twitter.com/DanTDMInstagram : http://www.instagram.com/DanTDM"
"PEv6Zc0H0ao","I ONLY ate PINK Food for 24 HOURS!!","2020-01-12T10:00:02.000Z","UCwR-g7XxcLxjYVTS5qncFhg","Anastasia Kingsnorth","24","20.12.01","[none]","250566","17845","317","1809","https://i.ytimg.com/vi/PEv6Zc0H0ao/default.jpg","False","False","Business Email: anastasiakingsnorth@mcsaatchisocial.comPO Box: Anastasia KingsnorthC/O M&C Saatchi Social36 Golden SquareLondonW1F 9EEDisclaimer - I am not trying to brag, all opinions are my own. I will state in the video and in the description if the video is sponsored by a brand or company.\Links:Instagram - www.instagram.com/anastasiakingsnorthTwitter - www.twitter.com/AnastasiaK_xoxoFacebook - www.facebook.com/AnastasiaKingsnorthSocial Snapchat - anastasiaa3xoTiktok - @anastasiakingsnorthxoxo,Anastasia"
"-rZabiNQXkU","Wiley - The Game (Freestyle)","2020-01-11T18:23:00.000Z","UC1jWTZ_pBUYvpBEljYR5xCw","Wiley","10","20.12.01","[none]","462894","21592","1969","2791","https://i.ytimg.com/vi/-rZabiNQXkU/default.jpg","False","False","Follow Wiley on Instagram - https://www.instagram.com/wiley__/?hl=enFollow Wiley on Twitter - https://twitter.com/WileyUkLike Wiley on Facebook - https://www.facebook.com/OfficialWiley/"
"OMZXhmvxmq0","Marcus Rashford scores brace on 200th appearance! | Manchester United 4-0 Norwich | EPL Highlights","2020-01-11T17:15:00.000Z","UCNAf1k0yIjyGu3k9BwAg3lg","Sky Sports Football","17","20.12.01","sky sports|premier league|Football League|football|Sky Sports live|Sky|Sports|stream|sky sports football|premier league highlights|epl 1920|epl highlights 1920|Manchester United|Manchester United vs Norwich|Norwich|Sky Football|Marcus Rashford|Mason Greenwood|Anthony Martial|Teemu Pukki|sp:ty=high|sp:dt=2020-01-11T15:00:00Z|sp:st=soccer|sp:li=epl|sp:ti:home=MUN|sp:ti:away=NOR","1000235","13039","327","1806","https://i.ytimg.com/vi/OMZXhmvxmq0/default.jpg","False","False","SUBSCRIBE ► http://bit.ly/SSFootballSubPREMIER LEAGUE HIGHLIGHTS ► http://bit.ly/SkySportsPLHighlightsHighlights from Old Trafford as Manchester United cruised to a comfortable win over Norwich. Watch Premier League LIVE on Sky Sports here ► http://bit.ly/WatchSkyPL►TWITTER: https://twitter.com/skysportsfootball►FACEBOOK: http://www.facebook.com/skysports►WEBSITE: http://www.skysports.com/footballMORE FROM SKY SPORTS ON YOUTUBE:►SKY SPORTS FOOTBALL: http://bit.ly/SSFootballSub►SKY SPORTS BOXING: http://bit.ly/SSBoxingSub►SOCCER AM: http://bit.ly/SoccerAMSub►SKY SPORTS F1: http://bit.ly/SubscribeSkyF1"
"4AklFoHlpas","Titans vs. Ravens Divisional Round Highlights | NFL 2019 Playoffs","2020-01-12T04:39:46.000Z","UCDVYQ4Zhbm3S2dlz7P1GBDg","NFL","17","20.12.01","NFL|Football|offense|defense|American Football|highlight|highlights|game|sport|play|plays|season|2019|touchdown|td|game highlights|postseason|playoffs|divisional|divisional round|best plays|top plays|titans|tennessee|ten|ravens|baltimore|bal|titans ravens highlights|titans highlights|ravens highlights|sp:ty=high|sp:dt=2020-01-12T01:15:00Z|sp:st=football|sp:li=nfl|sp:ti:home=Bal|sp:ti:away=Ten|Derrick Henry TD Pass|Derrick Henry|Ryan Tannehill TD","2898759","37537","1816","17399","https://i.ytimg.com/vi/4AklFoHlpas/default.jpg","False","False","The Tennessee Titans take on the Baltimore Ravens during the Divisional Round of the 2019 NFL postseason.Subscribe to NFL: http://j.mp/1L0bVBuCheck out our other channels:NFL Vault http://www.youtube.com/nflvaultNFL Network http://www.youtube.com/nflnetworkNFL Films http://www.youtube.com/nflfilmsNFL Rush http://www.youtube.com/nflrushNFL Play Football https://www.youtube.com/playfootballNFL Podcasts https://www.youtube.com/nflpodcasts#NFL #Titans #Ravens"
"OB0I1TCYJAE","Bruno Fernandes Transfer On Hold! Man Utd Transfer News","2020-01-12T11:40:08.000Z","UCMmVPVb0BwSIOWVeDwlPocQ","The United Stand","17","20.12.01","Manchester United|Man United|Man Utd|Manchester United TV|The United Stand|United Stand|Manchester United News|MUFC|Man Utd News|United|Manchester United 2020|Manchester United Latest News|Manchester United Transfer News|Manchester United Breaking News|Man Utd Transfer News|Transfer News|Transfer|Manchester United latest news|Bruno Fernandes|Fernandes|Bruno|Bruno Fernandes transfer|Solskjaer","119097","5401","287","1144","https://i.ytimg.com/vi/OB0I1TCYJAE/default.jpg","False","False","Bruno Fernandes transfer update as Man Utd take a step back in transfer negotiations and Solskjaer pleas for trust and time. Get the latest Man Utd Transfer News on The United Stand🔔 SUBSCRIBE here http://bit.ly/1CmczHm 🚨VISIT OUR WEBSITE 🚨For all the latest United news and TUS content:https://www.theunitedstand.com⏲️The United Stand Content TIMELINE is the best way to find all our latest content quickly! https://www.theunitedstand.com/timeline📰 LATEST WRITTEN NEWS https://www.theunitedstand.com/articles/latest-news📸 FOLLOW OUR INSTAGRAMhttps://www.instagram.com/theunitedstandtv/✅ The United Stand MEMBERSHIP https://buff.ly/2I2Of9R📧Contact The United Stand = soccerboxtv@gmail.com📧WRITER SUBMISSIONS = unitedstandwebsite@gmail.comAddressing: Nora CalderSee the FULL United Stand Kit Range CLICK HERE https://buff.ly/2Krpw1zEXCLUSIVE NEW PODCAST ITUNES https://buff.ly/2ZUhv84Spotify https://buff.ly/34dwEo6Google Podcast https://buff.ly/2ZHlNDnCastBox https://buff.ly/2UuiU3RRadio Public https://buff.ly/34jWkzAThe United Stand is Manchester United's biggest independent fan channel. Made for Manchester United fans by Manchester United fans, the United Stand provides you with the latest Manchester United transfer news, highlights, goal reviews and much more. So if MUFC means the world to you, get involved and subscribe to The United Stand http://bit.ly/1CmczHm The United Stand SOCIAL ACCOUNTS:WEBSITE: https://www.theunitedstand.comFACEBOOK: https://www.facebook.com/UnitedStandMUFC/TWITTER: https://twitter.com/UnitedStandMUFCINSTAGRAM! Follow us here https://www.instagram.com/theunitedstandtv/#ManchesterUnited #MUFC"
"SM0Kk6KwQZQ","SE DONS VS ROCA SENIORS {LEWISHAM PECKHAM DERBY} | Sunday League Football","2020-01-12T12:32:25.000Z","UCDS72f-TgUOfYkOzdB17leA","donstrapzytv","24","20.12.01","Se dons|sunday league tackles|sunday league football|arsenal fan tv|longest 90|slash football|baiteze|soccer am|fifa 19|arsenal|manchester united|jimmy bullard|bbc sport|bt sport|sky sports news|sky sports|fa cup|champions league|europa league|premiere league|love island|ian wright|puma football|jadon sancho|mesut ozil|nicholas pepe|aubameyang|liverpool|sadio mane|sergio aguero|lionel messi|ksi|logan paul","56228","4801","51","328","https://i.ytimg.com/vi/SM0Kk6KwQZQ/default.jpg","False","False","Join us on Patreon:www.patreon.com/sedonsBUY YOUR DØNS MERCH & SE DØNS KIT NOW FROM www.sedons.comSE Dons is the journey of a Sunday League Football Club in South London hosted by UK Rap/Grime Artist Don Strapzy. Follow us on: Instagram @officialdons Twitter @sedonsfc Merch - www.sedons.com"
"RbsxWphFbaw","KFC VEGAN BURGER, FOOD SHOPPING & TIKTOK DANCES...","2020-01-11T18:11:54.000Z","UC3dpCfpWEN24JW124ROyrVg","Anastasia’s Vlogs","24","20.12.01","[none]","170870","9450","113","428","https://i.ytimg.com/vi/RbsxWphFbaw/default.jpg","False","False","Business Email: anastasiakingsnorth@mcsaatchisocial.comPO Box: Anastasia KingsnorthC/O M&C Saatchi Social36 Golden SquareLondonW1F 9EEDisclaimer - I am not trying to brag, all opinions are my own. I will state in the video and in the description if the video is sponsored by a brand or company.\Links:Instagram - www.instagram.com/anastasiakingsnorthTwitter - www.twitter.com/AnastasiaK_xoxoFacebook - www.facebook.com/AnastasiaKingsnorthSocial Snapchat - anastasiaa3xoTiktok - @anastasiakingsnorthxoxo,Anastasia"
"aaiA5gpm4f8","Trying Dumb LIFE HACKS to see if they work","2020-01-11T20:14:44.000Z","UCpB959t8iPrxQWj7G6n0ctQ","SSSniperWolf","24","20.12.01","sssniperwolf|sniper wolf|reacting|reaction|funny|life hacks|diy|do it yourself|life hack|trying|to|see|if|they|work|trying dumb life hacks|life|hacks|lifehacks","2068417","67054","5349","4912","https://i.ytimg.com/vi/aaiA5gpm4f8/default.jpg","False","False","Trying Dumb LIFE HACKS to see if they work! Haven't done any diy lifehacks in a while... Leave a Like if you enjoyed! Watch Dumb People Caught STEALING https://youtu.be/TGBvbTe8FMI Subscribe to SSSniperWolf to join the Wolf Pack http://bit.ly/SubSSSniperWolfInstagram: http://instagram.com/sssniperwolfTwitter: http://www.twitter.com/sssniperwolfFacebook: https://www.facebook.com/sssniperwolfOfficial Merch: https://ogwolfpack.com/"
"WN8IxjWFvW4","Cagliari 0-2 AC Milan | Ibrahimovic Scores on his Full Return to AC Milan | Serie A TIM","2020-01-11T17:00:10.000Z","UCBJeMCIeLQos7wacox4hmLQ","Serie A","17","20.12.01","Ronaldo|Serie A|Higuain|Dybala|highlights|Insigne|Juventus|AC Milan|Inter Milan|Napoli|Roma|CR7|Cristiano Ronaldo|goals|full highlights|watch|stream|partita|migliori gol|migliori in campo|migliori al mondo|gol del mese|federcalcio|calcio|Italia|lukaku|de ligt|balotelli|zlatan|Ibrahimovic|zlatan milan|milan highlights|cagliari|cagliari v milan|sp:ty=high|sp:dt=2020-01-11T13:00:00Z|sp:st=soccer|sp:li=seri|sp:ti:home=CAG|sp:ti:away=MIL|sp:vl=en","5445301","81590","2054","2539","https://i.ytimg.com/vi/WN8IxjWFvW4/default.jpg","False","False","Zlatan Ibrahimovic scores on his full return to AC Milan to secure a win against CagliariThis is the official channel for the Serie A, providing all the latest highlights, interviews, news and features to keep you up to date with all things Italian football.Subscribe to the channel here! https://bit.ly/2OM2Eax Find out more about the Serie A at: http://www.legaseriea.it/en/ Questo è il canale ufficiale della Serie A, dove potrai avere accesso ai momenti salienti, alle interviste, alle notizie e alle funzionalità del momento per rimanere aggiornato sulle ultime novità del campionato.Iscriviti qui al canale! https://bit.ly/2OM2EaxPer maggiori infomazioni sulla Serie A: http://www.legaseriea.it/it"
"J_3DFTm8ioA","Chernobyl's Abandoned Ghost Town | Pripyat","2020-01-12T13:18:58.000Z","UCxDZs_ltFFvn0FDHT6kmoXA","bald and bankrupt","19","20.12.01","Chernobyl|Pripyat|HBO Chernobyl|Ukraine|USSR|Nuclear|Ghost town","108598","15406","124","2704","https://i.ytimg.com/vi/J_3DFTm8ioA/default.jpg","False","False","🇺🇦 If you would like to visit Chernobyl and explore Pripyat then please visit SoloEast travel at https://www.tourkiev.com These guys are the best at what they do and will take you where others won't 👍🏻🇺🇦 Not far from the Chernobyl reactor is the town of Pripyat which housed the plant's workers and was abandoned due to high levels of radiation not long after the disaster. I went there on a miserable winter day to see what traces of the past remained..."
"bKZat-WZO9k","Highlights | Leeds United  0-2 Sheffield Wednesday | 2019/20 EFL Championship","2020-01-12T01:00:02.000Z","UCyQcJHDN4uYfPa1DHzKVSnw","Leeds United Official","17","20.12.01","sp:ty=high|sp:dt=2020-01-11T15:00:00Z|sp:st=soccer|sp:li=eng_ch|sp:ti:home=LEE|sp:ti:away=SHW","31218","281","79","218","https://i.ytimg.com/vi/bKZat-WZO9k/default.jpg","False","False","Highlights from Leeds United’s 0-2 loss against Sheffield Wednesday in the 2019/20 EFL Championship. Presented by Wish - Shopping Made Fun.Get exclusive Leeds United video content first - download the Official App: http://bit.ly/LUTVappIf you thought this video was 🔥 don't forget to subscribe and hit the like 👍 button! Also if you want to get a notification every time we post hit the bell 🛎 button in the top right corner. MOT. ALAW. ⚽️If you want to keep up with everything Leeds, go check out our other pages https://www.facebook.com/LeedsUnited/https://twitter.com/LUFChttps://www.instagram.com/leedsunited/?hl=enhttps://www.leedsunited.com"
"1_wo1nBO5YA","Crystal Palace 1-1 Arsenal | Maitland-Niles Dealt With Zaha! (DT)","2020-01-11T15:33:17.000Z","UCBTy8j2cPy6zw68godcE7MQ","AFTV","17","20.12.01","a.f.c.|afc|aftv|arsenal|arsenal fan tv|arsenal tv|aubameyang|fans|football|goal|gooners|highlights|ozil|premier league|robbie lyle|troopz|dt|aftvmedia|nicolas pepe|pépé|tierney|david luiz|xhaka|martinelli|mesut ozil|leno|torreira|arteta|mikel arteta|roy hodgson|selhurst park|crystal palace|wilfred zaha|zaha|benteke|tosun|cenk tosun|VAR|ayew|aubameyang red card|red card","265739","5157","283","783","https://i.ytimg.com/vi/1_wo1nBO5YA/default.jpg","False","False","Crystal Palace 1-1 Arsenal | Maitland-Niles Dealt With Zaha! (DT)DONT MISS OUT ON 15% OFF ALL ITEMS IN OUR JANUARY SALES : http://goo.gl/rin8oWSUBSCRIBE NOW : https://goo.gl/Zq9NcA INSTAGRAM:  https://goo.gl/FfTBNLTWITTER:     https://goo.gl/pSKBuCFACEBOOK:   https://goo.gl/w4YbW7SNAPCHAT: https://goo.gl/mQRasiVKONTAKTE: https://goo.gl/p5Y3feTWITCH: https://goo.gl/Gx9g2nDISCORD: https://discord.gg/KCwCQqWWEBSITE:     https://goo.gl/GsjncrAFTV winner of The Best Overall Football Content Creators at The 2018/19 Football Blogging AwardsAFTV is the Unofficial Voice of Arsenal Fans around the world. AFTV is a platform where fans can voice their independent opinions on the greatest football club in the world.#AFTV  #Arsenal #CRYARS"
"16KkxPKspF0","WORST Ever Player Picked By YOUR Manager","2020-01-12T07:00:01.000Z","UC3UFSVP6ormiRWUg_rmH2zA","HITC Sport","17","20.12.01","sport|football|hitc sport|HITCsport|premier league|jurgen klopp|liverpool|pep guardiola|goals|skills|highlights|fa cup","65688","3461","76","349","https://i.ytimg.com/vi/16KkxPKspF0/default.jpg","False","False","The Irish Guy takes a look at the worst player ever picked by your current Premier League manager."
"Md-iBTwN4Kc","The Try Guys Make Waffle Cones Without A Recipe","2020-01-11T16:00:04.000Z","UCpi8TJfiA4lKGkaXs__YdBA","The Try Guys","23","20.12.01","try guys|keith|ned|zach|eugene|habersberger|fulmer|kornfeld|yang|buzzfeedvideo|buzzfeed|ariel|ned & ariel|comedy|education|funny|try|learn|fail|experiment|test|tryceratops|without a recipe|baking|cooking|challenge|cooking challenge|baking challenge|chef|chef show|amazing cooking|how to cook|waffle|waffle cones|dessert|sweets|sweet treat|ice cream|kids|family friendly|kids cooking|how to make|waffle maker","1785005","118886","1083","5575","https://i.ytimg.com/vi/Md-iBTwN4Kc/default.jpg","False","False","Who’s ready for some bonus baking? Which Try Guy’s Waffle Cone will stack up to the competition? 🧇👑Are you a business looking to work with The Try Guys? Reach out to us at 2ndtrybusiness@gmail.com for all business inquiries! 🎧THE TRYPOD 🎧: watch our new podcast at https://youtube.com/trypod or listen at https://tryguys.com/podcast📘THE HIDDEN POWER OF F*CKING UP 📘: check out our new book at https://tryguys.com/bookGet your official Try Guys color hoodies and phone cases at https://tryguys.com/collections/color-line 💙❤️💚💜Support us! http://www.patreon.com/tryguys. Join our Patreon to get videos a day early, plus, live streams, chatrooms, BTS footage, exclusive merchandise, and more!SUBSCRIBE TO AND FOLLOW THE TRY GUYS http://www.youtube.com/c/tryguyshttp://www.facebook.com/tryguys  http://www.twitter.com/tryguyshttps://www.instagram.com/tryguysFOLLOW THE GUYShttp://www.Instagram.com/keithhabshttp://www.Instagram.com/nedfulmerhttp://www.Instagram.com/korndiddyhttp://www.instagram.com/eugeneleeyang http://www.twitter.com/keithhabshttp://www.twitter.com/nedfulmer http://www.twitter.com/korndiddyhttp://www.twitter.com/eugeneleeyang THE TRY GUYSThe #TryGuys is the flagship channel of 2ND TRY, LLC. Tune in twice a week for shows from Keith, Ned, Zach and Eugene, the creators and stars of The Try Guys.EDITED BYYB Chang @xoyboxMUSICLicensed from AudioNetworkSFXLicensed from AudioblocksVIDEOLicensed from VideoblocksOfficial Try Guys Photos By Mandee Johnson Photography | @mandeephoto2nd Try, LLC STAFFExecutive Producer - Keith HabersbergerExecutive Producer - Ned FulmerExecutive Producer - Zach KornfeldExecutive Producer - Eugene Lee YangProducer - Rachel Ann ColeProducer - Nick RufcaProduction Manager - Alexandria HerringEditor - Devlin McCluskeyEditor - YB ChangEditor - Elliot DickerhoofAssistant Editor - Will WitwerCamera Operator - Miles BonsignoreSound Operator - Jonathan KirkProduction Assistant - Sam JohnsonContent Strategist - Kaylin BurkeSpecial Thanks To! Thanks to all of our Gold Level Patrons! AJ S., Amy Fleming, Ana Camba, Cat Hicks, Elisa Proust, Emma Godfrey, Erica Rao, Jared Aarons, Kelsey Bock, Kourtney Wong, Loretta Wen, Matthew Tadros, Miha, Paulus, Sarah Waxman, Traci Lew, Wendy Tran, Lily"
"l0U7SxXHkPY","Future - Life Is Good (Official Music Video) ft. Drake","2020-01-10T05:00:08.000Z","UCFNosi99Sp0_eLilBiXmmXA","FutureVEVO","10","20.12.01","future|drake|hip hop|travis scott|doe boy|meek mill|young thug|hndrxx|migos|codeine crazy|the wizrd|freebandz|freeband gang|fbg|life is good|epic|new music|rap|Epic/Freebandz|Future feat. Drake|Life Is Good|Rap","12399113","610453","16965","32885","https://i.ytimg.com/vi/l0U7SxXHkPY/default.jpg","False","False","Life is Good available at: https://smarturl.it/LifeIsGood.FutureDirected by Director XFuture online:https://www.twitter.com/1futurehttps://www.instagram.com/futurehttps://www.soundcloud.com/futureisnowhttps://www.facebook.com/FutureOfficialhttp://www.freebandz.com/(C) 2020 Epic Records, a division of Sony Music Entertainment. With Freebandz."
"2vwa2TvcGvc","LAST TO STOP DOING GYMNASTICS WINS CASH PRIZE!","2020-01-11T22:30:36.000Z","UCC3OGYxHwV8pB5yLobw9KdA","Dobre Brothers","24","20.12.01","Dobre Brothers|The Dobre Brothers|Lucas and Marcus|Dobre Twins|Marcus and Lucas|Cyrus Dobre|Darius Dobre|Dobre Brothers YouTube|Lucas and Marcus pranks|Dobre brothers gymnastics|Dobre brothers pranks|Pranks|Gymnastics|Dance|Challenges|Music|Rap|Grocery Store|Cars|Reactions|Makeup|Make-up|Games|Food|Family|Collabs","375743","21351","1181","1704","https://i.ytimg.com/vi/2vwa2TvcGvc/default.jpg","False","False","BEST GYMNAST WINS! 🔥DOWNLOAD & PLAY DOBRE DUNK http://bit.ly/DownloadDOBREDUNKMERCH 🔥 http://bit.ly/NewDobreMerchTURN ON OUR POST NOTIFICATIONS!SUBSCRIBE!! https://www.youtube.com/channel/UCC3OGYxHwV8pB5yLobw9KdACHECK OUT OUR DOBRE CARS CHANNEL!https://www.youtube.com/channel/UC7Irjups5A2nxStONM3JJmwFOLLOW US! Instagram -http://instagram.com/dobrebrothersSnapchat - https://www.snapchat.com/discover/Dobre_Brothers/5255767112CyrusInstagram - @CyrusdobreTwitter - @CyrusdobreMusical.ly - @CyrusdobreDariusInstagram - @DariusdobreTwitter - @DariusdobreMusical.ly - @DariusdobreLucas Instagram - @lucas_dobreTwitter - @DobrelucasMusical.ly @dobretwinsMarcusInstagram - @MarcusdobreTwitter - @DobremarcusMusical.ly - @dobretwinsBIZ - dobrebrothersmgmt@gmail.comTHANKS FOR WATCHING! :)LAST TO STOP DOING GYMNASTICS WINS CASH PRIZE!https://www.youtube.com/channel/UCC3OGYxHwV8pB5yLobw9KdA"
