video_id,title,publishedAt,channelId,channelTitle,categoryId,trending_date,tags,view_count,likes,dislikes,comment_count,thumbnail_link,comments_disabled,ratings_disabled,description
"JFNM1aN7y3I","REACTING to PRETENTIOUS INGREDIENTS Recipe Relay Video","2020-01-26T16:15:00.000Z","UCfyehHM_eo4g5JUyWmms2LA","SORTEDfood","26","20.29.01","REACTING to PRETENTIOUS INGREDIENTS Recipe Relay Video|Reacting to Pass It On|Sortedfood Reaction|Sorted|sortedfood|sortedfood ben ebbrell|sortedfood James Currie|Pretentious ingredients|pretentious ingredients sorted|pass it on sortedfood|cooking challenge|sortedfood pass it on|food challenge|recipe relay|pass or fail","227165","11874","156","614","https://i.ytimg.com/vi/JFNM1aN7y3I/default.jpg","False","False","Here’s another reaction video for the Pass It On recipe relay video using pretentious ingredients! The Sorted guys get to see how each of the others behaved while cooking in the kitchen...Didn’t catch the first video? Be sure to watch that first right here: https://youtu.be/AqbHNtmb0NgLove these reaction videos? Give it a like, comment below and we’ll do more!WANT TO SUPPORT SORTED?? Here's how to get involved...Join our food journey each week by SUBSCRIBING to the channel. Press the bell button to get notifications every time we post: https://goo.gl/pqaw14Become a member of the Sorted club and access the AMAZING podcast and apps that have been designed for you to live your best life through food: https://goo.gl/otD6NFGrab the Packs Starter Kit for everything you need to create your own SMART kitchen and nail midweek meals: https://sorted.club/buy-the-packs-starter-kit/Grab a copy of one of our UNIQUE cookbooks for major cooking inspo: https://sorted.club/books/"
"AaZeTTtKvmI","BTS Gives a Preview of Their Grammys Performance | E! Red Carpet & Award Shows","2020-01-27T00:15:32.000Z","UCD-1jAmL42qnEszozefaa1g","E! Red Carpet & Award Shows","24","20.29.01","E! Live from the Red Carpet|Red Carpet|Celebrity Gossip|Celebrity News|E! News|E! Entertainment|E! Pop Culture|Live Interviews Awards|Award Show|Fashion|Beauty|Oscar|Grammys|Golden Globes|Emmys|Screen Actors Guild|People’s Choice Awards|PCAs|Red Carpet and Award Shows|Live Events|BTS|bangtan boys|bts army|bts interview|Awards|Live From E!|Live From E|Grammy|Grammy Awards 2020|2020 Grammys Awards|2020 Grammys|Grammys Interview|Music|Black Swan","1651402","174147","811","6949","https://i.ytimg.com/vi/AaZeTTtKvmI/default.jpg","False","False","See the Black Swan singers give a quick preview of their performance with Lil Nas X and spill on their Map of the Soul: 7 album at the 2020 Grammys!#BTS #Grammys2020 #ERedCarpetAndAwardShows #CelebrityNews #GrammysMore 2020 Grammy Awards Here: https://e.app.link/e/0fyqoe1Dz3Subscribe: http://eonli.ne/RedCarpetSubscribeAbout E! Red Carpet and Award Shows: E! is the ultimate destination for Red Carpet coverage. And for the first time ever we’re taking you from the E!’s People’s Choice Awards directly into the show as E! is the new home of the People’s Choice Awards. From the Academy Awards to the Emmys, we give you an insider's view of the arrivals, exclusive interviews and of course, cover every stitch of the fabulous fashion. Only Live From the Red Carpet hosts Ryan Seacrest and Giuliana Rancic, along with E!’s entire awards team of fashion and entertainment experts, have the most comprehensive LIVE coverage of the biggest premieres and events.Download the E! News App: https://eonline.onelink.me/yMtl/9574499c   Watch Full Episodes: https://e.app.link/l2VEHxBRu3Connect with E! Red Carpet and Award Shows: Visit the E! News WEBSITE: http://eonli.ne/enewsFollow E! Live from the Red Carpet on TWITTER: http://eonli.ne/RedCarpetTwitterFollow E! News on TWITTER: http://eonli.ne/ENewsTWLike E! News on FACEBOOK: http://eonli.ne/ENewsFBCheck out E! News on INSTAGRAM: http://eonli.ne/ENewsIGBTS Gives a Preview of Their Grammys Performance | E! Red Carpet & Award Showshttps://youtu.be/AaZeTTtKvmIhttps://www.youtube.com/ERedCarpetandAwardShows"
"wsLZtc7G7nw","Funniest KID TEST Answers !","2020-01-25T18:15:28.000Z","UCzeB_0FNcPIyUSjL_TL5lEw","AzzyLand","24","20.29.01","azzyland|reaction|reacting|funny|funniest|kid|test|answers|funny tests|funny test answers|kid test answers|school","2673897","107015","5361","8652","https://i.ytimg.com/vi/wsLZtc7G7nw/default.jpg","False","False","Azzyland - Funniest KID TEST Answers !👨‍👩‍👧 SUBSCRIBE and become part of the AzzyLand family :D ✨ SOCIAL MEDIA•Instagram: https://www.instagram.com/azzyland/•Twitter: https://twitter.com/AzzyLand•Facebook: https://www.facebook.com/azzyland/•Twitch: https://www.twitch.tv/azzyland🎵 OUTRO SONGhttps://www.youtube.com/watch?v=xVzeZGRZk0s"
"NVGuFdX5guE","Your New Year's Resolution Has Already Failed","2020-01-26T10:15:14.000Z","UC2C_jShtL725hvbm1arSV9w","CGP Grey","27","20.29.01","cgpgrey|education|hello internet|self-improvement","1119325","84464","1106","5989","https://i.ytimg.com/vi/NVGuFdX5guE/default.jpg","False","False","Grey's 2020 Theme: https://www.youtube.com/watch?v=2zugiZ73SyMDiscuss your theme at: https://www.reddit.com/r/CGPGrey/comments/eu5b9x/your_theme/These videos are made possible by the Patrons who support them.  Thank you.https://www.patreon.com/bePatron?u=227816## Patrons:Bob Kunz, John Buchan, Steven Snow, Nevin Spoljaric, Donal Botkin, Chris Chapin, Richard Jenkins, Phil Gardner, Martin, سليمان العقل, Steven Grimm, Colin Millions, Saki Comandao, Jason Lewandowski, Michael Mrozek, Guillermo, Andrea Di Biagio, rictic, David F Watson, Ben Schwab, Marco Arment, Shallon Brown, Shantanu Raj, Elliot Lepley, Hunter S Zimmerman, James Hoskins, emptymachine, Chris Amaris, Bobby, George Lin, MJ, Richard Barthel, Derek Bonner, Derek Jackson, Mikko, Orbit_Junkie, Ron Bowes, Tómas Árni Jónasson, Henry Ng, Jeffrey Podis, Thunda Plum, Awoo, Carlin, David Tyler, Fuesu, iulus, Jordan Earls, Joshua Jamison, Kodi, Michael Reilly, Michael Williams, Nick Fish, Nick Gibson, Robert Webb, Stephen Drollinger, Tyler Bryant, Tex Simon, Kermit Norlund, Kevin Costello, Bear, chrysilis, David Palomares, Emil, Erik Parasiuk, Esteban Santana Santana, Freddi Hørlyck, John Rogers, ken mcfarlane, Leon, Maarten van der Blij, Peter Lomax, Rhys Parry, ShiroiYami, Tijmen van Dien, Tristan Watts-Willis, Veronica Peshterianu, Dag Viggo Lokøen, John Lee, Maxime Zielony, Elizabeth Keathley, Frederick The Great, Luxe Gifts.Music by Music by: http://www.davidreesmusic.com"
"txtHmthOZkg","Sean Lock Being Absolutely SAVAGE About National Treasures?! | 8 Out of 10 Cats Does Countdown","2020-01-26T09:00:15.000Z","UCz1hQ68G3XPVYEBoFDgSjcQ","Channel 4","24","20.29.01","8 Out of 10 Cats Does Countdown|Cats Countdown|Channel 4|Jimmy Carr|Sean Lock|Richard Ayoade|Katherine Ryan|8 out of 10 cats does countdown 2020|8 out of 10 cats does countdown full episode|8 out of 10 cats does countdown best bits|8 out of 10 cats does countdown sean lock|sean lock savage|sean lock 8 out of 10 cats|sean lock best bits","257087","3721","66","243","https://i.ytimg.com/vi/txtHmthOZkg/default.jpg","False","False","Jimmy Carr hosts as Sean Lock and Richard Ayoade take on Jon Richardson and Katherine Ryan.Watch FULL EPISODES on All 4: https://bit.ly/2vQu7RmSubscribe to Channel 4 for more: https://bit.ly/2v2I6SY#8OutOf10CatsDoesCountdown #SeanLock #JimmyCarr #RichardAyoade #KatherineRyan #CatsCountdown #Channel4"
"JEJhLUTMqPU","TikTok Star Lil Huddy Confronted During Haircut | Jeff's Barbershop","2020-01-25T19:32:42.000Z","UCmraHp1nkUsFWLqR7SWToIg","Jeff Wittek","23","20.29.01","Jeff's barbershop|Jeff wittek|vlog squad|David Dobrik|barber|barbershop|haircut|interview|podcast","2679870","145663","4600","7463","https://i.ytimg.com/vi/JEJhLUTMqPU/default.jpg","False","False","Jeff’s Barbershop merch is available now at 👇https://www.fanjoy.co/jeff Follow my Instagramhttps://www.instagram.com/jeffTwitter https://www.twitter.com/jeffwittek People in this vid:Lil Huddyhttps://www.instagram.com/lilhuddy/?hl=en Thomashttps://www.instagram.com/petroutv/?hl=enJonahhttps://www.youtube.com/channel/UCTTS1yS_b6xak0vEh7LYx8AOutro song bySimon Rexhttps://www.youtube.com/user/dirttothenastyCamera/ EditorOscar Alvahttps://www.instagram.com/oscaralvaCamera man/ Assistant EditorNathan SpeiserHttps://www.instagram.com/nathanspeiserAssitant to the assistant EditorJoe Vulpishttps://www.youtube.com/channel/UCJRb6jaNxNjkLfVg_z8VQ3g"
"sNJwDC1XhVI","PICKING OUR BABY’S NAME OUT OF A HAT!!!","2020-01-25T23:06:40.000Z","UCWwWOFsW68TqXE-HZLC3WIA","The ACE Family","22","20.29.01","the ace family picking our sons name out of a hat|ace family picking our sons name out of a hat|picking our sons name out of a hat|picking our sons name|picking our baby's name|naming our baby|naming our son|the ace family|ace family|ace family pregnancy|revealing our baby's name|revealing our sons name","4108634","235950","7482","109999","https://i.ytimg.com/vi/sNJwDC1XhVI/default.jpg","False","False","Picking our son's name out of a hat!!!JOIN THE ACE FAMILY & SUBSCRIBE: http://bit.ly/THEACEFAMILY UP TO 80% OFF The Ace Family store: http://shopacefamily.com LAST VIDEO: https://www.youtube.com/watch?v=J24JMmT2b5c&t=528s*TURN ON OUR POST NOTIFICATIONS FOR SHOUTOUTS IN OUR VIDEOS*MAKE SURE YOU LIKE, COMMENT, SHARE & SUBSCRIBE TO OUR YOUTUBE CHANNEL AND FOLLOW US ON OUR FAMILY ADVENTURES!WATCH MORE VIDEOS!!! VLOGS: https://youtube.com/playlist?list=PLq...PRANKS: https://youtube.com/playlist?list=PLq...CHALLENGES: https://youtube.com/playlist?list=PLq...POPULAR VIDEOS: https://youtube.com/playlist?list=PLq...LATEST VIDEOS: https://youtube.com/playlist?list=PLq... STALK US :)Catherine's Instagram: https://www.instagram.com/catherinepaiz/Catherine's Twitter: http://twitter.com/catherinepaizCatherine's SnapChat: CatherinepaizAustin's Instagram: https://www.instagram.com/austinmcbroom/Austin's Twitter: https://twitter.com/AustinMcbroomAustin's SnapChat: TheRealMcBroom"
"QhkH-o_-mzc","FIRST LOOK: Laura makes a surprise visit | Love Island Series 6","2020-01-26T13:28:58.000Z","UCgM5P6QGHmrvu5fDPx79mug","Love Island","24","20.29.01","love island 2019|love island|islanders 2019|Love island couples|love island 2018|love island uk|love island 2020|islander 2020|itv2|love island season 6|dating game show|iain stirling|laura whitmore|winter love island|love island series 6","424766","0","0","0","https://i.ytimg.com/vi/QhkH-o_-mzc/default.jpg","True","True","Subscribe for more! http://bit.ly/1U9dtB0Download the Official Love Island App here:iOS: http://bit.ly/2uC0FvsAndroid: http://bit.ly/2thKW50Like, follow and subscribe to Love Island!#LoveIslandYouTube: https://www.youtube.com/loveislandWebsite: http://www.itv.com/loveislandFacebook: https://www.facebook.com/LoveIslandITV2Twitter: https://twitter.com/LoveIslandInstagram: https://www.instagram.com/loveislandTikTok: https://www.tiktok.com/@loveislandWatch more videos from Love Island on the official YouTube channel https://www.youtube.com/loveislandVisit our official Love Island shop: https://loveislandshop.co.ukhttp://www.itv.com"
"YpuMlT241Ak","😎Kylian Mbappe - Q&A😎","2020-01-26T09:58:41.000Z","UC4SUUloEcrgjsxbmy_rQQXA","442oons","17","20.29.01","funny|lol|parody|football|spoof|comedy|premier|league|soccer|442oons|animation|cartoons|scores|games|cartoon|goals|highlights|footy|EPL|BPL|goal|vs|44200NS|4-4-2oons|44toons|kylian|mbappe|neymar|psg|celebration|Q&A|cavani","640392","25791","442","1649","https://i.ytimg.com/vi/YpuMlT241Ak/default.jpg","False","False","✋Please note: these shitty cartoons are not made for kids in any way. They contain profanity, cartoon violence and non-child themes✋ ⚽️ Subscribe to 442oons: http://bit.ly/442oonsSUB ⚽️👕New Merch! 442oons T-Shirts+Phone Cases👕👉🏻https://teespring.com/stores/442oons⚽️⬅️🏃‍♂️442oons Football Runner!⚽️⬅️🏃‍♂️Download free now ios👉🏻http://bit.ly/442RUNappDownload free now android👉🏻http://bit.ly/442RUNand442oons Footballer Manager App👉🏻https://bnc.lt/xzHc/aMIpiA9ioN ⭐Celebrity Cartoons👉🏻http://bit.ly/Celebri2oons ⭐Don't forget to like, comment on and share the vids! I reply to as many as I can. Thanks for watching!THIS IS A PARODY. ALL CHARACTERS ARE FICTIONAL CARICATURESFor non-You Tube short videos, sneak previews, pictures, behind the scenes, polls, fan choices, updates and more, follow me on: ▶️http://facebook.com/442oons ▶️http://instagram.com/442oons▶️http://twitter.com/442oons▶️442oons@gmail.com442oons was created by me... Dean Stobbart! I do the voices/scripts/ideas/directing/editing/characters blah blah blah ... and now I've got four animators doing all the hard work, the animation...Bravo Sam Dunscombe, Mike Myler, James Williams and Karl Hargreaves (Karl does the art these days ... which is why it looks better)Help us caption & translate this video!https://amara.org/v/CZmp5/"
"K_oXgALpVeY","Can You Find Him in This Video? • Hidden in Plain Sight #11","2020-01-25T13:00:03.000Z","UCDRbNGFusqlXX4a5vwi9ouQ","Vat19","24","20.29.01","vat19|vat 19|vat-19|hidden in plain sight","3353626","75382","5143","5534","https://i.ytimg.com/vi/K_oXgALpVeY/default.jpg","False","False","Can Danny hide until the end of the day before his boss finds him?Buy here: https://www.vat19.com/item/crunchy-snow-stress-ball?adid=youtubeMore Hidden in Plain Sight: https://www.youtube.com/watch?v=BtR4mH3ZvcM&list=PLSqiExuEA-RF4HU9PWHtpiQo94XkXV2nXSubscribe to Vat19: http://www.youtube.com/subscription_center?add_user=vat19comVisit the Vat19 Headquarters: https://www.vat19.com/tour****************** Follow Vat19:Facebook: https://facebook.com/vat19Instagram: https://instagram.com/vat19/Shop hundreds more curiously awesome products:https://www.vat19.com/?adid=youtubeWatch More Vat19:The White Elephant Gift Show: https://www.youtube.com/watch?v=rppcXroNgKI&list=PLSqiExuEA-RFpqW0Y3vn0pn8wDW_3LXAOLatest Uploads: https://www.youtube.com/user/vat19com/videos?shelf_id=1&view=0&sort=ddPopular Videos: https://www.youtube.com/user/vat19com/videos?shelf_id=7&view=0&sort=pFun Stuff to Eat: https://www.youtube.com/watch?v=7RXmNRr8x7I&list=PLSqiExuEA-REt5gzR0A9ernZNHlZ2glIlAbout Vat19:Vat19 is dedicated to curiously awesome gifts, candy, toys, gummy, putty, puzzles, games, and more! In addition to making funny commercials you'll actually want to watch, we produce amazing challenge videos, document our outrageous contraptions, and invite you to a front row seat for our silly stunts. Sometimes we blow things up, fill up a bathtub or pool with crazy stuff, dare each other to eat super spicy foods, and answer “burning questions” from our viewers."
"rNyJbdv2KF4","First flight of Boeing's 777X foldable-wing aircraft (full recap)","2020-01-25T23:08:58.000Z","UCOmcA3f_RrH6b9NmcNa4tdg","CNET","28","20.29.01","CNET|Technology|News|Tech|science|aviation|boeing|boeing 777x|boeing triple 7x|777x|triple 7x|boeing 777x first flight|777x first flight|take off|landing|folding wingtips|foldable wings|foldable wing aircraft|foldable wing airplane|commercial airplane|boeing news|top news|aviation news|engineering|full recap|recap|highlights|aerospace|777|first flight|flight|aviation videos|boeing 777|jet|777x engine|folding wingtip|boeing 777x takeoff|runway","1077862","5489","561","1320","https://i.ytimg.com/vi/rNyJbdv2KF4/default.jpg","False","False","Boeing successfully flew and landed its new 777X aircraft, the first commercial airplane with folding wingtips.  Watch a full recap of the day's events.Subscribe to CNET: https://www.youtube.com/user/CNETTVCNET playlists: https://www.youtube.com/user/CNETTV/playlistsDownload the new CNET app: https://cnet.app.link/GWuXq8ExzGLike us on Facebook: https://www.facebook.com/cnetFollow us on Twitter: https://www.twitter.com/cnetFollow us on Instagram: http://bit.ly/2icCYYm"
"FHBtu5Yh8K0","YOUR Player Most Capable Of Scoring BEAUTIFUL Goals","2020-01-26T07:00:01.000Z","UC3UFSVP6ormiRWUg_rmH2zA","HITC Sport","17","20.29.01","sport|football|hitc sport|HITCsport|premier league|fa cup|goals|skills|highlights|neymar|shaqiri|liverpool|salah|de bruyne|goal of the month|best goals","138896","5295","90","450","https://i.ytimg.com/vi/FHBtu5Yh8K0/default.jpg","False","False","The Irish Guy takes a look at every Premier League club, and the respective player most likely to score a beautiful, aesthetic-looking goal.Including the likes of Ruben Neves, Juan Mata and Kevin De Bruyne."
"4Ov422BgmE0","Owner Thinks No-One Serves Fresh Ravioli | Kitchen Nightmares","2020-01-25T17:00:02.000Z","UCUZzyuAlhHNP3oiuMjn7RfQ","Kitchen Nightmares","24","20.29.01","Gordon Ramsay kitchen nightmares|Gordon Ramsay best insults|kitchen nightmares full episodes|kitchen nightmares online|kitchen nightmares watch online|kitchen nightmares HD|kitchen nightmares best moments|Gordon Ramsay|Kitchen Nightmares|kitchen nightmares la galleria 33|kitchen nightmares la galleria|kitchen nightmares la galleria 33 full episode|kitchen nightmares la galleria 33 part 1|gordon ramsay kitchen nightmares","655864","9962","141","1030","https://i.ytimg.com/vi/4Ov422BgmE0/default.jpg","False","False","Big if true. If you liked this clip check out the rest of Gordon's channels:http://www.youtube.com/gordonramsayhttp://www.youtube.com/thefwordhttp://www.youtube.com/kitchennightmaresMore Gordon Ramsay:Website: http://www.gordonramsay.comFacebook: http://www.facebook.com/GordonRamsay01Twitter: http://www.twitter.com/GordonRamsay"
"rI-y77HbIso","Queen Bee Performs 'Girl On Fire' By Alicia Keys | Season 1 Ep.5 | The Masked Singer UK","2020-01-25T19:38:20.000Z","UCkSO8PoK2AwbvjppT2CkDNg","The Masked Singer UK","24","20.29.01","The Masked Singer|Rita Ora|Jonathan Ross|Davina McCall|Ken Jeong|Joel Dommett|The Masked Singer UK|ITV|the masked singer|TMS|tms|Masked Singer|masked singer","132796","2187","49","0","https://i.ytimg.com/vi/rI-y77HbIso/default.jpg","True","False","Queen Bee takes on Alicia Keys' 'Girl On Fire', but can you work out the link between The Masked Singer and their song?Like, follow and subscribe to The Masked Singer UK's official YouTube channel here: https://www.youtube.com/channel/UCkSO8PoK2AwbvjppT2CkDNgMake sure you're following all of the Masked Singer official accounts:https://www.instagram.com/maskedsingeruk/https://twitter.com/MaskedSingerUKhttps://www.facebook.com/maskedsingeruk/Watch the full episode on the ITV Hub now, here:https://www.itv.com/hub/the-masked-singer#MaskedSinger #AliciaKeys #GirlOnFire"
"HFnTN5ohiqg","Highlights Valencia CF vs FC Barcelona (2-0)","2020-01-25T18:24:31.000Z","UCTv-XvfzLX3i4IGWAm4sbmA","LaLiga Santander","17","20.29.01","española|oficial|soccer|football|spanish league|laliga|resumen|highlight|Valencia CF vs FC Barcelona|sp:st=soccer|sp:vl=en|sp:dt=2020-01-25T15:00:00Z|sp:ti:home=val|sp:ti:away=fcb|sp:ty=high|sp:or=2|sp:li=liga|hl|highlights|matchday|Maxi Gómez|Gayà|Gaya|Piqué|Pique|Ter Stegen|Leo Messi|Messi|Griezmann|Carlos Soler|Ferran Torres|Gameiro|Coquelin|Kondogbia|Jaume Doménech|Jaume Domenech|Arturo Vidal|Ansu Fati|Collado|Setién|Setien|Celades|Rodrigo Moreno|Paulista","1050655","5894","433","908","https://i.ytimg.com/vi/HFnTN5ohiqg/default.jpg","False","False","Valencia CF get the win against FC Barcelona in Mestalla with goals from Jordi Alba on their own doorstep and Maxi Gomez #ValenciaBarça J21 LaLiga Santander 2019/2020Subscribe to the Official Channel of LaLiga Santander in HD | 2020-01-25 00.00h | J21 | VAL | BARLaLiga Santander on YouTube: http://goo.gl/Cp0tCLaCopa on YouTube: http://bit.ly/1P4ZriPLaLiga SmartBank on YouTube: http://bit.ly/1OvSXbiFacebook: https://www.facebook.com/LaLigaTwitter: https://twitter.com/LaLigaInstagram: https://instagram.com/laligaGoogle+: http://goo.gl/46Py9"
"o9lVJ6IlE4k","Coronavirus: How could it be stopped? – BBC Newsnight","2020-01-24T23:45:10.000Z","UC6o-wWU-v2ClFMwougmK7dA","BBC Newsnight","25","20.29.01","coronavirus|pandemic|china|france|how to stop|latest news|deaths|disease|virus|corona|vaccine|prevention|travel|how deadly is coronavirus|wuhan flu|infectious disease|disease x|cold and flu symptoms coronavirus|bbc|bbc interview|newsnight|katie razzall|ben chu","1129437","10792","1016","8229","https://i.ytimg.com/vi/o9lVJ6IlE4k/default.jpg","False","False","The first European cases of Coronavirus are confirmed in France. How prepared would we be to deal with a global pandemic? Subscribe to our channel here: https://goo.gl/31Q53FCases of Coronavirus have now been confirmed in Japan, Vietnam, Thailand, the US and France, after the virus began in China. In a globalised world, how might such an outbreak be contained?We’ve had similar scares before, with SARS in 2003, bird flu in 2006, swine flu in 2009, and even Ebola and Zika. What are the plans in place to act against a major threat?  The World Health Organization has said it's too early to term the outbreak of coronavirus an international public health emergency. It also doesn't fulfil the criteria for a pandemic, which is a spread worldwide of a new disease. Ben Chu reports, and Katie speaks to Tom Inglesby, Director of the Center for Health Security of the Johns Hopkins Bloomberg School of Public Health, and Sarah Gilbert, Professor of Vaccinology at Oxford University.Newsnight is the BBC's flagship news and current affairs TV programme - with analysis, debate, exclusives, and robust interviews. Website: https://www.bbc.co.uk/newsnightTwitter: https://twitter.com/BBCNewsnightFacebook: https://www.facebook.com/bbcnewsnight"
"NT30xYYI0CU","Olly Murs' 'Runaround Sue' | Blind Auditions | The Voice UK 2020","2020-01-25T22:01:53.000Z","UCOlLivh3_AfkjDFy5X7EL5Q","The Voice UK","24","20.29.01","the voice coaches|the voice uk|Meghan Trainor|will.i.am|william|tom jones|olly murs|the voice of uk|the voice itv|tv talent|the voice best moments|the voice performance|la voiz|aj odudu|emma willis|the voice uk 2020|the voice uk 2020 highlights|the voice uk olly murs singing|the voice uk olly murs funny moments|olly murs performing|olly murs the voice|olly murs performance|the voice blind auditions","354833","5155","103","0","https://i.ytimg.com/vi/NT30xYYI0CU/default.jpg","True","False","Olly Murs Performs 'Rundaround Sue' by Dion in week 4 of The Voice UK 2020 Blind Auditions!Subscribe for more: http://bit.ly/2jmXcPtLike, follow and subscribe to the official channels for The Voice UK.YouTube: http://bit.ly/2iull3eWebsite: http://bit.ly/2hwvvllFacebook: http://bit.ly/2iuiAyQTwitter: http://bit.ly/2ht0H1rInstagram: http://bit.ly/2iIEy0qWatch Full Episodes on The ITV Hub (UK): http://bit.ly/2i5vyqaDownload The Voice UK's free app for exclusive previews and news:iOS: http://apple.co/2hzvKxqAndroid: http://bit.ly/2iJbRo3Get all the latest from The Voice UK YouTube channel, news, gossip and videos with superstar Coaches will.i.am, Meghan Trainor, Olly Murs and Sir Tom Jones.http://www.itv.comhttp://www.stv.tv #TheVoiceUK"
