video_id,title,publishedAt,channelId,channelTitle,categoryId,trending_date,tags,view_count,likes,dislikes,comment_count,thumbnail_link,comments_disabled,ratings_disabled,description
"il__1mGs48A","Something Like The Bachelor | Lele Pons","2020-02-21T18:31:29.000Z","UCi9cDo6239RAzPpBZO9y5SA","Lele Pons","23","20.26.02","Something Like The Bachelor | Lele Pons|bachelor|bachelorette|pilot pete|bachelor season|fantasy suite|hometowns|rose ceremony|lele|pons|lelepons|lele pons|taking the perfect picture|i have bad news|should i be a doctor|tv show|reality spoof|bachelor spoof|shots|shots studios|hannah stocking|hannah|stocking|rudy|mancuso|rudymancuso|anwar|jibawi|anwarjibawi|juanpa|eljuanpazurita|juanpa comedy|blackjack","1346429","51915","2643","1776","https://i.ytimg.com/vi/il__1mGs48A/default.jpg","False","False","WATCH VETE PA LA MUSIC VIDEO ▶ https://youtu.be/IVZsfc0TqJoWATCH MORE ▶ https://youtube.com/playlist?list=PLmjMRs-v1tgTWmpYuBPugvLqBXVz5H-vPSUBSCRIBE HERE ▶ http://youtube.com/channel/UCi9cDo6239RAzPpBZO9y5SA?sub_confirmation=1THANKS FOR WATCHING! :) LIKE & SUBSCRIBE FOR MORE VIDEOS!-----------------------------------------------------------FIND ME ON:Instagram | http://instagram.com/leleponsTwitter | http://twitter.com/leleponsFacebook | http://facebook.com/lele TikTok | https://vm.tiktok.com/4CfRTgMerch | https://lilshop.comText Me | https://my.community.com/leleponsCAST: Lele Pons | http://youtube.com/c/leleponsPierson Fode https://instagram.com/piersonfodeAmanda McCants https://instagram.com/amandamccantsEvelyn Gonzalez https://instagram.com/theevelyngFiammata Cavatorta https://instagram.com/fi_cavatortaAlexis Figueroa https://instagram.com/lexxxxissssssLia Studio - https://instagram.com/this.is.lia.studioWE HIT 500 VIDEOS WITH OVER 1 MILLION VIEWS ▶ https://youtu.be/VOzQW_fff5AShots Studios Channels:@Anwar Jibawi @Awkward Puppets @Benny the Bee @Delaney Glazer @Hannah Stocking @Juanpa Zurita Comedy @Lele Pons @Rudy Mancuso @Shots Vlog Channel #Lele#LelePons#Bachelor"
"YQRni4skt5U","THE GREATEST KICKTOWN GOAL IVE WITNESSED!!","2020-02-21T18:03:55.000Z","UCHeP9WNFZbfR1v7HKrNOQIA","KickTown","22","20.26.02","[none]","327334","19830","164","443","https://i.ytimg.com/vi/YQRni4skt5U/default.jpg","False","False","BOOK: https://kicktownfootball.com/bookings/Find out more about the KickTown Arenas: https://www.kicktownfootball.com/the-arenas/Join the club: https://www.kicktownfootball.com/the-club/The sick Goal: https://www.youtube.com/channel/UCq7tIe_6iwVFIHQja3Qt0DQThe Kicktown monatge: https://www.youtube.com/user/xImWoodyInstagram: https://www.instagram.com/kicktownfootball/Facebook: https://www.facebook.com/KickTownFootball/Twitter: https://twitter.com/kicktowntweets"
"wM9P7HKdNho","KSI – Wake Up Call (feat. Trippie Redd) BTS","2020-02-21T15:00:14.000Z","UCVtFOytbRpEvzLjvqGG5gxQ","KSI","24","20.26.02","KSI|Wake Up Call|Trippie Redd|Nayip Ramos|Asher Brown","1408549","88860","2393","5480","https://i.ytimg.com/vi/wM9P7HKdNho/default.jpg","False","False","Watch The Official Video For “WAKE UP CALL” : https://K-S-I.lnk.to/WakeUpCallID/youtube Get “WAKE UP CALL”  https://K-S-I.lnk.to/WakeUpCallID  Follow KSI on all platforms: https://linktr.ee/ksi Director: Nayip Ramos Producer: Asher BrownBTS Shot and edited by: @_o93c https://www.instagram.com/_o93cManagement: Mams Taylor - mams@premierleaguemusic.com https://www.premierleagueentertainment.com/Lyrics:  Trippie Redd  Don’t wake up when it’s too late They might think that you hate meIma get it in while you wait Better late than never Yeah, this the WAKE UP CALLAin’t no walking out you better wake up dawgYeah, this the WAKE UP Call Every other day I’m getting cake like Yooo!Yeah, this the WAKE UP CALL. Ain’t no walking out you better wake up dawgYeah, get your face bust off Your bitch with me now tryin’ to get face fucked dawgOkay  KSI  Funny innit (ha)Now they wanting to get it (money)Now they wanting to visit (Ay)Cos they watching the Richard (Mille)See me getting the cheddar (cheesy)See me sprinkle the pepper (season)Panoramic my view in leading and trending whatever,  Trippie Redd – Okay KSI  Bill it (yeah)Thurman how I go kill it (Bill)Hire steak and get fillet (Beef)X amount to exhibit I’m winning in different avenues (Views)Trippie my revenue(Yeah)Don’t see me ever lose I jump hurdles like kangaroos (damn) Trippie Redd  Don’t wake up when it’s too late They might think that you hate meIma get it in while you wait Better late than never Yeah, this the WAKE UP CALLAin’t no walking out you better wake up dawgYeah, this the WAKE UP Call Every other day I’m getting cake like Yooo!Yeah, this the WAKE UP CALL. Ain’t no walking out you better wake up dawgYeah, get your face bust off Your bitch with me now tryin’ to get face fucked dawgOkay  KSI  Picture perfect Now that they know I’m worth it(Winning)Before they hatedNow they say I deserve it(Living)Back the beefShowing them how I bring it(Hitting) At the beach Sipping on something different (Swimming) Swimming in money they said I’ll never earn Kicked out of school, they said I’ll never learn Now I learned to make it countMultiplied the vision and making a high amount bitch Trippie Redd  Yeah In a big body swervin’ No suburban Bitch this is a BentlyPussy do not tempt me YEAH Cause the choppa get a buzzin’ have a nigga lookin’ likeRicky!   Yeah, this the WAKE UP CALLAin’t no walking out you better wake up dawgYeah, this the WAKE UP Call Every other day I’m getting cake like Yooo!Yeah, this the WAKE UP CALL. Ain’t no walking out you better wake up dawgYeah, get your face bust off Your bitch with me now tryin’ to get face fucked dawgOkay"
"4Th0EwFmkLA","Selena Gomez - Feel Me (Official Lyrics)","2020-02-21T05:00:01.000Z","UCjK8ORC71kwyj1DWFwril_A","SelenaGomezVEVO","10","20.26.02","Selena|Gomez|Feel|(Lyric|Video)|Interscope|Records|Pop","3878983","339759","2561","16482","https://i.ytimg.com/vi/4Th0EwFmkLA/default.jpg","False","False","Listen to Feel Me, out now: http://smarturl.it/FeelMeSGGet Selena's new album 'Rare': http://smarturl.it/RARESGFollow Selena:Instagram: https://www.instagram.com/selenagomez/Twitter: https://twitter.com/selenagomezFacebook: https://www.facebook.com/SelenaTik Tok: https://www.tiktok.com/@selenagomezYouTube: https://smarturl.it/SelenaYTListen on Apple Music: https://smarturl.it/SGEssentialsListen on Spotify: https://smarturl.it/SelenaGomezTheHitsSpGet exclusive Selena Gomez merch, available at: http://smarturl.it/SelenaStoreSign-up to be the first to hear news from Selena: http://smarturl.it/SelenaGomez.NewsBest of Selena Gomez https://goo.gl/mgJg2sSelena Gomez Audio https://goo.gl/dmJYbdLYRICSNo one love you like I love youNever cheat never lieNever put no one above you,I gave you space and timeNow you’re telling me you miss itAnd I’m still on your mindWe were one in a millionAnd love is hard to findDo you stay up lateJust so you don’t dream?Every time your lips touch anotherI want you to feel meI want you to feel meEvery time you dance with somebodyI want you to feel meI want you to feel meDo your days get a little bit longer?Nights get a little bit colder?Heart beat a little bit louder?OhhhDays get a little bit longer?Nights get a little bit colder?Heart beat a little bit louder?OhhhWhen you’re runningWho you run to?Where do you go to hide?When she ain’t giving you enough toGet you through the night?Won’t be caught up in the middleOf your highs and your lowsBaby long as you’re not with meYou’ll always be aloneDo you stay up lateJust so you don’t dream?Every time your lips touch anotherI want you to feel meI want you to feel meEvery time you dance with somebodyI want you to feel meI want you to feel meDo your days get a little bit longer?Nights get a little bit colder?Heart beat a little bit louder?OhhhDays get a little bit longer?Nights get a little bit colder?Heart beat a little bit louder?OhhhFeel me (feel me)Feel me (feel me)Feel me (feel me)Every time your lips touch anotherI want you to feel meI want you to feel meEvery time you dance with somebodyI want you to feel meI want you to feel meDo your days get a little bit longer?Nights get a little bit colder?Heart beat a little bit louder?OhhhDays get a little bit longer?Nights get a little bit colder?Heart beat a little bit louder?OhhhMusic video by Selena Gomez performing Feel Me (Lyric Video). © 2020 Interscope Recordshttp://vevo.ly/QGetBG"
"3x3HDTY919g","Race The Tube - Can You Walk Faster Than The Central Line?","2020-02-21T17:30:00.000Z","UCd18OhMfRmjMjzSHP7Zrzmw","Geoff Marshall","19","20.26.02","race the tube|beat the tube|central london|the tube|london underground|queensway|lancaster gate|notting hill gate|bayswater|paddington|geoff marshall|vicki pipe|all the stations","88037","3176","40","448","https://i.ytimg.com/vi/3x3HDTY919g/default.jpg","False","False","We're back out onto the Tube to try out a couple of connections where we think it's possible to walk faster than the Central line!First up, is the classic Queensway to Bayswater dodge, but after that did you know that Lancaster Gate to Paddington are exceedingly close, and can be easily walked? It's even an official TfL Out of Station Interchange as well, meaning you can break your journey between these two stations but still pay just the one fare.Hit subscribe if you like this, and look at the other videos in the 'Race The Tube' playlists where we've done more!"
"po5n6N4BrB8","Trying FOOD Gadget Hacks to see if they work","2020-02-20T19:15:04.000Z","UC2hFZwNM71iOOCY3guLE7KQ","Little Lia","26","20.26.02","sssniperwolf|little lia|hacks|life hacks|lifehacks|useful things|beauty hacks|beauty|do it yourself|diy|to|see|if|they|work|kitchen|food","3082366","47507","3847","4024","https://i.ytimg.com/vi/po5n6N4BrB8/default.jpg","False","False","Trying Kitchen Gadget & food Life Hacks to see if they work! Today we're trying out some more DIY lifehacks! Leave a Like if you enjoyed! Watch the last one https://youtu.be/XvLbBMBHcDI Subscribe so you don’t miss videos!Main Channel: https://www.youtube.com/user/sssniperwolfInstagram: http://instagram.com/sssniperwolfTwitter: http://www.twitter.com/sssniperwolfFacebook: https://www.facebook.com/sssniperwolfOfficial Merch: https://ogwolfpack.com/"
"tcec9VAgLMQ","Building & Riding a FAST wooden berm","2020-02-21T14:00:13.000Z","UCu8YylsPiu9XfaQC74Hr_Gw","Seth's Bike Hacks","17","20.26.02","mtb|mountain bike|bike repair|biking|bike riding|bike tricks|bike trials|cycling|DIY|home improvement|outdoors|building|berm|backyard trails|enduro","688792","29895","236","1409","https://i.ytimg.com/vi/tcec9VAgLMQ/default.jpg","False","False","Well, here's to learning to do something new! This wooden mountain bike berm is the first ever on Berm Peak, and it was full of learning experiences. Next time it'll look a little neater and go together smoother, but overall I think we built something very functional. So far this is one of my favorite home improvement projects. I can't stop going back there and roasting this thing!Berm Peak Gloveshttps://cognativemtb.com/collections/seths-bike-hacks-collection/products/berm-peak-mtb-tech-gloveYouth Sized Berm Peak Gloveshttps://cognativemtb.com/collections/seths-bike-hacks-collection/products/berm-peak-mtb-tech-glove-youthCheck out Backyard Trail Builds https://www.youtube.com/channel/UC1iGpIm2g0D8lZvhtqetHmgCheck out Kevin's YouTube channelhttps://www.youtube.com/channel/UC4bKHbrzUtRGHnmFfYRaOXAThe guy who crashed at the end is Super Dave! He sure knows a thing or two about committing. He also holds races in the Southeastern USA, so check out his Instagram https://www.instagram.com/gonutsbiking/?hl=enCheck out my second channel: https://www.youtube.com/channel/UCOpP5PqrzODWpFU961acUbgBerm Peak Playlist https://bit.ly/2jXkMEqBerm Creek Playlist https://bit.ly/2lzA56OInstagram https://www.instagram.com/sethsbikehacksFacebook https://www.facebook.com/sethsbikehacksAll music in this video is from http://share.epidemicsound.com/trQSg#DIY #mountainbikingI'm also working on a long-term moonshot project: Building a free public bike park in the Asheville metro area. Join my Patreon and 100% of the proceeds go towards funding this. https://www.patreon.com/sethsbikehacksAdvertising disclosure: All of these videos contain products, logos, or mentions associated with Diamondback Bicycles. Whether or not the video itself was sponsored by Diamondback, they do support this channel, and by extension, every video on it."
"Aam8A5HMp_8","2020 Pre-Season Testing: Day 3 Highlights","2020-02-21T18:58:45.000Z","UCB_qr75-ydFVKSF9Dmo6izg","FORMULA 1","17","20.26.02","F1|Formula One|Formula 1|Sports|Sport|Action|GP|Grand Prix|Auto Racing|Motor Racing|F1 Testing|F1 Testing 2020|Barcelona|Mercedes|Lewis Hamilton|Ferrari|Bottas|Vettel","969426","20398","181","1299","https://i.ytimg.com/vi/Aam8A5HMp_8/default.jpg","False","False","The first pre-season test of 2020 is over - and it's a familiar duel at the top of the timing screen.For more F1® videos, visit http://www.Formula1.comLike F1® on Facebook: https://www.facebook.com/Formula1/Follow F1® on Twitter: http://www.twitter.com/F1Follow F1® on Instagram: http://www.instagram.com/F1#F1"
"GF0hMKW_oRg","LUDICROUS Valuation Has Dragons Bouncing Off The Walls And Boxes | Dragons' Den","2020-02-21T12:00:02.000Z","UCDAzmE9V4Xw5CdLkn3pvO3A","Dragons' Den","24","20.26.02","dragon's den|dragon's den uk|evan davis|deborah meaden|peter jones|touker suleyman|tej lalvani|business pitching|entrepreneur|game show|reality tv|shark tank|Having your own skin in the game|PARKOUR GENERATIONS|worlds best parkour and freerunning|stuntsamazing parkour|worlds best parkour and freeruninng of all time|rooftop parkour|best parkour|best parkour and freerunning|best freerunning|PARKOUR DRAGONS DEN|dragons den 2020|dragons den 2020 episodes","204274","1974","97","670","https://i.ytimg.com/vi/GF0hMKW_oRg/default.jpg","False","False","Dan Edwardes plans to break into mainstream gyms with his 'Parkour Generations' fitness classes, he believes the classes counter our technological lifestyles. Dan is seeking an investment of £150,000 in return for a 5% equity stake but the Dragons can't wrap their heads around such a valuation. An international sensation, Dragon's Den features entrepreneurs pitching for investment in the Den from our Dragons, five venture capitalists willing to invest their own money in exchange for equity.#DragonsDen #Parkour #JennyCampbell #PeterJones #Business"
"-LrJxTtnqMg","BTS Live Interview On New Album 'Map Of The Soul: Seven' | TODAY","2020-02-21T14:24:57.000Z","UChDKyKQ59fYz3JO2fl0Z6sg","TODAY","25","20.26.02","Music|Television|Pop Culture|Big News|Today|The TODAY Show|TODAY Show|NBC|NBC News|Lifestyle|TODAY Show Interview|Donna Farizan|Al Roker|TODAY show news|news|Map Of The Soul|BTS Live Interview|New Album|bts interview|korea now bts|Jin|Suga|Jungkook|map of the soul bts|bts interview 2020|K pop|kpop today news|k pop on today news|k pop album|k pop interview|New Album on today news|celebrity interview|music stars|korea now jimin|J Hope","824227","85964","364","2972","https://i.ytimg.com/vi/-LrJxTtnqMg/default.jpg","False","False","On the same day the South Korean boy band BTS release “Map of the Soul: Seven,” their highly anticipated new album, Jin, Suga, J-Hope, RM, Jimin, V and Jungkook are on a fan-packed TODAY plaza for a live interview. “Music truly transcends languages and nationalities and races,” RM says.» Subscribe to TODAY: http://on.today.com/SubscribeToTODAY» Watch the latest from TODAY: http://bit.ly/LatestTODAYAbout: TODAY brings you the latest headlines and expert tips on money, health and parenting. We wake up every morning to give you and your family all you need to start your day. If it matters to you, it matters to us. We are in the people business. Subscribe to our channel for exclusive TODAY archival footage & our original web series.  Connect with TODAY Online!Visit TODAY's Website: http://on.today.com/ReadTODAYFind TODAY on Facebook: http://on.today.com/LikeTODAYFollow TODAY on Twitter: http://on.today.com/FollowTODAYFollow TODAY on Instagram: http://on.today.com/InstaTODAYFollow TODAY on Pinterest: http://on.today.com/PinTODAY#BTS #MapOfTheSoulSeven #TodayShowBTS Live Interview On New Album 'Map Of The Soul: Seven' | TODAY"
"OIfFJCfCiWg","Gerry Cinnamon - Where We're Going (Official Audio) - Lyrics in description.","2020-02-21T00:00:02.000Z","UCNo045Nm5EXd2m__lW09N0g","GERRY CINNAMON","10","20.26.02","Gerry Cinnamon|The Bonny|Where We’re Going|Sun Queen|Dark Days|Canter|Belter|Sometimes|Lullaby|Gerry Cinnamon Live|Gerry Cinnamon Acoustic|Gerry Cinnamon Cover|Gerry Cinnamon Session|Gerry Cinnamon Video|Gery Cinnamon|What Have You Done|Diamonds in The Mud|Erratic Cinematic","169265","4702","57","371","https://i.ytimg.com/vi/OIfFJCfCiWg/default.jpg","False","False","‘Where We’re Going’ is taken from the forthcoming album: THE BONNYPre-order THE BONNY: https://gerrycinnamon.lnk.to/thebonnyYDListen to ‘Where We’re Going’: https://gerrycinnamon.ffm.to/wwgoing.ydWhere We’re Going Lyrics by Gerry Cinnamon: Can I get back to my loneliness I don’t know what to do with all the happiness That you’re giving me Lately-You know that I can turn my hand to anything But it seems that in the end I fuck up everything And it’s killing me Slowly -Endless time love There will be another place for you and me Endless time love And nothing really matters really I hope one day love You can open up your eyes and you will seeIt’s only destiny Where we’re going this shit don’t matter -Hanging round in places that I shouldn’t be Taking no shit and making enemies like I gotta be Fuckin crazy -Rolling in directions that I don’t believe Pretending that I’m someone that I’ll never be I will never be I could never be -Endless time love There will be another place for you and me Endless time love And nothing really matters really I hope one day love You can open up your eyes and you will seeIt’s only destiny Where we’re going this shit don’t matter-Can I get back to my loneliness I don’t know what to do with all the happiness That you’re giving me Lately-You know that I can turn my hand to anything But it seems that in the end I fuck up everythingAnd it’s killing me Slowly -Endless time love There will be another place for you and me Endless time love And nothing really matters really I hope one day love You can open up your eyes and you will seeIt’s only destiny Where we’re going this shit don’t matter.#GerryCinnamon #WhereWereGoing #TheBonnyFollow Gerry Cinnamon.Instagram: https://gerrycinnamon.lnk.to/instagramYDFacebook: https://gerrycinnamon.lnk.to/facebookYDTwitter: https://gerrycinnamon.lnk.to/twitterYDWebsite: https://www.gerrycinnamonmusic.comStore: https://gerrycinnamon.lnk.to/shopYDSpotify: https://gerrycinnamon.lnk.to/spotifyYDApple: https://gerrycinnamon.lnk.to/applemusicYD"
"tLasOVx5CQw","Lil Tjay - Forever Pop","2020-02-20T20:04:01.000Z","UCEB4a5o_6KfjxHwNMnmj54Q","Lil Tjay","10","20.26.02","[none]","2164676","153606","1739","9892","https://i.ytimg.com/vi/tLasOVx5CQw/default.jpg","False","False","RIP Pop Smoke"
"9mshRaY8gTs","Legends Summarized: Robin Hood","2020-02-21T16:00:03.000Z","UCodbH5mUeF-m_BsNueRDjcw","Overly Sarcastic Productions","27","20.26.02","Funny|Summary|OSP|Overly Sarcastic Productions|Analysis|Literary Analysis|Myths|Legends|Classics|Literature|Stories|Storytelling|History|robin hood|england|english folklore|little john|will scarlett|much the miller's son|maid marian","519525","40205","1278","5158","https://i.ytimg.com/vi/9mshRaY8gTs/default.jpg","False","False","The man! The myth! The legend! What exactly IS this verdant vigilante's deal? LET'S TALK ABOUT ITOur content is intended for teenage audiences and up.PATREON: https://www.Patreon.com/OSPMERCH LINKS: https://www.redbubble.com/people/OSPYouTubeOUR WEBSITE: https://www.OverlySarcasticProductions.com/Find us on Twitter https://www.Twitter.com/OSPYouTubeFind us on Reddit https://www.Reddit.com/r/OSP/"
"d7qqu9HC7V0","Will Ferrell Deeply Regrets Eating Spicy Wings | Hot Ones","2020-02-20T16:00:13.000Z","UCPD_bxCRGpmmeQcbe2kpPaA","First We Feast","26","20.26.02","First we feast|fwf|firstwefeast|food|food porn|cook|cooking|chef|kitchen|recipe|cocktail|bartender|craft beer|complex|complex media|Cook (Profession)sean evans|will ferrell|will ferrall hot ones|will ferrall hot sauce|will ferrall spicy wings|will ferrall sean evans|will ferrall hot wings|hot ones|hot ones hot sauce|the last dab|will ferrall interview","8398189","229588","4670","17873","https://i.ytimg.com/vi/d7qqu9HC7V0/default.jpg","False","False","Will Ferrell is a comedy icon with a storied career in TV and film that span decades. He stars alongside fellow comedic legend Julia Louis-Dreyfuss in the new film Downhill, in theaters now. But how is he with spicy food? Find out as he takes on the wings of death with host Sean Evans in an especially improvisational Hot Ones (fun fact: JLD was hoping to join but was too under the weather). Along the way, Ferrell shares behind-the-scenes stories from beloved movies like Anchorman and Old School, discusses the origins of his famous Harry Caray impersonation on Saturday Night Live, and expresses sincere shock that Seinfeld and Friends fans don't always get along.Be sure to catch Hot Ones: The Game Show every Tuesday @ 10pm ET/PT on truTV!BUY THE LAST DAB XXX NOW: https://heatonist.com/products/hot-ones-the-last-dab?variant=378416136201BUY THE CLASSIC HOT ONES HOT SAUCE NOW: https://bit.ly/2Q1VfIhBUY LOS CALIENTES HOT SAUCE NOW: https://bit.ly/2LMDxqSNEW HOT ONES MERCH AVAILABLE NOW: https://bit.ly/2AIS271SIGN UP for the Hot Ones Monthly Hot Sauce Subscription box: https://bit.ly/2veY50PSubscribe to First We Feast on YouTube: http://goo.gl/UxFzhKCheck out more of First We Feast here:http://firstwefeast.com/https://twitter.com/firstwefeasthttps://www.facebook.com/FirstWeFeasthttp://instagram.com/firstwefeastFirst We Feast videos offer an iconoclastic view into the culinary world, taking you behind-the-scenes with some of the country's best chefs and finding the unexpected places where food and pop culture intersect."
"pDJbFA32_QY","Westworld | Official Season 3 Trailer | HBO","2020-02-20T17:30:28.000Z","UCVTQuK2CaWaTgSsoNkn5AiQ","HBO","24","20.26.02","[none]","3002561","57900","2064","5697","https://i.ytimg.com/vi/pDJbFA32_QY/default.jpg","False","False","Your world. Season 3 premieres March 15 at 9PM on HBO. #WestworldSubscribe to HBO on YouTube: https://goo.gl/wtFYd7Don’t have HBO? Order Now: https://itsh.bo/GetHBONow Get More HBO: Get HBO GO: https://play.hbogo.comLike on Facebook: https://www.facebook.com/westworldHBOFollow on Twitter: https://twitter.com/westworldHBOLike on Instagram: https://www.instagram.com/westworldHBOOfficial Site: http://www.hbo.com/westworldWestworld | Official Season 3 Trailer | HBO"
"ZG36pYrujIo","Why I Left","2020-02-21T00:05:41.000Z","UCQCnMFr8uHBaMTaNBhych_A","Mini Ladd","22","20.26.02","[none]","1669294","141775","5160","11428","https://i.ytimg.com/vi/ZG36pYrujIo/default.jpg","False","False","What's Been Going On.Vlog Channel: http://bit.ly/CraigThompsonVlogsGet Your Own LADD Clothing: http://www.shopladd.comInstagram: http://instagram.com/miniladddTwitter: http://www.twitter.com/MiniLadddLivestream: http://www.twitch.tv/MiniladddDiscord: https://discord.gg/miniladdFacebook: http://www.facebook.com/MiniLadddTikTok: https://bit.ly/2V9s48v"
"EVCyTpxIO4c","Aitch - MICE (Official Video)","2020-02-19T19:41:33.000Z","UCi1z2e3LwosX3kvAbWdBB2A","Aitch","10","20.26.02","aitch|officialaitch|40aitch|grime|manchester|music|sbtv|grm|grmdaily|linkuptv|ukmusic|ukgrime|bugzy|malone|manny|on|the|map|rapper|vibsing|straight|rhymez|aitch new music|official aitch|haitch|8itch|nothern quarterz|aitch new freestyle|aitch mice|mice aitch|freestyle aitch|Aitch manchester|manchester rap","1421735","66560","1728","2342","https://i.ytimg.com/vi/EVCyTpxIO4c/default.jpg","False","False","Listen to MICE now https://Aitch.lnk.to/MiceID/  Directed by Kelvin Jones by KARTIXStream and Save MICE@Spotify - https://Aitch.lnk.to/MiceID/Spotify Apple Music - https://Aitch.lnk.to/MiceID/AppleMusic Amazon Music - https://Aitch.lnk.to/MiceID/AmazonMusic YouTube Music - https://Aitch.lnk.to/MiceID/YouTubeMusic Youtube Music Video- https://Aitch.lnk.to/MiceID/Youtube Deezer - https://Aitch.lnk.to/MiceID/Deezer iTunes - https://Aitch.lnk.to/MiceID/Itunes  Aitch Essentials Apple - https://aitch.lnk.to/LISTENID/AppleMusic This is Aitch Spotify - https://aitch.lnk.to/LISTENID/Spotify Big Shell Spotify - https://aitch.lnk.to/LISTENID/SpotifyManual   Life of Aitch on YouTube - https://aitch.lnk.to/LISTENID/Youtube  Join the Aitch QSign up at the Official Website - https://Aitch.lnk.to/SocialsID/WebsiteGeneral Youtube - https://Aitch.lnk.to/SocialsID/Youtube Tik Tok - https://Aitch.lnk.to/SocialsID/TikTok Instagram - https://Aitch.lnk.to/SocialsID/Instagram Facebook -https://Aitch.lnk.to/SocialsID/Facebook/ Twitter - https://Aitch.lnk.to/SocialsID/TwitterSoundcloud - https://Aitch.lnk.to/SocialsID/Soundcloud2/Spotify - https://Aitch.lnk.to/SocialsID/Spotify  Apple Music - https://Aitch.lnk.to/SocialsID/AppleMusic Follow NQ: Twitter: https://twitter.com/thisisnqInstagram: https://www.instagram.com/thisisnq/Soundcloud: https://soundcloud.com/thisisnqFacebook: https://www.facebook.com/thisisnq/Snapchat: https://www.snapchat.com/add/thisisnq#Aitch #MICE"
