video_id,title,publishedAt,channelId,channelTitle,categoryId,trending_date,tags,view_count,likes,dislikes,comment_count,thumbnail_link,comments_disabled,ratings_disabled,description
"wSNd02kVv8o","BTS: Black Swan","2020-01-29T07:07:58.000Z","UCJ0uqCI0Vqr2Rrt1HseGirg","The Late Late Show with James Corden","24","20.29.01","The Late Late Show|Late Late Show|James Corden|Corden|late night|late night show|comedy|comedian|celebrity|celeb|celebrities|CBS|joke|jokes|funny|funny videos|funny video|humor|hollywood|famous","4998321","1005181","9203","57786","https://i.ytimg.com/vi/wSNd02kVv8o/default.jpg","False","False","Late Late Show music guest BTS lights up Stage 56 with their debut performance of Black Swan, the latest hit from the Kpop super group.More Late Late Show:Subscribe: http://bit.ly/CordenYouTubeWatch Full Episodes: http://bit.ly/1ENyPw4Facebook: http://on.fb.me/19PIHLCTwitter: http://bit.ly/1Iv0q6kInstagram: http://bit.ly/latelategramWatch The Late Late Show with James Corden weeknights at 12:35 AM ET/11:35 PM CT. Only on CBS.Get new episodes of shows you love across devices the next day, stream live TV, and watch full seasons of CBS fan favorites anytime, anywhere with CBS All Access. Try it free! http://bit.ly/1OQA29B---Each week night, THE LATE LATE SHOW with JAMES CORDEN throws the ultimate late night after party with a mix of celebrity guests, edgy musical acts, games and sketches. Corden differentiates his show by offering viewers a peek behind-the-scenes into the green room, bringing all of his guests out at once and lending his musical and acting talents to various sketches. Additionally, bandleader Reggie Watts and the house band provide original, improvised music throughout the show. Since Corden took the reigns as host in March 2015, he has quickly become known for generating buzzworthy viral videos, such as Carpool Karaoke."
"owWMJK2RQ6E","Highlights | Leeds United 3-2 Millwall | 2019/20 EFL Championship","2020-01-29T01:00:04.000Z","UCyQcJHDN4uYfPa1DHzKVSnw","Leeds United Official","17","20.29.01","sp:ty=high|sp:dt=2020-01-28T19:45:00Z|sp:st=soccer|sp:li=eng_ch|sp:ti:home=LEE|sp:ti:away=MIL","129115","2073","92","406","https://i.ytimg.com/vi/owWMJK2RQ6E/default.jpg","False","False","Highlights from Leeds United’s 3-2 comeback win against Millwall in the 2019/20 EFL Championship. Presented by Wish - Shopping Made Fun.#LeedsUnited #LUFCGet exclusive Leeds United video content first - download the Official App: http://bit.ly/LUTVappIf you thought this video was 🔥 don't forget to subscribe and hit the like 👍 button! Also if you want to get a notification every time we post hit the bell 🛎 button in the top right corner. MOT. ALAW. ⚽️If you want to keep up with everything Leeds, go check out our other pages https://www.facebook.com/LeedsUnited/https://twitter.com/LUFChttps://www.instagram.com/leedsunited/?hl=enhttps://www.leedsunited.com"
"66-fQ1x2uCg","FULL PRESS CONFERENCE | Jake Paul vs. AnEsonGib","2020-01-28T22:41:21.000Z","UCurvRE5fGcdUgCYWgh-BDsg","DAZN USA","17","20.29.01","jake paul|anesongib|gib|jake paul gib|highlights|press conference|full|presser|matchroom boxing|dazn|eddie hearn|shane mosley","850715","22332","1026","2839","https://i.ytimg.com/vi/66-fQ1x2uCg/default.jpg","False","False","Big fights. Any device. One price. DAZN is the only place to watch Gennadiy “GGG” Golovkin, Canelo Alvarez, and Anthony Joshua. Download the app now at http://bit.ly/DAZN_YT and get one of the best schedules in combat sports, including: Budd vs. Cyborg (January 25)Andrade vs. Keeler (January 30)Farmer vs. Diaz (January 30)Paul vs. Gib (January 30)Ryan Garcia vs. Fonseca (February 14)Mikey Garcia vs. Vargas (February 29)FOLLOW DAZN USA ON SOCIAL MEDIA! 👇 Twitter: http://www.twitter.com/dazn_usa Facebook: http://www.facebook.com/daznusa Instagram: http://www.instagram.com/dazn_usaFOLLOW CHANGEUP ON SOCIAL MEDIA! 👇 Twitter: http://www.twitter.com/changeupondazn  Instagram: http://www.instagram.com/changeupondaznFOLLOW PAT MCAFEE ON SOCIAL MEDIA! 👇 Twitter: http://www.twitter.com/patmcafeeondazn  Instagram: http://www.instagram.com/patmcafeeondazn"
"sk00epALZps","Jimmy Kimmel Remembers Kobe Bryant","2020-01-28T08:30:02.000Z","UCa6vGFO9ty8v5KZJXQxdhaw","Jimmy Kimmel Live","23","20.29.01","jimmy|jimmy kimmel|jimmy kimmel live|late night|talk show|clip|mean tweets|Kobe Bryant|Tribute|RIP Kobe|Lakers|Los Angeles Lakers|LA Lakers|Remembering Kobe|Mamba Mentality|Purple and Gold|NBA|Basketball|Gianna Bryant|Kobe Charity|Kobe and Vanessa Bryant Family Foundation|Black Mamba|Mamba4ever","8203509","321573","6145","15791","https://i.ytimg.com/vi/sk00epALZps/default.jpg","False","False","Jimmy pays tribute to Kobe Bryant the day after he and his daughter Gianna and seven of their friends were killed in a helicopter crash. We take a look back at some of our favorite moments with Kobe from his 15 appearances on our show over the years. If you want to remember Kobe in a philanthropic way, make a donation to The Kobe and Vanessa Bryant Family Foundation. http://kvbff.orgJimmy Kimmel Remembers Kobe Bryanthttps://youtu.be/sk00epALZps"
"-c2afF2euq4","SIDEMEN REVERSE HIDE & SEEK ON A PRIVATE ISLAND","2020-01-28T19:00:00.000Z","UCh5mLn90vUaB1PbRRx_AiaA","MoreSidemen","22","20.29.01","[none]","1403732","85991","737","2581","https://i.ytimg.com/vi/-c2afF2euq4/default.jpg","False","False","• Sidemen: http://www.youtube.com/Sidemen• Sidemen Clothing: http://www.sidemenclothing.com• Sidemen Twitter: https://twitter.com/Sidemen----------------------------------------------------------------------Sidemen:• Miniminter: http://www.youtube.com/Miniminter• Zerkaa: http://www.youtube.com/Zerkaa• Behzinga: http://www.youtube.com/Behzinga• Vikkstar123: http://www.youtube.com/Vikkstar123• TBJZL: http://www.youtube.com/TBJZL• Wroetoshaw: http://www.youtube.com/Wroetoshaw• KSI: http://www.youtube.com/KSIedited by https://twitter.com/TegsRFoutro song https://www.youtube.com/watch?v=3O7FQdHrHLM"
"imUvGNJRNvg","Villa reach final with last-gasp goal | Aston Villa 2-1 Leicester | Carabao Cup Highlights","2020-01-28T21:56:55.000Z","UCNAf1k0yIjyGu3k9BwAg3lg","Sky Sports Football","17","20.29.01","sky sports|premier league|Football League|football|Sky Sports live|Sky|Sports|stream|sky sports football|carabao cup|Aston Villa|Leicester|carabao highlights 1920|jack grealish|aston villa vs leicester|leicester city|aston villa highlights","519559","8519","219","1332","https://i.ytimg.com/vi/imUvGNJRNvg/default.jpg","False","False","SUBSCRIBE ► http://bit.ly/SSFootballSubPREMIER LEAGUE HIGHLIGHTS ► http://bit.ly/SkySportsPLHighlightsHighlights of the Carabao Cup semi-final 2nd leg between Aston Villa and Leicester City at Villa Park.Watch Premier League LIVE on Sky Sports here ► http://bit.ly/WatchSkyPL►TWITTER: https://twitter.com/skysportsfootball►FACEBOOK: http://www.facebook.com/skysports►WEBSITE: http://www.skysports.com/footballMORE FROM SKY SPORTS ON YOUTUBE:►SKY SPORTS FOOTBALL: http://bit.ly/SSFootballSub►SKY SPORTS BOXING: http://bit.ly/SSBoxingSub►SOCCER AM: http://bit.ly/SoccerAMSub►SKY SPORTS F1: http://bit.ly/SubscribeSkyF1"
"TsNf7KxejKI","Shaq Reflects On Kobe Bryant's Death","2020-01-29T00:35:36.000Z","UC9-OpMMVoNP5o10_Iyq7Ndw","Bleacher Report","17","20.29.01","bleacher report|br|nba|shaq|shaq kobe|kobe bryant|inside the nba|inside the nba kobe|kobe bryant nba|kobe bryant lakers|shaq remembers kobe|shaq reflects on kobe bryant|shaq kobe lakers|shaq kobe nba|los angeles lakers|inside the nba on kobe|tnt on kobe|nba on kobe's passing|remembering kobe bryant|kobe bryant memoriam|kobe bryant death","6906321","236177","2248","14537","https://i.ytimg.com/vi/TsNf7KxejKI/default.jpg","False","False","Shaq and the TNT family reflect on Kobe Bryant's death. Subscribe: https://www.youtube.com/user/BleacherReport?sub_confirmation=1Follow on IG: http://www.instagram.com/f/bleacherreportFollow us on Twitter: http://www.twitter.com/bleacherreportLike us on Facebook: http://www.facebook.com/bleacherreport"
"BHlAlN3z4ss","FAST AND FURIOUS 9 Teaser Trailer 2 (2020)","2020-01-28T17:39:27.000Z","UCT0hbLDa-unWsnZ6Rjzkfug","FilmSelect Trailer","24","20.29.01","trailer|movie|filmselect|2020|FAST AND FURIOUS 9|FAST AND FURIOUS 9 Trailer|Vin Diesel|John Cena|Action","1904415","49033","2116","3917","https://i.ytimg.com/vi/BHlAlN3z4ss/default.jpg","False","False","Second teaser for Fast And Furious 9 starring Vin Diesel"
"wDuQegkx8Gk","IMPOSSIBLE HOLE IN THE GOAL CHALLENGE! ⚽️😱","2020-01-28T18:05:53.000Z","UCKvn9VBLAiLiYL4FFJHri6g","F2Freestylers - Ultimate Soccer Skills Channel","17","20.29.01","f2|the f2|f2 freestylers|skills|tekkers|tricks|football|soccer|billy wingrove|jeremy lynch|football freestyle|freestylers|football duo|football freestylers|soccer am|messi|neymar|ronaldo|freekickerz|skilltwins|bin shots|trickshots|football trickshots|soccer tricks|soccer skills|Impossible|Goal|Hole|In|The|Target|Challenge|Epic|Insane","763895","42010","494","974","https://i.ytimg.com/vi/wDuQegkx8Gk/default.jpg","False","False","THIS CHALLENGE IS OUR HARDEST TO DATE! 😱 THIS IS AN EPIC HOLE IN THE GOAL TARGET CHALLENGE! ⚽️💥100 BALL CHALLENGE: https://youtu.be/SCrUsufuMKg#UCL #Challenge #ad► Don't forget to SUBSCRIBE: http://bit.ly/SubscribeF2► CHECK OUT OUR CLOTHING RANGE! http://bit.ly/RascalClothing► SUBSCRIBE TO F2FC! http://bit.ly/SubF2FC► GET THE FIRST EVER F2 BOOK! http://bit.ly/F2Book1► GET OUR #1 BEST SELLING BOOK! http://bit.ly/F2Book2► GET OUR FIRST EVER GRAPHIC NOVEL! http://bit.ly/F2GN1► GET F2 WORLD CLASS! http://bit.ly/F2Book3DOWNLOAD OUR BOOK APP FOR FREE ► The F2 App on Apple/iOS - http://bit.ly/F2AppiOS► The F2 App on Android - http://bit.ly/F2AndroidTo keep up to date with us at any time in any place then follow us on;Twitter - http://bit.ly/F2TwitterInstagram - http://bit.ly/F2InstagramFacebook - http://bit.ly/F2FacebookSnapchat - http://bit.ly/F2SnapchatStay tuned by subscribing to our channel to see all of the amazing videos coming up in the near future! Love, peace & tekkers! Billy & Jezza"
"fdaDmAmvCXs","EPL vs La Liga - You laugh, you lose ft. Pogba, Griezmann, Hazard & Messi!","2020-01-28T17:00:13.000Z","UC2-0sEOYbQFuaURd_AU6Krg","Onefootball English","17","20.29.01","Football|Soccer|Onefootball|Football app|premier league|epl|transfers|442oons|la liga|442oons onefootball|football cartoons|funny football|luis suarez|lionel messi|messi|antoine griezmann|griezmann barcelona|barcelona|barcelona news|barcelona transfers|harry kane|suarez 442oons|messi 442oons|paul pogba|man united|gareth bale|real madrid|harry maguire|kevin de bruyne|man city|eden hazard|jurgen klopp|funny cartoons|you laugh you lose","199080","7608","214","428","https://i.ytimg.com/vi/fdaDmAmvCXs/default.jpg","False","False","The Onefootball x 442oons show is here with an 'EPL vs La Liga - You laugh, you lose' episode! Up against each other tonight are Lionel Messi, Eden Hazard, Antoine Griezmann, Gareth Bale, Paul Pogba, Harry Kane, Kevin de Bruyne, Harry Maguire and more!  ► Liked the video? Let us know by subscribing to our channel: http://bit.ly/SubscribeToOnefootball► Liked it a lot? Download our app: http://bit.ly/2GeDHEKOnefootball is the world's most comprehensive football app and is available free on iOS, Android and Windows Phone!► Check our website: https://www.onefootball.com/en► Like us on Facebook: http://bit.ly/1YpT8ud► Follow us on Twitter: http://bit.ly/2lDcoK8► Follow us on Instagram: http://bit.ly/1U7uYQh► Listen to the Onefootball podcast: http://bit.ly/2617W55Photo credits: Getty"
"BKKEqyaCmfY","MCR - Fire In The Booth","2020-01-28T19:17:58.000Z","UCRmmd8tl3sT96cqDynL4Qgg","Stephen Tries","23","20.29.01","comedy|sketch|comedy sketch|stephen tries|how to be|funny sketch|funny video|mcr|fire in the booth|rap|donk|donk scene saviour|mcr donk scene saviour|comedy rap|song parody","221673","34257","158","1142","https://i.ytimg.com/vi/BKKEqyaCmfY/default.jpg","False","False","Today we're meeting back up with the hottest spitters this side of the River Nile.If you enjoyed the video please leave a like and subscribe2nd channel - https://www.youtube.com/stephentrieslessWritten by - Stephen TriesStarringMax Smith - https://twitter.com/GongWeTony Wright - https://www.instagram.com/tony_wright97/Cameron Green - https://www.instagram.com/instacam_73/and myselfInstagram - https://www.instagram.com/stephen_tries/Twitter - https://twitter.com/StephenTries"
"b9Y4bmbh1KY","Bonanzaville, Hour 1 | Rolex Oyster Cosmograph & Documentation, ca. 1971 | ANTIQUES ROADSHOW | PBS","2020-01-28T02:00:11.000Z","UCdnJJ2_mzqHwKIX_SmCVHTA","Antiques Roadshow PBS","24","20.29.01","antiques roadshow|antiques|pbs|rolex|vintage watch|antique watch|watch collecting|Rolex Oyster Cosmograph|paul newman daytona|bonanzaville|fargo nd|appraisal","2143636","13500","307","1432","https://i.ytimg.com/vi/b9Y4bmbh1KY/default.jpg","False","False","Travel with ANTIQUES ROADSHOW to Bonanzaville in West Fargo for the biggest find of the season, and watch as the owner is floored by the appraisal--literally! Stream Bonanzaville, Hour 1 at: https://www.pbs.org/wgbh/roadshow/watch/episode/2404-bonanzaville-hour-1/.Watch full-length episodes of ANTIQUES ROADSHOW at http://www.pbs.org/wgbh/roadshow/watch/. To be the first to know about all our broadcast and tour info, subscribe to our newsletter and follow us on Facebook, Twitter, Instagram, and Pinterest at @RoadshowPBS!"
"-HfyDaFb6ok","Ellen Pays Tribute to Kobe Bryant's Legacy","2020-01-28T14:00:00.000Z","UCp0hYYBW6IMayGgR-WeoCvQ","TheEllenShow","24","20.29.01","ellen|ellen degeneres|the ellen degeneres show|ellentube|season 17|kobe bryant|kobe bryant ellen|kobe bryant tribute|gianna bryant|kobe bryant memorial|kobe bryant life|kobe bryant flashback|kobe bryant rip|bryant family|ellen tribute|kobe ellen|rest in peace kobe|ellen fans|ellen audience|ellen tickets","7423082","258596","2769","5772","https://i.ytimg.com/vi/-HfyDaFb6ok/default.jpg","False","False","Ellen paid tribute to the late Kobe Bryant by remembering his visits to the show, and by highlighting the kindness he showed to fans and deserving people.#KobeBryant#KobeBryantTribute#TheEllenShow"
"5wnmNwVG2bk","Jerry West On Kobe Always Having the Mamba Mentality | NBA on TNT","2020-01-29T03:26:24.000Z","UCU7iRrk3xfpUk0R6VdyC1Ow","NBA on TNT","17","20.29.01","NBA on TNT|NBA|Inside the NBA|Charles Barkley|Shaq|Kenny Smith|Ernie Johnson|Jerry West|Kobe bryant|Staples Center","534474","10427","215","746","https://i.ytimg.com/vi/5wnmNwVG2bk/default.jpg","False","False","Jerry West and Shaq detail some of their favorite memories they shared with Kobe Bryant.Watch highlights from Inside the NBA with Shaq, Charles Barkley, Kenny Smith and Ernie Johnson and more! Subscribe now to be updated on the latest videos: https://www.youtube.com/nbaontnt?sub_confirmation=1Connect with NBA on TNT:Follow NBA on TNT on Twitter: https://twitter.com/NBAonTNTLike NBA on TNT on Facebook: https://www.facebook.com/NBAONTNT/Follow NBA on TNT on Instagram: https://www.instagram.com/nbaontnt/?hl=en"
"x9532waiGcE","China races to develop vaccine before coronavirus mutates | DW News","2020-01-28T10:10:16.000Z","UCknLrEdhRCp1aegoMqRaCZg","DW News","25","20.29.01","DW News|coronavirus|corona virus|virus outbreak|china virus|virus china|virus outbreak china|wuhan virus|china virus 2020|wuhan|wuhan virus oubreak|china virus news|corona|coronavirus china|wuhan coronavirus|coronavirus outbreak|virus|china|wuhan lockdown|corona virus europe|coronavirus germany|coronavirus vaccine|corona virus vaccine|coronavirus munich|coronavirus münchen|coronavirus deutschland","1350144","13682","815","6099","https://i.ytimg.com/vi/x9532waiGcE/default.jpg","False","False","With China's deadly Wuhan coronavirus continuing to spread, scientists and pharmaceutical companies are racing to find a way to medically contain the virus. Lessons learned from the SARS epidemic nearly two decades ago may help them in developing a vaccine. It's a race against time before the virus has a chance to mutate. Global concerns over the virus are mounting, as more cases are identified abroad. Germany has now confirmed its first case of the virus. More than a dozen other countries are also reporting infections. In China the death toll has jumped to 100, with more than 45-hundred confirmed cases. Domestic travel bans are already in place, and now the government has asked people to delay foreign travel. For millions, life has come to a complete standstill.Subscribe: https://www.youtube.com/user/deutschewelleenglish?sub_confirmation=1For more news go to: http://www.dw.com/en/Follow DW on social media:►Facebook: https://www.facebook.com/deutschewellenews/►Twitter: https://twitter.com/dwnews►Instagram: https://www.instagram.com/dw_stories/Für Videos in deutscher Sprache besuchen Sie: https://www.youtube.com/channel/deutschewelle#Coronavirus #WuhanCoronavirus #ChinaCoronavirus"
"OD5GPVzFKkM","80-year-old Reveals Passionate First Night With Egyptian Toyboy | This Morning","2020-01-28T12:15:00.000Z","UChFsYLqPUyLiZnfRog6wiZA","This Morning","24","20.29.01","this morning|holly willoughby|phillip schofield|this morning funniest|Holly & Phillip funny","227439","2373","250","0","https://i.ytimg.com/vi/OD5GPVzFKkM/default.jpg","True","False","Subscribe now for more! http://bit.ly/1JM41yFAt 80-years-old, Iris believed she’d never find love again but after a chance conversation with 35-year-old Mohamed Ahmed Ibriham on social media, her dreams of romance finally came true. Within a fortnight, Mohamed had professed his love, and Iris had arranged to fly over to Cairo to meet him in person. And, despite her family and friends raising concern about the romance - Iris joined us to share her plans for their dream wedding and reveal their passionate first meeting!Broadcast on 28/01/20Like, follow and subscribe to This Morning!Website: http://bit.ly/1MsreVqYouTube: http://bit.ly/1BxNiLlFacebook: http://on.fb.me/1FbXnjUTwitter: http://bit.ly/1Bs1eI1This Morning - every weekday on ITV and STV from 10:00am.Join Holly Willoughby and Phillip Schofield, Ruth Langsford and Eamonn Holmes as we meet the people behind the stories that matter, chat to the hottest celebs and cook up a storm with your favourite chefs!Dr Zoe and Dr Ranj answer all your health questions, stay stylish with Gok Wan's fabulous fashion, be beautiful with Bryony Blake's top make-up tips, and save money with Martin Lewis.http://www.itv.comhttp://www.stv.tv#thismorning #phillipandholly #eamonnandruth"
"E1IX-MF82SI","Jon Batiste & Stephen Colbert Reflect On The Loss Of Kobe Bryant","2020-01-29T05:15:00.000Z","UCMtFAi84ehTSYSE9XoHefig","The Late Show with Stephen Colbert","24","20.29.01","The Late Show|Late Show|Stephen Colbert|Steven Colbert|Colbert|celebrity|celeb|celebrities|late night|talk show|comedian|comedy|CBS|joke|jokes|funny|funny video|funny videos|humor|hollywood|famous","535297","20553","390","1658","https://i.ytimg.com/vi/E1IX-MF82SI/default.jpg","False","False","Stephen Colbert and Jon Batiste offer their condolences and discuss the tragic helicopter crash that killed Kobe Bryant, Gianna Bryant, John Altobelli, Keri Altobelli, Alyssa Altobelli, Christina Mauser, Sarah Chester, Payton Chester and Ara Zobayan. #Colbert #JonBatiste #KobeBryantSubscribe To The Late Show Channel HERE: http://bit.ly/ColbertYouTubeFor more content from The Late Show with Stephen Colbert, click HERE: http://bit.ly/1AKISnRWatch full episodes of The Late Show HERE: http://bit.ly/1Puei40Like The Late Show on Facebook HERE: http://on.fb.me/1df139YFollow The Late Show on Twitter HERE: http://bit.ly/1dMzZzGFollow The Late Show on Google+ HERE: http://bit.ly/1JlGgzwFollow The Late Show on Instagram HERE: http://bit.ly/29wfREjFollow The Late Show on Tumblr HERE: http://bit.ly/29DVvtRWatch The Late Show with Stephen Colbert weeknights at 11:35 PM ET/10:35 PM CT. Only on CBS.Get the CBS app for iPhone & iPad! Click HERE: http://bit.ly/12rLxgeGet new episodes of shows you love across devices the next day, stream live TV, and watch full seasons of CBS fan favorites anytime, anywhere with CBS All Access. Try it free! http://bit.ly/1OQA29B---The Late Show with Stephen Colbert is the premier late night talk show on CBS, airing at 11:35pm EST, streaming online via CBS All Access, and delivered to the International Space Station on a USB drive taped to a weather balloon. Every night, viewers can expect: Comedy, humor, funny moments, witty interviews, celebrities, famous people, movie stars, bits, humorous celebrities doing bits, funny celebs, big group photos of every star from Hollywood, even the reclusive ones, plus also jokes."
"JGAcQ6UeIIM","Coronavirus: 50 confirmed cases outside China - BBC News","2020-01-28T14:03:46.000Z","UC16niRr50-MSBwiO3YDb3RA","BBC News","25","20.29.01","bbc|bbc news|news|Coronavirus|China|corona virus|corona news|corona symptoms|corona latest|coronavirus news|china news","1123236","9990","525","6001","https://i.ytimg.com/vi/JGAcQ6UeIIM/default.jpg","False","False","According to the World Health Organization and national authorities, there have been more than 50 confirmed cases outside China - but no deaths.Eight cases: ThailandSix: JapanFive: USA, Australia, Singapore, TaiwanFour: Malaysia, South KoreaThree: FranceTwo: VietnamOne: Nepal, Canada, Cambodia, Sri Lanka, GermanyThe latest case to be confirmed is in the German state of Bavaria, only the fourth so far in Europe.It involves a man who contracted the virus at a training event from a visiting Chinese colleague who reportedly did not show symptoms until she returned to China days later.In Japan, authorities said a bus driver caught the virus after transporting tour groups from Wuhan earlier this month.Please subscribe HERE http://bit.ly/1rbfUog"
"VSqk6B14sNU","MCRXX","2020-01-29T03:32:59.000Z","UCCZGYab5SpD0I7Z5JqJZgww","My Chemical Romance","10","20.29.01","my chemical romance|mcr|my chem|frank iero|ray toro|mikey way|gerard way|rock","308991","57595","235","5333","https://i.ytimg.com/vi/VSqk6B14sNU/default.jpg","False","False","Please join us on YouTube and http://mychemicalromance.com at 8:35am PST/11:35am EST#MCRXX"
"AqtooBbxuaw","Demi Lovato - Anyone (Live From The 62nd GRAMMYs ® / 2020)","2020-01-27T20:25:49.000Z","UCnyB9MYKRkSFK3IIB32CoVw","DemiLovatoVEVO","10","20.29.01","Demi|Lovato|Anyone|Grammys|2020|Sober","6917445","396585","7669","19416","https://i.ytimg.com/vi/AqtooBbxuaw/default.jpg","False","False","Listen to “Anyone”:  https://demilovato.lnk.to/Anyonehttp://vevo.ly/4SFTEK"
"_Mzc_e2VyAo","FIRST INTERVIEW | STEVEN BERGWIJN SIGNS FOR SPURS","2020-01-29T10:41:36.000Z","UCEg25rdRZXg32iwai6N6l0w","Tottenham Hotspur","17","20.29.01","Spurs|Tottenham Hotspur|Tottenham|Football|Spurs TV|White Hart Lane|Soccer|EPL|Premiership|Premier League|FA Cup|League Cup|COYS|THFC|Goals|Highlights|Training|Skills|Tricks|Hotspurs|bergwijn|Steven Bergwijn|PSV Eindhoven","50590","3228","27","521","https://i.ytimg.com/vi/_Mzc_e2VyAo/default.jpg","False","False","Hear from Steven Bergwijn for the first time as he spoke to Spurs TV following his move from PSV Eindhoven.Subscribe to Spurs TV on YouTube: http://spurs.to/YouTube Facebook: http://spurs.to/FacebookInstagram: http://spurs.to/InstagramTwitter: http://spurs.to/SpursOfficial"
"UtCoGAl1dnw","AC Milan 4-2 Torino | Coppa Italia Highlights","2020-01-28T22:55:48.000Z","UC4i_9WvfPRTuRWEaWyfKuFw","BT Sport","17","20.29.01","[none]","339721","4808","84","313","https://i.ytimg.com/vi/UtCoGAl1dnw/default.jpg","False","False","AC Milan secured a semi-final tie with Juventus after beating Torino 4-2 after extra time. Zlatan Ibrahimović scored his first goal back at the San Siro for Milan since 2012.Subscribe to our YouTube channel for the best videos from BT Sport  ➡️ http://bit.ly/17YTeL5Subscribe to our Boxing YouTube channel ➡️ http://po.st/NoFilterYTTwitter: http://twitter.com/btsportFacebook: http://www.facebook.com/btsportInstagram:http://instagram.com/btsportWebsite: http://sport.bt.com"
"lqndByeyN6I","I WAS MY GIRLFRIEND'S ASSISTANT FOR 24 HOURS","2020-01-27T20:45:51.000Z","UCWZmCMB7mmKWcXJSIPRhzZw","Miniminter","20","20.29.01","simon|sidemen|miniminter|mm7games|random|vlog|talia|girlfriend|assistant|24 hours","1914143","110161","1599","4939","https://i.ytimg.com/vi/lqndByeyN6I/default.jpg","False","False","Thanks to Talia I guess....Her channel: https://www.youtube.com/user/nataliahaddockIf you have an idea you would like to see, let me know here:https://docs.google.com/forms/d/e/1FAIpQLSfrqSDycG6GevuJD7gGvfHsa3O-qdbTTyZjV-Lr3tjoP5hXLQ/viewform?usp=sf_linkSecond Channel: https://goo.gl/acaMTtTwitter: https://goo.gl/ugsA1YFacebook: https://goo.gl/S7X2XQSidemen Clothing: https://goo.gl/8RLHBRSidemen Book: https://goo.gl/wqFrjSMy PC: http://bit.ly/miniminterCustom Controller: http://bit.ly/SideCCUKHOW I RECORD MY GAMEPLAY: http://e.lga.to/mmWHERE I GET MY CHAIR:UK: http://goo.gl/35aEHxUSA: https://goo.gl/BbkxsFMusic from: https://www.youtube.com/user/NoCopyrightSoundsMusic from MediaMusicNow.co.ukVideo uploaded bySimon/Miniminter/mm7games"
