video_id,title,publishedAt,channelId,channelTitle,categoryId,trending_date,tags,view_count,likes,dislikes,comment_count,thumbnail_link,comments_disabled,ratings_disabled,description
"2BjdB6MX-h4","WILDER vs FURY 2 : TRUE GEORDIE LIVE","2020-02-23T06:08:20.000Z","UCWaZLW7Bfa83J_h587dH1WQ","True Geordie","17","20.26.02","Fury vs Wilder|Fury vs Wilder 2|deontay wilder vs tyson fury|Deontay Wilder|Tyson Fury|Wilder Fury 2|fight stream|boxing|bt sport|boxing stream|highlights|fury live|wilder live|true geordie|the knockout|Wilder vs Fury|Wilder v Fury|live stream|KO|Full Fight|Fight","1665329","24727","1590","1181","https://i.ytimg.com/vi/2BjdB6MX-h4/default.jpg","False","False","Deontay Wilder vs Tyson Fury 2. Join us for all the live stream reactions from The Knock Out studio with True Geordie! #TheKnockOut #WilderFury2 #AD"
"R8UNneql6Zg","Is This The Best Save We've Seen in 50 Years?","2020-02-23T10:59:55.000Z","UCQ-YJstgVdAiCT52TiBWDbg","ChrisMD","24","20.26.02","football|soccer|chrismd|funny|fails|goals","1066873","43633","521","1652","https://i.ytimg.com/vi/R8UNneql6Zg/default.jpg","False","False","Send in your best Sunday League clips to: chrismdsundayleagueclips@gmail.comCredits:1. Kristaps Bareika 2. Cameron Maung-Maung3. Calum Kirkwood4. Giacomo DAlma 5. Jack Allison6. Charlie Dobinson (1)7. Charlie Dobinson (2)8. Chris Nairn9. Connor Shaw10. Eef Kessels11. Elliot Imberger.12. Hunter Trenary13. Arturo Mejia14. Ben Glendon15. Tommy Byrne16. Tom Day17. Mitchell Flewelling18. Gabriel Lennartsson19. Gregory Lopez20. Greg Roshier 21. Hayden Frost22. SiempreMarcelo1223. Louis Pryce24. Kai Falkenberg25. Keith Bennett26. Gabriel Andersson► Follow my Instagram: http://instagram.com/chrismd10► Follow me on Twitter: https://twitter.com/chrismd10► My book: http://amzn.to/2hvWgIUHow I record my gameplay!: https://www.elgato.com/gaming/?utm_source=chrismd&utm_medium=youtube&utm_campaign=GameCaptureHDMusic:0:00 | Ralvero – Mayday (KXA & CRANKDAT Remix)0:45, 5:25, 8:53 | Hopex – Eternity1:04 | Kings and Creatures – As The Empire Falls1:38, 4:30 | Aero Chord – Boundless https://www.youtube.com/watch?v=mNn34ErU6kM2:34 | Hallmore - Saharas3:40 | Haterade - Custom Track 4:30 | Aero Chord – Resistance4:50 | FEWZ – Drive https://www.youtube.com/watch?v=q1L9sI_FdSM; Music provided by Free Songs To Us5:13, 8:35 | Gioni – Trigger https://soundcloud.com/gioni6:00 | Johannes Bornlof – Mighty Rush 26:26 | Lemon Fight - Stronger (feat. Jessica Reynoso) [Champion Remix] NCS Release https://www.youtube.com/watch?v=yZfyQ0MAMmo6:39, 10:23 | Craig Reever – You Light Me Up8:14 | Wellmess – I’m a Hurricane8:17 | Strlght – Flames9:13 | Marin Hoxha / Chris Linton – Hold Me Back9:26 | Matrix & Futurebound – Got You There (ft Zelah) https://www.youtube.com/watch?v=5aRZSWfIbOYMusic by Epidemic Sound (http://www.epidemicsound.com) & others."
"C93EvCVIuFA","LET'S GO AJ! TYSON FURY IMMEDIATE MESSAGE TO ANTHONY JOSHUA AFTER DETHRONING WILDER!","2020-02-23T07:42:49.000Z","UCms2Ifa9owy2CK3ToKGkaQw","Behind The Gloves","17","20.26.02","BOXING|BOXEO|NEWS|EXCLUSIVE|HIGHLIGHTS|SPORTS|boxer|highlights|interview|press conference|workout|michelle joy phelps|TYSON FURY|“deontay|wilder”|“wilder|vs|fury|2”|“fury|“Behind|the|gloves”|ANTHONY JOSHUA|TYSON FURY KO|EDDIE HEARN|DEONTAY WILDER|FURY VS WILDER 2|REACTION","230257","2822","164","890","https://i.ytimg.com/vi/C93EvCVIuFA/default.jpg","False","False","Interview by 🎤: MICHELLE JOY PHELPSInstagram: MichelleJoyPhelpsTwitter: @MichellePhelpswww.facebook.com/MichelleJoyPhelpsFansInstagram: OfficialBehindTheGlovesTwitter: @BehindTheGloveswww.Facebook.com/BehindTheGloveswww.BehindTheGloves.comDid you know we have a FREE APP? ⬇️https://itunes.apple.com/us/app/behind-the-gloves/id766648818?mt=8"
"FcJtG-M8TO8","KSI VS SOMALIA? CHUNKZ AND FILLY PLAY HIGHER OR LOWER  | Higher or Lower EP1","2020-02-23T19:00:01.000Z","UCSTJELgD0j0gW2_wgF_TYuA","Footasylum","24","20.26.02","CHUNKZ|YUNG FILLY|CHUNKZ AND FILLY|FOOTASYLUM|TEST|GENERAL KNOWLEDGE|HIGHER OR LOWER|AJ SHABEEL","313381","13607","121","606","https://i.ytimg.com/vi/FcJtG-M8TO8/default.jpg","False","False","Chunkz and Filly decide which option is higher or lower - from social media followings and football clubs, to AJ Shabeel and Anthony Joshua. CHUNKZ: https://www.instagram.com/chunkz_en/?... YUNG FILLY: https://www.instagram.com/yungfilly/?... AJ: https://www.youtube.com/channel/UCDMHyBFbyJIKFiEwHty-u5Q"
"gQvxZSLiPYk","WE DIDN'T WANT YOU TO SEE THIS!! BLOOPERS!!","2020-02-23T04:32:00.000Z","UCef29bYGgUSoJjVkqhcAPkw","David Dobrik Too","22","20.26.02","david|dobrik|vlog|vlogger|how|to|dating|boyfriend|girlfriend|first|jason|nash|comedy|vine|viner|alex|ernst|zane|hijazi|heath|hussar|reaction|emotional|singing|sing|suprise|todd|smith|natalie","7834069","450487","4671","9044","https://i.ytimg.com/vi/gQvxZSLiPYk/default.jpg","False","False","Thanks to SeatGeek for sponsoring the video. Use code DAVID for $20 off your first order: https://sg.app.link/david  These are the bloopers and clips that didn't make the vlog!!Follow Ryan on insta: https://www.instagram.com/ryantricks/The outro song was made by Scott! Go watch the music video: https://www.youtube.com/watch?v=7RXst03JCos&feature=youtu.be MY MOST POPULAR MERCH IS HERE: https://fanjoy.co/collections/david-dobrik   SUBSCRIBE TO JOE HE IS GREAT: https://www.youtube.com/watch?v=8YeIi3_ZEks GO TO MY INSTAGRAM FOR MORE CONTENT: https://www.instagram.com/daviddobrik/?hl=en CHECKOUT OUR PODCAST WHERE WE TALK ABOUT RELATIONSHIPS:  https://itunes.apple.com/us/podcast/views-with-david-dobrik-and-jason-nash/id1236778275?mt=2       ADD ME ON SNAPCHAT TO KEEP UP WITH OUR VEGAS TRIP: @Daviddobrik  WATCH MY NEW HOUSE TOUR HERE: https://www.youtube.com/watch?v=C4yECzFCdZk&t=26s   Comment how much you love our bunny if you read this!!ADD ME ON SNAPCHAT TO BE INVITED TO OUR HOUSE NEXT: @DavidDobrikThanks for watching :) Throww it a like if you like throwing stuff!Turn my notifications on these to be the next shoutout!!Twitter: @DavidDobrikInstagram: @DavidDobrikSnapchat: @DavidDobrikVine: @DavidDobrikMusically: @DavidDobrikBusiness email: daviddobrikbusiness@gmail.comOther people in the video:Liza- Twitter; @lizakoshy Instagram; @lizakoshy Snapchat; @lizakoshysnapsAlex Ernst- Twitter; @AlexErnst Instagram; @Ernst Snapchat; @AlexErnstJason Nash- Twitter and Instagram; @JasonNashJosh Peck- Instagram: @shuapeck Twitter: @Itsjoshpeck Snapchat: @joshuapeckScottysire- Twitter; @imnotscottysire Instagram; @VanillaDingDongToddysmith- Twitter; @todderic_ Instagram; @todderic_Zane- Twitter; @Zane Instagram; @Zane Snapchat; @ZaneHijaziDom: Instagram/Twitter: @DomZeglaitisThe Gabbie Show- Twitter; @TheGabbieShow Instagram; @TheGabbieShow Snapchat; @TheGabbieShowCorinna- Snapchat/Twitter/Instagram: @CorinnaKopfBignik- Twitter: @BigNik Instagram: @RealBigNik Snapchat; @BignikVineHeath- Twitter; @HeathHussar Instagram; @HeathHussar Snapchat; @HeathHussarSeth - @sethfrancoisJonah Hill- Insta: @nickantonyanBrandon Calvillo- Twitter; @BJCalvillo Instagram; @BJCalvillo Snapchat; @BJCalvilloMatt King - Twitter/Instagram/Snapchat: @MattRKingCarly incontro- Twitter/Instagram: @CarlyIncontroErin Gilfoy- Twitter and Instagram: goddess_eriu Snapchat: erin_gilfoyJack Dytrych: Twitter: @BigJuicyJack Instagram: jdytrych22Cailee: Twitter/Instagram: @CaileeRaeMusic Lindsey: @lindseygrollJulia Abner- Instagram; @JuliaAbnerElton Castee- Twitter; @EltonCastee, Instagram; @EltonCasteeMeghan McCarthy- Twitter: @MeghanWMcCarthyJcyrus snapchat: @Jcyrusvine ."
"O9g6CpqpCc0","I ate MY DADS diet for 24 hours!! *he’s vegan😱*","2020-02-23T17:00:03.000Z","UCFanrVWRodCwCw43U7KBAQg","Saffron Barker","24","20.26.02","saffron barker|saffron barker youtube|youtube saffron barker","380143","15504","246","1006","https://i.ytimg.com/vi/O9g6CpqpCc0/default.jpg","False","False","I ate MY DADS diet for 24 hours!! *he’s vegan😱*Subscribe to my vlogs here: http://bit.ly/2clXIs6Subscribe: http://bit.ly/sub-SB | 🔔Make sure to enable ALL push notifications!🔔Watch MY NEWEST videos: https://youtube.com/playlist?list=PLN7q64zaVsnE0c5YtL5oqqtXge29NOzSP&playnext=2 Follow Saffron Barker:Vlog Channel: http://bit.ly/1N1v8uK Instagram: https://instagram.com/saffronbarker Twitter: https://twitter.com/SaffronBarker SnapChat: https://snapchat.com/add/saffronbarker Watch more of Saffron Barker:Challenges: https://www.youtube.com/playlist?list=PLN7q64zaVsnE8gdkOqFgJwutSC90A-5HHplaynext=1Makeup & Beauty: https://www.youtube.com/playlist?list=PLN7q64zaVsnHaPeuTzC9BL51Zk33y__I8playnext=1VS: https://www.youtube.com/playlist?list=PLN7q64zaVsnESfvMvfG5EZrzTo55qX1oKplaynext=1Newest Videos: https://youtube.com/playlist?list=PLN7q64zaVsnE0c5YtL5oqqtXge29NOzSP&playnext=1Popular Videos: https://www.youtube.com/playlist?list=PLN7q64zaVsnHkeeXVfhW2lLCjT7X-gC3qplaynext=1About Saffron Barker:Welcome to the official Saffron Barker YouTube channel! On this channel, you’ll find a variety of lifestyle, beauty, and challenge videos including routine videos, boyfriend and girlfriend videos, q&as, makeup & beauty tutorials, clothing and American hauls, and more! Make sure to subscribe and enable ALL notifications so you never miss a video! For instant updates, follow us on our social media accounts below.BUSINESS ONLY : saffronbarker@mcsaatchisocial.com"
"l-zxMgpv9Zw","FROM KID TO 6 MILLION SUBSCRIBERS!! (DECADE IN REVIEW)","2020-02-23T20:07:50.000Z","UCtNBFUsxj2YVbEc5HquzFqg","Carter Sharer","24","20.26.02","[none]","1299247","32354","1187","4147","https://i.ytimg.com/vi/l-zxMgpv9Zw/default.jpg","False","False","🔥CHECK OUT TEAM RAR!!🔥━► https://www.teamrar.com/ In today's video, Carter Sharer invites you, the fans, to recap the last ten years of his life and career on YouTube by looking at the last decade (2009-2019). Starting from his humble beginnings with backyard experiments in his house in Virginia, hanging with friends and going to school, to a famous YouTuber living in Los Angeles California. Watch Carter take you on a journey through his life and how he's built his YouTube career in 2020 and Team RAR with members Lizzy Capri, Stove's Kitchen, Ryan Prunty, and even Milli's World and don't forget to Comment below with what you thought about this epic blast from the past vlog!❇️ MORE EPIC VLOGS ❇️LAST TO LEAVE GIANT LEGO HOUSE WINS $10,000https://youtu.be/4VF8q95LLxsBUILDING A HUGE 3 STORY LEGO HOUSE!!https://youtu.be/DldCGsc_f90LAST TO FALL IN LAVA POOL WINS!!https://youtu.be/kmxf6nW2noE-----------------------------------------------------------------------------------------------------------Follow Us For a Chance to WIN Some Epic Stuff!📷INSTAGRAM → @CarterSharer https://goo.gl/DkjB5J📘FACEBOOK → CARTER SHARER OFFICIAL https://goo.gl/WM7mBu📷INSTAGRAM → @LizzySharer https://goo.gl/jALBqj📘FACEBOOK → LIZZY SHARER https://goo.gl/AX1d4tSubscribe to my channel! https://goo.gl/XjjCA8-----------------------------------------------------------------------------------------------------------Business Inquiries: carter.integrations@teamrar.comWARNING: This video is only for entertainment purposes. Do not attempt to recreate any of the acts in this video, as they may be dangerous if not done correctly, and could result in serious injury. If you rely on the information portrayed in this video, you assume the responsibility for the results. Have fun, but always think ahead, and remember that every project you try is at YOUR OWN RISK.This footage is property of Dream Team Studios LLC and is not allowed to be repurposed without written consent from Dream Team Studios LLC. For any requests from media contact us at carter.integrations@teamrar.com"
"UWwYChuG2ds","Hairdresser Reacts To Life Changing Haircuts","2020-02-23T21:59:18.000Z","UCoc_XJPj6YLMQDWtPDQcDtA","Brad Mondo","24","20.26.02","Hairdresser Reacts To Life Changing Haircuts|bradmondo|bradmondonyc|hairdresserreacts|hairdresser reacts|how to cut layers at home|how to|brad mondo|fall off|hair fail|hair stylist|how to color hair at home|jenna marbles|at home|diy hair|hair dresser|long hair to pixie|girls shaving their hair|long hair to shave|long hair to pixie cut|long hair to pixie cut transformation|long to short hair|how to cut hair at home|haircut compilations|Bleach hair","1210930","53734","1282","6195","https://i.ytimg.com/vi/UWwYChuG2ds/default.jpg","False","False","Hi Beautiful! Today we watch 3 girls cut their hair and go from having extremely long hair to short!Shop XMONDO Hair: https://www.xmondohair.com/DiscoverSarah: https://www.youtube.com/watch?v=R-S9r0KmorYVictoria amaro: https://www.youtube.com/watch?v=PRxlCqV_NoISophia Galaviz: https://www.youtube.com/watch?v=h67t1jrhHqsInstagram: https://www.instagram.com/bradmondonyc/Twitter: https://twitter.com/bradmondonycTikTok: https://www.tiktok.com/@bradmondonyc?utm_source=tt_10XMONDO Instagram:  https://www.instagram.com/xmondohair/Video Editing By: Kris Edrosa Don't Forget To Live Your Extra Life."
"YE55v7pj7-c","Lionel Richie compares Cyniah to Whitney Houston - American Idol 2020","2020-02-24T01:08:11.000Z","UCAMPco9PqjBbI_MLsDOO4Jw","American Idol","24","20.26.02","American Idol 2019|American Idol|singing competition|Katy Perry|Ryan Seacrest|Luke Bryan|Lionel Richie|covers|sing|ABC|Cyniah Elise|Calum Scott|You Are the Reason","1287190","28928","425","1787","https://i.ytimg.com/vi/YE55v7pj7-c/default.jpg","False","False","After going viral on Facebook, Cyniah brings her soulful voice to Katy Perry, Lionel Richie and Luke Bryan--and leaves them speechless. See more of American Idol 2020 on our official site: http://www.americanidol.comLike American Idol on Facebook: https://www.facebook.com/AmericanIdolFollow American Idol on Twitter: https://twitter.com/americanidolFollow American Idol on Instagram: https://www.instagram.com/americanidol/AMERICAN IDOL, the iconic series that revolutionized the television landscape by pioneering the music competition genre, returns on ABC.American Idol 2020Helping to determine who America will ultimately vote for to become the next singing sensation are music industry forces and superstar judges Luke Bryan, Katy Perry and Lionel Richie. Emmy® Award-winning host and producer Ryan Seacrest continues as host of the beloved series, while multimedia personality Bobby Bones serves at the in-house mentor."
"KoYbm8BJhHQ","BEST FEMALE FOOTBALLER?! | AMAZING GOALS! 🔥","2020-02-23T18:50:00.000Z","UCKvn9VBLAiLiYL4FFJHri6g","F2Freestylers - Ultimate Soccer Skills Channel","17","20.26.02","f2|the f2|f2 freestylers|skills|tekkers|tricks|football|soccer|billy wingrove|jeremy lynch|football freestyle|freestylers|football duo|football freestylers|soccer am|messi|neymar|ronaldo|freekickerz|skilltwins|bin shots|trickshots|football trickshots|soccer tricks|soccer skills|Toni|Duggan|Female|amazing|goals|girl|womens|woman","1075600","42702","687","2050","https://i.ytimg.com/vi/KoYbm8BJhHQ/default.jpg","False","False","We flew to Madrid to film with one of the best female footballers in the world - Toni Duggan! 🌍⚽️🔥FOLLOW:Toni - https://instagram.com/tonidugganSUBSCRIBE TO:Cacho - https://www.youtube.com/user/cachoo01► Don't forget to SUBSCRIBE: http://bit.ly/SubscribeF2► CHECK OUT OUR CLOTHING RANGE! http://bit.ly/RascalClothing► SUBSCRIBE TO F2FC! http://bit.ly/SubF2FC► GET THE FIRST EVER F2 BOOK! http://bit.ly/F2Book1► GET OUR #1 BEST SELLING BOOK! http://bit.ly/F2Book2► GET OUR FIRST EVER GRAPHIC NOVEL! http://bit.ly/F2GN1► GET F2 WORLD CLASS! http://bit.ly/F2Book3DOWNLOAD OUR BOOK APP FOR FREE ► The F2 App on Apple/iOS - http://bit.ly/F2AppiOS► The F2 App on Android - http://bit.ly/F2AndroidTo keep up to date with us at any time in any place then follow us on;Twitter - http://bit.ly/F2TwitterInstagram - http://bit.ly/F2InstagramFacebook - http://bit.ly/F2FacebookSnapchat - http://bit.ly/F2SnapchatStay tuned by subscribing to our channel to see all of the amazing videos coming up in the near future! Love, peace & tekkers! Billy & Jezza"
"mwxtHTwFe9Y","St. Johnstone 2-2 Rangers | Rangers Halted by Late Stevie May Equaliser! | Ladbrokes Premiership","2020-02-23T22:53:43.000Z","UCakRszbIjjGYtFrDPeg5Ieg","SPFL","17","20.26.02","St johnstone 2-2 rangers|rangers st Johnstone|rangers st johnstone|st johnstone|rangers highlights|rangers fc|SPFL|florian kamberi rangers|SPFL Highlights|Scottish football highlights|ladbrokes premiership|braga v rangers|Joe aribo|scottish football goals|steven gerrard rangers|steven gerrard|ianis hagi|alfredo morelos|sp:ty=high|sp:dt=2020-02-23T13:30:00Z|sp:st=soccer|sp:li=scot|sp:ti:home=SJFC|Sp:ti:away=RFC","118966","767","40","469","https://i.ytimg.com/vi/mwxtHTwFe9Y/default.jpg","False","False","St. Johnstone opened the scoring after just 8 minutes through Callum Hendry. Rangers answered back through a Florian Kamberi volley, who then assisted Joe Aribo to send the visitors ahead. 10 minutes from full time, Stevie May fired the saints level resulting in both teams sharing a point.  Subscribe to the SPFL YouTube here!: http://goo.gl/jq3jXNLike us on Facebook: http://www.facebook.com/spflofficialFollow us on Twitter: https://twitter.com/spfl & https://twitter.com/spflnewsLADBROKES PREMIERSHIP CONTENT AVAILABILITY INFORMATION - GOALS FROM SATURDAY'S MATCHES WILL BE AVAILABLE IN THE UK & IRELAND FROM 6PM ON SUNDAY. GOALS FROM ALL OTHER MATCHDAYS WILL BE AVAILABLE TO VIEW WORLDWIDE FROM MIDNIGHT AFTER THE MATCH.The SPFL is the leading sporting competition in Scotland, covering the top 42 football teams in the country. Subscribe to the official SPFL YouTube channel to make sure you catch all the best bits from Scottish league football. Scottish football is famous for passionate and exciting matches featuring top teams like Celtic, Rangers, Aberdeen, Hearts, Hibs and Dundee United.The top league is called the Ladbrokes Premiership. Below the top level, there are a further three leagues -- the Ladbrokes Championship, Ladbrokes League 1 and Ladbrokes League 2."
"m-X6cSSNPZY","Tyson Fury beats Deontay Wilder in heavyweight rematch","2020-02-23T09:03:19.000Z","UCoMdktPbSTixAyNGwb-UYkQ","Sky News","25","20.26.02","fury vs wilder|fury fight|fury fight time|tyson fury fight|tyson fury vs deontay wilder|boxing results|tyson vs wilder 2|gypsy king|wbc boxing|wilder vs fury|fight|rematch|match|heavyweight|champion|belt|title|world title|bronze bomber|heavyweight boxing|heavyweight boxer|las vegas|round|throw|punch|sky|news|boxing news|punching|showdown|show|mgm grand|vegas|sports|sport","1537863","4343","751","924","https://i.ytimg.com/vi/m-X6cSSNPZY/default.jpg","False","False","British boxer Tyson Fury has beaten American fighter Deontay Wilder in their WBC heavyweight showdown in Las Vegas.The 'Gypsy King' dominated throughout the rematch at the MGM Grand arena before Wilder's corner threw in the towel in the seventh round, capping a remarkable career comeback for the 31-year-old.The Mancunian - who once held all four world title belts - dethroned Wladimir Klitschko back in 2015, before his time at the top of the sport was derailed by depression and addiction as he reached an estimated 27 stone.SUBSCRIBE to our YouTube channel for more videos: http://www.youtube.com/skynews Follow us on Twitter: https://twitter.com/skynews  Like us on Facebook: https://www.facebook.com/skynews Follow us on Instagram: https://www.instagram.com/skynews For more content go to http://news.sky.com and download our apps:  Apple: https://itunes.apple.com/gb/app/sky-news/id316391924?mt=8 Android https://play.google.com/store/apps/details?id=com.bskyb.skynews.android&hl=en_GBSky News videos are now available in Spanish here/Los video de Sky News están disponibles en español aquí: https://www.youtube.com/skynewsespanol"
"gu5G5K8b-TE","Perri & Vanessa got their letters from Hogwarts! | Dancing on Ice 2020","2020-02-23T19:17:45.000Z","UCHP_B9PT4LvW4tWSrewhvcw","Dancing on Ice","24","20.26.02","dancing on ice|ice skating|ashley banjo|jayne torvill|christopher dean|torvill and dean|holly willoughby|phillip schofield|holly and phil|john barrowman|kem cetinay|ben hanlin|lisa george|libby clegg|joe swash|trisha goddard|maura higgins|ian h watkins|perri kiely|lucrezia millarini|radzi chinyanganya|itv|perri dancing on ice|perri dancing on ice 2020|perri and vanessa|perri dancing on ice performance|perri kiely dancing on ice","90860","0","0","0","https://i.ytimg.com/vi/gu5G5K8b-TE/default.jpg","True","True","Grab your wands, this Harry Potter inspired skate to 'Hedwig's Theme' is truly magical.Watch our Week 8 Playlist!: https://bit.ly/3c6WkqHFollow and subscribe to the official YouTube channel for Dancing On Ice! https://bit.ly/35zHG6Mhttp://www.itv.comhttp://www.stv.tvYouTube: https://goo.gl/mN4RddWebsite: http://www.itv.com/dancingoniceFacebook: https://www.facebook.com/dancingoniceInstagram: https://www.instagram.com/dancingoniceTwitter: https://twitter.com/dancingonice#dancingonice"
"lLuBDojtefA","Daredevil 'Mad Mike' Hughes Dies During Attempt To Launch Homemade Rocket","2020-02-23T07:22:32.000Z","UCkH1uDkyuO9sVjSqdqBygOg","CBS Los Angeles","25","20.26.02","CBSN LA","2042605","7833","1145","6613","https://i.ytimg.com/vi/lLuBDojtefA/default.jpg","False","False","Well-known daredevil Mad Mike Hughes reportedly died after a homemade rocket crashed."
"modn3AZ11ek","Solskjaer, Fernandes, Greenwood & Shaw react to win | Manchester United 3-0 Watford | Premier League","2020-02-23T17:45:00.000Z","UC6yW44UGJJBvYTlfC7CRg2Q","Manchester United","17","20.26.02","manchester united|mufc|man utd|manutd|mu|ggmu|old trafford|manchester united 3-0 watford|post match reaction|ole gunnar solskjaer|bruno fernandes|luke shaw|mason greenwood|man utd 3-0 watford reaction|de gea|wan-bisakka|lindelof|maguire|shaw|matic|mata|fernandes|greenwood|pogba|martial|rashford|mctominay|james|ighalo","479439","12114","139","950","https://i.ytimg.com/vi/modn3AZ11ek/default.jpg","False","False","Hear from United boss Ole Gunnar Solskjaer, new signing Bruno Fernandes, goalscorer Mason Greenwood and left back Luke Shaw after their 3-0 win at Old Trafford.Subscribe to Manchester United on YouTube at http://bit.ly/ManU_YTVisit Manchester United at http://www.manutd.comLike Manchester United on Facebook at http://www.facebook.com/manchesterunitedFollow Manchester United on Twitter at http://www.twitter.com/ManUtdFollow Manchester on Instagram at http://www.instagram.com/manchesterunitedSubscribe to MUTV at https://bit.ly/2L9ymRs"
"QePvLSBFZPU","Coronavirus cases surge in Italy and South Korea | DW News","2020-02-23T15:16:02.000Z","UCknLrEdhRCp1aegoMqRaCZg","DW News","25","20.26.02","coronavirus|coronavirus italy|coronavirus social media|coronavirus venice|coronavirus outbreak|virus outbreak|coronavirus epidemic|virus epidemic|pandemic|china virus|coronavirus china|south korea|china virus 2020|wuhan virus|china virus news|coronavirus news|coronavirus update","957594","7799","458","3732","https://i.ytimg.com/vi/QePvLSBFZPU/default.jpg","False","False","A sharp jump in coronavirus cases in Italy has prompted authorities to cancel the final days of Carnival in Venice. Several towns in northern Italy have also been put on lockdown, after 2 people are reported to have died from the disease.South Korea is also on high alert following a sharp jump in coronavirus cases there, with the total number reaching more than 600.  The virus has now spread from China to more than 25 countries. Subscribe: https://www.youtube.com/user/deutschewelleenglish?sub_confirmation=1For more news go to: http://www.dw.com/en/Follow DW on social media:►Facebook: https://www.facebook.com/deutschewellenews/►Twitter: https://twitter.com/dwnews►Instagram: https://www.instagram.com/dw_stories/Für Videos in deutscher Sprache besuchen Sie: https://www.youtube.com/channel/deutschewelle#Coronavirus"
"QhI2rgR6xBM","The REAL COST of a $169 eBay Turbo","2020-02-23T22:00:08.000Z","UCgJRL30YS6XFxq9Ga8W2J3A","Mighty Car Mods","2","20.26.02","mighty|car|mods|mcm|MCM|moog|marty|turbo|jdm|how|to|diy|do|it|yourself|nissan|subaru|supercharged|race|yaris hilton|ebay turbo|169 turbo|$169 ebay turbo|toyota corolla|mcm toyota|mcm yaris|mcm yaris hilton","537130","21392","314","2182","https://i.ytimg.com/vi/QhI2rgR6xBM/default.jpg","False","False","Cheap turbos are easy to get on eBay but how much do they really cost once you factor in all the other parts you need to make them work properly? In this episode, we break down the exact costs of our budget turbo conversion on Yaris Hilton. Be sure to check out the MCM Facebook Page and Shop►http://www.facebook.com/mightycarmods►http://www.mightycarmods.com/collecti...✌️ JDM Air Fresheners https://mightycarmods.com/collections...👕 BRAND NEW Engine Heart T-shirt https://mightycarmods.com/collections...🔔 Hit the bell next to Subscribe so you don't miss a video!Also something to note around Mighty Car Mods: we are normal guys and are not trained mechanics. We like to make interesting car mods and show you how we've gone about it, but we can't promise that anything we show you will work for your particular car, or that you won't harm yourself, someone else, your car or your warranty doing it. Please be safe, be responsible and unless you know what you're doing, do not fool around with very serious machinery just because you've seen us make it look so easy. Talk to a qualified mechanic if you are in any doubt."
