video_id,title,publishedAt,channelId,channelTitle,categoryId,trending_date,tags,view_count,likes,dislikes,comment_count,thumbnail_link,comments_disabled,ratings_disabled,description
"w9uWPBDHEKE","Jack Harlow - WHATS POPPIN (Dir. by @_ColeBennett_)","2020-01-21T16:59:10.000Z","UCtylTUUVIGY_i5afsQYeBZA","Lyrical Lemonade","24","20.29.01","Jack Harlow|WHATS POPPIN|What's Poppin'|Lyrical Lemonade|Cole Bennett|Jetsonmade|Pooh Beatz|oh lawd jetson made anotha one|diner|rap|hip hop|music video|brand new whip just hopped in|i got options|friendzone|hometown hero|basketball team|restaurant|louisville|cardinals|lenny|2020","4413824","269750","7532","19230","https://i.ytimg.com/vi/w9uWPBDHEKE/default.jpg","False","False","Lyrical Lemonade Presents:Jack Harlow - WHATS POPPIN (Official Music Video)Directed + Edited by Cole BennettSong Produced by Jetsonmade & Pooh BeatzDirector of Photography - Brett ArndtSteadicam by Renard CherenEx. Produced by Sal Tarantino & Jay TauzinStream “WHATS POPPIN” here:https://jackharlow.lnk.to/WHATSPOPPINJack Harlow's Socials:http://instagram.com/jackharlowhttp://twitter.com/jackharlow--Official Channel of Lyrical Lemonade Subscribe for updates on music videos, interviews, performance videos, etc.Lyrical Lemonade's Hot 25 Spotify Playlist:https://open.spotify.com/user/gh3vdz775oy18ah1wp9ucxsj5/playlist/5UuPeWDR2I8a8pORvW9vmrLyrical Lemonade Socials:http://www.twitter.com/lyricalemonadehttp://www.instagram.com/lyricalemonadehttp://www.facebook.com/lyricalemonadehttp://www.lyricallemonade.comCole Bennett Socials:http://www.twitter.com/_colebennett_http://www.instagram.com/_colebennett_LENNY ~ our hidden character representing happiness & good energyhttp://instagram.com/lenny"
"MYnjzsjeMK8","Why Flat Earthers Are Dead Wrong","2020-01-22T02:10:00.000Z","UCfdNM3NAhaBOXCafH7krzrA","The Infographics Show","27","20.29.01","flat earth|flat earth theory|flat earthers|Earth|planet Earth|solar system|outer space|space|the infographics show|theory|science|experiments|experiment|scientist|conspiracy|conspiracy theories","990970","36859","1727","10833","https://i.ytimg.com/vi/MYnjzsjeMK8/default.jpg","False","False","What was supposed to be a relaxing trip home to visit Mom turned out to be a battle of science and spite. One of our writers shared his head-butting story about his mother and her new affinity for the Flat Earth Theory. Is it even a theory? Watch our new funny video to find out!Check out my new channel I Am: https://www.youtube.com/channel/UCH5YmeRhiQZt9_5Eky3A2og🔔 SUBSCRIBE TO THE INFOGRAPHICS SHOW ► https://www.youtube.com/c/theinfographicsshowOFFICIAL?sub_confirmation=1🔖 MY SOCIAL PAGESDISCORD ►https://discord.gg/theinfographicsshowFacebook ► https://www.facebook.com/TheInfographicsShowTwitter ► https://twitter.com/TheInfoShow💭  SUGGEST A TOPIChttps://www.theinfographicsshow.com📝 SOURCES: https://pastebin.com/ALmaczN4All videos are based on publicly available information unless otherwise noted."
"Y99X9rx5VLU","Customizing 40 Apple Watches, Then Giving Them To People!!🍎⌚ (Giveaway)","2020-01-21T20:29:18.000Z","UClQubH2NeMmGLTLgNdLBwXg","ZHC","24","20.29.01","epic|prank|hilarious|apple watch|apple watch series 5|iphone 11|iphone 11 pro|iphone 11 pro max|airpods|airpods pro|iphone x|iphone|apple|macbook|mac pro|giveaway|giving away iphones|apple product|custom iphone 11|custom airpods|custom apple watch|zhc|marko|mrbeast|mr beast|charli damelio|tiktok|hydro dip|hydro|jbl|custom|art|satisfying|that was epic|Customizing 40 Apple Watches|Then Giving Them To People!!📱⌚ (Giveaway)|apple watches","3403949","159967","2272","44876","https://i.ytimg.com/vi/Y99X9rx5VLU/default.jpg","False","False","Hope you enjoyed! Make sure to enter the huge Apple Watch giveaway! Thanks for watching:) Download Monster Legends here: https://mtchm.de/i8hsfSubscribe, Click on another vid in recommendations, and Follow my socials! Instagram : @ zhcomicartTwitter: @ hsieh_zacharyFollow everyone!Instagram:@rae_dizzle_@artofchloerose@haroldartist@vexx@sandraciresart"
"uqZQO6lgrik","Lunar New Year Storytime! EXCLUSIVE Warrior Queen skin (Clash of Clans)","2020-01-22T00:00:06.000Z","UCD1Em4q90ZUK2R5HKesszJg","Clash of Clans","20","20.29.01","clash of clans|COC|Clash of Clans Gameplay|Clash of Clans Strategy|Clash of Clans Animation|Clash of Clans Commercial|Clash of Clans Attacks|Clash of Clans Town Hall|Hog Rider|PEKKA|Clan Wars|season challenges|clan war leagues|clash on|clan game|lunar new year|stop motion|stop motion animation|warrior queen|clash of clans archer queen|archer queen|clash of clans lunar new year|year of the rat|chinese new year 2020|archer queen new skin","8503842","143517","8603","4920","https://i.ytimg.com/vi/uqZQO6lgrik/default.jpg","False","False","Follow us on our Socials!Twitter ► https://twitter.com/ClashofClans/Instagram ►https://www.instagram.com/clashofclans Facebook ►https://www.facebook.com/ClashofClans Attack. Defend. Strategize. Download for free for mobile devices. http://supr.cl/ThisArmyFrom rage-­filled Barbarians with glorious mustaches to pyromaniac wizards, raise your own army and lead your clan to victory! Build your village to fend off raiders, battle against millions of players worldwide, and forge a powerful clan with others to destroy enemy clans.PLEASE NOTE! Clash of Clans is free to download and play, however some game items can also be purchased for real money Also, under our Terms of Service and Privacy Policy, you must be at least 13 years of age to play or download Clash of Clans.A network connection is also required.FEATURES- Build your village into an unbeatable fortress - Raise your own army of Barbarians, Archers, Hog Riders, Wizards, Dragons and other mighty fighters- Battle with players worldwide and take their Trophies- Join together with other players to form the ultimate Clan- Fight against rival Clans in epic Clan Wars - Build 18 unique units with multiple levels of upgrades- Discover your favorite attacking army from countless combinations of troops, spells, Heroes and Clan reinforcements - Defend your village with a multitude of Cannons, Towers, Mortars, Bombs, Traps and Walls- Fight against the Goblin King in a campaign through the realmChief, are you having problems? Visit http://supercell.helpshift.com/a/clas...Privacy Policy:http://www.supercell.net/privacy-policy/Terms of Service:http://www.supercell.net/terms-of-ser...Parent’s Guide:http://www.supercell.net/parents#clashofclans #lunarnewyear #warriorqueen"
"OXiAxFeeQ1o","Did we forget about Conor McGregor vs Nate Diaz 3 ?","2020-01-22T20:26:33.000Z","UCRlvF4jIeBWqXJDGNXfPyVw","Chael Sonnen","24","20.29.01","MMA|mixed martial arts|Chael Sonnen|UFC|Bellator|Ultimate Fighting Championships|Bellator MMA|MMA Fights|MMA podcast|Beyond the Fight|Chael Sonnen podcast|mma fights|Fighter|Bad Guy Inc","219193","4061","188","1890","https://i.ytimg.com/vi/OXiAxFeeQ1o/default.jpg","False","False","Have a question for Chael?  Click here... https://bit.ly/2QVfwyIChael Sonnen talks about he possibility of seeing Conor McGregor vs Nate Diaz 3 on this episode of Beyond the Fight.Click here to subscribe - https://www.youtube.com/chaelsonnenofficial?sub_confirmation=1"
"GJA32OqD0Vs","We Hydro Dipped a Nerf Blaster 100 Times! (100 Layers Challenge)","2020-01-21T22:04:52.000Z","UC70Dib4MvFfT1tU6MqeyHpQ","Preston","24","20.29.01","funny|challenge|family|comedy|preston|brianna","1736318","51321","3526","6104","https://i.ytimg.com/vi/GJA32OqD0Vs/default.jpg","False","False","We Hydro Dipped a Nerf Blaster 100 Times! (100 Layers Challenge) with Preston 👊👀 FOLLOW ME HERE!🡆 Instagram - https://instagram.com/realtbnrfrags🡆 Twitter - https://twitter.com/Preston👕 Get your merch below!🡆 http://www.prestonsstylez.com/ 🡆 https://royallyb.com🐲 Buy FLOOP Here! 🡆 https://amzn.to/37uLpV6🎮 Join my Fan Discord! 🡆 http://discord.gg/PrestonZHC - Customizing 40 Apple Watches, Then Giving Them To People!!📱⌚ (Giveaway)https://youtu.be/Y99X9rx5VLUMoreJSTu - Building Secret MOVIE THEATER Inside Storage Unit!https://youtu.be/ooVVyR8eO_I------------------------------Additional music provided by Epidemic SoundClick here for a free trial! 🡆 http://share.epidemicsound.com/TBNR"
"8viKaAC4VXQ","Rich The Kid - Money Talk (feat. YoungBoy Never Broke Again) [Official Music Video]","2020-01-21T17:00:03.000Z","UCvTEOPrdg8f_mufsqH3VGQw","Rich The Kid","10","20.29.01","[none]","3194369","126771","2480","5145","https://i.ytimg.com/vi/8viKaAC4VXQ/default.jpg","False","False","Official music video for Rich The Kid Money Talk feat. YoungBoy Never Broke Again - available everywhere now: https://richthekid.lnk.to/MoneyTalk►Follow Rich The Kid :http://www.facebook.com/richforevermusichttp://www.instagram.com/richthekidhttp://www.twitter.com/richthekidProduced By DYInstagram: https://www.instagram.com/dykrazy/Twitter: https://mobile.twitter.com/dykrazy808Lyrics:Money TalkBitch I’m the boss no there ain’t no talking to meI need a check no I ain’t talking for freeI took that bitch she ain’t been home in a weekPussys so good that I might buy her a jeepI need hittas on the wraith nowNigga watch that money talkNeed all my bitches in the bustdownNigga that’s the money talk Ever since she got her own, told her I can’t hold herShe put on for the gang, shawty she a soldierAnd it don't matter what she wish, she thinkin' what I told herAnd I told her always make sure money talking for yaAnd I told her I'm chasing a check, Ima call her backI ain't call in a week and I follow backI got sticks in the Jeep I’m on all of that Lotta racks on my jeans, that's a 100k packI don't even much look I ain’t seeing thatAll my bitches in the bustdownI run with that beef like a running back that Money talk I get you touch nowFollow behind me I’m sliding with all my bitches in the JagWatching a nigga can’t figure me out like bitch go get the bagHold on, watch me swagKeep protection on my waist hoeNun less 130 cashWhen I’m walking up into my shows Bitch I’m the boss no there ain’t no talking to meI need a check no I ain’t talking for freeI took that bitch she ain’t been home in a weekPussys so good that I might buy her a jeepI need hittas on the wraith nowNigga watch that money talkNeed all my bitches in the bustdownNigga that’s the money talkThey say the money on the way, I had to tell em rush itI bought the Cartier was plain but then I told em bust itYou ain’t ain’t talking bout no money, I ain't heard nothinend of discussion, every time she call I’m comingI left the Maybach runningI keep the cash all hundredsPull out the sticks they drummingBitch I’m the boss you nothingI be talking bout the checkLook at my bitch her wrists on wetEverything I bust it downPut Eliante round her neck pussy so goodI bought the wagon off the lotPussy so good, I bought Chanel right on the spotBitch I’m the boss I knock it off won’t see the caseRich Forever, balling like the nba Bitch I am the boss, it ain't no talkin' to meI need a check, no I ain't talkin' for freeI took that bitch, she ain't been home in a weekPussy so good right, I might buy a Jeep"
"QhLd5HWma5A","Becky Lynch becoming 'The Man', feuding with Asuka, more | WWE BACKSTAGE | WWE ON FOX","2020-01-22T07:47:26.000Z","UCgKpcxVyF0qXU1h_Irzd7XA","WWE ON FOX","17","20.29.01","wwe|wwe on fox|smackdown|wrestling|fox sports|The Man|feuding with Asuka|Asuka|Becky Lynch joins CM Punk|WWE Backstage|journey so far|World Wrestling Entertainment|WWE rewind|Becky Lynch|Becky Lynch WWE|Becky Lynch WWE rewind|Asuka WWE|Asuka WWE rewind|Becky Lynch vs Asuka|Becky Lynch vs Asuka rewind","229401","5516","164","882","https://i.ytimg.com/vi/QhLd5HWma5A/default.jpg","False","False","Becky Lynch joins CM Punk, Paige, and Renee Young on this week's edition of WWE Backstage to discuss her journey so far in WWE, Asuka, and much more.#WWEonFOX #WWE #WWEBACKSTAGE #BeckyLynch #AsukaSUBSCRIBE for more from WWE ON FOX: https://foxs.pt/SubscribeWWEONFOX►FOX Sports YouTube channel: http://foxs.pt/SubscribeFOXSPORTSSee more from WWE ON FOX: https://foxs.pt/WWEONFOXFoxSportsLike WWE ON FOX on Facebook: https://foxs.pt/WWEONFOXFacebookFollow WWE ON FOX on Twitter: https://foxs.pt/WWEONFOXTwitterFollow WWE ON FOX on Instagram: https://foxs.pt/WWEONFOXInstagramAbout WWE ON FOX:Your official home for all things WWE on FOX, from Friday Night SmackDown to NXT and everything in between! WWE highlights, WWE Backstage segments, original stories with your favorite Superstars, and much, much more — find it all right here on WWE on FOX!Becky Lynch becoming 'The Man', feuding with Asuka, more | WWE BACKSTAGE | WWE ON FOXhttps://youtu.be/QhLd5HWma5AWWE ON FOXhttps://www.youtube.com/c/WWEonFOX"
"0fOCZS0J3qM","Honest Trailers | Joker","2020-01-21T18:00:01.000Z","UCOpcACMWblDls9Z6GERVi1A","Screen Junkies","1","20.29.01","screenjunkies|screen junkies|honest trailers|honest trailer|joker|joker trailer|honest trailers joker|joker review|joker reaction|joker 2019|joker trailer reaction|joker parody","2289739","82211","3044","6064","https://i.ytimg.com/vi/0fOCZS0J3qM/default.jpg","False","False","►►Find out How to Watch 'Never Surrender' Our Galaxy Quest Documentary at This Link►►https://www.journeyman.tv/film/7688/never-surrender►►iTunes Link►►https://itunes.apple.com/us/movie/never-surrender-a-galaxy-quest-documentary/id1486843892?mt=6&ign-mpt=uo%3D4►►Amazon Link►►https://www.amazon.com/gp/video/detail/B08175LBM1►►Google Play Link►►https://play.google.com/store/movies/details?id=3tPdBD7QwiA.P►►Vimeo Link►►https://vimeo.com/ondemand/neversurrenderdoc?ref=tw-sharePresented by Fandom►►Subscribe to ScreenJunkies!►► https://fandom.link/SJSubscribeHonest Trailers | JokerVoice Narration: Jon Bailey aka Epic Voice GuyWritten by: Spencer Gilbert, Joe Starr, Dan Murrell, Danielle Radford & Lon HarrisProduced by: Spencer Gilbert, Joe Starr, Dan Murrell, & Max DionneEdited by: Randy Whitlock & Kevin WilliamsenPost-Production Supervisor: Emin BassavandProduction Coordinator: Ryan OToole#HonestTrailers"
"aSCEnFXtQ14","Try Not To Laugh Challenge #38 w/ Tom Lennon","2020-01-21T18:00:00.000Z","UCYJPby9DRCteedh5tfxVbrw","Smosh Pit","22","20.29.01","smosh|smosh pit|smosh games|funny|comedy|Try Not To Laugh Challenge #38 w/ Tom Lennon|tom lennon|smosh try not to laugh|tntl","1574143","68219","836","2775","https://i.ytimg.com/vi/aSCEnFXtQ14/default.jpg","False","False","Tom Lennon and Ghostmates Director Jack Henry Robbins are here to try and make is LAUGH!Punch that bell icon so you'll know when we add a new episode!VHYes is in limited theaters now and available on VOD in March. Go to vhyes.oscilloscope.net/ for moreSHOP THE SMOSH CLOTHING LINE: https://smosh.storeWatch Every Waiter Ever: https://youtu.be/3V2vo0tiR5MWatch Mystery Top Hat Challenge! | Max Gentlemen: https://youtu.be/14i8TW2MTEgWatch Should We Keep Our Relationships Private? - SmoshCast #46: https://youtu.be/YTu3GJVlQgUSubscribe To Smosh Pit: Smosh: https://smo.sh/Sub2SmoshPitFollow Us:Instagram: https://instagram.com/smoshFacebook: https://facebook.com/smoshTwitter: https://twitter.com/smoshIan Hecox: https://www.instagram.com/ianhecox/Courtney Miller: https://www.instagram.com/co_mill/Shayne Topp: https://www.instagram.com/shaynetopp/Damien Haas: https://www.instagram.com/damienhaas/Tom Lennon: https://www.instagram.com/thomaspatricklennon/Jack Henry Robbins: https://www.instagram.com/jackhenryrobbinsCheck Out Our Other Smosh Channels:Smosh: https://smo.sh/Sub2SmoshSmosh Games: https://smo.sh/Sub2SmoshGamesSmoshCast: https://smo.sh/Sub2SmoshCast"
"ss6mIGfyvXM","Pearl Jam - Dance of the Clairvoyants","2020-01-22T05:10:57.000Z","UClQT6Vnsm6BUm0I5kR26EkQ","Pearl Jam","10","20.29.01","Pearl Jam|eddie vedder|stone gossard|jeff ament|mike mccready|matt cameron|pj|pearl jam 2013|monkeywrench records|rock|rock n roll|pearl jam music|gigaton|dance of the clairvoyants|new music|new single|2020","1126498","30706","1964","4273","https://i.ytimg.com/vi/ss6mIGfyvXM/default.jpg","False","False","Pearl Jam is back. New single Dance of the Clairvoyants available everywhere now: https://pearljam.lnk.to/DOTCYD'Dance' was a perfect storm of experimentation and real collaboration...We’ve opened some new doors creatively and that’s exciting. - Jeff AmentPre-order Gigaton today: https://pearljam.com/SUBSCRIBE: http://bitly.com/PJ_SubscribeLIKE on Facebook: http://bitly.com/PJ_FacebookFOLLOW on Twitter: http://bitly.com/PJ_TwitterFOLLOW on Instagram: http://bitly.com/PJ_InstagramFOLLOW on Tumblr: http://bit.ly/pj-tumblrSubscribe to Pearl Jam's YouTube channel for access to live performances, exclusive footage, and more!"
"yLvw8D_6KPo","Bruno Fernandes Transfer Update! Man Utd Transfer News","2020-01-22T07:00:06.000Z","UCMmVPVb0BwSIOWVeDwlPocQ","The United Stand","17","20.29.01","Manchester United|Man United|Man Utd|Manchester United TV|The United Stand|United Stand|Manchester United News|MUFC|Man Utd News|United|Manchester United 2020|Manchester United Latest News|Manchester United Transfer News|Manchester United Breaking News|Bruno Fernandes|Bruno Fernandes Transfer|Bruno Fernandes Manchester United|Man Utd Transfer News|Transfer news|Transfer|Manchester United latest news","223272","4572","287","1085","https://i.ytimg.com/vi/yLvw8D_6KPo/default.jpg","False","False","Smarterscout website https://www.smarterscout.com/ Use code SMARTER2020 to get the first month free. $5 a month after that. Bruno Fernandes should be a Manchester United player by Friday say the latest transfer reports. Get the latest Man Utd Transfer News on The United Stand🔔 SUBSCRIBE here http://bit.ly/1CmczHm 🚨VISIT OUR WEBSITE 🚨For all the latest United news and TUS content:https://www.theunitedstand.com⏲️The United Stand Content TIMELINE is the best way to find all our latest content quickly! https://www.theunitedstand.com/timeline📰 LATEST WRITTEN NEWS https://www.theunitedstand.com/articles/latest-news📸 FOLLOW OUR INSTAGRAMhttps://www.instagram.com/theunitedstandtv/✅ The United Stand MEMBERSHIP https://buff.ly/2I2Of9R📧Contact The United Stand = soccerboxtv@gmail.com📧WRITER SUBMISSIONS = unitedstandwebsite@gmail.comAddressing: Nora CalderSee the FULL United Stand Kit Range CLICK HERE https://buff.ly/2Krpw1zEXCLUSIVE NEW PODCAST ITUNES https://buff.ly/2ZUhv84Spotify https://buff.ly/34dwEo6Google Podcast https://buff.ly/2ZHlNDnCastBox https://buff.ly/2UuiU3RRadio Public https://buff.ly/34jWkzAThe United Stand is Manchester United's biggest independent fan channel. Made for Manchester United fans by Manchester United fans, the United Stand provides you with the latest Manchester United transfer news, highlights, goal reviews and much more. So if MUFC means the world to you, get involved and subscribe to The United Stand http://bit.ly/1CmczHm The United Stand SOCIAL ACCOUNTS:WEBSITE: https://www.theunitedstand.comFACEBOOK: https://www.facebook.com/UnitedStandMUFC/TWITTER: https://twitter.com/UnitedStandMUFCINSTAGRAM! Follow us here https://www.instagram.com/theunitedstandtv/#ManchesterUnited #MUFC"
"igkKs9O5wPg","How to Deal with Brown People (PART 2)","2020-01-21T21:22:09.000Z","UCfm4y4rHF5HGrSr-qbvOwOg","Lilly Singh","23","20.29.01","iisuperwomanii|superwoman|team super|comedy|skit|rant|lilly singh|youtube superwoman|manjeet|paramjeet|parents|types of people|superwoman youtube|lily sing|lilly singh brown bar|brown bar|hannah simone|russell peters|mena massoud|jay shetty|humble the poet|collabs|lilly singh collabs|lilly singh 12 collabs of christmas","993329","73875","2347","2934","https://i.ytimg.com/vi/igkKs9O5wPg/default.jpg","False","False","Because one video wasn’t enough! Your favorite brown family is back to teach you how to deal with your coloured friends. The Brown Bar, we’re still here to help.STALK OUR EMPLOYEES:Jay Shetty: https://www.instagram.com/jayshetty/?hl=enMena Massoud: https://www.instagram.com/menamassoud/?hl=enKal Penn: https://www.instagram.com/kalpenn/?hl=enHannah Simone: https://www.instagram.com/therealhannahsimone/Russell Peters: https://www.instagram.com/russellpeters/?hl=enHumble the Poet: https://www.instagram.com/humblethepoet/?hl=enSubscribe: http://bit.ly/SubLillySingh | MERCH: https://lillysingh.comWatch How to Deal with Brown People (The Brown Bar)! https://www.youtube.com/watch?v=QRhGxFl0NI4 If you want to add translations, click the gear icon and go to Subtitles/CC then to Add subtitles or CC! Follow Paramjeet:Instagram: https://instagram.com/iiparamjeetii/Twitter: https://twitter.com/iiparamjeetii/ Follow Manjeet:Instagram: https://instagram.com/iimanjeetii/Twitter: https://twitter.com/iimanjeetii/ Get HOW TO BE A BAWSE: https://lillysinghbook.com Follow Lilly Singh:Facebook: https://facebook.com/IISuperwomanII/Instagram: https://instagram.com/iisuperwomanii/Twitter: https://twitter.com/iisuperwomaniiLilly Singh Vlogs: https://youtube.com/user/SuperwomanVlogsOfficial Website: http://lillysingh.com/ Watch More Lilly Singh:Types Of People: https://youtube.com/watch?v=eR_nzGqYXNw&list=PLuBXqtS2jaLMu81JnF6AOnRHzG6Csbd6yMy Parents: https://youtube.com/watch?v=EPHMXbZml_s&list=PLuBXqtS2jaLOGQynSYvxaqUgvNl7Ovz8xSkits: https://youtube.com/watch?v=jyxi0rfEDnE&list=PLuBXqtS2jaLMhu9PU0tAaHbnqloWibwl0The Super Rants: https://youtube.com/watch?v=KYadw8gNOok&list=PLuBXqtS2jaLPopv899QwFphiirmD_XWdqLatest Uploads: https://youtube.com/user/IISuperwomanII/videos?view=0&sort=dd&shelf_id=2 Thanks for watching and don't forget to keep smiling. You're worth it! xoxo"
"nmGuVJMs0Ss","I Bought a Crashed JDM Supra In Japan!","2020-01-21T23:18:55.000Z","UCl4-WBRqWA2MlxmZorKOV7w","B is for Build","2","20.29.01","acura|aston martin|audi|bentley|bmw|Buick|cadillac|chevrolet|dodge|ferrari|fiat|ford|gm|gmc|honda|hyundai|infinity|jaguar|jeep|kia|lamborghini|land rover|lexus|maserati|mazda|mclaren|mercedes|mini|mitsubishi|nissan|porsche|ram|rolls royce|subaru|tesla|toyota|volkswagen|volvo|b is for build|a80|supra|old supra|imported|jdm|fast and the furious supra","587420","21372","778","2728","https://i.ytimg.com/vi/nmGuVJMs0Ss/default.jpg","False","False","In today's episode we are in Japan checking out the crashed 1995 Toyota Supra Turbo that i bought before its imported into the United States.  Importing this vehicle is made possible by JDM Buyer if you're interested in importing a JDM car to the USA head here: http://lp.jdmbuyer.com/bisforbuildsupra and join mailing list to see whats available. Find our second channel Behind The Build here: https://www.youtube.com/channel/UCuipK0SZuSqvtzM21LvxV9g❱ Shop - http://bisforbuild.com/❱ Patreon - http://www.patreon.com/user?u=3364742❱ Facebook - http://facebook.com/bisforbuild❱ Instagram - http://instagram.com/bisforbuild❱ Twitch - https://www.twitch.tv/bisforbuildMusic:Fareoh - Cloud Ten"
"V8L9ddbIp1A","What Can You Do With 100 Tubes of Toothpaste?","2020-01-21T21:35:42.000Z","UC1zZE_kJ8rQHgLTVfobLi_g","The King of Random","27","20.29.01","toothpaste|what's inside of toothpaste|100 tubes of toothpaste|what is toothpaste made of|tubes of toothpaste|giant toothpaste|giant toothbrush|giant props|boiling experiment|science experiment|tkor|thekingofrandom|random happens|grant thompson|nate|calli|brushing teeth","606053","16170","1601","2732","https://i.ytimg.com/vi/V8L9ddbIp1A/default.jpg","False","False","Today we're taking 100 tubes of toothpaste and testing out its different properties. What's inside of them, what are they made of, and how do they work? Can you boil it, does it foam up- what's the difference between charcoal toothpaste and regular?To pre-order Grant's book, head to one of the retailers below:Amazon: https://www.amazon.com/Garage-Science-Incredible-Projects-Backyard/dp/1250184509/Barnes & Noble: https://www.barnesandnoble.com/w/52-random-weekend-projects-grant-thompson-the-king-of-random/1134307752Books-A-Million: https://www.booksamillion.com/product/9781250184504IndieBound: https://www.indiebound.org/book/9781250184504Kobo:https://www.kobo.com/us/en/ebook/52-random-weekend-projectsiBooks: https://books.apple.com/us/book/52-random-weekend-projects/id1455110002Check out the TKOR Shop: http://bit.ly/2UCNpEbSee What Else We're Up To:TKOR Discord: http://bit.ly/2LTTRoyTKOR Reddit: http://bit.ly/2XOFn0mTKOR Instagram: http://bit.ly/2Ihef1jNate's Instagram: http://bit.ly/2CZx05FCalli's Instagram: http://bit.ly/2YWWryaTKOR Facebook: http://bit.ly/2Kl2zgrTKOR Pinterest: http://bit.ly/2InY0iTSend Us Some Mail:TKOR1881 W Traverse ParkwaySte. E #221Lehi, UT 84043Business Inquiries: For sponsorship requests or business opportunities please contact us directly: http://bit.ly/2VwFw3xMusic by:Aiyo - Morning Breath (Instrumental Version)Victor Olsson - Redneck Rumble 5Elias Naslin - You Still Amaze Me (Instrumental Version) Royalty Free Music from Epidemic Sound: http://bit.ly/2YZS8SHWARNING:This video is only for entertainment purposes. If you rely on the information portrayed in this video, you assume the responsibility for the results. Have fun, but always think ahead, and remember that every project you try is at YOUR OWN RISK.✌️👑  RANDOM NATION: TRANSLATE this video and you'll GET CREDIT! Click Here: http://bit.ly/3752jt2 Want credit TRANSLATING other videos? Click Here to see where else you can contribute: http://bit.ly/2UFOm1OThis video is dedicated to our friend and founder Grant Thompson- the one and only King of Random. Click here to to see our tribute to him: http://bit.ly/2MwG5bNTHANK YOU!! ✌️👑"
