video_id,title,publishedAt,channelId,channelTitle,categoryId,trending_date,tags,view_count,likes,dislikes,comment_count,thumbnail_link,comments_disabled,ratings_disabled,description
"WG2pOFrj5eI","Napoli vs Barcelona (1-1) | UEFA Champions League Highlights","2020-02-25T22:56:37.000Z","UC4i_9WvfPRTuRWEaWyfKuFw","BT Sport","17","20.26.02","bt sport|bt sport official|sp:ty=high|sp:dt=2020-02-25T20:00:00Z|sp:st=soccer|sp:li=chlg|sp:ti:home=NAP|sp:ti:away=BARC|messi|mertens","590716","9029","145","757","https://i.ytimg.com/vi/WG2pOFrj5eI/default.jpg","False","False","Dries Mertens and Antoine Griezmann scored either side of the break as Napoli and Barcelona played out a 1-1 draw in their UEFA Champions last-16 first-leg tie in Italy.Hit 'Subscribe' above to ensure you never miss a video from the BT Sport YouTube channel.Visit and subscribe to our 'BT Sport Boxing' YouTube channel ➡️ http://www.youtube.com/c/btsportboxingTwitter: http://twitter.com/btsportFacebook: http://www.facebook.com/btsportInstagram:http://instagram.com/btsportWebsite: http://sport.bt.com"
"tfgZHOy6q2M","Joe Rogan on Tyson Fury vs. Deontay Wilder Rematch","2020-02-25T20:30:02.000Z","UCnxGkOGNMqQEUMvroOWps6Q","JRE Clips","22","20.26.02","Joe Rogan|JRE|Joe Rogan Experience|JRE Clips|PowerfulJRE|Joe Rogan Fan Page|Joe Rogan Podcast|podcast|MMA|Joe Rogan MMA Show|UFC|comedy|comedian|stand up|funny|clip|favorite|best of","2146262","42857","803","5667","https://i.ytimg.com/vi/tfgZHOy6q2M/default.jpg","False","False","Taken from JRE #4131 w/Owen Smith:https://youtu.be/A1Q4vhC4Ink"
"A2qA5fMpZAk","Stephen A. reacts to Deontay Wilder blaming his costume for loss to Tyson Fury | First Take","2020-02-25T16:45:01.000Z","UCiWLfSweyRNmLpgEHekhoAg","ESPN","17","20.26.02","stephen a smith|stephen a|deontay wilder|tyson fury|deontay wilder vs tyson fury 2|deontay wilder vs tyson fury|tyson fury vs deontay wilder 2|tyson fury vs deontay wilder|wilder vs fury 2|wilder vs fury|fury vs wilder 2|fury vs wilder|wilder|fury|wilder fury|fury wilder|boxing|boxing espn|deontay wilder espn|tyson fury espn|stephen a smith deontay wilder|espn|stephen a smith tyson fury|max kellerman boxing|first take deontay wilder|first take espn","2039723","28776","1452","9438","https://i.ytimg.com/vi/A2qA5fMpZAk/default.jpg","False","False","Stephen A. Smith and Max Kellerman react to Deontay Wilder blaming his loss to Tyson Fury on his 40-pound pre-fight costume.✔ Subscribe to ESPN+ https://plus.espn.com/✔ Get the ESPN App: http://www.espn.com/espn/apps/espn✔ Subscribe to ESPN on YouTube: http://es.pn/SUBSCRIBEtoYOUTUBE✔ Subscribe to ESPN FC on YouTube: http://bit.ly/SUBSCRIBEtoESPNFC✔ Subscribe to NBA on ESPN on YouTube: http://bit.ly/SUBSCRIBEtoNBAonESPN✔ Watch ESPN on YouTube TV: http://es.pn/YouTubeTVExclusive interviews with Rachel Nichols https://urlzs.com/jNUReStephen A. Smith on ESPN https://urlzs.com/W19TzESPN on Social Media:► Follow on Twitter: http://www.twitter.com/espn► Like on Facebook: http://www.facebook.com/espn► Follow on Instagram: www.instagram.com/f/espnVisit ESPN on YouTube to get up-to-the-minute sports news coverage, scores, highlights and commentary for NFL, NHL, MLB, NBA, College Football, NCAA Basketball, soccer and more. More on ESPN.com: https://www.espn.com"
"QfC5pvds2-4","'OH COME ON' -FRANK WARREN REACTS TO WILDER COSTUME EXCUSE, TALKS FURY WIN, AJ-FURY, & FURY-WILDER 3","2020-02-25T18:19:36.000Z","UCdl_gZZR6BtKi45eHFGAduw","iFL TV","17","20.26.02","ifl tv|ifltv|mtk global|boxing news now|boxing news uk|boxing news|boxing today|british boxing|boxing uk|boxing rankings|boxing results|boxing updates|boxing|sports|'OH COME ON' -FRANK WARREN REACTS TO WILDER COSTIME EXCUSE|TALKS FURY WIN|AJ-FURY|& FURY-WILDER 3","168053","2213","259","1773","https://i.ytimg.com/vi/QfC5pvds2-4/default.jpg","False","False","'OH COME ON' -FRANK WARREN REACTS TO WILDER COSTUME EXCUSE, TALKS FURY WIN, AJ-FURY, & FURY-WILDER 3BY KUGAN CASSIUS 🥊 | Furys vs Wilder II Playlist: https://www.youtube.com/playlist?list=PL0O9MupJ4YWEPxo5lNZUMlxC048v_BAw6Why not keep up to date with us on social media? 🥊▶ | INSTAGRAM: https://www.instagram.com/ifltvboxing▶ | TWITTER: https://twitter.com/IFLTV▶ | FACEBOOK: https://www.facebook.com/ifltvDon’t miss the action – tune into BoxNation, Sky Sports and BT Sports and watch the fights live. Not signed up? You’ll find the best offers for new UK customers here:▶ | Sky - http://tidd.ly/452d9811▶ | BT - http://tidd.ly/90e75d54▶ | TalkTalk - http://tidd.ly/2d34a477🥊 | CHECK OUT OUR MOST POPULAR VIDEOS: https://goo.gl/dHeoTk🥊 | ANTHONY JOSHUA PLAYLIST: https://goo.gl/QZ58RD🥊 | TYSON FURY PLAYLIST: https://goo.gl/HdWpGj"
"T4x7sDevVTY","BTS Carpool Karaoke","2020-02-26T06:06:03.000Z","UCJ0uqCI0Vqr2Rrt1HseGirg","The Late Late Show with James Corden","24","20.26.02","The Late Late Show|Late Late Show|James Corden|Corden|late night|late night show|comedy|comedian|celebrity|celeb|celebrities|CBS|joke|jokes|funny|funny videos|funny video|humor|hollywood|famous","6946716","1204770","11755","100468","https://i.ytimg.com/vi/T4x7sDevVTY/default.jpg","False","False","James Corden hits the carpool lane with international superstars BTS to sing songs off their new album Map of the Soul: 7 and cover Bruno Mars' “Finesse (Remix) (feat. Cardi B) and “Circles“ by Post Malone, before finally taking a detour to a PLYOJAM dance class where James attempts to convince V, Jungkook, Jimin, RM, Jin, SUGA and J-Hope he’s got good enough moves to become the 8th member of BTS.#BTSCarpool #BTS #BTSxCordenMore Late Late Show:Subscribe: http://bit.ly/CordenYouTubeWatch Full Episodes: http://bit.ly/1ENyPw4Facebook: http://on.fb.me/19PIHLCTwitter: http://bit.ly/1Iv0q6kInstagram: http://bit.ly/latelategramWatch The Late Late Show with James Corden weeknights at 12:35 AM ET/11:35 PM CT. Only on CBS.Get new episodes of shows you love across devices the next day, stream live TV, and watch full seasons of CBS fan favorites anytime, anywhere with CBS All Access. Try it free! http://bit.ly/1OQA29B---Each week night, THE LATE LATE SHOW with JAMES CORDEN throws the ultimate late night after party with a mix of celebrity guests, edgy musical acts, games and sketches. Corden differentiates his show by offering viewers a peek behind-the-scenes into the green room, bringing all of his guests out at once and lending his musical and acting talents to various sketches. Additionally, bandleader Reggie Watts and the house band provide original, improvised music throughout the show. Since Corden took the reigns as host in March 2015, he has quickly become known for generating buzzworthy viral videos, such as Carpool Karaoke."
"cZ8IZ3iW_UM","Dillian Whyte bursts into LAUGHTER at Wilder, and calls out Fury!","2020-02-25T16:53:13.000Z","UC_JQGBtA7P0RwkRxd7xpJcA","Sky Sports Boxing","17","20.26.02","Sky sports|sky sports boxing|sky sports boxing stream|anthony joshua|anthony joshua highlights|dillian whyte|dillian whyte wilder|dillian whyte laughter|whyte laughs at wilder|dillian whyte tyson fury|tyson fury|fury vs whyte|whyte v fury|anthony joshua vs tyson fury|fury aj|fury joshua|fury wilder","1106720","20545","995","6891","https://i.ytimg.com/vi/cZ8IZ3iW_UM/default.jpg","False","False","►SUBSCRIBE http://bit.ly/SSBoxingSubDeontay Wilder is getting NO sympathy from Dillian Whyte following his defeat to Tyson Fury, with the Brixton man bursting into LAUGHTER whilst talking about Wilder's performance in the ring. Whyte also says Fury will attempt to avoid a WBC mandatory title fight but has vowed to break him down if the new champion agrees to a British battle.►TWITTER: https://twitter.com/skysportsboxing►FACEBOOK: http://www.facebook.com/skysportsboxing►WEBSITE: http://www.skysports.com/boxing"
"MUhR-lWJDuk","LED Lights Makeup Challenge!","2020-02-25T20:02:37.000Z","UCucot-Zp428OwkyRm2I7v2Q","James Charles","24","20.26.02","james|james charles|makeup artist|mua|covergirl|coverboy|cute|easy makeup|how-to|reviews|tutorials|funny videos|beauty tips|hacks|beauty|sister|sisters apparel|morphe|james charles x morphe|guru|lips|beauty hacks|makeup routines|e girl makeup|e boy makeup|makeup 2020|prom makeup|how to apply makeup for beginners|tik tok makeup|tik tok hacks|tik tok beauty hacks|led lights|led lights makeup challenge|makeup challenge|led","1719621","136198","2515","8412","https://i.ytimg.com/vi/MUhR-lWJDuk/default.jpg","False","False","HI SISTERS! Colorful LED Lights are SUPER trendy right now for room decor and Tik Tok transitions, but they make doing makeup EXTREMELY difficult. In today's video, I try the LED Lights Makeup Challenge and see what colorful eyeshadow look I can come up with... when I can't actually see the colors. Enjoy and don't forget to thumbs up and SUBSCRIBE!🎥 PREVIOUS VIDEO » https://youtu.be/4Sk-9hqf8vY👕 SISTER'S APPAREL » http://sisters-apparel.com🛎 Subscribe to my channel to join the sisterhood & hit the notification bell so you never miss an upload! » http://bit.ly/JamesCharles for new videos!__❤️ LET'S BE BFFSINSTAGRAM » http://instagram.com/jamescharlesFACEBOOK » http://facebook.com/jcharlesbeautyTWITTER » http://twitter.com/jamescharlesSNAPCHAT » jamescharlessTIKTOK » jamescharlesSISTERS APPAREL INSTAGRAM » @sistersapparel__💸 COUPON CODES 💸MORPHE BRUSHES » http://morphebrushes.comUse code JAMES for 10% off all products online AND in store!LILLY LASHES » https://lillylashes.com/Use code JAMES for 15% off all lashesLAURAS BOUTIQUE » http://lauras-boutique.comUse code JAMES for 10% off all items__♡ MY AMAZING TEAMDIRECTOR OF CONTENT: Louis Gargiulahttp://instagram.com/louisgargiulaEDITOR: Ryan Allenhttp://www.youtube.com/user/helloxryan GRAPHICS: Michael Rusakovhttp://instagram.com/michael.ny"
"_bYeNpgOjtc","Destiny 2: Season of the Worthy – Trials of Osiris Returns – Dev Insight","2020-02-26T04:00:11.000Z","UCxidp0WgNPBdIXpHZKQcoMw","Bungie","20","20.26.02","Destiny|Destiny 2|shadowkeep|season of the worthy|trials of osiris|trials|Destiny 2 Season 10|Season 10|dev insights|developer insights|developer commentary|ps4|xbox one|steam|pc|stadia|bungie|season pass|D2|Osiris|Saint-14|luke smith|cauldron|exodus blue|anomaly|pvp|free to play|f2p|new light","352007","20728","1337","3846","https://i.ytimg.com/vi/_bYeNpgOjtc/default.jpg","False","False","Trials of Osiris is back and it’s pretty insane. Destiny's infamous 3v3 pinnacle PvP activity is returning in Season of the Worthy. The developers at Bungie discuss the significance of its return and what to expect on your quest to the Lighthouse. Favorite maps and armor return as the level of competition rises to a new height.bung.ie/BuyFOLLOW DESTINY:https://www.twitter.com/destinythegamehttps://www.instagram.com/destinythegamehttp://www.discord.gg/destinygameFOLLOW BUNGIE: Facebook: https://www.facebook.com/Bungie/Twitter: https://www.twitter.com/bungieInstagram: https://www.instagram.com/bungie/_____________________________________Dive into the free-to-play world of Destiny 2 to experience responsive first-person shooter combat, explore the mysteries of our solar system, and unleash elemental abilities against powerful enemies. Create your Guardian and collect unique weapons, armor, and gear to customize your look and playstyle. Experience Destiny 2’s cinematic story alone or with friends, join other Guardians for challenging co-op missions, or compete against them in a variety of PvP modes."
"n8IypLpjhFw","Sewing a Suit for my Wedding","2020-02-25T19:18:07.000Z","UC0CG8Kj2DqFc9bJld0hJKBA","Ryland Adams","24","20.26.02","Ryland Adams|Morgan Adams|Shane Dawson|Andrew siwicki|Clothing|Wedding|Sewing|Haul|DIY|Funny Fails","1643963","124307","983","10824","https://i.ytimg.com/vi/n8IypLpjhFw/default.jpg","False","False","Subscribe to Morgan https://www.youtube.com/channel/UCSfLUmBHOLoL0uHcxhRCwFwSubscribe to Shane https://www.youtube.com/user/shane/vi... Follow Andrew https://www.instagram.com/andrewsiwicki/I finally have merch!! https://www.amazon.com/rylandadamsWATCH MY LAST VIDEO: https://www.youtube.com/watch?v=tBxTXxPj9YU https://youtu.be/tBxTXxPj9YUADD ME ON:INSTAGRAM: https://www.instagram.com/rylandadams...TWITTER: https://twitter.com/ryland_adams?lang=enSNAPCHAT: @rylandadamsspark effect created by MultiVerse Studio https://www.youtube.com/watch?v=47HhkkVgbCU"
"klDbFuxmXrA","Watch full South Carolina Democratic debate | CBS News","2020-02-26T05:05:26.000Z","UC8p1vwvWtl6T73JiExfWs1g","CBS News","25","20.26.02","cbs news|cbsn|live stream|democratic debate 2020|democratic debate highlights|presidential debate|watch live|democratic debate bloomberg|democratic debate biden|warren|amy klobuchar|joe biden|live democratic debate|how to watch|politics|democratic debate|US News|foreign policy|joe bien|pete buttigieg|michael bloomberg|bernie sanders|elizabeth warren","2739093","16818","23191","5248","https://i.ytimg.com/vi/klDbFuxmXrA/default.jpg","False","False","Debate starts at 1:00:00CBS News hosted the 10th Democratic presidential primary debate on Feb. 25 from 8 p.m. to 10 p.m. ET in Charleston, South Carolina, just days ahead of the state's primary on Feb. 29.The candidates who qualified were former Vice President Joe Biden, former New York City Mayor Mike Bloomberg, former South Bend Mayor Pete Buttigieg, Minnesota Senator Amy Klobuchar, Vermont Senator Bernie Sanders, billionaire investor Tom Steyer and Massachusetts Senator Elizabeth Warren.CBS Evening News anchor and managing editor Norah O'Donnell and CBS This Morning co-host Gayle King moderated the debate and were joined in questioning by Face the Nation moderator and senior foreign affairs correspondent Margaret Brennan, chief Washington correspondent Major Garrett and 60 Minutes correspondent Bill Whitaker.CBS News and CBSN aired post-debate live coverage hosted by Elaine Quijano, anchor of CBSN's Red & Blue, and political correspondent Ed O'Keefe, featuring live interviews with the candidates, surrogates and other newsmakers, plus in-depth analysis and reporting from the team of CBS News journalists and contributors in Charleston.--Subscribe to the CBS News Channel HERE: https://bit.ly/2uz8qYEWatch CBSN live HERE: http://cbsn.ws/1PlLpZ7cFollow CBS News on Instagram HERE: https://www.instagram.com/cbsnews/Like CBS News on Facebook HERE: http://facebook.com/cbsnewsFollow CBS News on Twitter HERE: http://twitter.com/cbsnewsGet the latest news and best in original reporting from CBS News delivered to your inbox. Subscribe to newsletters HERE: http://cbsn.ws/1RqHw7TGet your news on the go! Download CBS News mobile apps HERE: http://cbsn.ws/1Xb1WC8Get new episodes of shows you love across devices the next day, stream CBSN and local news live, and watch full seasons of CBS fan favorites like Star Trek Discovery anytime, anywhere with CBS All Access. Try it free! http://bit.ly/1OQA29B---CBSN is the first digital streaming news network that will allow Internet-connected consumers to watch live, anchored news coverage on their connected TV and other devices. At launch, the network is available 24/7 and makes all of the resources of CBS News available directly on digital platforms with live, anchored coverage 15 hours each weekday. CBSN. Always On."
"587ZD-y4LQE","ARK: Genesis - Part 1 Expansion Pack!","2020-02-26T04:45:15.000Z","UCEYfsfyne69mFfNTcZeZ6gw","ARK: Survival Evolved","20","20.26.02","ark|ark survival evolved|survival evolved|dinosaur game|xbox one|pc|steam|Genesis|ark genesis|expansion|dlc|trailer|release","253373","19378","286","1950","https://i.ytimg.com/vi/587ZD-y4LQE/default.jpg","False","False","CONTINUE YOUR QUEST FOR ULTIMATE SURVIVAL!Awaking within a virtual simulation, you must survive across exotic worlds unlike anything you’ve seen before! With a strangely familiar companion at your side, you must overcome the simulation’s rigorous missions. Only by fighting, building, taming, and exploring will you uncover the secrets behind this forbidding place.ARK: Genesis represents a new, story-oriented beginning in ARK’s epic saga of survival where your skill determines your success. Everything is turned up to the highest setting: the challenges, the dangers...and the vast rewards. Only the toughest and smartest survivors will pass the simulation’s many tests. Will you be one of them?ARE YOU THE ULTIMATE SURVIVOR?ARK Genesis: Part I Is Available Now!https://playark.com/genesis/Twitter at https://www.twitter.com/survivethearkLike us on Facebook https://www.facebook.com/survivetheark/Visit the Website: http://playark.comCommunity Hub: http://www.survivetheark.comSubreddit: https://www.reddit.com/r/playarkInstagram: https://www.instagram.com/survivethearkPlus watch us tame and train leviathan creatures: https://www.twitch.tv/survivetheark"
"V2ySDBiwBsQ","INSTAGRAM chooses my MAKEUP ROUTINE !! 😱","2020-02-25T19:30:37.000Z","UCa3wuly5TEbB5ETH8Ga-S0g","Kaci-Jay","22","20.26.02","kaci|kaci jay|kaci jay conder|kaci conder|dad v girls|dadvgirls|kaci dad v girls|dad vs girls","100538","6374","70","540","https://i.ytimg.com/vi/V2ySDBiwBsQ/default.jpg","False","False","INSTAGRAM chooses my MAKEUP ROUTINE !! 😱get my make up brushes here:https://kacijay.shopFollow me!Instagram: https://www.instagram.com/kaci.jay/21 buttons: https://www.21buttons.com/kaci.jay"
"wzXcTplqROQ","Planning the HOUSE UPGRADE!","2020-02-25T19:22:58.000Z","UCFYs3KYHDPoZfwGv0A4sYGQ","Life of Tom","22","20.26.02","life of tom|lifeoftom|tom syndicate|syndicate|syndicate vlog|vlogger|daily vlog|uk vlogger|tom cassell|adventure|travel|exploration","138092","5335","111","461","https://i.ytimg.com/vi/wzXcTplqROQ/default.jpg","False","False","I invited 100 random people into my Minecraft World.. (Here’s what happened) Check out the video here: https://youtu.be/b7dgyrm9CCo ● Click SUBSCRIBE to see more of my Videos 😀Don’t forget to click that LIKE button! 👍‎I upload new videos everyday at 7pm GMT, so see you again tomorrow! :) Grab yourself a Syndicate Shirt! ► http://www.syndicateoriginal.com/‎‎Send me something! ‎Tom Syndicate PO Box 418 ‎HYDE SK14 9DN‎My Socials‎● My Twitter ► ⁦‪https://twitter.com/ProSyndicate‎● My Instagram ► http://instagram.com/syndicate‎● My Facebook ► ⁦‪https://www.facebook.com/LifeOfTom‎● My Snapchat ► ItsSyndicate‎● My Gaming Channel ► https://www.youtube.com/Syndicate‎‎Want to upgrade your gaming equipment?‎Check out Razer ► ⁦‪http://rzr.to/lifeoftom‎‎Syndicate Original Clothing‎● Shop: ⁦‪http://www.syndicateoriginal.com‎● Twitter: https://twitter.com/SyndicateOG‎● Facebook: ⁦‪ ⁦‪https://www.facebook.com/SyndicateOG‎Thank you so much for watching, I hope you enjoyed the video!"
"bnYrWEypBbc","FREDDIE ROACH REACTS TO TYSON FURY STOPPING WILDER; PULLS NO PUNCHES ON EXCUSE & TOWEL THROWN IN","2020-02-26T01:59:47.000Z","UCmxZw7N4Jyljr1RbSs4Ymaw","FightHype.com","17","20.26.02","Freddie Roach|Tyson Fury|Deontay Wilder|Boxing|FightHype","224482","2414","85","845","https://i.ytimg.com/vi/bnYrWEypBbc/default.jpg","False","False","FightHype.com was on hand in Los Angeles, California where welterweight sensation Vergil Ortiz held a press conference for his upcoming March 28 return to the ring when he takes on contender Samuel Vargas. You don't want to miss what those in attendance had to say. Check it out!"
"6NLr1EvNllE","Mane’s late strike helps Liverpool overcome big scare! | Liverpool 3-2 West Ham | EPL Highlights","2020-02-24T22:14:34.000Z","UCNAf1k0yIjyGu3k9BwAg3lg","Sky Sports Football","17","20.26.02","sky sports|premier league|Football League|football|Sky Sports live|Sky|Sports|stream|sky sports football|premier league highlights|epl 1920|Liverpool|Liverpool 3-2 West Ham|Liverpool 3-2 West Ham highlights|Sky football|Sadio Mane|Trent Alexander-Arnold|Sadio Mane goal|Mo Salah goal|epl highlights 1920","1196144","14798","685","2554","https://i.ytimg.com/vi/6NLr1EvNllE/default.jpg","False","False","SUBSCRIBE ► http://bit.ly/SSFootballSubPREMIER LEAGUE HIGHLIGHTS ► http://bit.ly/SkySportsPLHighlightsHighlights from the Premier League as Sadio Mane's 81st-minute strike ensured Liverpool overcame an almighty scare to beat a spirited West Ham 3-2 at Anfield.Watch Premier League LIVE on Sky Sports here ► http://bit.ly/WatchSkyPL►TWITTER: https://twitter.com/skysportsfootball►FACEBOOK: http://www.facebook.com/skysports►WEBSITE: http://www.skysports.com/footballMORE FROM SKY SPORTS ON YOUTUBE:►SKY SPORTS FOOTBALL: http://bit.ly/SSFootballSub►SKY SPORTS BOXING: http://bit.ly/SSBoxingSub►SOCCER AM: http://bit.ly/SoccerAMSub►SKY SPORTS F1: http://bit.ly/SubscribeSkyF1"
"MZh-w2nysuI","BTS Performs ON at Grand Central Terminal for The Tonight Show","2020-02-25T05:29:51.000Z","UC8-Th83bH_thdKZDJCrn88g","The Tonight Show Starring Jimmy Fallon","23","20.26.02","The Tonight Show|Jimmy Fallon|BTS|Performs|ON|Grand Central Terminal|NBC|NBC TV|Television|Funny|Talk Show|comedic|humor|snl|tonight|show|jokes|funny video|interview|variety|comedy sketches|talent|celebrities|video|clip|highlight|BTS on Fallon|BTS interview|Bangtan Boys|Bangtan|K Pop|Kpop|music|Korean Pop|J-Hope|RM|Jin|Jimin|Jungkook|Suga|boy band|Boy With Luv|Blood Sweat & Tears|Euphoria|IDOL|Make It Right|HOME|ON live|BTS ON|ON BTS|BTS live|#BTS","11806277","1194208","22502","68960","https://i.ytimg.com/vi/MZh-w2nysuI/default.jpg","False","False","Global phenomenon BTS (방탄소년단) delivers an epic performance of ON from their album Map of the Soul: 7 when they take over the historic Grand Central Terminal in New York City for The Tonight Show.Subscribe NOW to The Tonight Show Starring Jimmy Fallon: http://bit.ly/1nwT1aN Watch The Tonight Show Starring Jimmy Fallon Weeknights 11:35/10:35c Get more The Tonight Show Starring Jimmy Fallon: https://www.nbc.com/the-tonight-show JIMMY FALLON ON SOCIALFollow Jimmy: http://Twitter.com/JimmyFallonLike Jimmy: https://Facebook.com/JimmyFallonFollow Jimmy: https://www.instagram.com/jimmyfallon/ THE TONIGHT SHOW ON SOCIALFollow The Tonight Show: http://Twitter.com/FallonTonightLike The Tonight Show: https://Facebook.com/FallonTonightFollow The Tonight Show: https://www.instagram.com/fallontonight/Tonight Show Tumblr: http://fallontonight.tumblr.com The Tonight Show Starring Jimmy Fallon features hilarious highlights from the show, including comedy sketches, music parodies, celebrity interviews, ridiculous games, and, of course, Jimmy's Thank You Notes and hashtags! You'll also find behind the scenes videos and other great web exclusives. GET MORE NBCNBC YouTube: http://bit.ly/1dM1qBHLike NBC: http://Facebook.com/NBCFollow NBC: http://Twitter.com/NBCNBC Instagram: http://instagram.com/nbctvNBC Tumblr: http://nbctv.tumblr.com/ BTS Performs ON at Grand Central Terminal for The Tonight Showhttp://www.youtube.com/fallontonight#FallonTonight#BTS#JimmyFallon"
"iVgWKflMjm4","PART TWO: Should We Be Listening to R. Kelly’s Music?","2020-02-26T00:00:05.000Z","UCdM8C3ufiI-i-I1XSugKVvg","The Real Daytime","24","20.26.02","the real|daytime|talk show|women|tamera mowry|adrienne bailon|loni love|jeannie mai|amanda seales|therealdaytime","144483","2580","94","788","https://i.ytimg.com/vi/iVgWKflMjm4/default.jpg","False","False","Real fam, are you still listening to R. Kelly’s music?"
"vkbHWEQfWPU","Deontay Wilder blamed this ring walk as the reason he lost to Tyson Fury","2020-02-25T17:01:11.000Z","UC-hWvVvE-crFl5vg5G8QbqA","BT Sport Boxing","17","20.26.02","BT Sport|BT Sport Boxing|BT Sport Wilder Fury|Wilder Fury 2|Wilder vs Fury|Deontay Wilder|Tyson Fury|Wilder Fury highlights|Tyson Fury interview|Deontay Wilder interview|deontay wilder ring walk|wilder ring walk|wilder 40lbs|wilder interview|wilder fury highlights","313931","2609","800","2510","https://i.ytimg.com/vi/vkbHWEQfWPU/default.jpg","False","False","Deontay Wilder claims that the costume he wore to the ring before his fight with Tyson Fury weighed over 40lbs and was the reason behind his defeat to the Gypsy King... #WilderFury2 Subscribe to BT Sport Boxing on YouTube ➡️ http://www.youtube.com/c/btsportboxingFollow BT Sport Boxing on Twitter ➡️ http://twitter.com/btsportboxingJoin our BT Sport Boxing Facebook Group ➡️ https://www.facebook.com/groups/BTSpo...Follow us on Instagram ➡️ http://instagram.com/btsportboxingRead more on upcoming fights on BT Sport and BT Sport Box Office ➡️ http://www.bt.com/sportboxoffice"
