video_id,title,publishedAt,channelId,channelTitle,categoryId,trending_date,tags,view_count,likes,dislikes,comment_count,thumbnail_link,comments_disabled,ratings_disabled,description
"luBOq-iAWbs","CHILLINIT - READY FOR THE PAIN #OCTAGON","2019-12-16T07:29:29.000Z","UCY97VmeXV1zF8GNKB2x8MWA","ChillinIt420","10","19.17.12","[none]","169914","11978","313","964","https://i.ytimg.com/vi/luBOq-iAWbs/default.jpg","False","False","PRE-ORDER THE ALBUM TODAY @ https://chillinit.bandtshirts.com.au/AVAILABLE FOR DOWNLOAD OR STREAMING ON ALL SERVICES AT MIDNIGHTLADIES AND GENTLEMEN, WELCOME TO THE OCTAGON"
"h1JKzHPCGso","Sidemen - Merry Merry Christmas Ft. Jme & LayZ (Official Music Video)","2019-12-15T19:46:17.000Z","UCh5mLn90vUaB1PbRRx_AiaA","MoreSidemen","10","19.17.12","sidemen|official music video|sidemen merry merry christmas|sidemen challenge|sidemen song in 24 hours|sidemen song|sidemen disstrack","4857058","356035","13203","15215","https://i.ytimg.com/vi/h1JKzHPCGso/default.jpg","False","False","Whoever has the most views on their Sidemen Official Music Video by Christmas Day wins! Sidemen - The Gift Ft. S-X - https://www.youtube.com/watch?v=dtNIbIedChgJme: http://twitter.com/JmeBBKLayZ: https://twitter.com/LayZ_MusicSidemen Make A Song In 24 Hours Challenge:https://www.youtube.com/watch?v=YyYnll7LjW4&t=1sUnfortunately due to issues with Shakka's label we've had to change the song's chorus and it isn't allowed to be on Spotify/iTunes"
"a_TSR_v07m0","Porch Pirate vs. Glitter Bomb Trap 2.0","2019-12-15T17:00:01.000Z","UCY1kMZp36IQSyNx_9h4mpCg","Mark Rober","28","19.17.12","package thief|glitter bomb|porch pirate|glitter bomb prank|glitter bomb package|funny|2019|funny videos|prank|react|science|engineering|package thief revenge|glitter bomb trap|package thief caught|glitter|home alone|mark rober|porch pirates|package thieves|update|trap|viral|funny videos 2019|caught on camera|comedy|pranks|porch|theif|holiday|christmas|amazon package|jimmy kimmel","15015648","946959","12322","44097","https://i.ytimg.com/vi/a_TSR_v07m0/default.jpg","False","False","11 months of social justice engineering boiled down to 15 minutes!Thanks to Bose for their support! Save $50 on the Headphones 700 now through 12/21 (US only)https://bose.life/markrober700Thanks to Macaulay Culkin!  Check out his channel- https://www.youtube.com/channel/UCsCw3J3T3XFLgKm2te7TrTQSpecial thanks to my buddy Sean Hodgins. I hired him to help me on this and it wouldn't have been possible without his mad skillz - https://www.youtube.com/channel/UCE-bw6PRKuDlH6fP1mP4nOwHere is where I got the biodegradable glitter from: https://www.plurvision.com/glitterThanks to all the volunteers across the country who put packages out for me!  *MUSIC*0:00 - Tchaikovsky - Dance of the Sugar Plum Fairy https://en.wikipedia.org/wiki/File:Tchaikovsky_-_Dance_of_the_Sugar_Plum_Fairy_-_The_Nutcracker.ogg0:23 - Cereal Killa - Blue Wednesday https://soundcloud.com/bluewednesday/0:56 - Arrow- Andrew Applepie http://andrewapplepie.com/1:28 - Marimba Idea - Blue Wednesday https://soundcloud.com/bluewednesday/2:58 - Arrow- Andrew Applepie http://andrewapplepie.com/3:52 - Dansez - Fasion https://soundcloud.com/michalgallo/dansez-fasion-beats-music4:28 - Sappheiroz - Falling https://soundcloud.com/sappheirosmusic/falling-ft-esoreni5:12 - Cereal Killa - Blue Wednesday https://soundcloud.com/bluewednesday/11:40 - Arrow- Andrew Applepie http://andrewapplepie.com/12:46 - Kalimba Jam - Blue Wednesday https://soundcloud.com/bluewednesday/15:44 - Q - Blue Wednesday https://soundcloud.com/bluewednesday/17:53 - New Shoes - Blue Wednesday https://soundcloud.com/bluewednesday/"
"a9m3GD0DbPY","Baking A Wedding Cake With Every Possible Cake Flavor In It","2019-12-15T21:21:11.000Z","UCbAwSkqJ1W_Eg7wr3cp5BUA","Safiya Nygaard","22","19.17.12","baking a wedding cake with every possible cake flavor in it|wedding cake|cake|baking|frankencake|mixing cake mixes|cake mixes|safiya nygaard|safiya wedding|safiya|safia|safiya and tyler|rosanna pansino|baking cakes|cake flavors","3281808","208416","2720","12590","https://i.ytimg.com/vi/a9m3GD0DbPY/default.jpg","False","False","You can check out our Colourpop frankenlipsticks here! https://colourpop.com/collections/safiya-nygaard-makeupAnd now I present to you, part 2 of our 4-part wedding series! We had to make a franken-wedding-something, so why not a cake? We decided to bake an 8-tier wedding cake where each layer is a different cake flavor, and then at the end taste them as tiers and all together. What do you guys think? Do you want a franken-cake at your wedding? Should we keep doing bad culinary science or retire our spatulas for good?Thank you so much to Rosanna Pansino for helping us bake our cake! You can find her channel here: https://www.youtube.com/user/RosannaPansinoDon’t forget to click the bell to turn on post notifications!Merch: https://fiendsbysaf.com/Safiya's IG: https://www.instagram.com/safiyany/Twitter: https://twitter.com/safiyajnFacebook: https://www.facebook.com/safnygaard/Assistant Editors: Emily Linden, Claire Wiley, Josie Latino, & Ben Chrobak-PrinceMusicvia Audio NetworkSFXVia Audioblocks"
"qbVsjbBllKQ","Star Wars Battlefront 2: The Rise of Skywalker Official Trailer","2019-12-16T15:00:11.000Z","UCOsVSkmXD1tc6uiJ2hc0wYQ","EA Star Wars","20","19.17.12","Star Wars|Star Wars Battlefront|Star Wars Battlefront II|Star Wars multiplayer|Battlefront|Battlefront 2|Rise of Skywalker trailer|Rise of Skywalker gameplay|Rise of Skywalker game|Episode 9|Episode IX|Battlefront 2 2019|Sith Trooper|Jet Trooper|BB8|Kylo Ren|Rey|Finn|Caphex Spy|Ovissian Gunner|Celebration Edition|EA Star Wars|DICE","3189176","145925","6734","19591","https://i.ytimg.com/vi/qbVsjbBllKQ/default.jpg","False","False","Immerse yourself in the finale of the Skywalker saga in Star Wars™ Battlefront™ II. Inspired by Star Wars™: The Rise of Skywalker™, set foot on an exotic new jungle planet where a fateful war between the Resistance and First Order thunders.Starting December 17, 2019, play as the ruthless Sith trooper, rain down fire from the skies with the new Jet trooper, or aid the Resistance with a hard-hitting Ovissian Gunner and resourceful Caphex Spy. BB-8 joins the battlefront in January 2020, bringing bravery and a fast-paced playstyle to the roster.Star Wars Battlefront II: Celebration Edition is the ultimate destination to live out your epic Star Wars battle fantasies. Enjoy over two years’ worth of free content updates and get more than 350 customization items at that!Full details on the Star Wars Battlefront II: Celebration Edition and The Rise of Skywalker Update: https://www.ea.com/games/starwars/battlefront/star-wars-battlefront-2/news/celebration-edition-rise-of-skywalker-roadmap-updateBuy or upgrade to the Star Wars Battlefront II: Celebration Edition now: https://www.ea.com/games/starwars/battlefront/star-wars-battlefront-2/buyFollow EA Star Wars on social: Twitter: https://twitter.com/EAStarWars  Instagram: https://www.instagram.com/eastarwars/  Facebook: https://www.facebook.com/EAStarWars/"
"g4U4BQW9OEk","Top Gun: Maverick (2020) – New Trailer - Paramount Pictures","2019-12-16T13:00:15.000Z","UCF9imwPMSGz4Vq1NiTWCC7g","Paramount Pictures","1","19.17.12","Top Gun|Top Gun: Maverick|Maverick|Top Gun 2|Top Gun Sequel|Top Gun Remake|Top Gun Movie|Tom Cruise|Miles Teller|Jennifer Connelly|Jon Hamm|Glen Powell|Lewis Pullman|Ed Harris|Jay Ellis|Danny Ramirez|Monica Barbaro|Greg Tarzan Davis|Charles Parnell|Bashir Salahuddin|Paramount|SkyDance|Jerry Bruckheimer|Official Trailer|Trailer|New Trailer|Action (Movie Genre)|New Movie|Coming Soon","6739797","90704","2873","10055","https://i.ytimg.com/vi/g4U4BQW9OEk/default.jpg","False","False","Watch the NEW trailer for #TopGun: Maverick starring Tom Cruise - In theatres June 26, 2020. After more than thirty years of service as one of the Navy’s top aviators, Pete “Maverick” Mitchell (Tom Cruise) is where he belongs, pushing the envelope as a courageous test pilot and dodging the advancement in rank that would ground him. When he finds himself training a detachment of Top Gun graduates for a specialized mission the likes of which no living pilot has ever seen, Maverick encounters Lt. Bradley Bradshaw (Miles Teller), call sign: “Rooster,” the son of Maverick’s late friend and Radar Intercept Officer Lt. Nick Bradshaw, aka “Goose.” Facing an uncertain future and confronting the ghosts of his past, Maverick is drawn into a confrontation with his own deepest fears, culminating in a mission that demands the ultimate sacrifice from those who will be chosen to fly it. Connect with #TopGunFacebook: https://www.facebook.com/TopGunMovie/Twitter: https://twitter.com/TopGunMovieInstagram: https://www.instagram.com/TopGunMovie/ Paramount Pictures Corporation (PPC), a major global producer and distributor of filmed entertainment, is a unit of Viacom (NASDAQ: VIAB, VIA), home to premier global media brands that create compelling television programs, motion pictures, short-form content, apps, games, consumer products, social media experiences, and other entertainment content for audiences in more than 180 countries.Connect with Paramount Pictures Online:Official Site: http://www.paramount.com/Facebook: https://www.facebook.com/ParamountInstagram: http://www.instagram.com/ParamountPicsTwitter: https://twitter.com/paramountpicsYouTube: https://www.youtube.com/user/Paramount"
"_e_IT906_ak","The Netflix Series That Was Also Scary for Adult James","2019-12-14T17:47:08.000Z","UCo8bcnLyZH8tBIH9V1mLgqQ","TheOdd1sOut","1","19.17.12","The Dark Crystal|Age Of Resistence|Netflix|Review|Skesis|Mystics|Agura|Tree Alien|Reveiw|Movie|Jim Henson|TheOdd1sout|theoddisout|theoddonesout|theodd1scout","7679171","423487","7055","37307","https://i.ytimg.com/vi/_e_IT906_ak/default.jpg","False","False","MMMMMMMMMMMMMMMMMMMMMMMGet Some Holiday Merch ➤ https://theodd1sout.com/ Pre-Order my book ➤ https://theodd1sout.com/pages/the-first-sequelSecond Channel ➤ https://www.youtube.com/channel/UC0GLNhtTu7yI8rl6ZZGeezwFirst Dark Crystal Review ➤ https://www.youtube.com/watch?v=SK6ZZgoy2D0Barnabydixon ➤ https://www.youtube.com/user/barnabydixonVideo Speed Controller Plugin ➤ https://chrome.google.com/webstore/detail/video-speed-controller/nffaoalbilbmmfgbnbgppjihopabppdk?hl=enAdditional artists: GetMadz ➤ https://www.youtube.com/user/TheMadz2012Rushlight Invader ➤ https://www.youtube.com/user/RushLightInvaderAnnie Loomis ➤ https://twitter.com/annieloomisartAntiDarkHeart ➤ https://twitter.com/AntiDarkHeartPantslessPajamas ➤ https://www.youtube.com/channel/UCR0O-1cvuPNxDosvSDLpWHgHexrin ➤ https://twitter.com/hexriinKat ➤ https://twitter.com/NineDoodlesfunymony ➤ https://www.youtube.com/user/funymonyTwitter ➤ https://twitter.com/Theodd1soutInstagram ➤ https://www.instagram.com/theodd1sout/Website/Merch: https://theodd1sout.com/"
"7OVyHWZJFIE","Mr and Mrs Miller - OUR WEDDING","2019-12-15T06:00:02.000Z","UCfacjXguCGmsQkNZG1GA-Og","Keep It Cleaner","1","19.17.12","wedding|bride|groom|marriage","266390","7738","136","221","https://i.ytimg.com/vi/7OVyHWZJFIE/default.jpg","False","False","FILMED & EDITED BY - Sam Evanshttps://www.instagram.com/samevanslife/ASSISTANT VIDEOGRAPHER - Logan Doddshttps://www.instagram.com/logan_dodds/Venue: 'The Miller Farm’ Private propVenue: 'The Miller Farm’ Private property on the Murray RiverDress/attire: Dress by One Day BridalHair: Rachel Vitullo from Joey Scandizzo SalonMake-up: Monica Gingold Fragrance: Maison Francis Kurkdjian Paris Baccarat Rouge 540Jewellery (not including wedding bands) : Linden CookJosh's Ring: https://www.artelia.com.auShoes: Rupert Sanderson for ceremony dress and Common Project sneakers for receptionGroom’s suit: Oscar HuntBridesmaid’s outfits: Shona JoyCatering: Matthew ButcherCake: Close friends Lydia and GeorgiePhotographers: Lost in Love PhotographyFirst dance song: Can’t help falling in love with you - Elvis PresleyNick Cunningham - Homehttps://www.instagram.com/nickcunningham/Jack Thomas & Josh Needham - Close Your Eyeshttps://www.instagram.com/joshthecreative_/https://www.instagram.com/jaxthomas_/Jack Thomas & Josh Needham - Can't Help Falling In Lovehttps://www.instagram.com/joshthecreative_/https://www.instagram.com/jaxthomas_/Flowers: Creating BeautifulGlamping tents: Twilight GlampingMarquee/furniture : Harry the Hirer Cars: Vintage Jaguar was a friend of a friends, the Rolls-Royce’s were from The Chauffeur Group auEvent planner/stylist: Creating Beautiful Marquee/furniture : Harry the Hirer"
"6jCJhiSV4qM","Scraps: Daisy Saves Andy - CONAN on TBS","2019-12-16T17:51:35.000Z","UCi7GJNg51C3jgmYTUwqoUXA","Team Coco","23","19.17.12","Conan O'Brien|Conan|Conan (TV Series)|TBS (TV Channel)|Team Coco","413596","7432","223","291","https://i.ytimg.com/vi/6jCJhiSV4qM/default.jpg","False","False","Andy’s dog, Daisy, is NOT a fan of this sketch where Santa Claus attacks her owner.More CONAN @ http://teamcoco.com/videoTeam Coco is the official YouTube channel of late night host Conan O'Brien, CONAN on TBS & TeamCoco.com. Subscribe now to be updated on the latest videos: http://bit.ly/W5wt5DFor Full Episodes of CONAN on TBS, visit http://teamcoco.com/videoGet Social With Team Coco:On Facebook: ‪https://www.facebook.com/TeamCoco‬On Google+: https://plus.google.com/+TeamCoco/On Twitter: http://twitter.com/TeamCocoOn Tumblr: http://teamcoco.tumblr.comOn YouTube: http://youtube.com/teamcocoFollow Conan O'Brien on Twitter: http://twitter.com/ConanOBrien"
"GSTyIwVqO6Q","YouTube Rewind 2019: Dude Perfect Edition | #YouTubeRewind","2019-12-16T23:00:10.000Z","UCRijo3ddMTht_IHyNSNXpNQ","Dude Perfect","17","19.17.12","dude perfect|dude perfect stereotypes|dude perfect water bottle flip|bottle flip|water bottle flip|dude perfect bottle flip|dude perfect basketball|dp|dude perfect world record|edition|nerf|trick shots|trick shot|family|ping pong|bowling|clean|family friendly|bubble wrap|soccer|football|spinner|spinners|fidget spinners|dude|youtube|rewind|2019|best|of|2018|real|life|worlds|recap|end|new|year|2020","3881092","259825","3602","7250","https://i.ytimg.com/vi/GSTyIwVqO6Q/default.jpg","False","False","Time for our BEST and FUNNIEST moments of 2019!!Special thanks to Entertainment One for sponsoring this video!Click HERE to get our new Untold Stories DVD: http://bit.ly/DudePerfectTrickShots► Want an EXTRA Dude Perfect Video every week? Join the DP SQUAD! https://www.youtube.com/user/corycotton/join► Thanks for subscribing! - http://bit.ly/SubDudePerfectMusic by Oh The Larceny:► Click HERE to Listen to “Another Level by Oh The Larceny on YouTube: https://youtu.be/LRcolCCt7Qk ► Click HERE to Stream/Buy “Another Level by Oh The Larceny: https://fanlink.to/OTLBloodIsRebel► Click HERE to Visit Oh The Larceny's Instagram: https://www.instagram.com/ohthelarceny/► Click HERE to Subscribe to Position Music on YouTube - https://www.youtube.com/positionmusicNEXT LEVEL STUFF -------------------------------------------🎒 NEW Merch - http://bit.ly/DPStore🎮 Play our FREE iPhone game! - http://smarturl.it/DudePerfect2📱 JOIN our VIP TEXT LIST - http://bit.ly/DPTextVIP🔔 Hit the bell next to Subscribe so you don't miss a video!👨🏻‍💻 Watch our newest vids! - http://bit.ly/NewDPVids📕 Read our Book - Go Big - http://amzn.to/OYdZ2sFollow our Instagrams so we can be best friends -------------------------------------------🏆 http://Instagram.com/DudePerfect🧔🏻 http://Instagram.com/TylerNToney👱🏻‍♂️ http://Instagram.com/Cody_Jones_🙋🏻‍♂️ http://Instagram.com/CobyCotton👨‍🦰 http://Instagram.com/GarrettHilbert⛹🏻‍♂️ http://Instagram.com/CoryCotton-------------------------------------------Another LevelArtist - Oh The LarcenyWritten By Tyrone Wells (ASCAP - 50%), Dustin Burnett (ASCAP - 50%)Published By Position Music Publishing (ASCAP - 50%), Tyrone Wells Music (ASCAP - 25%), Red Coco Publishing (ASCAP - 25%)-------------------------------------------Bonus points if you're still reading this! Comment your favorite video of 2019!Click here to learn more about Dude Perfect:http://bit.ly/AboutDudePerfectAs always...Go Big and God Bless!- Your friends at Dude PerfectBusiness or Media, please contact us at: Dude@DudePerfect.com5 Msgs/Month. Reply STOP to cancel, HELP for help. Msg&data rates may apply. Terms: slkt.io/DLd------------5 Best Friends and a Panda.If you like Sports + Comedy, come join the Dude Perfect team!Best known for trick shots, stereotypes, battles, bottle flips, ping pong shots and all-around competitive fun, Dude Perfect prides ourselves in making the absolute best family-friendly entertainment possible! Welcome to the crew! Pound it 👊🏻 Noggin 🙇🏻‍♂️ - Dude Perfect"
"D6wXU6lW7sc","The Haunting of Queen Mary's Castle","2019-12-15T21:14:02.000Z","UCg3gzldyhCHJjY7AWWTNPPA","Sam and Colby","24","19.17.12","sam golbach|colby brock|exploring|abandoned|exploring stanley hotel|sam and colby haunted|most haunted places|sam and colby scary|paranomal investigation|overnight at haunted hotel|sam and colby overnight|sam and colby queen mary|exploring haunted|top 10 haunted|sam colby jake corey|haunted london|the graveyard|24 hour overnight|biltmore hotel|sam and colby castle|haunted castle|queen mary castle|queen mary overnight|scottish castle|haunted england","1040754","110267","1176","12167","https://i.ytimg.com/vi/D6wXU6lW7sc/default.jpg","False","False","GET XPLR MERCH: https://shopxplr.comSam and Colby stay overnight at the haunted Queen Mary's Castle in Scotland. Corey Scherer and Jake Webber explore the hauntings behind the Castle and capture tons of paranormal evidencePrevious Movie THE GRAVEYARD: https://youtu.be/jMonTLNCGfINEW XPLR APP! Download for free: https://apps.apple.com/us/app/xplr/id1474820819Android: https://play.google.com/store/apps/details?id=co.tapcart.app.id_lMlmFXdnGD&hl=en_USFollow Jake and Corey!https://www.youtube.com/user/ItsCoreySchererhttps://www.youtube.com/user/Jakewebber9Channel Membership: https://www.youtube.com/channel/UCg3gzldyhCHJjY7AWWTNPPA/joinMake sure to Subscribe! https://www.youtube.com/channel/UCg3gzldyhCHJjY7AWWTNPPA?sub_confirmation=1Check out our personal channels!COLBY: https://www.youtube.com/c/ColbyBrockSAM: https://www.youtube.com/c/SamGolbachMusic Used: http://link.epidemicsound.com/Our other social media!Instagram: @SamandColbyTwitter: @SamandColbySnapchat: @samgolbach & @colbybrock"
"kA08iW7MOQk","UFC 245: Alexander Volkanovski & Max Holloway Octagon Interview","2019-12-15T06:12:59.000Z","UCvgfXK4nTYKudb0rFR6noLA","UFC - Ultimate Fighting Championship","17","19.17.12","ufc 245|ufc|245|max holloway|max|holloway|blessed|alexander volkanovski|alexander|volkanovski|joe rogan|joe|rogan|octagon|interview","1144429","11679","592","3095","https://i.ytimg.com/vi/kA08iW7MOQk/default.jpg","False","False","After a very close bout in the co-main event, hear from Alexander Volkanovski & Max Holloway.Subscribe to get all the latest UFC content: http://bit.ly/2uJRzRRExperience UFC live with UFC FIGHT PASS, the digital subscription service of the UFC. Visit https://ufcfightpass.com/To order UFC Pay-Per-Views, visit http://www.ufc.tv/events Connect with UFC online and on Social:Website: http://www.ufc.comTwitter: http://www.twitter.com/ufcFacebook: http://www.facebook.com/ufcInstagram: http://www.instagram.com/ufcSnapchat: UFCPeriscope: http://Periscope.tv/ufcConnect with UFC FIGHT PASS on Social:Twitter: http://www.twitter.com/ufcfightpassFacebook: http://www.facebook.com/ufcfightpassInstagram: http://www.instagram.com/ufcfightpass"
"215UNO5EV8A","FORCING MYSELF TO HAVE CHRISTMAS SPIRIT","2019-12-15T20:29:10.000Z","UC78cxCAcp7JfQPgKxYdyGrg","emma chamberlain","24","19.17.12","emma chamberlain|emma chambie|vlog|christmas|vlogmas","1663138","107395","2111","5432","https://i.ytimg.com/vi/215UNO5EV8A/default.jpg","False","False","Thanks to Yahoo Mail for sponsoring a portion of this video!Download the Yahoo Mail App: https://mail.onelink.me/107872968?pid=famebit&c=US_Awareness_VM1_YM6_Famebit_&af_sub1=Awareness&af_sub2=US_VM1&af_sub3=&af_sub4=&af_sub5=EmmaChamberlain__Video_&af_c_id=0 ✩ MY PODCAST ✩✭ listen on SPOTIFY: https://bit.ly/StupidGeniusShow✭ listen on APPLE PODCASTS: https://bit.ly/StupidGeniusPod✭ or just search Stupid Genius on spotify, apple podcasts, or wherever else you get your podcasts...✭ podcast merch NOW AVAILABLE: https://shopemmachamberlain.com/products/stupid_genius_podcast_hoodie✩ MERCH ✩✭  https://shopemmachamberlain.com✩ MY SOCIAL MEDIA ✩✭ instagram: https://www.instagram.com/emmachamberlain✭ twitter: https://twitter.com/emmachamberlain✭ snapchat: https://www.snapchat.com/emmachambie✭ spotify: http://open.spotify.com/user/emmachambie ✭ tik tok (lol): emmachambieI LUV U,-emma chamberlain"
"wZ6zKtsN_WI","6 Couples vs 1 Fake Couple","2019-12-15T15:00:08.000Z","UCJjSDX-jUChzOEyok9XYRJQ","Jubilee","24","19.17.12","jubilee|jubilee media|jubilee project|live deeper|blind devotion|love language|middle ground|spectrum|odd man out|odd man out couples|6 couples vs 1 fake couple|who is the fake couple?|who is the real couple?|cute couples|relationship goals|who is the mole|who is not a real couple","2940686","102293","2529","5659","https://i.ytimg.com/vi/wZ6zKtsN_WI/default.jpg","False","False","We're almost completely sold out at https://humangoodla.com - shop before we run out! Thanks for all your amazing support!SUBSCRIBE for more! 👉http://bit.ly/SUBSCRIBEjubilee 👈Be in a Jubilee video: http://bit.ly/JubileeCastingFollow us on INSTAGRAM: https://www.instagram.com/jubileemedia/Are you a loyal Jubilee fan? Join our Facebook group: https://www.facebook.com/groups/407942859721012/| ABOUT |Jubilee exists to bridge people together and inspire love through compelling stories. We create shareable human-centric videos that create connection, challenge assumptions, and touch the soul.Ultimately, we aim to inspire people to LIVE DEEPER.| SOCIAL |Jubilee Facebook: https://www.facebook.com/jubileemediaJubilee Instagram: https://www.instagram.com/jubileemedia/Jubilee Twitter: https://www.twitter.com/jubileemediaJubilee Website: https://www.jubileemedia.comFEATURING:Hannah: https://instagram.com/hannahmontana12346789Jamie: https://instagram.com/jaamie.nicholeDan: https://instagram.com/thedchenArielle: https://instagram.com/zkowPatrick: https://www.instagram.com/kane.the.insaneAlexander: https://instagram.com/_zandersOlivia: https://instagram.com/oliveediamondChristan: https://instagram.com/_christychris_Andrew: https://instagram.com/darth_drew94Ruben: https://instagram.com/rubenfitness_Help us caption & translate this video!https://amara.org/v/f5rE/For brands interested in partnering with Jubilee, email us:hello@jubileemedia.comHelp us caption & translate this video!https://amara.org/v/CZ14D/"
"lRx0ebNsxEM","Kardashians Hilariously Impersonate Each Other | Season 17 | Keeping Up With The Kardashians","2019-12-16T15:23:12.000Z","UCn3jIZe_5xsAgo5FlvyYCXw","hayu","24","19.17.12","hayu|keeping up with the kardashians|real housewives|million dollar listing|reality tv|vanderpump rules|southern charm|kim kardashian|khloe kardashian|kourtney kardashian|e!|bravo|rhobh full episodes|lisa vanderpump|kyle richards|Lisa rinna|rhony full epsodes|real housewives of|kuwtk season 17 finale|kuwtk finale episode|funny kardashian edits|kendall jenner|kylie jenner|kim kardashian wyoming ranch","1942745","71916","894","2638","https://i.ytimg.com/vi/lRx0ebNsxEM/default.jpg","False","False","Khloé is Kris, Kris is Khloé, Kim is Kourtney, and Kourtney is Kim - got it?#KUWTK #KimKardashian #KrisJennerSubscribe to the Official Hayu Channel https://www.youtube.com/c/hayuHayu is the place to watch your favourite reality shows whenever and wherever you want. With loads of shows the same day as the U.S. and thousands of episodes of binge-worthy Box Sets from the start, hayu is the undoubted home of reality TV. And if all that wasn't enough, we've got exclusive clips and snippets you can share and your fave stars' social media all in one place.With hayu, you can literally have it all."
"bzTWI4pKNy4","Juventus 3-1 Udinese | CR7 Scores Twice as Juve go Top! | Serie A TIM","2019-12-15T17:00:08.000Z","UCBJeMCIeLQos7wacox4hmLQ","Serie A","17","19.17.12","Juventus 3-1 Udinese|Juventus Udinese|Juventus Udinese highlights|Juventus Udinese 3-1 serie a|ronaldo goal|juventus highlights|Cristiano Ronaldo|Ronaldo|Juventus|CR7|Serie A|highlights|Bonucci|Dybala|Insigne|AC Milan|Inter Milan|Napoli|Roma|full highlights|watch|migliori gol|migliori in campo|migliori al mondo|gol del mese|calcio|Italia|lukaku|de ligt|balotelli|sp:ty=high|sp:dt=2019-12-15T13:00:00Z|sp:st=soccer|sp:li=seri|sp:ti:home=JUV|sp:ti:away=UDN|sp:vl=en","4606945","62904","1789","2802","https://i.ytimg.com/vi/bzTWI4pKNy4/default.jpg","False","False","Cristiano Ronaldo and Bonucci score against Udinese, to give Juventus a 3-1 win | Serie AThis is the official channel for the Serie A, providing all the latest highlights, interviews, news and features to keep you up to date with all things Italian football.Subscribe to the channel here! https://bit.ly/2OM2Eax Find out more about the Serie A at: http://www.legaseriea.it/en/ Questo è il canale ufficiale della Serie A, dove potrai avere accesso ai momenti salienti, alle interviste, alle notizie e alle funzionalità del momento per rimanere aggiornato sulle ultime novità del campionato.Iscriviti qui al canale! https://bit.ly/2OM2EaxPer maggiori infomazioni sulla Serie A: http://www.legaseriea.it/it"
