video_id,title,publishedAt,channelId,channelTitle,categoryId,trending_date,tags,view_count,likes,dislikes,comment_count,thumbnail_link,comments_disabled,ratings_disabled,description
"X2m-08cOAbc","Free Guy | Official Trailer | 20th Century FOX","2019-12-07T18:32:52.000Z","UC2-BeLxzUBSs0uSrmzWhJuQ","20th Century Fox","1","19.17.12","Free Guy|Ryan Reynolds|Trailer|Jodie Comer|Taika Waititi|Comedy|Action","9972647","265522","8822","15346","https://i.ytimg.com/vi/X2m-08cOAbc/default.jpg","False","False","In Twentieth Century Fox’s epic adventure-comedy “Free Guy,” a bank teller who discovers he is actually a background player in an open-world video game, decides to become the hero of his own story…one he rewrites himself. Now in a world where there are no limits, he is determined to be the guy who saves his world his way…before it is too late. Starring Ryan Reynolds, Jodie Comer, Joe Keery, Lil Rel Howery, Utkarsh Ambudkar and Taika Waititi, Directed by Shawn Levy from a story by Matt Lieberman and a screenplay by Lieberman and Zak Penn. Produced by Ryan Reynolds, Shawn Levy, Greg Berlanti, Sarah Schechter and Adam Kolbrenner with Mary McLaglen, Josh McLaglen, George Dewey, Dan Levine and Michael Riley McGrath serving as executive producers.Free Guy opens in U.S. theaters July 3, 2020.Connect with Free Guy Online:Visit the Free Guy WEBSITE: http://www.freeguymovie.comLike Free Guy on FACEBOOK: https://www.facebook.com/FreeGuyMovie/Follow Free Guy on TWITTER: https://twitter.com/FreeGuyMovieFollow Free Guy on INSTAGRAM: https://www.instagram.com/FreeGuyMovie#FreeGuy #RyanReynolds Connect with 20th Century FOX Online:Visit the 20th Century FOX WEBSITE: http://bit.ly/FOXMovieLike 20th Century FOX on FACEBOOK: http://bit.ly/FOXFacebookFollow 20th Century FOX on TWITTER: http://bit.ly/TwitterFOX"
"jlOncGequ8o","Philip proposes to Helen","2019-12-10T21:51:58.000Z","UCutXfzLC5wrV3SInT_tdY0w","Wong Fu Productions","24","19.17.12","proposal|wedding|the last|marriage|engagement|ring|asian boss girl|motivational|bopomofo|wong fu|ceremony|how to","680589","58372","281","3627","https://i.ytimg.com/vi/jlOncGequ8o/default.jpg","False","False","Helen and I decided to share this very personal moment because we're so grateful for the incredible response, warm wishes, and sincere messages of joy for us. It took a lot of work, heartache, and love to get to this point which went unseen for years, but perhaps by sharing this video, we can show some people out there that happy endings (and beginnings) are possible. Personally, Wong Fu kept me going through some very difficult years, and you helped in that, whether you knew it or not. I've grown a lot, and I'm grateful I can show you what that growth looks like. Thank you for all the love and support. Helen and I are deeply moved.HUGE thanks to Wes, Taylor, Eric, Melody, Janet, & Anne for making this surprise possible! No way I could've pulled this off without your help. And I'm soooooo happy I could share this special day/weekend with you, our closest friends.-Helen and PhilHelen Wu https://www.instagram.com/hwuwuPhil Wang https://www.instagram.com/wongfuphilShot by Eric, Taylor, WesEdited by TaylorSUBSCRIBE: https://www.youtube.com/user/WongFuProductions/featuredPATREON: https://patreon.com/wongfuproductionsFACEBOOK: ‪https://facebook.com/wongfuproductionsINSTAGRAM OFFICIAL: ‪https://www.instagram.com/wongfupro/TWITTER OFFICIAL: ‪https://twitter.com/wongfuproSTORE: ‪‪https://www.wongfustore.comOFFICIAL WEBSITE: ‪https://wongfuproductions.com"
"PymeUZ49ge8","The Guys Teach Chuck How Many Years Are in a Decade | NBA on TNT","2019-12-11T04:28:39.000Z","UCU7iRrk3xfpUk0R6VdyC1Ow","NBA on TNT","17","19.17.12","NBA on TNT|NBA|Inside the NBA|Charles Barkley|Shaq|Kenny Smith|Ernie Johnson|decade","327669","4143","176","1285","https://i.ytimg.com/vi/PymeUZ49ge8/default.jpg","False","False","Charles learns how many years are in a decade and the guys build their NBA All-Decade squads!Watch highlights from Inside the NBA with Shaq, Charles Barkley, Kenny Smith and Ernie Johnson and more! Subscribe now to be updated on the latest videos: https://www.youtube.com/nbaontnt?sub_confirmation=1Connect with NBA on TNT:Follow NBA on TNT on Twitter: https://twitter.com/NBAonTNTLike NBA on TNT on Facebook: https://www.facebook.com/NBAONTNT/Follow NBA on TNT on Instagram: https://www.instagram.com/nbaontnt/?hl=en"
"vOhLRx2pf9U","Higher | Mecha Kingdoms Skins Teaser - League of Legends","2019-12-10T18:00:09.000Z","UC2t5bjwHdUX4vM2g8TRDq5g","League of Legends","20","19.17.12","Riot Games|Riot|League of Legends|League|LoL|MOBA|Mecha kingdoms|jax|skin|skins teaser|event|lunar revel|mecha|avalon|robot|lol skins|league skins|animated trailer|skins trailer","1147521","40161","651","2400","https://i.ytimg.com/vi/vOhLRx2pf9U/default.jpg","False","False","We must rise above the past if we wish to have a future.Mecha Kingdoms launches with five new pilots on January 15, 2020, at 11:00 a.m. PT."
"EhQXAm66Sjg","Every Sick Day Ever","2019-12-09T17:00:02.000Z","UCY30JRSgfhYXA6i6xX1erWg","Smosh","23","19.17.12","smosh|smosh pit|smosh games|funny|comedy","1426703","59202","1331","5091","https://i.ytimg.com/vi/EhQXAm66Sjg/default.jpg","False","False","If your coughs are as loud and powerful as the bass in your speakers, you should probably stay home. This is EVERY SICK DAY EVER!Punch that bell icon so you'll know when we add a new episode!Ian Hecox // https://www.instagram.com/ianhecox/Courtney Miller // https://www.instagram.com/co_mill/Shayne Topp // https://www.instagram.com/shaynetopp/Damien Haas // https://www.instagram.com/damienhaas/Vanessa Merrell // https://www.instagram.com/vanessamerrell/Veronica Merrell // https://www.instagram.com/veronicamerrell/Jacklyn Uweh // https://www.instagram.com/blkjack76/CREWDirector: Ryan ToddWriters: Monica Vasandani & Ryan FinnertyExecutive Producer: Ryan ToddProduction Manager: Margo McHughProduction Coordinator: Nancy Azcona1st AD: David Gutel DP: Billy YatesCam Op: Brennan Iketani1st AC: Jacqi JonesDIT: Matt DuranArt Director: Cassie VanceArt Department Assistant: Yasmeen MughalSet Decorator: Tayler NicholsonSet Dresser: Sam ValladresProps & Stage Coordinator: David HillSound Mixer: Greg JonesScript Supervisor: Eddie Vigil VHair & Makeup Department Head: Rachel JenkinsWardrobe: Lena Frostestad Gaffer: Nick Giomuso Best Boy Grip: Dustin BloodgoodGrip: Jonathan NaKey PA: Austin BarrettEditor: Mike SmallAssistant Editor: Matt DuranGFX: Brittany MetzContent Manager: Kiana ParkerIT/Equipment Manager: Tim BakerExecutive Assistant: Nancy AzconaWatch Surprising Shayne with a Graduation Ceremony (he cries): https://youtu.be/8yXMTfApDcAWatch Mystery Baby Bottle Challenge!: https://youtu.be/uvlG3rFs_uwWatch Bonus: Live from VidCon 2019! - SmoshCast: https://youtu.be/cwnI9IJKA7ISHOP THE SMOSH CLOTHING LINE: https://smosh.storeSubscribe To Smosh: https://smo.sh/Sub2SmoshFollow Us:Instagram: https://instagram.com/smoshFacebook: https://facebook.com/smoshTwitter: https://twitter.com/smoshCheck Out Our Other Smosh Channels:Smosh Pit: https://smo.sh/Sub2SmoshPitSmosh Games: https://smo.sh/Sub2SmoshGamesSmoshCast: https://smo.sh/Sub2SmoshCast"
"wYovkrFEe9Q","How to make 75hp Feel Like 300+hp: Kei Car Ripping With Mighty Car Mods in Australia!","2019-12-09T17:00:27.000Z","UCXlfi8sf6cKGQ8sOd0-yRuw","Hoonigan","2","19.17.12","Hoonigan|Hoonigan Mighty Car Mods|Mighty Car Mods|MCM|Daihatsu|Daihatsu Mira|Kei Car|Yaris Hilton|TRXX|Daihatsu Mira TRXX|Moog|Marty|Australia|Hoonigan Australia|Hoonigan Down Under|k car|Daihatsu turbo|Hoonigan Hert|Hoonigan Vin|Chairslayer|Rob Parsons","633645","22839","259","1986","https://i.ytimg.com/vi/wYovkrFEe9Q/default.jpg","False","False","How could we go down under without visiting Mighty Car Mods themselves? Moog and Marty show us around their headquarters, and show off one of their more recent projects: a mad Daihatsu Mira kei car, modded up to around 75hp pushing only 1,500lbs of car. Can you have fun with just 75hp? Yes, yes you can. As long as you fit inside.TRDLZR by Mighty Car Mods: https://www.youtube.com/watch?v=SqTY2-Tkfmo&feature=emb_titleSubscribe, nerds! https://www.youtube.com/channel/UCXlfi8sf6cKGQ8sOd0-yRuw?sub_confirmation=1FB: https://www.facebook.com/TheHoonigans/IG: instagram.com/thehoonigansTurn on notifications so you don’t miss out, noob.https://www.hoonigan.com/Follow Our Crew:@brianscotto@vin_tra@hertlife@dangerdan3@mister_zachary@jchase7452@teaguefleury@baker_ashley@nelsonflores__@nadsynads@kyletstuart24@larry_chen_foto@roncarStay fresh with the latest apparel: https://www.hoonigan.com/featured.html"
"YahizdhHQ-Q","Rick and Morty 4x04 SECRET CAT ORIGIN Revealed! | Ricksplained","2019-12-10T01:47:58.000Z","UC7yRILFFJ2QZCykymr8LPwA","New Rockstars","24","19.17.12","rick and morty|rick and morty season|rick and morty season 4|rick and morty 404|rick and morty 4x04|ricksplained|rick and morty season 4 episode 4|rick and morty aftershow|rick and morty review|rick and morty reaction|new rockstars|rick and morty talking cat|rick and morty dragon|slut dragon|rick and morty dragon episode|claw and hoarder special ricktim's morty|brandon johnson","593635","12713","891","1218","https://i.ytimg.com/vi/YahizdhHQ-Q/default.jpg","False","False","Go to Hawthorne.co and use promo code RICK for 10% off your order.Use promo code RICKSPLAINED at Stamps.com for a 4-week free trial and free postage.Get 20% Off and Free Shipping with the code RICKSPLAINED at Manscaped.com.Rick and Morty Season 4 Episode 4 Claw and Hoarder Special Ricktim’s Morty gets an in-depth analysis. Is this dragon episode the most obscene episode of Rick and Morty yet? What is the horrible secret of the talking cat in this episode, and how could it connect back to Mr. Jellybean in Season 1? In this episode of #Ricksplained, Erik Voss, Tommy Bechtold, and the voice of Mr. Goldenfold, BRANDON JOHNSON, discuss the dark themes of this #rickandmorty episode, and whether we should take the advice of the cat and stop overthinking things... or whether that advice is actually covering up the cat's disgusting sexual history.CONNECT WITH US!Facebook: http://facebook.com/newmediarockstarsTwitter: http://twitter.com/newrockstarsPatreon: http://patreon.com/newrockstarsPATREON PRODUCERS:Dallas AndersonJake StormKelly HopperMatthew SalvasMiguel MendozaPony StarkSamuel MorseTodd SlawsbyUnder_CiegeProducer: Erik Voss http://www.twitter.com/eavossProducer: Zach HuddlestonWritten by: Erik VossExecutive Creative Director: Filup Molina http://www.twitter.com/filupmolinaPost Production Supervisor: John CostaEditors: Josh Hurd, Devin Cleary"
"JFAByoRP2VE","Miss Universe 2019 Final Question and Answer Round | Miss Universe 2019","2019-12-09T03:05:56.000Z","UCstEtN0pgOmCf02EdXsGChw","ABS-CBN Entertainment","24","19.17.12","ABS-CBN Entertainment|ABS-CBN Online|ABS-CBN Philippines|December 9 2019|20191209online|Miss Universe 2019|Miss U 2019|Miss U coronation night|Miss Universe Catriona Gray|Catriona Gray|Miss Universe 2019 coronation|Miss Universe in ABS-CBN|ABSCBN Miss Universe|Miss U ABS CBN|Zozibini Tunzi|Miss Universe South Africa 2019|Miss Universe 2019 Mexico|Miss Universe 2019 Puerto Rico|Sofía Aragón|Madison Anderson|Miss Universe 2019 Final Question and Answer","5479583","37783","2492","5391","https://i.ytimg.com/vi/JFAByoRP2VE/default.jpg","False","False","Miss Universe 2019 Top 5 answers timely questions about global issues.Courtesy of: “IMG Universe, LLC” The Miss Universe OrganizationSubscribe to the ABS-CBN Entertainment channel!http://bit.ly/ABS-CBNEntertainmentVisit our official website! http://entertainment.abs-cbn.comhttp://www.push.com.phFacebook: http://www.facebook.com/ABSCBNnetworkTwitter: https://twitter.com/ABSCBN Instagram: http://instagram.com/abscbn#MissUniverse2019#MissU#MissUTop5"
"HHKWXBY-1O4","BOAT LIFE: Cleaning the Ship. We arrived in an Old Fishing Village! Ep. 226","2019-12-09T21:34:01.000Z","UCZdQjaSoLjIzFnWsDQOv4ww","Sailing La Vagabonde","19","19.17.12","Cleaning the Ship. We arrived in an Old Fishing Village!","441503","17350","318","1129","https://i.ytimg.com/vi/HHKWXBY-1O4/default.jpg","False","False","Pick up our Essential Sail Guide: bit.ly/sailguide everything we've learned on our voyage!Follow our Patron John on IG, for his amazing art! https://www.instagram.com/noj.design/?hl=enSong Credits:00:00 Song selected from MusicBed. Get a free trial here: http://share.mscbd.fm/sailinglavagabonde01:41 Koresma - Canyon Walls (Andrew Rothschild Remix) - https://www.koresmamusic.com02:44 Song selected from MusicBed. Get a free trial here: http://share.mscbd.fm/sailinglavagabonde03:53 Now - HUFRIK - https://open.spotify.com/artist/3AcFiMakoMEOLYMF69EPJL?si=fRIS9VajTo6mcsAR0GUY2g07:15 Cold Hearted - Ead Wood - https://open.spotify.com/artist/3iOLgxOL7YEnf4mUMxBTak 08:28 Slow Train - Anthony Arya - https://www.anthonyarya.com/12:07 The Hunt - AKW - http://akwband.com16:46 The Hills - Brandon Hoogenboom - https://open.spotify.com/artist/6xXJO6wdSY2I6yWo997Oc2?Videos made by Elayna, starring Riley!!  https://www.instagram.com/elayna.carausuhttps://www.instagram.com/riley.whitelumDon't forget to like us on Facebook!http://www.facebook.com/sailinglavagabondeDownload Elaynas music here!https://elaynac.bandcamp.comPick up some official La Vaga merch and help support our journey!http://shop-lavagabonde.comSubscribe to our new sexy website for blog posts and updates!http://www.sailing-lavagabonde.comFollow us on Twitter!http://twitter.com/@sailing_lavagaLike Elaynas Music page on the book!http://www.facebook.com/elaynacmusicFAQWhat cameras do we use?BIG CAMERA: http://amzn.to/1t6fAfYOTHER BIG CAMERA: http://amzn.to/2rybQE2HANDY CAM: http://amzn.to/25KvT0xGOPRO: http://amzn.to/1t6haPcDRONE: http://amzn.to/2ooXPLsSELFIE STICK: http://bit.ly/SPIVO-STICKWhat software do we use?Premiere ProPredict Wind http://bit.ly/PredictWindNZ"
"3Za09x39MVE","After divorcing Lana, Rusev slams Lashley through a table: Raw, Dec. 19, 2019","2019-12-10T04:02:27.000Z","UCJ5v_MCY6GNUBTO8-D3XoAg","WWE","17","19.17.12","wrestling|submission wrestling|wwe|professional wrestling|Combat Sport|finishing moves|कुश्ती|पहलवान|डब्लू डब्लू ई|मैच|सुपरस्टार|व्यावसायिक कुश्ती|مصارعه|bobby lashley lana|wwe raw|lana and bobby lashley|rusev lana break up|rusev lana|rusev lana divorce|wwe rumors|wwe raw results|bobby lashley and lana|lana kisses lashley|bobby lashley kisses lana|bobby lashley vs rusev|wwe raw highlights today|wwe raw highlights this week|rusev lana segment","2830772","59620","2386","3688","https://i.ytimg.com/vi/3Za09x39MVE/default.jpg","False","False","A cantankerous divorce proceeding between Lana and Rusev leads to The Bulgarian Brute slamming his soon-to-be ex-wife’s suitor Bobby Lashley through a table.#RAWGET YOUR 1st MONTH of WWE NETWORK for FREE: http://wwe.yt/wwenetwork---------------------------------------------------------------------Follow WWE on YouTube for more exciting action!---------------------------------------------------------------------Subscribe to WWE on YouTube: http://wwe.yt/Check out WWE.com for news and updates: http://goo.gl/akf0J4Find the latest Superstar gear at WWEShop: http://shop.wwe.com------------------------------------WWE on Social Media------------------------------------Twitter: https://twitter.com/wweFacebook: https://www.facebook.com/wweInstagram: https://www.instagram.com/wwe/Reddit: https://www.reddit.com/user/RealWWEGiphy: https://giphy.com/wwe---------------------------------------------Check out our other channels!---------------------------------------------The Bella Twins: https://www.youtube.com/thebellatwinsUpUpDownDown: https://www.youtube.com/upupdowndownWWEMusic: https://www.youtube.com/wwemusicTotal Divas: https://www.youtube.com/wwetotaldivas#WWE #wrestling #prowrestling"
"D0QpldEWmlY","I used The Sims to perfect my apartment | Unraveled","2019-12-09T20:00:01.000Z","UCuVxaQDraOja6xKidcmoufA","Polygon","20","19.17.12","the sims|sims|sims 4|unraveled|brian david gilbert|bdg|videogames|video games|polygon|perfect|apartment|decoration|redecoration|simulation|simulated|jazz|painting|money|happiness|perfection|house|interior design|real life|irl|recreating|paint night|wholesome|joy|funny|pee|ridiculous","876038","90457","670","4052","https://i.ytimg.com/vi/D0QpldEWmlY/default.jpg","False","False","Is The Sims just another fun video game... or is it the perfect simulation device? Today, Brian David Gilbert is using The Sims 4 to test out a perfect apartment before recreating it in real life.Subscribe to our YouTube channel! https://goo.gl/D8prdfLike us on Facebook: http://bit.ly/PolygonFBFollow us on Twitter: http://bit.ly/PolygonTwitterFollow us on Instagram: http://bit.ly/PolygonInstaAnd for more gaming and entertainment coverage, visit www.polygon.com"
"yezDEWako8U","Harry Styles - Adore You (Official Video)","2019-12-06T13:00:09.000Z","UCbOCbp5gXL8jigIBZLqMPrw","HarryStylesVEVO","10","19.17.12","Adore You Video|Harry Styles Adore You|Harry Styles Adore You Official Video|Harry Styles Adore You Video|Harry Styles Eroda|Fine Line|Harry Styles Fine Line|New Harry Styles|HarryStyles|New Harry Styles Video|HS|HS2|Pop Music|Harry Styles Eroda Adore You|Adore You Eroda|Isle of Eroda|Eroda Island|Erodian|Erodean|Harry Styles Adore You Eroda|African Jewel Coat|African Jewel Coat Fish|African Jewel Coat Migration|Rosalia","12706907","995089","9898","38626","https://i.ytimg.com/vi/yezDEWako8U/default.jpg","False","False","Pre-order Harry Styles’ new album ‘Fine Line’ now: https://HStyles.lnk.to/FineLinePSPAAY Listen to “Adore You” now: https://HStyles.lnk.to/AdoreYouAYListen to “Watermelon Sugar” now: https://HStyles.lnk.to/WatermelonSugarAYListen to “Lights Up” now: https://HStyles.lnk.to/LightsUpAYHARRY STYLES. LOVE ON TOUR. 2020.https://hstyles.co.uk/tourFollow Harry Styles:Facebook: https://HarryStyles.lnk.to/followFIInstagram: https://HarryStyles.lnk.to/followIITwitter: https://HarryStyles.lnk.to/followTIWebsite: https://HarryStyles.lnk.to/followWISpotify: https://HarryStyles.lnk.to/followSIYouTube: https://HarryStyles.lnk.to/subscribeYDDirected by Dave MeyersWritten by Chris Shafer & Dave MeyersStarring Harry StylesNarration by RosalíaScore by Kid HarpoonProduced by Nathan ScherrerLine Produced by Jo Coombes, Ellen De Faux, & Tom GardnerCinematographer Scott CunninghamProduction Designer Laura Ellis CricksMr. Styles Styling by Harry LambertCast Styling by Verity May LaneEdited by Alyssa OhTelecine Stefan SonnenfeldVFX by Mathematic Sound Design Chris Afzal at Wave StudiosPost Produced by Adam Parker & Nathan ScherrerVideo Commissioner Bryan Younce A Freenjoy Production  Full Stop ManagementColumbia RecordsContent Creative Thanks:Audri KenleyLS ProductionsSomesuchEntire cast and crewLyrics:Walk in your rainbow paradiseStrawberry lipstick state of mindI get so lost inside your eyesWould you believe it?You don’t have to say you love meYou don’t have to say nothingYou don’t have to say you’re mineHoneyI’d walk through fire for youJust let me adore youOh honeyI’d walk through fire for youJust let me adore youLike it’s the only thing I’ll ever doLike it’s the only thing I’ll ever doYour wonder under summer skiesBrown skin and lemon over iceWould you believe it?You don't have to say you love meI just wanna tell you somethingLately you’ve been on my mindHoneyI’d walk through fire for youJust let me adore youOh honeyI’d walk through fire for youJust let me adore youLike it’s the only thing I’ll ever doLike it’s the only thing I’ll ever doIt’s the only thing I’ll ever doI’d walk through fire for youJust let me adore youOh honeyI’d walk through fire for youJust let me adore youLike it’s the only thing I’ll ever doI’d walk through fire for youJust let me adore youOh honeyOh honeyI’d walk through fire for youJust let me adore youLike it’s the only thing I’ll ever do#HarryStyles #AdoreYou #FineLine"
"9fteLHb24A4","The Kid LAROI - Let Her Go (Dir. by @_ColeBennett_)","2019-12-06T15:59:53.000Z","UCtylTUUVIGY_i5afsQYeBZA","Lyrical Lemonade","24","19.17.12","Laroi|The Kid Laroi|Let Her Go|In Love With The Money|Lyrical Lemonade|Cole Bennett|Music Video|Rap|Hip Hop|2019|Juice WRLD|Monster Truck|cole bennett let her go|kid laroi cole bennett|kid laroi lyrical lemonade|kid laroi official|kid laroi music|kid laroi 2019|the kid laroi music|the kid laroi official|the kid laroi 2019|the kid laroi cole bennett|the kid laroi let her go|let her go the kid laroi|the kid laroi music video|let her go music video","2593338","135571","4873","11255","https://i.ytimg.com/vi/9fteLHb24A4/default.jpg","False","False","Lyrical Lemonade Presents:The Kid LAROI - Let Her Go (Official Music Video)Directed + Edited by Cole BennettSong Produced by DSonBeats & JRHitMakerDir. of Photography - Michael StineSteadicam by Renard CherenEx Produced by Sal Tarantino & Jay TauzinThe Kid LAROI's Socials:http://instagram.com/thekidlaroihttp://twitter.com/thekidlaroi-Official Channel of Lyrical Lemonade Subscribe for updates on music videos, interviews, performance videos, etc.Lyrical Lemonade's Hot 25 Spotify Playlist:https://open.spotify.com/user/gh3vdz775oy18ah1wp9ucxsj5/playlist/5UuPeWDR2I8a8pORvW9vmrLyrical Lemonade Socials:http://www.twitter.com/lyricalemonadehttp://www.instagram.com/lyricalemonadehttp://www.facebook.com/lyricalemonadehttp://www.lyricallemonade.comCole Bennett Socials:http://www.twitter.com/_colebennett_http://www.instagram.com/_colebennett_LENNY ~ our hidden character representing happiness & good energyhttp://instagram.com/lenny#LyricalLemonade #LLMusicVideo #TheKidLAROI"
"d0zo8CRe6Qs","What happens if you photocopy water","2019-12-08T14:56:26.000Z","UCgGlx6XqXPthGyoyXkQkFpQ","Ceapa Cool","24","19.17.12","photocopy|water|what happens|meme|ceapa cool|money|canon|printer","3473928","136499","9233","9873","https://i.ytimg.com/vi/d0zo8CRe6Qs/default.jpg","False","False","What should I photocopy next?Leave your suggestions in the comments below or on my website!https://ceapa.coolInstagram: @ceapa_cool© 2019 Barsan Glad All Rights ReservedPlease do not repost my videos without my consent."
