video_id,title,publishedAt,channelId,channelTitle,categoryId,trending_date,tags,view_count,likes,dislikes,comment_count,thumbnail_link,comments_disabled,ratings_disabled,description
"u1cGTK4tupQ","Watch again: New Year's Eve 2020 celebrations and fireworks from around the world","2019-12-31T10:18:41.000Z","UCPgLNge0xqQHWM5B5EFH9Cg","The Telegraph","25","20.03.01","telegraph|news|telegraph news|new year's eve celebrations|new year's eve fireworks|Auckland|Sydney|Pyongyang|Hong Kong|China|Taiwan|Bangalore|Islamabad|Dubai|Moscow|Athens|Lebanon|cape town|Beirut|Paris|Berlin|Edinburgh|London|Rio|New York|Mexico City","6480987","53935","4551","401","https://i.ytimg.com/vi/u1cGTK4tupQ/default_live.jpg","False","False","Celebrations to mark the start of 2020 are being held around the world, starting with Kiribati (Line Islands) at 0900GMT, with New Zealand seeing in the new decade at 1100GMT. Key timings:1100GMT: Auckland, New Zealand 1300GMT: Sydney, Australia 1500GMT: Pyongyang, North Korea and Seoul, South Korea 1600GMT: Hong Kong, China, and Taiwan1830GMT: Bangalore, India 1900GMT: Islamabad, Pakistan 2000GMT: Dubai, United Arab Emirates 2100GMT: Moscow, Russia 2200GMT: Athens, Greece; Cape Town, South Africa; Beirut, Lebanon2300GMT: Paris, France 2300GMT: Berlin, Germany2345GMT: Edinburgh, UK 0000GMT: London, UK 0200GMT: Rio, Brazil 0500GMT: New York, USA 0600GMT: Mexico City, Mexico Get the latest headlines: https://www.telegraph.co.uk/Telegraph.co.uk and YouTube.com/TelegraphTV are websites of The Telegraph, the UK's best-selling quality daily newspaper providing news and analysis on UK and world events, business, sport, lifestyle and culture.#happynewyear2020 #2020NewYear #NewYearCelebrations"
"rdJZzBS7zQE","New Year's 2020: Dubai puts on stunning fireworks show at world's tallest building","2019-12-31T20:45:20.000Z","UChLtXXpo4Ge1ReTEboVvTDg","Global News","25","20.03.01","Dubai fireworks|Dubai NYE celebration|Dubai NYE fireworks|New Year’s Eve|برج خليفة|ألعاب برج خليفة النارية|ألعاب نارية دبي|حفلة رأس السنة في دبي|Dubai New Year's party|Burj Khalifa fireworks|NYE 2019|New Year’s Eve fireworks|full dubai fireworks|full dubai nye 2020|dubai nye fireworks|Burj Khalifa|burj khalifa fireworks","7823339","103942","6870","9222","https://i.ytimg.com/vi/rdJZzBS7zQE/default.jpg","False","False","Dubai, United Arab Emirates welcomed the new year with a mesmerizing display of fireworks from the world's tallest building, the iconic Burj Khalifa.For nearly 10 minutes, fireworks lit the sky over Dubai’s Burj Khalifa, as hundreds of thousands gathered downtown to watch the spectacular display.The New Year’s Eve display at the 828-meter-tall (2,716-foot-tall) skyscraper is just one of seven different fireworks shows across the emirate.For more info, please go to https://globalnews.ca/news/6350893/new-years-celebrations-2019/Subscribe to Global News Channel HERE: http://bit.ly/20fcXDcLike Global News on Facebook HERE: http://bit.ly/255GMJQFollow Global News on Twitter HERE: http://bit.ly/1Toz8mtFollow Global News on Instagram HERE: https://bit.ly/2QZaZIB#GlobalNews #NYE2020 #NewYearsEve #Dubai"
"58Fvq4jNLR4","Australia welcomes 2020 with firework celebrations on Sydney Harbour","2019-12-31T13:56:23.000Z","UCIzXayRP7-P0ANpq-nD-h5g","The Sun","25","20.03.01","The Sun|news|breaking news|sydney|new|years|eve|fire|bushfire|firework|display|sydney harbour|harbour|year's|2020|2019|NYE|Aus|Fireworks|New Year|New Year’s Eve|New Years Eve|Sydney harbour bridge|Australia|Sydney opera house","822642","7948","1316","2612","https://i.ytimg.com/vi/58Fvq4jNLR4/default.jpg","False","False","Sydney's New Year celebrations went off with a bang as hundreds of fireworks were launched from the Harbour Bridge at midnight.It is a moment to enjoy for residents after the city was choked by thick smoke from wildfires.But some campaigned for the event to be cancelled out of respect for those whose homes were destroyed in surrounding towns in New South Wales.Read more: https://www.thesun.co.uk/news/10644366/bushfires-mallacoota-trapped-beach-red-sky/From Brexit breaking news to HD movie trailers, The Sun newspaper brings you the latest news videos and explainers from the UK and around the world.Become a Sun Subscriber and hit the bell to be the first to knowRead The Sun: http://www.thesun.co.ukLike The Sun on Facebook: https://www.facebook.com/thesun/Follow The Sun on Twitter: https://twitter.com/TheSunSubscribe to The Sun on Snapchat: https://www.snapchat.com/discover/The_Sun/1633225139"
"yhmaXS70YnQ","Flames rip through towns, fears death toll will rise as bushfires rage on | ABC News","2019-12-31T08:36:03.000Z","UCVgO39Bk5sMo66-6o6Spn6Q","ABC News (Australia)","25","20.03.01","Australia|abc|abc news|news|fires|bushfire|bushfires|bushfires australia|bushfires nsw|fires nsw|emergency|extreme weather|sydney|sydney news|wildfire|wildfires|new south wales|new south wales bushfire|firefighters|fire season|emergency warning|flames|blaze|blazes|rural fire service|homes lost|firies|bushfire season|fire service","300102","3159","189","0","https://i.ytimg.com/vi/yhmaXS70YnQ/default.jpg","True","False","As the year, and the decade, come to an end, the country is burning.It's been labelled the worst fire season ever recorded - an apocalypse, a nightmare, like looking into the gates of hell.From the New South Wales/Victoria border, all the way to the Central Coast, nine blazes reached emergency warning level today.Read more here: https://www.abc.net.au/news/2019-12-31/nsw-bushfires-cobargo-fire-destroys-towns-main-street/11834322For more from ABC News, click here: https://ab.co/2kxYCZYYou can watch more ABC News content on iview: https://ab.co/2mge4KHSubscribe to us on YouTube: http://ab.co/1svxLVEGo deeper on our ABC News In-depth channel: https://ab.co/2lNeBn2You can also like us on Facebook: http://facebook.com/abcnews.auOr follow us on Instagram: http://instagram.com/abcnews_auOr even on Twitter: http://twitter.com/abcnews"
"n-GpnvREM5Q","Fixing the best JDM 2 door AWD car ever made","2019-12-31T20:33:54.000Z","UCgJRL30YS6XFxq9Ga8W2J3A","Mighty Car Mods","2","20.03.01","mighty|car|mods|mcm|MCM|moog|marty|turbo|jdm|how|to|diy|do|it|yourself|nissan|subaru|supercharged|race|pulsar|gtir|gtr|all wheel drive|haltech|1500|elite|restoration|fix","786264","29476","299","3344","https://i.ytimg.com/vi/n-GpnvREM5Q/default.jpg","False","False","We push a broken nugget into our shed and give it the love it so desperately deservesShop: http://www.mightycarmods.com/collections/Facebook: http://www.facebook.com/mightycarmodsForum: http://forums.mightycarmods.comMore info on the Haltech gear we used here: https://www.haltech.com/product-category/nissan/pulsar-n14-gtir/Also something to note around Mighty Car Mods: we are normal guys and are not trained mechanics. We like to make interesting car mods and show you how we've gone about it, but we can't promise that anything we show you will work for your particular car, or that you won't harm yourself, someone else, your car or your warranty doing it. Please be safe, be responsible and unless you know what you're doing, do not fool around with very serious machinery just because you've seen us make it look so easy. Talk to a qualified mechanic if you are in any doubt."
"XEMwSdne6UE","A Quiet Place Part II - Official Trailer - Paramount Pictures","2020-01-01T14:02:20.000Z","UCF9imwPMSGz4Vq1NiTWCC7g","Paramount Pictures","1","20.03.01","a quiet place|a quiet place part ii|john krasinski|emily blunt|millicent simmonds|millie simmonds|noah jupe|a quiet place trailer|a quiet place part II trailer|a quiet place sequel|a quiet place part 2|a quiet place 2|new trailer|movie trailer|2020 movies|horror movie|thriller movie|new movies","8358133","223837","4522","17541","https://i.ytimg.com/vi/XEMwSdne6UE/default.jpg","False","False","Watch the official trailer for A Quiet Place Part II. In theatres March 20.Following the deadly events at home, the Abbott family (Emily Blunt, Millicent Simmonds, Noah Jupe) must now face the terrors of the outside world as they continue their fight for survival in silence.  Forced to venture into the unknown, they quickly realize that the creatures that hunt by sound are not the only threats that lurk beyond the sand path.#AQuietPlace Part IIhttp://facebook.com/AQuietPlaceMoviehttp://instagram.com/AQuietPlaceMoviehttp://twitter.com/QuietPlaceMovie"
"jFuOoAFJlOg","Justin Bieber: Seasons | Official Trailer Ft. Yummy | YouTube Originals","2019-12-31T17:00:13.000Z","UCIwFjwMjI0y7PDBVEO9-bkQ","Justin Bieber","24","20.03.01","Justin Bieber|Music|Yummy|Musician|Artist|Singer|Documentary|Docu-series|Justin Bieber: Seasons|Justin|Bieber|bieber 2020|bieber is back|justin bieber yummy|yummy justin bieber|justin bieber documentary|justin bieber seasons|seasons justin bieber|justin bieber new tour|justin bieber new album|yummy new song|bieber new song|bieber new album|justin bieber tour|#bieber2020|#bieberisback|#bieberiscoming|justin beiber","4332215","371636","9905","17381","https://i.ytimg.com/vi/jFuOoAFJlOg/default.jpg","False","False","For the very first time, the world’s biggest superstar, Justin Bieber, is pulling back the curtain and giving fans an intimate look into the past few years of his life. From the joys of marriage to the struggles through difficult seasons, Justin opens up to reveal his biggest challenges as he gets back into the studio to record his first album since 2015. Watch the full trailer now, which features a sneak peek of his new single Yummy.” Justin Bieber: Seasons a new documentary series premieres January 27 and you can choose how you want to watch - get early access to new episodes and watch the series ad-free with YouTube Premium or watch two new episodes each week with ads for free on YouTube. Learn more at https://support.google.com/youtube/answer/6358146. Check out YouTube Premium at: https://www.youtube.com/premium/originals See if Premium is available in your country at: https://support.google.com/youtube/answer/6307365#Bieber2020Pre-save Yummy. Out Jan 3: https://www.justinbiebermusic.com/presaveyummy"
"Q_F9CxSmGOM","World's Longest Home Run (The Mad Batter Machine) - Smarter Every Day 230","2020-01-01T05:58:06.000Z","UC6107grRI4m0o2-emgoDnAA","SmarterEveryDay","28","20.03.01","Smarter|Every|Day|Science|Physics|Destin|Sandlin|Education|Math|Smarter Every Day|experiment|nature|demonstration|slow|motion|slow motion|education|math|science|science education|what is science|Physics of|projects|experiments|science projects|baseball|made batter|home run|statistics|hank aaron|babe ruth|mickey mantle|pitcher","3874517","102211","2186","5805","https://i.ytimg.com/vi/Q_F9CxSmGOM/default.jpg","False","False","Get your first audiobook plus 2 Audible Originals free when you try Audible for 30 days https://www.audible.com/smarter or text smarter to 500 500Click here if you're interested in subscribing: http://bit.ly/Subscribe2SED⇊  Click below for more links!  ⇊If you're awesome and would consider supporting on Patreon here's that link:http://www.patreon.com/smartereveryday~~~~~~~~~~~~~~~~~~~~~~~~~~~~GET SMARTER SECTIONCheck out Jeremy's Channel:https://www.youtube.com/channel/UC_SLthyNX_ivd-dmsFgmJVgBelieve it or not, the wikipedia article on the home run is pretty great https://en.wikipedia.org/wiki/Home_run~~~~~~~~~~~~~~~~~~~~~~~~~~~~Tweet Ideas to me at:http://twitter.com/smartereverydaySmarter Every Day on Facebookhttps://www.facebook.com/SmarterEveryDaySmarter Every Day on Patreonhttp://www.patreon.com/smartereverydaySmarter Every Day On Instagramhttp://www.instagram.com/smartereverydaySmarter Every Day SubReddithttp://www.reddit.com/r/smartereverydayAmbiance, audio and musicy things by: Gordon McGladdery https://www.ashellinthepit.com/http://ashellinthepit.bandcamp.com/If you feel like this video was worth your time and added value to your life, please SHARE THE VIDEO!If you REALLY liked it, feel free to pitch a few dollars Smarter Every Day by becoming a Patron.http://www.patreon.com/smartereverydayWarm Regards,Destin"
"3WySwhj2SwE","Indignant Pope Francis slaps woman's hand to free himself at New Year's Eve gathering","2020-01-01T03:02:09.000Z","UCIRYBXDze5krPDzAEOxFGVA","Guardian News","25","20.03.01","pope|pope francis|vatican|grab|hand|yank|angry|disgruntled|new year's eve|the pope|christianity|religion|new year|pope video|pope francis slaps woman's hand|pope francis yanks hand|pope francis new year's eve|new year's eve vatican|st peter's square|pope viral video|pope woman|pope francis annoyed|pope francis angry|francis|woman and pope|slap|pope francis video|2020|world|gdnpfpnewsworld|pope francis grabbed|pope slaps woman|woman grabs pope's hand|italy","3519942","11816","3534","8911","https://i.ytimg.com/vi/3WySwhj2SwE/default.jpg","False","False","A visibly annoyed Pope Francis had to pull himself away from a woman in a crowd in St Peter's Square on New Year's Ever after she grabbed his hand and yanked him towards her. Pope Francis was walking through the square and greeting pilgrims. After reaching out to greet a child, the pope turned away from the crowd only for a nearby woman to seize his hand and pull her towards him. The abrupt gesture appeared to cause him pain and Francis slapped swiftly slapped at her hand before pulling his hand free Subscribe to Guardian News on YouTube ► http://bit.ly/guardianwiressubPope Francis apologises after slapping woman's hand ► https://www.theguardian.com/world/2020/jan/01/pope-francis-apologises-after-slapping-womans-handSupport the Guardian ► https://support.theguardian.com/contributeToday in Focus podcast ► https://www.theguardian.com/news/series/todayinfocusThe Guardian YouTube network:The Guardian ► http://www.youtube.com/theguardianOwen Jones talks ► http://bit.ly/subsowenjonesGuardian Football ► http://is.gd/guardianfootballGuardian Sport ► http://bit.ly/GDNsportGuardian Culture ► http://is.gd/guardianculture"
"PK1nZog0cv4","Ferocious fires hit NSW south coast | Nine News Australia","2019-12-31T07:29:29.000Z","UCIYLOcEUX6TbBo7HQVF2PKA","Nine News Australia","25","20.03.01","Nine News Australia|Channel 9|Breaking News|Sydney News|Melbourne News|Brisbane News|Politics|south coast fires|nsw bushfires|bushfires australia|australian bushfire crisis|bushfire emergency|bushfires|fires south coast|fires batemans bay|batemans bay deaths|fires life lost|lives lost in fires|nowra fires|combargo fires","151897","961","71","0","https://i.ytimg.com/vi/PK1nZog0cv4/default.jpg","True","False","Residents and holiday-goers are pushed to the water’s edge as fires ravage Batemans Bay on the NSW south coast. Subscribe: https://bit.ly/2noaGhv Get more breaking news at: https://bit.ly/2nobVgFJoin Nine News for the latest in news and events that affect you in your local city, as well as news from across Australia and the world.Follow Nine News on Facebook: https://www.facebook.com/9News/Follow Nine News on Twitter: https://twitter.com/9NewsAUSFollow Nine News on Instagram: https://www.instagram.com/9news/#9News #NineNewsAustralia #9NewsAUS"
"N1vWbcoTmkk","We Took The Polar Plunge","2020-01-01T20:00:01.000Z","UCIcgBZ9hEJxHv6r_jDYOMqg","Unus Annus","23","20.03.01","unus annus|markiplier|crankgameplays|memento mori|polar plunge|ice bucket challenge|jumping into ocean in winter|cold water in winter|polar plunge in winter|swimming in freezing water|new years day|new years challenge|new years polar plunge","999578","106049","598","9113","https://i.ytimg.com/vi/N1vWbcoTmkk/default.jpg","False","False","There is only one RIGHT way to start a new year: By submerging yourself in freezing cold water. #ColdusAnnusᴍᴇʀᴄʜ ➤ http://www.unusannus.comᴜɴᴜs ➣ http://www.youtube.com/crankgameplaysᴀɴɴᴜs ➢ http://www.youtube.com/markiplierᴛᴡɪᴛᴛᴇʀ ► http://www.twitter.com/unusannusɪɴsᴛᴀɢʀᴀᴍ ► http://www.instagram.com/unusannusʀᴇᴅᴅɪᴛ ► http://www.reddit.com/r/unusannusᴛᴜᴍʙʟʀ ► http://www.unusannus.tumblr.comEdited by  ► http://www.youtube.com/crankgameplaysThis channel, along with every video that has or will ever be uploaded on this channel, will be deleted after our year has ended. This is inevitable. Inescapable. Irreversible.Do not archive or re-upload anything. This is our last wish. Our parting gift. Stay true to the purpose of our final year or we shall lay down wrath upon those that attempt to escape the end.Memento Mori.Unus Annus."
"5-QejUTDCWw","The World's Most Useful Airport [Documentary]","2019-12-31T16:59:39.000Z","UC9RM-iSvTu1uPJb8X5yp3EQ","Wendover Productions","27","20.03.01","airport|aviation|airplanes|st helena|saint helena|jamestown|isolated|overseas territory|island|remote|ocean|world's most useful airport|world's most useless airport|wendover|productions|documentary|full length|nebula original","1148314","37174","886","2533","https://i.ytimg.com/vi/5-QejUTDCWw/default.jpg","False","False","For more great original content just like this, sign up for the Curiosity Stream + Nebula bundle deal at http://curiositystream.com/wendover"
"Bql5eLW_2bs","Slofie to the beat with iPhone 11 — Apple","2019-12-30T02:49:02.000Z","UCqrq_YZP7-_bZ9yIYIOAa4g","Apple Australia","28","20.03.01","apple|iphone|apple iphone|new iphone|iphone 2019|iphone 11|iphone 11 pro|iphone 11 pro max|iphone selfie|iphone selfies|iphone video|iphone videos|iphone camera|iphone selfie camera|photo|photos|video|videos|camera|slo mo|slow mo|slow motion|slo motion|slomo|slo mo songs|slo mo music|slo mo guy|slo mo girl|slo mo dancing|selfie|selfies|self|selfie camera|selfie angles|selfie videos|selfie app|fresh wild fly and bold|cold crush brothers","329309","525","292","0","https://i.ytimg.com/vi/Bql5eLW_2bs/default.jpg","True","False","Now even your funniest faces can look amazing with slo-mo on iPhone 11’s front facing camera. Also available on iPhone 11 Pro and Pro Max.Explore More at https://apple.co/39iizIzSong: ““Fresh Wild Fly and Bold” by Cold Crush Brothershttps://apple.co/2tRRsnn"
"9nsKvax_EJ8","Liv Morgan returns to drop a bombshell during Lana’s wedding to Lashley: Raw, Dec. 30, 2019","2019-12-31T05:09:52.000Z","UCJ5v_MCY6GNUBTO8-D3XoAg","WWE","17","20.03.01","wwe|world wrestling entertainment|wrestling|wrestler|wrestle|superstars|कुश्ती|पहलवान|डब्लू डब्लू ई|मैच|सुपरस्टार|व्यावसायिक कुश्ती|مصارعه|wwe 2019|Raw|Lana|Bobby Lashley|Rusev|Liv Morgan|raw highlights|bobby lashley and lana|lana and bobby lashley|raw highlights this week|liv morgan returns|liv morgan new theme|wwe raw|liv morgan return promo|liv morgan and lana|lana and liv morgan|liv morgan lana|liv returns|lana wedding|lashley wedding","4111746","66245","12675","11551","https://i.ytimg.com/vi/9nsKvax_EJ8/default.jpg","False","False","Liv Morgan returns to help Rusev make an absolute mess of Lana and Bobby Lashley’s wedding on the final Monday Night Raw of 2019.#RAW #LanaLashleyWeddingGET YOUR 1st MONTH of WWE NETWORK for FREE: http://wwe.yt/wwenetwork---------------------------------------------------------------------Follow WWE on YouTube for more exciting action!---------------------------------------------------------------------Subscribe to WWE on YouTube: http://wwe.yt/Check out WWE.com for news and updates: http://goo.gl/akf0J4Find the latest Superstar gear at WWEShop: http://shop.wwe.com---------------------------------------------Check out our other channels!---------------------------------------------The Bella Twins: https://www.youtube.com/thebellatwinsUpUpDownDown: https://www.youtube.com/upupdowndownWWEMusic: https://www.youtube.com/wwemusicTotal Divas: https://www.youtube.com/wwetotaldivas------------------------------------WWE on Social Media------------------------------------Twitter: https://twitter.com/wweFacebook: https://www.facebook.com/wweInstagram: https://www.instagram.com/wwe/Reddit: https://www.reddit.com/user/RealWWEGiphy: https://giphy.com/wwe------------------------------------WWE Podcasts------------------------------------After the Bell with Corey Graves: http://bit.ly/afterthebellpodcastThe New Day: Feel the Power: https://link.chtbl.com/7Fp6uOqk"
"R5gEQdwOYq4","I Got Stuck On A Roof","2019-12-31T17:15:36.000Z","UCu6v4AdYxVH5fhfq9mi5llA","Let Me Explain Studios","1","20.03.01","stuck|roof|animated|animation|cartoon|rebecca parham|let me explain studios|animator|storytime|middle school|school","1961158","105602","1159","10070","https://i.ytimg.com/vi/R5gEQdwOYq4/default.jpg","False","False","So this one time in middle school, I got stuck on a roof. How did I become the kid that did stupid, dangerous things? SECOND CHANNEL: https://www.youtube.com/channel/UC5J0GUulumPO6Rg0o9eva9QMerch Store: http://bit.ly/2RwMjZBMegan Maher: https://meganamaher.com/E Griswold: https://elisegriswold.tumblr.com/NineDoodles: https://twitter.com/NineDoodles?s=09 REBECCA'S SOCIAL STUFF: TWITTER: https://twitter.com/_RebeccaParham INSTAGRAM: @RebeccaParham LME SOCIAL STUFF: Twitter: https://twitter.com/LME_Studios Instagram: @LetMeExplainStudios Facebook: https://www.facebook.com/LetMeExplain...#animated #cartoon #storytime #roof #stuck #RebeccaParham #LetMeExplainStudios #friend #sleepover #pokemon #smash #stupid #funny #animator #animation #story"
"2ks1U-8bojU","London 2020 fireworks streaming live 🔴 - BBC","2020-01-01T00:21:53.000Z","UCCj956IF62FbT7Gouszaj9w","BBC","19","20.03.01","BBC|fireworks|NYE|new year|countdown|fireworks live|live stream|london|big ben|NYE 2019|fireworks 2019|2019|NYE 2019 fireworks|NEW YEAR'S EVE|new year's fireworks 2019|London Fireworks 2019|London NYE Fireworks 2019|2019 London Fireworks|London New Year's Day Fireworks|Fireworks london 2019|Fireworks london eye|fireworks big ben|London Fireworks new year's eve|BBC New Year's Eve Fireworks|UK Fireworks 2019|london fireworks|NYE fireworks|london eye","2030215","26223","1295","3202","https://i.ytimg.com/vi/2ks1U-8bojU/default.jpg","False","False","Subscribe and 🔔 to OFFICIAL BBC YouTube 👉 https://bit.ly/2IXqEInStream original BBC programmes FIRST on BBC iPlayer 👉 https://bbc.in/2J18jYJAs Big Ben strikes midnight we bring in the New Year live from Embankment with London's famous fireworks, one of the most spectacular firework displays to be seen anywhere in the world.New Year's Eve Fireworks | 2019 / 2020 | BBC#BBC #FireworksLondon #BBCiPlayer #NewYearsEve #HappyNewYear2020 #2020All our TV channels and S4C are available to watch live through BBC iPlayer, although some programmes may not be available to stream online due to rights. If you would like to read more on what types of programmes are available to watch live, check the 'Are all programmes that are broadcast available on BBC iPlayer?' FAQ 👉 https://bbc.in/2m8ks6v."
"6Slhkyo9-E4","Arsenal 2-0 Man United | Pepe Is Just Going To Get Better & Better! (DT)","2020-01-01T22:48:36.000Z","UCBTy8j2cPy6zw68godcE7MQ","AFTV","17","20.03.01","a.f.c.|afc|aftv|arsenal|arsenal fan tv|arsenal tv|aubameyang|fans|football|goal|gooners|highlights|ozil|premier league|robbie lyle|troopz|dt|aftvmedia|nicolas pepe|pépé|tierney|david luiz|xhaka|martinelli|mesut ozil|freddie ljungberg|ljungberg|leno|torreira|arteta|mikel arteta|manchester united|man united|united stand|martial|pogba|sokratis","605069","17378","733","2192","https://i.ytimg.com/vi/6Slhkyo9-E4/default.jpg","False","False","Arsenal 2-0 Man United | Pepe Is Just Going To Get Better & Better! (DT)SUBSCRIBE NOW : https://goo.gl/Zq9NcAAFTV SHOP:  http://goo.gl/rin8oWINSTAGRAM:  https://goo.gl/FfTBNLTWITTER:     https://goo.gl/pSKBuCFACEBOOK:   https://goo.gl/w4YbW7SNAPCHAT: https://goo.gl/mQRasiVKONTAKTE: https://goo.gl/p5Y3feTWITCH: https://goo.gl/Gx9g2nDISCORD: https://discord.gg/KCwCQqWWEBSITE:     https://goo.gl/GsjncrAFTV winner of The Best Overall Football Content Creators at The 2018/19 Football Blogging AwardsAFTV is the Unofficial Voice of Arsenal Fans around the world. AFTV is a platform where fans can voice their independent opinions on the greatest football club in the world.#AFTV  #Arsenal #ManUnited"
"IcJhmhA8tHE","Answering Very Personal Questions","2019-12-28T18:37:08.000Z","UC-lHJZR3Gqxm24_Vd_AJ5Yw","PewDiePie","24","20.03.01","SATIRE","6006923","514131","4314","36830","https://i.ytimg.com/vi/IcJhmhA8tHE/default.jpg","False","False","qna questions epicly answered100 CLUB MERCH OUT NOW! https://represent.com/store/pewdiepie (Thank you)Pewdiepie's Pixelings DOWNLOAD:iOS: https://buff.ly/2pNG0aTAndroid: https://buff.ly/34C68nZ#pewdiepie #pixelingsMinecraft Playlist:https://www.youtube.com/watch?v=mhgS6...My Stores:TSUKI:https://tsuki.market/Merch:https://represent.com/store/pewdiepieI drink GFUEL (affiliate link):https://gfuel.ly/31KargrMy Setup (affiliate links):Chair: https://clutchchairz.com/pewdiepie/Official Razer hardware:Razer Nari Ultimate headset: http://rzr.to/pdp-razer-nari Razer Customs phone cases: http://rzr.to/pdp-razer-caseNordVPN DOWNLOAD (affiliate link):Go to https://NordVPN.com/pewdiepie or use code PEWDIEPIE for a special holiday deal. Get a 3-year plan with 81% off plus two amazing gifts: 4 extra months + NordPass password manager app (worth $194.61)I stream on DLive (ad):https://go.dlive.tv/pewdiepie"
