video_id,title,publishedAt,channelId,channelTitle,categoryId,trending_date,tags,view_count,likes,dislikes,comment_count,thumbnail_link,comments_disabled,ratings_disabled,description
"5w0PDaEz91w","Evie Wants To Destroy The WORLD","2019-12-28T16:01:00.000Z","UCYzPXprvl5Y-Sf0g4vX-m6g","jacksepticeye","20","20.03.01","jacksepticeye|evie|cleverbot|cleverbot evie|cleverbot evie jacksepticeye|evie jacksepticeye|funny|funny moments|existor|best bits|AI|simulation|AI chat|montage|chat game|asking questions|funny answers|reaction|bot|commentary|speech recognition|test to speech|speech to text|funny text to speech|funny reaction|best reactions","1584357","107517","729","12959","https://i.ytimg.com/vi/5w0PDaEz91w/default.jpg","False","False","It's been years since Cleverbot Evie and I talked. It seems nothing has changed, she's still dumb and can't form coherent sentences but this time she wants to destroy the world! NOSTALGIA WEEK!SUB TO BE EPIC - https://www.youtube.com/user/jacksepticeye?sub_confirmation=1Become a Sponsor: https://youtube.com/jacksepticeye/join►Twitter : https://twitter.com/Jack_Septic_Eye►Instagram: http://instagram.com/jacksepticeyeOutro animation created by Pixlpit:https://www.youtube.com/user/pixlpitOutro Song created by Teknoaxe. It's called I'm everywhere and you can listen to it herehttp://www.youtube.com/watch?v=JPtNBwMIQ9Q"
"O9brRLQu5Hs","Dana White looks ahead to 2020: Khabib vs. Ferguson, McGregor, Floyd Mayweather | ESPN MMA","2019-12-27T20:24:04.000Z","UCO4AcsPKEkIqDmbeiZLfd1A","ESPN MMA","17","20.03.01","dana white|dana white ufc|ufc dana white|dana white interview|dana white espn|espn dana white|dana white conor mcgregor|dana white khabib|khabib|conor|tony khabib|nurmagomedov|nick diaz|khabib vs ferguson|mcgregor|jorge masvidal|floyd mayweather|conor vs cowboy|floyd dana white|dana white mcgregor|mcgregor cowboy|dana white mayweather|mayweather|dana white boxing|espn ufc|espn mma|mma espn|ufc espn|ufc|mma|fight|ufc interview|masvidal","405140","6260","414","1764","https://i.ytimg.com/vi/O9brRLQu5Hs/default.jpg","False","False","UFC president Dana White sits down with ESPN MMA’s Brett Okamoto to recap 2019 and look ahead to 2020, including topics: (4:40) Getting into boxing, (6:14) booking Khabib Nurmagomedov vs. Tony Ferguson for the fifth time, (7:08) Conor McGregor making his return to the Octagon vs. Donald Cerrone, (11:34) Nick Diaz, (14:15) Israel Adesanya's next fight, (14:34) Jon Jones' future, (16:01) Zhang Weili and (16:45) meeting with Floyd Mayweather.#ESPNMMA #UFC✔ For more UFC, sign up for ESPN+ https://plus.espn.com/ufc✔ Get the ESPN App: http://www.espn.com/espn/apps/espn✔ Subscribe to ESPN on YouTube: http://es.pn/SUBSCRIBEtoYOUTUBE✔ Subscribe to ESPN FC on YouTube: http://bit.ly/SUBSCRIBEtoESPNFC✔ Subscribe to NBA on ESPN on YouTube: http://bit.ly/SUBSCRIBEtoNBAonESPN✔ Watch ESPN on YouTube TV: http://es.pn/YouTubeTVESPN on Social Media:► Follow on Twitter: http://www.twitter.com/espn► Like on Facebook: http://www.facebook.com/espn► Follow on Instagram: http://www.instagram.com/espnVisit ESPN on YouTube to get up-to-the-minute sports news coverage, scores, highlights and commentary for NFL, NHL, MLB, NBA, College Football, NCAA Basketball, soccer and more. More on ESPN.com: http://www.espn.com"
"ejax00QIUgw","Aussies wrap up MCG Test, series over NZ | Second Domain Test v New Zealand","2019-12-29T07:31:31.000Z","UCkBY0aHJP9BwjZLDYxAQrKg","cricket.com.au","17","20.03.01","cricket|australia|new zealand|highlight|tom blundell|nathan lyon|james pattinson|test|sp:ty=high|sp:dt=2019-12-25T23:30:00Z|sp:st=cricket|sp:li=icc|sp:ti:home=AUS|sp:ti:away=NZ","2949452","36641","1813","1556","https://i.ytimg.com/vi/ejax00QIUgw/default.jpg","False","False","Nathan Lyon bowled Australia to victory on Sunday's fourth day of the second Test at the MCG despite a fighting century from Black Caps opener Tom Blundell."
"qDEM1OTq4i4","Do all the Sidemen think the same?","2019-12-28T15:00:19.000Z","UCh5mLn90vUaB1PbRRx_AiaA","MoreSidemen","22","20.03.01","[none]","3459472","159252","2089","9933","https://i.ytimg.com/vi/qDEM1OTq4i4/default.jpg","False","False","#SidemenSaturdayInspiration from: https://www.youtube.com/user/jubileeProject• Sidemen: http://www.youtube.com/Sidemen• Sidemen Clothing: http://www.sidemenclothing.comHave an idea for a compilation/montage or Sidemen Saturday, let us know below!------------------------------------------------------------------------------------------------------------Sidemen:• Miniminter: http://www.youtube.com/Miniminter• Zerkaa: http://www.youtube.com/Zerkaa• Behzinga: http://www.youtube.com/Behzinga• Vikkstar123: http://www.youtube.com/Vikkstar123• TBJZL: http://www.youtube.com/TBJZL• Wroetoshaw: http://www.youtube.com/Wroetoshaw• KSI: http://www.youtube.com/KSIedited by https://twitter.com/TegsRF"
"jfEan8A5Npw","A Tour Of The Dumbest Car Collection Of Any YouTuber: Making More Bad Decisions","2019-12-30T16:43:33.000Z","UCdEczn3MVkx_4PnMZ10MVFA","Hoovies Garage","2","20.03.01","hoovies|garage|tyler|hoover|review|test|drive|problems|hooptie|fleet|update","398882","15615","460","2018","https://i.ytimg.com/vi/jfEan8A5Npw/default.jpg","False","False","Check out my new merch with Inshane Designs! https://inshanedesigns.com/product-category/hoovies-collection/Read my column on Autotrader here: https://www.autotrader.com/oversteerFollow me on Twitter! https://twitter.comFollow me on Facebook! https://www.facebook.com/hooviesgarage/"
"V9HVkVmEGEU","Game Theory: 2019 Game of the Year? More like Best Games of the DECADE!","2019-12-29T19:05:05.000Z","UCo_IB5145EVNcf8hw1Kku7w","The Game Theorists","20","20.03.01","fortnite|pokemon|pokemon go|amnesia|amnesia the dark descent|mario|nintendo|mario maker|mario maker 2|pokemon sword and shield|super mario|super mario maker|super mario maker 2|dark souls|star wars|star wars battlefront|star wars battlefront 2|minecraft|league of legends|new year|new decade|2010s|game of the year|game of the decade|top games|top game|game theorists|game theory|matpat|fnaf","1291448","86908","6353","25930","https://i.ytimg.com/vi/V9HVkVmEGEU/default.jpg","False","False","SUBSCRIBE for Every Theory! ►► http://bit.ly/1qV8fd6The end of 2019 not only marks a time to look back on the top games of this year, but the top games that defined the entire decade of the 2010s. So to celebrate the end of the decade, I am counting down the games that defined not only gaming as a whole, but gaming on YouTube and the communities around it. From Pokemon and Mario to Star Wars and Fortnite, these games really made a mark on our culture and shaped the face of gaming going into 2020. Will your top games make the cut? Watch to find out!SUBSCRIBE for Every Theory! ►► http://bit.ly/1qV8fd6  Hang out with us on GTLive! ► http://bit.ly/1LkSBnzNeed Royalty Free Music for your Content? Try Epidemic Sound.Get A 30 Day Free Trial! ► http://share.epidemicsound.com/MatPat#Top10 #BestGames #TopGames #Gaming #Pokemon #Fortnite #DarkSouls #MarioMaker #AmnesiaTheDarkDescent #StarWars #FNAF #GameTheory More THEORIES:What is MatPat Hiding? ►► https://bit.ly/2ZjmhvyThe END of Princess Peach! ► https://bit.ly/2CJuYbmMinecraft's Ending, DECODED! ►► http://bit.ly/2d5o2KyMario Kart 8, Mario's SCARIEST Game? ► https://bit.ly/2wyeellWhat's Diamond Armor Worth IRL? ►► http://bit.ly/1Q5xhmMCredits:Writers: Matthew PatrickEditors: Tyler Mascola, Marc Schneider, Koen Verhagen, and Danial BanditRants KeristoufiAssistant Editor: AlyssaBeCrazySound Editor: Yosi BermanSources:https://www.tweaktown.com/news/59856/star-wars-battlefront-ii-costs-2100-unlock-everything/index.htmlhttps://dotesports.com/culture/news/twitch-growth-esports-streaming-mlg-youtube-2013-90"
"D3jxx8Yyw1c","Why 2020 Started On December 30th","2019-12-30T16:00:02.000Z","UCBa659QWEk1AI4Tg--mrJ2A","Tom Scott","27","20.03.01","tom scott|tomscott|iso weeks|dates|computer minutaie|date format|twitter|bug","1393694","71279","1504","3935","https://i.ytimg.com/vi/D3jxx8Yyw1c/default.jpg","False","False","Weird calendar edge-cases and computer bugs. It's an old-school video. • Video sponsor Fasthosts are giving UK viewers the chance to win a trip to SXSW 2020 by answering my Techie Test question: https://fasthosts.co.uk/tomscottFURTHER READING:The ISO 8601 Standards for date and time: https://www.iso.org/iso-8601-date-and-time-format.htmlThe tweet referenced in the video: https://twitter.com/_ninji/status/549365454322802688The Guardian article mentioned: https://www.theguardian.com/technology/2014/dec/29/twitter-2015-date-bugI'm at https://tomscott.comon Twitter at https://twitter.com/tomscotton Facebook at https://facebook.com/tomscottand on Instagram as tomscottgo"
"0hVZOJCYBBM","Important Youtube Announcement (please watch)","2019-12-28T21:00:06.000Z","UCX6OQ3DkcsbYNE6H8uQQuVA","MrBeast","24","20.03.01","[none]","17348644","1752600","13220","95658","https://i.ytimg.com/vi/0hVZOJCYBBM/default.jpg","False","False","I CAN'T BELIEVE WE REACHED OUR GOAL!!!!! YOU GUYS ARE AMAZING!New Merch - https://shopmrbeast.com/SUBSCRIBE OR I TAKE YOUR DOG----------------------------------------------------------------follow all of these or i will kick you• Twitter - https://twitter.com/MrBeastYT•  Instagram - https://www.instagram.com/mrbeast--------------------------------------------------------------------"
"Bru8AddADvo","49ers vs. Seahawks Week 17 Highlights | NFL 2019","2019-12-30T04:45:42.000Z","UCDVYQ4Zhbm3S2dlz7P1GBDg","NFL","17","20.03.01","sp:ty=high|sp:dt=2019-12-30T01:20:00Z|sp:st=football|sp:li=nfl|sp:ti:home=Sea|sp:ti:away=SF|NFL|Football|offense|defense|American Football|highlight|highlights|game|sport|play|plays|season|2019|touchdown|td|game highlights|week 17|best plays|top plays|49ers|san francisco|sf|seahawks|seattle|sea|49ers seahawks game highlights|49ers highlights|seahawks highlights","3142968","30887","1811","8204","https://i.ytimg.com/vi/Bru8AddADvo/default.jpg","False","False","The San Francisco 49ers take on the Seattle Seahawks during Week 17 of the 2019 NFL season.Subscribe to NFL: http://j.mp/1L0bVBuCheck out our other channels:NFL Vault http://www.youtube.com/nflvaultNFL Network http://www.youtube.com/nflnetworkNFL Films http://www.youtube.com/nflfilmsNFL Rush http://www.youtube.com/nflrushNFL Play Football https://www.youtube.com/playfootballNFL Podcasts https://www.youtube.com/nflpodcasts#NFL #49ers #Seahawks"
"SzfmtGESBxw","Dunkey's Best of 2019","2019-12-27T20:30:01.000Z","UCsvn_Po0SmunchJYOWpOxMg","videogamedunkey","20","20.03.01","dunkeys best of 2019|best of 2019|top games 2019|best games 2019|dunkey best of 2019|dunkey top 10|dunkey best of|top 10 games 2019|dunkey|videogamedunkey","3534888","205357","3141","9711","https://i.ytimg.com/vi/SzfmtGESBxw/default.jpg","False","False","Sorry no Super Mario Bros 2 this year. I'm over that game.dunk store https://dunkeyscastle.com/My donkey list--------------------------7. Devil May Cry 5 3:506. Slay the Spire 4:225. Resident Evil 2 4:584. Super Mario Maker 2 6:253. Earthbound 7:172. Ikaruga 8:111. Sekiro : Shadows Die Twice 8:22featured channels-----------trophygamers https://www.youtube.com/channel/UCHIHF6TXK82_36w3pxZ7jwQgameranx https://www.youtube.com/user/gameranxTVtorioda https://www.youtube.com/channel/UCVZ-VD3vfJZKOESUz3q6fywrobby santiago https://www.youtube.com/channel/UCwKIK6PY1ksz_CQIbBs04gQmark after dark https://www.youtube.com/user/ScarPredsupragzaerotop https://www.youtube.com/channel/UC9B84JTY25FNspDMm5Wr9rgsnowcone guy https://www.youtube.com/channel/UC_2O8UiIv-pYOeUQ8P8nLPAshirrako https://www.youtube.com/channel/UC7eAfUjR9gdIjoaoQaS0W-A"
"AMIzIDbclZQ","NBA's Top 60 Clutch Plays Of The Decade","2019-12-28T17:00:00.000Z","UCWJ2lWNubArHWmf3FIHbfcQ","NBA","17","20.03.01","nba|highlights|basketball|plays|amazing|sports|hoops|games|game|clutch|top 60|clutch plays|game winner|buzzer beater|block|game tying|clutch shot|ray allen|lebron james|chasedown|kawhi leonard|stephen curry|damian lillard|dwyane wade|derrick rose|manu ginobili|james harden|dirk nowitzki|kevin durant|jeremy lamb|kobe bryant|russell westbrook|joe johnson|giannis antetokounmpo|vince carter|jeremy lin|carmelo anthony|chris paul|sundiata gaines","1351280","20974","594","2706","https://i.ytimg.com/vi/AMIzIDbclZQ/default.jpg","False","False","Check out the top 60 clutch plays of the decade!Subscribe to the NBA: https://on.nba.com/2JX5gSNFull Game Highlights Playlist: https://on.nba.com/2rjGMgeFor news, stories, highlights and more, go to our official website at https://nba_webonly.app.link/nbasiteGet NBA LEAGUE PASS: https://nba.app.link/nbaleaguepass5"
"v7MYOpFONCU","First Person View PC BUILD Guide! (POV)","2019-12-30T20:00:02.000Z","UCXuqSBlHAE6Xw-yeJA0Tunw","Linus Tech Tips","28","20.03.01","fpv|gopro|build guide|build|intel|gaming|pc|overclock|motherboard|how-to|diy|camera|buildguide|assembly|RAM|SSD|Harddrive|Graphics|Steam|Benchmark|RGB","880314","43404","1094","5136","https://i.ytimg.com/vi/v7MYOpFONCU/default.jpg","False","False","Thanks Intel for sponsoring this video! Learn more about how to build your own gaming PC at https://lmg.gg/edWobLinus is taking the reins away from our film team and giving you his own view of building a gaming PC. This is a first person build guide featuring Intel's 9700K CPU will take you step by step through the entire build from scratch.Buy Intel 9700KOn Amazon (PAID LINK): https://geni.us/QY2azOn Newegg: https://lmg.gg/xfAfkBuy Corsair 460X RGBOn Amazon (PAID LINK): https://geni.us/BHOSPdOn Newegg: https://lmg.gg/xiLlaBuy Asus Prime Z390-POn Amazon (PAID LINK): https://geni.us/wbtNOOn Newegg: https://lmg.gg/289VfBuy G.Skill Trident Z RGB RAMOn Amazon (PAID LINK): https://geni.us/fHz77ZOn Newegg: https://lmg.gg/tBv1vBuy Intel 760P SSDOn Amazon (PAID LINK): https://geni.us/zCezzBYOn Newegg: https://lmg.gg/V1WJzBuy Nvidia RTX2080On Amazon (PAID LINK): https://geni.us/NJ31UOn Newegg: https://lmg.gg/44XyrBuy Seagate Barracuda 10TB HDDOn Amazon (PAID LINK): https://geni.us/t3wXo0On Newegg: https://lmg.gg/HtnHRBuy Corsair RM750X PSUOn Amazon (PAID LINK): https://geni.us/w8QSwDHOn Newegg: https://lmg.gg/tXKqbBuy Noctua Chromax Black NH-U12SOn Amazon (PAID LINK): https://geni.us/A30J2On Newegg: https://lmg.gg/bnVcKPurchases made through some store links may provide some compensation to Linus Media Group.Discuss on the forum: https://linustechtips.com/main/topic/1140103-9700k-fpv-build-sponsored-by-intel/Our Affiliates, Referral Programs, and Sponsors: https://lmg.gg/sponsorsGet a Displate Metal Print at https://lmg.gg/displatelttGet a 30-day free trial of Amazon Prime at https://lmg.gg/8KV1vLinus Tech Tips merchandise at http://www.LTTStore.com/ Our Test Benches on Amazon: https://www.amazon.com/shop/linustechtips Our production gear: http://geni.us/cvOSTwitter - https://twitter.com/linustechFacebook - http://www.facebook.com/LinusTechInstagram - https://www.instagram.com/linustechTwitch - https://www.twitch.tv/linustech Intro Screen Music Credit:Title: Laszlo - SupernovaVideo Link: https://www.youtube.com/watch?v=PKfxmFU3lWYiTunes Download Link: https://itunes.apple.com/us/album/supernova/id936805712Artist Link: https://soundcloud.com/laszlomusicOutro Screen Music Credit: Approaching Nirvana - Sugar High http://www.youtube.com/approachingnirvana"
"1dt1qZyXwIM","Your friends that are too down for you.","2019-12-30T03:33:59.000Z","UCI1XS_GkLGDOgf8YLaaXNRA","CalebCity","20","20.03.01","[none]","1856280","212692","748","7695","https://i.ytimg.com/vi/1dt1qZyXwIM/default.jpg","False","False","Bro it's okay, he can park there for a little while MusicOddwin - 19"
"_RHQZ-7EXMw","Hairdresser Reacts To People Going From Blonde To Blue","2019-12-29T23:01:38.000Z","UCoc_XJPj6YLMQDWtPDQcDtA","Brad Mondo","24","20.03.01","bradmondo|bradmondonyc|hairdresser|reacts|brad&eric|Hairdresser Reacts To People Going From Blonde To Blue|hairdresser reacts|diy hair|hair fail|hair dresser|hair color compilaiton|hair stylist|at home|how to|brad mondo|jenna marbles|gone wrong|box dye|40 vol|video react|manic panic|funny|hilarious|tutorial|blonde|pink hair|blue hair|hair fails|dye|beauty|blonde hair to blue|coloringing hair blond to blue|dark blue hair|light blue hair|pastel pink","1010512","44317","1264","4002","https://i.ytimg.com/vi/_RHQZ-7EXMw/default.jpg","False","False","Hi Beautiful! Let their be blue hair for all! Blue is one of my favorite hair colors and these girls actually kind of pulled something off in these videos.... SHOP XMONDO HAIRCARE ▷ https://www.xmondohair.com/AH-NAH-EE'S VIDEO ▷https://www.youtube.com/watch?v=AjuPULDkLeITINA HALADA'S VIDEO▷ https://www.youtube.com/watch?v=nVB5397FN6ASHOP MY MERCH ▷ https://goo.gl/VN6tVD SOCIALS: INSTAGRAM ▷ https://www.instagram.com/bradmondonyc/TIKTOK ▷ https://www.tiktok.com/@bradmondonyc?utm_source=tt_10TWITTER ▷ https://twitter.com/bradmondonycXMONDO INSTA ▷ https://www.instagram.com/xmondohair/VIDEO EDITING BY ▷ Kris Edrosa DON'T FORGET TO LIVE YOUR EXTRA LIFE!"
"yU8pAYZ1k0c","Are Youtubers SMARTER Than A 13 YEAR OLD?","2019-12-28T18:37:17.000Z","UC9-3c4LzdzT_HvW3Xuti9wg","Calfreezy","24","20.03.01","Soccer|Football|Calfreezy|Rebel|Rebel FC|London|England|How to|Footy|Tekkers|YouTuber|Challenge|Soccer Skills|Football Skill|Trick Shots|Soccer Fails|Football Fails|Tricks|Freestyle Football|funny|comedy|friends|vlog|vlogging|freezy","893430","37778","531","1407","https://i.ytimg.com/vi/yU8pAYZ1k0c/default.jpg","False","False","🔔: Subscribe & click that notification bell so you don't miss anything!🔔: Subscribe to Theo: http://www.youtube.com/TheoBaker🔔: Subscribe to W2S: http://www.youtube.com/W2S🔔: Subscribe to Callux: http://www.youtube.com/Calfreezy📱: Follow me on my socials so you don't miss anything!:       ► Instagram - http://www.instagram.com/realCalfreezy       ► Twitter - http://twitter.com/Calfreezy       ► Twitch - http://www.twitch.tv/Calfreezy       ► Tik Tok - @Calfreezy💻: Join my Discord!        ► https://discord.gg/sHmpz7D"
"kcuiI3cvEVI","Best Of Season 13 | Most Shocking + Funniest Moments ft. Our Best Guests & More 🙌 Wild 'N Out","2019-12-27T21:00:07.000Z","UCrkzfc2yf-7q6pd7EtzgNaQ","Wild 'N Out","24","20.03.01","best of season 13|compilation|supercut|WNO|Wild|Out|Nick|Cannon|Justina|Valentine|Delaghetto|Nick Cannon|Justina Valentine|DC Young Fly|Timothy DeLaGhetto|Conceited|Chico Bean|Corey Charron|Darren Brand|Charlie Clips|Hitman Holla|pick up and kill it|let me holla|bullspittin|talking spit|wild style|live performance|improv|battle|championship","3309684","63884","1903","1968","https://i.ytimg.com/vi/kcuiI3cvEVI/default.jpg","False","False","Recapping some of the most hilarious moments, best guest, & MORE from Wild ‘N Out season 13 🙌#WildNOut #MTVSubscribe to stay updated on the newest content! http://goo.gl/YuLQAoMore from Wild 'N Out!Official Wild 'N Out Website: http://www.mtv.com/shows/nick-cannon-presents-wild-n-outWild 'N Out Twitter: https://twitter.com/wildnoutWild 'N Out Instagram: https://www.instagram.com/mtvwildnout/Wild 'N Out Facebook: https://www.facebook.com/nickcannonwildnout/Nick Cannon Presents: Wild 'N Out delivers lightning-fast improv and head-to-head battles, helmed by the master of ceremonies, Nick Cannon. The stakes are high as teams face off in a series of visceral, hip-hop-edged comedy showdowns, all culminating in a rap battle for the championship belt."
"FOJ7JAUK6EU","Spinning Ink out of Pens in Slow Motion - The Slow Mo Guys","2019-12-28T16:46:07.000Z","UCUK0HBIBWgM2c4vsPhkYY4w","The Slow Mo Guys","24","20.03.01","slomo|slow|mo|super|motion|Slow Motion|1000|1000fps|gav|dan|slowmoguys|phantom|guys|HD|flex|gavin|free|gavin free|high speed camera|the slow mo guys|2000|2000fps|5000|5000fps|pens|drill|spin|painting|ink|centripetal|centrifugal|markers|marker","2995281","95130","1284","4964","https://i.ytimg.com/vi/FOJ7JAUK6EU/default.jpg","False","False","Using the scientific force known as the spinnies, Gav and Dan make some splatter paintings using a drill. Gav asked Dan to get some cheap, knock-off felt pens, but he went full Crayola. This video is not sponsored by Crayola. Follow us on Instagram! https://www.instagram.com/gavinfree/https://www.instagram.com/danielgruchy/Filmed at 1000fps and 28,500fps on the Phantom Flex 4k and the Phantom V2511Spinning Ink out of Pens in Slow Motion - The Slow Mo Guys"
"l-FSvLrksWo","Donating $100,000 For Christmas","2019-12-27T02:05:19.000Z","UCw1SQ6QRRtfAhrN_cjkrOgA","LazarBeam","24","20.03.01","lazarbeam|christmas","4682625","346714","2169","42945","https://i.ytimg.com/vi/l-FSvLrksWo/default.jpg","False","False","Download Archero for free here: https://pixly.go2cloud.org/SH1UHThanks to Archero for sponsoring this video!Streamers:Lupo - https://twitch.tv/drlupoAaron - https://twitch.tv/aaronautixliveReward - https://twitch.tv/rewarddadrawerAurora - https://twitch.tv/Aurora_PeachyAderissa - https://twitch.tv/LadyAderissaRachael - https://twitch.tv/rachaeltadJakob - https://twitch.tv/spaxra"
"0jX_WmO7fCs","VFX Artists React to LORD OF THE RINGS Bad and Great CGi 1","2019-12-28T17:00:00.000Z","UCSpFnDQr88xCZ80N-X7t0nQ","Corridor Crew","24","20.03.01","vfx artists react|vfx|cgi|hollywood|shot breakdown|visual effects|movies|lord of the rings|peter jackson|gollum|any circus|weta|weta workshop|digital","1535622","73680","824","5974","https://i.ytimg.com/vi/0jX_WmO7fCs/default.jpg","False","False","Top 10 Games You Can Play in Your Head, by Yourself ► http://bit.ly/top10gamesaudiobookWatch Shadow of Mordor Live Action Short ► https://youtu.be/5xK7e0-_3oQCONSIDER SUBSCRIBING ► http://bit.ly/Subscribe_Corridor_CrewWatch This Show From The Beginning ► http://bit.ly/Watch_Season1This Episode ►Niko, Clint, and Wren sit down to react to some of the zestiest CGi moments from Peter Jackson's The Lord of The Rings Trilogy: What makes a visual effect bad? What makes one great? THE GEAR WE USE ►Most Used Equipment: http://bit.ly/CorridorCrew_GearPerfect Camera: https://bhpho.to/2FJpQmRPuget Systems Computers: http://bit.ly/PC_Puget_WorkstationsSUPPORT US ► Translate & Subtitle: http://bit.ly/Make_SUBTITLESPatreon Donation: http://bit.ly/_Corridor_Patreon_SupportBuy Merch: http://bit.ly/Corridor_StoreFOLLOW US ►Instagram: http://bit.ly/_Corridor_InstagramSub-Reddit: http://bit.ly/_Corridor_Sub-RedditSubscribe to our Gaming Channel, NODE: http://bit.ly/Subscribe_to_NODEEPISODE MUSIC ►Epidemic Music ► http://bit.ly/Corridor_Music click this link for a free month!"
"vkhvUBPGDVE","The Best 5 Games of 2019","2019-12-30T01:20:04.000Z","UCq6VFHwMzcMXbuKyG7SQYIg","penguinz0","24","20.03.01","[none]","702644","36213","811","2761","https://i.ytimg.com/vi/vkhvUBPGDVE/default.jpg","False","False","Welcome to this years Moisties, where we reveal the best and worst movies and video games to hit the screens for the year. Remember, these are SCIENTIFICALLY ACCURATE so any other opinions are factually wrong. We don't make the rules. The Moist Meter does. The Moist Meter is an experimental measurement system that you can use to safely gauge just how moist a video game or movie is going to be before playing it or viewing it. Avoid the dry products and only use the wettest. Moist Meter Scientists: Jackson: https://twitter.com/zealotonpcCharlie: https://twitter.com/moistcr1tikalContact: admin@theofficialfour.comIntro Voice: https://goo.gl/y5YRWY"
"IlDifYSz298","Top 20 Student Moments of 2019","2019-12-29T13:00:02.000Z","UCGwcH4qnJ2qM_ZJUSFcAMAA","JianHao Tan","23","20.03.01","jianhao tan|jian hao tan|jianhao|the jianhao tan|thejianhaotan|jian hao|jianhaotan|kim lee|singapore|singaporean|youtuber|youtubers|youtube|class|t1t5|movie|exams|before|after|recess|relationship|denise gets kicked out|school|madam|soot beng|miss sherly|jianhao and denise|debbie|ben|mr lakosh|debbie removes her glasses|kevin and ren yi xiang|bullies|noc|avengers|kiss|car|i8|nicole|moment|favorite moment|best|scenes|of","1296255","53221","798","7803","https://i.ytimg.com/vi/IlDifYSz298/default.jpg","False","False","Here are the craziest, funnest and most dramatic moments of your favourite students this year!Get your merch at http://www.teamtitanstore.comBehind the scenes: https://www.youtube.com/watch?v=LtKnQ_u1m1E&t=39sWatch our latest episode here: https://www.youtube.com/watch?v=GdxciZzxJQQ&t=513sEMAIL: For business enquiries, contact ​business@thejianhaotan.com directlyFOLLOW ME ON INSTAGRAM:http://www.instagram.com/thejianhaotanTITAN DIGITAL MEDIA: http://www.instagram.com/titandigitalmedia"
"H1l9H_cAFf4","Highlights | Birmingham City 4-5 Leeds United | 2019/20 EFL Championship","2019-12-30T01:00:00.000Z","UCyQcJHDN4uYfPa1DHzKVSnw","Leeds United Official","17","20.03.01","sp:ty=high|sp:dt=2019-12-29T15:00:00Z|sp:st=soccer|sp:li=eng_ch|sp:ti:home=BIR|sp:ti:away=LEE","225957","3495","109","338","https://i.ytimg.com/vi/H1l9H_cAFf4/default.jpg","False","False","Highlights from Leeds United’s 5-4 win against Birmingham City at St Andrew's in the 2019/20 EFL Championship. Presented by Wish - Shopping Made Fun.Watch extended highlights on the Official Leeds United App: http://bit.ly/LUTVappGet exclusive Leeds United video content first - download the Official App: http://bit.ly/LUTVappIf you thought this video was 🔥 don't forget to subscribe and hit the like 👍 button! Also if you want to get a notification every time we post hit the bell 🛎 button in the top right corner. MOT. ALAW. ⚽️If you want to keep up with everything Leeds, go check out our other pages https://www.facebook.com/LeedsUnited/https://twitter.com/LUFChttps://www.instagram.com/leedsunited/?hl=enhttps://www.leedsunited.com"
