video_id,title,publishedAt,channelId,channelTitle,categoryId,trending_date,tags,view_count,likes,dislikes,comment_count,thumbnail_link,comments_disabled,ratings_disabled,description
"BHuK8BdVCV4","Letting a Coin Flip Control Our Lives for 24hrs (DUBAI)","2019-12-15T19:02:56.000Z","UCvK4bOhULCpmLabd2pDMtnA","Yes Theory","24","19.16.12","yestheory|seek discomfort|dubai|yes theory dubai|dubai desert|letting a coin decide our lives|letting chance control our lives|24 hours|yes theory 24 hours|letting instagram followers control our lives|letting strangers control our lives for 24 hours|dubai adventures|best of dubai|best things to do in dubai|falcons in dubai|flying falcons|rolls royce|fancy cars in dubai|crazy events in dubai|dubai locals","771512","49813","621","2676","https://i.ytimg.com/vi/BHuK8BdVCV4/default.jpg","False","False","Thank you to our friends at Google Pixel for sponsoring this video. As you can see in the video, Pixel 4 captures super high-quality photos and videos, making it the ultimate travel companion. Check it out here! https://store.google.com/config/pixel_4?utm_source=youtube&utm_medium=organic_social&utm_campaign=GS103999&utm_content=Yes #sponsored For this episode, we decided to bring back a beloved Yes Theory format... by letting chance control our lives for 24hrs... We decided to do it in Dubai... This is what happened.Thank you to our friend Shady for helping us make this episode happen: https://www.instagram.com/shadybeshr/and thank you to  @TG From Dubai  for helping us shoot this video!If you want to join the Yes Fam Facebook group which is 100,000+ of our most engaged and badass community members, you can apply here: https://www.facebook.com/groups/15653...PERFECT ROYALTY FREE MUSIC FOR YOUTUBE: free 30 day trial here: http://share.epidemicsound.com/wFFbr Musicbed has amazing montage and cinematic music:http://share.mscbd.fm/YesTheoryFor an amazing b-roll and footage library, checkout: http://storyblocks.com/YesTheoryYes Theory Spotify Playlist: https://open.spotify.com/user/t-boogy...Exclusive challenges on Instagram: https://www.instagram.com/yestheory/Who are we? We believe that life can be as fulfilling as you wish, so long as you're willing to seek discomfort. And we make videos about it.Business Inquiries: zack@yestheory.comhttps://www.instagram.com/yestheory/https://twitter.com/yestheoryhttps://www.facebook.com/yestheory/Hosts: Thomas Brag, Ammar Kandil, Matt DajerEditors: Thomas Brag, Thomas Dajer, Cam Peddle, Bryce Perry"
"1V7_KWPxJ1k","Galaxy Note 10 Plus Star Wars Edition Unboxing","2019-12-15T17:00:01.000Z","UCsTcErHg8oDvUnTzoqsYeNw","Unbox Therapy","28","19.16.12","galaxy note 10|galaxy note 10+|note 10|note 10+|note 10 plus|star wars|note 10 star wars|samsung|samsung galaxy note 10|samsung galaxy star wars|star wars edition|edition|2019|special edition|limited edition|note|galaxy note|galaxy note star wars|unboxing|note 10 star wars unboxing|review|note 10 review|note 10 plus unboxing|note 10 plus review|note 10+ unboxing|note 10+ review|lew later|iphone|apple|iphone 11|iphone 11 pro|iphone 11 pro max|vs","914044","43454","1333","2413","https://i.ytimg.com/vi/1V7_KWPxJ1k/default.jpg","False","False","Unboxing the special edition Samsung Galaxy Note 10 Plus Star Wars Edition.FOLLOW ME IN THESE PLACES FOR UPDATESTwitter - http://twitter.com/unboxtherapyFacebook - http://facebook.com/unboxtherapyInstagram - http://instagram.com/unboxtherapy"
"oKtNddxn6FQ","Star Wars: The Rise of Skywalker | Voices TV Spot","2019-12-15T17:00:17.000Z","UCZGYJFUizSax-yElQaFDp5Q","Star Wars","24","19.16.12","Star Wars|Star Wars: The Rise of Skywalker|The Rise of Skywalker|Lucasfilm","469956","19247","944","1452","https://i.ytimg.com/vi/oKtNddxn6FQ/default.jpg","False","False","This will be the final word in the story of Skywalker. See Star Wars: The Rise of Skywalker in theaters in 5 days. Get tickets: fandango.com/TheRiseOfSkywalker"
"d6DvbqomkZU","Ellie Goulding Receives Heartfelt Lyrics In Surprising Send To All! | Michael McIntyre","2019-12-14T22:30:00.000Z","UCUFrBvQ96A-KeU6NgpemQXA","Michael McIntyre","23","19.16.12","Michael McIntyre|Stand Up|Comedy|Roadshow|Funny|Best|Channel|YouTube|English|Live At The Apollo|Hello Wembley|Happy and Glorious|Christmas|Royal Variety|Comedy Roadshow|michael mcintyre stand up|michael|mcintyre|michael mcintyre funny|michael mcintyre jokes|british|michael McIntyre 2019|sent to all|Peter Andre|dani dyer|cheryl|Gino d’acampo|midnight gameshow|pilot|names|kids|dentist|wine|hotel|driving|glasses|accents|children","348451","5679","168","285","https://i.ytimg.com/vi/d6DvbqomkZU/default.jpg","False","False","A night of firsts on Send To All as we receive some touching replies and a contestant that wants more!#MichaelMcIntyre #EllieGoulding #SendToAll Watch the latest episode here - https://www.bbc.co.uk/iplayer/episodes/b08402jb/michael-mcintyres-big-showWebsite: https://www.michaelmcintyre.co.uk/Facebook: https://www.facebook.com/TheMichaelMcIntyre/Twitter: @McInTweet"
"hCSlGx7RVec","Breaking Into An Abandoned 100 Year Old Safe With A Plasma Cutter!!","2019-12-15T01:02:24.000Z","UCau_n8AK1uk3Ys5bEnRAoqg","JustDustin","23","19.16.12","Safe|abandoned safe|money|auction|justdustin|justdustin safe|1000|10000|lastpass|lastpass login|password|password generator|lastpass chrome|lastpass download|lastpasspremium|random password generator|generate password|password manager|recover|lastpas|laspass|lastpass premium features|delete account mobogram|lastpass.com|how secure is my password|last password","714795","20419","4366","2025","https://i.ytimg.com/vi/hCSlGx7RVec/default.jpg","False","False","Watch my last Unbreakable Safe video here: https://www.youtube.com/watch?v=s-D_Lb6OrhM&t=22sA portion of this video was sponsored by LastPass.Click here to start using LastPass: https://lastpass.onelink.me/HzaM/2019Q4DecemberJustDustinWatch more awesome videos this week: https://www.youtube.com/watch?v=wMuYiLby3-shttps://www.youtube.com/watch?v=a_TSR_v07m0SOOUUU WEEEE!!"
"-Khu2dXiPf8","Sisters Christmas Party 2019","2019-12-15T20:00:46.000Z","UCucot-Zp428OwkyRm2I7v2Q","James Charles","24","19.16.12","james|james charles|makeup artist|mua|covergirl|coverboy|cute|easy makeup|how-to|reviews|tutorials|funny videos|beauty tips|hacks|beauty|christmas|sisters christmas party|james charles christmas party|christmas tik tok|christmas party|party|inviting my fans|I invited my fans","843329","69872","1978","5467","https://i.ytimg.com/vi/-Khu2dXiPf8/default.jpg","False","False","HI SISTERS! Last week, I invited 25 of my fans over to my house for the first ever Sisters Christmas Party! It was one of the best days of my life and I was so grateful to get to know some of you beautiful people who support me every day! We made gingerbread houses, ate dinner, played white elephant with CRAZY gifts, and danced!! What fun things do you think we should do next year? Love you all so much!Thank you again to Ludim Design for bringing the party to life» http://instagram.com/ludimdesign🎥 PREVIOUS VIDEO » https://www.youtube.com/watch?v=jwHfMld-2BU👕 SISTER'S APPAREL » http://sisters-apparel.com🛎 Subscribe to my channel to join the sisterhood & hit the notification bell so you never miss an upload! » http://bit.ly/JamesCharles for new videos!__❤️ LET'S BE BFFSINSTAGRAM » http://instagram.com/jamescharlesTWITTER » http://twitter.com/jamescharlesTWITCH » http://twitch.tv/jamescharlesSNAPCHAT » jamescharless__💸 COUPON CODES 💸MORPHE BRUSHES » http://morphebrushes.comUse code JAMES for 10% off all products online AND in store!LILLY LASHES » https://lillylashes.com/Use code JAMES for 15% off all lashesLAURAS BOUTIQUE » http://lauras-boutique.comUse code JAMES for 10% off all itemsSKINDINAVIA » http://skindinavia.comUse code JAMES for 25% off all products __♡ MY AMAZING TEAMVIDEOGRAPHER/PRODUCER: Louis Gargiulahttp://instagram.com/louisgargiulaEDITOR:  Ryan Allen  http://www.youtube.com/user/helloxryanGRAPHICS: Michael Rusakovhttp://instagram.com/michael.ny"
"-pN0zHf_WPc","John McDonnell: 'If anyone’s to blame it’s me, full stop'","2019-12-15T10:51:35.000Z","UCIRYBXDze5krPDzAEOxFGVA","Guardian News","25","19.16.12","john McDonnell|john McDonnell interview|john McDonnell interview marr|andrew marr|general election|general election 2019|labour|general election john mcdonnell|boris johnson|john mcdonnell andrew marr|uk general election|conservatives|john mcdonnell|john mcdonnell video|mcdonnell|jeremy corbyn|brexit|andrew marr john mcdonnell|marr|corbyn|mcdonnell interview|john mcdonnell labour|uk|guardian|politics|news|andrew marr show|bbc|shadow chancellor|blame|2019","80061","470","138","801","https://i.ytimg.com/vi/-pN0zHf_WPc/default.jpg","False","False","Labour's shadow chancellor, John McDonnell, has taken responsibility for his party's election performance in an interview with the BBC's The Andrew Marr Show. McDonnell also blamed Brexit and the media for Labour's loss and said that Corbyn will stand down in ‘8-10 weeks’ Subscribe to Guardian News on YouTube ► http://bit.ly/guardianwiressubMcDonnell says he takes full responsibility for Labour's defeat – politics live ► https://www.theguardian.com/politics/live/2019/dec/15/jeremy-corbyn-sorry-boris-johnson-revolution-politics-liveSupport the Guardian ► https://support.theguardian.com/contributeToday in Focus podcast ► https://www.theguardian.com/news/series/todayinfocusThe Guardian YouTube network:The Guardian ► http://www.youtube.com/theguardianOwen Jones talks ► http://bit.ly/subsowenjonesGuardian Football ► http://is.gd/guardianfootballGuardian Sport ► http://bit.ly/GDNsportGuardian Culture ► http://is.gd/guardianculture"
"NQcwgZbgLj4","The Try Guys Cook Bagels Without A Recipe","2019-12-14T16:00:06.000Z","UCpi8TJfiA4lKGkaXs__YdBA","The Try Guys","23","19.16.12","try guys|keith|ned|zach|eugene|habersberger|fulmer|kornfeld|yang|buzzfeedvideo|buzzfeed|ariel|ned & ariel|comedy|education|funny|try|learn|fail|experiment|test|tryceratops|without a recipe|baking|cooking|challenge|cooking challenge|baking challenge|chef|chef show|amazing cooking|how to cook|bagel|bagels|frying pan|fried food|how to make|breakfast|breakfast food|baking cookies|cookies|cake|boil|bake|cook|kitchen|easy recipes|recipe|diy|food|taste|tasting|taste test","3040778","140418","2439","12230","https://i.ytimg.com/vi/NQcwgZbgLj4/default.jpg","False","False","#WithoutARecipe is all you knead! This week the guys are giving bagels a go, but which #TryGuy will dough it right?🥯🏆 Are you a business looking to work with The Try Guys? Reach out to us at 2ndtrybusiness@gmail.com for all business inquiries! 🎧THE TRYPOD 🎧: watch our new podcast at https://youtube.com/trypod or listen at https://tryguys.com/podcast📘THE HIDDEN POWER OF F*CKING UP 📘: check out our new book at https://tryguys.com/bookGet your official Try Guys color hoodies and phone cases at https://tryguys.com/collections/color-line 💙❤️💚💜Support us! http://www.patreon.com/tryguys. Join our Patreon to get videos a day early, plus, live streams, chatrooms, BTS footage, exclusive merchandise, and more!SUBSCRIBE TO AND FOLLOW THE TRY GUYS http://www.youtube.com/c/tryguyshttp://www.facebook.com/tryguys  http://www.twitter.com/tryguyshttps://www.instagram.com/tryguysFOLLOW THE GUYShttp://www.Instagram.com/keithhabshttp://www.Instagram.com/nedfulmerhttp://www.Instagram.com/korndiddyhttp://www.instagram.com/eugeneleeyang http://www.twitter.com/keithhabshttp://www.twitter.com/nedfulmer http://www.twitter.com/korndiddyhttp://www.twitter.com/eugeneleeyang THE TRY GUYSThe #TryGuys is the flagship channel of 2ND TRY, LLC. Tune in twice a week for shows from Keith, Ned, Zach and Eugene, the creators and stars of The Try Guys.APPEARANCESJamie - Rank Kid Jessica Schupack - Marketing ConsultantFind her on Instagram @classiceventsandmarketingNick Schreiber - Chef & Owner of Belle’s Bagels @bitchdontkillmyschreibJD Rocchio - Chief Bagel Officer & Owner of Belle’s BagelsBelle’s Bagelswww.bellesbagels.com@bellesbagels on Instagram and Twitter Reece Scelfo - Owner of Brady’s Bakerywww.bradysbakery.comIG: @bradysbakeryVoice Over by Devlin McCluskeyLOCATIONLight Lab@lightlab www.lightlabla.com Special Thanks Jessica Schupack, Stephanie Levine & Susan Levison, Anne SageEDITED BY Devlin McCluskey  EPISODE CREW Directed by Rachel Ann Cole   Director of Photography - Stephen TringaliCamera Operator - Vito HuizarCamera Operator - Nathan MeadeCamera Operator - Dante Skartoni1st Assistant Camera - Melanie Adams2nd Assistant Camera - Nicole Kent2nd Assistant Camera - Jennifer PawlowskiGo Pro Camera Assistant - Miles Bonsignore Demo Camera Operator - Dawn ShimDIT - Greg KarpinskiGaffer - George SugarBest Boy Electric - Brandon WintersKey Grip - Nate ThompsonKey Grip - Andrew EnloeBest Boy Grip - Alberto GonzalesSound Mixer - Evan MenakBoom Operator - Rory O’ConnellBoom Operator - Daniel WonacottProduction Designer - Susannah HoneyArt Director - Megan SunzeriFood Stylist - Niki Ford Art Production Assistant - Samuel JohnsonProduction Manager - Alexandria HerringSet Production Assistant - Jonathan KirkAssistant Editor - Will WitwerOvernight Editor - Bryan SandlinOvernight Editor - Rosalie Fischer VENDORSCamera provided by The Camera DivisionGrip & Electric provided by Lightspeed Grip & LightingProduction Supplies provided by Walk & Talk Rentals  MUSICLicensed from AudioNetwork SFXLicensed from Audioblocks VIDEOLicensed from VideoblocksFood vector created by natalka_dmitrova - https://www.freepik.com/free-photos-vectors/food Official Try Guys PhotosBy Mandee Johnson Photography | @mandeephoto 2nd Try, LLC STAFFExecutive Producer - Keith HabersbergerExecutive Producer - Ned FulmerExecutive Producer - Zach KornfeldExecutive Producer - Eugene Lee YangProducer - Rachel Ann ColeProducer - Nick RufcaProduction Manager - Alexandria HerringEditor - Devlin McCluskeyEditor - YB ChangEditor - Elliot DickerhoofAssistant Editor - Will WitwerCamera Operator - Miles BonsignoreSound Operator - Jonathan Kirk Production Assistant - Sam JohnsonContent Strategist - Kaylin Burke Special Thanks To!Thanks to all of our Gold Level Patrons! AJ S., Amy Fleming, Ana Camba, Cat Hicks, Elisa Proust, Emma Godfrey, Erica Rao, Jared Aarons, Kelsey Bock, Kourtney Wong, Loretta Wen, Matthew Tadros, Miha, Paulus, Sarah Waxman, Traci Lew, Wendy Tran, Lily"
"3s2qAFfpJf4","Meanwhile 4D","2019-12-14T19:24:22.000Z","UCOYWgypDktXdb-HfZnSMK6A","TomSka","23","19.16.12","Meanwhile|tomska|thomas ridgewell|asdf movie|180 video|comedy|sketch|skit|funny videos|funny video|muffin time|darksquidge|content|comedy video|funny|comedy videos|joke|jokes|humor|crabstickz|vr|google|4D|360 video|maenwhile 1|meanwhile 2|meanwhile 3","624981","60874","764","4772","https://i.ytimg.com/vi/3s2qAFfpJf4/default.jpg","False","False","Time to explore even more universes with some extra dimensions thrown in!Featuring Chris 'Crabstickz' Kendall (http://youtube.com/crabstickz)Written, Produced, and Directed by Thomas 'TomSka' Ridgewell (http://youtube.com/tomska) and Eddie Bowley (http://youtube.com/eddache)Cinematography and editing by Elliot Gough (http://youtube.com/elliotexplicit)Music by Todd ‘LilDeuceDeuce’ Bryanton (http://youtube.com/lildeucedeuce)Sound Design by Dan Pugsley (http://danpugsley.co.uk)Sound Recording by Liam Abbott (http://twitter.com/liambabbott96)Narration by Jonti 'Weebl' Picking (http://youtube.com/mrweebl)with Daniel J. Layton (actor) as Dancing Police (http://youtube.com/danieljlayton)CONTENT WARNING: Body shaming, general TomSka-esque mischief, and the probability of motion sicknessTomSka Shirts (https://tomskashop.com/)Twitter (http://twitter.com/thetomska)Facebook (http://fb.com/thetomska)Tumblr (http://thetomska.tumblr.com)Secondary Channel (http://youtube.com/darksquidge)"
"L2rWFAanswg","CLICK READS MEAN TWEETS","2019-12-14T21:30:00.000Z","UCELEYV16ItX8pNkg8EuVY7g","Click","24","19.16.12","click|click house|click crew|click plays|muselk|loserfruit|crayator|bazzagazza|lachlan|lazarbeam|lannan|vlogs|fortnite|challenge|lufu|bazz|cray|prank|reactions|travel|game show|gaming|sketch|comedy|funny|mean tweets|roast|fans roast|submissions|twitter","996505","63128","1067","4458","https://i.ytimg.com/vi/L2rWFAanswg/default.jpg","False","False","We get our hearts broken by our fans perfectly written roasts.  Click Social Links:YouTube | http://bit.ly/CLICK-SUBSCRIBEDouble Click YouTube | http://bit.ly/DOUBLECLICKTik Tok | http://vm.tiktok.com/m68E3N/Twitter | https://twitter.com/TheClickCrewInstagram | https://instagram.com/clickOur Partners:Produced and edited by the Click Management Team | http://clickmgmt.com.au/team4G data powered by Boost Mobile Australia | https://boost.com.au/Audio Equipment by Rode Microphones | http://www.rode.com/Click Roster:Muselk | https://www.youtube.com/user/MrMuselkLoserfruit | https://www.youtube.com/user/TheLoserfruitCrayator | https://www.youtube.com/user/CrayatorBazzaGazza | https://www.youtube.com/c/BazzaGazzaLazarBeam | https://www.youtube.com/LazarBeamTannar | https://www.youtube.com/c/tannareacottWe have opened a PO Box! You can send your letters or packages to all of us here at Click for a chance to be featured in a future video:PO Box 183Pyrmont 2009Australia"
"Sbo88CDLgTM","Bronny James leads Sierra Canyon to win in front of LeBron | Prep Highlights","2019-12-15T04:14:08.000Z","UCiWLfSweyRNmLpgEHekhoAg","ESPN","17","19.16.12","LeBron James Jr.|Bronny James|Bronny|Bronny Jr|LeBron James son|bronny james|lebron|lebron james|lebron james bronny|bronny james sierra canyon|sierra canyon|bronny highlights|lebron bronny|bronny james espn|bronny james jr|lebron james jr|lebron espn|bronny espn|lebron lakers|lebron james lakers|bronny james highlights|bronny james high school highlights|bronny sierra canyon|espn|nba|st vincent st marys|prep highlights|sierra canyon highlights","1664342","21110","649","2483","https://i.ytimg.com/vi/Sbo88CDLgTM/default.jpg","False","False","LeBron James’ son Bronny James scores 15 points, including the game-winning steal and score in the final minute of Sierra Canyon’s win over LeBron’s alma mater St. Vincent-St Mary’s.#Bronny #SierraCanyon✔ Subscribe to ESPN+ https://plus.espn.com/✔ Get the ESPN App: http://www.espn.com/espn/apps/espn✔ Subscribe to ESPN on YouTube: http://es.pn/SUBSCRIBEtoYOUTUBE✔ Subscribe to ESPN FC on YouTube: http://bit.ly/SUBSCRIBEtoESPNFC✔ Subscribe to NBA on ESPN on YouTube: http://bit.ly/SUBSCRIBEtoNBAonESPN✔ Watch ESPN on YouTube TV: http://es.pn/YouTubeTVExclusive interviews with Rachel Nichols https://urlzs.com/jNUReStephen A. Smith on ESPN https://urlzs.com/W19TzESPN on Social Media:► Follow on Twitter: http://www.twitter.com/espn► Like on Facebook: http://www.facebook.com/espn► Follow on Instagram: www.instagram.com/f/espnVisit ESPN on YouTube to get up-to-the-minute sports news coverage, scores, highlights and commentary for NFL, NHL, MLB, NBA, College Football, NCAA Basketball, soccer and more. More on ESPN.com: https://www.espn.com"
"Lh1Tz3zwhFU","VFX Artists React to STAR WARS bad and Great CGi","2019-12-14T17:00:04.000Z","UCSpFnDQr88xCZ80N-X7t0nQ","Corridor Crew","24","19.16.12","VFX|CGI|vfx artists react|Star Wars|trilogy|a new hope|empire strikes back|return of the jedi|shot breakdown|hollywood|the mandalorian|baby yoda","1347503","77079","637","7051","https://i.ytimg.com/vi/Lh1Tz3zwhFU/default.jpg","False","False","CONSIDER PATREON ► http://bit.ly/_Corridor_Patreon_SupportWatch More Corridor Crew ► https://www.youtube.com/watch?v=4cw5MZkjW5k&Consider Subscribing ► http://bit.ly/Subscribe_Corridor_CrewThis Episode ►Niko, Clint, and Wren sit down to react to some of the zestiest CGi moments from the original STAR WARS trilogy: What makes a visual effect bad? What makes one great?OUR GEAR ►Most Used Equipment: http://bit.ly/CorridorCrew_GearPerfect Camera: https://bhpho.to/2FJpQmRPuget Systems Computers: http://bit.ly/PC_Puget_WorkstationsSUPPORT ► Translate & Subtitle: http://bit.ly/Make_SUBTITLESPatreon Donation: http://bit.ly/_Corridor_Patreon_SupportBuy Merch: http://bit.ly/Corridor_StoreFOLLOW ►Instagram: http://bit.ly/_Corridor_InstagramSub-Reddit: http://bit.ly/_Corridor_Sub-RedditSubscribe to our Gaming Channel, NODE: http://bit.ly/Subscribe_to_NODEMUSIC ►Epidemic Music ► http://bit.ly/Corridor_Music click this link for a free month!"
"D_YkN83BkwY","GENIUS Advertisements That Actually WORK","2019-12-14T21:04:36.000Z","UCpB959t8iPrxQWj7G6n0ctQ","SSSniperWolf","24","19.16.12","sssniperwolf|sniper wolf|reaction|reacting|funny|ads|advertisements|advertising|genius|ad|creative|creative advertising","782969","32971","1623","3032","https://i.ytimg.com/vi/D_YkN83BkwY/default.jpg","False","False","GENIUS Advertisements That Actually WORK! Have you ever seen an ad for a product and then wanted whatever was being advertised? Leave a Like if you enjoyed!Subscribe to SSSniperWolf to join the Wolf Pack! http://bit.ly/SubSSSniperWolfInstagram: http://instagram.com/sssniperwolfTwitter: http://www.twitter.com/sssniperwolfFacebook: https://www.facebook.com/sssniperwolfOfficial Merch: https://ogwolfpack.com/"
"HC0GGkNZPgs","Dual Axis Illusion","2019-12-09T13:59:48.000Z","UCLIEt2GYDgOTLm32sSsRK2Q","The Illusion contest","27","19.16.12","[none]","574205","9443","231","458","https://i.ytimg.com/vi/HC0GGkNZPgs/default.jpg","False","False","Best Illusion of the Year Contest - 2019 Title: Dual Axis Illusion Authors:  Frank ForceCountry: USA"
"F3LtBdw__fI","Fortnite X Star Wars - Gameplay Trailer","2019-12-14T23:10:38.000Z","UClG8odDC8TS6Zpqk9CGVQiQ","Fortnite","20","19.16.12","Fortnite|Epic Games|PC|PS4|Xbox One|Battle Royale|Unreal Tournament|Unreal Engine|Fortnite Battle Royale|Fortnite Creative","2329046","54969","4537","5582","https://i.ytimg.com/vi/F3LtBdw__fI/default.jpg","False","False","The battle is over and TIE Fighters have crashed into the Island!Explore the crashed TIE Fighters, take on some Stormtroopers to get their Blasters or grab the all-new Lightsaber weapon and duel your opponents. #FortniteXStarWarsPlay Fortnite Battle Royale, the completely free 100-player PvP mode. One giant map, A Battle Bus, Last one standing wins. ESRB Rating: Teen with Violence.Instagram: https://www.instagram.com/fortnite/Twitter: https://twitter.com/FortniteGameFacebook: https://www.facebook.com/FortniteGame/Learn More: https://www.epicgames.com/fortnite/en-US/"
"XpPZzpG2Tok","Decorating my Cristmas Tree with my Nail Peelies","2019-12-14T16:30:38.000Z","UCGCVyTWogzQ4D170BLy2Arw","Simply Nailogical","24","19.16.12","nails|nail art|nail tutorial|beauty tutorial|nail art tutorial|diy nails|diy nail art|simply nailogical|cristine|peel-off|peel off base coat|peel off nails|peely|peelies|simply nailogical peelies|my peely bag|peely bag|what's in my peely bag|memories|year end reflection|history|simply nailogical reflects|christmas tree|christmas tree decorating|decorating my christmas tree|polish mountain","1164899","88923","989","6873","https://i.ytimg.com/vi/XpPZzpG2Tok/default.jpg","False","False","Gather round, it's time to decorate the Cristmas tree like a normal family!!Got boring nails? Just add a Holo Taco 💿🌮 Sign up for email updates to be notified about restocks ➡️ http://holota.co/holothere1 ♡ Subscribe to never miss n̶e̶w̶ ̶n̶a̶i̶l̶ ̶a̶r̶t̶ ̶t̶u̶t̶o̶r̶i̶a̶l̶s̶! http://bit.ly/subsimply♡ Subscribe to my SECOND CHANNEL for no reason: http://bit.ly/SubSimplyNot♡ Subscribe to Holo Taco (for nail videos lol): http://bit.ly/SubHoloTacoWhat's in my Peely Bag (2017): http://bit.ly/WhatsInMyPeelyBagHow to peel off your nails: https://www.youtube.com/watch?v=PdRl54j7OqgRewind vlog 2017: https://www.youtube.com/watch?v=15aTCG3as6QMixing all the Holoday glitters together: https://www.youtube.com/watch?v=bEICztmyZXc_ _ _ _ _ _ _ _ _ _ _ _ _ _ _ _ _ _ _ _ _ _ _ _ _ _ _ _ _ _ _ _ _ _♡PRODUCTS USED IN THIS VIDEO:♡♥ Peel-off base coat: http://holota.co/holopeelynailogical♥ Holodays Collection of glitter polishes: http://holota.co/holotherenailogicalON MY OTHER HAND: 👀_ _ _ _ _ _ _ _ _ _ _ _ _ _ _ _ _ _ _ _ _ _ _ _ _ _ _ _ _ _ _ _ _ _Stalk me on all the social medias!http://www.simplynailogical.comhttp://instagram.com/simplynailogicalhttps://www.snapchat.com/add/simplynailogicahttps://twitter.com/nailogicalhttps://www.facebook.com/simplynailogicalhttps://youtube.com/user/simplynailogicalhttps://www.youtube.com/c/simplynotlogicalhttp://simplynailogical.tumblr.com/_ _ _ _ _ _ _ _ _ _ _ _ _ _ _ _ _ _ _ _ _ _ _ _ _ _ _ _ _ _ _ _ _ _I film my nail videos with this camera: http://amzn.to/1MgznhtThis 105mm macro lens: http://amzn.to/1Pi8PM3I film my face videos with this camera: http://amzn.to/2kgHIgUThis 24-70mm lens: http://amzn.to/2gXJpxQI edit my videos with: http://bit.ly/videoeditor1I get some cool editing filters from: https://motionvfx.sjv.io/Ze3bRVoiceover mic: http://amzn.to/1MefGpGOn-camera shotgun mic: http://amzn.to/1HA9nz2External mic: http://amzn.to/2cU7t3jRing light for face-cams: http://amzn.to/2cU7cNOCheck out my personalized Amazon page with stuff I like! https://www.amazon.com/shop/simplynailogicalSee how to make your own amazing nail videos here: http://youtu.be/6k_GW0aso_kMusic: http://share.epidemicsound.com/SIMPLY_ _ _ _ _ _ _ _ _ _ _ _ _ _ _ _ _ _ _ _ _ _ _ _ _ _ _ _ _ _ _ _ _ _Disclaimer cause I love you guys: This video was not sponsored by any of the brands mentioned. All are opinions are my own. Some links above are affiliate links."
