video_id,title,publishedAt,channelId,channelTitle,categoryId,trending_date,tags,view_count,likes,dislikes,comment_count,thumbnail_link,comments_disabled,ratings_disabled,description
"h1JKzHPCGso","Sidemen - Merry Merry Christmas Ft. Jme & LayZ (Official Music Video)","2019-12-15T19:46:17.000Z","UCh5mLn90vUaB1PbRRx_AiaA","MoreSidemen","10","19.16.12","sidemen|official music video|sidemen merry merry christmas|sidemen challenge|sidemen song in 24 hours|sidemen song|sidemen disstrack","2546508","275342","9013","10393","https://i.ytimg.com/vi/h1JKzHPCGso/default.jpg","False","False","Whoever has the most views on their Sidemen Official Music Video by Christmas Day wins! Sidemen - The Gift Ft. S-X - https://www.youtube.com/watch?v=dtNIbIedChgJme: http://twitter.com/JmeBBKLayZ: https://twitter.com/LayZ_MusicSidemen Make A Song In 24 Hours Challenge:https://www.youtube.com/watch?v=YyYnll7LjW4&t=1sUnfortunately due to issues with Shakka's label we've had to change the song's chorus and it isn't allowed to be on Spotify/iTunes"
"a_TSR_v07m0","Porch Pirate vs. Glitter Bomb Trap 2.0","2019-12-15T17:00:01.000Z","UCY1kMZp36IQSyNx_9h4mpCg","Mark Rober","28","19.16.12","package thief|glitter bomb|porch pirate|glitter bomb prank|glitter bomb package|funny|2019|funny videos|prank|react|science|engineering|package thief revenge|glitter bomb trap|package thief caught|glitter|home alone|mark rober|porch pirates|package thieves|update|trap|viral|funny videos 2019|caught on camera|comedy|pranks|porch|theif|holiday|christmas|amazon package|jimmy kimmel","8768327","664868","7420","31059","https://i.ytimg.com/vi/a_TSR_v07m0/default.jpg","False","False","11 months of social justice engineering boiled down to 15 minutes!Thanks to Bose for their support! Save $50 on the Headphones 700 now through 12/21 (US only)https://bose.life/markrober700Thanks to Macaulay Culkin!  Check out his channel- https://www.youtube.com/channel/UCsCw3J3T3XFLgKm2te7TrTQSpecial thanks to my buddy Sean Hodgins. I hired him to help me on this and it wouldn't have been possible without his mad skillz - https://www.youtube.com/channel/UCE-bw6PRKuDlH6fP1mP4nOwHere is where I got the biodegradable glitter from: https://www.plurvision.com/glitterThanks to all the volunteers across the country who put packages out for me!  *MUSIC*0:00 - Tchaikovsky - Dance of the Sugar Plum Fairy https://en.wikipedia.org/wiki/File:Tchaikovsky_-_Dance_of_the_Sugar_Plum_Fairy_-_The_Nutcracker.ogg0:23 - Cereal Killa - Blue Wednesday https://soundcloud.com/bluewednesday/0:56 - Arrow- Andrew Applepie http://andrewapplepie.com/1:28 - Marimba Idea - Blue Wednesday https://soundcloud.com/bluewednesday/2:58 - Arrow- Andrew Applepie http://andrewapplepie.com/3:52 - Dansez - Fasion https://soundcloud.com/michalgallo/dansez-fasion-beats-music4:28 - Sappheiroz - Falling https://soundcloud.com/sappheirosmusic/falling-ft-esoreni5:12 - Cereal Killa - Blue Wednesday https://soundcloud.com/bluewednesday/11:40 - Arrow- Andrew Applepie http://andrewapplepie.com/12:46 - Kalimba Jam - Blue Wednesday https://soundcloud.com/bluewednesday/15:44 - Q - Blue Wednesday https://soundcloud.com/bluewednesday/17:53 - New Shoes - Blue Wednesday https://soundcloud.com/bluewednesday/"
"HayzAN99uSE","Arsenal 0-3 Man City | What Are The Kroenke's Doing For This Club (DT)","2019-12-15T19:19:43.000Z","UCBTy8j2cPy6zw68godcE7MQ","AFTV","17","19.16.12","a.f.c.|afc|aftv|arsenal|arsenal fan tv|arsenal tv|aubameyang|fans|football|goal|gooners|highlights|ozil|premier league|robbie lyle|troopz|dt|aftvmedia|nicolas pepe|pépé|tierney|david luiz|xhaka|martinelli|mesut ozil|freddie ljungberg|ljungberg|leno|torreira|manchester city|mcfc|man city|aguero|kdb|sterling|kevin de bruyne|guardiola|pep","569840","12430","603","2859","https://i.ytimg.com/vi/HayzAN99uSE/default.jpg","False","False","SUBSCRIBE NOW : https://goo.gl/Zq9NcAAFTV SHOP:  http://goo.gl/rin8oWINSTAGRAM:  https://goo.gl/FfTBNLTWITTER:     https://goo.gl/pSKBuCFACEBOOK:   https://goo.gl/w4YbW7SNAPCHAT: https://goo.gl/mQRasiVKONTAKTE: https://goo.gl/p5Y3feTWITCH: https://goo.gl/Gx9g2nDISCORD: https://discord.gg/KCwCQqWWEBSITE:     https://goo.gl/GsjncrAFTV winner of The Best Overall Football Content Creators at The 2018/19 Football Blogging AwardsAFTV is the Unofficial Voice of Arsenal Fans around the world. AFTV is a platform where fans can voice their independent opinions on the greatest football club in the world.#AFTV  #Arsenal #ManCity"
"YDqqbH2MlGg","Champions League Round of 16 Draw | Liverpool, Man City, Tottenham and Chelsea","2019-12-16T11:54:40.000Z","UC4i_9WvfPRTuRWEaWyfKuFw","BT Sport","17","19.16.12","bt sport|bt sport official|football|soccer|sport|champions league|champions league draw|liverpool|manchester city|man city|chelsea|spurs|tottenham|mourinho|klopp|guardiola|lampard|barcelona|real madrid","129681","1913","84","230","https://i.ytimg.com/vi/YDqqbH2MlGg/default.jpg","False","False","Watch the draw for the UEFA Champions League last 16 and watch all the matches live and exclusively on BT Sport.Hit 'Subscribe' above to ensure you never miss a video from the BT Sport YouTube channel.Visit and subscribe to our 'BT Sport Boxing' YouTube channel ➡️ http://www.youtube.com/c/btsportboxingTwitter: http://twitter.com/btsportFacebook: http://www.facebook.com/btsportInstagram:http://instagram.com/btsportWebsite: http://sport.bt.com"
"a9m3GD0DbPY","Baking A Wedding Cake With Every Possible Cake Flavor In It","2019-12-15T21:21:11.000Z","UCbAwSkqJ1W_Eg7wr3cp5BUA","Safiya Nygaard","22","19.16.12","baking a wedding cake with every possible cake flavor in it|wedding cake|cake|baking|frankencake|mixing cake mixes|cake mixes|safiya nygaard|safiya wedding|safiya|safia|safiya and tyler|rosanna pansino|baking cakes|cake flavors","2028770","156037","1890","9962","https://i.ytimg.com/vi/a9m3GD0DbPY/default.jpg","False","False","And now I present to you, part 2 of our 4-part wedding series! We had to make a franken-wedding-something, so why not a cake? We decided to bake an 8-tier wedding cake where each layer is a different cake flavor, and then at the end taste them as tiers and all together. What do you guys think? Do you want a franken-cake at your wedding? Should we keep doing bad culinary science or retire our spatulas for good?You can check out our Colourpop frankenlipsticks here! https://colourpop.com/collections/safiya-nygaard-makeupThank you so much to Rosanna Pansino for helping us bake our cake! You can find her channel here: https://www.youtube.com/user/RosannaPansinoDon’t forget to click the bell to turn on post notifications!Merch: https://fiendsbysaf.com/Safiya's IG: https://www.instagram.com/safiyany/Twitter: https://twitter.com/safiyajnFacebook: https://www.facebook.com/safnygaard/Assistant Editors: Emily Linden, Claire Wiley, Josie Latino, & Ben Chrobak-PrinceMusicvia Audio NetworkSFXVia Audioblocks"
"jV-WUkru6nA","DigDat - Daily Duppy | GRM Daily","2019-12-15T17:00:11.000Z","UCqTwKvjbTENZDGbz2si47ag","GRM Daily","10","19.16.12","Music|GRM|GRM Daily|Video|DigDat|Daily Duppy","360380","31406","274","1097","https://i.ytimg.com/vi/jV-WUkru6nA/default.jpg","False","False","🚨 SUBSCRIBE: http://bit.ly/GRMsubscribe🎧 STREAM: https://smarturl.it/Digdat_DD🎹 PROD BY: Madara Beatz & M1OnTheBeat  📲 FOLLOW: @grmdaily📰 VISIT: http://grmdaily.com/"
"RR-qNkuCmvY","This Video Is So Important.. (COPPA)","2019-12-15T22:11:51.000Z","UCS5Oz6CHmeoF7vSad0qqXfw","DanTDM","22","19.16.12","coppa|dantdm|coppa dantdm|what is coppa","1071731","72885","869","20721","https://i.ytimg.com/vi/RR-qNkuCmvY/default.jpg","False","False","I have spent the last week compiling everything about COPPA and the way it will affect both YouTube and its creators. See below for the key points if you want to go straight to a certain section of the video.Contents:What Is COPPA? : 01:24Why are Creators Panicking? and Fines : 02:44My Call with the FTC : 05:38The FTC Don't Want GOTCHA Campaigns : 05:53Adding a Disclaimer Doesn't Cover You : 06:39Mixed Audiences : 07:42FTC Says YouTube is our 3rd Party Data Collector : 09:15FTC DIDN'T Force YouTube to block comments and notifications : 10:13Parents Should Be Responsible : 10:57The Main Issue with COPPA : 12:09The Solution (IMPORTANT) : 15:02"
"HlgZISKzAKk","Lucas Moura smashes home spectacular strike! | Wolves 1-2 Tottenham | Premier League Highlights","2019-12-15T16:06:09.000Z","UCNAf1k0yIjyGu3k9BwAg3lg","Sky Sports Football","17","19.16.12","sky sports|premier league|Football League|football|Sky Sports live|Sky|Sports|stream|sky sports football|premier league highlights|epl 1920|epl highlights 1920|tottenham|tottenham highlights|spurs highlights|tottenham wolves|wolves|wolves highlights|wolverhampton wanderers|wolves v spurs|wolves v tottenham|moura goal|lucas moura goal|lucas goal|tottenham goals|sp:ty=high|sp:dt=2019-12-15T14:00:00Z|sp:st=soccer|sp:li=epl|sp:ti:home=WAND|sp:ti:away=TOT","682543","6905","237","767","https://i.ytimg.com/vi/HlgZISKzAKk/default.jpg","False","False","SUBSCRIBE ► http://bit.ly/SSFootballSubPREMIER LEAGUE HIGHLIGHTS ► http://bit.ly/SkySportsPLHighlightsJan Vertonghen headed an injury-time winner as Tottenham snatched an unlikely 2-1 win at Wolves to move to within three points of the top four.Watch Premier League LIVE on Sky Sports here ► http://bit.ly/WatchSkyPL►TWITTER: https://twitter.com/skysportsfootball►FACEBOOK: http://www.facebook.com/skysports►WEBSITE: http://www.skysports.com/footballMORE FROM SKY SPORTS ON YOUTUBE:►SKY SPORTS FOOTBALL: http://bit.ly/SSFootballSub►SKY SPORTS BOXING: http://bit.ly/SSBoxingSub►SOCCER AM: http://bit.ly/SoccerAMSub►SKY SPORTS F1: http://bit.ly/SubscribeSkyF1"
"jmr_b559OAk","Queen of the I'm a Celeb Jungle Jacqueline Jossa Addresses the Infidelity Rumours | Lorraine","2019-12-16T12:30:13.000Z","UCM0cwESe107DHyGpEUx1n4Q","Lorraine","24","19.16.12","lorraine|lorraine kelly|lorraine itv|lorraine interview|interview on lorraine|chat show|talk show|jacqueline jossa|jacqueline jossa im a celeb|im a celebrity 2019|im a celebrity queen of the jungle|im a celebrity... get me out of here|im a celeb jacqueline and myles|im a celeb myles stephenson|jacqueline jossa dan osborne|eastenders|eastenders jacqueline jossa","30331","1936","54","0","https://i.ytimg.com/vi/jmr_b559OAk/default.jpg","True","False","Subscribe now for more! http://bit.ly/1KyA9sVIn her first television interview since being crowned I'm A Celeb's Queen of the Jungle, Jacqueline Jossa talks about dealing with the infidelity rumours surrounding her husband Dan Osborne, overcoming her fears to face the Bushtucker Trials, and what her plans are moving forward in her career.Broadcast on 16/12/2019Like, follow and subscribe to Lorraine!Website: http://bit.ly/1E6BlKWYouTube: http://bit.ly/18cHdtxFacebook: http://on.fb.me/1E6BhepTwitter: https://goo.gl/R5JxmpLorraine brings you up-to-date topical stories, the biggest celebrity interviews and tasty recipes as well as finger-on-the-pulse fashion tips and health advice from Dr Hilary Jones.Presenter Lorraine Kelly welcomes guests in her warm and friendly studio setting, where the likes of Mark Heyes, Dan Wootton and Dr Hilary Jones share knowledge in their expert fields.Join Lorraine every weekday on ITV at 8.30am.http://www.itv.com"
"E7BqGaZQGws","£150 SECRET SANTA PRESENT SWAP!! (OPENING CHRISTMAS PRESENTS EARLY) ft. DadvGirls","2019-12-15T18:00:03.000Z","UCahx478FV8W0qz4LGTrs1CA","Brandonio","24","19.16.12","brandonio|brandonio sister|user friendly|brandonio challenge|brandonio girlfriend|present swap|secret santa|£150 secret santa|secret santa gifts|secret santa gift exchange|secret santa present swap|present exchange|christmas presents opening|christmas presents|christmas present swap|opening christmas presents early|secret sants present opening|secret santa with dadvgirls|christmas|opening presents|christmas gifts|vlogmas|family friendly","140526","7809","75","631","https://i.ytimg.com/vi/E7BqGaZQGws/default.jpg","False","False","£150 SECRET SANTA PRESENT SWAP!!LEAVE A LIKE FOR ME & COMMENT DOWN BELOW ONCE DONE FOR A HEART BACKNEW VIDEO EVERY SUNDAY 6PM (UK TIME)Make sure you SUBSCRIBE with NOTIFICATIONS on so you can be on time to EVERY video🔔By subscribing you'll be helping towards my dream of hitting over 1 Million Subscribers so don't let it pass!Dad V Girls: https://www.youtube.com/channel/UCSxspw1FZ3K4bhdHhhibhqw••••••••••••••••••••••••••••••••••••••••••••••••••••••••••••••••••••••••••••••••••••••NEW MERCH HERE (LIMITED SO BE QUICK)http://www.brandoniostore.com/••••••••••••••••••••••••••••••••••••••••••••••••••••••••••••••••••••••••••••••••••••••FOLLOW ME FOR GOOD LUCK😉(I follow back a lot if I see you active)• Instagram: Brandonio_ https://www.instagram.com/brandonio_/• Snapchat: BrandonioSnaps• Twitter: https://twitter.com/BrandonioTweets• TikTok: Brxndonio• Sisters Instagram: Holly_Bxnnxtt https://www.instagram.com/holly_bxnnxtt/• Girlfriends Instagram: erinbowyer_ https://www.instagram.com/erinbowyer_/••••••••••••••••••••••••••••••••••••••••••••••••••••••••••••••••••••••••••••••••••••••Business Enquiries:brandohvlogs@gmail.com•••••••••••••••••••••••••••••••••••••••••••••••••••••••••••••••••••••••••••••••••••••••MORE VIDEOS: https://www.youtube.com/watch?v=lSd6alhwKQU&list=PL8Y4bbcq6EiJL45wwn9TlM9jnUMdLD9lHThank you SO much for your support, every single one of you genuinely mean so much to me, I'll always appreciate what you do to support me & I'll always show my support back. YOU never go unnoticed trust me, what we have is so different & this is for life xuser friendly , family friendly , brandonio#secretsantaSTAY TRUE TO YOURSELF🙏🏻"
"g4U4BQW9OEk","Top Gun: Maverick (2020) – New Trailer - Paramount Pictures","2019-12-16T13:00:15.000Z","UCF9imwPMSGz4Vq1NiTWCC7g","Paramount Pictures","1","19.16.12","Top Gun|Top Gun: Maverick|Maverick|Top Gun 2|Top Gun Sequel|Top Gun Remake|Top Gun Movie|Tom Cruise|Miles Teller|Jennifer Connelly|Jon Hamm|Glen Powell|Lewis Pullman|Ed Harris|Jay Ellis|Danny Ramirez|Monica Barbaro|Greg Tarzan Davis|Charles Parnell|Bashir Salahuddin|Paramount|SkyDance|Jerry Bruckheimer|Official Trailer|Trailer|New Trailer|Action (Movie Genre)|New Movie|Coming Soon","794337","37752","640","4099","https://i.ytimg.com/vi/g4U4BQW9OEk/default.jpg","False","False","Watch the NEW trailer for #TopGun: Maverick starring Tom Cruise - In theatres June 26, 2020. After more than thirty years of service as one of the Navy’s top aviators, Pete “Maverick” Mitchell (Tom Cruise) is where he belongs, pushing the envelope as a courageous test pilot and dodging the advancement in rank that would ground him. When he finds himself training a detachment of Top Gun graduates for a specialized mission the likes of which no living pilot has ever seen, Maverick encounters Lt. Bradley Bradshaw (Miles Teller), call sign: “Rooster,” the son of Maverick’s late friend and Radar Intercept Officer Lt. Nick Bradshaw, aka “Goose.” Facing an uncertain future and confronting the ghosts of his past, Maverick is drawn into a confrontation with his own deepest fears, culminating in a mission that demands the ultimate sacrifice from those who will be chosen to fly it. Connect with #TopGunFacebook: https://www.facebook.com/TopGunMovie/Twitter: https://twitter.com/TopGunMovieInstagram: https://www.instagram.com/TopGunMovie/ Paramount Pictures Corporation (PPC), a major global producer and distributor of filmed entertainment, is a unit of Viacom (NASDAQ: VIAB, VIA), home to premier global media brands that create compelling television programs, motion pictures, short-form content, apps, games, consumer products, social media experiences, and other entertainment content for audiences in more than 180 countries.Connect with Paramount Pictures Online:Official Site: http://www.paramount.com/Facebook: https://www.facebook.com/ParamountInstagram: http://www.instagram.com/ParamountPicsTwitter: https://twitter.com/paramountpicsYouTube: https://www.youtube.com/user/Paramount"
"D6wXU6lW7sc","The Haunting of Queen Mary's Castle","2019-12-15T21:14:02.000Z","UCg3gzldyhCHJjY7AWWTNPPA","Sam and Colby","24","19.16.12","sam golbach|colby brock|exploring|abandoned|exploring stanley hotel|sam and colby haunted|most haunted places|sam and colby scary|paranomal investigation|overnight at haunted hotel|sam and colby overnight|sam and colby queen mary|exploring haunted|top 10 haunted|sam colby jake corey|haunted london|the graveyard|24 hour overnight|biltmore hotel|sam and colby castle|haunted castle|queen mary castle|queen mary overnight|scottish castle|haunted england","588281","84488","523","9980","https://i.ytimg.com/vi/D6wXU6lW7sc/default.jpg","False","False","GET XPLR MERCH: https://shopxplr.comSam and Colby stay overnight at the haunted Queen Mary's Castle in Scotland. Corey Scherer and Jake Webber explore the hauntings behind the Castle and capture tons of paranormal evidencePrevious Movie THE GRAVEYARD: https://youtu.be/jMonTLNCGfINEW XPLR APP! Download for free: https://apps.apple.com/us/app/xplr/id1474820819Android: https://play.google.com/store/apps/details?id=co.tapcart.app.id_lMlmFXdnGD&hl=en_USFollow Jake and Corey!https://www.youtube.com/user/ItsCoreySchererhttps://www.youtube.com/user/Jakewebber9Channel Membership: https://www.youtube.com/channel/UCg3gzldyhCHJjY7AWWTNPPA/joinMake sure to Subscribe! https://www.youtube.com/channel/UCg3gzldyhCHJjY7AWWTNPPA?sub_confirmation=1Check out our personal channels!COLBY: https://www.youtube.com/c/ColbyBrockSAM: https://www.youtube.com/c/SamGolbachMusic Used: http://link.epidemicsound.com/Our other social media!Instagram: @SamandColbyTwitter: @SamandColbySnapchat: @samgolbach & @colbybrock"
"xIIvYdioJxg","NEVER HAVE I EVER WITH SIMON","2019-12-15T15:50:49.000Z","UC1YKc1TB0-bvWFXo8RqNJlQ","Talia Mar","24","19.16.12","taliamarmusic|talia|talia mar|mar|miniminter|simon|boyfriend","622266","37898","373","791","https://i.ytimg.com/vi/xIIvYdioJxg/default.jpg","False","False","I have a few more videos going up before Christmas so stay tuned!!!simons channel: https://www.youtube.com/miniminterTWITCH (I stream daily woop woop) - https://www.twitch.tv/taliamarGET MY MERCH: https://www.taliamar.com-----------------------GAMING CHANNEL:https://www.youtube.com/channel/UCELBodZwev0kgJY5Cz61UPQ------------------------SOCIAL LINKS------------------------http://www.twitter.com/taliamarhttp://www.instagram.com/taliamarhttp://www.younow.com/taliamarSnapchat: TaliamarmusicMY MUSIC:https://open.spotify.com/artist/7zoc6JsY8GWVcl2qFwiKay_________________DISCOUNT CODES;www.ofracosmetics.com (TALIA)"
"bzTWI4pKNy4","Juventus 3-1 Udinese | CR7 Scores Twice as Juve go Top! | Serie A TIM","2019-12-15T17:00:08.000Z","UCBJeMCIeLQos7wacox4hmLQ","Serie A","17","19.16.12","Juventus 3-1 Udinese|Juventus Udinese|Juventus Udinese highlights|Juventus Udinese 3-1 serie a|ronaldo goal|juventus highlights|Cristiano Ronaldo|Ronaldo|Juventus|CR7|Serie A|highlights|Bonucci|Dybala|Insigne|AC Milan|Inter Milan|Napoli|Roma|full highlights|watch|migliori gol|migliori in campo|migliori al mondo|gol del mese|calcio|Italia|lukaku|de ligt|balotelli|sp:ty=high|sp:dt=2019-12-15T13:00:00Z|sp:st=soccer|sp:li=seri|sp:ti:home=JUV|sp:ti:away=UDN|sp:vl=en","3364692","53072","1444","2402","https://i.ytimg.com/vi/bzTWI4pKNy4/default.jpg","False","False","Cristiano Ronaldo and Bonucci score against Udinese, to give Juventus a 3-1 win | Serie AThis is the official channel for the Serie A, providing all the latest highlights, interviews, news and features to keep you up to date with all things Italian football.Subscribe to the channel here! https://bit.ly/2OM2Eax Find out more about the Serie A at: http://www.legaseriea.it/en/ Questo è il canale ufficiale della Serie A, dove potrai avere accesso ai momenti salienti, alle interviste, alle notizie e alle funzionalità del momento per rimanere aggiornato sulle ultime novità del campionato.Iscriviti qui al canale! https://bit.ly/2OM2EaxPer maggiori infomazioni sulla Serie A: http://www.legaseriea.it/it"
"Q8-WM2e6s94","I Got My Nails Done By Cardi B's Nail Tech...*HOW MUCH?!*","2019-12-15T17:01:23.000Z","UChmPDnOUiWx4FrfiljzR_WA","Millie T","24","19.16.12","24 hours|i tried|i got my nails done by cardi bs nail tech|getting acrylic nails|cardi b|cardi b nails|as/if|refinery|cardi bs nail artist|most expensive salon|diamond acrylic nails|manicure|most expensive|luxury|i tried long acrylics|for 24 hours|i flew to new york|diy fake nails|fake nails|gel nails|worst reviewed|gone wrong|storytime|acrylic nails vlog|for the first time|cardi b asmr|cardi b interview","455027","26023","430","665","https://i.ytimg.com/vi/Q8-WM2e6s94/default.jpg","False","False","So I flew to New York to get my nails done by Cardi B's nail artist/best friend. I had a HUGE diamond installed onto my nails and it was more expensive than I thought...Subscribe: https://bit.ly/2IZ7MWVFollow Millie T :Instagram: https://instagram.com/milliet25/Twitter: https://twitter.com/milliet25SnapChat: https://snapchat.com/add/milliet24Watch more Millie T :24 Hours Challenge: http://bit.ly/2pV8lsjReaction Videos: http://bit.ly/2yGHhB4Product Testing videos: http://bit.ly/2NJZTFRLatest Videos: http://bit.ly/2PBeRj5Popular Videos: http://bit.ly/2EquSqP"
"UV7wLwxqwe4","CHRISTMAS FAMILY MUKBANG! Q&A VLOGMAS DAY 15 2019","2019-12-15T18:58:59.000Z","UCSxspw1FZ3K4bhdHhhibhqw","Dad V Girls","24","19.16.12","Dad V Girls|Dad|Girls|Dad Vs Girls|Family|Family Friendly|Challenges|kids|Family challenges|family vloggers|daily vlog|uk family|fun|funny|english family|mukbang|christmas|vlogmas","131084","8244","57","0","https://i.ytimg.com/vi/UV7wLwxqwe4/default.jpg","True","False","CHRISTMAS FAMILY MUKBANG! Q&A VLOGMAS DAY 15 2019* IPHONE GIVEAWAY CLICK 👉🏻 https://bit.ly/2lf0X8J* Watch Next MOM & DAD CHOOSE OUR CHRISTMAS OUTFITS! http://bit.ly/34qg17sFollow Dad V Girls:* IINSTAGRAM -  https://www.instagram.com/dadvgirls/* Kaci Instagram: https://www.instagram.com/kaci.jay/* Sarah Instagram: https://www.instagram.com/sarahconder/* Grace Instagram: https://www.instagram.com/grace_conder/* Kaci Jay's Channel: https://bit.ly/2OBqCca* Facebook: https://www.facebook.com/dadvgirls/* Twitter: https://twitter.com/joelconder* Watch More Dad V Girls:All Dad V Girls videos: https://www.youtube.com/watch?v=7bnXF...Family Challenges: https://www.youtube.com/watch?v=7bnXF...Family Vlogs: https://www.youtube.com/watch?v=LZMk1...Music Parodys: https://www.youtube.com/watch?v=IQBiX...Will They cheat?: https://www.youtube.com/watch?v=8DVZ0...About Dad V Girls:Tune in for our Family Challenges, Vlogs and days out! We're a family of ALL Girls + Dad!"
"u3-TKuA8k1k","UFC 245: Kamaru Usman Octagon Interview","2019-12-15T07:27:25.000Z","UCvgfXK4nTYKudb0rFR6noLA","UFC - Ultimate Fighting Championship","17","19.16.12","kamaru|usman|kamaru usman|octagon interview|ufc|245|ufc 245|mma|joe rogan|colby|covington|interview|post|fight|octagon","1661572","24896","2077","8727","https://i.ytimg.com/vi/u3-TKuA8k1k/default.jpg","False","False","Hear from welterweight champion Kamaru Usman after his battle with Colby Covington in the main event of UFC 245.Subscribe to get all the latest UFC content: http://bit.ly/2uJRzRRExperience UFC live with UFC FIGHT PASS, the digital subscription service of the UFC. Visit https://ufcfightpass.com/To order UFC Pay-Per-Views, visit http://www.ufc.tv/events Connect with UFC online and on Social:Website: http://www.ufc.comTwitter: http://www.twitter.com/ufcFacebook: http://www.facebook.com/ufcInstagram: http://www.instagram.com/ufcSnapchat: UFCPeriscope: http://Periscope.tv/ufcConnect with UFC FIGHT PASS on Social:Twitter: http://www.twitter.com/ufcfightpassFacebook: http://www.facebook.com/ufcfightpassInstagram: http://www.instagram.com/ufcfightpass"
